url,tag,author,updated_date,title,contents
https://www.pv-magazine.it/2024/01/19/gruppo-fp-lux-investe-in-12-parchi-solari-in-italia-per-una-capacita-totale-di-114-mw/,"FINANZA,INSTALLAZIONI E IMPIANTI,MERCATI & POLITICHE,ITALIA",SERGIO MATALUCCI,"GENNAIO 19, 2024",Gruppo FP Lux investe in 12 parchi solari in Italia per una capacità totale di 114 MW,"Il Gruppo FP Lux sta effettuando il suo primo investimento attraverso FP Lux Energy Transition Fund, fondo lanciato lo scorso anno. L’operazione comprende dodici progetti fotovoltaici in Italia, attualmente in fase di sviluppo, per una capacità totale di 114 MW di picco.
“I dodici parchi solari sono entreranno in funzione a partire dal 2025”, ha scritto la società svizzera.
Il venditore del portafoglio è la società di energie rinnovabili PNE, che sta sviluppando i parchi fino alla loro costruzione. La transazione è stata permessa dalla partecipazione di investitori internazionali. La base di investitori comprende compagnie assicurative, fondi pensione, schemi pensionistici e casse di risparmio.
“L’Italia è un luogo predestinato per i progetti fotovoltaici. Con questo acquisto, i nostri investitori possono partecipare a questo vantaggio localizzativo”, ha commentato Thomas Seibel, amministratore delegato di re:cap
FP Lux Energy Transition Fund è il quinto fondo che il Gruppo FP ha lanciato insieme a re:cap. I fondi precedenti hanno già investito 2 miliardi di euro in progetti eolici, solari e di accumulo di batterie in 80 località europee.
La capacità di generazione acquisita e gestita da re:cap per i fondi FP Lux (eolico onshore, solare e accumulo di batterie) ammonta a oltre 1,3 GW.
FP Lux Energy Transition Fund è un comparto di FP Lux Platform, un fondo di investimento lussemburghese.
I presenti contenuti sono tutelati da diritti d’autore e non possono essere riutilizzati. Se desideri collaborare con noi e riutilizzare alcuni dei nostri contenuti, contatta: editors@pv-magazine.com."
https://www.pv-magazine.it/2024/01/19/eni-sigla-accordi-con-kazakistan-per-centrali-ibride-gas-rinnovabili/,"INSTALLAZIONI E IMPIANTI,MERCATI & POLITICHE,POLITICA,SVILUPPI DI MERCATO,KAZAKHSTAN",SERGIO MATALUCCI,"GENNAIO 19, 2024",Eni sigla accordi con Kazakistan per centrali ibride gas-rinnovabili,"Eni e KazMunayGas (KMG) hanno firmato a Roma un accordo relativo al progetto di centrale ibrida gas-rinnovabili da 250 MW nella città di Zhanaozen, regione di Mangystau, in Kazakistan. La firma è avvenuta in occasione della visita del Presidente del Kazakistan, Kassym Jomart Tokayev, in Italia.
“Eni e KMG hanno confermato la loro disponibilità a procedere alla fase di implementazione del progetto, che fornirà ad impianti di KMG elettricità stabile e a basse emissioni di carbonio prodotta da energia solare ed eolica, e sarà bilanciato con capacità aggiuntiva da una centrale elettrica a gas”, ha scritto il cane a sei zampe.
La centrale ibrida gas-rinnovabili è sviluppata dalla controllata di Eni Plenitude in collaborazione con KMG.
Eni ha inoltre firmato un Memorandum di Cooperazione con il Fondo Sovrano Samruk-Kazyna (SK) su ulteriori progetti nell’ambito della transizione energetica, tra cui la potenziale replica del modello di centrale ibrida gas-rinnovabili in altre regioni del Kazakistan.
L’accordo prevede anche “la valutazione di iniziative sui minerali e lo sviluppo di altre tecnologie per la riduzione delle emissioni di carbonio”.
Eni è presente in Kazakistan dal 1992, dove è operatore congiunto del giacimento di Karachaganak ed equity partner in diversi progetti nel Mar Caspio settentrionale. Eni opera nel settore delle rinnovabili in Kazakistan attraverso Arm Wind, controllata di Plenitude, con una capacità installata complessiva di 150 MW.
I presenti contenuti sono tutelati da diritti d’autore e non possono essere riutilizzati. Se desideri collaborare con noi e riutilizzare alcuni dei nostri contenuti, contatta: editors@pv-magazine.com."
https://www.pv-magazine.it/2024/01/19/centro-commerciale-carosello-inaugura-un-campo-fotovoltaico-di-otre-2-mw/,"INSTALLAZIONI E IMPIANTI,ITALIA,LOMBARDIA",LARA MORANDOTTI,"GENNAIO 19, 2024",Centro Commerciale Carosello inaugura un campo fotovoltaico di oltre 2 MW,"Eurocommercial Properties, proprietaria di diversi centri commerciali in Italia, Francia, Belgio e Svezia, ha scelto di installare un parco fotovoltaico  per ridurre i consumi energetici e le emissioni del suo Shopping Center Carosello, che si trova a Carugate, in provincia di Milano.
Ad assistere il committente in fase di permitting e di direzione lavori per il nuovo campo fotovoltaico greenfield di potenza pari a 2,178 MW è stata 3Energy di Cinisello Balsamo, che ha dichiarato: “Il nuovo impianto garantirà una produzione annua di circa 3050 MWh di energia pulita e permetterà di abbassare drasticamente i costi sostenuti fino ad oggi dallo Shopping Center”.
L’impianto è stato installato su una superficie di circa 23.000 mq e si trova su un terreno di proprietà di Eurocommercial Properties nel comune di Cernusco sul Naviglio.
“Ringraziamo il nostro dipartimento Tecnico, Albasolar, Savills, i comuni di Cernusco sul Naviglio e di Carugate e tutti i consulenti tecnici per il grande lavoro svolto in meno di un anno. Inoltre, abbiamo voluto coinvolgere i nostri visitatori, soprattutto i bambini, in un’attività di edutainment per sensibilizzare alle nuove fonti di energia rinnovabile”, ha dichiarato Eurocommercial Properties.
I presenti contenuti sono tutelati da diritti d’autore e non possono essere riutilizzati. Se desideri collaborare con noi e riutilizzare alcuni dei nostri contenuti, contatta: editors@pv-magazine.com."
https://www.pv-magazine.it/2024/01/19/angolo-di-inclinazione-ottimale-per-progetti-agrivoltaici-nella-regione-del-mediterraneo/,"TECNOLOGIA E SCIENZA,ITALIA,PORTOGALLO,SPAGNA,TURCHIA",LIOR KAHANA,"GENNAIO 19, 2024",Angolo di inclinazione ottimale per progetti agrivoltaici nella regione del Mediterraneo,"Un gruppo internazionale di ricercatori ha analizzato l’angolo di inclinazione ottimale per i sistemi agrivoltaici (APV) nelle regioni a clima mediterraneo e alle medie latitudini. Hanno eseguito una serie di simulazioni su un sistema di 175 m2 nella capitale turca, Ankara.
“I valori analizzati possono essere utilizzati nella regione del Mediterraneo centrale con latitudine e condizioni climatiche simili (Csb) e in diverse regioni del mondo”, hanno spiegato. “Le principali sono Portland negli USA, Braga in Portogallo, Valladolid in Spagna, Terni in Italia e Žabljak in Montenegro”.
Il gruppo accademico ha spiegato che l’inclinazione ottimale può aiutare sia la produzione di energia che la resa delle colture, poiché i pannelli fotovoltaici ombreggiano parzialmente le colture, proteggendole dal calore eccessivo. È noto che alcune colture, come pomodoro, patate e aglio, hanno una resa migliore con l’ombra, mentre altre, come riso, arachidi e gombo, necessitano di più luce solare.
“L’originalità dello studio risiede nella progettazione di un sistema APV come soluzione alternativa all’aumento dei costi alimentari legati all’energia. L’obiettivo è ridurre l’impatto dei costi operativi sulle attività agricole e promuovere la sostenibilità, in particolare nelle zone rurali”, hanno affermato.
Per condurre la simulazione, gli scienziati hanno prima calcolato l’angolo di inclinazione ottimale per Ankara in termini di produzione di energia. Hanno scoperto che la media annuale è compresa tra 31 gradi e 33 gradi. L’angolo di pendenza ottimale stagionale per l’inverno era di 55 gradi, per la primavera era di 20 gradi, per l’estate era di 7 gradi e per l’autunno era di 45 gradi.
Tenendo conto di questi valori, hanno poi creato otto scenari con diversi angoli di inclinazione e ne hanno calcolato l’effetto sulla resa dei raccolti e sulla produzione di energia. Gli scenari si basano sui seguenti parametri: media annua (M1); latitudine 39,57° (M2); installazione orizzontale (M3); installazione verticale (M4); angolo di inclinazione ottimale invernale (M5), angolo di inclinazione ottimale primavera (M6); angolo di inclinazione ottimale estivo (M7); e angolo di inclinazione ottimale autunnale (M8).
“Nella progettazione del sistema APV, è stata installata una capacità di potenza CC di 12,0 kWh con 40 unità con pannelli fotovoltaici da 300 Watt”, hanno aggiunto. “Tra ogni campo fotovoltaico viene lasciato uno spazio di 3 metri e l’ombreggiamento è considerato inefficace. Si presuppone che l’altezza dei pannelli da terra sia di 3,6 m ed è stato realizzato un progetto APV in conformità con gli standard internazionali, con una larghezza di 10,5 m e una lunghezza di 16,5 m, per un totale di 175 m2.
La simulazione è stata condotta presupponendo l’utilizzo di silicio cristallino standard con un’efficienza del 19%, silicio cristallino premium con copertura antiriflesso con efficienza del 21% e moduli fotovoltaici a film sottile più economici con un’efficienza del 18%. I raccolti sotto di loro sono stati simulati come curcuma, olive, cavoli invernali, kiwi, mais, lattuga e cavolo cinese.
Gli accademici hanno accertato che lo scenario M1 con pannelli a film sottile offre le prestazioni più elevate con un guadagno finanziario annuo di 1.286 dollari e una elettricità AC generata di 15.674 kWh. Le prestazioni più basse, al contrario, sono state ottenute nello scenario M4 con pannelli a film sottile, con un guadagno finanziario stimato in 775 dollari e elettricità AC in 9.438 kWh.
I ricercatori hanno anche dettagliato il rapporto equivalente terra (LER). LER è un metodo utilizzato per misurare l’efficienza dell’uso del suolo per la produzione simultanea di colture ed elettricità. Hanno scoperto che il fattore di capacità più alto è per la coltivazione del kiwi nello scenario M1 e il più basso per la coltivazione del cavolo cinese nelle condizioni M4.
“A partire dal 2023, il valore del periodo di ammortamento scontato (DPBP) per il modello M1 è di 15,8 anni, mentre il modello M4 non riesce a soddisfare i costi di investimento. Entro il 2035, il valore DPBP per il modello M1 scende a 7,8 anni, mentre per il modello M4 diventa 13,6 anni. Nel 2050, i valori DPBP sono 5,4 anni per il modello M1 e 10,1 anni per il modello M4”, hanno scoperto.
I loro risultati sono stati presentati in “ Ottimizzazione dell’angolo di inclinazione del collettore solare per sistemi agrivoltaici ” e pubblicati in Case Studies in Thermal Engineering . Gli scienziati dietro la ricerca provengono dalla Batman University della Turchia, dalla James Cook University dell’Australia , dall’Università della Pannonia in Ungheria e dall’ELTE Eötvös Loránd University.
I presenti contenuti sono tutelati da diritti d’autore e non possono essere riutilizzati. Se desideri collaborare con noi e riutilizzare alcuni dei nostri contenuti, contatta: editors@pv-magazine.com."
https://www.pv-magazine.it/2024/01/19/credit-agricole-italia-finanzia-con-125-milioni-di-euro-chiron-per-progetti-utility-scale/,"FINANZA,MERCATI & POLITICHE,ITALIA",LARA MORANDOTTI,"GENNAIO 19, 2024","Crédit Agricole Italia finanzia con 12,5 milioni di euro Chiron per progetti utility scale","Crédit Agricole Italia ha erogato a favore di Chiron Energy, impegnata principalmente a sviluppare, costruire e gestire infrastrutture energetiche utility scale, un finanziamento pari a 12,5 milioni di euro.
“L’operazione, coerentemente con l’impegno del Gruppo Crédit Agricole di promuovere progetti innovativi volti a favorire la transizione energetica, permetterà alla Società di investire in impianti fotovoltaici già operativi supportando importanti interventi di revamping e repowering con una potenza obiettivo di circa 9 MWp”, scrive Chiron in una nota stampa.
Secondo quanto riportato da Chiron, che ad oggi conta circa 20 impianti operativi e oltre 500 MW in fase di sviluppo, “grazie al finanziamento potremo investire in impianti solari fotovoltaici utility scale in Italia, favorendo interventi di ammodernamento tecnologico”.
I presenti contenuti sono tutelati da diritti d’autore e non possono essere riutilizzati. Se desideri collaborare con noi e riutilizzare alcuni dei nostri contenuti, contatta: editors@pv-magazine.com."
https://www.pv-magazine.it/2024/01/19/servizio-ricerca-di-lavoro-nel-fotovoltaico-quarantesima-edizione/,"MERCATI & POLITICHE,SVILUPPI DI MERCATO,EMILIA-ROMAGNA,FRIULI-VENEZIA GIULIA,ITALIA,SICILIA,VENETO",LARA MORANDOTTI,"GENNAIO 19, 2024",Servizio ricerca di lavoro nel fotovoltaico: quarantesima edizione,"Termonova cerca un progettista fotovoltaico a Martignacco, Friuli-Venezia Giuliam che abbia una pluriennale esperienza nel settore, abbia padronanza degli strumenti di configurazione e del dimensionamento impianti.
L’azienda di ricerca personale Catenon sta selezionando un Project Manager per una grande multinazionale con una divisione specializzata nello sviluppo di soluzioni ingegneristiche e di costruzione di impianti fotovoltaici. Il candidato sarà inserito in un team per far parte di un progetto basato nella provincia di Ferrara, con una durata di 12/15 mesi.
A Rimini, il Gruppo Hera cerca per la divisione Wölmann Engineering di Wölmann, un Project and Proposal Engineer che dovrà gestire commesse in ambito energie rinnovabili, con iniziale focus sulla predisposizione di studi di fattibilità tecnico economica e successiva gestione della progettazione esecutiva e realizzazione di impianti fotovoltaici.
A29, è una Energy Service Company con sede a Mazara del Vallo, che opera nel settore dell’efficienza energetica e delle energie rinnovabili. Per potenziare la propria rete commerciale ricerca un Capo Area con comprovata esperienza, da inserire in diverse regioni d’Italia.
A Martellago, in Veneto, Hill ricerca elettricisti per l’installazione di impianti fotovoltaici e sistemi d’accumulo. Si richiede anche solo una minima sperienza e si offre formazione continua.
I presenti contenuti sono tutelati da diritti d’autore e non possono essere riutilizzati. Se desideri collaborare con noi e riutilizzare alcuni dei nostri contenuti, contatta: editors@pv-magazine.com."
