url,tag,author,updated_date,title,contents
https://www.pv-magazine.de/2022/04/06/500-000-photovoltaik-heimspeicher-mittlerweile-in-deutschland-installiert/,"HIGHLIGHTS DER WOCHE,SPEICHER,DEUTSCHLAND",SANDRA ENKHARDT,6. APRIL 2022,500.000 Photovoltaik-Heimspeicher mittlerweile in Deutschland installiert,"In diesen Tagen wird der 500.000. Photovoltaik-Heimspeicher in Deutschland installiert werden, wie der Bundesverband Energiespeichersysteme (BVES) bei der Veröffentlichung der Marktzahlen am Mittwoch bekanntgab. Sie verfügen über eine Kapazität von rund 4,4 Gigawattstunden und eine Gesamtleistung von 2,5 Gigawatt. Urban Windelen, Bundesgeschäftsführer BVES, kommentierte dies wie folgt: „Die 500.000 Hausspeicher sind nicht nur ein tolles Ergebnis für die Branche, sondern ein deutliches Signal, dass Energiespeicher ein essenzieller Teil des neuen, auf erneuerbaren Energie basierten Energiesystems sind und sein müssen.“
Bis zum Jahresende 2021 waren etwa 430.000 Heimspeicher installiert. Ein Marktwachstum um rund 50 Prozent gegenüber 2020. In diesem Jahr erwartet der BVES ein noch stärkeres Wachstum des Marktes – so soll sich die Zahl der installierten Photovoltaik-Heimspeicher um 67 Prozent auf dann 700.000 erhöhen. Hauptsächliche Treiber für die starke Nachfrage seien Resilienz, Autarkie und Elektromobilität. So hat sich die Zahl der installierten Photovoltaik-Anlagen mit einer Leistung bis 20 Kilowatt im vergangenen Jahr mehr als verdoppelt. In diesem Zuge werden auch die Speichersysteme größer – die durchschnittliche Kapazität der Heimspeicher stieg seit 2017 um 2 auf 8,6 Kilowattstunden.
Der Heimspeicher-Markt wird dabei von drei heimischen Anbietern angeführt. Auf Nachfrage von pv magazine erklärt der Verband, dass es sich dabei um Sonnen, Senec und E3/DC handelt. Sie haben dem BVES zufolge der Konkurrenz aus dem Ausland 2021 Marktanteile abnehmen können. Der Umsatz des Heimspeichermarktes wuchs im vergangenen Jahr dabei um 25 Prozent auf 3,1 Milliarden Euro und für Wärmespeicher im Haushaltsbereich leicht auf 1,3 Milliarden Euro. Für dieses Jahr geht der BVES von ähnlichen Wachstumsraten in beiden Segmenten aus. Der Umsatz mit Photovoltaik-Heimspeichern könnte dann bei knapp 4 Milliarden Euro liegen.
Doch nicht nur bei den Heimspeichern wächst die Nachfrage. Insgesamt erhöhten sich die Umsatzerlöse der Energiespeicherbranche im vergangenen Jahr um 29 Prozent auf 8,9 Milliarden Euro. Für das laufende Jahr geht der BVES von einem Wachstum auf mindestens 10,1 Milliarden Euro aus – im besten Fall könnten es auch 11,4 Milliarden Euro werden.
Bei den Industrie- und Gewerbespeichern verzeichnete der Verband wieder ein Anziehen der Nachfrage. Der Corona-bedingte Umsatzrückgang 2020 sei mehr als kompensiert worden. Die Erlöse stiegen von 1,3 auf 1,8 Milliarden Euro. In diesem Jahr werde ein weiteres Wachstum erwartet auf rund 2 Milliarden Euro. Wasserstoff-Anwendungen für die Industrie und das Gewerbe stünden dagegen eher noch am Anfang. Damit sei 2021 ein Umsatz von 140 Millionen Euro erzielt worden. Für dieses Jahr rechnet der BVES mit 150 Millionen Euro. Ab 2023 könnte es dann einen Markthochlauf geben – gerade bei Wasserstoff-Anwendungen zwischen einem und zehn Megawatt. Hier wirkten lange Genehmigungszeiten noch hemmend.
Der Markt für Großspeicher habe 2021 wiederum von den höheren Preisen für Primärregelleistung profitiert. Die Zahl der neuen Projekte sei dennoch überschaubar, so der BVES. Erste realisierte Großspeicher aus den Innovationsausschreibungen und Netzbooster sorgten jedoch für ein weiteren Wachstum Im vergangenen Jahr wuchs der Umsatz bei großen Batteriespeichern im Jahresvergleich von 78 auf 440 Millionen Euro. Für 2022 geht der BVES von einem Rückgang der Umsatzerlöse auf 246 Millionen Euro aus.
Mit der steigenden Nachfrage, gerade bei Heimspeichern, wächst auch die Zahl der Beschäftigten in der Branche weiter. So stieg sie von 14.700 auf 16.900 im vergangenen Jahr an. In diesem Jahr könnten es dann bis zu 20.000 Beschäftigte in der Speicherbranche werden. Vor dem Hintergrund dieser Zahlen verwundert es auch wenig, dass viele Marktteilnehmer die Aussichten als sehr positiv (36 Prozent) und eher positiv (50 Prozent) einschätzen. Die negativen Einschätzungen in der BVES-Umfrage hätten sich gegenüber 2020 auf 5 Prozent halbiert. 82 Prozent der Befragten erwarten so auch ein Umsatzwachstum. Sie gaben dabei Prognosen zwischen 10 und 200 Prozent Steigerung ab. Zwei Drittel der Unternehmen planten demnach auch neue Mitarbeiter einzustellen, wobei die Suche nach Fachkräften weiter schwierig sei.
Viele der befragten Unternehmen sind dabei nicht nur in Deutschland aktiv. Etwa zwei Drittel generieren mindestens 10 Prozent ihrer Erlöse im Ausland. Der Schwerpunkt liege dabei meist auf den Märkten in Österreich, der Schweiz, Großbritannien, Spanien, Skandinavien, Frankreich, den Benelux-Ländern und Italien. Nur 25 Prozent fokussierten sich auch auf Märkte außerhalb Europas und dabei besonders auf die USA; wie die Umfrage des BVES weiter ergab.
Hohe Erwartungen gibt es derweil an die Politik. Dies bezieht sich vor allem auf eine Verbesserung des regulatorischen Rahmens, der aktuell weiterhin als eher markthemmend eingeschätzt wird. Die rasant gestiegenen Rohstoffpreise und höheren Produktionskosten wirkten sich ebenfalls negativ aus. Dabei geht es vor allem um die Sorge, die Nachfrage aus dem Markt bedienen zu können.
Sind Sie Installateur und können Privatkundenanlagen nicht mehr zeitnah realisieren? Oder warten Sie als Kunde schon lange auf Photovoltaik und Speicher? Schildern Sie uns Ihre Erfahrungen! Zur Kurzumfrage
„Energiespeicher bieten ein enormes Potential für eine flexible, dekarbonisierte Energieversorgung und können einen großen Beitrag zur Versorgungssicherheit liefern“, erklärte Windelen. Die vorhandenen Technologien am Markt seien schnell skalierbar und könnten damit kurzfristig die Importabhängigkeiten von insbesondere Öl und Gas deutlich reduzieren. „Umso überraschender ist es, dass die aktuelle EEG-Reform wiederum das Thema Speicher ausklammert und stattdessen die Probleme der Energieversorgung durch etwa die ungesteuerte Einspeisung erhöht und nicht reduziert“, so Windelen weiter. Er sehe dringenden Nachbesserungsbedarf, wenn es die Bundesregierung mit Klimaschutz und Versorgungssicherheit ernst meine. „Nur mit Speichern bringen wir die Energiewende voran.“
Sonnen als größter deutscher Anbieter von Photovoltaik-Heimspeicher erklärte zur Veröffentlichung der BVES-Marktzahlen: „2021 war bereits ein Rekordjahr für Sonnen und allein im ersten Quartal dieses Jahres hat die Nachfrage nach unseren Produkten noch einmal enorm angezogen.“ Das Allgäuer Unternehmen hat seine Kapazitäten enorm erweitert. „Wir produzieren an unserem Hauptsitz in Wildpoldsried seit dieser Woche erstmals auch im Zweischichtbetrieb. Damit können wir unseren Partnern weiterhin zuverlässige und überschaubare Lieferzeiten anbieten, was in solchen Zeiten besonders wichtig ist.“
Dieser Inhalt ist urheberrechtlich geschützt und darf nicht kopiert werden. Wenn Sie mit uns kooperieren und Inhalte von uns teilweise nutzen wollen, nehmen Sie bitte Kontakt auf: redaktion@pv-magazine.com."
https://www.pv-magazine.de/2022/04/06/kurzumfrage-lieferengpaesse-bremsen-zubau-bei-photovoltaik-und-batteriespeichern/,"HIGHLIGHTS DER WOCHE,INSTALLATION,MÄRKTE,SPEICHER,DEUTSCHLAND",CORNELIA LICHNER,6. APRIL 2022,Kurzumfrage: Lieferengpässe bremsen Zubau bei Photovoltaik und Batteriespeichern,"Der Markt für bestimmte Komponenten wie Hybrid-Wechselrichter und Batteriespeicher ist derzeit leergefegt. Vor allem beliebte Modelle der 10-Kilowatt-Klasse sind nur mit langen Wartezeiten verfügbar, berichten Marktteilnehmer. Um einen besseren Überblick über die Situation zu erhalten, hat pv magazine eine Kurzumfrage unter Installateuren, Händlern und Endkunden gestartet, die auch noch weiterhin für die Teilnahme geöffnet ist. Bis zum Mittwoch haben 322 Installateure und Händler teilgenommen und angegeben, dass sie bei vielen Produkten lange Wartezeiten von mehr als drei Monaten sehen (63 Prozent) oder zumindest bei einigen Produkten (35 Prozent). Nur sechs der Teilnehmer haben bisher keine Auswirkungen gespürt.
Sind Sie Installateur und können Privatkundenanlagen nicht mehr zeitnah realisieren? Oder warten Sie als Kunde schon lange auf Photovoltaik und Speicher? Schildern Sie uns Ihre Erfahrungen! Zur Kurzumfrage
Besonders kritisch wird die Marktsituation bei Hybrid-Wechselrichtern, Batterie-Komplettsystemen und reinen Batteriespeichern ohne Wechselrichtern eingeschätzt. Bei Batteriespeichern, also Produkten, die mit mehreren Wechselrichtern kompatibel sind, rechnen 45 Prozent der Befragten mit Wartezeiten von mehr als sechs Monaten. Bei Batterie-Komplettsystemen sind es 37 Prozent.
Bei Hybrid-Wechselrichtern sehen 48 Prozent der Befragten Lieferzeiten zwischen zwei und sechs Monaten, 29 Prozent vermelden für ihre Bestellungen Lieferzeiten von mehr als einem halben Jahr. Das ist besonders ungünstig für Kunden, die mit dem Hybrid-Wechselrichter eine neue Photovoltaik-Anlage in Betrieb nehmen wollen. Da sich viele Installateure verstärkt mit Solarmodulen eingedeckt hatten und die Wartezeiten bei den meisten Betrieben (66 Prozent) nur bei bis zu zwei Monaten liegen, kann es vorkommen, dass die Dachanlage bereits installiert wurde, aber einfach nicht ans Netz gehen kann, wie ein Teilnehmer der Umfrage kommentiert.
„Es müssen Materialien Monate im Voraus gesichert werden, was ungemein Kapital bindet“, schreibt ein anderer Teilnehmer. „Da werden manche Installateure ums Überleben kämpfen müssen, da Sie nicht regelmäßig und kontinuierlich Einnahmen generieren können“, befürchtet ein weiterer. Doch Engpässe haben noch weitergehende Auswirkungen auf die tägliche Arbeit.
Der Aussage „Bestimmte Anlagen kann ich derzeit nicht bauen und in Betrieb nehmen“ stimmen 56 Prozent der Teilnehmer zu. „Ich verbringe doppelt so viel Zeit wie sonst mit der Produktauswahl und der Suche nach Alternativen“, sagen 42 Prozent der Befragten. 22 Prozent würden sagen, es geht sogar noch darüber hinaus. Und obwohl viele Betriebe neben den Lieferengpässen noch mit Fachkräftemangel zu kämpfen haben, sagt ein Drittel von sich: „Ohne die Lieferengpässe könnte ich mindestens zehn Prozent mehr Anlagen bauen/verkaufen.“ 45 Prozent schätzen die Menge an entgangenen Aufträgen sogar noch höher ein.
Grafik: pv magazine
Die Aussichten für Neukunden sind demnach schlecht. 62 Prozent der Installateure empfehlen ihren Kunden Produkte inzwischen nach Verfügbarkeit und nicht in erster Linie nach deren Präferenz. Und 68 Prozent warnen, dass die Kunden mit nachträglichen Preissteigerungen rechnen müssen. Nach Einschätzung der Installateure und Händler ist der Preis für Batteriespeichersysteme im letzten Jahr bereits um durchschnittlich neun Prozent gestiegen.
An der Befragung haben sich bislang auch 311 Endkunden beteiligt. 142 von ihnen warten auf eine Photovoltaik-Anlage, und zwar im Schnitt seit fünf Monaten. 78 sind inzwischen glückliche Besitzer einer Anlage, die seit Sommer 2021 angeschlossen wurde. Sie hatten durchschnittlich vier Monate darauf gewartet. 194 Kunden beantworteten unsere Frage, wie sich die Lieferengpässe auf ihr Projekt auswirken. 44 Prozent stellen fest, dass sich der Liefertermin immer weiter verschiebt. Bei 36 Prozent hat sich der Preis bereits erhöht und 23 Prozent (45 Teilnehmer) konnten ihr Projekt noch gar nicht in Angriff nehmen, weil die bisher angefragten Installateure keine Kapazitäten mehr hatten.
Wenn die Planungen im Schnitt 12 Kilowattpeak umfassen, wie die Kunden angegeben haben, befinden sich allein bei unseren Umfrageteilnehmern mehr als 1,6 Megawatt an Photovoltaik in der Warteschleife.
Die Lieferengpässe sind nicht allein mit einem Anstieg der Anfragen und Bestellungen zu begründen. Zwar berichten 85 Prozent der Installateure und Händler, dass auch ihr Bestellvolumen gestiegen ist, die Branche hatte aber in den letzten Jahren gerade bei den Heimspeichern ein hohes Wachstum von 25 Prozent und mehr verkraftet. Es seien nach Einschätzung des Bundesverbandes Energiespeicher-Systeme (BVES) vor allem Probleme in den Lieferketten, die zu den langen Wartezeiten führen. Die Hersteller hätten Schwierigkeiten bei der Beschaffung von Rohstoffen und Komponenten, vor allem von Chips, aber auch anderer Teile wie Sensoren oder Batteriezellen.
Dieser Inhalt ist urheberrechtlich geschützt und darf nicht kopiert werden. Wenn Sie mit uns kooperieren und Inhalte von uns teilweise nutzen wollen, nehmen Sie bitte Kontakt auf: redaktion@pv-magazine.com."
https://www.pv-magazine.de/2022/04/06/solarfoerderung-in-oesterreich-kann-endlich-starten-budget-auf-240-millionen-euro-vervierfacht/,"INSTALLATION,POLITIK,ÖSTERREICH",SANDRA ENKHARDT,6. APRIL 2022,Solarförderung in Österreich kann endlich starten – Budget auf 240 Millionen Euro vervierfacht,"Die österreichische Photovoltaik-Branche musste sich lange in Geduld üben. Jetzt ist es jedoch endlich soweit: Mit dem erfolgten Erlass des Finanzierungs- und Regelwerks für die Investitionsförderung des Erneuerbaren-Ausbau-Gesetz (EAG) durch die Energieministerin Leonore Gewessler kann die seit Monaten verzögerte Solarförderung im Land endlich starten. Der Förderstart ist für den 21. April geplant.
Der Bundesverband freute sich zudem über die Ausgestaltung. „Wichtige Forderungen des Bundesverband Photovoltaic Austria (PV Austria) wie etwa die Vervierfachung des Förderbudgets auf 240 Millionen Euro, Verdoppelung der Antragsmöglichkeiten, Anhebung der Fördersätze und die Kombinierbarkeit mit Bundes-, Gemeinde- und Landesförderungen für Anlagen bis 100 Kilowattpeak, wurden in der nun vorliegenden Verordnung noch eingearbeitet“, erklärte Vorstandsvorsitzender Herbert Paierl.
Mit der Bekanntgabe der Verordnung könne die Solarrevolution in Österreich wirklich starten. „„Die erste Übereinkunft der Regierungsparteien, wie die Energiewende im Stromsektor mit staatlichen Mitteln gelenkt werden kann, lag mit dem EAG bereits im Sommer 2021 vor, mit der jetzigen Festlegung zu Inhalten, finanziellen Mitteln und Bedingungen treten wir endlich raus aus dem Schatten und rein in die Solarrevolution“, ergänzte Vera Immitzer, Geschäftsführerin des PV Austria. Vor allem die zuvor auf Eis gelegten Photovoltaik-Projekte könnten nun endlich umgesetzt werden. Die Endkunden könnten nun endlich auch ihre Photovoltaik-Anlagen bestellen, da die neuen Förderbedingungen bekannt seien.
Neben der Wiederaufnahme der Investitionsförderung steht auch die Marktprämienförderung noch aus. Hier müsse die Umsetzung der entsprechenden Verordnung schneller gehen. „Noch einmal darf das nicht passieren, dass wir solche Verzögerungen bei der Umsetzung eines so wichtigen Regelwerks erleben“, warnt Paierl. Große Photovoltaik-Projekte würden fast ausschließlich über die Marktprämie abgewickelt werden, durch die Planungs- sowie Umsetzungsverzögerungen prognostiziert PV Austria, dass der für dieses Jahr notwendige Zubau verfehlt wird.
Dieser Inhalt ist urheberrechtlich geschützt und darf nicht kopiert werden. Wenn Sie mit uns kooperieren und Inhalte von uns teilweise nutzen wollen, nehmen Sie bitte Kontakt auf: redaktion@pv-magazine.com."
