url,tag,author,updated_date,title,contents
https://www.pv-magazine.fr/2021/09/07/un-panneau-solaire-flexible-pour-les-vehicules-electriques/,"VÉHICULE ÉLECTRIQUE,ALLEMAGNE",EMILIANO BELLINI,"SEPTEMBRE 7, 2021",Un panneau solaire flexible pour les véhicules électriques,"D’après pv magazine international.
Le fabricant allemand de panneaux solaires OpesSolutions et le centre Fraunhofer pour le photovoltaïque au silicium CSP ont mis au point un module solaire standard flexible et léger destiné à être intégré dans les véhicules électrique. Il serait particulièrement adapté aux vélos-cargos, ainsi qu’aux bus, camions et camionnettes électriques.
Appelé SolFlex, ce panneau sans cadre est basé sur des cellules solaires d’un rendement de 22 % et est conçu pour supporter une charge thermique élevée et unilatérale. Le produit standard mesure 100x100x2,9 cm, pèse 3,4 kg et affiche une puissance de 170 W. Sa tension à vide est de 24,23 V et son courant de court-circuit de 9,55 A. Il est également possible d’obtenir un panneau sur mesure d’une puissance allant jusqu’à 600 W et d’une taille de 3 000×1 200×2,9 mm.
Le module présente un rayon de courbure allant jusqu’à 15 degrés et une surface résistante aux rayures. « Un système d’interconnexion innovant, des diodes de dérivation intégrées et une technologie de demi-cellule garantissent des rendements optimaux, même en cas de faible exposition », explique le fabricant de panneaux dans un communiqué. Il ajoute que le panneau peut être fabriqué à des coûts inférieurs, par rapport à des produits similaires, car il s’appuie sur une production en série située à l’usine de Changzhou, dans la province du Jiangsu situé dans le sud de la Chine.
« Dans le cas d’un véhicule utilitaire léger qui utilise le mix électrique actuel, les panneaux solaires intégrés peuvent réduire les émissions annuelles de CO2 jusqu’à 890 kg et réduire les coûts d’exploitation en fournissant de l’électricité pour les systèmes de refroidissement », avance le fabricant. « Dans les bus, qui disposent de grandes surfaces de toit, les panneaux photovoltaïques intégrés peuvent fournir jusqu’à 100 % des besoins en énergie du système de chauffage, de ventilation et de climatisation, ce qui est particulièrement utile lorsque le moteur est éteint. »
Selon une étude récente menée aux Pays-Bas, les voitures électriques équipées de panneaux photovoltaïques sur leur carrosserie ou leur toit pourraient dépasser les 10 000 km par an de uniquement en consommant de l’énergie solaire pure. Les modules pourraient être amortis en trois ou quatre ans seulement. L’autonomie de 10 000 km reste toutefois difficile à atteindre pour la plupart des voitures électriques actuellement sur le marché, en raison de l’efficacité énergétique réelle des véhicules. D’autre part, les possibilités offertes par le photovoltaïque intégré aux véhicules sont proportionnelles aux niveaux de rayonnement solaire d’une zone donnée, à sa demande en véhicules électriques et à ses prix de l’électricité.
Ce contenu est protégé par un copyright et vous ne pouvez pas le réutiliser sans permission. Si vous souhaitez collaborer avec nous et réutiliser notre contenu, merci de contacter notre équipe éditoriale à l’adresse suivante: editors@pv-magazine.com."
https://www.pv-magazine.fr/2021/09/07/scatec-va-aider-engie-a-decarboner-sa-production-dhydrogene-en-afrique-du-sud/,"FOURNITURE D'ÉLECTRICITÉ,HYDROGÈNE,AFRIQUE DU SUD",MARIE BEYER,"SEPTEMBRE 7, 2021",Scatec va aider Engie à décarboner sa production d’hydrogène en Afrique du sud,"Dans un communiqué du 6 septembre 2021, l’entreprise norvégienne Scatec a annoncé avoir conclu un bail de deux ans avec Engie pour fournir une centrale photovoltaïque préassemblée et conteneurisée d’une capacité de 616 kwc. L’unité mobile sera installée à Limpopo, dans l’usine de production d’hydrogène d’Engie au sein de la mine Anglo American Platinum – Mogalakwena en Afrique du Sud.
Ce faisant, Scatec déploit pour la première fois sa solution de centrale solaire mobile et prête à l’emploi, baptisée « Release », dans la production d’hydrogène. Cette unité d’alimentation évolutive est destinée aux industriels et fait ici un premier pas dans l’industrie minière. « Le modèle Release gagne du terrain et, avec sa flexibilité à la fois en ce qui concerne la durée du contrat et la capacité, a un grand potentiel dans l’exploitation minière », a avancé Hans Olav Kvalvaag, SVP Release chez Scatec.
Ce contenu est protégé par un copyright et vous ne pouvez pas le réutiliser sans permission. Si vous souhaitez collaborer avec nous et réutiliser notre contenu, merci de contacter notre équipe éditoriale à l’adresse suivante: editors@pv-magazine.com."
https://www.pv-magazine.fr/2021/09/07/solarstratos-ou-le-reve-datteindre-la-stratosphere-avec-lenergie-solaire/,"INNOVATION,TECHNOLOGIE ET R&D,VÉHICULE ÉLECTRIQUE,SUISSE",MARIE BEYER,"SEPTEMBRE 7, 2021","SolarStratos, ou le rêve d’atteindre la stratosphère avec l’énergie solaire","Développer l’aviation électrico-solaire du futur. Voilà le défi que veut relever Solarstratos, un projet suisse débuté en 2014 et qui a mis sur pied le premier avion stratosphérique du monde avec une équipe technique et des partenaires technologiques internationaux. Basé sur l’aérodrome militaire de Payerne et toujours en développement opérationnel, l’appareil mesure 8,5 mètres de longueur, 24,8 mètres d’envergure pour un total de 450 kilos. Il est recouvert de 22 m2 de panneaux solaires à 25% de rendement et d’environ 5 kWc, qui alimenteront un moteur électrique relié à des batteries en lithium-ion pour assurer son fonctionnement.
Pour atteindre les 25000 mètres d’altitude annoncés, l’avion est propulsé grâce à une hélice à trois pales et à un double moteur électrique de 2 x 19 kW qui est intégralement alimenté par l’énergie solaire. Les cellules photovoltaïques ont été intégrées directement dans les ailes par l’équipe du professeur Christophe Ballif au Centre suisse d’électronique et de microtechnique (CSEM), partenaire scientifique du projet.
Le procédé d’encapsulation des modules PV utilisé regroupe les cellules en série ou en parallèle de manière à assurer leur isolation électrique. Elles deviennent ainsi plus résistantes aux facteurs extérieurs tels que l’humidité, la pluie, la neige ou encore la corrosion, voire les chocs mécaniques. En avril 2019, des améliorations de modules avaient été intégrées au projet pour permettre un potentiel plus élevé de production d’énergie solaire, une plus grande flexibilité et un poids plus faible.
Les cellules solaires alimentent les batteries lithium-ion de l’appareil, d’une capacité totale de 14kWh, extensible à 21 kWh. Ce type de batterie est constitué d’un accumulateur électrochimique qui utilise du lithium sous une forme ionique. Elle libère, par échange réversible, des ions lithium entre deux électrodes (une anode en graphite et une cathode en oxyde métallique) au sein d’un électrolyte liquide.
Pour limiter le poids de l’avion, l’appareil n’est pas pressuré et le pilote doit être équipé d’une combinaison spatiale spécialement conçue pour le projet et qui fonctionne à l’énergie solaire. C’est l’équipementier spatial russe Zvezda qui a développé la technologie de cette combinaison qui concentre plusieurs innovations permettant de réguler notamment la température et la pression et de protéger le pilote de l’exposition solaire.
Le fuselage et les ailes sont construits en fibre de carbone avec une grande envergure qui permet à l’avion de voler à vitesse réduite. « SolarStratos restera dans la stratosphère quelques temps, sans rien consommer d’autre que l’énergie solaire illimitée et surtout totalement propre. C’est le rêve d’Icare, mais dans ce cas le soleil sera un allié et non plus un ennemi ! », s’enthousiasmait en mai 2020 Philippe Pilloud, responsable des opérations et de la sécurité en vol. Le budget total du projet est d’environ 10 millions de francs suisses (9,2 millions d’euros). Il est principalement sponsorisé par des fonds privés.
Ce contenu est protégé par un copyright et vous ne pouvez pas le réutiliser sans permission. Si vous souhaitez collaborer avec nous et réutiliser notre contenu, merci de contacter notre équipe éditoriale à l’adresse suivante: editors@pv-magazine.com."
