url,tag,author,updated_date,title,contents
https://www.pv-magazine.com/2022/11/04/indias-seci-launches-1-2-gw-hybrid-wind-solar-tender/,"MARKETS,UTILITY SCALE PV,INDIA",UMA GUPTA,"NOVEMBER 4, 2022",India’s SECI launches 1.2 GW hybrid wind-solar tender,"From pv magazine India
SECI has opened bidding to develop 1.2 GW of hybrid wind-solar power projects in India, paired with energy storage. The projects will be installed on a “build-own-operate” basis and will be connected to the interstate transmission network. The minimum bid capacity will be 50 MW.
SECI will sign a 25-year power purchase agreement with hybrid power developers at the tariffs discovered after the e-reverse auction.
“Identification of land, installation, and ownership of the project, along with obtaining connectivity necessary approvals and interconnection with the ISTS network for supply of power to SECI, will be under the scope of the hybrid power developer,” said SECI in the tender document.
For an installation to qualify as a hybrid project, the rated capacities of the solar and wind components must be a minimum of 33% of the total contracted capacity. For example, if the contracted capacity of a project is 100 MW, the rated capacities of both the wind and solar components must be a minimum of 33 MW each.
In addition, the winning developers will be expected to install at least 100 MWh of energy storage system capacity for every 100 MW project that is contracted under a PPA. The energy storage component must be co-located with the PV or the wind components of each project.
This content is protected by copyright and may not be reused. If you want to cooperate with us and would like to reuse some of our content, please contact: editors@pv-magazine.com."
https://www.pv-magazine.com/2022/11/04/australian-miner-signs-baseload-ppa-contract-with-neoen-for-24-7-renewables/,"MARKETS,UTILITY SCALE PV,UTILITY SCALE STORAGE,AUSTRALIA",BELLA PEACOCK,"NOVEMBER 4, 2022",Australian miner signs baseload PPA contract with Neoen for 24/7 renewables,"From pv magazine Australia
The 70 MW renewable energy baseload contract will supply BHP with 24/7 renewable energy from Neoen’s Goyder South Stage 1 wind farm and Blyth Battery from July 2025.
BHP’s Olympic Dam site, 650 kilometers north of Adelaide, is one of the world’s most significant deposits of gold, uranium, and copper. Copper is an increasingly important material in the renewable energy supply chain, and BHP Olympic Dam's asset president, Jennifer Purdie, said the mining giant is focused on producing
“South Australia’s high-quality copper to build renewable technologies and infrastructure … more sustainably,” said Purdie.
A baseload contract means continuous power supply, regardless of whether the sun is shining or the wind is blowing. Such contracts in the power purchase agreement space are increasingly common, especially in Nordic states with extensive wind generation portfolios, but the market is also strong in Spain and the United States.
However, the trend is only just beginning in Australia, and utility-scale battery systems are the reason. Neoen said it will deliver a “24/7 green energy solution to the mine, along with the associated large-scale certificates (LGCs).” And it will do this by firming the intermittent wind resources of its 412 MW Goyder South Stage 1 wind farm with storage capacity from its Blyth Battery.
The Blyth Battery received approval this year for up to 300 MW/800 MWh of storage capacity. In August 2022, Neoen announced storage revenues had grown by more than one-third in the last year due to its Australian battery assets – specifically its Victorian Big Battery.
Neoen said this contract is a demonstration that its portfolio of renewable energy and storage assets means it can now offer, “for the first time, firm delivery of green power.” Louis de Sambucy, Neoen Australia’s managing director, said that the company is convinced of its ability to “combine [its] assets and [its] energy management capabilities to create bespoke commercial offers.”
The company’s chairman, Xavier Barbaro, concurred.
“This first baseload PPA is a significant step forward for Neoen and will serve as a template for future contracts, opening up great market opportunities in Australia and in the rest of the world,” said Barbaro.
The Goyder Renewables Zone, of which Goyder South Stage 1 is an under-construction hybrid wind, solar and storage project. It has approval for 1,200 MW of wind, 600 MW of solar generation and 900 MW of battery storage capacity. Construction began on Aug. 25, 2022, and is expected to be operational in 2024.
This is not the first PPA agreement BHP has signed. In 2021, it signed a PPA with Risen Energy for its Nickel West Kwinana refinery in Western Australia. However, the deal was not a baseload contract.
This content is protected by copyright and may not be reused. If you want to cooperate with us and would like to reuse some of our content, please contact: editors@pv-magazine.com."
https://www.pv-magazine.com/2022/11/04/us-utility-scale-solar-slowed-in-q3/,"MARKETS,UTILITY SCALE PV,UNITED STATES",RYAN KENNEDY,"NOVEMBER 4, 2022",US utility-scale solar slowed in Q3,"From pv magazine USA
With just under 1.9 GW of utility-scale solar installed in the third quarter of 2022, the industry experienced its slowest quarter since July-September 2020. This was expected to be a landmark year for solar, but global supply challenges have hampered growth, delayed projects, and driven up prices.  
Despite this, optimism remains. The American Clean Power Association (ACP) said in its quarterly report that the United States might deploy 550 GW of renewable energy by 2030. Solar is expected to lead the charge in this decade of energy transition, representing 59% of active renewable energy projects in queues. Along the way, the United States is expected to cut economy-wide emissions by 40% below 2005 levels. This progress will be accomplished by a clean power workforce of 1 million, said ACP.
“President (Joe) Biden signed the Inflation Reduction Act (IRA) into law on Aug. 16. This unprecedented national commitment to clean power is the largest policy investment in clean energy on record,” said the report. “The IRA is set to catalyze clean energy growth, ultimately more than tripling annual installations of wind, solar, and battery storage by the end of the decade.”
Despite a slow quarter, 2022 remains the second highest year for solar deployment in history, falling just behind 2021 totals. Quarterly installs were down 23% compared to the same period next year. This slowdown may persist for some time as solar module supply issues remain, and the United States works to inject Inflation Reduction Act funds into a new domestic manufacturing supply chain.
In total, solar installations in 2022 reach just over 7 GW. This brings total utility-scale solar operating capacity to 68 GW. Developers activated 41 solar projects, spanning 18 states and totaling 1.87 GW, said the ACP. California leads in cumulative installed operating capacity with 16.8 GW active, followed by Texas with 9.9 GW. Iowa increased its solar capacity by nearly 40% this quarter by installing 100 MW.
The largest utility-scale solar project commissioned this quarter was Old 300 Solar, a 430 MW facility in Texas. Developed by Ørsted, the project is selling its capacity to Microsoft via a power purchase agreement.
This content is protected by copyright and may not be reused. If you want to cooperate with us and would like to reuse some of our content, please contact: editors@pv-magazine.com."
