url,tag,author,updated_date,title,contents
https://www.pv-magazine.com/2021/12/06/solar-plus-storage-powers-urban-elevator-in-italy/,"COMMERCIAL & INDUSTRIAL PV,DISTRIBUTED STORAGE,ENERGY STORAGE,MODULES & UPSTREAM MANUFACTURING,TECHNOLOGY AND R&D,ITALY",MARIE BEYER,"DECEMBER 6, 2021",Solar-plus-storage powers urban elevator in Italy,"From pv magazine France
In the Italian town of Cuneo, located in the northern region of Piedmont, Italian PV module manufacturer FuturaSun has installed a solar-plus-storage system to power a panoramic elevator.
The pilot project is part of the Store4HUC program which is funded by the European Regional Development Fund, and is the first in a series of four to be developed in Austria, Croatia, Slovenia and Italy. The aim is to develop renewable energy production systems with sustainable storage in historic city centers across Europe.
In Cuneo, the newly equipped lift consists of an inclined system which climbs 28 meters to connects a car park to the city center. The elevator is powered not only by the solar array and the batteries but also by the energy produced by the elevator itself while it is moving, through gravitational storage.
The 8.84 kWp photovoltaic installation was connected to the grid in October and was deployed along the lift path. It comprises 26 FuturaSun Next Pro 340 W monocrystalline photovoltaic panels measuring 1,684×1,002mm with 120 half-cut multi-busbar PERC cells, for a total surface area of 45 square meters.
According to a FuturaSun press release, this initiative is one of the first at national and European level “to optimize the use of energy resources in a fixed-location transport system.” The plant is expected to receive some remuneration from Italian energy agency the Gestore dei Servizi Energetici.
The new system, a ‘sustainable public mobility experience,' reduces the energy consumption of the elevator, ensuring both reduced public spending and lower carbon dioxide emissions.
This content is protected by copyright and may not be reused. If you want to cooperate with us and would like to reuse some of our content, please contact: editors@pv-magazine.com."
https://www.pv-magazine.com/2021/12/06/brazil-introduces-new-rules-for-hybrid-power-plants/,"MARKETS,UTILITY SCALE PV,UTILITY SCALE STORAGE,BRAZIL",LÍVIA NEVES,"DECEMBER 6, 2021",Brazil introduces new rules for hybrid power plants,"From pv magazine Brazil newsletter
The Brazilian energy regulator – Aneel – approved, last Tuesday, a new regulation for the operation of hybrid power plants.
Resolution 954/2021 defines what hybrid projects are and establishes the rules for permitting and contracting the use of transmission systems. In addition, it defines what kind of tariffs these plants will have to pay for using the grid, and possible tariff reductions.
The regulation is considered an important step to help Brazil take advantage of the synergies between different sources of energy generation. It allows for combinations of different generation sources, including PV, wind, hydroelectric, and thermoelectric plants.
Combining utility scale facilities, according to the regulator, should allow the use of the transmission network in a more efficient and stable manner while helping plant operators mitigate risks and save on land purchase and other costs.
“The approval of the proposed regulation will be a milestone for the development of hybrid plants, which will provide greater technological diversity, contributing to the modernization of the Brazilian electricity sector,” stated Aneel director Elisa Bastos. “The inclusion of these projects in the electrical system can reduce costs and delay new investments in grid expansion.”
“This regulation is a leap in quality in the electricity sector and is now the priority of our innovation agenda,” said the director general of Aneel, André Pepitone. “Throughout the entire process of building the regulation, Aneel acted with predictability and transparency, qualities that were recently recognized by the Organisation for Economic Co-operation and Development (OECD).”
The procedural matters related to the viability of the hybrid plants will be approved by Aneel shortly, with the revision of grid procedures and commercialization rules.
Prior to Aneel's new resolution, some pilot, hybrid wind-solar projects were undertaken in Brazil. One of these is a 68.7 MWac facility planned to be installed on a plot next to the existing 205.9 MW Ventos do Piauí I wind farm, by the energy division of the Brazilian multinational Votorantim: Votorantim Energia. The commissioning of the entire complex is scheduled for early 2023 and it will have a total installed capacity of 274.6 MW. It will sell energy on the free market.
A study conducted by Brazil’s government-run energy agency the Empresa de Pesquisa Energética, in 2017, stated that, for hybrid wind-solar, the particular characteristics of every geographical area must be taken into account, and that the benefits of every wind-solar project must be assessed on a case-by-case basis. The study includes, among other things, an analysis of the advantages of these projects in northeastern Brazil, where the transmission grid has a limited capacity compared to the volume of the proposed wind and solar projects.
This content is protected by copyright and may not be reused. If you want to cooperate with us and would like to reuse some of our content, please contact: editors@pv-magazine.com."
https://www.pv-magazine.com/2021/12/06/invergy-to-set-up-residential-solar-inverter-factory-in-india/,"INVERTERS,MARKETS,RESIDENTIAL PV,INDIA",UMA GUPTA,"DECEMBER 6, 2021",Invergy to set up residential-solar inverter factory in India,"From pv magazine India
London-based inverter and battery company Invergy, which this year launched its hybrid solar inverters in India, is targeting residential arrays with 3-12 kW products for use in single and three-phase set-ups.
As part of its push for Indian customers, the company will build an inverter factory in Noida, Uttar Pradesh by May which will be able to manufacture 5 MW of products annually.
Invergy director Deepak Pandey told pv magazine: “Our product line is not in competition with other inverter brands present in India. Ours are next-generation inverters with features that have not been introduced in India 'till today. These are IP65-compatible units compatible with both lithium-ion and lead-acid batteries. Currently, the inverters available in the Indian market are mostly compatible with only [a] lead-acid or lithium battery.” 
“Our inverters are scalable. So, you can get 50 kW output by placing 5 kW inverters in ten rows in parallel. You can connect up to 16 … rows. The maximum capacity, in that case, will be somewhere around 75 kW, with 5 kW units. The best part is, our single-phase inverters can be connected in three-phase mode and give a three-phase output.”
Invergy lays claim to 10 MW of manufacturing capacity catering to the residential solar market in Europe, West Africa, Dubai, and India.
“We want to manufacture in India as the response from the Indian market is good,” added Pandey. “Also, the Make in India concept is there. The increased [customs] duties on the import of completely-built units is among other reasons [for our expansion in India].”
This content is protected by copyright and may not be reused. If you want to cooperate with us and would like to reuse some of our content, please contact: editors@pv-magazine.com."
https://www.pv-magazine.com/2021/12/06/antimony-selenide-solar-cell-with-8-5-efficiency/,"MODULES & UPSTREAM MANUFACTURING,TECHNOLOGY AND R&D,UNITED STATES",EMILIANO BELLINI,"DECEMBER 6, 2021",Antimony selenide solar cell with 8.5% efficiency,"Antimony selenide (Sb2Se3) is a p-type inorganic semiconductor with a one-dimensional crystal structure and a direct bandgap in the range of 1.2 eV to 1.9 eV. It has excellent optoelectronic properties. In recent years, it has also been used as an absorber material to build solar cells. The efficiencies achieved by such devices have reached between 5% and 9.2%.
These efficiency levels are still far behind those of other thin-film technologies, such as cells based on copper, indium, gallium and selenide (CISG), cadmium telluride (CdTe), kesterite (CZTSSe), and amorphous silicon (a-Si). This technological gap might depend on the fact that features such as mobility, carrier lifetime, diffusion length, defect depth, defect density and band tail remain largely unknown to the scientific community for the Sb2Se3 cell technology, as not too many devices of this kind have been fabricated to date.
The latest attempt to investigate such a cell configuration was made by U.S. scientists from the University of Toledo. They developed a device with a power conversion efficiency of 8.5%.
“The efficiency was measured in our own lab so it is internally certified,” researcher Suman Rijal told pv magazine. “These cells can be used for the production of solar electricity and also can be used as a photocathode for the production of hydrogen by the solar water splitting method.”
The cell was built with a two-step closed space sublimation (CSS), which is a physical vapor deposition method to produce thin films. It involves semiconductors that evaporate below 800 C, which are coated on substrates in both vacuum and atmospheric pressure.
“This is a kind of sublimation deposition method this can go for commercial production,” Rijal said.
The scientists applied a seed layer was to a soda-lime glass substrate coated with molybdenum (Mo) through rapid thermal evaporation (RTE). They said this enabled templated growth of a vertically orientated Sb2Se3 seed layer that, in turn, enabled the growth of a high-quality Sb2Se3 absorber layer with high crystallinity and large columnar grains, while also avoiding the void formation at the back interface.
“The seed layer plays a crucial role in controlling the crystalline quality and preferred orientation of Sb2Se3 thin films and their interface properties,” the scientists said, noting that the growth of the Sb2Se3 ribbons can be oriented in mainly two groups of directions with respect to the substrate surface, and that vertically oriented ribbons are preferred.
A cell developed with this configuration originally achieved an efficiency of 7.47%, an open-circuit voltage of 459 mV, a short-circuit current of 26.54 mA cm2 and a fill factor of 61.39%. After post-deposition annealing in the air was used to passivate bulk defects in the Sb2Se3 absorber, the device reached 8.5%.
“The air annealing effectively reduces the densities of the defects and lowers their activation energies,” the scientists said. They also claimed that their research shows that high-performance Sb2Se3 solar cells can be developed through an approach that they define as “facile and effective.”
They shared the technical details of the cell in “Templated Growth and Passivation of Vertically Oriented Antimony Selenide Thin Films for High-Efficiency Solar Cells in Substrate Configuration,” which was recently published in Advanced Functional Materials.
This content is protected by copyright and may not be reused. If you want to cooperate with us and would like to reuse some of our content, please contact: editors@pv-magazine.com."
https://www.pv-magazine.com/2021/12/06/developers-submit-4-1-gw-of-pv-projects-for-first-2021-round-of-dutch-sde-program/,"COMMERCIAL & INDUSTRIAL PV,HIGHLIGHTS,MARKETS,MARKETS & POLICY,UTILITY SCALE PV,NETHERLANDS",EMILIANO BELLINI,"DECEMBER 6, 2021",Developers submit 4.1 GW of PV projects for first 2021 round of Dutch SDE++ program,"The SDE+ (Stimulering Duurzame Energieproductie) program for large-scale renewable energy projects continues to be the main driver for planned and contracted PV capacity in the Netherlands. Large-scale solar continues to prevail, despite growing congestion issues on the Dutch grid.
The Dutch Ministry of Economic Affairs and Climate Policy has announced that PV projects with a combined capacity of 4,161 MW have been submitted for the first round of the 2021 SDE++ (Stimulering Duurzame Energieproductie) program for large-scale solar and renewable energy. Of this capacity, 2,224 MW is represented by commercial and industrial PV systems, while ground-mounted projects and floating solar arrays account for another 1,908 MW.
The state-run Rijksdienst voor Ondernemend Nederland (RVO) agency, which manages the program, has accepted a range of renewable energy project proposals. The proposals include sustainable heating projects and CO2 capture and storage, with an aggregate power of 5.17 GW. All of the projects would require a total budget of €12 billion (USD 13.5 billion), with €5 billion earmarked for the round.
“Due to budget depletion, a number of more expensive techniques may not qualify for the subsidy,” said the RVO. “The highest amount of €6.1 billion was requested for CO2 capture and storage, followed by solar PV with €2.2 billion.”
The largely oversubscribed round might not end up allocating all the capacity requested for solar. But as previous rounds of the SDE++ program have shown, a big portion of it could be allocated.
In the second round of 2020, the RVO selected 3,426 PV projects with a combined capacity of 3,535 MW. In another recent round of the SDE++ program, the Dutch authorities selected 6,882 PV projects with a combined capacity of 3,340 MW.
The Netherlands could reach between 38 GW and 125 GW of total installed solar capacity by 2050, according to a recent report by Netbeheer Nederland. By the end of December 2020, the country’s cumulative installed solar capacity hit 10 GW. New PV capacity for 2020 was around 2.93 GW.
This content is protected by copyright and may not be reused. If you want to cooperate with us and would like to reuse some of our content, please contact: editors@pv-magazine.com."
https://www.pv-magazine.com/2021/12/06/canadian-bipv-module-maker-releases-790-w-panel/,"MARKETS,MARKETS & POLICY,CANADA",EMILIANO BELLINI,"DECEMBER 6, 2021",Canadian BIPV module maker releases 790 W panel,"Mitrex Integrated Solar Technology, a Canadian building-integrated PV module producer, has released a new 790 W panel with a power conversion efficiency of 19.5%.
The Mega HP M790-M1F module is the company's most powerful product. It combines two 395 W panels fused in a single device. It is built with 144 monocrystalline cells with an efficiency of 22.5%, 3.2 mm tempered glass, and an IP68 enclosure.
The panel measures 2,036 mm x 1,992 mm x 40 mm and weighs in at 42 kg. It can operate with a system voltage of 1,000 V and has a power temperature coefficient of -0.36% per degree Celsius. The open-circuit voltage is 96.2 V and the short-circuit current is 9.86 A.
“During the first year, Mitrex warrants the actual power output of the products will be no less than 97% of the labeled power output,” a company spokesperson told pv magazine. “From year two to year 25, the actual annual power decline will be no more than .7% by the end of year 25. By the end of year 25, the actual power output will be no less than 80% of the labeled power output.”
Mitrex produces the panels at its facility in Toronto. It said it is using its patented anti-reflecting technology, which involves color-treating the glass through pigments that are fused into the glass itself.
“The glass coating materials are characterized by high solar transmittance, minimal absorption, and increased durability,” the manufacturer said on its website, in reference to the colored layers. “Treated glass can have reflective, semi-reflective, or matte surfaces, depending on the product’s aesthetic requirements.”
Mitrex also makes smaller solar modules, as well as PV facades, solar cladding, solar glass and BIPV systems.
This content is protected by copyright and may not be reused. If you want to cooperate with us and would like to reuse some of our content, please contact: editors@pv-magazine.com."
