url,tag,author,updated_date,title,contents
https://www.pv-magazine.com/2021/09/13/romanian-hydropower-producer-enters-pv-business-with-45-mw-ground-mounted-project/,"UTILITY SCALE PV,ROMANIA",EMILIANO BELLINI,"SEPTEMBER 13, 2021",Romanian hydropower producer enters PV business with 45 MW ground-mounted project,"Romanian state-owned hydropower provider Hidroelectrica is seeking experts to conduct the feasibility study for a 45 MW ground-mounted PV project it wants to develop in Tudor Vladimirescu, in Brăila county, Muntenia, southern Romania, according to the website Licitatie-Publica.ro.
The project is the first solar power station planned by the company, which currently owns and operates 6.4 GW of hydropower assets across the country and is also planning to build both onshore and offshore wind power plants.
According to Romanian media outlet Profit.ro, the new solar park will require an investment of ROL193 million ($42.6 million) and will be the main bulk of a plan to deploy 50 MW of PV capacity in the country, with the remaining 5 MW being represented by small-scale floating PV arrays spread across its numerous hydropower plants.
Profit.ro also reports that in March, Hidroelectrica was interested in acquiring a 153 MW PV project under development by local real estate developer Portland Trust. In August, however, the project was bought by Israel-based renewable energy company Nofar Energy.
Romania's PV project pipeline has increased considerably in recent months. In early September, the Romanian energy supplier OMV Petrom – majority-owned by Austrian business OMV – said it wants to build a 111 MW solar power plant at a former chemical plant in Işalniţa, Dolj county, in southwestern Romania. Furthermore, there is a 700 MW project that is set to be spread across the municipalities of Grăniceri and Pilu, and another one under development by CE Oltenia, which wants to deploy 310 MW at one of its coal power facilities.
In May 2020, the Romanian government introduced more favorable rules for power purchase agreements.
This content is protected by copyright and may not be reused. If you want to cooperate with us and would like to reuse some of our content, please contact: editors@pv-magazine.com."
https://www.pv-magazine.com/2021/09/13/regional-strategy-to-turbocharge-indonesian-solar/,"FINANCE,GRIDS & INTEGRATION,MARKETS,MARKETS & POLICY,POLICY,UTILITY SCALE PV,UTILITY SCALE STORAGE,INDONESIA",MAX HALL,"SEPTEMBER 13, 2021",Regional strategy to turbocharge Indonesian solar,"A study prepared by the governments of Indonesia and Denmark has suggested a series of regional solar capacity targets can help the South East Asian nation to emission reduction targets which include having renewables supply 23% of its power mix by 2025.
The Renewable Energy Pipeline proposed by Indonesia's Department for Renewable Energy and Energy Conservation (Energi Baru Terbarukan dan Konservasi Energi) and the Danish Energy Agency has called for 2,379 MW of solar generation capacity to be added next year, as part of 6,713 MW of new projects by 2025, and 14,867 MW by 2030.
Far from being over-ambitious, the authors of the document stated developers have already committed to around 2.82 GW of new solar by 2025, and 7.87 GW this decade.
Pick up your copy of the September edition of pv magazine today for a detailed update on solar and battery storage in the United States, which faces a tough decision between taking advantage of Asian imports, or developing domestic manufacturing at the risk of slowing progress towards decarbonization.
With Indonesian solar tenders having recently established prices of around $0.04/kWh, and expected to hit $0.037 in the next round of awards, the report's authors estimated new solar farms will be competitive against legacy coal plants in 2023.
Similar cost calculations, however, prompted the authors of the study to discount widespread deployment of solar-plus-storage projects at this stage as the price of energy storage tech would reduce competitiveness. The document states the Indonesian grid can cope with the scale of intermittent renewables planned in the strategy without the need for energy storage at this point.
The regional plan considers five renewable energy technologies, although it acknowledges the risk associated with the suggested dominance of geothermal – alongside hydro – in many regions, given the uncertain nature of the costs and lead times associated with the former. Discounting geothermal would require another 7 GW of solar by 2025, the study stated, for 13.7 GW of new photovoltaic capacity by that stage.
Although the largest volume of new generation capacity is envisaged in the Java-Bali region – 1,058 MW next year, 3,298 MW by 2025, and 6,738 MW by 2030 – solar would supply only 1.8% of the renewable electricity needed in that zone to keep Indonesia on track with its clean energy targets.
PV modules would generate around 2% of the clean power needed nationally under the proposed regional plan and the solar contribution would amount to 4.5% in Nusa Tenggara, achieved by adding 131 MW of generation capacity next year, 161 MW by 2025, and 511 MW this decade. Some 401 MW of solar in Kalimantan next year, as part of 924 MW in four years' time, and 2,504 MW by 2030, would see photovoltaics supply 3.7% of that region's clean electricity.
Just 15 MW of panels in Papua next year, as part of subsequent totals of 75 MW and 255 MW of new solar, would see PV generate 2.5% of that region's clean electricity, and Sulawesi would rely on solar for 2.3% of its renewable energy, thanks to 279 MW next year, as part of 2025 and 2030 numbers of 729 MW and 1,629 MW, respectively.
Solar's smallest contribution is suggested in Maluku, which would require just 25 MW of project capacity next year, towards 55 MW in 2025, and 155 MW in 2030.
In terms of already planned capacity, Java-Bali has the highest figure, with solar developers having announced 4,195 MW of opportunities. The next highest figure is the 943 MW of solar projects planned in Sumatra. The latter region is earmarked to have the next largest volumes of solar added after Java-Bali, under the regional proposal, with 471 MW required next year, as part of 1,471 MW by 2025, and 3,075 MW by 2030.
This content is protected by copyright and may not be reused. If you want to cooperate with us and would like to reuse some of our content, please contact: editors@pv-magazine.com."
https://www.pv-magazine.com/2021/09/13/hanwha-q-cells-unveils-plan-to-produce-perovskite-topcon-solar-modules/,"HIGHLIGHTS,MARKETS,MODULES & UPSTREAM MANUFACTURING,SOUTH KOREA",EMILIANO BELLINI,"SEPTEMBER 13, 2021","Hanwha Q Cells unveils plan to produce perovskite, TOPCon solar modules","South Korea-based solar module manufacturer Hanwha Q Cells will invest a total of KRW1.5 trillion ($1.28 billion) over the next five years to expand solar module manufacturing capacity and increase research and development activities in its home country.
“The overall investment plan will include a 3.1 GW production capacity expansion in Korea, with the plan being to expand Q Cells’ Korean production capacity to 7.6 GW by 2025,” a spokesperson from the company told pv magazine. “Some of the funds from this investment pledge will be steered towards TOPCon and tandem perovskite technology … however, the 1.5 trillion figure is intended to be invested into a number of avenues.”
“The expanded production capacity will include perovskite and TOPCon lines, but it is as yet undetermined what precise capacity this will be,” the spokesperson went on to say, without providing further details.
The South Korean market is expected to see the deployment of more than 15 GW of PV capacity by the end of the decade and several domestic manufacturers are competing to secure a slice of this cake, including module manufacturer Hyundai Energy Solutions, among others. Hyundai is planning to build a 1.37 GW facility and recently opened a 750 MW panel factory in Eumseong county, in South Korea's North Chungcheong province, which brought its current module capacity of 1.35 GW.
South Korea’s Ministry of Trade, Industry and Energy (Motie) introduced carbon footprint rules for solar modules in May 2020. These rules are similar to those applied in France, where large scale solar tenders take low-carbon manufacturing into account, as well as the price developers agree to accept for the power generated. South Korea, like France, has an extensive nuclear power generation capacity which aids the low-carbon efforts of domestic solar panel manufacturers.
This content is protected by copyright and may not be reused. If you want to cooperate with us and would like to reuse some of our content, please contact: editors@pv-magazine.com."
https://www.pv-magazine.com/2021/09/13/the-worlds-first-large-scale-hybrid-hydro-floating-solar-power-plant/,"HIGHLIGHTS,TECHNOLOGY AND R&D,UTILITY SCALE PV,UTILITY SCALE STORAGE,NORWAY",EMILIANO BELLINI,"SEPTEMBER 13, 2021",The world’s first large scale hybrid hydro-floating solar power plant,"The Norwegian government has decided to support, with NOK79 million ($9.1 million), a research project led by Norway-based renewable energy developer Scatec and aimed at developing a large scale, hybrid hydro and floating solar power plant at an undisclosed location in West Africa.
The Norwegian consortium includes floating PV specialist Ocean Sun, independent research organization Sintef, software provider Prediktor, the Institute for Energy Technology (IFE), and Norwegian solar industry body the Solenergiklyngen. 
“[A] Scatec power plant will be planned, for hybrid hydropower and floating solar right from the beginning, as a first in the world,” Ocean Sun CEO Børge Bjørneklett told pv magazine. “Normally, floating solar power is an add-on to existing hydropower plants but this project will be developed specifically as a greenfield combo plant with overall low LCOE. PV and hydropower are complementary on a seasonal basis and hydropower can convert intermittent PV into higher-value steady power.”
The project includes the development of a platform for planning, scaling, and optimizing the operation of hybrid power plants. According to Bjørneklett, the optimization of the two power-generating elements gives benefits for water remediation technology and the dimensioning of the reservoir and the basin, as well as for defining early production levels from the solar plant during the construction phase. The project will also explore adaptations of the Ocean Sun system for amphibious use during the gradual filling of the reservoir.”
According to him, reduced water evaporation and PV cooling effects will be of key importance in the project. “Together with Prediktor and internet-of-things experts, the consortium will develop novel control mechanisms for the optimization and fine-tuning of the hybrid power [plant's] production,” the CEO stated.
No more technical or financial details of the project were revealed.
Scatec recently acquired the SN Power hydropower operator belonging to Norwegian state-owned private equity business Norfund. SN Power has 2.5 GW of hydro assets in Asia and sub-Saharan Africa. “Hydropower and solar PV are complementary technologies, resulting in new project opportunities, for instance floating solar on hydro reservoirs,” said Scatec Solar CEO Raymond Carlsen in October 2020, when the operation was finalized. “With this transaction, we see great potential in broader project origination and geographical expansion into growth markets in South East Asia and sub-Sahara[n] Africa.”
Ocean Sun has developed an innovative design for floating PV projects at near-shore locations and in semi-sheltered waters. The patented system consists of PV modules on floating membranes, inside buoyancy rings anchored to the seabed. with four mooring points and 12 lines.
Sintef recently unveiled a special floating structure that Norwegian energy company Equinor wants to deploy in offshore waters. The structure is built with an anchoring system that is claimed to give the installation enough freedom to cope with the waves.
This content is protected by copyright and may not be reused. If you want to cooperate with us and would like to reuse some of our content, please contact: editors@pv-magazine.com."
https://www.pv-magazine.com/2021/09/13/impact-of-increasing-pv-module-prices-on-indian-market/,"MARKETS,MODULES & UPSTREAM MANUFACTURING,UTILITY SCALE PV,INDIA",PV MAGAZINE,"SEPTEMBER 13, 2021",Impact of increasing PV module prices on Indian market,"From pv magazine India
India aims to develop the world’s largest clean energy program by 2022, with 175 GW of renewable energy capacity, including 100 GW of solar power. By 2030, the country’s power demand will be 817 GW, with more than half of that coming from clean energy and 280 GW coming from solar energy alone.
One of the key selling features that have helped solar power become the world’s fastest-growing energy source is cost reduction, which has just encountered a snag due to recent increases in solar module pricing. Solar module prices have increased by 18% since the beginning of 2021, after plummeting by 90% over the previous decade.
The value of projects awarded in the last six to nine months will be impacted by a rise in solar PV module prices. The government intends to impose a 40% basic customs duty (BCD) on solar modules and a 25% BCD on solar cells beginning April 1, 2022. This is one of the first stages toward the capacity secured by developers through the procurement process over the last six to nine months at rates ranging mostly between INR 2.00 ($0.03) and 2.25 per unit (kWh), with units scheduled to be commissioned over the following 12 to 15 months.
The price increase is mostly due to a significant increase in the price of polysilicon, a vital input for cell and module manufacturing. Metal prices have recently increased, putting pressure on the overall capital cost of solar-generating installations. Chinese module manufacturers have recently hiked their costs by more than one-fifth and have started canceling contracts to provide equipment.
For most solar power projects in India, imports are heavily reliant on PV modules. Therefore, if PV module prices continues to rise, it will be a near-term headwind. It has a significant influence on solar projects in two ways: It delays them past their deadlines and slows the uptake of solar power, precisely as numerous major economies have begun to recognize the role of solar power in reducing climate change.
PV module components account for roughly 50% to 55% of total project costs. Therefore a sustained increase in module prices of about 4% to 5% per watt will have a 12 to 14 basis point impact on project developers’ debt service coverage criteria. The tariff increase needed to counterbalance such a module price rise is expected to be around 20 to 22 paise per unit. The impact on the imported PV modules is expected to raise the overall bid tariff for the upcoming auctions by around 55 to 60 paise/unit. After accounting for the dual impact, the solar bid tariff is projected to remain below the INR 3/unit.
As the notification for cells and modules takes effect in April 2022, both the module price behavior and the completion of supply contracts by Chinese module original equipment manufacturer (OEMs) will continue to be important factors for solar power providers. The considerable ambiguity surrounding the deadlines for the inclusion of Chinese module providers on the Approved List of Models and Manufacturers (ALMM) may have an impact on the solar power sector’s incremental bidding activity.
The cost of solar panels has risen, and investment returns may suffer as a result. This sharp surge in prices has alarmed developers who have won projects that are yet to be commissioned, as 85% to 90% of solar modules used in India are imported from China.
Modules account for a huge percentage of a project’s total costs, and since independent power providers (IPPs) have lower margins in the Indian solar energy sector, even a small increase in module pricing will put them under more strain. For projects that have already signed a power purchase agreement, the increase in module costs has an influence on the internal rate of return. Unless the customer is willing to pay a higher electricity tariff, large-scale projects that are yet to negotiate PPAs with utilities may be delayed.
The polysilicon shortfall is expected to last at least through the first half of 2022. Other raw material prices, such as silver and glass, are also on the rise, so it will affect the entire ecosystem.
The viability of all the projects will be a major concern. About 50% of projects will be able to keep themselves viable depending on the number of days they get to work after the delivery of panels. Large project developers are finding it difficult to maintain their projects profitable after buying panels in the final phase of development, that is, 10 to 12 months after signing the PPA. The significant rise in steel prices, as well as the uncertainty surrounding safeguard duty, have contributed to their misery.
The recently established Production Linked Incentive (PLI) scheme will improve solar panel availability in India, stabilizing project costs in the future. Distribution companies are experiencing financial difficulties, and tariff changes are sporadic and insufficient. As a result, most private players cannot rely on power markets alone to stay profitable. They have to rely on repeated injections of liquidity through schemes like UDAY (Ujwal DISCOM Assurance Yojana) and entities like Power Finance Corporation Ltd. Because it’s impossible to forecast where the next subsidy will come from, scale and sprawl develop.
Large corporations integrate vertically to ensure that they are one of the beneficiaries of any subsidies that are implemented. The unpredictability of knowing where the next subsidy will come from leads to scale and sprawl. Large companies integrate vertically to make sure that wherever the subsidies kick in, they are one of the beneficiaries. As long as some arm of the Indian state is paying or injecting liquidity, solar companies can use it to keep the rest of the power business afloat.
Author: Gautam Das
The author is the co-founder and CEO of Oorjan Cleantech.
This content is protected by copyright and may not be reused. If you want to cooperate with us and would like to reuse some of our content, please contact: editors@pv-magazine.com."
https://www.pv-magazine.com/2021/09/13/south-australian-electricity-networks-rooftop-pv-trial-set-for-launch/,"MARKETS & POLICY,POLICY,AUSTRALIA",NATALIE FILATOFF,"SEPTEMBER 13, 2021",South Australian electricity network’s rooftop PV trial set for launch,"From pv magazine Australia
Sept. 23 will mark the start of SA Power Networks’ (SAPN) 12-month Flexible Exports Trial, which has the potential to double the amount of rooftop PV participating in the South Australian electricity network, by using smart technology to manage the flow of solar exports in response to congestion signals.
New and upgrading solar customers in parts of the grid that can’t handle more solar feed-in at certain times of the day, for short periods of the year, will no longer be limited to a year-round 5 kW of solar exports. That measure was introduced to protect grid stability, but it has proved to be a blunt instrument that unfairly affects new solar customers, compared to those who got in early and have been unrestricted in their exports.
“We are in the early stages of this new technology, and Flexible Exports is a world first that will help us accommodate more solar on our network,” said Mark Vincent,  SAPN’s general manager of strategy and transformation.
Flexible Exports will initially allow new systems connecting in the most solar-loaded of Adelaide’s southern suburbs to make a great leap in export capacity, if they are prepared to install compatible smart inverters – from either the Fronius SnapINverter Primo series or the GroWatt MIN-TLX line – paired with the energy-management technology of Australian company SwitchDin’s Droplet gateway.
“Based on network conditions experienced over the past 12 months, the flexible option would allow customers the opportunity to export 10kW for 98% of the time,” said Vincent.
To put it another way, intelligent flexible connection technology will allow new solar-equipped customers in the operating radius of the Sheidow Park substation, where more than 46% of households already have solar on top, to export more energy by reducing exports only when the network is actually constrained.
Flexible Exports “will quantify the extra value this can create for solar customers in constrained areas compared to zero-near-zero export limits, informing the business case for DNSPs to invest in this capability,” said the Australian Renewable Energy Agency (ARENA), when the project was announced in July.
ARENA is supporting the AUD 4.84 million ($3.6 million) project with AUD 2.08 million in funding. It said it aims to verify a system that can give customers “greater choice, the ability to export more from their solar panels, access to cheaper energy, and improved security and quality of supply – all without costly network upgrades.”
Participation is not mandatory. Those in the shadow of Sheidow Park substation who would prefer to use other inverter brands will still be connected, but with a 1.5 kW export limit, because on a few occasions each year – typically on mild-sunny days in spring, when solar is pumping around the middle of the day, and the demand of air conditioners has not yet cut in – the system can no longer cope with more exports at even 5 kW.
Existing customers and those upgrading in other parts of the network that aren’t congested are not affected by the Flexible Exports Trial, and will continue to be able to export up to 5 kW.
As the trial begins, Fronius and SMA inverter providers in Australia are simultaneously working to provide inverters with built-in capability to manage flexible exports, such that they won’t require the mediation of the Droplet tech. And the range of Droplet-compatible inverter systems will also be expanded over time.
The specially enabled inverters will automatically adjust their export limits every five minutes in response to locational, dynamic limit signals issued by SAPN, the distribution network service provider (DNSP).
“We expect that once we have proven the technology and assessed the customer experience that this will become a standard offer for new solar customers in South Australia from mid-2022,” Vincent said. “It is part of our plan to double the amount of solar that we can accommodate on our network by 2025.”
SAPN was instrumental in proposing what has become a controversial rule change by the Australian Electricity Market Operator, which, in brief, will allow networks to apply to upgrade the distribution network — whether with innovative fixes such as the dynamic exports being trialed in this project, or with physical upgrades to the system — to support greater solar integration, and charge solar customers a tariff for those upgrades.
In an interview with pv magazine Australia in June, Bryn Williams – network strategy manager at SAPN – said the rule change would support changes to the ability of the network to host more distributed renewable energy.
“In the future, we can consider pricing arrangements that pass on the component of our costs associated with enabling more energy to be fed in, to the people who are using that, separate to charging for simply maintaining the network etc which will continue to be recovered through the normal charges on energy consumed from the grid,” he said.
Energy Networks Australia, the industry body representing gas and electricity distribution and electricity transmission networks, welcomed the commencement of the 12-month trial.
ENA Chief Executive Andrew Dillon said he believes “the SA trial will have implications not only for the rest of Australia, but internationally.”
This content is protected by copyright and may not be reused. If you want to cooperate with us and would like to reuse some of our content, please contact: editors@pv-magazine.com."
