url,tag,author,updated_date,title,contents
https://www.pv-magazine.com/2021/09/13/stake-in-greeces-distribution-grid-sells-for-e2-1bn/,"FINANCE,GRIDS & INTEGRATION,HIGHLIGHTS,POLICY,GREECE",ILIAS TSAGAS,"SEPTEMBER 13, 2021",Stake in Greece’s distribution grid sells for €2.1bn,"The Spear WTE Investments Sarl business owned by Australian investment banking giant Macquarie will pay €2.12 billion for a 49% share in Greek electric grid company Hedno (the Hellenic Electricity Distribution Network Operator).
The majority of Greece’s transmission and distribution lines belong to state-owned utility the Public Power Corporation (PPC).
Greece’s environment and energy minister, Kostas Skrekas, said €2.1 billion was the highest offer for the privatization of a public enterprize in the nation’s history. 
The PPC this month revealed the interested bidders also included Luxembourg-headquartered private equity group CVC Capital Partners; the Mitsubishi Banking Corp-owned First Sentier Investors Group; and New York-based investor KKR Group, as the eight-month sale process entered its final stage.
The windfall is much greater than the utility could have expected two years ago, as high borrowing costs and record losses hamstrung the electric company.
The New Democracy government elected in 2019 shifted energy policy towards renewables and has pledged to phase coal out by 2025. Kyriakos Mitsotakis and his cabinet have also adopted a new electric vehicle (EV) law and are preparing the country’s first energy storage policy and tenders.
The part privatization of the distribution grid will enable the PPC to pay down debt and finance its investment plans.
With the company under new management since the election, and having pivoted from coal towards solar, EV and storage investment, stated plans to devote a chunk of the nation's post-Covid, ‘recovery and resilience facility‘ EU funding towards upgrading the distribution network give a pointer to where some of the Macquarie cash is likely to be diverted.
A greener energy system will require a more powerful and dynamic electric distribution network, able to accommodate and manage higher amounts of intermittent renewable energy. 
With the EU funding needing to be matched by private investment, €2.1 billion is not a bad start.
This content is protected by copyright and may not be reused. If you want to cooperate with us and would like to reuse some of our content, please contact: editors@pv-magazine.com."
https://www.pv-magazine.com/2021/09/13/keeping-track-of-chlorine-in-perovskite-stability/,"MODULES & UPSTREAM MANUFACTURING,TECHNOLOGY,TECHNOLOGY AND R&D,JAPAN,WORLD",MARK HUTCHINS,"SEPTEMBER 13, 2021",Keeping track of chlorine in perovskite stability,"As our understanding of perovskite solar cells improves, scientists are looking deeper and deeper into the material to observe the structure, the way electrons flow through it, and any obstacles limiting the performance.
Defects in the material, particularly at the boundaries between crystal grains, have been shown to cause problems, causing the structure to quickly degrade when exposed to UV light or moisture. Among the many approaches suggested to solve this, doping the cells with chlorine has shown significant improvements.
However, scientists have struggled to explain why chlorine had these effects, or whether it even remained present in the material after deposition. This was the starting point for a group of scientists led by the Okinawa Institute of Science and Technology (OIST). “The research community had no idea why they were seeing these improvements,” explained OIST scientist Afshan Jamshaid. “Once added, the researchers couldn’t track the chlorine – they couldn’t tell whether the chlorine was incorporated deep into the perovskite material, stayed at the surface or even left the material during the manufacturing process.”
Aiming to provide a definitive answer, Jamshaid and the group set out to fabricate chlorine doped perovskite solar films and pry into their structure right down to the atomic level, to confirm the presence or absence of chlorine. Using an imaging technique called scanning tunnelling microscopy, they observed dark depressions on the surface of the films, which were not present in samples without the chlorine doping.
Image: OIST
They were then able to calculate (with the help of collaborators at China’s Soochow University) that these dark patches were spots where chlorine had replaced iodine in the perovskite structure. And since more chlorine appeared to be present at the grain boundaries, they now suspect that chlorine serves to reduce the number of surface defects in the material, increasing its stability. Their work is described in full in the paper Atomic-scale insight into the enhanced surface stability of methylammonium lead iodide perovskite by controlled deposition of lead chloride, published in Energy & Environmental Science.
The group also trialled different deposition times, varying the final concentration of chlorine in the material. Through this, they are able to claim that 14.8% represents the ideal surface concentration of chlorine to boost stability. Any lower, and the improvements would be less pronounced, any higher and the chlorine will start to drastically alter other properties of the perovskite.
They plan to continue investigating how chlorine behaves as a dopant for perovskites, with the next step to create a fully operational solar cell based on a chlorine doped perovskite layer. “…fundamental studies like these are so important – they help device engineers pin down the most optimal manufacturing process without as much trial and error,” said Jamshaid. “By understanding how the dopants improve the material, it can also guide us towards new chemical mixes that might work even better.”
This content is protected by copyright and may not be reused. If you want to cooperate with us and would like to reuse some of our content, please contact: editors@pv-magazine.com."
https://www.pv-magazine.com/2021/09/13/jinkosolars-n-type-topcon-cell-achieves-24-58-efficiency-via-hydrogenation-treatment/,"MODULES & UPSTREAM MANUFACTURING,TECHNOLOGY AND R&D,AUSTRALIA,CHINA",EMILIANO BELLINI,"SEPTEMBER 13, 2021",JinkoSolar’s n-type TOPCon cell achieves 24.58% efficiency via hydrogenation treatment,"A group of researchers from the University of New South Wales (UNSW), in Australia, and Chinese solar module manufacturer JinkoSolar, claims to have been able to improve the average efficiency of a batch of 50 commercial n-type TOPCon solar cells developed by JinkoSolar itself, by implementing a post-cell hydrogenation process.
Described in the paper 24.58% efficient commercial n-type silicon solar cells with hydrogenation, published in Progress in Photovoltaics, the novel technique consists of incorporating the hydrogenation step in the chemical passivation for the tunnelling oxide, polysilicon contact, during the high-temperature firing for metal contact formation. When applied to this process, hydrogen diffuses from the dielectric layer to the silicon dioxide/crystalline silicon and passivates interfacial defects. “The hydrogenation process was developed at UNSW and is incorporated into the production of n-type TOPCon ‘HOT’ solar cells in a fully industrial environment at JinkoSolar,” the researchers emphasized.
The cells were fabricated with monocrystalline 251.99 cm2 n-type silicon wafers that were diamond wire cut and pyramid textured using an alkaline texturing solution. Tunneling oxide was thermally grown on the cell rear side through a thermal oxidation furnace. Both sides were then passivated with a stack of aluminum oxide (Al2O3), deposited via atomic layer deposition (ALD), and hydrogenated silicon nitride (SiNx) layers, deposited through plasma-enhanced chemical vapor deposition (PECVD). “Front silver/aluminium and rear silver contacts are screen printed with nine front busbars,” the scientists explained. “Cells are fired in a belt furnace to form the contacts, which also simultaneously allows hydrogen to diffuse throughout the bulk of the silicon.” The cells were then exposed to the hydrogenation treatment and heated to up to 600 degrees Celsius in a chamber for around one minute, which allows hydrogen to bond to dangling bonds and defects.
By measuring the performance of the solar cells, the researchers found that the cell's average open-circuit voltage increased by 7 mV, from 696 to 703 mV, and the average fill factor from 82.03% to 83.07%. “These improvements indicate enhanced bulk passivation and slight surface improvement from the dedicated hydrogenation process, above and beyond the hydrogenation that occurs during the firing process,” the Chinese-Australian team stated, noting that the average cell efficiency grew by 0.64%, from 23.51% to 24.15%.
The research team also developed a champion cell with an efficiency of 24.58% which was confirmed by the Chinese Academy of Sciences. This device also showed an open-circuit voltage of 10.45 V and a fill factor of 82.5%. “This result highlights the potential for incorporating an additional hydrogenation process following firing for the manufacture of commercial n-type TOPCon solar cells,” it concluded.
 
This content is protected by copyright and may not be reused. If you want to cooperate with us and would like to reuse some of our content, please contact: editors@pv-magazine.com."
https://www.pv-magazine.com/2021/09/13/indonesia-moves-forward-with-1-gw-pumped-storage-hydropower-plant/,"HIGHLIGHTS,MARKETS,UTILITY SCALE PV,UTILITY SCALE STORAGE,INDONESIA",EMILIANO BELLINI,"SEPTEMBER 13, 2021",Indonesia moves forward with 1 GW pumped storage hydropower plant,"The World Bank has decided to award a $380 million loan to Indonesia's Ministry of Energy and Mineral Resources for the construction of the 1,040 MW Upper Cisokan Pumped Storage Power Plant, a project under development since 1986.
“The facility will have significant power generation capacity to meet peak demand, provide significant storage capacity to enable a larger penetration of renewable energ[y] and, because of its close location to two large demand centers, will alleviate increasing transmission loads on the grid,” the international financial institution said in a statement. “As a result, a more environmentally friendly and reliable supply of electricity will benefit consumers in Java and Bali.”
The $800 million facility is planned to be located 40km west of Bandung in West Java and will occupy an area across two water reservoirs in West Bandung regency and Cianjur regency. According to a document published last year by state-owned utility PT PLN (Persero), which owns the project, the plant will consist of four units with a capacity of 260 MW each and the facility's total pump capacity will be 1.1 GW and will be provided by an underground power plant. The generation duration is estimated at 6.5 hours per day and the pump duration at maximum input, at 8.5 hours per day.
One of the two dams is located at 75.5m and is already built, on the Cirumamis River while a second dam is planned to be constructed at 98m on the Cisokan River. A tunnel will connect the power station to the reservoir and two transmission lines will link the facility to the Cibinong-
Saguling network, which cannot handle additional load as it has almost reached its capacity limit. “Main construction activities are expected to take 50 months and are planned to be operational between 2024 [and] 2025,” the report reads.
This content is protected by copyright and may not be reused. If you want to cooperate with us and would like to reuse some of our content, please contact: editors@pv-magazine.com."
https://www.pv-magazine.com/2021/09/13/proposals-received-for-latest-version-of-delayed-kuwaiti-gigasolar-project/,"HIGHLIGHTS,MARKETS,MARKETS & POLICY,UTILITY SCALE PV,KUWAIT",MAX HALL,"SEPTEMBER 13, 2021",Proposals received for latest version of delayed Kuwaiti gigasolar project,"The three-and-a-half-years delayed Dabdaba solar project planned by the government of Kuwait is back out for tender, according to a report on Dubai-based trade news website Energy and Utilities.
An article posted on the site yesterday reported the Kuwait Authority for Partnership Projects (KAPP) – which has taken over the tender for the gigawatt-scale solar field from the Kuwait Petroleum Corp (KPC) – has received project proposals from companies vying for the engineering, procurement and construction services contract.
Previously reported as a 1 GW and 1.5 GW project, the solar field – which Energy and Utilities referred to as Al-Dibdibah – is now set to have a generation capacity of “up to 3 GW,” according to the trade news website, although the Dubai-based media organization also referred to the latest plans as a “1.5 GW project.”
The article appears to confirm a story reported by New York-controlled regional news website Zawya Middle East in January, that the project has been combined with the Shagaya renewables field being planned 100km west of Kuwait City. Berlin-based cleantech advisory Apricum wrote in a pv magazine article in June, that “Al Dibdibah” is part of the Shagaya project.
Energy and Utilities wrote bids had been received for a submission date of last Tuesday which had been extended from June 27 and July 27. The original, KPC tender for Dabdaba was supposed to have been completed in March 2018.
Dubai's Energy and Utilities report stated Shagaya has 50 MW of concentrating solar power generation capacity, plus 10 MW of solar and 10 MW of wind, installed as part of a pilot project, and implies Dabdaba will comprise the second phase of the clean power facility. Phase III, described as ‘Al Abrag' by Apricum, is expected to feature 1.2 GW of photovoltaics as part of a 2 GW extension of capacity which will take it to “almost 4GW of renewable energy capacity by 2030,” according to Energy and Utilities.
pv magazine is awaiting a reply from KPC about the status of the tender, having contacted the state entity in July last year and in January. The English-language version of the website of KAPP – the state body tasked with generating private-sector investment – had no updates related to Dabdaba this morning.
This content is protected by copyright and may not be reused. If you want to cooperate with us and would like to reuse some of our content, please contact: editors@pv-magazine.com."
https://www.pv-magazine.com/2021/09/13/solar-in-uncommon-spaces/,"COMMERCIAL & INDUSTRIAL PV,TECHNOLOGY AND R&D,UTILITY SCALE PV,UNITED STATES",RYAN KENNEDY,"SEPTEMBER 13, 2021",Solar in uncommon spaces,"From pv magazine USA
Solar is at the forefront of climate mitigation efforts, but comes with some environmental baggage of its own. One concern is the amount of land needed for the energy revolution, especially as more utility-scale solar projects are brought forward.
In July, for example, developers of a proposed 850 MW solar plant in the desert north of Las Vegas pulled their application with the U.S. Bureau of Land Management in the wake of local opposition. Residents argued that the array, proposed to cover more than 14 square miles, would be an eyesore and could hurt area recreational activities.
A study by Clemson University estimated that energy production for domestic use and export will rise by 27% by 2040. Roughly 124,000 square miles of land will be needed to site all of the related facilities. With spacing requirements included, nearly 500,000 square miles of land will need to be dedicated to new energy production – an area larger than Texas.
To be sure, locations across the built environment (rooftops, carports, and the like) are common places for solar installations. The benefits of these distributed sites are numerous. But if the nation is to rapidly hit clean energy penetration targets, then large-scale projects with big footprints are needed as well. 
Not all large-scale solar deployments need to be sited on vacant spaces or farmland, however. Three options include floatovoltaics, landfill solar, and highway rights-of-way. Let’s have a look at each in turn.
Land or sea?
Floatovoltaics are a hot PV trend set to double in capacity in 2021. The structures largely take land use debates off the table, as the solar array floats on top of a body of water. Typically, these installations are found buoyed-up on a lake or basin, where the water is calmer than the ocean.
Dual-use locations are often sites for these projects. Reservoirs, hydroelectric dam water sources, and wastewater treatment ponds are all potential candidates to host floatovoltaics. 
Take the Far Niente Winery in Napa Valley, California, for example. Completed in 2008, it is widely considered to be the first grid-connected floatovoltaic array in the world. To meet annual demand of 800,000 kWh, the solar array uses 2,296 panels, 1,200 of which sit on top of the winery’s irrigation reservoir, reserving nearby vineyard space for grape production.  
The buoyant structure that supports the panels was a simple, yet clever solution. Pontoons made of 18-inch ribbed pipe filled with styrofoam sit beneath the panels and are attached to four concrete mounts. The array can freely rise and fall 18 feet as water is used, and the concrete mounts prevent the modules from rotating and ensure an optimal azimuth.
What’s more, the array reduces evaporation by covering and cooling the water. This same effect also prevents the spread of unwanted algae. In turn, the pond benefits the panels, acting as a stable thermal mass that regulates temperature, slowing panel degradation and increasing efficiency.
An example of how such projects be effective comes from the Sembcorp Floating Solar, a 60 MW FPV array on the Tengeh Reservior in Singapore, which recently entered service. The system’s 122,000 Trina Solar 210 Vertex dual-glass modules, which cover a surface area the size of 45 football fields, deliver green energy from Singapore’s main reservoir of drinking water via a 25-year power purchase agreement with the National Water Agency.
Singapore’s Public Utilities Board said it selected Trina Solar modules due to their double-glass protection, which will aid in making them durable enough to perform in wet and humid conditions for 25 years. The panels are supported by high-density polyethylene (HDPE) floats. The floats are UV-resistant, a necessity to protect them from degradation.
When evaluating the effectiveness of floating PV, cost is likely a first concern as these structures have unique construction mounting (or docking) needs. However, cost parity may be closer than one may expect. Floating PV has slightly higher capital costs, but lower operation and management costs, no land costs, and increased efficiency benefits the cost structure.
According to Stetson Tchividjian, director of business development at D3Energy, an FPV developer, the price to install floating solar is about 10% to 15% higher than land-based PV. However, O&M cost reductions may help close the gap. If the externalities that stem from developing otherwise-useful land are included, then the economics behind floating solar may keep a project above water.
Landfill opportunity
Landfills and other contaminated brownfield sites are another area for growth. The U.S. Environmental Protection Agency tracks solar-landfill topping installations as part of its RE-Powering America’s Land initiative, and has recorded an 80% rise in installations in the last five years. Nearly 60% of the tracked projects sit on landfills, and more than 90% of the RE-Powering projects are solar PV.
Most of the sites are either municipally or privately owned, with about 1.5 GW of the 1.8 GW installed capacity falling under those ownership structures. Two-thirds of the projects sell power back to the grid, and 22% of the tracked sites are community solar projects. Nearly 70% of these facilities offer 1 MW or more of capacity.
Massachusetts currently leads the field with 30% of the country’s landfill projects. EPA said that a favorable policy climate is important to supporting brownfield sites. Massachusetts’ SMART Program offers enhanced incentives for landfill and brownfield development and built a fast-track for the approval process of these projects, hence the state’s leadership in this arena.
New Jersey and Illinois have also made strides in policy and utility involvement, said the EPA. One of the largest is the 50 MW Sunnyside solar facility, planned to top a 240-acre Houston landfill and enter service by the end of 2022. Sunnyside’s procurement came as a result of the city’s Climate Action Plan.
Typically, installers are not allowed to penetrate the landfill’s surface, and mounting hardware and foundational structures must be adaptable and lighter than in a conventional ground-mount design. For example, mounting supplier Solar FlexRack provided cast-in-place racks for a community solar landfill development south of Provo, Utah. The mounting system used lighter ballasts with internal bracing and fewer components than a typical solar mount.
Lighter mounts, less expensive land, and environmentally minded policy are all drivers that can push costs down for solar landfills. 
Highway PV 
Highway right-of-way (ROW) areas offer unique qualities that lend themselves to solar installations. For example, the Colorado Department of Transportation (CDOT) explained that ROW areas offer ease of access to the adjacent solar facilities and transmission lines often follow highway alignments.  What’s more, ROWs have well-maintained vegetation and few trees or other shading elements.
The CDOT study noted a number of potential safety and quality issues with ROW PV. The top concerns included snow drift and deposition, panel glint and glare, water quality management issues, driver safety in collisions, and safe access for maintenance.
As a result of the study, CDOT created a series of tools for properly siting solar projects. The tools included glint and glare hazard models, array siting criteria, an impact matrix and mitigation strategies.
Highway ROW solar has been deployed in Europe for more than 30 years, and innovations continue to be introduced. For example, a Belgian consortium created two testing facilities to develop PV-equipped noise barriers for use where land and policy constraints make ground-mounted solar plants nearly impossible to install. 
The dual-use structure must first function as a sound barrier, which may limit the accompanying PV production. Modules are covered with a transparent sound dampening layer that the researchers said cut production by about 30%.
In the United States, the land area available for ROW installations can be tight and is generally best left for highway interchanges and exits, according to a study by the University of Texas at Austin’s Webber Energy Group. 
The study found that most states have more than 200 miles of suitable interstate frontage available. That amounts to between 440 and 6,600 acres of preferable install site area per state. Each state had an identified potential of anywhere from 127 to 1,814 GWh per year, with Texas sitting in the top spot. California and Illinois ranked second and third in potential.
The Texas researchers identified a need for GIS data to better support the development of ROW solar. Iowa was the only state included in the that had completed detailed highway interchange profiles to facilitate the transition to solar site planning.
This content is protected by copyright and may not be reused. If you want to cooperate with us and would like to reuse some of our content, please contact: editors@pv-magazine.com."
