url,tag,author,updated_date,title,contents
https://www.pv-magazine.de/2021/01/18/bundeswirtschaftsministerium-zieht-gesetzentwurf-zu-steuerbaren-verbrauchseinrichtungen-zurueck/,"HIGHLIGHTS DER WOCHE,POLITIK,DEUTSCHLAND",SANDRA ENKHARDT,18. JANUAR 2021,Bundeswirtschaftsministerium zieht Gesetzentwurf zu steuerbaren Verbrauchseinrichtungen zurück,"Aufregung im Bundeswirtschaftsministerium (BMWi). Am Wochenende wurde bekannt, dass der Gesetzentwurf des Steuerbare-Verbrauchseinrichtungen-Gesetzes (SteuVerG) vorerst auf Eis gelegt ist. Mit dem Gesetz soll eigentlich ein schneller Anschluss neuer Verbrauchseinrichtungen wie Elektrofahrzeugen, Wärmepumpen und dezentrale Speicher in die Niederspannungsnetze geregelt werden.
„Es handelt sich um einen Entwurf der Arbeitsebene, der nicht die Billigung des Ministers gefunden hat und deshalb bereits am vergangenen Freitag zurückgezogen und von der Homepage des BMWi heruntergenommen wurde“, erklärte eine Sprecherin von Bundeswirtschaftsminister Peter Altmaier (CDU) am Sonntag. Altmaier wolle das der Hochlauf der Elektromobilität schnell und verlässlich erreichen. „Er wird in den kommenden Tagen diesbezüglich sowohl mit den Fahrzeugherstellern als auch mit den Netzbetreibern Gespräche führen und danach einen neuen Vorschlag vorlegen, der für alle Beteiligten akzeptabel ist.“, so die Ministeriumssprecherin weiter.
Der Bundesverband Neue Energiewirtschaft (bne) begrüßte die Entscheidung, das Gesetz vorerst zurückzunehmen. „Der Gesetzentwurf wäre für die Energiewende, die Verbraucher, die Verkehrswende und die Automobilwirtschaft schädlich gewesen“, erklärte bne-Geschäftsführer Robert Busch. Der Entwurf sei „nicht reparierbar“. Der bne fordert daher vom Ministerium einen völlig neuen Gesetzentwurf. Er solle Flexibilitäten im System fördern und nicht behindert sowie marktbasierte Lösungen eröffnen.
Für den BDEW kam die Rücknahme des Referentenentwurf nach mehr als zwei Jahren der gutachterlichen Vorbereitung „völlig überraschend“. „Es ist völlig unverständlich, dass der ausgewogene Vorschlag zurückgenommen wurde. Elektromobilität ist erfolgreich, wenn das System mitgedacht wird. Das Schüren von unbegründeten Ängsten behindert den Erfolg der CO2-freien Mobilität der Zukunft“, erklärte BDEW-Hauptgeschäftsführerin Kerstin Andreae. Es sei nicht nachvollziehbar, warum die Autobranche suggeriere, dass das Laden von Elektrofahrzeugen verhindert werde. Es werde „ohne Not eine regelrechte Reichweiten-Angst herbeigeredet“, sagte Andreae weiter.
„Es muss allen Beteiligten klar sein: Wir brauchen für den Erfolg der Elektromobilität ein jederzeit stabiles Stromnetz.“ Das Laden von Millionen Elektroautos und der Anschluss von Millionen neuer Wärmepumpen sei für die Verteilnetze eine Herausforderung, für die sie aber gut aufgestellt. Für einen Marktanteil von 50 Prozent Elektrofahrzeuge müssten die Netze jetzt geplant werden. „Ohne die Möglichkeit einer kurzzeitigen Anpassung der Ladeleistung müsste das Stromnetz-Verteilnetz in Deutschland flächendeckend für die sehr seltenen Fälle extremer Stromnachfragespitzen ausgebaut werden“, sagte Andreae weiter. Dies würde zusätzliche Milliarden-Investitionen zum bereits erforderlichen Ausbau benötigen, die am Ende alle Verbraucher zahlen müssten – egal, ob sie Elektroauto fahren oder nicht. Dies hält der BDEW angesichts praktikabler Alternativen nicht für vertretbar. „Wichtig ist, dass jetzt ein verlässlicher gesetzlicher Rahmen für ein modernes, intelligentes und effizientes Netz geschaffen wird, der zugleich aber offen bleibt für zukünftige Anpassungen auf Basis von Praxiserfahrungen und sich ändernden Rahmenbedingungen“, sagte Andreae. Zudem brauche es ein Monitoring, um die Häufigkeit und Dauer der netzseitigen Begrenzungen zu evaluieren. Auf dieser Basis sollten dann weitere sinnvolle Ansätze zu Spitzenlastglättung entwickelt werden.
Der Bundesverband Solarwirtschaft (BSW-Solar) zeigte sich über den Rückruf eines Gesetzesentwurfs zur Neuordnung der Netzentgelt-Tarifstruktur für steuerbare Verbrauchseinrichtungen erleichtert. Die Solar- und Speicherwirtschaft fordern eine faire Kostenverteilung beim weiteren Umbau der Stromnetze im Rahmen der Energiewende, der keinesfalls zu Lasten des Ausbaus der Elektromobilität, von Speichern und Wärmepumpen gehen dürfe, hieß es am Dienstag vom Verband. Der Referentenentwurf hätte aber genau dies vorgesehen. Dieser hätte Netzbetreiber in die Lage versetzt, Verbrauchseinrichtungen wie zum Beispiel Ladeeinrichtungen für Elektroautos oder Wärmepumpen täglich für Stunden vom Netz zu nehmen oder die Jahresnetzgebühren für eine sichere Anschlussleistung gegenüber heute zu vervielfachen. Bei Prosumerhaushalten mit einem Energiemangementsystem wäre sogar die gesamte Anschlussleistung inklusive des normalen Haushaltsstroms durch den Netzbetreiber steuerbar, wenn auf die kostenintensive Bestellung von sicherer Anschlussleistung verzichtet würde.
„Uns vorliegende Berechnungen zeigen, dass es bei hohen unbedingten Leistungen bis zu einer Vervierfachung der Jahresentgelte hätte kommen können. Schon mit einer kleinen Wallbox von 11 Kilowatt und lediglich 5 Kilowatt unbedingter Leistung hätten einige Netzbetreiber zum Beispiel einen Jahrespreis von 2.000 Euro nur für die Netznutzung festsetzen können“, erklärte BSW-Solar-Hauptgeschäftsführer Carsten Körnig. „Unter diesen Bedingungen käme die Solarisierung des Mobilitäts- und Wärmesektors ins Stocken. Wir empfehlen dringend, keine weiteren Hürden für verbrauchernahen Klimaschutz zu schaffen, sondern bestehende Barrieren endlich abzubauen.“*
*Anmerkung der Redaktion: Die Stellungnahme des BSW-Solar ist am 19.1.2021 nachträglich in den Artikel aufgenommen worden.
Dieser Inhalt ist urheberrechtlich geschützt und darf nicht kopiert werden. Wenn Sie mit uns kooperieren und Inhalte von uns teilweise nutzen wollen, nehmen Sie bitte Kontakt auf: redaktion@pv-magazine.com."
https://www.pv-magazine.de/2021/01/18/bundesumweltministerium-will-photovoltaik-ausbauziel-auf-150-gigawatt-bis-2030-anheben/,"HIGHLIGHTS DER WOCHE,POLITIK,DEUTSCHLAND,EUROPA",SANDRA ENKHARDT,18. JANUAR 2021,Bundesumweltministerium will Photovoltaik-Ausbauziel auf 150 Gigawatt bis 2030 anheben,"Nach der EEG-Novelle ist vor der EEG-Novelle: Dies war auch bei den Beschlüssen im Bundestag im Dezember 2020 der Fall. Neben dem EEG 2021 verabschiedeten die Abgeordneten mit der Mehrheit der Regierungsfraktionen auch einen Entschließungsantrag. Darin enthalten zahllose Punkte, über die sich CDU, CSU und SPD im Zuge der Diskussion über die EEG-Reform nicht einigen konnten und deren Entscheidung somit auf das erste Halbjahr 2021 verschoben wurde. Ein Punkt darin ist die Anpassung der Ausbauziele für Photovoltaik, Windkraft und Co.
Im Referentenentwurf des CDU-geführten Bundeswirtschaftsministeriums war vorgesehen, für die Photovoltaik ein Ausbauziel von 100 Gigawatt bis 2030 im EEG festzuschreiben. Dies kommt in etwa einer Verdopplung der in Deutschland bisher installierten Photovoltaik-Leistung bis zum Ende des Jahrzehnts gleich und würde einen jährlichen Zubau von durchschnittlich fünf Gigawatt bis 2030 erfordern. Dem Koalitionspartner SPD, der das Umweltressort leitet, ist dies wohl eindeutig zu wenig. In der vergangenen Woche hatte Bundesumweltministerin Svenja Schulze (SPD) auf der Handelsblatt-Jahrestagung „Energiewirtschaft“ von der Notwendigkeit einer erneuten EEG-Reform gesprochen und einen deutlich ambitionierten Photovoltaik-Ausbau gefordert. Sie will das Ziel für die Photovoltaik von 100 auf 150 Gigawatt bis 2030 anheben und für Windkraft an Land von 71 auf 95 Gigawatt bis 2030. „Ich gehe davon aus, dass wir dies bald mit einer weiteren #EEG-Novelle beschließen, denn die Energiewirtschaft braucht dringend einen neuen Orientierungsrahmen“, twitterte Schulze.
Dazu müssen wir die Ausbaupfade anheben: 2030 150 statt 100 GW Photovoltaik, 95 GW statt 71 GW Onshore-Windkraft. Ich gehe davon aus, dass wir dies bald mit einer weiteren #EEG-Novelle beschließen, denn die Energiewirtschaft braucht dringend einen neuen Orientierungsrahmen. (3/3)
— Svenja Schulze (@SvenjaSchulze68) January 13, 2021
Ihr Staatssekretär Jochen Flasbarth bekräftigte nun in einem Interview mit dem „Tagesspiegel“ die Forderungen der Ministerin. Beide verwesen auch auf die gestiegenen EU-Ambitionen. Daher brauche Deutschland bis 2030 einen Anteil von mindestens 65 Prozent Erneuerbare an der Stromerzeugung und eine größere Dynamik beim Kohleausstieg, um das EU-Klimaziel zu erreichen. Dazu passt auch die jüngst veröffentlichte Forderung der Europäischen Umweltagentur. Sie will eine Verdoppelung des Anteils erneuerbarer Energien im Stromsektor.
2030 sollen Erneuerbare mind. 65% der Stromerzeugung ausmachen. Doch das neue EU-Klimaziel, die größere Dynamik beim Kohleausstieg und der zunehmende Bedarf an sauberen Strom für Elektroautos, Wärmepumpen und grünen Wasserstoff, erfordern einen deutlich erhöhten Ausbau. (2/3)
— Svenja Schulze (@SvenjaSchulze68) January 13, 2021
Vor diesem Hintergrund hat sich der Bundesverband Erneuerbare Energie (BEE) ebenfalls zu Wort gemeldet. Er drängt seit längerem auf die Anpassung der Ausbaupfade für Photovoltaik, Windkraft und Co., um die Klimaschutzziele in erreichbare Nähe zu rücken und eine Ökostromlücke angesichts des wachsenden Strombedarfs durch Elektromobilität, grünen Wasserstoff und Wärmepumpen in den kommenden Jahren zu vermeiden. Neben den Ausbaupfaden müssten dafür auch die Ausschreibungsmengen zügig angepasst werden. „Die Bundesregierung wird durch den Entschließungsantrag dazu verpflichtet, nochmals tätig zu werden, um mit angepassten Ausbauzielen ein Signal für Klimaschutz und Innovation zu geben“, so BEE-Präsidentin Simone Peter. „Es geht jetzt nicht nur darum, der drohenden Verfehlung des bisherigen 65-Prozent-Ziels gegenzusteuern, sondern auch darum, auf die Ambition der EU zu reagieren und ein nationales Ausbauziel von 80 Prozent erneuerbaren Energien im Stromsektor bis 2030 zu beschließen.“
Dieser Inhalt ist urheberrechtlich geschützt und darf nicht kopiert werden. Wenn Sie mit uns kooperieren und Inhalte von uns teilweise nutzen wollen, nehmen Sie bitte Kontakt auf: redaktion@pv-magazine.com."
https://www.pv-magazine.de/2021/01/18/naturschutzverbaende-befuerworten-1000-megawatt-photovoltaik-kampagne-in-baden-wuerttemberg/,"INSTALLATION,DEUTSCHLAND",SANDRA ENKHARDT,18. JANUAR 2021,Naturschutzverbände befürworten 1000 Megawatt Photovoltaik-Kampagne in Baden-Württemberg,"Die Plattform Erneuerbare Energien Baden-Württemberg (EE BW) hat im Dezember eine 1000 Megawatt Kampagne gestartet, um die Photovoltaik bis 2030 zur wichtigsten Energiequelle in dem Bundesland zu machen. Bis zum Ende des Jahrzehnts sollten jährlich etwa 1000 Megawatt Photovoltaik-Leistung zugebaut werden – etwa eine Verdopplung der aktuellen Installationszahlen. Unterstützt wird die Initiative unter anderem von der Energiewirtschaft und dem Handwerk. Jetzt sprachen sich auch die baden-württembergischen Landesverbände von BUND und NABU, der Landesnaturschutzverband LNV und die Bodensee-Stiftung dafür aus. Die von der Landesregierung beschlossene Photovoltaik-Pflicht sowie die Neuauflage der Photovoltaik-Speicherförderung seien „positiv, alleine aber zu wenig“, hieß es von en Naturschutzverbänden am Montag.
Sie fordern neben dringend notwendigen Energieeinsparungen auch einen massiven Ausbau der Erneuerbaren in den Sektoren Strom und Wärme. „Wir wollen so im Jahr 2030 mittels Photovoltaik mit deutlich mehr als 17 Terawattstunden die Strommenge von vier größeren Kohlekraftwerken oder zwei Atomkraftwerken ersetzen und Ende des Jahrzehnts ungefähr ein Viertel des heute in Baden-Württemberg verbrauchten Stroms solar erzeugen“, erklärt Brigitte Dahlbender, Landesvorsitzende des BUND.
Der LNV-Vorsitzende Gerhard Bronner fordert von der Politik die passenden Rahmenbedingen, etwa um die riesigen Photovoltaik-Potenziale für Solarstrom auf Gewerbegebäuden zu erschließen. „Der von uns, den Kommunen, der Energiewirtschaft und dem Handwerk vorgeschlagene solare Zubau kann mehrere Fliegen mit einer Klappe schlagen“, so Bronner weiter. Er bringe den Klimaschutz voran, könne helfen und könne beitragen, die Versorgungslücke im Südwesten zu füllen, die durch die Abschaltung der Atom- und Kohlekraftwerke in den nächsten Jahren entsteht.
Volker Kromrey, Programmleiter Energiewende der Bodensee-Stiftung, betonte zudem die Bedeutung des Photovoltaik-Zubaus für die Wertschöpfung im Land und die Schaffung neuer Arbeitsplätze. Zudem sei Photovoltaik mittlerweile die günstigste Stromerzeugungstechnologie im Land und lasse sich gut mit Naturschutzaspekten verbinden.
Die Orts- und Kreisgruppen der Umweltverbände werden Druck machen, dass Kommunen und Landkreise endlich auf breiter Front aktiv werden, Förderprogramme für Solarstrom auflegen und die eigenen Dächer und Fassaden zur Erzeugung von klimaschonendem und günstigem Solarstrom nutzen, wie es weiter hieß. Außerdem wollten sie über verschiedene Kanäle für mehr Photovoltaik im Land werben. Zugleich sei den Umweltverbänden klar, dass die Forderung nach einer neu installierten Photovoltaik-Leistung von 1000 Megawatt vor allem in diesem Jahr eine ungewöhnliche Kraftanstrengung bedeute. Dort ein „frühes und schnelles Handeln beim Umbau der Energiewirtschaft“ sei notwendig.
Die Photovoltaik-Anlagen sollten vor allem auf den Dächern und Fassaden von Privathäusern oder im Gewerbe sowie der Landwirtschaft installiert werden. Ebenso sehen die Verbände großes Potenzial in der solaren Überdachung großer Parkplätze, weshalb das geplante Förderprogramm sofort starten müsse.
Dieser Inhalt ist urheberrechtlich geschützt und darf nicht kopiert werden. Wenn Sie mit uns kooperieren und Inhalte von uns teilweise nutzen wollen, nehmen Sie bitte Kontakt auf: redaktion@pv-magazine.com."
https://www.pv-magazine.de/2021/01/18/verbraucherschuetzer-fordern-staatliches-siegel-fuer-gruenen-wasserstoff/,"MÄRKTE,WASSERSTOFF,DEUTSCHLAND",SANDRA ENKHARDT,18. JANUAR 2021,Verbraucherschützer fordern staatliches Siegel für grünen Wasserstoff,"Wie beim Strom kann man dem Wasserstoff nicht ansehen, ob er mit Photovoltaik und Windkraft oder aus fossilen Brennstoffen erzeugt wurde. Eine qualitative Umfrage des Verbraucherzentrale Bundesverband (vzbv) ergab nun, dass sich Verbraucher diesbezüglich transparente Informationen wünschen. 18 von 21 ausgewählten Verbrauchern, die zu grünem Wasserstoff bereits auskunftsfähig waren, gaben an, dass sie nachvollziehen können wollen, ob es sich wirklich um aus Wind- und Solarstrom erzeugten Wasserstoff handele. Für diesen Fall gab dann eine knappe Mehrheit – 12 der 21 Befragten – an, Mehrkosten von 10 bis 20 Prozent zu bezahlen.
Etwa 75 Prozent der Befragten bewerten grünen Wasserstoff positiv. Allerdings bräuchte es dafür aber „eindeutige und verständliche Informationen zur Nachhaltigkeit“. Der vzbv fordert daher auch ein staatliches Siegel, um Sicherheit zu schaffen und „Greenwashing“ entgegenzuwirken.  „Ein Gütesiegel der Wirtschaft reicht aus Sicht des vzbv nicht aus, deshalb ist ein staatliches Siegel notwendig“, erklärte Thomas Engelke, Teamleiter Energie und Bauen im vzbv. Die qualifizierte Befragung habe dabei auch ergeben, dass 11 von 21 Verbrauchern Informationen zum Herstellungsort interessant fänden. 16 von 21 Befragten interessierten sich zudem für den Anteil an Wind- und Solarstrom im grünen Wasserstoff.
Der qualifizierten Befragung war eine repräsentative Haushaltsumfrage des Bundesverbands vorausgegangen. Dabei zeigte sich, dass 44 Prozent der Verbraucher mit dem Begriff grünen Wasserstoff etwas anfangen können. Allerdings gaben nur 17 Prozent an, sie könnten ihn auch erklären. Auch bei der anschließenden Befragung der 21 Verbraucher zeigte sich, dass ein Drittel von ihnen nicht klar ist, dass die Herstellung des grünen Wasserstoffs aus Photovoltaik und Windkraft noch hohen Umwandlungsverlusten unterliegt.
Dieser Inhalt ist urheberrechtlich geschützt und darf nicht kopiert werden. Wenn Sie mit uns kooperieren und Inhalte von uns teilweise nutzen wollen, nehmen Sie bitte Kontakt auf: redaktion@pv-magazine.com."
https://www.pv-magazine.de/2021/01/18/trianel-und-20-stadtwerke-gruenden-projektgesellschaft-fuer-photovoltaik-und-windkraftausbau/,"INSTALLATION,MÄRKTE,DEUTSCHLAND",SANDRA ENKHARDT,18. JANUAR 2021,Trianel und 20 Stadtwerke gründen Projektgesellschaft für Photovoltaik- und Windkraftausbau,"Mit der Trianel Wind und Solar (TWS) will Trianel gemeinsam mit 20 Stadtwerken den weiteren Ausbau von Photovoltaik und Windkraft vorantreiben. Die offizielle Gründungsveranstaltung sei bereits am 1. Dezember erfolgt. Seit Jahresbeginn ist die neue Gesellschaft nun operativ tätig und wird sukzessive Projekte aus der Trianel Projektentwicklung übernehmen, wie es am Montag von der Aachener Stadtwerke-Kooperation hieß. Mehr als eine halbe Milliarde Euro sollen demnach bis 2030 in den Bau neuer Solar- und Windparks investiert werden.
Das neue Unternehmen knüpfe an die erfolgreiche Zusammenarbeit in der Trianel Onshore Windkraftwerke, der Trianel Erneuerbare Energien sowie der Trianel Windpark Borkum und Trianel Windpark Borkum II an. Das kommunale Gesamtportfolio erweitere sich somit um 340 auf über 1000 Megawatt Gesamtleistung. „Das ist eine starke kommunale Leistung, die uns bestärkt auch in Zukunft gemeinsam neue klimaschonende und profitable Projekte umzusetzen“, erklärte Sven Becker. Sprecher der Geschäftsführung bei Trianel.
An der neuen Gesellschaft beteiligen sich zahlreiche Stadtwerke aus Nordrhein-Westfalen, aber auch Stadtwerke aus anderen Bundesländern sind engagiert. Nach Angaben von Trianel sind folgende Stadtwerke beteiligt: Allgäuer Überlandwerk GmbH, Energie- und Wasserversorgung Bonn/ Rhein-Sieg GmbH, Energie- und Wasserversorgung Rheine GmbH, ENNI Energie & Umwelt Niederrhein GmbH, Gemeindewerke Steinhagen GmbH. GSW Gemeinschaftsstadtwerke GmbH Kamen Bönen Bergkamen. Hertener Energiehandelsgesellschaft mbH, Stadtwerke Aalen, Stadtwerke Bochum Holding GmbH, Stadtwerke Detmold GmbH, Stadtwerke Energie Jena-Pößneck GmbH, Stadtwerke Georgsmarienhütte GmbH , Stadtwerke Gronau GmbH, Stadtwerke Hamm GmbH, Stadtwerke Heidelberg Energie GmbH, Stadtwerke Herford GmbH, Stadtwerke Herne AG, Stadtwerke Mosbach GmbH, Stadtwerke Solingen GmbH.
Dieser Inhalt ist urheberrechtlich geschützt und darf nicht kopiert werden. Wenn Sie mit uns kooperieren und Inhalte von uns teilweise nutzen wollen, nehmen Sie bitte Kontakt auf: redaktion@pv-magazine.com."
