url,tag,author,updated_date,title,contents
https://www.pv-magazine.de/2021/01/18/netzfrequenz-in-europa-sinkt-auf-4975-hertz-folge-ist-systemaufspaltung/,"MEINUNG,DEUTSCHLAND,EUROPA",,18. JANUAR 2021,"Netzfrequenz in Europa sinkt auf 49,75 Hertz – Folge ist Systemaufspaltung","Im nunmehr zweiten Jahr der Corona-Pandemie hat man sich ja an schlechte Nachrichten schon gewöhnt, auch der nach einer gefühlt unendlichen Geschichte nun tatsächlich vollzogene Brexit und die historischen Ereignisse um das Capitol in den USA bestimmten in den letzten Tagen die Schlagzeilen. Da geht eine solche Meldung über Netzprobleme in der täglichen Nachrichtenflut eigentlich fast schon unter. Auch wenn sie immerhin ganz Europa betrifft – oder vielleicht fast betroffen hätte. Doch was bedeutet diese Schlagzeile wirklich? Und welche Funktion haben größere Speicherprojekte in Deutschland bei solchen Zwischenfällen?
Hier ein paar Nachbetrachtungen auf dieses Ereignis aus dem Blickwinkel eines Speicherherstellers. Ich bin für die Smart Power GmbH tätig, die als Hersteller und Projektierer von netzdienlichen Speichern mit dazu beitragen will, dass solche Vorfälle auch in Zukunft weiterhin nur von wenigen technisch Interessierten zur Kenntnis genommen werden und eben nicht zu großen Schlagzeilen werden.
Die Energiewende ist ja mittlerweile als eine der zentralen gesellschaftlichen und technischen Herausforderungen geworden. Der erforderliche starke Ausbau der Erneuerbarenist ohne Zweifel auch eine große Herausforderungen für die Betriebsführung der Netze. Durch die Verdrängung fossiler thermischer Kraftwerke mit ihren großen Turbinen fehlen zunehmend große Schwungmassen im Netz, die mit ihrer kinetischen Energie die Schwankungen und Ungleichgewichte zwischen Erzeugung und Verbrauch im ersten Moment gut ausgleichen können. So sind zunehmend intelligente aktive Ausgleichsmaßnahmen notwendig, um das Gleichgewicht zwischen Erzeugung und Verbrauch stets konstant zu halten. Die Frequenz im Netz ist der Indikator für dieses Gleichgewicht, denn sie repräsentiert die gemeinsame Drehzahl aller synchron rotierenden Erzeugungsmaschinen im Netz, bei 50 Hertz ist die Sollgröße und damit das Gleichgewicht genau erreicht.
Der Einbruch der Netzfrequenz am 8. Januar 2021 beschreibt einen aktuellen Fall einer starken und vor allem sehr schnell wachsenden Unterdeckung im Netz. Er soll Gegenstand dieser Betrachtungen sein. Die Ursachen des Ereignisses bis dato im wesentlichen  ungeklärt sind, kann diese Betrachtung aber nur eine Momentaufnahme sein, weitere Untersuchungen dazu sind aktuell noch im Gange.
Quelle: frequenzmessung.de
In verschiedenen Portalen wie gridradar.net, netzfrequenz.info oder netzfrequenzmessung.de  wurden zum  aktuellen Vorfall Messergebnisse und Auswertungen zur Verfügung gestellt. Bei der Recherche fiel allerdings auf, dass die Diagramme den Einbruch immer um 13:05 Uhr zeigen, in den begleitenden Texten teilweise aber von 14:05 Uhr (CET) die Rede ist. Diese Diskrepanz in der Zeitangabe konnte bis dato nicht genau geklärt werden. Tatsache ist aber, dass der Frequenzeinbruch jedenfalls nicht exakt zum Stundenwechsel erfolgte. Ähnliche Einbrüche zum Stunden- oder Viertelstundenwechsel waren in den vergangenen Monaten vermehrt vorgekommen. Sie sind in der Regel ein Indiz dafür, dass nicht technische, sondern kaufmännische Gründe eine Unterdeckung im Netz hervorrufen. Das passiert in der Regel dann, wenn in Bilanzkreisen zu wenig vergleichsweise teure Ausgleichenergie rechtzeitig einkauft wird. Stattdessen verlässt man sich auf die Regelenergie, die aber unter Umständen in solchen Fällen an ihre Grenzen stoßen kann. Um diese Art der Gewinnmaximierung auf Kosten der Sicherheit im Netz zu unterbinden, erfolgten in jüngerer Vergangenheit einige Abmahnungen an verschiedene Marktteilnehmer.
In den einschlägigen Portalen ist teilweise auch sehr gut erkennbar, dass die Frequenzmessungen von verschiedenen europäischen Städten praktisch genau demselben Verlauf folgen. Die Frequenz ist also überall vollkommen gleich, ein Zeichen dafür, wie sich die Netze gegenseitig im Rahmen Ihrer Übertragungskapazität stützen. Auf der anderen Seite ist aber hier auch erkennbar, dass sehr schwache Netze mit einer Leistungsunterdeckung auch das gesamte Europäische Verbundnetz (UCTE) sozusagen mitreißen und im Ernstfall einen Zusammenbruch hervorrufen könnten.
Quelle: gridradar.net
Genau diese Gefahr drohte vermutlich durchaus im aktuellen Fall. Im Nachhinein wurde ermittelt, dass es scheinbar in Rumänien Ausfälle von Kraftwerken und Übertragungsleitungen und damit eine größere Unterdeckung im Netz gab. Um eine Ausbreitung des Fehlers und speziell Auswirkungen auf das gesamte europäische UCTE-Netz zu vermeiden, wurde für eine bestimmte Zeit das gesamte südosteuropäische Netz abgetrennt und nach Behebung der Fehler etwa eine Stunde später wieder mit dem restlichen Netz verbunden (re-synchronisiert). Der Normalzustand konnte somit ohne weitere Auswirkungen auf das restliche europäische Netz sehr schnell wieder erreicht werden. Den einzigen Hinweis auf die Vorfälle bildet somit der überall gleichzeitig gemessene Frequenzeinbruch.
Quelle: netzfrequenzmessung.de
Quelle: entsoe.eu
Interessant ist in diesem Zusammenhang auch die Betrachtung der weiteren Schritte, die bei einem weiteren Abfall der Frequenz gegebenenfalls notwendig gewesen wären. Das Kriterium für die „unverzögerte Aktivierung von Leistungsreserven“ wurde mit Überschreitung der 200 Millihertz-Grenze in diesem Fall sofort erreicht, weitere Schritte zum automatischen Lastabwurf im Netz waren aber nicht notwendig. Allerdings ist aus den Diagrammen ein sehr hoher Gradient des Frequenzeinbruches abzulesen (242 Millihertz in 10 Sekunden). Aus dem Gradienten beziehungsweise der Höhe des Frequenzeinbruches kann auch eine erste Abschätzung zur Fehlleistung zum Zeitpunkt des Einbruches erfolgen – es ergibt sich daraus ein Wert von etwa 3,6 Gigawatt. Zumindest die ungefähre Größenordnung dieses Leistungsdefizites wird auch durch folgende Meldung bestätigt: Laut entsoe.eu wurden im verbleibenden nördlichen Netzteil rund 1,7 Gigawatt an Lastabschaltungen in Italien und Frankreich durchgeführt. Dabei handelt es sich aber nicht um die ungeplante Abschaltung normaler Verbraucher wie in der Tabelle Bild 6 wiedergegeben, sondern um Lasten, die gemäß vertraglichen Vereinbarungen im Rahmen von Netzsteuerungsmaßnahmen geschaltet werden können.
Der sehr steile Abfall der Frequenzkurve kann aber durchaus ein Indiz dafür sein, dass auch die verschiedenen Schritte des Lastabwurfes (gemäß Bild 5 und Bild 6) bei einem weiteren Frequenzabfall unter Umständen eine Komplettabschaltung weiterer Netzteile oder auch des ganzen Netzes nicht unbedingt in jedem Fall verhindern hätten können.
In diesem Zusammenhang ist natürlich die Frage interessant, inwieweit aktive Stützungsmaßnahmen durch Einspeisung von Primärregelleistung (PRL) unter Umständen daran beteiligt waren, einen weiteren Frequenzabfall und damit weitere Abschaltungen vorbeugend zu verhindern. Dies soll im Folgenden betrachtet werden.  
Quelle: netzfrequenzmessung.de
 
Quelle: Forum Netztechnik/Netzbetrieb
 
„Wir brauchen Speicher im Netz“ – dieser Ruf kann in den letzten Jahren durchaus immer wieder wahrgenommen werden und zwar von verschiedenen Marktakteuren an ganz unterschiedlichen Stellen bis hin zur Politik. Und auch die Betrachtung dieses aktuellen Falles führt natürlich unweigerlich zur Frage, inwieweit Speichersysteme geeignet sind, um Netzzustände dieser Art beherrschen zu helfen. Seit Jahrzehnten existieren auch Marktmechanismen, um diese Funktion der Netzstabilisierung zu entlohnen, das Ausschreibungsverfahren für Primärregelleistung ist in diesem Zusammenhang das beste Beispiel. Der Vollständigkeit halber sei erwähnt, dass durchaus auch konventionelle Kraftwerke Primärregelleistung anbieten können: In solchen Fällen wird ein Kraftwerk nicht mit Nennlast, sondern in Teillast betrieben. Bei einer positiven oder negativen PRL-Anforderung kann es dann mehr oder weniger Leistung erzeugen und damit das Leistungs-Gleichgewicht in beide Richtungen verschieben. Voraussetzung ist allerdings eine ausreichend dynamische Regelgeschwindigkeit.
In diesem Zusammenhang sollen aber speziell die Speichersysteme betrachtet werden. Sie können nicht nur virtuell, sondern tatsächlich in beiden Wirkungsrichtungen betrieben werden. Bei Überfrequenz werden die Batterien aus dem Netz geladen und entziehen dem Netz somit überschüssige Leistung, bei Unterfrequenz stützen sie das Netz durch Einspeisung. Der Zusammenhang zwischen Frequenz und Leistung ist in einer Kennlinie definiert, die die einheitliche Regelvorgabe jedes PRL-Systems darstellt. Das Speichersystem kann in der Ausschreibung des PRL-Marktes dann mitbieten, wenn es die Kriterien Regelgeschwindigkeit, Leistung und Energiereserven für eine gewisse Vermarktungsleistung erfüllen kann und dies auch einmalig im Rahmen einer Präqualifikation durch den Übertragungsnetzbetreiber nachgewiesen hat.
Quelle: Smart Power GmbH
Vergleicht man nun diese vorgeschriebene PRL-Kennlinie mit den aktuellen Frequenzeinbrüchen des 8. Januar 2021, ist durchaus erkennbar, dass hier durchaus echte und nicht nur „kosmetische“ Korrekturmaßnahmen zu erfolgen hatten. Im normalen PRL-Betrieb pendeln diese Speicher normalerweise ständig zwischen 0 und maximal etwa 20 Prozent ihrer Nennleistung in beiden Richtungen und halten durch diese kleinen Korrekturen die Frequenz sehr eng im Nennbereich. Weitere Ausschläge sind sehr selten. Am 8. Januar 2021 aber war der gesamte PRL-Regelbereich bereits mit der ersten Frequenzabweichung von über 200 Millihertz innerhalb von 10 Sekunden komplett ausgesteuert, die Kraftwerke mussten also – laut Kennlinie – ohne Verzögerung mit der maximalen Leistung ins Netz einspeisen.
Hier kommen wir natürlich zur interessanten Frage: Haben im aktuellen Fall diese Steuerungsmechanismen auch „gegriffen“ und haben sie möglicherweise sogar dabei geholfen, weitere Abschaltungen zu vermeiden? Diese Frage soll im Folgenden anhand der Reaktion unserer aktiven Smart-Power-Speichersysteme betrachtet werden:
Die folgende Auswertung zeigt die Funktionalität der PRL-Eingriffe durch die aktiven Speichersysteme der Smart Power GmbH im Realbetrieb am besagten 8. Januar 2021.  In den Jahren 2016 bis 2020 wurden durch die Smart Power GmbH bereits zahlreiche Speichersysteme im Megawatt-Bereich errichtet und in Betrieb genommen. Diese Systeme werden in verschiedenen Businessmodellen teilweise im eigenen Anlagenportfolio, teilweise auch durch Kunden betrieben. In den meisten Fällen ist PRL zumindest einer der möglichen Betriebsfälle. In vielen Fällen sind die Anlagen nach wie vor in der hauseigenen Monitoring- und Betriebsplattform geführt, daraus wurde aktuell die folgende kumulative Auswertung generiert:
Quelle: Smart Power GmbH
Die Anlagen dieser Summenauswertung stehen an verschiedenen Orten in Deutschland, da die Frequenz aber wie bereits beschrieben überall gleich ist, konnte sozusagen eine Summenauswertung aller Smart Power-Anlagen für den Vorfall am 8. Januar 2021 erstellt werden. Die Auswertung zeigt folgende Ergebnisse:
Die in diesem Beispiel aufgeführte Zusammenfassung der durch uns errichteten Speicherprojekte ist natürlich nur eines von mehreren repräsentativen Beispielen der „Speicherlandschaft“ in Deutschland. Derzeit gibt es in Deutschland eine wachsende Anzahl an PRL-Speichern im einstelligen Megawatt-Bereich und sogar bereits eine „Handvoll“ Speichersysteme im kleinen zweistelligen Bereich. Sicher sehr interessant ist in diesem Zusammenhang der aktuell Anfang 2021 in Betrieb genommene LEAG-Speicher im Braunkohlegebiet „Schwarze Pumpe“ in Brandenburg mit 50 Megawatt PRL-Leitung. Bereits bis Ende des Jahres wollen wir mit einem bis dahin errichteten Speicher-Kraftwerkspark mit insgesamt etwa 100 Megawatt wiederum einen neuen Benchmark setzen.
Viele andere Projekte wären in dieser Zusammenstellung zu nennen und zu kumulieren. Sehr interessant könnte in diesem Zusammenhang die neue Überarbeitung der Karte von Speicher-Großprojekten des Bundesverband Speichersysteme sein, die zum Frühjahr 2021 in einer neuen Ausgabe erscheinen dürfte.
Die Erkenntnisse dieser Betrachtungen könnten also wie folgt zusammengefasst werden: Die Rolle der Speicher bei der dynamischen Netzstützung ist anhand der betrachteten Zahlen derzeit sicher noch nicht ausreichend, um solche Störfälle allein beherrschen zu können. Dies betrifft sowohl die kurzfristig abrufbare Leistung als auch die zur Verfügung stehende Kapazität bzw. Energie. Die derzeit am Markt erkennbare große Ausbaudynamik bei Speichern zeigt aber, dass die Größenordnung der zur Verfügung stehenden Leistung und auch Energie sehr schnell ansteigen kann, wenn die Rahmenbedingungen entsprechend vorgegeben werden. Sicher kann der Speicherausbau an vielen Stellen den Netzausbau nicht vollkommen ersetzen, aber das Gleichgewicht könnte sich bei Betrachtung der fallenden Gestehungskosten von Speichern durchaus stark in Richtung der Speicher verschieben. Vor allem die kurzen Realisierungszeiten und die kaum vorhandenen Akzeptanzprobleme für Speicherprojekte sind im Vergleich zu großen Netz-Infrastrukturmaßnahmen sicher ein großer Vorteil.
— Der Autor Hans Urban hat den Solarbereich bei Schletter aufgebaut. Seit seinem Ausscheiden aus der dortigen Geschäftsleitung ist er als Berater tätig, unter anderem für Schletter, Smart Power und Maxsolar. Zudem hält er deutschlandweit Vorträge zu Themen rund um erneuerbare Energien. —
Die Blogbeiträge und Kommentare auf www.pv-magazine.de geben nicht zwangsläufig die Meinung und Haltung der Redaktion und der pv magazine group wieder. Unsere Webseite ist eine offene Plattform für den Austausch der Industrie und Politik. Wenn Sie auch in eigenen Beiträgen Kommentare einreichen wollen, schreiben Sie bitte an redaktion@pv-magazine.com.
Dieser Inhalt ist urheberrechtlich geschützt und darf nicht kopiert werden. Wenn Sie mit uns kooperieren und Inhalte von uns teilweise nutzen wollen, nehmen Sie bitte Kontakt auf: redaktion@pv-magazine.com."
