url,tag,author,updated_date,title,contents
https://pv-magazine-usa.com/2021/12/22/toshiba-claims-8-4-efficiency-for-transparent-cuprous-oxide-solar-cell/,"MANUFACTURING,MODULES & UPSTREAM MANUFACTURING,TECHNOLOGY,TECHNOLOGY AND R&D,WORLD",EMILIANO BELLINI,"DECEMBER 22, 2021",Toshiba claims 8.4% efficiency for transparent cuprous oxide solar cell,"Japanese electronics manufacturer Toshiba has announced an 8.4% power conversion efficiency for a transparent cuprous oxide (Cu2O) thin-film solar cell. The result, the company claims, is the highest efficiency ever reported for any cell of this kind to date.
The cell was conceived for use in electric vehicles and high-altitude platform station (HAPS) applications. “The tandem solar cell offers the promise of more efficient solar modules by combining top and bottom cells that generate power at different wavelengths,” the manufacturer said in a statement.
The record efficiency was achieved by reducing copper(II) oxide (CuO) and copper (Cu) impurities during the fabrication of the cell’s Cu2O layer and, in particular, by carefully controlling the oxygen flow. These impurities are due to the reactive sputtering deposition method used in the manufacturing of the cell. “We used a transparent conducting oxide as the bottom electrode and fabricated a low-impurity Cu2O thin film by reactive sputtering using argon and oxygen,” the Toshiba research scientists stated.
The Cu2O thin films were deposited by reactive sputtering in mixed oxygen and argon atmosphere on transparent conducting oxide (TCO) on a glass substrate with TCO composed of double layers of antimony doped tin oxide (ATO) and indium tin oxide (ITO). “The ATO layer was chosen for its good electrical contact with the Cu2O layer,” the researchers further explained. “The thicknesses of the Cu2O thin films were varied from 2 to 5 μm.”
The cell was tested under standard illumination conditions and was found to have an efficiency of 8.3%, an open-circuit voltage of 1.13 V, a short-circuit current of 10.63 mA/cm2, and a fill factor of 0.696.  The Cu2O thin films showed the highest transmittance with the lowest impurity ratio.
The scientists also conducted a device simulation analysis and found that the cell has the potential to reach an efficiency of over 10% by decreasing the surface velocity at p–n interfaces and increasing n-type carrier density at the n-layer. “With support from Japan’s New Energy and Industrial Technology Development Organization (NEDO), Toshiba will continue research to achieve the 10% PCE target for top Cu2O cells,” the researchers said. “Toshiba is also cooperating with Toshiba Energy Systems & Solutions Corporation in the development of large-scale Cu2O solar cells that are the same size as mass-produced silicon solar cells.”
The solar cell was described in the paper “Highly transparent Cu2O absorbing layer for thin film solar cells,” published in Applied Physics Letters (AIP).
This content is protected by copyright and may not be reused. If you want to cooperate with us and would like to reuse some of our content, please contact: editors@pv-magazine.com."
https://pv-magazine-usa.com/2021/12/22/sunrise-brief-the-most-read-pv-magazine-usa-articles-of-2021/,"ACQUISITIONS,INSTALLATIONS,MARKETS & POLICY,MICROGRID,O&M,UTILITY SCALE PV,TEXAS,UNITED STATES",ANNE FISCHER,"DECEMBER 22, 2021",Sunrise brief: The most-read pv magazine USA articles of 2021,"You read, we listened: Most-read pv magazine USA articles of 2021. The top five articles of 2021 show that pv magazine USA readers really pay attention to innovative new technologies that show great potential, are concerned about the lifetime of components in a solar installation, and are tracking the electric vehicle revolution.
Watch: Enel activates 181 MW solar, 55 MW storage in Texas. The project joins a large portfolio of renewable energy + storage co-located projects in the state.
NREL launches international consortium to advance high-tech mirrors used in concentrating solar plants. The goal of the consortium is to reduce cost of heliostats by 50% and accelerate U.S. manufacturing.
Iron flow battery PV microgrid for fire-prone California. ESS announced the integration of its long-duration batteries for a microgrid project commissioned by San Diego Gas & Electric to mitigate and increase resilience to wildfires.
AES acquires Community Energy Solar. The acquisition adds 10 GW of solar projects to AES’ existing pipeline, as well as the addition of Community Energy’s development workforce.
Enphase acquires 365 Pronto, O&M platform. The acquisition gives Enphase installers access to a labor pool that can perform service calls, beneficial at a time of severe labor shortages within the industry.
 
This content is protected by copyright and may not be reused. If you want to cooperate with us and would like to reuse some of our content, please contact: editors@pv-magazine.com."
https://pv-magazine-usa.com/2021/12/22/people-on-the-move-borrego-american-energy-partners-enervenue-and-more/,"BUSINESS,EMPLOYMENT,MARKETS & POLICY,UNITED STATES",TIM SYLVIA,"DECEMBER 22, 2021","People on the Move: Borrego, American Energy Partners, EnerVenue, and more","Borrego, a leading developer, EPC and O&M provider for large-scale renewable energy projects throughout the United States, has hired two seasoned professionals to lead its development and people + culture efforts and also created a new leadership team for its EPC business.
Borrego named Jacquie Ashmore as vice president of engineering, development, a role in which she will provide senior accountability for all engineering needs of Borrego’s development portfolio. Ashmore joins Borrego from Boston University, where she served for five years as the executive director of the university’s Institute for Sustainable Energy. 

Catriona Wiley joins Borrego as the executive vice president of people + culture (P+C) after more than seven years with food and beverage giant Torani as its P+C vice president. Wiley brings more than two decades of industry HR experience to her new role, in which she will guide Borrego’s developing diversity, equity and inclusion plan and offer valuable strategy for organizational design, talent acquisition and retention as well as leadership development.

In addition to the new hires, Borrego has restructured its EPC team to fuel its strategic expansion plan. This new structure will focus on national alignment under a new functional leadership model.

Brian Barker, previously general manager of the utility-scale division, has been promoted to executive vice president of EPC. Carl Price will head up the estimating and design optimization team as the VP of pre-construction; Ben Walter will lead the professional engineering and design teams as the VP of engineering; Joanie Brooke takes on a new role as VP of business operations where she will lead the PMO, supply chain, quality, warranty and scheduling teams; Joe Busch will lead the distributed generation construction team (projects from 3 MW to 100 MW) as the VP of construction; and Josh Richardson will lead Borrego’s self-performing teams on projects 100 MW and greater as VP of construction.
American Energy Partners, Inc., a diversified energy company, announced that Kurtis Z. Hoffman has been hired as Chief Operating Officer for American Energy, effective January 1, 2022. Josh Hickman will step down as Chief Operating Officer and Board Member effective January 1, 2022, and continue his role as President of Hickman Geological Consulting, LLC, a wholly owned subsidiary of American Energy.
Mr. Hoffman previously served as a Vice President at CNX Resources. Mr. Hoffman has also served in management, operations, business development and engineering positions at CNX Midstream Partners LP, CONSOL Energy, Dominion Energy and BJ Services.
EnerVenue, a bring metal-hydrogen battery energy storage company, announced the appointment of Andrzej Skoskiewicz as VP of Product Engineering. In this role, Skoskiewicz will lead EnerVenue’s product design and engineering, including the hardware design work across all customer products, manufacturing, installation, and servicing. Skoskiewicz comes to EnerVenue with decades of experience as an engineer and product development leader in renewable energy storage. Most recently, Skoskiewicz served as VP of Product Development at Stem, Inc.
Graphex Group Limited, a world leader in graphene technologies and products used in electric vehicle (EV) battery and energy storage production, has announced the formation of its U.S. subsidiary, Graphex Technologies LLC (Graphex), and the appointment of its new CEO.
John DeMaio has been appointed to the positions of CEO of Graphex Technologies and President, Graphene Division of Graphex Group Limited, the former of which represents the U.S. entity. In his new role, DeMaio will lead development and launch of key North American and European strategic alliances to support the strong increase in demand for advanced technology in the EV and renewable energy industries.
Lordstown Motors Corp., an EV innovator developing high-quality light duty commercial fleet vehicles, announced that its Board of Directors has elected Melissa Leonard as Executive Vice President, effective January 1, 2022. Leonard will replace Tom Canepa, LMC’s current General Counsel & Secretary, who is leaving to pursue other opportunities. Leonard was co-leader of the Mergers and Acquisitions team for Baker & Hostetler LLP, where she has served as outside counsel to the Company since 2019.
Sponsored: VP of Operations – Phoenix, AZ

Main Accountabilities:
Required Skill & Experience:
This content is protected by copyright and may not be reused. If you want to cooperate with us and would like to reuse some of our content, please contact: editors@pv-magazine.com."
