url,tag,author,updated_date,title,contents
https://www.pv-magazine-brasil.com/2024/01/19/trinatracker-fornece-projeto-fotovoltaico-de-210-mw-no-brasil/,"EQUILÍBRIO DE SISTEMAS,FABRICAÇÃO,GERAÇÃO CENTRALIZADA,INSTALAÇÕES,BRASIL",LÍVIA NEVES,"JANEIRO 19, 2024",TrinaTracker fornece projeto fotovoltaico de 210 MW no Brasil,"A TrinaTracker concluiu o fornecimento de um conjunto de soluções de rastreamento inteligente para um projeto fotovoltaico de 210 MW no Brasil desenvolvido pela POWERCHINA, localizado em Mauriti, município do norte do estado do Ceará.
As soluções incluem o rastreador Vanguard 1P de última geração, um sistema de inteligência artificial de autoaprendizagem, SuperTrack, e a plataforma SCADA de nível de rastreador digital Trina Smart Cloud.
Após a conclusão e comissionamento, espera-se que o projeto crie mais de 2.000 empregos e gere um crescimento económico cumulativo avaliado em 140 milhões de dólares.
A TrinaTracker possui uma unidade de fabricação de rastreadores inteligentes no Brasil e equipes de serviços regionais, garantindo capacidade de fabricação local e de alta qualidade, bem como entrega e serviços eficientes e precisos. As equipes de pré-vendas, vendas e P&D da TrinaTracker colaboraram para otimizar o esquema em resposta à solicitação do cliente por um design personalizado.
Devido à natureza propensa a inundações do local do projeto, a TrinaTracker propôs uma solução automática de proteção contra inundações que equilibra segurança e economia.
O Brasil, avalia a empresa em comunicado, é o mercado fotovoltaico mais promissor na América Latina e na região do Caribe devido à demanda crescente por capacidade fotovoltaica instalada, impulsionada por uma série de incentivos e políticas locais.
Recentemente, a companhia obteve o código Finame para fornecer seguidores fabricados no Brasil para clientes que desejem ter acesso à linha de financiamento incentivado oferecida pelo BNDES.
Este conteúdo é protegido por direitos autorais e não pode ser reutilizado. Se você deseja cooperar conosco e gostaria de reutilizar parte de nosso conteúdo, por favor entre em contato com: editors@pv-magazine.com."
https://www.pv-magazine-brasil.com/2024/01/19/assembleia-legislativa-de-goias-ampliara-usina-de-geracao-solar-distribuida/,"GERAÇÃO DISTRIBUIDA,INSTALAÇÕES,MERCADOS & POLÍTICAS,POLÍTICA,GOIÁS",PV MAGAZINE,"JANEIRO 19, 2024",Assembleia Legislativa de Goiás ampliará usina de geração solar distribuída,"
O engenheiro conta que a escolha pelo sistema de energia solar foi feita depois de um Estudo de Eficiência Energética, que apontou ser a melhor solução para economia de energia elétrica na Casa.
Com o aumento da geração, a energia solar vai ser responsável por suprir 60% do consumo do Palácio Maguito Vilela. Atualmente, o sistema que já está em funcionamento, gera 19.000 quilowatt-hora por mês, o que corresponde a 8% do que é consumido no prédio.
Segundo Sulino, a usina solar da Alego é do tipo on-grid, que permite a conexão do sistema de geração de energia elétrica na rede e possibilita que parte de energia não utilizada seja enviada para a concessionária. “Através do medidor bidirecional, a energia elétrica injetada na rede é medida e compensa a energia elétrica consumida da (empresa) Equatorial pela Alego.”
A medida faz parte da política empreendida pela Mesa Diretora da 20ª Legislatura de busca de economicidade e eficiência, de forma a diminuir despesas e otimizar os recursos financeiros.
De acordo com o presidente do Parlamento, deputado Bruno Peixoto (UB), a medida vai gerar economia no custeio do prédio, além de ser um modelo de sustentabilidade aos demais órgãos públicos. “Nesta gestão, estamos trabalhando e ampliando tecnologias que são responsáveis por grande economia na Casa e, consequentemente, aos cofres públicos. Além disso, a energia solar é sustentável e eficiente.”
Bruno reforça, ainda, a importância do modelo que poderá ser copiado por outros prédios da administração pública no estado. “É o futuro. O uso de tecnologias para otimizar o trabalho e gerar economia tem sido feito na Assembleia em todas as áreas. Tenho certeza que estamos implementando um modelo mais eficiente e econômico de trabalho e custeio.”
A geração de energia elétrica a partir dos raios solares integra a política de sustentabilidade exigida no projeto de construção da nova sede da Alego. Além desse item, o prédio também  possui um sistema de captação de água gerado pelo sistema de ar-condicionado e da chuva; área permeável e 20 caixas de recarga; uso de ventilação e iluminação natural em áreas comuns, reduzindo consumo de energia; e estrutura para coleta seletiva e separação total de resíduos.
Este conteúdo é protegido por direitos autorais e não pode ser reutilizado. Se você deseja cooperar conosco e gostaria de reutilizar parte de nosso conteúdo, por favor entre em contato com: editors@pv-magazine.com."
https://www.pv-magazine-brasil.com/2024/01/19/neocharge-estima-crescimento-de-200-em-2024/,"CAPACITAÇÃO,EMPRESAS,GERAÇÃO DISTRIBUIDA,TECNOLOGIA P&D,VEÍCULOS ELÉTRICOS,BRASIL",ALESSANDRA NERIS,"JANEIRO 19, 2024",NeoCharge estima crescimento de 200% em 2024,"Com mais de oito anos de atuação no mercado de eletromobilidade, a NeoCharge, empresa especializada em soluções para recarga de veículos elétricos e um braço da NeoSolar, distribuidora de soluções fotovoltaicas off grid, projeta crescimento de 200% esse ano, após um crescimento de 65% no segundo semestre de 2023. A companhia prepara o lançamento de novos carregadores Wallbox e de recarga rápida e planeja retomar os cursos de capacitação sobre eletromobilidade.
Essa projeção nas vendas acompanha os números otimistas para o setor de mobilidade elétrica no Brasil. De acordo com dados da Associação Brasileira de Veículos Elétricos (ABVE), as vendas de veículos eletrificados – híbridos ou 100% elétricos – devem crescer 60% e passar de 150 mil veículos em 2024 e pontos de recarga públicos ou semipúblicos devem chegar a 10 mil postos.
Imagem: Divulgação
O diretor da NeoCharge, Rodrigo Carrau, explica que “a empresa nasceu praticamente junto à NeoSolar, que vislumbrou, lá atrás, a integração de geradores fotovoltaicos e carros elétricos como forma de melhorar o payback. A economia no ‘abastecimento’ dos carros elétricos pode chegar quase a 80% quando comparado com veículos à combustão”.
De acordo com a empresa, com um cálculo simples, é possível comprovar que o quilômetro rodado com energia elétrica é muito mais barato. O gasto médio anual para abastecer um veículo à gasolina (rodando 20.000 km por ano, com um consumo hipotético de 10 km/L e preço de R$ 5,82/L) é de R$ 11.663,28. Já o gasto médio para abastecer com eletricidade (considerando a mesma quilometragem rodada, em um consumo hipotético de 6 km/kWh e preço de R$ 0,72/kWh) é de R$ 2.401,92 por ano. Uma economia de 79%, ou R$ 9.261,36.
Ou seja, se considerado o caso de pessoas que fazem um uso intenso do veículo, como os motoristas de aplicativo, a economia é ainda maior. Rodando 60.000 km por ano e considerando os mesmos consumos hipotéticos, de 10 km/L e preço de R$ 5,82/L, o gasto médio anual para abastecer com gasolina é de R$ 34.920. Já o gasto médio para abastecer com eletricidade é de R$ 7.197, uma economia de quase R$ 28 mil.
A NeoCharge oferece soluções em infraestrutura de recarga para veículos elétricos por meio da distribuição de equipamentos, cursos, serviços técnicos e operação compartilhada de estações de recarga e eletropostos.
“Nossa oferta é bem completa e oferece opções para todos os perfis de clientes, mas o carregamento AC – por meio de carregadores de corrente alternada – é atualmente nosso principal foco. Estamos desenvolvendo e homologando alguns equipamentos DC (de corrente contínua e que proporcionam carregamento rápido) para lançar ainda esse ano. Mas nosso foco está, principalmente, nos carregadores portáteis e Wallbox”, informa Carrau.
O modelo portátil é indicado para cargas de emergência, é transportado no porta-malas e pode ser conectado em uma tomada comum para carregar a bateria de seu carro elétrico quando necessário. Já o modelo Wallbox, em comparação com os modelos portáteis, possuem algumas características que os diferenciam: são mais potente e carregam os veículos com mais agilidade, são mais robustos e duráveis, mais seguros e possuem a função Smart, que permite a conexão do carregador em plataformas de gerenciamento remoto de carregadores, possibilitando controle dos pontos, gestão de acesso, relatórios, cobrança e supervisão de toda a rede de recarga.
“Os modelos Wallbox com a função Smart podem ser facilmente associados a plataformas de gerenciamento, como a da NeoCharge, que são responsáveis pelo controle de quantos kWh foram gastos em cada recarga. Por isso, em condomínios, por exemplo, é possível medir quanto cada morador utilizou de energia e realizar a divisão ao final de cada mês. Ou seja, o carregador para carro elétrico não “roubará” energia do condomínio e nem aumentará gastos de quem não o utilizar. Já em um ou posto de combustível que queiram monetizar os carregamentos, oferecemos a gestão completa desses equipamentos com cobrança via cartão de crédito ou por aplicativo”, esclarece o executivo.
Carrau se diz otimista com as oportunidades do mercado em 2024. “Nossos produtos têm um custo-benefício muito bom pela qualidade do hardware, pela questão estética – já que são equipamentos bonitos -, além da robustez. Até março devemos lançar uma nova geração de carregadores Wallbox com ainda mais conectividade, mantendo as proteções e a qualidade que já entregamos ao mercado.”
A NeoCharge conta com uma rede de parceiros homologados que indica para as instalações. Isso porque, mesmo que os carregadores de entrada tenham a mesma potência de um chuveiro elétrico, sua instalação requer conhecimento técnico específico com atenção às cargas, regras ABNT, correto dimensionamento de disjuntores, entre outros. Para disseminar esse conhecimento, a empresa planeja retomar os cursos de capacitação sobre eletromobilidade e oferecê-los a clientes e parceiros ainda no primeiro semestre desse ano.
Este conteúdo é protegido por direitos autorais e não pode ser reutilizado. Se você deseja cooperar conosco e gostaria de reutilizar parte de nosso conteúdo, por favor entre em contato com: editors@pv-magazine.com."
https://www.pv-magazine-brasil.com/2024/01/19/surpresas-de-verao-brasil-sufoca-enquanto-argentina-fica-de-molho-ate-dezembro/,"EMPRESAS,GERAÇÃO CENTRALIZADA,GERAÇÃO DISTRIBUIDA,INSTALAÇÕES,MERCADOS & POLÍTICAS,OPINIÃO,AMÉRICA CENTRAL E DO SUL,ARGENTINA,BRASIL",SOLCAST,"JANEIRO 19, 2024",Surpresas de verão: Brasil sufoca enquanto Argentina fica de molho até dezembro,"Da pv magazine Global
O El Niño mostrou alguns sinais de padrões esperados em toda a América do Sul, já que ventos anormais mantiveram o Brasil seco e ensolarado, enquanto a Argentina passou por tempestades em dezembro, de acordo com dados analisados pela Solcast, via Solcast API. A produção brasileira de energia solar terá superado as expectativas de dezembro, com a maioria dos ativos de geração compartilhada do país recebendo irradiância bem acima da irradiância média. A Argentina viu tempestades ao longo do mês, embora o sul do país tenha permanecido principalmente seco e visto algumas das maiores irradiações diárias em todo o continente.
Os produtores solares brasileiros se beneficiaram de um dezembro mais ensolarado do que o normal, com a maioria das áreas recebendo de 20% a 30% de irradiância acima da média para o mês. Ventos anormais de leste mantiveram a umidade no interior da amazônica, com redução de nuvens levando a menos chuvas e aumento da irradiância. A maior parte dos ativos brasileiros de geração compartilhada está concentrada no Leste, portanto, obteve uma produção maior do que o esperado ao longo do mês. O Rio de Janeiro também teve um mês ensolarado, recebendo mais irradiação em dezembro do que em 2014.

Sem os efeitos tropicais mais ao norte, a Argentina viu uma massa de ar relativamente úmida, levando a condições ideais para grandes tempestades convectivas. Várias grandes tempestades ao longo do meio do mês, e no dia de Natal trouxeram inundações repentinas e reduziram a irradiação de dezembro bem abaixo da média. Os efeitos localizados podem ser vistos nos números diários de irradiância, inclusive em 18 de dezembro, na foto acima. Por outro lado, o Sul do país recebeu condições muito mais secas e ensolaradas, enquanto em torno da média de dezembro, com irradiância média diária significativamente maior do que o Norte.

Algumas das expectativas normais dos efeitos climáticos do El Niño foram silenciadas, coincidindo com os padrões vistos em todo o mundo. O litoral do Equador e o Peru normalmente registram aumento de chuvas e nebulosidade em anos de El Niño, mas em dezembro deste ano houve irradiação neutra a ligeiramente acima do normal. O deserto do Atacama recebe os mais altos níveis de irradiância do mundo, pois a região fica na costa oeste sob a crista subtropical e é abrigada pela Cordilheira dos Andes. Registrou a maior irradiação diária no continente em dezembro. A segunda mais alta foi em toda a costa e sul da Argentina, onde ventos de oeste e dias ensolarados foram persistentes na costa dos Andes ao longo de dezembro.
A Solcast produz esses números rastreando nuvens e aerossóis com resolução de 1-2 km globalmente, usando dados de satélite e algoritmos proprietários  de IA/ML. Esses dados são usados para conduzir modelos de irradiância, permitindo que a Solcast calcule a irradiância em alta resolução, com viés típico de menos de 2%, e também previsões de rastreamento de nuvem. Essas informações são usadas por mais de 300 empresas que gerenciam mais de 150 GW de ativos solares em todo o mundo.
 
Os pontos de vista e opiniões expressos neste artigo são dos próprios autores, e não refletem necessariamente os defendidos pela pv magazine.
Este conteúdo é protegido por direitos autorais e não pode ser reutilizado. Se você deseja cooperar conosco e gostaria de reutilizar parte de nosso conteúdo, por favor entre em contato com: editors@pv-magazine.com."
https://www.pv-magazine-brasil.com/2024/01/19/startup-norte-americana-desenvolve-paineis-tandem-de-perovskita-e-silicio-com-26-de-eficiencia/,"EMPRESAS,FABRICAÇÃO,MERCADOS & POLÍTICAS,MÓDULOS E FABRICAÇÃO UPSTREAM,TECNOLOGIA P&D,ESTADOS UNIDOS",VALERIE THOMPSON,"JANEIRO 19, 2024",Startup norte-americana desenvolve painéis tandem de perovskita e silício com 26% de eficiência,"Da pv magazine Global
A Tandem PV, uma startup com sede em San Jose, Califórnia, que desenvolve módulos de perovskita e silício empilhados mecanicamente, de quatro terminais, anunciou uma rodada de financiamento de risco de US$ 6 milhões. A empresa, que foi fundada em 2016, disse que usará os recursos para acelerar a comercialização, investindo em pesquisa e desenvolvimento e planos para sua primeira unidade fabril.
A rodada foi liderada pelo investidor existente Planetary Technologies, uma empresa de capital de risco em estágio inicial, juntamente com o novo investidor compatriota Uncorrelated Ventures.
O novo capital é uma validação do progresso do empreendimento em termos de estabilidade, eficiência de conversão de energia e tamanho do módulo, de acordo com o CEO da Tandem PV, Scott Wharton. “Todo mundo fala em durabilidade e estabilidade, mas somos capazes de demonstrá-lo”, disse ele à pv magazine.
“Nossos testes “indoor” estão mostrando 80% de desempenho após 25 anos equivalentes. A eficiência de conversão de energia do módulo tandem encapsulado é de 26% com as células PERC convencionais”, disse Wharton, acrescentando que os módulos medem 100 cm2, enquanto os mais novos medem 300 cm2.
A empresa não forneceu mais detalhes sobre o módulo e a tecnologia da célula.
A Tandem PV é uma das várias equipes que usam o PV Accelerator for Commercializing Technologies (PACT) do Departamento de Energia dos EUA para testes independentes de desempenho e confiabilidade para todas as variedades de módulos fotovoltaicos e minimódulos de perovskita, incluindo testes de campo.
Até o momento, a empresa levantou US$ 27 milhões em capital de risco e apoio do governo. A empresa espera que a última rodada de financiamento ajude a trazer acordos com clientes e comece a construir a primeira fábrica. Os próximos passos para este ano são a validação por terceiros das métricas de desempenho, especificamente eficiência e durabilidade, e a participação em programas de testes ao ar livre.
Os testes de desempenho são o passo mais recente que a Tandem PV, de sete anos, está dando para comercializar seus painéis empilhados mecanicamente. Ela fabricou painéis de 100 cm2 que passaram nos testes acelerados IEC 61215 com parceiros acadêmicos e recebeu dados iniciais sobre a aprovação nos testes IEC 61215 de duração tripla, como disse Colin Bailie, CTO, à pv magazine em uma entrevista de 2023.
A aplicação inicial que a Tandem PV terá como alvo é a energia solar em telhados.
Este conteúdo é protegido por direitos autorais e não pode ser reutilizado. Se você deseja cooperar conosco e gostaria de reutilizar parte de nosso conteúdo, por favor entre em contato com: editors@pv-magazine.com."
