url,tag,author,updated_date,title,contents
https://pv-magazine-usa.com/2021/08/05/sunrise-brief-big-financial-win-means-more-clean-energy-investments-from-ny-green-bank/,"BUSINESS,COMMERCIAL & INDUSTRIAL PV,COMMUNITY,FINANCE,MARKETS,RESEARCH,WORLD",DAVID WAGMAN,"AUGUST 5, 2021",Sunrise brief: Big financial win means more clean energy investments from NY Green Bank,"NY Green Bank attracts $314m investment from Bank of America. The backing will allow the bank to reinvest capital into new projects at a faster rate by making the additional financing available to more projects.
U.S. to net-zero carbon by 2050 will be a steep climb. Worley and Princeton estimated that the U.S. would need to build 800 MW of solar every week for the next 30 years to achieve carbon neutrality.
BlueWave Solar partners with Laketricity to develop floating solar projects. The joint venture aims to develop floatovoltaic projects, first in Massachusetts and then across New England. Other projects are already proving the concept.
Researchers develop a novel design for agrivoltaics. The design uses metal brackets as mounting structures, conventional solar panels, and a grooved glass plate placed between the solar panels. System costs would be around $847/kW.
New York adds $52.5 million in community solar incentives for low-income residents. The program includes low-to-moderate-income subscribers, affordable housing providers, and organizations working with disadvantaged communities.
People on the Move: Nexamp, TerraWatt Infrastructure, NRECA, and more. Job moves in solar, storage, cleantech, utilities, and energy transition finance.
Walmart signs on as anchor tenant for New York community solar.  Nexamp is developing the nearly two dozen solar projects across the Empire State.
 
 
This content is protected by copyright and may not be reused. If you want to cooperate with us and would like to reuse some of our content, please contact: editors@pv-magazine.com."
https://pv-magazine-usa.com/2021/08/05/bluewave-solar-partners-with-laketricity-to-develop-floating-solar-projects/,"BUSINESS,COMMERCIAL & INDUSTRIAL PV,MASSACHUSETTS",DAVID WAGMAN,"AUGUST 5, 2021",BlueWave Solar partners with Laketricity to develop floating solar projects,"BlueWave Solar formed a joint venture with Laketricity, a unit of France-based Ciel & Terre, to develop floating solar photovoltaic, or “floatovoltaics,” projects in Massachusetts with intent to expand throughout the Northeast.
The agreement makes BlueWave Solar Laketricity’s first New England partner.
BlueWave said that water-based projects are important in places like Massachusetts, where building on man-made ponds and reservoirs address land use problems and “ensures no disruption to the state’s terrestrial habitats.”
Floating solar arrays can also be deployed as an alternative to land-based solar farms in areas were land is in short supply or in dry places where it can be installed at man-made reservoirs to help mitigate evaporation. In 2018, the National Renewable Energy Laboratory estimated that installing floating solar photovoltaics on the more than 24,000 man-made U.S. reservoirs could generate about 10% of the nation’s annual electricity production.
In April, Pine Gate Renewables said it would site 9 MW of solar-plus-storage over cranberry bogs in southeast Massachusetts. Solar Carver 1 would be built on a 70-acre site and generate 5 MW of solar energy, accompanied by 30 MWh of battery storage. Solar Carver 3 would have a capacity of 2 MW and include a 12 MWh battery storage system across a 35-acre site.
Image: SPG Solar
To keep the locations dual-use, Pine Gate’s EPC team will engineer the projects to rest on more than 3,300 40-foot-long wooden utility poles, which are expected to be more durable for the wet terrain. The poles will be driven 15-30 feet into the ground to keep the trackers at least 10 feet above the cranberry bogs and allow for annual harvesting.
In March, White Pine Renewables completed a floating solar array in northern California that the company claimed to be the largest in the United States. The 4.8 MW Healdsburg Floating Solar Project was installed on ponds at the City of Healdsburg’s wastewater treatment plant. It will deliver energy to the city under under a 25-year power purchase agreement.
The project site and floating PV approach were chosen to help reduce evaporation and algae growth at the ponds, benefitting nearby vineyards that use the water for irrigation.
BlueWave Solar is currently involved in dual-use solar development, through agrivoltaics, a project design model that allows agricultural production and solar to coexist on the same space.
Ciel & Terre has installed over 230 floatovoltaic projects globally, and 21 projects in the U.S. representing more than 162 MW of power. BlueWave has developed and sold more than 155 MW of solar projects to date.
This content is protected by copyright and may not be reused. If you want to cooperate with us and would like to reuse some of our content, please contact: editors@pv-magazine.com."
https://pv-magazine-usa.com/2021/08/05/researchers-develop-a-novel-design-for-agrivoltaics/,"COMMERCIAL & INDUSTRIAL PV,COST AND PRICES,RESEARCH,CHINA",EMILIANO BELLINI,"AUGUST 5, 2021",Researchers develop a novel design for agrivoltaics,"From pv magazine Global
A group of researchers from the University of Science and Technology of China has developed a design for agrivoltaic projects that, compared to other approaches, is claimed to reduce the shading effect of the PV installation and improve crops’ light environment and the crop growth process, yield, and quality.
“The system has a cost that is 10% higher than conventional agrivoltaic project, but the improved crop yield ensured by the optimized lighting management would compensate for this slightly higher investment,” research co-author, Jan Ingenhoff, told pv magazine.
In terms of economic feasibility, a system developed with the proposed approach should be built at a cost of approximately €715 per kW ($847) installed and a yearly cost for maintenance of about €6.5 per kW ($7.70).
Called Even-lighting Agrivoltaic System (EAS), the design methodology consists of using metal brackets as mounting structures, conventional solar panels, and a grooved glass plate placed between the solar panels. The latter occupies an area that is one-third of the light-receiving area of the entire system.
“With the installation of the glass plate, the density of PV panel arrays is the same as conventional photovoltaic power stations and very close to the optimum design for energy production,” the scientists said.
According to Ingenhoff, any regular glass with a high transmission coefficient can be used, as there are no special requirements, and silicate glass and ultra-white glass may be suitable.
The metal brackets are placed on columns that are high enough to allow the growth of tall plants and the use of big agricultural machinery. The optimum tilt angle for modules was determined to be 23 degrees, which the research group described as a good compromise between electricity generation and construction costs.
The scientists initially calculated and simulated optically the design of the grooved glass plate and then built a first pilot 35 kW agrivoltaic project in Fuyang city, in China’s Anhui province. Common vegetables such as lettuce, broccoli, garlic sprouts, garlic, rapeseed, Jerusalem artichoke, among others, were planted.
A second pilot system was deployed more recently in Hefei city, in the same Chinese province.
The EAS system provided improved growing conditions for some plants. For example, the Jerusalem artichoke harvest increased by over 20%. The reason behind this may be due to better soil moisture retained within the facility area, or that the plant can remain under photosynthesis between 11:00 and 2:00 pm in good sun radiation days, which is typically entering a dormant state for the plant outside, as leaf photosynthesis reaches a maximum in the late morning.
For both facilities, the height at which the solar panels were placed was 2.5 meters. Some of the plants also grew under the system equipped with supplementary LED lamps powered by the solar panels, which provided plants an extra 2 h light time every day compared to other treatments.
“The comprehensive economic benefits of EAS consist of the installation and maintenance costs, the electricity generation benefits and the crops harvest benefits,” the academics said. “To accurately evaluate the comprehensive benefits of planting different crops, we considered the time required to plant different crops and the amount of electricity generated by the PV panels during the crop growth.”
According to their measurements, the use of the transparent grooved glass plate improved the irradiation collected by crops in one day by 47.38% compared to a conventional system, and the yield of Jerusalem artichoke, which needs at least six hours of sun a day, improved by 23%.
Including solar power generation, the system has shown that a farmer’s average income increases by 5.14 times and performed a high land equivalent ratio (LER), which is the measure the productivity and effectiveness of intercropping. It also improved the economic benefits on the farmland per hectare.
“Under the EAS, crops grew fast, and the yield was similar or better than that under the natural state,” the Chinese group said. “By adding supplementary LED lamps into the EAS, the soluble sugar content of lettuce increased by 72.14% and the nitrate content of lettuce decreased by 21.51%.”
More details on the system design can be found in the paper Increasing the comprehensive economic benefits of farmland with Even-lighting Agrivoltaic Systems, published in Plos One.
This content is protected by copyright and may not be reused. If you want to cooperate with us and would like to reuse some of our content, please contact: editors@pv-magazine.com."
https://pv-magazine-usa.com/2021/08/05/ny-green-bank-attracts-314m-investment-from-bank-of-america/,"BUSINESS,FINANCE,MARKETS,NEW YORK",DAVID WAGMAN,"AUGUST 5, 2021",NY Green Bank attracts $314m investment from Bank of America,"NY Green Bank said it closed its first private capital raise, a $314 million transaction with Bank of America.
The backing will allow NY Green Bank to reinvest capital into new projects at a faster rate by making this additional financing available to more projects. It said that its ability to raise the private capital provides “third-party validation of the quality of its transaction portfolio” and demonstrates the “strong and growing appetite” among private-sector investors to gain more exposure to clean energy projects.
NY Green Bank had made cumulative investments of $1.6 billion as of June. It said it has consistently generated positive net income since 2017.
The bank’s pipeline totals $790 million and spans residential, agricultural, and commercial industrial, technology classes including solar, energy efficiency, wind and sustainable transport.
NY Green Bank is a unit of New York State Energy Research and Development Authority (NYSERDA). In addition to the investment from Bank of America, global investment bank Moelis & Company acted as placement agent.
This content is protected by copyright and may not be reused. If you want to cooperate with us and would like to reuse some of our content, please contact: editors@pv-magazine.com."
