url,tag,author,updated_date,title,contents
https://www.pv-magazine-brasil.com/2023/08/10/governo-do-ceara-adere-ao-pacto-do-hidrogenio-e-se-torna-pioneiro-no-brasil/,"MERCADOS & POLÍTICAS,POLÍTICA,BRASIL,CEARÁ",NATALIA BRUSCKY,"AGOSTO 10, 2023",Governo do Ceará adere ao Pacto do Hidrogênio e se torna pioneiro no Brasil,"Com o objetivo de ampliar o intercâmbio de informações e a realização de ações conjuntas para o desenvolvimento do  hidrogênio verde, o acordo foi firmado junto à Associação Brasileira de Energia Eólica e Novas Tecnologias (Abeeólica); Associação Brasileira do Biogás (Abiogás); Associação Brasileira de Energia Solar Fotovoltaica (Absolar); e Câmara Brasil-Alemanha (AHK).
O governador Elmano de Freitas destacou a entrada do estado no Pacto, reforçando o protagonismo do Ceará na pauta de energias renováveis. “Esse pacto reitera o pioneirismo e o compromisso do Ceará com o fortalecimento da produção de hidrogênio verde em nosso estado. O H2V é estratégico para o país e decisivo para o desenvolvimento do Ceará. A criação de uma sensibilização política e social é importante para que o hidrogênio se torne prioridade em todo o país. Temos no hidrogênio verde um setor que pode alavancar diversos outros setores. É algo único para o Ceará. Após produzir a primeira molécula, a nossa meta agora é produzir hidrogênio verde em grande escala. É um dia feliz para todos nós”, disse.
Com a entrada do governo do Ceará no Pacto, devem ser tomadas iniciativas em prol do desenvolvimento do hidrogênio renovável, como arcabouço regulatório; um novo mercado de aplicação de hidrogênio renovável; a promoção do desenvolvimento socioeconômico através da economia de hidrogênio renovável e do hidrogênio de origem renovável; além da disseminação das oportunidades de hidrogênio renovável aos seus associados e à sociedade, fazendo com que seja trabalhada a viabilidade econômica da produção e uso de hidrogênio verde de diversas formas.
“Acreditamos que era necessário juntarmos forças em prol do desenvolvimento das energias renováveis como um todo. Desta maneira, esperamos conseguir influenciar o crescimento do hidrogênio verde no Brasil”, destacou Ansgar Pinkowski, diretor de transição energética e sustentabilidade da AHK.
A vice-presidente do conselho da Absolar, Camila Ramos, parabenizou o governo do Estado pela iniciativa e projetou novas ações para um futuro próximo. “Gostaria de agradecer a adesão do Ceará e seu pioneirismo. Tenho certeza que iremos trabalhar o quanto antes em prol do crescimento e do desenvolvimento do hidrogênio renovável em todo o Brasil”, disse.
Este conteúdo é protegido por direitos autorais e não pode ser reutilizado. Se você deseja cooperar conosco e gostaria de reutilizar parte de nosso conteúdo, por favor entre em contato com: editors@pv-magazine.com."
https://www.pv-magazine-brasil.com/2023/08/10/governo-do-parana-anuncia-projeto-de-energia-solar-nas-escolas/,"GERAÇÃO DISTRIBUIDA,INSTALAÇÕES,MERCADOS & POLÍTICAS,POLÍTICA,BRASIL",NATALIA BRUSCKY,"AGOSTO 10, 2023",Paraná anuncia projeto de energia solar nas escolas,"O Governo do Paraná anunciou um novo programa, o Escola Solar, que vai destinar R$ 6 milhões para a instalação de usinas fotovoltaicas nos colégios estaduais em 20 unidades na primeira etapa. O edital de licitação que deve ser publicado no dia 18 de agosto pela Paranaeducação, vinculada à Secretária de Estado da Educação, para selecionar as empresas que vão executar as obras, será dividido em dois lotes.
O programa de eficiência enérgica da Secretaria da Educação vai equipar as escolas estaduais com energia renovável, adotando a tecnologia de usinas fotovoltaicas para a produção de energia. As usinas fotovoltaicas terão potência instalada de 75 kW e as primeiras 20 instituições de ensino foram selecionadas de acordo com a incidência solar na região onde estão e também com o nível de consumo de cada uma.
Com a implantação das placas solares nos telhados, as escolas vão poder suprir suas necessidades de consumo, economizar na conta de energia e também disponibilizar o eventual excedente para a rede. Além de o projeto gerar economia de recursos com energia elétrica, também incentiva a sustentabilidade nas instituições de ensino da rede estadual, por ter um caráter pedagógico ao ensinar sustentabilidade aos alunos.
Este conteúdo é protegido por direitos autorais e não pode ser reutilizado. Se você deseja cooperar conosco e gostaria de reutilizar parte de nosso conteúdo, por favor entre em contato com: editors@pv-magazine.com."
https://www.pv-magazine-brasil.com/2023/08/10/brasil-adicionou-5-6739-mw-de-geracao-centralizada-no-primeiro-semestre/,"GERAÇÃO CENTRALIZADA,INSTALAÇÕES,BRASIL",LÍVIA NEVES,"AGOSTO 10, 2023","Brasil adicionou 5.673,9 MW de geração centralizada no primeiro semestre","A matriz elétrica brasileira alcançou este ano, até o final de julho, uma ampliação de 5.673,9 MW. A Agência Nacional de Energia Elétrica (Aneel) registrou a entrada em operação comercial de 176 usinas, sendo 79 eólicas (2.713,8 MW), 61 solares fotovoltaicas (2.295,1 MW), 25 termelétricas (531,4 MW), oito pequenas centrais hidrelétricas (122,2 MW) e três centrais geradoras hidrelétricas (11,4 MW). Plantas solares e eólicas representam, juntas, 88,3% da capacidade instalada no ano.
Com os 4,5 GW adicionados entre janeiro e junho na geração distribuída, fonte solar acrescentou ao todo 6,8 GW no primeiro semestre.
As usinas com operação iniciada no primeiro semestre estão localizadas em 18 estados de todas as regiões brasileiras. Em ordem decrescente, apresentam maiores resultados até o momento os estados da Bahia (1.684,7 MW), Minas Gerais (1.315,7 MW), Rio Grande do Norte (1160,3 MW) e Piauí (460,9 MW).
Participação da solar na matriz
O Brasil somou 194.387,49 MW de potência fiscalizada, de acordo com dados do Sistema de Informações de Geração da Aneel. Desse total em operação, ainda de acordo com o SIGA, 83,69% das usinas são consideradas renováveis. A participação de solar na capacidade de geração centralizada é de 5,18%.
Se considerada a geração distribuída, que acumulava 22.844 MW até o final de julho, junto com a centralizada, a matriz elétrica brasileira somaria 217.231 MW, dos quais 32.000 MW da fonte solar, ou 14,7%.
Este conteúdo é protegido por direitos autorais e não pode ser reutilizado. Se você deseja cooperar conosco e gostaria de reutilizar parte de nosso conteúdo, por favor entre em contato com: editors@pv-magazine.com."
https://www.pv-magazine-brasil.com/2023/08/10/marrocos-lanca-licitacao-para-projeto-de-400-mw-400-mwh-de-energia-solar-e-armazenamento/,"EMPRESAS,MERCADOS & POLÍTICAS,ÁFRICA DO NORTE,MARROCOS",EMILIANO BELLINI,"AGOSTO 10, 2023",Marrocos lança licitação para projeto de 400 MW/400 MWh de energia solar e armazenamento,"Da pv magazine Global 
A Agência Marroquina de Energia Sustentável (Masen) lançou uma licitação para o projeto Noor Midelt III – uma usina fotovoltaica de 400 MW que será conectada a 400 MWh de armazenamento em bateria.
A agência disse que o projeto aumentará a capacidade solar do projeto Noor Midelt, que também inclui as usinas solares Noor Midelt I e Noor Midelt II, para 1,6 GW.
Os desenvolvedores interessados terão até 20/10 para se pré-qualificar para a licitação.
Em julho, Masen publicou a lista dos 24 concorrentes que concorrem à construção do projeto Noor Midelt II. planejado para a região de Drâa-Tafilalet, no nordeste do Marrocos, terá 400 MW de capacidade. Incluirá uma bateria, com duas horas de armazenamento.
A usina Noor Midelt I, uma usina solar de 800 MW que combina CSP e PV com 5 horas de capacidade de armazenamento, será construída e operada pela EDF Renewables (35%), Abu Dhabi Future Energy CO (30%), a própria Masen (25 %) e Verde da África (10%).
Este conteúdo é protegido por direitos autorais e não pode ser reutilizado. Se você deseja cooperar conosco e gostaria de reutilizar parte de nosso conteúdo, por favor entre em contato com: editors@pv-magazine.com."
https://www.pv-magazine-brasil.com/2023/08/10/a-franca-visa-481-gw-de-energia-solar-ate-2030-140-gw-ate-2050/,"MERCADOS & POLÍTICAS,POLÍTICA,MUNDO",MARIE BEYER,"AGOSTO 10, 2023","A França visa 48,1 GW de energia solar até 2030, 140 GW até 2050","Da pv magazine Global
A primeira-ministra francesa Élisabeth Borne apresentou um novo plano ao Conselho Nacional de Transição Ecológica (CNTE), delineando metas revisadas de energia renovável e implantação solar para 2030. O plano inclui um aumento no orçamento de transição energética de € 30 bilhões (US$ 32,8 bilhões) para € 37 bilhões.
As metas atualizadas especificadas no plano visam a França atingir 48,1 GW de capacidade fotovoltaica até 2030 e 140 GW até 2050. Para atingir a meta de 2030, o plano prevê a implantação anual de 3.700 MW a 5.500 MW de novos sistemas fotovoltaicos. No final de março, a França atingiu 17,15 GW de capacidade fotovoltaica instalada cumulativa.
Este conteúdo é protegido por direitos autorais e não pode ser reutilizado. Se você deseja cooperar conosco e gostaria de reutilizar parte de nosso conteúdo, por favor entre em contato com: editors@pv-magazine.com."
