url,tag,author,updated_date,title,contents
https://www.pv-magazine.com/2021/06/14/upscaling-pv-powered-irrigation-in-india/,"COMMERCIAL & INDUSTRIAL PV,COMMUNITY,UTILITY SCALE PV,INDIA",UMA GUPTA,"JUNE 14, 2021",Upscaling PV-powered irrigation in India,"From pv magazine India
India’s mission to deploy some 2 million off-grid solar-powered irrigation pumps by 2022 has made sluggish progress, with only one-eighth of the target achieved so far, according to a new report from the Institute for Energy Economics and Financial Analysis (IEEFA).
“Solar-powered irrigation is a huge opportunity for India,” said author Kashish Shah, IEEFA research analyst. “But despite the clear multiple commercial benefits, the rollout of solar pumps has been much slower than anticipated.”
The report calls for a renewed push on the installation of solar-powered pumps under the Ministry of New and Renewable Energy’s INR34,422 crore ($4.7 billion) PM-KUSUM scheme, which has a 2022 target of 30.8 GW of solar capacity (revised from 25.75 GW earlier), including about 2 million off-grid pumps.
According to data from the Ministry of New and Renewable Energy, against an ambitious target of installing 2 million off-grid solar pumps, only 246,000 pumps were installed by the end of fiscal 2019-20. The PM-KUSUM scheme should have accelerated the process of pump deployment, however, the report noted only 8,900 pumps were deployed in the 12 months after the formalization of the scheme.
By comparison, the number of fossil-fuel-powered water pumps in India totals more than 8.8 million.
Benefits, bottlenecks
Compared to utility-scale solar, distributed PV generation reduces the need to expand transmission capacity and doesn’t require large land areas.
Shah said increasing distributed solar capacity through the installation of solar pumps could support India’s near-term renewable energy target of 175 GW by 2022, including 100GW of solar capacity.
“Replacing fleets of diesel generators in the agricultural sector would reduce emissions and air pollution and contribute to the government’s efforts to promote a self-reliant India by reducing reliance on costly, subsidized diesel imports,” Shah said. “Solar pumps would also reduce the burden on distribution companies (discoms) of providing highly subsidized power to the agricultural sector. This could potentially even lead to reductions in tariffs for commercial and industrial consumers who cross-subsidize electricity for agriculture.”
The report cited a lack of coordination among state-level bodies, affordability, asset ownership, and technology as key challenges impeding India’s uptake of solar pumps. It noted information asymmetry across state discoms, agricultural departments, minor irrigation departments, and other state-designated departments in the scheme implementation. The report also said that different models of asset ownership – farmer, discom, or developer – could play a significant role in the resulting viability of the pump sets.
“When it comes to implementing the scheme by the states, it’s a case of one size does not fit all,” says Shah.  “Different models of pump ownership could work for different states or even different districts, depending on the dynamics of the agricultural and power sectors in that area. Each state needs to zero in on which mode of solarising its agricultural power demand – off-grid or on-grid – works best for them.”
The report looked at the progress of solar pump deployment in three states: Gujarat, Maharashtra and Andhra Pradesh. It noted the ambitious approach taken by Andhra Pradesh to solarize the state’s entire agricultural demand through distributed solar, as well as using the enormous cost advantages of centralized utility-scale solar as an alternative. 
This content is protected by copyright and may not be reused. If you want to cooperate with us and would like to reuse some of our content, please contact: editors@pv-magazine.com."
https://www.pv-magazine.com/2021/06/14/takeaways-from-the-pvel-2021-reliability-scorecard/,"MODULES & UPSTREAM MANUFACTURING,TECHNOLOGY AND R&D,EUROPE",JOHN FITZGERALD WEAVER,"JUNE 14, 2021",Takeaways from the PVEL 2021 reliability scorecard,"From pv magazine USA
PV Evolution Labs (PVEL) has released its 2021 Reliability Scorecard. The annual publication is a collection of results from solar panel stress tests focused on specified and verified subcomponent bills of materials.
A few highlights from this year’s results:
The group’s newest product test, the Mechanical Street Sequence (MSS), seeks to discover how larger solar panels now deployed in more complex environments will potentially develop microcracks and degrade over the next several decades.
PVEL said that its MSS aligns with the forthcoming IEC 63209 technical specification for extended reliability testing. It said the IEC 61215 certification standard only requires static mechanical loading, and PV modules will pass if they exhibit no visible damage when evaluated by eye and have less than 5% power loss.
To start all testing processes, including this MSS, PVEL observes the production of each solar panel they test, from the opening of the raw materials through every step of production, until they are palletized and shipped with tamper-proof tape. The below electroluminescence imaging shows a  panel’s progression through the three main steps of MSS – static mechanical load (SML) – #2, dynamic mechanical load (DML) – #3, and environmental stress – #4.

In the SML testing phase, modules are mounted on two rails and secured at typical ground-mount clamping locations. They then undergo three rounds of one-hour downforce and one-hour up-force at 2,400 pascals.
For the DML testing, there are 1,000 cycles of alternating positive and negative loading at 1,000 pascals. As part of the simulated environmental stress, modules undergo 50 thermal cycles from 85 C to -40 C, then 10 cycles of humidity freeze, high heat, and humidity followed by a rapid drop to freezing temperatures.
The report said that, in general, solar panels from the last five years show higher levels of field degradation. This should not be too surprising as more than half of the world’s solar deployment has occurred over the same time period.
If we were to focus on one technology among the many which make up a modern solar panel, the report suggested that module encapsulation should get our attention. Variations in the encapsulant formulations were the primary factor affecting the degradation rate.
An aerial-infrared analysis submitted with the report by Heliolytics showed that a manufacturer’s size does not correlate with field reliability. As we can see in the chart, below, large- and small-scale manufacturers (blue versus green, respectively) are  evenly mixed.

The list of manufacturers with a bill of materials that performed well enough to garner a spot on the PVEL Top Performers list can be found in their Twitter feed. Below, we’ve highlighted the manufacturers that made the list for the first time this year:
While the solar panel failure rates noted here are trivial for residential and small commercial customers with even 100 panels, the higher failure rates will add significant labor hours when it comes to gigawatt-scale facilities.
This content is protected by copyright and may not be reused. If you want to cooperate with us and would like to reuse some of our content, please contact: editors@pv-magazine.com."
https://www.pv-magazine.com/2021/06/14/solar-makes-a-lot-of-sense-at-ground-level-too/,"TECHNOLOGY AND R&D,UTILITY SCALE PV,UNITED STATES",JOHN FITZGERALD WEAVER,"JUNE 14, 2021","Solar makes a lot of sense at ground level, too","From pv magazine USA
As we humans scramble to address climate change with renewable energy, the real paydirt in solar might actually be dirt.
Think of it in terms of multiple scientific and economic interests converging on the soil just below your photovoltaic panels. The panels provide an opportunity to restore natural ecosystems and reduce soil erosion, all while reducing the electric power grid’s carbon footprint.
For example, Minnesota and Iowa used to be home to an estimated 25 million acres of tallgrass prairie. Due to agriculture, these ecologically diverse habitats are almost functionally extinct, as barely 1% of those tallgrass acres remain.

From an emissions-capturing standpoint, these native grassland habitats are important because they sequester almost 60% more carbon per acre than modern agricultural activities.
Seeking to understand the environmental effects solar power has on these properties, a collaboration between researchers from the U.S. Department of Energy’s Argonne National Laboratory, the National Renewable Energy Laboratory, and the University of Minnesota analyzed solar power facilities that integrate natural grasses.
The study modeled and averaged solar facilities in seven states in the Upper Midwest. Their modeling suggests that native grasses planted as part of 10 GW of solar generation capacity would sequester 129.3 tons of carbon per hectare; that is 65% and 35% greater than either an agriculture or a solar-turfgrass scenario, respectively.
The researchers said that this volume of emission sequestration is equivalent to the emission savings of 5,000 GWh of fossil generation shifting to solar power, which would correspond to greater than 3 GW of solar capacity.
The paper found that in addition to carbon sequestration, native grassland habitats also produce a three-fold increase in habitat for local pollinators, like bees and butterflies, when compared to pure agricultural usage. The threat of erosion from poor management still looms for midwestern soil. Solar and native grasslands would protect this fertile asset from losses of up to 9,000 tons of sediment erosion annually, and would retain more than 40,000,000 cubic meters of water from runoff annually.
Prior observational research has shown that solar panels create microclimates in semi-arid regions by significantly increasing the water retention in soil, which in turn increases sheep and cow grazing grasses by 90%.
Land conscious
The solar industry is already conscious of land use challenges. Deals sometimes fall apart because people push back over issues related to land use. Their concerns include perceived home value depreciation, the losses of a rural lifestyle, and the risk of agricultural capacity depletion.
Two years ago, solar developer Silicon Ranch launched a “holistic solar land management program” known as Regenerative Energy. The group’s aspirations include:
Recently, a 2.4 GW portfolio of agrivoltaic projects changed hands, while a large developer put out a call for innovative agrivoltaic ideas, and solar interests in France started an agrivoltaic association.
We are going to build the solar. We already have the sites. The question is, how will it get built?
Solar vs corn?
And speaking of agriculture, did you know that all growth in corn use since 1980 went to make alcohol for fuel? Roughly 25% of the United States’ corn acreage is used specifically to generate biofuels, which represents only around 10% of all transportation fuel.
‘Crops to create that amount of fuel is currently using somewhere between 14 and 20 million acres of land. If that same acreage were used for solar electricity generation, we would produce an eye-popping 1.8-2.5 TWdc. Some estimates are that the U.S. could reach 100% clean electricity with roughly 1.1 TW of wind and solar combined.
And because an additional 25% to 40% of existing electricity generation would electrify 100% of our transportation sector, 2 TW of solar would generate roughly double what’s needed to fully electrify U.S. transportation.
That leads us to a startling conclusion. Solar fields are capable of producing roughly 16 times more transportation energy per acre than our current biofuel processes, while also providing a much needed opportunity to restore our native ecosystems.
This content is protected by copyright and may not be reused. If you want to cooperate with us and would like to reuse some of our content, please contact: editors@pv-magazine.com."
