url,tag,author,updated_date,title,contents
https://www.pv-magazine.com/2021/10/07/solar-tiles-for-roof-coatings-shelters-facades/,"MODULES & UPSTREAM MANUFACTURING,RESIDENTIAL PV,TECHNOLOGY AND R&D,ITALY",EMILIANO BELLINI,"OCTOBER 7, 2021","Solar tiles for roof coatings, shelters, facades","Italian manufacturer EnergyGlass, a unit of Italian turnkey PV system supplier GruppoSTG, has developed solar tiles for building-integrated PV (BIPV) applications.
The company, which operates a 1.5 MW factory in Cantú, in the northern Italian province of Como, claims that the tiles can be used to replace conventional roofs, or they can be integrated into existing rooftops. The BIPV products are fabricated with 4 mm, double- laminated safety glass.
“Slides, brackets and drains placed on the back enable an easy and quick installation” GruppoSTG Technical Director Sofia Tiozzo Pezzoli told pv magazine. “The color of the front glass can be chosen depending on the project.”
Tiozzo Pezzoli said that the tiles are produced to integrate the stratification of the safety glass with interposed photovoltaic cells. They are available in three different variants. The TG-EGM45ST tile was conceived for rooftop coatings and is available in black and white versions, as well as a colored variant with power outputs of 245 W, 240 W, and 220 W, respectively, and efficiencies of 16.17%, 15.84%, and 14.52%.
“The third version is available in different colors,” Tiozzo Pezzoli said. The 45-cell monocrystalline product measures 1,010 mm x 1,500 mm x 9 mm and weighs in at 34.5 kg.
 
Image: EnergyGlass
A smaller 24-cell version of this variant is the TG-EGM24ST, with power outputs of 135 W, 130 W, and 120 W, respectively, and efficiencies of 17.65%, 17.0%, and 15.69%. Its size is 765 mm x 1,000 mm x 9 mm and it weighs 17.3 kg.
The second variant is the TG-SPL-BA tile, which is designed for solar facades. The 45-cell devices are also available in black, white, and colored versions, with a power of 295 W, 290 W, and 265 W. Efficiencies include 19.54%, 19.21%, and 17.56%. They measure 1,000 mm x 1,510 mm x 9 mm and weigh 34.5 kg. The smaller 24-cell version, the TG-SPL-AA, measures 1,025 mm x 1,000 mm x 9 mm and weighs 23 kg.
Image: EnergyGlass
The third product in the series is the TG-EGM tile, which is intended for use in shelters. The products are available with different levels of transparency, ranging from 20% to 43%. The efficiency ranges from 9.57% to 13.82% and its power output ranges from 85 W to 210 W.
Image: EnergyGlass
The first two products in the series are encapsulated with EVA film and the third one with PVB. All of the products have an operating temperature coefficient of -0.38% per degree Celsius and feature an IP68 enclosure. They all come with 25-year linear power output guarantees and 10-year product guarantees.
“The company is currently investing in more R&D and the commercialization of new BIPV solutions through new strategic partnerships,” Tiozzo Pezzoli said.
This content is protected by copyright and may not be reused. If you want to cooperate with us and would like to reuse some of our content, please contact: editors@pv-magazine.com."
https://www.pv-magazine.com/2021/10/07/rwe-signs-deal-with-greek-utility-aiming-for-2-gw-of-coal-mine-solar/,"HIGHLIGHTS,MARKETS,POLICY,STRATEGIC ALLIANCES,UTILITY SCALE PV,GREECE",ILIAS TSAGAS,"OCTOBER 7, 2021",RWE signs deal with Greek utility aiming for 2 GW of coal-mine solar,"The RWE Renewables subsidiary of German utility RWE, and its PPC Renewables counterpart of Greece’s Public Power Corporation (PPC) last night agreed to form a joint venture to co-develop renewables projects in Greece.
Under the arrangement, RWE will hold 51% of the joint business, and the PPC the balance.
A press release issued to announce the arrangement stated: “PPC Renewables will contribute nine solar projects [with] up to a combined [generation capacity] total of 940 MW (870 MWac), and which are located in northern Greece’s west Macedonian region, within the boundaries of the former Amyntaio open pit lignite mine.”
The statement added: “RWE Renewables has secured a Greek photovoltaic project pipeline of similar size for the purpose of including it in the joint venture,” without offering further detail of the source of the latter projects. pv magazine has learned, however, the RWE Greek solar projects are part of a portfolio under development by Athens-based public limited company Idea. 
The press release stated the PV projects concerned are in various stages of development, with operations to start from 2023-25.
Speaking to pv magazine in June, an RWE spokesperson chose not to provide further information regarding the policy mechanisms supporting the Greek investment. 
The clean energy arm of the PPC has secured contracts for three solar farms with a total generation capacity of 230 MW in previous rounds of Greece's renewables tenders. All three facilities concern the same western Macedonia site, for which the PPC landed premium top-up payments – on top of the wholesale power price – of €0.04911/kWh for 200 MW of the capacity plus payments of €0.06488 and €0.05382/kWh for the two 15 MW slices of the solar field which make up the balance of the 230 MW power plant.
The RWE-PPC joint venture can be expected to participate in future rounds of the public tenders, which offer successful bidders premium payments under 20-year contracts. With the Greek utility's clean power operation already working on a 50 MW unsubsidized solar farm in southern Greece, there is also the possibility the new business could venture into commercial PPA-driven project development.
The new partnership is set to be another boost for the Greek energy transition, with the government having committed to phase out coal from its electricity generation by 2025 and the PPC aiming to develop 3 GW of solar capacity in the nation's former mining regions.
RWE's renewables unit can inject much-needed capital and technical expertise into the Greek market, and the PPC can offer local knowledge and well established relationships with stakeholders and clients, given the state-owned generator is Greece’s largest and oldest electric utility. PPC Renewables chief executive Konstantinos Mavros, the driving force behind the new partnership, has welcomed RWE to his country adding, the PPC is looking “forward to co-developing projects of unprecedented scale.”
The German clean power developer recently told pv magazine the company’s “first strategic focus is on the development and implementation of solar farms,” before adding: “We always have an eye on developments for energy storage facilities and hybrid projects across all European markets, wherever it makes economic sense, including Greece.” That suggests the initial ex-coal mine ambition could be expanded into other areas of Greece's energy transition.
Katja Wünschel, chief operating officer for onshore wind and solar photovoltaics in Europe and Asia-Pacific for RWE Renewables, has said “European collaborations, like our partnership with [the] PPC, are essential to making the energy transition happen.” Greece also offers the German company the chance to build out a solar portfolio which stretched to 229 MW in operation at the end of last year, with just 56 MW of it in Europe.
This content is protected by copyright and may not be reused. If you want to cooperate with us and would like to reuse some of our content, please contact: editors@pv-magazine.com."
https://www.pv-magazine.com/2021/10/07/perovskite-solar-pioneers-honored-with-prestigious-prize/,"MODULES & UPSTREAM MANUFACTURING,TECHNOLOGY,TECHNOLOGY AND R&D,WORLD",MAX HALL,"OCTOBER 7, 2021",Perovskite solar pioneers honored with prestigious prize,"Seven solar researchers from academic institutions in Japan, Korea, Europe and the U.S. have had their pioneering work on perovskite cells honored with the award of the 25th Rank Prize for Optoelectronics.
Nam-Gyu Park, whose group was the first to report a long-term stable perovskite solar cell, in 2012; and Sang Il Seok, whose group laid the groundwork for higher efficiency perovskite devices, are among the seven winners of the optoelectronic award founded by British industrialist Lord J Arthur Rank, who was head of the Rank film group.
Park, professor of chemical engineering at Sungkyunkwan University in Suwon, South Korea; and Seok, whose group presented the first inorganic-organic hybrid perovskite heterojunction solar cell to operate differently from perovskite-sensitized solar cells, were joined in the honor by Michael Graetzel, professor at Switzerland's Ecole Polytechnique Fédérale de Lausanne (EPFL); Akihiro Kojima, of chemical manufacturer Zeon Corporation; Science Robotics editor Mike Lee; Tsutomu Miyasaka, founder of photoelectric conversion start-up Peccell Technologies and a fellow of the research
center of advanced science and technology at the University of Tokyo; and Henry Snaith FRS, co-founder and chief scientific officer of perovskite solar manufacturer Oxford PV.
Pick up your copy of the October edition of pv magazine for an in-depth look at the fire hazard concern of lithium-ion battery systems, with a focus on the blaze at Australia’s Victorian Big Battery which caught the world’s attention. Also, Saul Griffith, the guru of electrification, talks to pv magazine about reshaping the climate conversation; we delve into the evolution of residential PV in China; and we continue our coverage of global PV supply-chain issues and ask: Is there an alternative to Made in China?
Graetzel, who directs the laboratory of photonics and interfaces at EPFL, pioneered research on energy and electron transfer reactions in mesoscopic systems and their use to generate electricity and fuels from sunlight. His dye-sensitized solar cells led to the advent of perovskite solar cells and the professor was recently ranked top of a Stanford University list of 100,000 leading global scientists.
Kojima studied the optical properties of organic-inorganic layered perovskite compounds in 2004, before receiving a master of engineering in photo-optical engineering from Tokyo Polytechnic University, and undertook research on applying organo-metal halide perovskite compounds to dye-sensitized solar cells as visible light sensitizers from 2005 to 2010, when he received a doctor of philosophy in multidisciplinary sciences from The University of Tokyo, before Joining Peccell Tech.
Lee conducted research at the Paul Scherrer Institute in Switzerland as a Marie Skłodowska-Curie Intra-European fellow and later completed his doctoral training at the University of Oxford. He was also a co-founding editor of Nature Electronics.
‘Tom' Miyasaka's research specializes in photo-electrochemistry and hybrid photovoltaic cells, especially halide perovskite devices, and his achievements include the Chemical Society of Japan Award, the PVSEC Hamakawa Award and the Clarivate Analytics Citation Honor Award, all in 2017; the Japan Society of Applied Physics Achievement Award, in 2019; and last year's Ichimura Academic Award.
Park's group is now undertaking research on materials and device engineering for high efficiency perovskite solar cells and are developing high-efficiency technology along with long-term stable, large-area processing technologies for commercialization, and Seok and his colleagues hold the world record for the most efficient perovskite solar cell, at 25.5%, as certified by the U.S' National Renewable Energy Laboratory.
Snaith discovered perovskites could produce extremely efficient solar cells when integrated into a simple thin-film device which would be easy and cheap to manufacture and his Oxford PV business is working to commercialize perovskite cell production.
The two, biennial Rank Prizes recognize achievements in optoelectronics and nutrition, reflecting the business interests of the philanthropist after whom they are named, who also headed the Hovis food group.
This content is protected by copyright and may not be reused. If you want to cooperate with us and would like to reuse some of our content, please contact: editors@pv-magazine.com."
https://www.pv-magazine.com/2021/10/07/french-consortium-develops-bio-based-pv-modules/,"MODULES & UPSTREAM MANUFACTURING,TECHNOLOGY AND R&D,FRANCE",EMILIANO BELLINI,"OCTOBER 7, 2021",French consortium develops bio-based PV modules,"CEA-Liten, the new energy technologies and nanomaterials unit of the French Alternative Energies and Atomic Energy Commission, and French tech supplier Roctool have joined forces to build PV modules made of recycled, bio-based materials.
The consortium said it is currently testing the production of panels with a size of 300 mm x 300 mm via a technique based on Rotcool Light Induction Tooling (LIT) technology, which purportedly reduces production times by a factor of four. Roctool said LIT technology consists of a standalone solution to manufacture composites parts.
“It offers a full and accurate control over the parameters amongst which temperatures and pressures – including vacuum through the composite material,” the company said. “Its automation is delivered by a specific control unit, with the ability to connect to previous and next process cells.”
The tool is designed for production projects with difficult requirements involving temperature and pressure controls.
“Proposed as a turnkey solution, the LIT can be seamlessly integrated into current or future production lines,” said Roctool. “Its controls are fully compatible with potential specific automation around the process, and its software can export quality control data in order to optimize the production rate or the product’s performances through designed iterations. CEA noticed the relevance and performance possible thanks to these increasingly innovative and eco–responsible processes.”
CEA-Liten said in a separate press release that “several series of panels are still being tested to verify their performance and mechanical resistance, and aging tests of at least 1,000 hours are also being carried out.” It added that the first module prototypes will be unveiled between the end of this year and the beginning of 2022.
The partners did not reveal any additional technical details about the manufacturing process or the materials that will be used. The research project is part of the asyPOC initiative, which is 100% financed by the authorities in France's Auvergne-Rhône–Alpes region.
This content is protected by copyright and may not be reused. If you want to cooperate with us and would like to reuse some of our content, please contact: editors@pv-magazine.com."
https://www.pv-magazine.com/2021/10/07/renewables-system-with-76-share-of-pv-could-halve-indian-electricity-costs-by-2050/,"COMMERCIAL & INDUSTRIAL PV,COMMUNITY,INSTALLATIONS,MARKETS,RESIDENTIAL PV,TECHNOLOGY AND R&D,UTILITY SCALE PV,INDIA",UMA GUPTA,"OCTOBER 7, 2021",Renewables system with 76% share of PV could halve Indian electricity costs by 2050,"From pv magazine India
India could cut its overall cost of electricity in half and reach net zero before 2050 by developing a 100% renewable energy power system, according to a power system modeling study by Wärtsilä and the Finnish Lappeenranta-Lahti University of Technology.
The modeling shows that increasing the share of renewable energy in the overall installed power capacity from 25% today to 100% by 2050 could cut the cost of meeting electricity demand by 48%, from INR 6,000 ($81)/MWh in 2020 to INR 3,120/MWh in 2050. This cost, also referred to as overall system cost, includes the levelized cost of electricity generation, the cost of energy storage, transmission interconnections, and the costs of curtailing surplus renewable generation.
Renewables, when paired with flexible generation technologies (thermal balancing power plants and energy storage), can improve the affordability of electricity while ensuring the reliability of system operations, according to the study. 
Power demand in India is expected to increase to 5,921 TWh (with 1,023 GW of peak demand), up 340% from 1,345 TWh in 2020. The modeling confirms that India can affordably meet this increased load through renewable energy, aided by low-cost solar. 
However, the study states the total system capacity must be scaled up to an unprecedented degree to serve this increased load through mid-day peaks and to charge energy storage resources such as batteries to offset intermittent renewable energy generation. It projects that 4,000 GW of installed capacity is needed for a 100% renewable system, a 10-fold increase in the overall power capacity in 2020. Solar would make up 76% (3,076 GW) of this total installed capacity by 2050. This would also be supported by a total wind capacity of around 410 GW by 2050, combined with hydro and carbon-neutral gas.
To achieve the projected solar share, new PV installations must rise by 885%, from 7 GW a year today, to 69 GW a year by 2035, rising to 79 GW a year between 2035 and 2050, according to the study.
Wärtsilä’s modeling shows that flexibility through energy storage is key to achieving the cost-optimal renewable baseload system – to shift generation when it is surplus, during the day, to times when renewables are not available, during evening or the night. Thermal balancing power plants, backed by battery energy storage, must also be deployed to manage sudden surges in demand or drops in renewable generation.
The modeling shows that India would need about 99 TWh of storage capacity and a total of 187 GW of fast-start load-following gas engines by 2050 to provide rapid grid balancing. Storage capacity includes storage in the form of both batteries and gas storage, mainly in the form of sustainable fuels (green hydrogen, and methane, for example). Together, these technologies could form the backbone of a reliable, cost-optimal power system for India.
“Increasing renewable energy could also generate major new revenues from hydrogen production, creating a technology market worth $39.8 billion,” said Wärtsilä and the Finnish Lappeenranta-Lahti University of Technology.
This content is protected by copyright and may not be reused. If you want to cooperate with us and would like to reuse some of our content, please contact: editors@pv-magazine.com."
https://www.pv-magazine.com/2021/10/07/sandia-offers-public-access-to-csp-archives/,"TECHNOLOGY AND R&D,UTILITY SCALE PV,UTILITY SCALE STORAGE,UNITED STATES",RYAN KENNEDY,"OCTOBER 7, 2021",Sandia offers public access to CSP archives,"From pv magazine USA
The US Energy Department’s Sandia National Laboratories has created a global archive of concentrated solar power (CSP) documents, which it is making fully accessible to the public.
Sandia has been studying utility-scale solar power since the 1960’s. Its National Solar Thermal Test facility was commissioned in 1978, spurred by the oil crisis of 1973. Documents detailing the design, construction, and research conducted at the multi-megawatt CSP facility had been shelved in backrooms and basements.
CSP uses large mirrors to concentrate sunlight onto a receiver tower to generate electricity. Sandia’s team has spent the last few years cataloging the history of the technology, organizing reports, blueprints, photos, among other items.
“A lot of ‘what if’ questions can be answered if you look at what was documented back in the day,” said Ken Armijo, project lead and CSP researcher at Sandia. 
In addition to tens of thousands of Sandia documents, the lab sourced information from collaborators in Australia, South Africa, Germany, and the U.S. Department of Energy.
Armijo said that successful research projects are often shared widely in the research community through peer-reviewed papers, presentations, and reports, but unsuccessful projects are often be shared more quietly and reluctantly. The knowledge of failures can be lost when a researcher retires, which may lead to the repeat of mistakes by new researchers. The archive aims to serve to address these knowledge gaps.
Some of the projects in the archive include the Solar One, a Sandia-led 10 MW CSP project that delivered power to Barstow, California from 1982 to 1986. It was upgraded in 1995 to the Solar Two, which used a high-temperature molten-salt receiver to store heat and convert it to electricity after the sun set.
Now, the lab has received a $25 million award from the DOE to build a third-generation, particle-based CSP plant with expanded storage capacity. Documents from the archive could inform the construction of the plant.
The archive project is funded by the Department of Energy Solar Technologies Office and was kicked off by Chuck Andraka, a retired Sandia engineer. Sandia said it is interested in creating archives for other renewable energy technologies, as well.
This content is protected by copyright and may not be reused. If you want to cooperate with us and would like to reuse some of our content, please contact: editors@pv-magazine.com."
https://www.pv-magazine.com/2021/10/07/doping-delivers-improved-performance-for-perovskite-solar-cells/,"MODULES & UPSTREAM MANUFACTURING,TECHNOLOGY AND R&D,AUSTRALIA",DAVID CARROLL,"OCTOBER 7, 2021",Doping delivers improved performance for perovskite solar cells,"From pv magazine Australia
Researchers at the University of Queensland (UQ) have said that advances in nanomaterial technology have allowed them to manufacture perovskite-based solar cells that are as efficient as conventional silicon-based cells, but without the high costs and complex manufacturing processes.
While silicon-based solar cells continue to dominate the market, perovskite solar cells have attracted enormous attention because of their high-efficiency potential and low-cost production. However, the technology still has some drawbacks, including poor long-term stability.
The UQ research team, based at the Australian Institute for Bioengineering and Nanotechnology, have used titanium carbide nanosheets doped with cesium (Cs) to fabricate perovskite solar cells, which they claim deliver a PV efficiency of up to 21.57%, with “excellent thermal stability.”
“Our theoretical and experimental analysis reveal that cesium plays an important role in improving perovskite crystallization and thus leads to enlarged crystal grains, long-lived carrier lifetimes, and reduced charge recombination,” the academics said.
Research team leader Professor Joe Shapter said the results, published in the journal Cell Reports Physical Science, show that the efficiency and thermal stability of the doped cells significantly outperformed those that were not doped.
“The PSCs that had doped cells showed a remarkable solar conversion efficiency that exceeded 21%,” he said. “This gives us hope that solar energy can continue to develop and improve as one of the most effective renewable and sustainable energy technologies.”
Shapter said the research, which involved scientists from École polytechnique fédérale de Lausanne in Switzerland and Griffith University in Queensland, addresses an urgent need for alternative energy sources that are capable of providing efficient and reliable energy production.
“Silicon-based solar cells remain the dominant first-generation product making up 90% of the market, but demand was high for cells that could be manufactured without their high prices and complexity,” he said. “Our research contributes to intensive efforts to develop various types of solar cells with the aim of realising efficient, stable and low-cost replacements for present silicon-based technology.”
The findings come with solar module manufacturing giants LONGi Green Energy, JinkoSolar, Trina Solar, JA Solar and Risen Energy warning that rising material costs – including the price of polysilicon, which is used in an estimated 98% of solar PV cells – could trigger a solar panel shortage.
In an open letter published earlier this week, the Chinese-based manufacturers said their output is expected to fall as rising costs, an ongoing shipping “crisis”  and government-imposed restrictions take a toll on the supply chain.
The Chinese government has ordered silicon metal refineries in the country to cut output to about 70% amid a power crisis.
“The raw material supply gap is serious,” the companies said in the statement. “This imbalance will break the supply chain and seriously endanger the healthy and sustainable development of the industry. Prices are also soaring.”
The manufacturers said the price of solar-grade polysilicon has surged in recent weeks by 9.1%, while the price of solar glass has also climbed, up 18.2% year on year. There has also been a 35% increase in the cost of adhesive films used in the production of modules.
The manufacturers said the capacity shortage will make it difficult for customers to meet installation targets, warning that many signed orders will be lost.
“The … industry has been caught in a difficult situation,” they said.
The companies said they are actively coordinating resources and making every effort to “stabilize supply,” but they implored customers to considering postponing projects and to avoid the end-of-year “rush to install.”
This content is protected by copyright and may not be reused. If you want to cooperate with us and would like to reuse some of our content, please contact: editors@pv-magazine.com."
