url,tag,author,updated_date,title,contents
https://www.pv-magazine-brasil.com/2023/09/21/mme-detalha-proposta-de-certificacao-de-hidrogenio-verde/,"ARMAZENAMENTO DE ENERGIA,HIDROGÊNIO,MERCADOS & POLÍTICAS,POLÍTICA,BRASIL",PV MAGAZINE,"SETEMBRO 21, 2023",MME detalha proposta de certificação de hidrogênio verde,"Ministério de Minas e Energia (MME) participou, na quarta-feira (20/09), do 5º Webinário Internacional de Certificação de Hidrogênio: Procedimentos de Certificação para indústria, organizado pelo projeto H2Brasil. A  coordenadora-geral de Energias e Tecnologias de Baixo Carbono e Inovação, Patricia Naccache, detalhou que uma das propostas principais do Projeto de Lei do Hidrogênio é a certificação considerando a intensidade de carbono e não necessariamente a origem da produção.
“A segregação de mercados por rotas limita modelos de negócios, afeta escalas e reduz a competitividade”, explica a representante do MME. Ela lembrou também que o Brasil tem potencial técnico para produzir 1,8 gigatoneladas de hidrogênio por ano e que já existem mais de US$30 bilhões em projetos de hidrogênio anunciados para o país.
O objetivo do evento foi apresentar, por meio da experiência de estudos de casos sobre Certificação de Hidrogênio, os desafios enfrentados pela indústria brasileira na busca pela certificação para atendimento ao mercado internacional.
De acordo com Naccache, a ideia é que o Brasil desenvolva uma certificação em harmonização com a discussão global. “Hoje, o país está interagindo com organismos internacionais para certificação e comércio de hidrogênio”, pontuou. Ainda no evento, foi destacada assinatura conjunta, em julho deste ano, do MME com mais de 15 países para acelerar o desenvolvimento do comércio internacional de hidrogênio renovável e de baixo carbono.
Este conteúdo é protegido por direitos autorais e não pode ser reutilizado. Se você deseja cooperar conosco e gostaria de reutilizar parte de nosso conteúdo, por favor entre em contato com: editors@pv-magazine.com."
https://www.pv-magazine-brasil.com/2023/09/21/como-os-integradores-podem-potencializar-as-vendas-no-mercado-solar/,"CAPACITAÇÃO,CONSUMO,EMPRESAS,EVENTOS,FINANÇAS,GERAÇÃO DISTRIBUIDA,INSTALAÇÕES,MERCADOS & POLÍTICAS,BRASIL",ALESSANDRA NERIS,"SETEMBRO 21, 2023",Como os integradores podem potencializar as vendas no mercado solar,"Durante a Imersão GD, evento que marcou o lançamento oficial do seu Estudo GD 2023, a Greener apresentou os resultados da pesquisa realizada junto a 2.492 empresas integradoras de todo o país entre os dias 01/07 e 31/07 deste ano, incluindo um recorte das 100 empresas integradoras, dentro do universo da pesquisa, que mais venderam nesse primeiro semestre.
A apresentação foi seguida por uma roda de conversa que contou com a participação do analista de Inovação e Pesquisa da Greener, Marco Ramos, e dois especialistas no segmento, a CEO da Energias GP, Tatiane Carolina, especializada em gestão de processos para o setor elétrico e apresentadora do podcast Boteco Solar, e Lincon Beraldo, CEO da LB Company, empresa de consultoria em processos comerciais.
Foi unanimidade durante o painel que resiliência, maturidade e experiência são essenciais para o sucesso dos integradores do setor solar. Nesse sentido, o recorte dos TOP 100 integradores da pesquisa da Greener revelou que as empresas com mais tempo de mercado fizeram mais orçamentos, venderam mais e contaram com um processo mais eficiente em relação a conversão das oportunidades geradas.
Tatiana enfatizou que o investimento em capacitação faz toda a diferença. “Os TOP 100 integradores do recorte da pesquisa da Greener aprenderam com o tempo, muitas vezes sozinhos, e hoje há uma infinidade de conteúdos disponíveis para acelerar o conhecimento. Mas a capacitação por si não é fórmula de sucesso, é preciso colocar o aprendizado em prática. O que faz o integrador performar no segmento é um somatório de esforços”, diz.
“A base da pirâmide de integradores da pesquisa investe R$ 5 mil reais anuais em capacitação, enquanto os TOP 100 investem R$ 20 mil. Isso, além de toda a resiliência de quem está há mais tempo no mercado, que aprende com os processos dia após dia faz com que os mais experientes saiam na frente e tenham mais conversão e vendas”, comenta Lincon.
O CEO da LB Company também compartilhou sua visão sobre o que é ser um bom vendedor. “Venda tem a ver com propósito, isso tem a ver com transformar a vida das pessoas, já que os integradores têm a oportunidade de oferecer aos clientes uma geração de energia limpa e verde e que vai libertá-los das concessionárias de energia”.
Para Lincon, venda não é um problema, é um processo. E quanto mais propostas e treinamentos forem realizados pelas empresas, maior será o entendimento das objeções do consumidor. “Portanto, a dica de ouro que deixo é treinar o time comercial e focar nos processos que os resultados virão”.
A pesquisa da Greener identificou que a dificuldade na aprovação de crédito e a taxa de juros elevadas dos financiamentos foram os principais fatores de não conversão de vendas citados pelos integradores e Tatiana avalia que muitas empresas não têm um processo estruturado para ajudar os clientes a obter crédito.
“Muitas vezes os consumidores precisam desse suporte e no meu podcast entrevistei um integrador que confessou: ou ele foca nas vendas ou ajuda os clientes no processo de aprovação. O que vejo é que muitos integradores esquecem do pós-venda, de contar com os processos adequados para verificar a geração dos sistemas instalados, oferecer novos produtos e serviços e isso é vital para o sucesso nos negócios”.
Em uma entrevista para a pv magazine durante a apresentação do estudo GD, com Lincon Beraldo deu mais algumas dicas valiosas para as empresas integradoras de energia solar.
“Minha visão é de que ainda falta inteligência de dados em grande parte da cadeia, incluindo alguns distribuidores. Na era do ChatGPT, alguns integradores ainda fazem uso do Excel como ferramenta para diversas áreas. É preciso organizar a base de dados dos clientes de forma mais automatizada direcionando a comunicação e as ofertas para oferecer níveis diferentes de atendimento para clientes fiéis, para aquele integrador que compra uma vez ou outra e para aqueles que compraram apenas uma vez”, conclui.
Este conteúdo é protegido por direitos autorais e não pode ser reutilizado. Se você deseja cooperar conosco e gostaria de reutilizar parte de nosso conteúdo, por favor entre em contato com: editors@pv-magazine.com."
https://www.pv-magazine-brasil.com/2023/09/21/quanto-duram-as-baterias-residenciais-de-energia-solar/,"ARMAZENAMENTO DE ENERGIA,GERAÇÃO DISTRIBUIDA,INSTALAÇÕES,TECNOLOGIA P&D,MUNDO",RYAN KENNEDY,"SETEMBRO 21, 2023",Quanto duram as baterias residenciais de energia solar?,"Da pv magazine Global
O armazenamento de energia residencial está cada vez mais popular no segmento de energia solar doméstica em mercados como o norte-americano. Uma pesquisa recente da SunPower em mais de 1.500 residências descobriu que cerca de 40% dos americanos se preocupam com quedas de energia regularmente. Dos entrevistados que consideram a instalação de equipamentos de energia solar residencial, 70% disseram que planejam incluir baterias de armazenamento de energia.
Além de fornecer energia de reserva durante interrupções, muitas baterias são integradas com tecnologia que permite o agendamento inteligente da importação e exportação de energia. O objetivo é maximizar o valor do sistema solar das residências. E algumas baterias são otimizadas para integrar também carregadores de veículos elétricos.
Nos EUA, as taxas de instalação de baterias em projetos solares residenciais aumentaram constantemente em 2020. Naquele ano, 8,1% dos sistemas fotovoltaicos residenciais conectaram baterias, de acordo com o Lawrence Berkeley National Laboratory, e em 2022 essa taxa subiu para mais de 17%.
Os períodos de garantia podem oferecer um exame das expectativas do instalador e do fabricante sobre a vida útil de uma bateria. Os períodos de garantia comuns são normalmente de cerca de 10 anos. A garantia da bateria Enphase IQ, por exemplo, termina em 10 anos ou 7.300 ciclos, o que ocorrer primeiro.
O instalador solar Sunrun disse que as baterias podem durar entre cinco a 15 anos. Isso significa que uma substituição provavelmente será necessária durante os 20 a 30 anos de vida de um sistema solar.
A expectativa de vida útil da bateria é impulsionada principalmente pelos ciclos de uso. Como demonstrado pelas garantias dos produtos LG e Tesla, limites de 60% ou 70% da capacidade são garantidos por meio de um certo número de ciclos de carga.
Dois cenários de uso impulsionam essa degradação: excesso de carga e carga por gotejamento, de acordo com o Instituto Faraday. Overcharge, ou excesso de carga, é o ato de empurrar a corrente para uma bateria que está totalmente carregada. Isso pode fazer com que ela superaqueça, ou até mesmo potencialmente pegue fogo.
A carga por gotejamento envolve um processo em que a bateria é continuamente carregada até 100%, e inevitavelmente ocorrem perdas. O salto entre 100% e pouco menos de 100% pode elevar as temperaturas internas, diminuindo a capacidade e a vida útil.
Outra causa de degradação ao longo do tempo é a perda de íons de lítio móveis na bateria, segundo o Faraday. As reações laterais na bateria podem reter lítio utilizável livre, reduzindo assim sua capacidade gradualmente.
Embora as temperaturas baixas possam impedir o desempenho de uma bateria de íons de lítio, elas na verdade não degradam a bateria nem encurtam sua vida útil. A vida útil geral da bateria, no entanto, diminui em altas temperaturas, segundo o Instituto Faraday.
Isso ocorre porque o eletrólito que fica entre os eletrodos se quebra em temperaturas elevadas, fazendo com que a bateria perca sua capacidade de transporte de íons de lítio. Isto pode reduzir o número de íons de lítio que o eletrodo pode aceitar em sua estrutura, esgotando a capacidade da bateria de íons de lítio.
É recomendado pelo Laboratório Nacional de Energias Renováveis (NREL) instalar uma bateria em um local fresco e seco, de preferência uma garagem, onde o impacto de um incêndio (uma ameaça pequena, mas não zero) pode ser minimizado. As baterias e os componentes ao seu redor devem ter espaçamento adequado para permitir o resfriamento, e verificações regulares de manutenção podem ser úteis para garantir a operação ideal.
O NREL disse para, sempre que possível, evitar descargas profundas repetidas das baterias, pois quanto mais descarregadas, menor será a vida útil. Se a bateria doméstica é descarregada profundamente todos os dias, pode ser hora de aumentar o tamanho do banco de baterias.
As baterias em série devem ser mantidas com a mesma carga, disse a NREL. Embora todo o banco de baterias possa exibir uma carga geral de 24 volts, pode haver tensão variável entre as baterias, o que é menos benéfico para proteger todo o sistema a longo prazo.
Além disso, o NREL recomendou que os pontos de ajuste de tensão corretos sejam definidos para carregadores e controladores de carga, conforme determinado pelo fabricante.
As inspeções também devem ocorrer com frequência, disse o NREL. Algumas questões para avaliar incluem vazamento (acúmulo na parte externa da bateria), níveis de fluido apropriados e tensão igual. O NREL disse que cada fabricante de bateria pode ter recomendações extras, portanto, é fundamental verificar a manutenção do equipamento e estar atento às especificações do manual do fabricante.
Este conteúdo é protegido por direitos autorais e não pode ser reutilizado. Se você deseja cooperar conosco e gostaria de reutilizar parte de nosso conteúdo, por favor entre em contato com: editors@pv-magazine.com."
https://www.pv-magazine-brasil.com/2023/09/21/reciclagem-de-paineis-solares-por-meio-de-tecnologia-de-agua-supercritica/,"EMPRESAS,FABRICAÇÃO,MERCADOS & POLÍTICAS,MÓDULOS E FABRICAÇÃO UPSTREAM,TECNOLOGIA P&D,MUNDO",LIOR KAHANA,"SETEMBRO 21, 2023",Reciclagem de painéis solares por meio de tecnologia de água supercrítica,"Da pv magazine Global
Um grupo de pesquisa brasileiro desenvolveu um novo método de reciclagem para painéis solares que utiliza tecnologia de água supercrítica. Água supercrítica é água aquecida e pressurizada além do seu ponto de ebulição normal. Neste estado, possui propriedades únicas que o tornam um poderoso solvente.
“A água atinge o estado supercrítico quando a temperatura e a pressão ultrapassam 374,3 °C e 22,1 MPa, respectivamente. Suas propriedades físico-químicas são bastante diferentes neste estado, promovendo a decomposição de compostos orgânicos perigosos e persistentes”, explicaram os pesquisadores, lembrando que o processo proposto não requer produtos químicos tóxicos ou perigosos.
Com o novo método, as células solares são primeiro quebradas em pedaços menores e colocadas num reator. Esse reator é constantemente alimentado com água que é aquecida e pressionada até um estado supercrítico. Este processo resulta em produtos gasosos, líquidos e sólidos.

Para avaliar a taxa de degradação orgânica dos painéis, os acadêmicos testaram o método com temperaturas, vazões, tempos de reação e composições de soluções variadas. Em seguida, executando mais um método de otimização, o grupo alcançou uma taxa de degradação orgânica de 99,6% a 550 °C, com tempo de reação no reator de 60 minutos, vazão volumétrica de 10 mL/m e uma solução de alimentação composta por uma solução aquosa de composto orgânico residual e peróxido de hidrogênio (H2O2/Rorg).
“A solução aquosa de compostos orgânicos residuais, composta por metanol, acetonitrila e clorofórmio, foi obtida a partir de análises por cromatografia líquida de alta eficiência (HPLC)”, enfatizaram. “O processamento de resíduos de painéis solares em condições supercríticas foi realizado para avaliar a possibilidade de tratamento simultâneo de resíduos sólidos e águas residuais líquidas orgânicas, diminuindo a quantidade de água limpa consumida”.
Subprodutos do processo de reciclagem
Em relação aos produtos sólidos resultantes do método, através das diferentes condições supercríticas, foi observada uma eficiência média de recuperação de metal de 76%. Entre os metais recuperados estavam alumínio, magnésio, cobre e prata. “Essa possibilidade de recuperação torna o processo mais atrativo economicamente”, acrescentaram.
Quanto aos subprodutos gasosos, sua composição média utilizando H2O2/Rorg foi de 72,9% de dióxido de carbono, 18,6% de hidrogênio e 8,6% de nitrogênio. “Os resultados obtidos destacam uma das principais vantagens da tecnologia da água supercrítica, ou seja, a possibilidade de utilização de águas residuais para o tratamento de resíduos eletrônicos produzindo apenas gases não nocivos em ambiente controlado”, sublinham os cientistas.
O subproduto líquido produzido neste método de reciclagem consistia principalmente de derivados fenólicos, como 3-etilfenol, bisfenol A e 4-isopropilfenol. Esse novo subproduto pode então passar por outro tratamento por meio da tecnologia de água supercrítica, removendo quase 100% do carbono orgânico total. “Isso permite o reaproveitamento dos resíduos líquidos em diversos processos de tratamento de resíduos de painéis solares”, acrescentou o grupo brasileiro.
A abordagem proposta é apresentada no artigo “Reciclagem simultânea de resíduos de painéis solares e tratamento de compostos orgânicos persistentes via tecnologia de água supercrítica”, publicado na Environmental Pollution. Foi escrito por cientistas da Universidade Estadual de Maringá, da Universidade Federal de Goiás e da Universidade de São Paulo.
Este conteúdo é protegido por direitos autorais e não pode ser reutilizado. Se você deseja cooperar conosco e gostaria de reutilizar parte de nosso conteúdo, por favor entre em contato com: editors@pv-magazine.com."
