url,tag,author,updated_date,title,contents
https://www.pv-magazine.de/2021/08/30/thinktanks-legen-handlungsempfehlungen-fuer-die-energiepolitik-nach-der-bundestagswahl-vor/,"HIGHLIGHTS DER WOCHE,POLITIK,DEUTSCHLAND",PETRA HANNEN,30. AUGUST 2021,Thinktanks legen Handlungsempfehlungen für die Energiepolitik nach der Bundestagswahl vor,"Das „ehrgeizigste Klimaschutz-Sofortprogramm auf den Weg bringen, das es in Deutschland je gegeben hat“ ist aus Sicht von Agora Energiewende, Stiftung Klimaneutralität und Agora Verkehrswende notwendig, um die im Juni vom Bundestag verabschiedeten Klimaziele zu erreichen. Für die neue Legislaturperiode legen die drei Denkfabriken daher in ihrem Impulspapier „Das Klimaschutz-Sofortprogramm – 22 Eckpunkte für die ersten 100 Tage der neuen Bundesregierung“ 22 Handlungsempfehlungen mit schnell umsetzbaren Maßnahmen vor. Diese wollen sie als Input für die Parteien verstanden wissen, die nach der Bundestagswahl in Koalitionsverhandlungen eintreten werden. Neben übergreifenden Vorschlägen zum gesetzlichen Rahmen, zum Haushalt und zu weiteren Finanzfragen gibt es weitere Vorschläge für die für den Klimaschutz relevanten fünf Schlüsselsektoren Strom, Verkehr, Industrie, Gebäude und Landwirtschaft. Die Vorschläge seien so konzipiert, dass sie in den ersten 100 Tagen vom Kabinett beschlossen werden und noch im Sommer 2022 in Kraft treten können.
Als übergreifende Maßnahme plädieren die drei Organisationen unter anderem dafür, einen Klima-Haushalt aufzustellen, der jährlich zusätzlich mehr als 30 Milliarden Euro für Klimaschutzinvestitionen bereitstellt. Denn das kommende Jahrzehnt bis 2030 müsse eine Dekade des Investierens werden: in klimaneutrale Energieversorgung, Industrieanlagen, Verkehr, Gebäudesanierung und eine Wasserstoff-Infrastruktur. Zentral sei zudem, die klimafreundliche Alternative wirtschaftlich attraktiver als die fossile Variante zu machen. Erneuerbarer Strom aus Photovoltaik und Windkraft wird als zentraler Baustein für ein Energiesystem ohne Kohle, Öl und Gas gesehen – von der Prozesswärme in der Industrie über die Nutzung von Wärmepumpen in Gebäuden bis hin zu Mobilität mit Elektroautos und im öffentlichen Nah- und Fernverkehr sowie für grünen Wasserstoff.
Auch der Bundesverband Neue Energiewirtschaft (bne) fordert eine Neuausrichtung der Rahmenbedingungen für Strom, Wärme und Mobilität nach der Bundestagswahl. In dem Papier „Energiewende für alle – was nun zu tun ist“ unterbreitet der bne dafür insgesamt 16 Vorschläge. Unter anderem müsse der Stromsektor bis 2035 vollständig auf erneuerbare Energien umgestellt werden. Das EEG müsse zum Innovationsgesetz für Erneuerbare Energien weiterentwickelt und das Feld der Ausschreibungen für spezifische Technologien und innovative Lösungen geöffnet werden. Zudem müssten Steuern, Abgaben und Umlagen im Energiesystem umfassend reformiert werden.
Dieser Inhalt ist urheberrechtlich geschützt und darf nicht kopiert werden. Wenn Sie mit uns kooperieren und Inhalte von uns teilweise nutzen wollen, nehmen Sie bitte Kontakt auf: redaktion@pv-magazine.com."
https://www.pv-magazine.de/2021/08/30/pfalzsolar-vereinbart-seinen-ersten-deutschen-ppa-mit-konzernmutter-pfalzwerke/,"MÄRKTE,DEUTSCHLAND",PETRA HANNEN,30. AUGUST 2021,Pfalzsolar vereinbart seinen ersten deutschen PPA mit Konzernmutter Pfalzwerke,"Pfalzsolar hat zum ersten Mal einen Stromabnahmevertrag in Deutschland abgeschlossen. Demnach werden die Pfalzwerke bis 2025 Strom aus dem Solarpark Dankmarshausen in Thüringen abnehmen, der sich im Eigenbestand von Pfalzsolar befindet. Wie das Unternehmen am Montag mitteilte, werden knapp 750 Kilowatt der Anlagenleistung klassisch über das EEG vermarktet, während der andere Teil – rund 1340 Kilowatt Leistung – über den mit der Konzernmutter geschlossenen Stromabnahmevertrag läuft.
Pfalzsolars Finanzchef Matthias Fehrentz zufolge ist der gesicherte Preis für die Laufzeit für das Unternehmen sehr attraktiv. „Gleichzeitig konnte durch die Wahl eines monatlichen Toleranzbandes für die Stromlieferung ein attraktives Chancen-Risiko-Verhältnis erzielt werden, das bei hoher Erzeugung zusätzliche Erlöse ermöglicht“, so Fehrentz. Der Solarpark Dankmarshausen mit einer Gesamtleistung von über zwei Megawatt wird in einer Projektgesellschaft betrieben und ist laut Pfalzsolar Teil eines längerfristig angelegten strategischen Aufbaus seines Eigenbestands. Aus Sicht der Pfalzwerke könnten PPAs perspektivisch ein wichtiger Marktbaustein zum Managen einer erfolgreichen und nachhaltigen Energiewende werden.
Dieser Inhalt ist urheberrechtlich geschützt und darf nicht kopiert werden. Wenn Sie mit uns kooperieren und Inhalte von uns teilweise nutzen wollen, nehmen Sie bitte Kontakt auf: redaktion@pv-magazine.com."
https://www.pv-magazine.de/2021/08/30/naturstrom-realisiert-erstmals-solarpark-mit-batteriespeicher/,"HIGHLIGHTS DER WOCHE,MÄRKTE,DEUTSCHLAND",PETRA HANNEN,30. AUGUST 2021,Naturstrom realisiert erstmals Solarpark mit Batteriespeicher,"Im thüringischen Henschleben baut die Naturstrom AG erstmals einen Solarpark in Kombination mit einem Speicher. Auf ehemaligen Deponieflächen soll eine Freiflächenanlage mit 7,5 Megawatt Nennleistung entstehen. Eine direkt im Park angeschlossene Batterie mit einer Speicherkapazität von über 1000 Kilowattstunden soll Ertragsspitzen in der Mittagszeit aufnehmen und dann in späten Abend- oder frühen Morgenstunden wieder abgeben. Die Inbetriebnahme der Anlage soll im Herbst oder Winter erfolgen.
Naturstrom-Chef Thomas E. Banning zufolge will das Unternehmen mit seinem Projekt in Henschleben dank des Speicher die Erzeugung flexibilisieren und so den gewonnenen Solarstrom möglichst netz- und systemfreundlich einspeisen. Dafür habe das Unternehmen im vergangenen Jahr einen Zuschlag in einer Innovationsausschreibung gewonnen. Zudem könne die Standortkommune mit regelmäßigen Pachteinnahmen rechnen, da die Anlage teilweise auf gemeindeeigenen Flächen errichtet werde. Darüber hinaus will Naturstrom im Zuge des Anlagenbaus auch die Rekultivierung angrenzender Deponieflächen übernehmen.
Mit dem Projekt betritt der Düsseldorfer Ökostromanbieter eigenen Angaben zufolge nicht nur technisch Neuland, sondern auch mit Blick auf die strategische Aufstellung seines Erzeugungsgeschäfts. Denn finanziert und betrieben werde die Anlage als erstes Neubauprojekt der Ende 2020 gegründeten Naturenergy GmbH & Co. KGaA. Unter dem Dach dieses Unternehmens will Naturstrom zukünftig Bau, Betrieb und die Finanzierung der Erneuerbaren-Kraftwerke in der Gruppe organisieren. Zur Finanzierung habe Naturenergy kürzlich ein Crowdfunding-Angebot gestartet, teilte Naturstrom weiter mit, mit dem neben der Freiflächenanlage in Henschleben weitere Solarparks, der Ankauf alter Windenergieanlagen und generell neue Erneuerbaren-Projekte angeschoben werden sollen. Das Beteiligungsangebot soll die neue Gesellschaft stärken und Bürgern die Möglichkeit geben, den Erneuerbaren-Ausbau zu unterstützen und durch gute Zinserträge daran zu partizipieren.
„Die technischen und die finanziellen Herausforderungen an die Energieerzeugung auf Basis regenerativer Quellen nehmen drastisch zu“, so Banning. „Um in diesem Umfeld mithalten zu können, haben wir uns bei Naturstrom entschieden, neue Wege zu gehen und unseren Geschäftsbereich Energieerzeugung unter dem Dach der Naturenergy neu und noch schlagkräftiger aufzustellen.“ Der Naturstrom-Chef leitet in Personalunion auch die neue Gesellschaft.
 
Dieser Inhalt ist urheberrechtlich geschützt und darf nicht kopiert werden. Wenn Sie mit uns kooperieren und Inhalte von uns teilweise nutzen wollen, nehmen Sie bitte Kontakt auf: redaktion@pv-magazine.com."
https://www.pv-magazine.de/2021/08/30/aiwanger-zerpflueckt-laschets-energie-masterplan/,"HIGHLIGHTS DER WOCHE,POLITIK,DEUTSCHLAND",PETRA HANNEN,30. AUGUST 2021,Aiwanger zerpflückt Laschets „Energie-Masterplan“,"Turbo statt Veto, Innovation statt Ideologie, Zukunftsmut statt Regelungswut, nachhaltiges Wachstum oder (rot-grünes) Schrumpfprogramm – darüber entscheiden Kanzlerkandidat Armin Laschet (CDU) zufolge die Wähler am 26. September. Das geht aus dem Text „Mein Energie-Masterplan” hervor, den Laschet als Gastbeitrag in der „Welt am Sonntag” veröffentlichte. Darin verspricht er unter anderem, als Kanzler Erleichterungen für den Ausbau der erneuerbaren Energien durchzusetzen, zudem die komplette Abschaffung der EEG-Umlage, mehr Tempo beim Netzausbau, schnellere Planungsverfahren sowie ein Programm für zinslose Darlehen für Solardächer. Dazu schreibt Laschet: „Damit niemand aus finanziellen Gründen auf ein Solardach verzichtet, legen wir das KfW-Deutschland-Dach-Programm auf, mit dem jeder Eigentümer ein zinsloses Darlehen für ein Solardach erhält.” Zudem müsse jeder eine marktgerechte Einspeisevergütung erhalten, der über den Eigenverbrauch hinaus seine gesamte Dachfläche für Photovoltaik nutze und über einen netzdienlichen Speicher verfüge.
„Was Laschet will, haben wir in Bayern seit zwei Jahren schon umgesetzt“, so Bayerns Wirtschaftsminister Hubert Aiwanger (Freie Wähler). „Ich habe als Wirtschaftsminister ein Photovoltaik-Speicherprogramm ins Leben gerufen, mit dem mittlerweile 50.000 neue Photovoltaik-Dachanlagen initiiert wurden. Höchste Zeit, dass dieses erfolgreiche Modell bundesweit umgesetzt wird.“ Das von Laschet vorgeschlagene zinslose Darlehen für Photovoltaik-Dachanlagen ist laut Aiwanger bei null Prozent Zinsen „nicht der große Brüller“. Und die von Laschet angestrebte „marktgerechte Einspeisevergütung“ sei ein schwammiger Begriff und im Zweifel schon gegeben. „Wichtiger wäre bei Kleinanlagen von Privatleuten eine unkompliziertere Einspeisung und Verwendung des Mieterstroms, ohne dafür einen Steuerberater und drei Gutachter zu brauchen“, so Aiwanger.
Dieser Inhalt ist urheberrechtlich geschützt und darf nicht kopiert werden. Wenn Sie mit uns kooperieren und Inhalte von uns teilweise nutzen wollen, nehmen Sie bitte Kontakt auf: redaktion@pv-magazine.com."
https://www.pv-magazine.de/2021/08/30/epfl-ladestationen-koennen-wasserstoffproduktion-und-energiespeicherung-kombinieren/,"SPEICHER,WASSERSTOFF,SCHWEIZ",PETRA HANNEN,30. AUGUST 2021,EPFL: Ladestationen können Wasserstoffproduktion und Energiespeicherung kombinieren,"Mit einem neuen System wollen Wissenschaftler des Labors für physikalische und analytische Elektrochemie (LEPA) der Schweizer Universität EPFL zwei wichtige Felder der Energiewende gleichzeitig abdecken: die Produktion von grünem Wasserstoff und die Energiespeicherung. In der Zeitschrift „Cell Reports Physical Science“ haben sie das System vorgestellt. Dieses verbindet eine herkömmliche Redox-Flow-Batterie mit katalytischen Reaktoren, die sauberen Wasserstoff mit Hilfe der durch die Batterie fließenden Flüssigkeit erzeugen. „Der Wasserstoff wird durch einen katalytischen Prozess hergestellt, bei dem die Energie aus der Batterie genutzt wird, um Wassermoleküle in ihre beiden Bestandteile, Wasserstoff und Sauerstoff, aufzuspalten“, so LEPA-Doktorand Danick Reynard. Dieser Wasserstoff könne als sauber bezeichnet werden, wenn die zum Laden der Batterien verwendete Energie erneuerbar sei.
Dem Wissenschaftler zufolge bietet die Technologie sowohl für die Wasserstoffproduktion als auch für die Energiespeicherung mehrere Vorteile. Denn herkömmliche Redox-Flow-Batterien könnten, sobald sie voll aufgeladen seien, keine weitere Energie mehr speichern. In dem LEPA-System hingegen könne die Batterie, sobald sie vollständig aufgeladen seien, Flüssigkeit in die externen Reaktoren abgeben. „Diese wiederum erzeugen Wasserstoff, der gespeichert und später verwendet werden kann, wodurch Speicherplatz in der Batterie selbst frei wird“, so Reynard. Der vom LEPA-System erzeugte Wasserstoff sei rein und müsse für eine optimale Lagerung nur getrocknet und komprimiert werden. Zudem sei das System sicherer als herkömmliche Systeme, da es den Sauerstoff und den Wasserstoff getrennt und nicht gleichzeitig erzeuge, was die Gefahr einer Explosion verringere.
Vor allem das Verkehrswesen ist laut LEPA ein sinnvoller Anwendungsbereich des Systems. Denn es könne nicht nur Wasserstoff produzieren, sondern auch als Puffer dienen, um Nachfragespitzen auszugleichen.
 
Dieser Inhalt ist urheberrechtlich geschützt und darf nicht kopiert werden. Wenn Sie mit uns kooperieren und Inhalte von uns teilweise nutzen wollen, nehmen Sie bitte Kontakt auf: redaktion@pv-magazine.com."
