url,tag,author,updated_date,title,contents
https://www.pv-magazine.com/2023/05/12/april-irradiance-up-for-us-and-mexico-down-for-canada/,"COMMERCIAL & INDUSTRIAL PV,MARKETS,OPINION & ANALYSIS,RESIDENTIAL PV,UTILITY SCALE PV,MEXICO,NORTH AMERICA",,"MAY 12, 2023","April irradiance up for US and Mexico, down for Canada","During April, most of the lower 48 US states and Mexico saw solar irradiation above climate normals, due to cloud-bearing, low-pressure system activity being more focused over Canada and the Gulf Coast, according to data collected by Solcast, a DNV company, via its Solcast API Toolkit.
Positive departures from normal April irradiation benefitted solar producers from California, Baja California and Sonora right across the continent to Pennsylvania, New Jersey and Maine. The anomaly reached as high as 25% above normal over the Midwest, with larger areas seeing irradiation 5 to 10% above normal.
In contrast, most of Canada had less irradiation than normal during April due to a focus of cloud-bearing, low-pressure systems from the Pacific extending through Canada to Newfoundland. This northward focus of the low-pressure systems was driven in part by the “blocking” effect of high-pressure systems off the coast of California, diverting low-pressure systems further north. As a result, this trans-Canadian region, which also extended over some northern US states, saw irradiation departures as much as 30% below the April normal through northern parts of British Columbia, Ontario and Quebec.
The Gulf Coast region was a secondary focus of low-pressure systems, causing moist oceanic tradewinds to bring increased cloud cover, especially during the second week of April. As a result, irradiation was down 10 to 15% on April normals from Florida, through Louisiana and southern Texas, and into Coahuila, Mexico.
West and southwest regions still topped irradiation totals for April
Despite these regional departures from April normals, the drier and sunnier western and southwestern regions still topped the list for the total irradiation received during April. These regions, being both further south and having drier conditions, typically experience the highest average daily insolation due to longer days with less cloud.
Solcast produces these figures by tracking clouds and aerosols at 1 to 2 km resolution globally using satellite data and proprietary AI/ML algorithms. This data is used to drive irradiance models, enabling Solcast to calculate irradiance at high resolution, with typical bias of less than 2%, and also cloud-tracking forecasts. This data is used by more than 300 companies managing over 150 GW of solar assets globally.
The views and opinions expressed in this article are the author’s own, and do not necessarily reflect those held by pv magazine.
This content is protected by copyright and may not be reused. If you want to cooperate with us and would like to reuse some of our content, please contact: editors@pv-magazine.com."
https://www.pv-magazine.com/2023/05/12/utility-scale-solar-installation-goes-automated/,"MARKETS,MARKETS & POLICY,TECHNOLOGY AND R&D,UTILITY SCALE PV,UNITED STATES",RYAN KENNEDY,"MAY 12, 2023",Utility-scale solar installation goes automated,"From pv magazine USA
Terabase is launching Terafab, an automated utility-scale solar installation system. It describes the service as an automated “field factory” that can double installation productivity. 
The installation system makes use of digital twins, logistics software, an on-site digital command center, a field-deployed automated assembly line, and installation rovers that can operate 24/7. 
The company also announced the grand opening of a Woodland, California manufacturing facility; “a factory to make factories.” The facility is currently manufacturing the first gigawatt Terafab assembly line with capacity to make more than 10 GW of Terafabs per year.  
Terabase said its system will double labor productivity when compared to traditional utility-scale installation methods. The system offers high-throughput, 24/7 operation, and modularity to enable rapid ramp-ups and higher solar field construction speeds, significantly reducing project schedules. 
“We successfully field-tested Terafab last year, building 10 MW of a 400 MW site in Texas. Today’s launch is the next step forward to rapid commercial scale-up,” said Matt Campbell, chief executive officer and co-founder of Terabase. 
Terabase has partnered with developer Intersect Power, engineering, procurement and construction firm Signal Energy, tracking hardware provider NEXtracker, and solar panel manufacturer First Solar to develop the Terafab facility. 
“Not only does our partnership with Terabase bring advanced installation technology to our next-generation Series 7 solar module, but it also enables a closed-loop packaging recycling system consistent with our vision of responsible solar,” said Nick Strevel, vice president of product, First Solar. “The Terafab system is another example of how homegrown American innovation can help accelerate the deployment of solar, enabling our country’s decarbonization ambitions.” 
Terafab is pegged for commercial deployment starting in the third quarter. The company said that the automated installation system reduces the levelized cost of electricity for utility-scale solar projects. It is also scalable, built on a modular design that can be replicated and deployed quickly. 
Terafab reduces the physical safety risk of construction workers by eliminating the need to lift heavy solar panels and steel structures, often in harsh weather conditions, by using automation on a climate-controlled assembly line. 
To continue reading, please visit our pv magazine USA website.
This content is protected by copyright and may not be reused. If you want to cooperate with us and would like to reuse some of our content, please contact: editors@pv-magazine.com."
https://www.pv-magazine.com/2023/05/12/amp-energy-wins-150-mw-wind-solar-auction-in-india-with-0-037-kwh-bid/,"MARKETS,MARKETS & POLICY,UTILITY SCALE PV,INDIA",UMA GUPTA,"MAY 12, 2023",Amp Energy wins 150 MW wind-solar auction in India with $0.037/kWh bid,"From pv magazine India
Amp Energy India has won an auction by West Bengal distribution company CESC to acquire 150 MW of wind-solar hybrid power, with its Amp Green Energy subsidiary securing the capacity at the lowest tariff of $0.037/kWh.
The company will install 250 MWp of wind and solar capacity to meet the contracted 150 MW power. They have the flexibility to develop the project anywhere in India, as long as it is connected to the inter-state transmission network, operating on a build-own-operate basis.
CESC will sign a 25-year power purchase agreement with Amp Energy.
Amp Energy India's latest win adds to their previous 100 MW success in Solar Energy Corp. of India Ltd's 1.2 GW hybrid wind-solar auction. Its utility portfolio has now grown to 1.75 GWp-plus and its total portfolio (including C&I off-takers) stands at 3 GWp.
This content is protected by copyright and may not be reused. If you want to cooperate with us and would like to reuse some of our content, please contact: editors@pv-magazine.com."
https://www.pv-magazine.com/2023/05/12/us-commercial-pv-can-meet-35-of-electricity-demand-of-manufacturers/,"COMMERCIAL & INDUSTRIAL PV,MARKETS,MARKETS & POLICY,UNITED STATES",ANNE FISCHER,"MAY 12, 2023",US commercial PV can meet 35% of electricity demand of manufacturers,"From pv magazine USA
Powering energy-intensive sectors of the US economy with renewable energy would go a long way toward achieving the Biden Administration’s climate goals of reducing emissions by at least 50% from a 2005 baseline by 2030 and achieving net-zero pollution by 2050.
A recent study conducted at Northeastern University looked at how solar could power US manufacturing. It found that solar mounted on industrial rooftops could meet the electricity demand of 35% of manufacturers.
According to the researchers, the industrial sector accounts for 38% of global energy consumption and 37% of greenhouse gas emissions. And with on-site sources of renewable energy currently supplying less than 0.1% of industrial electricity demand in the United States, the opportunities for carbon reduction are great.
The study, Environmental Research: Sustainability and Infrastructure, published in IOP Publishing’s journal, looks at the feasibility of meeting these electricity demands through on-site rooftop solar installations for different regions and manufacturing sectors across the United States.
Using the US Department of Energy Manufacturing Energy Consumption Survey from the Energy Information Administration, the researchers compared the potential electricity generation of rooftop solar arrays against the electricity demand per unit of floor space for the average manufacturing building.
Monthly solar generation potential per unit area was calculated using the system advisor model (SAM) for on-site roof-mounted panels for the capital of each US state. SAM is a techno-economic analysis and energy simulation model, developed by the National Renewable Energy Laboratory (NREL) in collaboration with Sandia National Laboratories.
The model used 476 W (DC) SunPower solar modules with a 22% nominal efficiency on a fixed-mount solar system. The modeled ABB inverter has a  97.5% California Energy Commission weighted efficiency, maximum power of 20,000 W (AC) and maximum power point tracking of 800 V (DC), with an actual DC to AC ratio of 1.20. They ran the performance model based on hourly timestep simulations to calculate each system’s output by month, and they assumed that 90% of the rooftops were available for solar modules. They also conducted an alternative analysis on with modules that have a 16% nominal efficiency with only 80% of the roof covered with solar.
The researchers compared supply and demand on a net annual basis, under the assumption that facilities will make use of net metering.
The results show that rooftop solar arrays could fulfil the electricity requirement of 5% to 35% of US manufacturing sectors, depending on the season. They found that manufacturers of furniture, textiles, and apparels set to benefit most, representing 2% of US manufacturing electricity use and 6% of floorspace.
 
“Currently, less than 0.1% of the electricity required by the manufacturing sector in the US is generated through renewable, on-site sources,” said Dr. Matthew Eckelman, associate professor of civil and environmental engineering at Northeastern University. “This must change if we are going to meet decarbonization goals, and in many cases rooftop solar panels are now a feasible option for supplying low-carbon energy.”
The alternative rooftop array design model was found to substantially shrink the range of supply intensities, from a high of 411 kWh m−2 yr−1 for the base case to just over 300 kWh m−2 yr−1, which is just within the range of demand intensities for the least electricity-intensive sector of furniture and related products. The researchers determined that the alternative model is not tenable for all of the other sectors in any US location.
The study found that light manufacturing sectors such as furniture and apparel can cover their average net annual electricity demand with rooftop solar on their locations across the country. Other more intensive manufacturing industries can achieve electricity self-sufficiency, but in a smaller subset of US locations.
An added benefit to pursuing on-site PV installations is that it enables manufacturers to maintain limited operations during periods of grid disruption, especially when coupled with on-site energy storage. Seasonally, manufacturing facilities with rooftop solar could fulfill their electrical needs in in nearly 40% of US locations could in the spring and summer..
“Greater policy attention on the feasibility and potential benefits of rooftop solar panel arrays will help industries to achieve renewable energy and greenhouse gas emissions goals,” said Eckelman. “Our research provides an indication of the locations and sectors for which rooftop solar arrays could significantly help manufacturing firms to reach these goals.”
Read: “US Warehouses can host enough solar to power nearly 20 million homes.”
This content is protected by copyright and may not be reused. If you want to cooperate with us and would like to reuse some of our content, please contact: editors@pv-magazine.com."
https://www.pv-magazine.com/2023/05/12/polysilicon-prices-preserve-downward-trend-weighed-down-by-supply-factors/,"HIGHLIGHTS,MARKETS,MODULES & UPSTREAM MANUFACTURING,OPINION & ANALYSIS,WORLD",,"MAY 12, 2023","Polysilicon prices preserve downward trend, weighed down by supply factors","The Global Polysilicon Marker (GPM), the OPIS benchmark assessment for polysilicon manufactured outside China, declined for a fifth week running to $35.789 per kilogram (kg) on May 9, edging 0.12% lower on-week. The fundamentals of scant deals and limited availability continue to govern the market. A source who had concluded a recent transaction confirmed that it had no transactions into China at the moment with demand only coming from outside of China.

The situation of the hung global market clashes starkly with the domestic China polysilicon market. Average polysilicon prices there, assessed by OPIS as China Mono Grade, plummeted a steep 8.81% to CNY158.83 ($22.86)/kg this week. Sustained across eleven consecutive weeks, the drop highlights how China’s producers are under significant pressure, facing challenges of their own as they sit on surplus material that is tricky to clear.
A “price war” for polysilicon, according to one source, has already begun. Manufacturers are promoting second-grade polysilicon which is more difficult to sell, offering their product at lower prices because this part of their inventories has been accumulating since the third quarter of 2022.
Wafer output in May is expected to hit around 49-50 gigawatts (GW), according to one source. There is a widespread consensus in the market that wafer prices still have room to decrease because current wafer manufacturing output is sufficient and polysilicon prices upstream have continued to slip.
OPIS, a Dow Jones company, provides energy prices, news, data and analysis on gasoline, diesel, jet fuel, LPG/NGL, coal, metals, and chemicals as well as renewable fuels and environmental commodities. It acquired pricing data assets from Singapore Solar Exchange in 2022 and now publishes the OPIS APAC Solar Weekly Report.
The views and opinions expressed in this article are the author’s own, and do not necessarily reflect those held by pv magazine.
This content is protected by copyright and may not be reused. If you want to cooperate with us and would like to reuse some of our content, please contact: editors@pv-magazine.com."
