url,tag,author,updated_date,title,contents
https://www.pv-magazine.com/2023/06/29/china-halts-tender-for-4-gw-offgrid-solar-hydrogen-project/,"HYDROGEN,MARKETS,MODULES & UPSTREAM MANUFACTURING,UTILITY SCALE PV,CHINA",VINCENT SHAW,"JUNE 29, 2023",China halts tender for 4 GW offgrid solar-hydrogen project,"The China Bidding Public Service Platform suspended a tender this week for the construction of a 4 GW off-grid PV project to be developed in Gansu province. It said it halted the procurement exercise partly due to the withdrawal of bidders.
The authority started the tender proceedings earlier this week. It said the suspension was specifically due to the incorrect filing of some documents by one of the bidders.
“It is expected that the bidding will continue,” said the platform.
The CNY 35 billion plant will be built in the city of Jiuquan and will feature 800 MW/1600MWh of energy storage. It will use 8,638 electrolyzers and occupy a total area of 67 km2.
Citic Capital, an investment bank, estimates that the solar-powered hydrogen plant has the potential to produce up to 200,000 tons of hydrogen per year. If achieved, this would set a record in China for both the largest single hydrogen production scale and hydrogen production volume tender. The project is scheduled to be operational by the end of 2026.
This content is protected by copyright and may not be reused. If you want to cooperate with us and would like to reuse some of our content, please contact: editors@pv-magazine.com."
https://www.pv-magazine.com/2023/06/29/intersolar-2023-prices-will-fundamentally-come-down/,"MARKETS,MODULES & UPSTREAM MANUFACTURING,WORLD",EMILIANO BELLINI,"JUNE 29, 2023",Intersolar 2023: ‘Prices will fundamentally come down’,"This content is protected by copyright and may not be reused. If you want to cooperate with us and would like to reuse some of our content, please contact: editors@pv-magazine.com."
https://www.pv-magazine.com/2023/06/29/stepping-into-the-european-utility-scale-market-an-interview-with-gregory-lukens-director-utility-europe-for-solis/,"COMMERCIAL & INDUSTRIAL PV,INVERTERS,TECHNOLOGY,TECHNOLOGY AND R&D,UTILITY SCALE PV,EUROPE,WESTERN EUROPE",JONATHAN GIFFORD,"JUNE 29, 2023","Stepping into the European utility-scale market: an interview with Gregory Lukens, Director Utility Europe for Solis","Gregory Lukens is the new Director Utility Europe for Solis, a brand of Ginlong Technologies. In this interview, Lukens discusses his background in the solar industry, Solis' dedication to string inverters, and the company's big push into the utility-scale scene in Europe.
pv magazine: Thanks for your time today, Gregory. When did you join Solis?
Gregory Lukens: Three months ago.
Can you tell me a bit about your experience before joining Solis?
Lukens: I’m an old dog and have been around a few tricks through the years. The last 20 years, I’ve been based in Madrid, Spain, and I’ve been working during that time in solar photovoltaics. I don’t think I’m one of the earliest pioneers in Spain, but we were among the early guys moving around trying to make business back in the day.
Was that in project development?
Lukens: At that time, it was project development, particularly in the commercial and industrial (C&I) sector. We undertook various projects, including shopping malls and installations for IKEA.  I had founded the company, called OpcionDos, with Spanish partners in 2011. In 2011, AEG Power Solutions, a German company, acquired us, marking my entry into the realm of utility-scale solar.
AEG Power Solutions was involved in manufacturing central inverters across different locations like Germany, South Africa, India, and the US. However, there were significant bankability challenges associated with their operations. Subsequently, I joined PV Hardware (PVH), a renowned global tracker company. They had acquired a startup based in California and approached me to assist in Europeanizing the company, which was an ironic twist given my American background. This marked the beginning of a new chapter for PVH.
After spending a few years at PVH, I was recruited by KACO, a German inverter manufacturer later acquired by Siemens. My role primarily involved their European business, but I also became involved in their North American operations due to the presence of their headquarters in San Antonio, Texas.
In 2018, I joined Huawei Spain when the company decided to venture into the solar business. Until that time, Spain was grappling with a moratorium and numerous challenges, leading to minimal activity in the solar industry.
The sun tax…
Lukens: The sun tax, and then, in 2017, the government launched a 4 GW tender and they announced the winners, and that’s when Huawei said, “Oh, I think there’s a market there now.” And that’s when the business started, so I was part of the original team of five or six people.
And how did you decide to make the switch to Solis?
Lukens: While working with Huawei, I gained experience in various global markets, including Spain, Chile, Australia, and Mexico. Solis presented me with an exciting opportunity, and I appreciate their strong focus on their core business. Unlike some other companies, Solis remains dedicated to string inverters and does not venture into other areas like chargers. This focus aligns well with my approach.
Where do you think the competition between string and central inverters currently stands?
Lukens: Personally, I am not a fan of central inverters. They often bring numerous challenges and complications. In contrast, I strongly believe in the benefits of string topology, which offers superior reliability, performance, and operation and maintenance advantages. Solis shares this perspective and aims to support the deployment of string topology in the utility-scale segment, which is widely recognized as the optimal solution by advanced and forward-thinking companies.
Besides inverters, what other components are crucial in utility-scale projects?
Lukens: While the inverter is an essential component, there are other pieces to the utility-scale puzzle. These include communication hardware, such as power plant controllers, and mid-voltage stations.
What are your priorities and focus areas as the Director Utility Europe for Solis?
Lukens: Currently, I'm focusing on completing the certification of our existing machines for the remaining European markets. This process will be finalized in the coming months. Additionally, I'm working on the puzzle pieces I mentioned earlier, which involve communication hardware and mid-voltage stations. At this stage, I'm not actively engaged in sales but rather concentrating on laying the groundwork and hiring the right salespeople. We are targeting some quick wins where customers only require inverters.
Image: pv magazine
Does Solis already have utility-scale sales and ongoing projects in Europe?
Lukens: At present, Solis does not have utility-scale sales or ongoing projects in Europe. While the company has successfully developed utility-scale business in China, India, and the United States, they hadn't previously hired a leader to drive the expansion in Europe. My role is to change that by building expertise, fostering dialogue with our colleagues in China, and ensuring Solis becomes a significant player in the European utility-scale market.
What are the challenges on the R&D side of utility-scale solar?
Lukens: In my opinion, we should explore adding an additional software layer to enhance our offerings. This layer could encompass data analysis, visualizations, and predictive modeling to optimize performance and predict failure rates. Although this may be a consideration for 2024-2025, we need to differentiate ourselves beyond hardware. While hardware innovations like new materials or improved integration with customer SCADA systems are possibilities, the focus should also be on software enhancements.
Lastly, how does bankability differ when transitioning from rooftop to utility-scale projects?
Lukens: Bankability is a critical aspect when it comes to utility-scale solar. The utility-scale market involves professional purchasers and rigorous scrutiny from purchasing departments. ESG requirements are gaining prominence, and stakeholders, including off-takers and project banks, thoroughly assess projects. Solis has an excellent opportunity in this market, as our strong focus on string inverters aligns well with the expectations and demands of utility-scale customers.
This content is protected by copyright and may not be reused. If you want to cooperate with us and would like to reuse some of our content, please contact: editors@pv-magazine.com."
https://www.pv-magazine.com/2023/06/29/intersolar-2023-maxeon-enters-topcon-segment-strengthens-ibc-panel-output/,"MARKETS,MODULES & UPSTREAM MANUFACTURING,UNITED STATES,WORLD",EMILIANO BELLINI,"JUNE 29, 2023","Intersolar 2023: Maxeon enters TOPCon segment, strengthens IBC panel output","This content is protected by copyright and may not be reused. If you want to cooperate with us and would like to reuse some of our content, please contact: editors@pv-magazine.com."
https://www.pv-magazine.com/2023/06/29/all-black-solar-panels-with-integrated-cell-string-optimizers/,"COMMERCIAL & INDUSTRIAL PV,MARKETS,MARKETS & POLICY,MODULES & UPSTREAM MANUFACTURING,RESIDENTIAL PV,TECHNOLOGY AND R&D,GERMANY,NETHERLANDS",EMILIANO BELLINI,"JUNE 29, 2023",All-black solar panels with integrated cell string optimizers,"Dutch software supplier Taylor and Germany-based Sonnex Energie are offering new all-black solar panels with integrated cell string optimizers.
“We are producing our module in China under an original equipment manufacturer (OEM) model based on Sonnex quality control criteria in our OEM factories which shall pass our audit and be reputable in the industry,” a Sonnex Energy spokesperson told pv magazine, noting that the company now has 2 GW of capacity. “While we have our own technical team and quality control team which are always at the production site for the production.”
The two companies are offering five versions of the new panels, with power outputs ranging from 395 W to 415 W and efficiencies ranging from 20.23% to 21.25%. The open-circuit voltage is between 36.93 V and 37.90 V and the short-circuit current is 13.48 A to 13.72 A. The panels can work either with system voltages of 1,500 V or 1,000 V.
The panels measure 1,722 mm x 1,134 mm x 30 mm and weigh 20.2 kg. They feature 120 half-cut monocrystalline PERC cells measuring 182 mm x 91 mm. The new panels also feature IP65 or IP67 enclosures and black anodized aluminum frames. They have a temperature coefficient of -0.35% per degree Celsius and and operational temperature ranging from -40 C to 85 C.
The new panels come with a 30-year linear power output guarantee and a 25-year product guarantee. The degradation in the first year is purportedly 2.0% and 30-year end power output is guaranteed to be no less than 82.5% of the nominal output power.
“We are now able to offer this unique technology to the market,” said Eric Lee, general manager of Sonnex Energie. “The integration of cell string optimizers in our modules really sets us apart and enables us to provide enhanced value to our customers.”
This content is protected by copyright and may not be reused. If you want to cooperate with us and would like to reuse some of our content, please contact: editors@pv-magazine.com."
https://www.pv-magazine.com/2023/06/29/the-year-it-all-changed/,"COMMERCIAL & INDUSTRIAL PV,COMMUNITY,DISTRIBUTED STORAGE,ELECTRIC VEHICLES,ENERGY STORAGE,GEOPOLITICS,GRIDS & INTEGRATION,HEAT PUMPS,MARKETS,MODULES & UPSTREAM MANUFACTURING,OPINION & ANALYSIS,POLICY,RESIDENTIAL PV,SUSTAINABILITY,EUROPE,FRANCE,GERMANY,ITALY,NETHERLANDS,POLAND,SPAIN",,"JUNE 29, 2023",The year it all changed,"From pv magazine 06/23
It can feel like old news to talk about 2022 halfway through 2023 but the impact of the most pivotal year for energy markets in decades will be felt through 2030. The European Commission doubled down on solar targets to cut Russian natural gas under its REPowerEU plan, targeting 415 GW of total solar by 2025, and up to 750 GW this decade. The scale of ambition is unprecedented: Europe wants to triple its capacity in eight years. Decarbonization is imperative and energy security has also come to the fore, under the EU Solar Strategy.
On the regulatory front, taxes and caps on member-state energy company windfall profits have increased risk premiums, particularly for merchant solar and power purchase agreement (PPA)-backed projects, with further extensions likely to slow buildout.
With electricity bills rising an average 38% in the euro area in the last 18 months, distributed solar’s annual capacity growth shattered records last year. Residential installations hit almost 15 GW across major EU markets while commercial and industrial additions rose to 13 GW.
Wood Mackenzie’s base case scenario sees Europe adding almost 400 GW of solar to 2030, meaning the EU will fall short of its target by nearly 150 GW – with today’s cumulative capacity at around 200 GW. The only way to bridge that gap is to tackle grid, permitting, and supply chain constraints.
Corporate PPAs will drive utility scale solar as tightening environmental, social, and corporate governance (ESG) requirements and structurally higher electricity costs incentivize business take-up. Spain remains Europe’s largest PPA market but volumes are accelerating in Germany, France, and Poland.
Local opposition and permitting processes will continue to slow growth, particularly in Italy, and grid issues are acute in the Netherlands, where congestion management has been used in recent years.
REPowerEU is betting on rooftop solar because of its modular nature and the continent’s vast, untapped potential. The European Solar Rooftop Initiative targets 52 GW to 58 GW more capacity by 2025 in its conservative scenario. This is an ambitious but achievable objective amid structurally higher retail electricity rates and a return to a downward trajectory in component costs. We predict distributed-solar’s levelized cost of energy (LCOE) will decline almost 30%, on average, this decade.
With net metering being replaced by less generous compensation for prosumer electricity grid exports, the European Commission’s toolbox to maximize rooftop PV relies on building mandates which will kick in from 2026 to 2028 and will also back energy communities. It is unclear how many member states will apply mandates, what exemptions will be granted, and whether additional capital expenditure subsidies or tax incentives will help rollout.
Regardless, household solar will keep pace to 2030 and the sector must attract low- and-medium-income customers and collective systems for apartments. Energy communities will help democratize residential solar.
Upfront expense will remain the biggest entry barrier for households. Third-party, subscription-based ownership models could relieve financial constraints and alleviate technology risks associated with subpar installations.
Heating and transport electrification will gain steam by 2025. Heat pump and domestic electric vehicle (EV) charging stations will further push residential solar. As home loads climb so will electricity costs, strengthening rooftop PV.
Upfront cost will again be a hurdle so heat pumps and EV chargers will require subsidies and interest-free finance as well as bans on natural gas heaters and internal combustion engine vehicles.
Along with home energy storage solutions, heating and transportation electrification will help harmonize home energy consumption and peak generation profiles, providing grid flexibility. This will be an invaluable benefit as governments phase out compensation for surplus-electricity grid exports. The case for maximizing self-consumption will only grow.
On the commercial solar front, the 2026-27 rooftop mandates for commercial buildings will be major drivers for growth; along with volatility in retail electricity rates, and improvements in installation and operational cost efficiencies.
Supply chain volatility poses a significant downside risk to increased solar buildout across segments. Equipment cost inflation since 2020 has already led to project cancellations and auction undersubscription all over Europe, as ceiling bid prices remain low compared to LCOE levels and corporate PPA prices.
However, PV component prices have started to come down and will continue to fall as supply and demand stabilize. But this story of generalized cost declines could look different if the European Commission achieves its objective of enforcing uptake of domestically manufactured equipment for public auction tenders, increasing costs for developers.
This localization strategy is in part a response to the Inflation Reduction Act in the United States but is also a push to diversify Europe’s PV technology supply away from China, in an environment of heightened geopolitical tension. If these efforts solidify, and are complemented by local content requirement policies, we could see PV component prices soar anywhere between 10% and 40%. That will depend on how much the EU enforces reshoring of the overall PV manufacturing supply chain.
About the authors: Juan Monge is a principal analyst on Wood Mackenzie’s power and renewables team, covering distributed solar market developments across Europe. Prior to his current role, Monge was a senior conference content manager, leading content development for Wood Mackenzie/Greentech Media’s energy transition conference portfolio in collaboration with WoodMac research practice heads.
Daniel Tipping is a solar analyst in the energy transition practice at Wood Mackenzie, focusing on European PV markets and PPA trends. Prior to joining WoodMac, Tipping worked as an offshore energy analyst for a consulting firm in London where he also helped forecast wind turbine vessel dynamics. He graduated from the University of Bristol with a master’s degree in civil engineering, specializing in solar and renewable energy technology.
This copy was amended on 31/05/23 to indicate the European Solar Rooftop Initiative aims for 52 GW to 58 GW of new generation capacity rather than the “almost 60 GW” stated in our print edition.
The views and opinions expressed in this article are the author’s own, and do not necessarily reflect those held by pv magazine.
This content is protected by copyright and may not be reused. If you want to cooperate with us and would like to reuse some of our content, please contact: editors@pv-magazine.com."
https://www.pv-magazine.com/2023/06/29/novel-assessment-of-pv-powered-air-conditioning/,"COMMERCIAL & INDUSTRIAL PV,DISTRIBUTED STORAGE,ENERGY STORAGE,ENERGY STORAGE,MODULES & UPSTREAM MANUFACTURING,TECHNOLOGY AND R&D,UTILITY SCALE PV,TURKEY",EMILIANO BELLINI,"JUNE 29, 2023",Novel assessment of PV-powered air conditioning,"A research group from the Burdur Mehmet Akif Ersoy University in Turkey has investigated how solar power may help reduce carbon emissions and improve the performance of heating, ventilation, and air conditioning (HVAD) systems.
“We aimed to improve the life cycle climate performance using a solar energy-powered heater in a residential air conditioner,” the research's lead author, Azim Dogus Tuncer, told pv magazine. “We found that using the heater in the system improved the coefficient of performance and decreased negative environmental effects by reducing the energy consumption of the compressor in the system.”
The scientists investigated, in particular, how the energy consumption of an air conditioning (AC) system may be improved by using PV and then assessed the environmental impact of this approach via the life cycle climate performance (LCCP) method, which includes all cradle-to-grave emissions.
The experimental setting included two 20 m2 insulated rooms with a total area of 65 m2. One of the rooms was equipped with solar-powered AC while the other one used AC powered by grid electricity.
The PV-energized system was in turn equipped with a heater added to the compressor inlet of the air conditioning system to heat the refrigerant, with pressure and temperature sensors being utilized to observe the changes. The scientists also used a wattmeter to measure the electricity consumption of the compressor.
They also assumed the outdoor AC system to have a capacity of 3.5 kW, a seasonal coefficient of performance of 38 W/W, and an energy efficiency ratio of 9.40 BTU/hW. Its dimensions are 880 mm x 280 mm x 363 mm and its weight is 27.2 kg. Its refrigerant is R410A and the expected lifetime is 15 years.
“The units have been connected with a copper pipe of about 2 m in length and insulation was made to prevent any effect on the pipe, the research team explained. “The heater has one inlet and one outlet with a copper pipe. At the inlet of the heater, there is the part sent to the compressor at the outlet of the refrigerant returning from the indoor unit.”
It tested the system with different heater set values of 18 C, 19 C, and 20 C, respectively, and ascertained that heaters set values
decreased by 7.74%, 26.62%, and 27.28%, respectively. It also found that the use of PV significantly reduces both energy and emission values.
They presented their findings in the study “Experimental investigation of a solar-assisted air conditioning system: Energy and life cycle climate performance analysis,” published in Thermal Science and Engineering Progress.
This content is protected by copyright and may not be reused. If you want to cooperate with us and would like to reuse some of our content, please contact: editors@pv-magazine.com."
https://www.pv-magazine.com/2023/06/29/european-solar-startup-funding-hits-6-billion-in-first-5-months-of-2023/,"FINANCE,RESIDENTIAL PV,TECHNOLOGY,TECHNOLOGY AND R&D,EUROPE,WORLD",MARIJA MAISCH,"JUNE 29, 2023",European solar startup funding hits $6 billion in first 5 months of 2023,"Innovation in European solar tech is booming, with $6 billion raised in just the first five months of 2023. According to data compiled by electronics distributor Avent Abacus, total investment in European solar startups is up 398%, from just $1.2 billion raised in the same period a year earlier.
Avnet Abacus, which acts as a consultant to engineers when designing new products, analyzed Crunchbase data for companies listed under solar and other renewable energy categories to provide insight on the level of funding going into those sectors. It found that investment is up 47% globally, with funding of the sector down 7% in the United States so far this year.
Despite continued uncertainty in the venture capital market, average investment in European solar is at an all-time high at $166.1 million, compared with an average of $88.3 million in 2022 and $22.9 million in 2021. The average amount of venture capital flowing into European solar so far this year eclipses the sector’s global average of $116.8 million and the US average of $113.8 million.

“Even though solar technology is relatively mature, there is still a lot of room for growth and innovation. There is growing demand around the world, and government policies and incentives continue to support investment in this area, with engineers continually seeking new ways to make solar more efficient,” said Sara Ghaemi, Avnet Abacus’s technical director.
According to Avnet Abacus, there are almost six times more startups focused on solar than wind energy in Europe, and it’s the consumer market that’s driving the expansion. Indeed, rooftop installations accounted for 66% of the EU’s solar capacity at the end of 2022, according to SolarPower Europe. Amid a slower-than-expected increase in large-scale solar, the total share for rooftop PV is expected to decrease only slightly to 59% by 2026.
Driven by rising electricity prices, interest in solar has grown exponentially. In Europe, specifically, a growing number of companies serving the residential sector and, in some cases, the commercial solar segment, have raised capital from a mix of investor types, particularly for lighter, more aesthetically pleasing, or easier-to-install rooftop PV designs.
In addition, the complexity of solutions has increased over the years, with startups now offering services and a software layer on top of that. One such example is Hamburg-based 1Komma5°, which last week raised €430 million in a Series B round, helping it to become Germany's latest unicorn, with a value of more than €1 billion ($1.09 billion) in just 23 months of existence.
This content is protected by copyright and may not be reused. If you want to cooperate with us and would like to reuse some of our content, please contact: editors@pv-magazine.com."
