url,tag,author,updated_date,title,contents
https://www.pv-magazine.com/2023/06/29/sungrows-james-li-discusses-liquid-cooling-for-ess/,"UTILITY SCALE STORAGE,EUROPE,IRELAND,NORWAY,UNITED KINGDOM",TRISTAN RAYNER,"JUNE 29, 2023",Sungrow’s James Li discusses liquid cooling for ESS,"James Li of Sungrow Power Europe shared insights on the inverter manufacturer's new utility-scale energy storage system (ESS), the PowerTitan 2.0 ESS. Li discussed the purpose of the solution, enhancements over the previous version, regional availability, the successful implementation of all-liquid cooling, and density advantages.
pv magazine: It's great to see your announcement of the PowerTitan 2.0 ESS. Can you tell us what has changed from the PowerTitan to the new PowerTitan 2.0?
James Li: The main change is based on valuable feedback we received from customers in the UK, Israel, and other places. They expressed a need for higher power density, particularly in areas where land availability is limited. As storage demands move closer to residential and urban areas, the cost of land is rising, and noise has become a concern. They requested a smaller system footprint. That's why we introduced the PowerTitan 2.0, offering a 5 MWh battery and a 2.5 MW PCS.
We have doubled the density while fitting everything, including the PCS, into a 20-foot container. It's quite impressive to have the whole system in such a compact container, making logistics easier.
Has the shift to liquid cooling enabled this change? Or was there something else?
Li: When we initially launched the first generation, we already had future product options in mind. It required significant engineering efforts to incorporate liquid cooling into our product swiftly. It's our first time using liquid cooling for the entire system, replacing the previous air cooling method.
Liquid cooling is applied to both the PCS and battery storage, providing advantages in terms of thermal management. With air cooling, there is a temperature difference of around 10 degrees, whereas with liquid cooling, it reduces to about 2.5 degrees. This translates to an extended lifespan of approximately two years, which is significant. Additionally, the string PCS allows for individual charging and discharging of battery racks, resulting in over 7% increased energy capacity during the life cycle and improved overall efficiency.
What was the main challenge you faced in introducing liquid cooling to the market?
Li: Designing air cooling systems is relatively easier in terms of thermal management and heat flow for cooling the entire system. On the other hand, liquid cooling necessitates more meticulous design considerations, including pipe layout to ensure efficient cooling and proper flow direction. This process takes time and careful control. Despite the additional design constraints, liquid cooling provides better overall control, making it highly effective. It particularly suits utilities facing land constraints, especially those seeking installations with more than 20 MWh of energy storage.
For a 100 MWh energy storage project using the PowerTitan 2.0, it will only occupy approximately 1,200 square meters, significantly reducing the required land footprint.
How does this approach differ from other solutions in the same market segment? How effective is it?
Li:  The PowerTitan 2.0 is a professional integration of Sungrow’s power electronics, electrochemistry, and power grid support technologies. The PowerTitan 2.0 distinguishes itself in terms of its 20ft container size, which is the smallest in the market segment. The high density of the system positions us as the leading choice for transportation and logistics. Although it is heavier than the first generation, it can still be easily transported within a 20-foot container.
Another key aspect is the adoption of liquid cooling for both the PCS and the battery. This not only provides superior thermal management but also significantly reduces noise. As we see a shift towards storage systems located closer to residential areas, the reduced noise level of around 4 dB, on a log scale, which makes it a lot, becomes highly advantageous. The new system operates at approximately 75 dB, compared to the previous 79 dB.
However, the most significant advantage lies in its efficient land utilization, which has been our primary focus.
Are you still offering the original PowerTitan alongside the PowerTitan 2.0?
Li: To avoid confusion, we continue to offer the original PowerTitan to all customers. However, the PowerTitan 2.0 is only available as an option in specific regions. These regions include Israel, the UK, the Nordics, and Ireland, where there is high demand for storage but limited land availability. In these locations, customers require higher density and longer duration for their storage systems.
The PowerTitan 2.0 is specifically designed to meet these customer requirements and is not available in countries like Germany, where the grid capacity is larger.
Is the liquid cooling option more expensive?
Li: Overall, we believe that offering the liquid cooling solution with the PowerTitan 2.0 can deliver cost savings. The smaller size, higher density batteries, and integration into a single 20-foot container result in overall savings for customers when considering all capital and operational expenses. This reduction in size by approximately 30% and the extended service life of two years contribute to real savings.
While the PowerTitan 2.0 may have a higher unit cost, taking into account all capital and operational expenses, it proves to be a cost-effective solution.
Based on your experience with PowerTitan installations in the field, what kind of feedback have you received from customers?
Li: Customers have become more professional in their approach, and we have likewise become more professional in response to their needs. For example, customers increasingly demand greater assurance when it comes to firefighting systems. Our system meets or exceeds all requirements and carries the CE marking. However, some customers, particularly in the USA who work with consultants, also seek UL certification. We continually strive for full compliance in all regions, providing evidence and test reports to offer customers the highest level of confidence.
This content is protected by copyright and may not be reused. If you want to cooperate with us and would like to reuse some of our content, please contact: editors@pv-magazine.com."
https://www.pv-magazine.com/2023/06/29/spain-targeting-56-gw-of-new-solar-by-2030-under-new-energy-strategy/,"COMMERCIAL & INDUSTRIAL PV,MARKETS,POLICY,RESIDENTIAL PV,UTILITY SCALE PV,SPAIN",PILAR SÁNCHEZ MOLINA,"JUNE 29, 2023",Spain targeting 56 GW of new solar by 2030 under new energy strategy,"From pv magazine Spain
Spain's Ministry for the Ecological Transition and Demographic Challenge (MITECO) has published a revised draft of the National Integrated Energy and Climate Plan (PNIEC) with a target of reducing greenhouse gas emissions by 32% compared to 1990 – surpassing the previous goal of 23%. The draft is currently open for public consultation until Sept. 4.
To meet these targets, the new energy strategy outlines a plan to have 214 GW of total installed capacity in the electricity sector by 2030. This includes 160 GW from renewable generation and 22 GW from various forms of storage.
The document acknowledges that the distribution of technologies is subject to change based on factors such as technology advancements, costs, availability, and integration capacity. It emphasizes the potential of photovoltaics, projecting a capacity of 76 GW by 2030, including 19 GW for self-consumption. The previous version of the plan aimed for 39 GW of solar photovoltaic capacity. As of the end of 2022, the PV source had reached 20 GW, indicating a need to deploy an additional 56 GW in the next eight years.
The plan also includes the addition of 62 GW of wind power, including 3 GW of offshore wind, 14.5 GW of hydro, and 4.8 GW of concentrated solar power (CSP). Non-renewable technologies are accounted for as well, with expectations of 26.6 GW of gas combined cycles and 3 GW of existing nuclear power plants by 2030.
Furthermore, the new plan raises the target for green hydrogen generation through electrolyzers to 11 GW, compared to the 4 GW outlined in the current roadmap.
José Donoso, director of the Spanish solar energy association UNEF, expressed a positive view of the new plan, stating that the objectives are attainable. He emphasized the importance of storage expansion and urges expedited regulatory measures to facilitate action.
Regarding the industrial plan mentioned in the draft, which addresses solar manufacturing, Donoso pointed to the budget of €1 billion ($1.09 billion) and the growing interest of panel manufacturers to invest in Spain. He emphasized the need for swift administrative authorizations and suggested promoting a “welcome packet” to attract investment.
This content is protected by copyright and may not be reused. If you want to cooperate with us and would like to reuse some of our content, please contact: editors@pv-magazine.com."
https://www.pv-magazine.com/2023/06/29/blackrock-raises-aud-500-million-to-finance-1-68-gwh-battery-in-australia/,"MARKETS,MARKETS & POLICY,UTILITY SCALE STORAGE,AUSTRALIA",DAVID CARROLL,"JUNE 29, 2023",BlackRock raises AUD 500 million to finance 1.68 GWh battery in Australia,"From pv magazine Australia
US-based investment giant BlackRock has raised more than AUD 500 million, including a AUD 100 million investment commitment from Clean Energy Finance Corp. (CEFC), to help finance the Waratah Super Battery in New South Wales.
The Waratah Super Battery (WSB), being built by BlackRock battery offshoot Akaysha Energy north of Sydney, is designed to unlock latent transfer capacity in the existing transmission system. It will help to integrate renewable energy and maintain grid reliability by acting as a “shock absorber” during power surges.
Akaysha has been contracted to deliver a battery capable of providing a guaranteed continuous active power capacity of at least 700 MW and a guaranteed useable energy storage capacity of at least 1,400 MWh. The company plans to trade the additional 150 MW/280 MWh of capacity in the electricity market as well as potentially releasing it during off-peak times.
Charlie Reid, BlackRock’s co-head of climate infrastructure in the Asia Pacific region, said the battery will add greater reliability and resilience to the power grid and will help Australia achieve its renewable ambitions.
“We firmly believe battery storage is the critical technology of today, applied both on a small scale in homes and for large-scale battery platforms like the Waratah Super Battery,” said Reid.
To continue reading, please visit our pv magazine USA website. 
This content is protected by copyright and may not be reused. If you want to cooperate with us and would like to reuse some of our content, please contact: editors@pv-magazine.com."
https://www.pv-magazine.com/2023/06/29/scientists-designed-10-83-efficient-solar-cell-based-on-new-unleaded-perovskite-material/,"MODULES & UPSTREAM MANUFACTURING,TECHNOLOGY AND R&D,INDIA",EMILIANO BELLINI,"JUNE 29, 2023",Scientists designed 10.83%-efficient solar cell based on new unleaded perovskite material,"Scientists at the Pandit Deendayal Energy University in India have designed a solar cell using KSnI3 as an absorber material.
KSnI3 is a perovskite material that doesn't contain lead and has already been used in solar cell applications by previous research. “This is not the first attempt at building cells based on KSnI3,” the research's corresponding author, Grishma Pindolia, told pv magazine. “Two more papers have been published by our research team in 2023 itself, which show the potential of KSnI3 as an absorber material in solar cells.”
The group used an organic electron transport layer (ETL) with optimized defect concentration and improved interface and doping density for the solar cell, claiming the use of this ETL is less expensive than that of inorganic ETLs based on materials such as titanium oxide (TiO2) . “The inorganic charge transport layers (ETLs) require complex deposition techniques, which are not very cost friendly and the reported efficiencies of perovskite solar cells with organic ETLs are higher than those with inorganic CTLs,” it explained.
The scientists used a numerical module and the SCAPS-1D solar cell capacitance software, which is a simulation tool for thin-film solar cells that was developed by the University of Ghent in Belgium, to simulate a solar cell utilizing ETLs based on either phenyl-C61-butyric acid methyl ester (PCBM) or buckminsterfullerene (C60). They also tested organic HTLs relying on spiro-OMeTAD, poly-triarylamine (PTAA), polymer Regioregular poly(3-hexylthiophene) (P3HT), PEDOT: PSS, and D-PBTTT-14.
“We optimized the defect concentration of the layers and the interfaces, doping density and thickness of the layers, and the shunt and series resistance of the device,” the scientists said, noting that they also used a gold (Au) metal contact and a fluorine-doped tin oxide (FTO) substrate for the solar cell. “The optimized thickness of PTAA, KSnI3, and C60 was 30nm, 980nm, and 10nm respectively.”
Through their simulation, the academics found the device may achieve a power conversion efficiency of 10.83% and a fill factor of 80.8%. It may also achieve an open-circuit voltage of 0.76788 V and a short-circuit current of 17.44879 mA/cm2.
The device is presented in the paper “Effect of organic charge transport layers on unleaded KSnI3 based perovskite solar cell,” published in Results in Optics. “The present work may be helpful in designing lead-free, non-toxic tin-based perovskite solar cells in the future,” the research team concluded.
This content is protected by copyright and may not be reused. If you want to cooperate with us and would like to reuse some of our content, please contact: editors@pv-magazine.com."
https://www.pv-magazine.com/2023/06/29/italian-supplier-unveils-new-pv-garden-system/,"MODULES & UPSTREAM MANUFACTURING,TECHNOLOGY AND R&D,ITALY",LARA MORANDOTTI,"JUNE 29, 2023",Italian supplier unveils new PV garden system,"From pv magazine Italy
Italian garden supplier Giulio Barbieri has developed an isothermal PV pergola that can be combined with battery storage. The “Eclettica Solar Power” solution is a waterproof, snow-resistant pergola.
The manufacturer describes it as a “new synthesis to respond to a growing and unstoppable green sensibility, combined with the search for environmental, thermal and visual comfort that satisfies all the senses. The pergola can be equipped with 3.06 kW, 4.08 kW, and 5.10 kW PV systems featuring modules with half-cut designs and 500 W of output, supplied by Slovenian panel maker Bisol.
The system can also be equipped with one or two battery packs for energy storage. The company offers an optional “high-efficiency” storage system designed for home security.
The PV pergola also features a 4 kW hybrid inverter that makes it possible to connect one or two external 5 kWh lithium-iron-phosphate battery packs capable of guaranteeing 10,000 discharge and charge cycles, maintaining a residual capacity of 70%. This results in a low risk of domestic fires and environmentally friendly technology, said the company.

In the latest issue of pv magazine we turn the spotlight onto European solar with a comprehensive review of the state of the PV industry across the region’s key markets and a look at the legislation which aims to drive a solar rooftop boom. We also examine the difficulty of establishing a solar panel recycling industry in Australia, where industry backbiting isn’t helping matters.
This content is protected by copyright and may not be reused. If you want to cooperate with us and would like to reuse some of our content, please contact: editors@pv-magazine.com."
https://www.pv-magazine.com/2023/06/29/germany-launches-33-kw-prototype-highway-pv-system/,"COMMERCIAL & INDUSTRIAL PV,MODULES & UPSTREAM MANUFACTURING,TECHNOLOGY AND R&D,UTILITY SCALE PV,GERMANY",SANDRA ENKHARDT,"JUNE 29, 2023",Germany launches 33 kW prototype highway PV system,"From pv magazine Germany
German Federal Transport Minister Volker Wissing visited the first PV system to cover Autobahn 81 at the Hegau-Ost service area in Germany this week, as the pilot project is nearing completion.
The installation is a collaborative research effort between Germany, Austria, and Switzerland, supported by participating research institutes including Fraunhofer ISE, Forster FF, and the Austrian Institute of Technology. While the original plan was to directly cover the motorway, the adjacent through lane was chosen instead.
The PV roof area, consisting of solar modules on a steel structure, was supplied by Solarwatt. It has a total output of 33 kW. Completion of the PV system is scheduled for July.
The German Federal Ministry of Transport claims that there are benefits for solar rooftops over motorways, particularly near tunnels or rest areas, where the electricity can be used directly. However, stringent safety requirements for the fast-flowing traffic underneath must be met.
Federal Transport Minister Wissing noted the significance of solar on federal highways in achieving climate neutrality, and legislation aims to expedite and simplify the expansion of PV on and near motorways. Federal Autobahn GmbH is actively seeking suitable locations, with the goal of achieving climate neutrality for its own area by 2040. The pilot project will be scientifically monitored by the Federal Highway Research Institute for one year.
The new legislation also facilitates the installation of PV modules by municipalities, residents, and investors in the vicinity of federal motorways. Noise barriers, in particular, have been identified as suitable installation areas for solar. A register of potential areas is currently being compiled, and the ministry aims to simplify the planning process to encourage the implementation of renewable energy systems along federal trunk roads.
This content is protected by copyright and may not be reused. If you want to cooperate with us and would like to reuse some of our content, please contact: editors@pv-magazine.com."
