,News_Url,News_tags,News_author,Released_Date,News_Title,News_Contents,News_Image,News_Nationality
0,https://www.pv-magazine.it/2024/02/06/zaha-hadid-architects-progetta-stazioni-di-rifornimento-in-25-porti-turistici-italiani/,"IDROGENO,STOCCAGGIO,ITALIA",SERGIO MATALUCCI,2024-02-06,Zaha Hadid Architects progetta stazioni di rifornimento idrogeno in 25 porti italiani,"Zaha Hadid Architects ha presentato le sue stazioni di rifornimento di idrogeno per i porti turistici italiani, affermando che costituiscono la prima rete di rifornimento di idrogeno verde al mondo per la nautica da diporto.
Il progetto sarà avviato in 25 porti e marine italiane grazie a un investimento di 100 milioni di euro (107 milioni di dollari) fatto da NatPower.
“L’infrastruttura a idrogeno verde inizierà a essere installata nell’estate del 2024 e prevede la fornitura di 100 stazioni di rifornimento in tutto il Mediterraneo nei prossimi sei anni”, ha commentato lo studio britannico, spiegando che fornirà fino a 3650 tonnellate di idrogeno all’anno.
Le stazioni saranno costruite con cemento a basse emissioni di carbonio, attraverso un processo di stampa 3D.
“L’industria navale italiana è leader mondiale per numero di imbarcazioni costruite e il nostro obiettivo è quello di facilitare la transizione energetica di questo mercato cruciale. Anche se il progetto è stato appena lanciato, abbiamo già una pipeline di 25 accordi con porti e marine italiane”, ha dichiarato Andrea Minerdo, CEO NatPower H, società controllata da NatPower.
I presenti contenuti sono tutelati da diritti d’autore e non possono essere riutilizzati. Se desideri collaborare con noi e riutilizzare alcuni dei nostri contenuti, contatta: editors@pv-magazine.com.",https://www.pv-magazine.it/wp-content/uploads/sites/14/2024/02/ZHA_NatPowerH-Refuelling-Stations_Render-by-Tecma-Solutions_2-1024x640-1-150x150.jpg,italy
1,https://www.pv-magazine.it/2024/02/06/stoccaggio-pacific-green-technologies-punta-su-australia-e-italia/,"BATTERIE,FINANZA,MERCATI & POLITICHE,STOCCAGGIO,ITALIA,STATI UNITI",SERGIO MATALUCCI,2024-02-06,"Stoccaggio, Pacific Green Technologies punta su Australia e Italia","Pacific Green punta a una capacità di stoccaggio dell’energia a batteria di oltre 12 GWh in quattro mercati globali, tra cui l’Italia.
La società con sede in Delaware, Stati Uniti, ha registrato una crescita della pipeline fino a 6 GWh nel 2023, conquistando posizioni di rilievo nei mercati emergenti dello stoccaggio di energia in Italia e in Australia e mettendo in funzione il suo primo progetto a Richborough, nel Regno Unito. Il focus della società rimane sui sistemi di stoccaggio di energia a batteria su scala pubblica (BESS) come obiettivo prioritario per i prossimi anni.
“L’Australia e l’Italia rimangono i punti caldi per un’ulteriore e significativa espansione della pipeline, mentre l’azienda sta cercando di ricaricare il proprio portafoglio di produzione nel mercato britannico in via di maturazione, oltre a muovere i primi passi nel nascente mercato polacco”, ha detto la società.
Pacific Green punta a una capacità minima di 1 GWh in ogni mercato in cui entra, ma ancora di più in Italia.
“Dopo aver acquisito una partecipazione di maggioranza in cinque parchi energetici a batterie in Italia dall’originator Sphera Energy nel 2023, per un totale di 2,8GWh di capacità, il team di Pacific Green in Italia punta a chiudere finanziariamente i suoi primi 1.500MWh di capacità di stoccaggio quest’anno, prima dell’inizio delle operazioni commerciali nel 2026”.
I presenti contenuti sono tutelati da diritti d’autore e non possono essere riutilizzati. Se desideri collaborare con noi e riutilizzare alcuni dei nostri contenuti, contatta: editors@pv-magazine.com.",https://www.pv-magazine.it/wp-content/uploads/sites/14/2023/06/Immagine2-150x150.png,italy
2,https://www.pv-magazine.it/2024/02/06/aumenta-la-produzione-solare-in-europa-con-lallungarsi-delle-giornate-aleasoft/,"MERCATI & POLITICHE,SVILUPPI DI MERCATO,FRANCIA,GERMANIA,ITALIA,PORTOGALLO,SPAGNA",SERGIO MATALUCCI,2024-02-06,Aumenta la produzione solare in Europa con l’allungarsi delle giornate – AleaSoft,"Nella settimana del 29 gennaio, la produzione di energia solare ha continuato ad aumentare nei principali mercati elettrici europei, grazie alle giornate più lunghe. Questa tendenza persiste dall’inizio dell’anno nei mercati italiano e francese, con aumenti settimanali rispettivamente del 20% e del 10% nella settimana in questione. Lo riporta AleaSoft Energy Forecasting nel suo rapporto settimanale.
“La tendenza all’aumento della produzione di energia solare si è riflessa anche nei valori giornalieri. In Spagna, la produzione di energia solare fotovoltaica ha raggiunto livelli mai visti in ottobre, con 104 GWh generati domenica 4 febbraio. L’Italia e il Portogallo hanno registrato rispettivamente 67 GWh e 12 GWh sabato 3 febbraio, segnando livelli di produzione di energia solare che non si vedevano da ottobre”, ha scritto la società di consulenza spagnola.
Secondo le previsioni di AleaSoft Energy Forecasting, la tendenza si invertirà, con un aumento della produzione di energia solare in Germania e una diminuzione in Italia e Spagna.
Nella prima settimana di febbraio, le medie settimanali hanno intanto continuato a essere inferiori a 75 €/MWh in quasi tutti i mercati elettrici europei analizzati. Fa eccezione il mercato italiano IPEX, che ha nuovamente registrato la media più alta, 95,68 €/MWh. “Il mercato nordico ha raggiunto il prezzo settimanale più basso, 30,56 €/MWh. Nel resto dei mercati analizzati, i prezzi variavano da 59,92 €/MWh nel mercato tedesco a 71,89 €/MWh in quello spagnolo”.
La produzione di energia eolica è stata generalmente inferiore alla settimana precedente. La domanda di elettricità è diminuita in quasi tutti i mercati. I futures sulla CO2 hanno continuato a scendere e quelli sul gas hanno interrotto la tendenza al ribasso degli ultimi mesi.
I presenti contenuti sono tutelati da diritti d’autore e non possono essere riutilizzati. Se desideri collaborare con noi e riutilizzare alcuni dei nostri contenuti, contatta: editors@pv-magazine.com.",https://www.pv-magazine.it/wp-content/uploads/sites/14/2024/02/20240205-AleaSoft-Solar-photovoltaic-thermosolar-energy-production-electricity-Europe-150x150.png,italy
3,https://www.pv-magazine.it/2024/02/06/sonnedix-firma-prestito-da-260-milioni-per-sviluppo-di-200-mw-in-sicilia-e-sardegna/,"FINANZA,MERCATI & POLITICHE,SVILUPPI DI MERCATO,ITALIA,SARDEGNA,SICILIA",SERGIO MATALUCCI,2024-02-06,Sonnedix firma prestito da 260 milioni per sviluppo di 200 MW in Sicilia e Sardegna,"Sonnedix ha firmato un prestito da 260 milioni di euro per finanziare l’acquisizione e la costruzione di progetti di energia rinnovabile in Italia.
“Il prestito, garantito nel dicembre 2023, rappresenta una delle più grandi operazioni di finanziamento di progetti solari sul mercato italiano nel corso dell’anno. Fa seguito all’innovativa linea di credito da 500 milioni di euro firmata da Sonnedix a dicembre, per finanziare la costruzione della sua pipeline di energia rinnovabile in Europa e nel Regno Unito”, ha scritto
Il finanziamento, concesso da un pool di banche, consentirà lo sviluppo di due progetti FV greenfield in Sicilia e in Sardegna con una capacità totale di circa 200 MW, nonché una linea di finanziamento per l’acquisizione di un asset operativo.
“Da quando siamo entrati in Italia nel 2010, questo è rimasto uno dei nostri mercati chiave e questo finanziamento ci permetterà di continuare a convertire la nostra pipeline di oltre 1,5GW solo in Italia”, ha commentato l’amministratore delegato di Sonnedix, Axel Thiemann, sottolineando il vantaggio competitivo della società, dovuto alle relazioni bancarie e alla presenza in diversi paesi.
I presenti contenuti sono tutelati da diritti d’autore e non possono essere riutilizzati. Se desideri collaborare con noi e riutilizzare alcuni dei nostri contenuti, contatta: editors@pv-magazine.com.",https://www.pv-magazine.it/wp-content/uploads/sites/14/2024/02/Screenshot-2024-02-06-at-10.04.23-150x150.png,italy
4,https://www.pv-magazine.it/2024/02/06/tesvolt-alla-conquista-del-mercato-italiano-degli-accumuli/,"BATTERIE,MERCATI & POLITICHE,STOCCAGGIO,SVILUPPI DI MERCATO,GERMANIA,ITALIA",SERGIO MATALUCCI,2024-02-06,Tesvolt alla “conquista” del mercato italiano degli accumuli,"Tesvolt utilizzerà un ufficio a Milano per facilitare l’accesso al mercato, con formazione in loco per gli installatori partner, al fine di “conquistare” il mercato italiano anche attraverso un nuovo sistema di accumulo a batterie per uso commerciale e industriale che la società tedesca presenterà al KEY a fine mese.
“L’ingresso nel mercato italiano non solo rappresenta un’altra pietra miliare nella crescita dell’attività di Tesvolt, ma anche un passo strategico per il futuro della transizione energetica in Europa. L’Italia offre opportunità affascinanti, perché il Paese ha una forte affinità con le energie rinnovabili e una domanda in costante crescita di soluzioni innovative di sistemi di accumulo”, ha commentato Daniel Hannemann, CEO e co-fondatore di Tesvolt.
Nel 2022, un sistema di accumulo a batteria su due nel segmento commerciale tedesco è stato fornito da Tesvolt, produttore con sede a Wittenberg.
Gli installatori possono ricevere una formazione online sui sistemi di accumulo di energia Tesvolt nel Tesvolt Partner Portal. Possono anche pianificare i loro progetti di accumulo, configurare i loro sistemi ed effettuare gli ordini online. La società tedesca spiega anche che “il sistema di accumulo può essere messo in funzione in modo completamente digitale tramite un’app; tutto ciò che l’installatore deve fare è scansionare i componenti in loco utilizzando i codici QR”.
I sistemi di accumulo a batteria Tesvolt sono ottimizzati per le esigenze degli operatori commerciali.
I presenti contenuti sono tutelati da diritti d’autore e non possono essere riutilizzati. Se desideri collaborare con noi e riutilizzare alcuni dei nostri contenuti, contatta: editors@pv-magazine.com.",https://www.pv-magazine.it/wp-content/uploads/sites/14/2024/02/Produktion_Batteriemodule2_Quelle-TESVOLT-150x150.jpg,italy
