url,tag,author,updated_date,title,contents
https://www.pv-magazine.com/2023/06/09/worlds-largest-pumped-hydro-storage-project-secures-key-contracts/,"ENERGY STORAGE,UTILITY SCALE STORAGE,AUSTRALIA",DAVID CARROLL,"JUNE 9, 2023",World’s largest pumped hydro storage project secures key contracts,"From pv magazine Australia
Twin Hills Engineering and Drilling and Water2Wire – a joint venture partnership between international engineering heavyweight GHD, London-headquartered civil engineers Mott MacDonald and Canadian engineering and design firm Stantec – have been awarded the first contracts for the Queensland state government’s AUD 12 billion ($8.06 billion) Pioneer-Burdekin pumped hydro energy storage (PHES) project.
The project is being touted as possibly the largest PHES project in the world. Proposed to be delivered in two stages by 2035, when complete the project is expected to provide 5 GW of generation capacity for 24 hours – equivalent to about half of the Australian state’s peak usage.
Queensland Energy Minister Mick de Brenni said the project, forecast to unlock high-quality wind and solar generation sources in the nearby Central and Northern Queensland Renewable Energy Zones, will provide the long-term storage and reliability needed to power Queensland’s clean energy future.
“The project is the cornerstone of the Queensland Energy and Jobs Plan,” he said. “This mega pumped hydro project will act like a giant battery, and when connected to our Queensland SuperGrid, will underpin the reliability of our publicly owned grid by storing the energy generated by our renewable energy zones.”
With initial studies indicating there is the potential for stage one of the project to be completed by 2032, Twin Hills Engineering and Drilling has this week been awarded the geotechnical contract, which will form a key part of the exploratory stage for the project.
The six-month shallow drilling program will be used to inform project design, a fundamental part of the project’s Detailed Analytical Report. The report is due to be presented to the Queensland government in 2024.
The awarding of the geotechnical contract comes after the Water2Wire joint venture partnership was appointed to deliver the front-end engineering and design (FEED) for the Pioneer-Burdekin project.
Queensland Hydro, the new publicly owned entity established to oversee the delivery of the state government’s planned pumped hydro projects, said the Water2Wire joint venture will bring significant engineering, hydropower expertise and capability to determine the technical specifications, schedule and cost parameters for the project.
The Water2Wire team has delivered FEED design multiple projects including for Queensland Hydro’s proposed 2 GW Borumba pumped hydro project, Genex’s 250 MW Kidston PHES in north Queensland, the 15 GW Lake Onslow PHES in New Zealand, and the 3 GW Bath County PHES in the United Kingdom.
Queensland Hydro Chief Executive Officer Kieran Cusack said the appointments were an asset to the project.
“Both Twin Hills and Water2Wire had outstanding tender responses that showcased both their impressive capability and strong local links,” he said. “With Water2Wire’s recent work on high-profile projects like Borumba and Kidston and their collective expertise in delivering pumped hydro projects around the world they will be a great asset to this project. We’re also delighted to be working with a local family business employing local workers.”
It is anticipate the project will support more than 3,000 jobs during construction and de Brenni said it will also offer “hundreds of supply chain opportunities. It’s regions like Mackay that are at the centre of this Queensland’s renewable energy transformation – which will unleash new industrial jobs in hydrogen, renewables, manufacturing, and critical minerals.”

This content is protected by copyright and may not be reused. If you want to cooperate with us and would like to reuse some of our content, please contact: editors@pv-magazine.com."
https://www.pv-magazine.com/2023/06/09/china-solar-module-prices-dive/,"MARKETS,MODULES & UPSTREAM MANUFACTURING,OPINION & ANALYSIS,TECHNOLOGY AND R&D,WORLD",,"JUNE 9, 2023",China solar module prices dive,"The Chinese Module Marker (CMM), OPIS’ benchmark assessment for modules from China, declined for a second week running to $0.198 per W as dramatic downslides in the country’s upstream segments pushed module prices to their lowest level in almost three years, according to OPIS data.
This 7.48% plummet – the largest percentage drop so far this year – takes CMM below the psychologically significant level of $0.2/W.
Multiple market players pinned the slump on growing polysilicon capacity in China and how China-made polysilicon is essentially back at what one source calls a “reasonable price.” The latter, which OPIS assesses as China Mono Grade, continued its inexorable march downwards to 107.5 CNY ($15.10)/kg.

China module prices are dropping rapidly, with opening bids for some recent domestic projects all lower than CNY1.5/W, noted multiple sources. Downstream demand is huge, with 48.31 GW installed in the first four months of this year. Yet module shipments are still lower than expected as prospective buyers, expecting further price drops, delay their purchases, sources also concurred. Buyers will wait as long as their project allows them to do so, explained one veteran market observer, adding that he did not expect falling module prices to level off.
OPIS expects significant price volatility ahead as buyers and sellers alike adopt a wait-and-see approach to the China module market’s direction. Pent-up demand from what one source calls “all-time high” procurement, with China’s National Energy Administration approving a third batch of Gigawatt-base power projects, means falling prices could find a floor.
According to the China Photovoltaic Industry Association, the country is set to install up to 120 GW of solar power in 2023. But manufacturers should have big module inventories accumulating, noted another source, which if unleashed on the market may suggest more downslides on the horizon.
OPIS, a Dow Jones company, provides energy prices, news, data and analysis on gasoline, diesel, jet fuel, LPG/NGL, coal, metals, and chemicals as well as renewable fuels and environmental commodities. It acquired pricing data assets from Singapore Solar Exchange in 2022 and now publishes the OPIS APAC Solar Weekly Report.
The views and opinions expressed in this article are the author’s own, and do not necessarily reflect those held by pv magazine.
This content is protected by copyright and may not be reused. If you want to cooperate with us and would like to reuse some of our content, please contact: editors@pv-magazine.com."
https://www.pv-magazine.com/2023/06/09/us-solar-market-expected-to-triple-in-size-by-2028/,"COMMERCIAL & INDUSTRIAL PV,MARKETS,RESIDENTIAL PV,UTILITY SCALE PV,UNITED STATES",ANNE FISCHER,"JUNE 9, 2023",US solar market expected to triple in size by 2028,"From pv magazine USA
The US solar industry installed 6.1 GW of capacity in the first quarter of 2023, according to the US Solar Market Insight Q2 2023 report from the Solar Energy Industries Association (SEIA) and Wood Mackenzie.
Several factors contributed to the record first quarter, not the least of which was the surge in demand triggered by the Inflation Reduction Act (IRA) of 2022. But in addition to the surge, projects are beginning to move forward after being delayed due to supply chain challenges that began during the Covid-19 pandemic.
Wood Mackenzie forecasts that the solar market will triple in size over the next five years, amounting to a total installed solar capacity of 378 GW by 2028.
 
A key component to the IRA is the domestic content adder. In May, the US Department of the Treasury and Internal Revenue Service (IRS) released guidance that provides detailed information about the domestic content bonus under the Inflation Reduction Act. Solar power projects that use domestic content are eligible for the full 30% tax credit can increase their tax credit by an additional 10%, to 40% in total, and 0.3 ¢/kWh for projects that use the Production Tax Credit.
In addition to the tax credits for clean energy developers, the IRA provides incentives for the build out of US manufacturing, and it has effectively stimulated a number of companies to announce the intent to set up domestic manufacturing facilities. The SEIA/Wood Mackenzie report expects that, as a result of the surge in announced manufacturing facilities, domestic module capacity will rise from fewer than 9 GW today to more than 60 GW by 2026. At least 16 GW of module manufacturing facilities are under construction as of the end of first quarter of 2023.
In addition to the domestic content adder, the IRA specifies adders for energy communities and low-income community projects, intending to drive investments in underserved communities.
“As the Inflation Reduction Act begins to flex its muscle and drive demand, the U.S. solar and storage industry is eagerly awaiting further guidance on some of the most impactful pieces of the law,” said Abigail Ross Hopper, the president and CEO of SEIA. “Timely, specific, and workable implementation guidance from the administration will have a major impact on our success in both the near and long-term. This guidance is powerful, and if done correctly, it could unlock new market potential across the country.”
The Q2 Solar Market Insight Report paints a picture of an upward trajectory, but that growth is not without some complexity. First off, navigating the maze of credits within the IRA remains complex and challenging. And secondly, it could take a few years before a full range of US-made soalr materials and components are available. The report points to the fact that there currently is no crystalline silicon cell manufacturing in the United States, although a few manufacturers have announced intentions of doing so, but it will be some time before the facilities are operational.
Michael Parr, executive director of Washington DC-based trade body the Ultra-Low Carbon Solar Alliance, says making polysilicon, wafers, and cells is capital intensive and that is why we are initially seeing so many announcements that are instead about module manufacturing. Any mismatch between US module and cell production capacity would see module makers remain dependent on imported cells for the foreseeable future.
“The US solar industry is slowly starting to see supply chain relief,” said Michelle Davis, head of global solar at Wood Mackenzie and lead author of the report. “At the same time, qualifying for the domestic content adder will be a very complex process for solar project developers. Even once crystalline silicon cell manufacturing is established, many other components will need to be produced domestically before projects can qualify.”
The SEIA/Wood Mackenzie report also notes that the IRA rules leave the residential market without clarity because they don’t specify how adders and credits can be applied. However, the residential market grew 30% over the same quarter last year. The report estimates that the residential segment installed 1.6 GW of solar capacity in Q1 2023, and is on track to add 36 GW of solar over the next five years, growing at an average annual rate of 6%.
Looking at the utility-scale market, it rebounded from a difficult 2022 and installed a record 3.8 GW of capacity. The report points to delayed projects moving forward due to fading supply chain challenges as more module importers were able to satisfy the documentation requirements under the Uyghur Forced Labor Prevention Act (UFLPA).
The commercial market installed a record 391 MW, and is on track for 12% growth in 2023. The only market downturn noted in the report is community solar, which dropped 13%, installing only 212 MW, in large part due to interconnection backlogs.
Overall the solar industry accounted for 54% of all new electricity-generating capacity added to the grid in the first quarter of 2023.
This content is protected by copyright and may not be reused. If you want to cooperate with us and would like to reuse some of our content, please contact: editors@pv-magazine.com."
https://www.pv-magazine.com/2023/06/09/us-export-import-bank-provides-900-million-for-500-mw-of-solar-in-angola/,"MARKETS,UTILITY SCALE PV,ANGOLA",PILAR SÁNCHEZ MOLINA,"JUNE 9, 2023",US Export-Import Bank provides $900 million for 500 MW of solar in Angola,"EXIM has agreed to provide $900 million in funding to Angola's Ministry of Energy and Water for the deployment of a 500 MW of utility-scale PV capacity.
“This transaction not only aligns with President Biden’s PGII initiative, but also advances EXIM’s efforts to promote clean energy exports, strengthen the US-Africa commercial relationship and support U.S. exporters and American workers facing foreign competition,” said EXIM President Reta Jo Lewis.
The projects were initially announced during the G7 summit of 2022 by the government of Angola and the two developers, AfricaGlobal Schaffer and Sun Africa.
According to the latest statistics from the International Renewable Energy Agency (IRENA), the African country had an installed PV capacity of 297 MW at the end of 2022.
By 2025, Angola hopes to reach an access rate of 65% and a total installed capacity of approximately 10 GW. Current installed capacity, however, is only 5.6 GW, although only 4.5 GW is available.
This content is protected by copyright and may not be reused. If you want to cooperate with us and would like to reuse some of our content, please contact: editors@pv-magazine.com."
