url,tag,author,updated_date,title,contents
https://www.pv-magazine.com/2023/01/12/europe-japan-led-global-hydrogen-patents-in-2011-20-period/,"HYDROGEN,TECHNOLOGY,TECHNOLOGY AND R&D,CHINA,EUROPE,JAPAN,WORLD",SERGIO MATALUCCI,"JANUARY 12, 2023","Europe, Japan led global hydrogen patents in 2011-20 period","Europe and Japan led in terms of new global hydrogen patent applications in the 2011-20 period, according to a new report by the IEA and the EPO.
Japan was the region in which the number of new hydrogen patents rose at the fastest pace throughout the 2011-20 period, with compound average growth rates of 6.2%. The United States is the only part of the world in which the number of patents decreased over the same period.
South Korea and China accounted for around 6% and 4% of total patents, but they showed solid growth, with average annual growth rates of 12.2% and 15.2%, respectively. South Korea, in particular, is focusing on emerging end-use applications for hydrogen.
The European chemical industry, mainly in Germany and France, dominated innovation in established hydrogen technologies. However, the new hydrogen patent heavyweights are primarily Japanese and Korean companies in the automotive and chemical sectors. Such companies tend to focus on electrolysis and fuel cell technologies.
“About half of international patent families (IPF) in hydrogen technologies in the period 2011-20 were related to hydrogen production,” said the IEA and the EPO. “The other IPF were split between end-use applications of hydrogen and technologies for the storage, distribution and transformation of hydrogen.”
Patenting has shifted away from fossil fuel-based tech to low-emission methods. The report notes the increase in electrolysis technology innovation. Japan led patents in alkaline and PEM technologies between 2011 and 2020.
“The EU 27 and other European countries are active in both patenting and manufacturing – notably in SOEC technologies – while also making significant contributions in terms of PEM and alkaline technologies,” said the IEA and the EPO.
The two institutions have called for strong policies to make low-emission hydrogen more cost-competitive. They have noted that technology improvements across the value chain will be needed for hydrogen to play a “major role” in the energy transition.
This content is protected by copyright and may not be reused. If you want to cooperate with us and would like to reuse some of our content, please contact: editors@pv-magazine.com."
https://www.pv-magazine.com/2023/01/12/first-attempt-to-build-solar-cells-based-on-gold-halide-hybrid-perovskite/,"MODULES & UPSTREAM MANUFACTURING,TECHNOLOGY AND R&D,SWEDEN",EMILIANO BELLINI,"JANUARY 12, 2023",First attempt to build solar cells based on gold polyhalide hybrid perovskite,"Researchers at the Research Institute of Sweden (RISE) have proposed the use of gold polyiodide compounds as the active layers in monolithic solar cells.
“We are seeking to build solar cells based on non-toxic gold, which opens up other application areas, such as consumer electronics, flexible electronics and indoor applications, where the price is not always the most critical factor,” researcher Allan Starkholm told pv magazine. “These areas do not necessarily require super high efficiencies. More importantly, the ideas behind these new materials could be used as concepts for new materials and in conventional perovskites as well to possibly boost efficiencies.”
The research group proposed to use, in particular, two pseudo-2D gold polyiodide compounds known as [DodMe2S][AuI4][I3] and [Et3S][AuI4][I5], which yielded optical bandgaps of 1.40 and 1.25 eV, respectively.
“These narrow bandgaps are akin to some recently reported gold perovskite-type compounds and indicate suitability for photovoltaics,” they said.
The academics used polyiodide ionic liquids (PIL) as a precursor solution for the deposition of the compounds as thin films. They said high vacuum and high temperatures should be avoided when assembling solar-cell devices involving the above-mentioned compounds.
They built lead-free solar cells based on the two compounds as the absorber layers using a device structure consisting of a tin oxide (FTO) substrate, titanium oxide (TiO2) films, a zirconium dioxide (ZrO2) interlayer, a nickel(II) oxide hole transporting layer and a carbon electrode.
Tested under standard illumination conditions, the champion solar cell developed by the scientists achieved a power conversion efficiency of 0.052%. “The reference measurements show that there is great potential for improvement using that device structure in ambient conditions,” Starkholm stated.
“Our work did not really include an in-depth cost analysis but one of the raw materials are based on gold, which is relatively expensive compared to the lead used in the conventional perovskite solar cells,” he added, when asked about the cell costs. “It depends a bit on the application area also, but it would likely be more expensive than the conventional ones.”
The scientists described the new perovskite cell tech in “Gold Polyiodide Hybrid Perovskite Solar Cells,” which was recently published in ACS Publications.
“The current results demonstrate a possible route toward new design strategies for lead-free, organic–inorganic complex metal-halide/polyiodide materials and the possibility of assembling stable monolithic solar-cell devices based on materials that usually are considered too sensitive to harsh processing conditions,” said the scientists.
*The article has been updated on January 12 to reflect that the cell efficiency is 0.052%.
This content is protected by copyright and may not be reused. If you want to cooperate with us and would like to reuse some of our content, please contact: editors@pv-magazine.com."
https://www.pv-magazine.com/2023/01/12/solar-powered-water-desalination-tech-for-off-grid-applications/,"COMMERCIAL & INDUSTRIAL PV,INSTALLATIONS,SUSTAINABILITY,TECHNOLOGY,TECHNOLOGY AND R&D,ASIA,CENTRAL & SOUTH AMERICA,MIDDLE EAST,NORTHERN AFRICA,SUB-SAHARAN AFRICA",BEATRIZ SANTOS,"JANUARY 12, 2023",Solar-powered water desalination tech for off-grid applications,"Boreal Light, a German technology company, has developed a PV-powered water desalination machine for off-grid applications.
The Winture Planet Cube machines have capacities from 1,000 liters per hour to 50,000 liters per hour. The size of the solar array needed to power these machines is a function of three factors: their capacity, the salinity of the water, and the depth of the borehole which water is extracted from. The technology uses seawater, wastewater, brackish water, or surface area as inputs.
“On average, a machine of 2,000 liters per hour needs a PV array with an installed capacity of 11 kW, for most projects we developed in Sub-Saharan Africa,” Hamed Beheshti, CEO of Boreal Light told pv magazine. Other projects include a 15,000 liter per hour machine in Iraq using a 90 kW PV system.
Boreal Light oversizes the solar arrays to sidestep the need for using batteries.
“We are extremely against using batteries because it brings a lot of extra costs, transportation, and maintenance. Instead of storing electricity from the solar panels, we produce more water and store it – it is way cheaper,” said Beheshti. “The machine in the Iraq project, for example, needs a maximum of 49 kW of electricity.”
The excess water is usually used for fish farming, irrigation, and sanitation. The company also uses the electricity excess for charging electrical cargo bikes used for distributing water, and for charging battery banks of nearby schools.
The solution uses 460 W monocrystalline silicon PV panels from DAH solar. The water desalination machines employ a low-pressure reverse osmosis membrane with a lifetime of three to five years and are built to last 25 years, according to Beheshti. Their production cost of water from direct seawater is €0.50/m3. For brackish water, the price decreases to €0.28/m3. Depending on capacity, the machine can cost from €20,000 to €1 million. The company’s clients range from aid organizations and NGOs to businesses, farms, and hospitals.
The Winture Planet Cube is connected to the internet via a SIM card, which allows Boreal Light to perform remote monitoring and control the machines from Berlin.
“We can read 36 sensors in the machines from Berlin. We can also give orders and update the machine software with a click. Such remote controlling for us is part of making the operation simple in remote parts of the world,” said Beheshti.
The company claims that 80% of the machine’s maintenance can be performed by a standard plumber using only a wrench and a screwdriver. It currently has projects in 14 countries across Africa, Southeast Asia, Latin America, and the Middle East.
*This article was amended on 13/01/2023 to reflect the price of water is per m3, not cm3.
This content is protected by copyright and may not be reused. If you want to cooperate with us and would like to reuse some of our content, please contact: editors@pv-magazine.com."
https://www.pv-magazine.com/2023/01/12/solax-releases-mini-single-phase-residential-string-inverters/,"HIGHLIGHTS,INVERTERS,RESIDENTIAL PV,TECHNOLOGY AND R&D,CHINA",EMILIANO BELLINI,"JANUARY 12, 2023",Solax releases mini single-phase residential string inverters,"Solax Power has developed new mini string inverters for residential rooftop applications. The Chinese company says the X1-Mini G4 inverters are compatible with heat pump systems and home EV chargers.
There are eight versions of the single-phase inverters with nominal power ranging from 0.6 kW to 3.3 kW. They can work with maximum PV system input capacities of 1.2 kW to 6.6 kW.
“The low starting voltage of 50 V ensures that X1-MINI G4 can generate electricity for a longer time, bringing more profit to customers.” the manufacturer said. “Additionally, it supports Modbus for the extendable parallel solution as well as DataHub for mass management and extension solution.”
The inverters feature efficiencies of 98% and a European efficiency rating of 96% to 97%. They have maximum MPPT input currents of 16 A, an MPP voltages ranging from 40 V to 550 V for 2.5 kW, 3 kW and 3.3 kW. The inverters weigh 5.2 kg and measure 290 mm × 206 mm × 120 mm. They are also equipped with IP66-rated protection and a cooling system based on natural convection.
“X1-MINI G4 is designed for high reliability since it is equipped with built-in AC/ DC Type II SPD and export control function,” said Solax Power. “It also supports I-V curve diagnosis, external Rapid Shutdown Device (RSD), and optional ARC detection (AFCI) to guarantee overall protection during operation.”
The Chinese manufacturer recently released its X1-Boost G4 inverters, designed for residential applications, with nominal power ratings of 2.5 kW to 6 kW.
This content is protected by copyright and may not be reused. If you want to cooperate with us and would like to reuse some of our content, please contact: editors@pv-magazine.com."
https://www.pv-magazine.com/2023/01/12/india-could-potentially-add-45-gw-of-corporate-renewables-by-2027/,"MARKETS,UTILITY SCALE PV,INDIA",UMA GUPTA,"JANUARY 12, 2023",India could potentially add 45 GW of corporate renewables by 2027,"From pv magazine India
Bridge to India says corporate renewables deployment will likely grow by 22% per year over the next few years, reaching 45 GW by 2027. Open-access PV and rooftop solar will remain the dominant sources of renewable power for corporate consumers.
“Renewable energy certificates (RECs) have had a complex trading history because of frequent and unclear regulatory provisions. Further, corporates are not keen to incur extra costs for renewable power obligation (RPO) compliance,” said Bridge to India. “Green power trading on the exchange commenced in August 2020 but the volumes are very small due to limited availability of untied capacity.”
The report estimates that India had installed 16,099 MW of overall renewables capacity for offtake through open access and 8,269 MW of commercial and industrial rooftop solar as of September 2022.
Open access is a mechanism under which consumers can buy electricity directly from power producers, rather than electricity distribution companies (discoms).
“Utility-scale private-sector developers are bullish on the open-access market primarily to diversify offtake risk away from state discoms,” said Bridge to India. “Most of them have exited the rooftop solar business due to small scale and intensive management effort.”
Bridge to India expect the new renewable additions for corporate offtake to remain geographically concentrated.
“Maharashtra, Tamil Nadu, and Karnataka remain the most attractive markets. Under-penetrated markets in Uttar Pradesh, Gujarat, Odisha, and Chhattisgarh are also expected to see more growth,” it said. “Other states like Haryana, Andhra Pradesh, Telangana, and Punjab with a history of regressive policy actions are expected to see limited growth but could open up with favorable policies.”
This content is protected by copyright and may not be reused. If you want to cooperate with us and would like to reuse some of our content, please contact: editors@pv-magazine.com."
