url,tag,author,updated_date,title,contents
https://www.pv-magazine.com/2021/01/19/chinese-pv-industry-brief-another-21-gw-of-module-capacity-and-record-pv-growth-for-spic/,"HIGHLIGHTS,INVERTERS,MODULES & UPSTREAM MANUFACTURING,UTILITY SCALE PV,CHINA",VINCENT SHAW,"JANUARY 19, 2021",Chinese PV Industry Brief: Another 21 GW of module capacity and record PV growth for SPIC,"PV module manufacturer Longi announced on Monday it had signed an agreement with the government of Xi’an City, Shaanxi province, where the company is headquartered, to build a manufacturing facility with a capacity of 15 GW for both modules and cells. The company will invest around RMB18 billion (US$2.73 billion) in the new factory, which is expected to be completed in two phases by March 2023. More details on the module technology that will be produced at the factory were not provided.
Solar panel maker Risen stated on Monday it will build a new factory in Jintan county, Jiangsu province. The new manufacturing facility will have a capacity of 4 GW for solar cells and 6 GW for solar modules. The total investment is expected to reach around RMB5.28 billion.
Polysilicon manufacturer GCL-Poly on Friday continued its fundraising efforts as the deadline for settling US$500 million of senior notes approaches at the end of the month. There was no opposition from shareholders to the proposed sale of 217 MW of Chinese solar project capacity to state-owned Xuzhou State Investment and Environmental Protection Energy, to raise RMB985 million (US$152 million) and remove RMB951 million of liabilities from GCL’s books. The company will book a RMB27.4 million (US$4.23 million) loss on the sale, based on the projected value of the solar plants. GCL company will have to settle US$500 million of senior notes by January 30 and the terms of a proposal for investors to suspend payment for three years are set to expire in a week's time.
Panel producer Solargiga on Friday reported significant rises in revenue and shipment volume figures for last year, compared with 2019. The unaudited figures showed revenue rose more than 37% from RMB4.4 billion (US$678 million) in 2019 to RMB6.04 billion. Shipments rose almost 65%, from 4.13 GW to 6.81 GW, according to the company.
China's largest energy company, the State Power Investment Corporation (SPIC), deployed 22.6 GW of renewable energy power generation capacity in 2020. Of this installed power, around 10.28 GW was for solar installations and approximately 11.58 GW for wind farms. At the end of last year, SPIC reached a cumulative clean energy capacity of 98.88 GW, of which 60.49 GW is solar, which makes the company the largest PV asset owner in the world. Its total power generation capacity has now reached 176 GW, of which 56.09% is from clean energy.
This content is protected by copyright and may not be reused. If you want to cooperate with us and would like to reuse some of our content, please contact: editors@pv-magazine.com."
https://www.pv-magazine.com/2021/01/19/ifc-says-green-recovery-could-drive-2-5tn-renewables-market-this-decade/,"COMMERCIAL & INDUSTRIAL PV,COVID-19,DISTRIBUTED STORAGE,EMPLOYMENT,ENERGY STORAGE,FINANCE,GRIDS & INTEGRATION,HIGHLIGHTS,HYDROGEN,MARKETS,MARKETS & POLICY,MINIGRID,POLICY,RESIDENTIAL PV,UTILITY SCALE PV,UTILITY SCALE STORAGE,ARGENTINA,BANGLADESH,BRAZIL,CHINA,COLOMBIA,COTE D'IVOIRE,EGYPT,INDIA,INDONESIA,JORDAN,KENYA,MEXICO,MOROCCO,NIGERIA,PHILIPPINES,RUSSIA,SERBIA,SOUTH AFRICA,TURKEY,UKRAINE,VIETNAM",MAX HALL,"JANUARY 19, 2021",IFC says green recovery could drive $2.5tn renewables market this decade,"Channeling Covid-19 stimulus money towards renewables generation capacity as part of a green recovery could create 42.8 million jobs and a ten-year, $2.5 trillion investment opportunity in some of the world's main emerging markets.
The International Finance Corp (IFC) private-sector arm of the World Bank has crunched the numbers and calculated a green recovery from the pandemic could generate 213 million jobs and $10.2 trillion of investment this decade in 21 emerging market economies.
As part of that calculation, carried out with U.S.-based market research company Guidehouse Insights, the IFC stated solar panels would supply 83% of the estimated $900 billion investment and 23.9 million jobs which could be created by funding small-scale, ‘distributed' generation and energy storage systems.
The IFC report considered ten key sectors which would reap the biggest rewards in the emerging markets studied, in terms of investment opportunity, job creation and greenhouse gas reduction. The sectors of the economy examined included the expansion of renewables capacity – with grid scale and distributed systems considered separately; the decarbonization of heavy industry; and the greening of urban transport.
Utility scale renewables investment over the next ten years could offer a $1.6 trillion investment opportunity, create 18.9 million new jobs and remove 813 million tons of greenhouse gas emissions, according to the study. The report compiled figures across 21 nations in six global regions. Grid scale renewables could offer a $787 billion investment and 7.9 million new jobs in the East Asia and Pacific region comprised of China, Indonesia, the Philippines and Vietnam, according to the IFC, with most of that opportunity represented by China, the world's solar capital.
The South Asian markets of Bangladesh and India would offer a $424 billion grid scale renewables opportunity and 4.3 million jobs to 2030; followed by Latin America (Argentina, Brazil, Colombia and Mexico), with $187 billion and 2.5 million jobs; Europe (Russia, Serbia, Turkey and Ukraine), with $83.7 billion and 1.4 million openings; sub-Saharan Africa (Côte d'Ivoire, Kenya, Nigeria and South Africa), with $63.6 billion and 2.2 million new positions; and the Middle East and North Africa (Egypt, Jordan and Morocco), with a $46.3 billion market and the potential for 500,000 jobs.
In addition to the usual calls for governments to help by drafting supportive policy, offering skills training and reducing planning red tape, the IFC demonstrated its private-sector credentials by advising against the application of local content requirements and state-owned-grid-company monopolies. The authors of the report also stressed the need to amend regulatory systems to properly reward flexible grid and energy storage capacity.
In terms of the rewards on offer from expanded small scale and off-grid renewables capacity, the report split the anticipated investment opportunity as $570 billion for residential systems and $341 billion from commercial assets, with a potential 23.9 million new jobs available this decade. East Asia would offer a $525 billion market and 13.2 million jobs, according to the study; South Asia $283 billion and 7.1 million jobs; Latin America $52.7 billion and 1.9 million positions; Europe $33.4 billion and 900,000 opportunities; sub-Saharan Africa $10 billion and 500,000 vacancies; and the Middle East and North Africa (MENA) region $7.3 billion and 200,000 openings.
The IFC called for a standardized small scale renewables quality ratings system to help investors aggregate such small installations into more attractive and easier-to-manage portfolios.
Despite trailing green hydrogen as one of two solutions for decarbonizing heavy industry, however, the report gave the impression the sustainable form of the fuel had been tacked on as an afterthought, as most of the heavy industry section emphasized the promise of carbon capture, usage and storage – to the extent no estimates or recommendations were offered up related to green hydrogen.
With the study considering the global textile industry as one of its key emerging market sectors for decarbonization, the IFC cited its work to drive renewables capacity among the supply chain companies of global clothing brands Levi and H&M, but the real headline figures were related to the greening of urban transport.
With the IFC considering private transport and commercial delivery fleets under that header, along with public transport, the study estimated the sector could represent a $2.7 trillion market this decade and supply 53.4 million new jobs. Recommendations included expanding public transport networks and cashless payment; reducing the cost of electric vehicle finance; local authorities expanding charging infrastructure; staggering public employee working times to ease rush hours; and applying sustainability requirements to support for motor manufacturers.
The other key sectors studied in the IFC report were energy efficient building retrofits; low carbon municipal waste and water; nature-based urban infrastructure; climate-smart agriculture; and low carbon shipping and aviation.
This content is protected by copyright and may not be reused. If you want to cooperate with us and would like to reuse some of our content, please contact: editors@pv-magazine.com."
https://www.pv-magazine.com/2021/01/19/is-china-really-opening-its-energy-market-to-eu-enterprises/,"HIGHLIGHTS,MARKETS,CHINA",EMILIANO BELLINI,"JANUARY 19, 2021",Is China really opening its energy market to EU enterprises?,"China and the European Union recently signed the Comprehensive Agreement on Investment (CAI), which will give EU companies more access to the Chinese market. Please describe the access that EU companies had to the Chinese market before the deal – was it impossible to get market share?
Prior to signing the CAI, European companies either teamed up with local Chinese partners or set up their own 100% subsidiaries. Their engagement covered a wide range along both the upstream and downstream sectors of the renewable market – as a manufacturer, service provider, or project developer.
The deal sets out clear rules for Chinese state-owned enterprises, the transparency of subsidies, forced technology transfers, and other distortive practices. Which provisions are really creating conditions for a more level playing field in China?
Transparency in all aspects, regarding the announcement of new policies, administrative regulations, access to and the mobilization of local financing, the allocation of subsidies, the removal of provisions designed to ensure that the local Chinese partner will be the majority stakeholder, just to name a few.
Image: AECEA
The Chinese energy market is still dominated by large state-owned entities (SOEs) – how can European companies compete in this environment?
True, large SOEs dominate the downstream energy market, whereas the upstream sector is rather dominated by privately owned Chinese companies, particularly as far as the solar PV market is concerned. Given the size of these SOEs, it is undeniably challenging for European companies to compete on the same level. However, not impossible either – EU companies may not develop gigawatt-size projects, but can choose to develop smaller-scale projects instead. On the contrary, I assume, transmission and distribution of power via the national grid will not be an option for foreign companies … due to reasons of national security. Where solar manufacturing is concerned, currently I can’t imagine a single European company being in the position to compete with countless double-digit-gigawatt factories in China.
Is it possible that big European players and utilities may build, own, and operate energy assets in China in the near future? Would a similar development only be possible if these big companies seek Chinese partners?
Yes, we have seen companies like Total, Engie or Siemens being active in the downstream sector – usually through local partnerships. However, once EU companies have gained sufficient on-the-ground experience, they may decide to move on without a local partner in future.
Will there be a real chance for EU-based companies to gain market share in the PV sector? In which market segments is this most likely to happen?
Provided EU companies have an appetite for gaining a foothold in the Chinese solar PV market, I would reckon that the commercial and industrial rooftop segment might be the most promising, because this to date is a largely untapped segment. However, to put this into perspective, at the beginning of 2021, China was home to approximately 320,000 companies operating in the entire solar sector. And last year alone, another 58,000 companies were registered, up 22% year on year. Last year, out of in total 10.1 GW, approximately 4.57 GW of residential PV systems were installed in the province of Shandong alone. So it does not surprise that approximately up to 48,000 new companies were registered in the same province. Hence, in my view, the residential PV segment shouldn’t be the first choice of EU companies when considering the Chinese solar PV market.
Government procurement and subsidies are not covered by the deal. Does this mean that only Chinese companies will continue to win auctions and tenders for large-scale and small-sized solar?
(This year) shall be the first year that China's solar PV market enters a subsidy-free era – at least, as far as the ground-mounted and C&I rooftop segments are concerned. Hence, subsidies shall no longer be relevant in future – competition is being determined by the market. Auctions, often solely conducted by governmental entities on both the national and provincial levels, are open to locally registered companies, regardless of ownership. Tenders seeking the procurement of modules and inverters in particular are increasingly offered by large SOEs themselves. They are also open to locally registered companies, regardless of local or foreign ownership.
Could European PV products be installed in large-scale projects or rooftop arrays in China? Do you believe EU brands and technologies could become attractive for Chinese consumers, even though Chinese products are good in terms of quality?
If “Made in the EU” products would be competitive, yes. But is this realistic if one just takes the duration and costs incurred for transportation into account? True, you may have international companies based in China that prefer so-called “green labeled low-carbon footprint” products. Under such conditions, this might be an option.
Which kinds of products might be preferred?
Currently, EU solar manufacturing equipment is still in demand. And being closer to their customers, to manufacture such equipment in China, might prove to be more advantageous.
Will this agreement also increase chances for Chinese companies to operate in the EU energy market? If it is true that Chinese PV products dominate in the European market, it is also true that there are not too many energy assets owned by Chinese players in Europe. If we look at recent PV tenders in France, Germany, Spain or Italy, the winners are mostly domestic EPCs and developers.
Over the course of the last 10 years, Chinese PV manufacturers managed to establish themselves as the No. 1 suppliers in the European PV market. However, during the past one to two years, I witnessed a growing interest among Chinese companies to consider either acquiring operational assets or developing projects in certain European PV markets as well. Their interest and appetite appear to grow in this regard. However, in the future, I assume that EU tenders will mostly be won by EU players, and vice versa in China.
China and the EU have agreed to support high-level protection of the environment and labor rights. Many in Europe have strongly criticized the deal because they say it will help China maintain the status quo. But others claim these kinds of agreement will bring China closer to Western standards. Which is your opinion?
Above all, it’s commendable that such issues are explicitly addressed by the CAI. The devil will be in the details, as always. That means how relevant regulations and laws will be implemented, enforced, or eventually harmonized remains to be seen in the years to come.
This content is protected by copyright and may not be reused. If you want to cooperate with us and would like to reuse some of our content, please contact: editors@pv-magazine.com."
https://www.pv-magazine.com/2021/01/19/mitsubishi-and-japanese-university-offer-peer-to-peer-trading-alternative-to-fit-payments/,"MARKETS,MARKETS & POLICY,RESIDENTIAL PV,TECHNOLOGY AND R&D,JAPAN",MAX HALL,"JANUARY 19, 2021",Mitsubishi and Japanese university offer peer-to-peer trading alternative to FIT payments,"Japanese giant Mitsubishi and the Tokyo Institute of Technology have developed a blockchain-based system for peer-to-peer energy trading which offers an alternative income stream to solar households now the nation's feed-in tariff (FIT) incentive program has ended.
The Mitsubishi Electric Corp unit of the Japanese conglomerate and the national research university have announced the development of the system, which will be evaluated from April.
A press release issued by the two institutions yesterday revealed Mitsubishi developed the energy trading platform and Tokyo Tech the blockchain and clearing algorithm in a system which enables users to state and match trading goals without the vast banks of computing power required for the sort of blockchain set-ups used in cryptocurrency mining.
Prosumer households in Japan – capable of generating as well as consuming electricity – need a new source of revenue for any excess power they generate now new installations no longer qualify for FIT payments.
With only retail power companies allowed to sell electricity in Japan, peer-to-peer trading systems operated under the management of such entities are being tested, according to the press release.
This content is protected by copyright and may not be reused. If you want to cooperate with us and would like to reuse some of our content, please contact: editors@pv-magazine.com."
https://www.pv-magazine.com/2021/01/19/turkish-pv-manufacturer-report-reveals-countrys-annual-production-capacity-is-5610-mw-year/,"OPINION & ANALYSIS,TURKEY",,"JANUARY 19, 2021","Turkish PV manufacturer report reveals country’s annual production capacity is 5,610 MW/year","Before the report, it was not possible to obtain up-to-date, comprehensive, and consolidated data on Turkey’s solar PV panel manufacturing industry. Therefore, it was impossible to assess even the most basic information, such as how many market players there are, what their installed capacities are, what kind of technologies they employ, and how much of their production is exported, etc.
The first version was compiled from the responses of 16 of the 22 Turkish PV panel manufacturers contacted. It will be updated periodically. Manufacturing companies included in the report are: Alfa Solar, Ankara Solar, CW Enerji, Elin Enerji, Gazioğlu Solar, Gest Enerji, GTC, 2H Enerji, HT Solar, Mirsolar, Ödül Enerji, Parla Solar, Seha Solar, Schmid-Pekintaş, Smart Solar and Solarturk.
It should be noted that the August 2020 inauguration of Kalyon’s 500 MW/year PV panel integrated manufacturing plant, which includes module, cell, wafer and ingot processes, and is located in Ankara Baskent, in the Organized Industrial Zone (OIZ), occurred after the report was completed, and will be taken into account during the revision in Q1 2021.
The key findings include:
Recently, we have been witnessing serious attempts by Europe to take the leadership in PV panel manufacturing back from the Far East. Along with technology development-oriented PV module efficiency increase, becoming more competitive globally with new materials, and updated production techniques are at the heart of it. This initiative is also supported by the strategy and financial resources within the scope of the European Green Deal. We think that it is critical for the manufacturers in Turkey to closely follow this wind of change and take the advantage of strategic opportunities in this development.
The report is freely available to download.
The views and opinions expressed in this article are the author’s own, and do not necessarily reflect those held by pv magazine.
This content is protected by copyright and may not be reused. If you want to cooperate with us and would like to reuse some of our content, please contact: editors@pv-magazine.com."
https://www.pv-magazine.com/2021/01/19/smart-meters-disrupt-residential-pv-segment-in-belgiums-flanders-region/,"RESIDENTIAL PV,BELGIUM",EMILIANO BELLINI,"JANUARY 19, 2021",Smart meters disrupt residential PV segment in Belgium’s Flanders region,"Belgium's constitutional court has ruled that the regulation of the Flemish-speaking macro-region of Flanders that allows the owners of PV systems with a capacity of up to 10 kW to keep operating under net metering for up to 15 years after the grid-connection date, is unconstitutional.
The legislation, which was in force since 2019, introduced the mandatory installation of smart meters and granted residential PV system owners a 15-year grace period during which they could continue to operate under net metering with a smart digital meter, just like if they still had a standard meter. These provisions established that PV system owners could decide whether to install a smart meter and calculate net metering tariffs based on presumed electricity consumption or embrace smart meters and receive payments based on actual electricity usage.
The ruling affects more than 100,000 PV system owners and even more in the coming months, as smart meters are being rolled out, and can result in financial losses. The Flemish energy minister, Zuhal Demir, said she was disappointed by the decision of the constitutional court and said that solar system owners will be somehow compensated. “Operators of PV installations that don't have a smart meter can apply for compensation when installing it,” she explained, adding that solar arrays that were recently grid-connected will be prioritized.
“The government makes a distinction between people who have already achieved a lot of return from their investment and those who have barely achieved any return,” the minister explained. “Those who installed solar panels in 2010 have already achieved a very good return from their investment thanks to, among other things, green certificates. This is a big difference from a family that invested in 2020 and now has a financial hangover.”
The Flemish government said it will calculate the refunding amount for each installation year in euros per kilowatt of installed power, by the end of the week. Applications for the refunding will likely be accepted from the summer and first payments should be done from the autumn.
“From 14 January 2021 on, everyone with a digital meter and PV will lose net metering billing,” the managing director at Flemish renewable energy association Organisatie voor Duurzame Energie Vlaanderen, Dirk Van Evercooren, told pv magazine yesterday. “Not everyone is hit in the same way by this decision and some even benefit, because with net metering also the prosumer tariff will die,” he further explained. “This is logical, as the prosumer tariff was the counterpart decided by the regulator to compensate for the non-paid grid use by the prosumer.”
Most of Flanders' installed PV capacity is represented by PV systems not exceeding 10 kW in size installed under a green certificate scheme which expired a few years ago, or under the net metering regime, which is now expected to be replaced by a feed-in premium system based on contracts for difference.
Each of Belgium’s three macro-regions, including Wallonia and Brussels, has its own regulatory framework for solar and renewable energy. The country has the potential to reach 18 GW of solar capacity by 2040, according to a late-2017 report by grid operator Elia.
This content is protected by copyright and may not be reused. If you want to cooperate with us and would like to reuse some of our content, please contact: editors@pv-magazine.com."
