url,tag,author,updated_date,title,contents
https://www.pv-magazine.com/2021/01/19/eastern-indonesia-may-become-hub-for-large-scale-pv-deployment/,"MARKETS,MARKETS & POLICY,UTILITY SCALE PV,INDONESIA",EMILIANO BELLINI,"JANUARY 19, 2021",Eastern Indonesia may become hub for large scale PV deployment,"Indonesia's Ministry of Energy and Mineral Resources (ESDM) has announced that a big solar park will be built on a large area of land at an undisclosed location in eastern Indonesia, which includes all the islands other than Java, Sumatra, Bali, and Madura and, more specifically, provinces in Kalimantan, Sulawesi, West Nusa Tenggara, East Nusa Tenggara, West Timor, Maluku, and Irian Jaya.
“We are planning to build a solar park, like those in Abu Dhabi, Portugal and Saudi Arabia,” said minister Dadan Kusdiana, noting eastern Indonesia has a dry climate, high solar radiation levels and low rainfall.
The region is indeed particularly suitable for large scale PV deployment. “Eastern Indonesia is good because solar irradiation is generally higher than in other regions and the province of East Nusa Tenggara has one of the highest,” Marlistya Citraningrum, the program manager for sustainable energy access at the Institute for Essential Services Reform (IESR), told pv magazine. “Higher PV output means more energy generated, and the availability of cheaper land with good contour and suitable slope also means we can drive down installation cost, lowering the electricity price.”
According to her, the government needs to lower overall electricity generation costs, which are higher in eastern Indonesia because of the extensive use of diesel power plants. “Energy access remains an issue there and renewable energy must be one of the answers,” she also stated.
As for western Indonesia, Citraningrum said the region is currently facing overcapacity and new solar power plants will probably be met with reluctance from Indonesian utility PT PLN (Persero), which in December started a pre-qualification process on its procurement portal to choose independent power producers to develop utility scale solar plants. “The call for IPPs is not exactly because PLN will tender solar power plants, it is probably a measure to update their list of pre-qualified companies or to anticipate the coming presidential regulation on feed-in tariffs,” she further explained.
Indonesia began supporting large scale PV via a law issued in April 2017. The country’s cumulative installed PV capacity remains negligible, at roughly 198 MW by the end of 2019, according to the International Renewable Energy Agency (IRENA).
The Indonesian government is targeting to deploy 6.5 GW of solar by 2025 and 45 GW by 2050.
This content is protected by copyright and may not be reused. If you want to cooperate with us and would like to reuse some of our content, please contact: editors@pv-magazine.com."
https://www.pv-magazine.com/2021/01/19/measuring-outdoor-performance-in-perovskites/,"MODULES & UPSTREAM MANUFACTURING,TECHNOLOGY,TECHNOLOGY AND R&D,COLOMBIA,SPAIN",MARK HUTCHINS,"JANUARY 19, 2021",Measuring outdoor performance in perovskites,"For perovskite solar cells, demonstrating long term, stable performance is one of the largest remaining hurdles to commercialization. And since the technology’s behavior at many levels is quite different to that of more established PV technologies, simply applying the industry standards based on these might not paint a full picture of either the potential or the risks that come with this new technology.
When it comes to laboratory testing to confirm efficiency achievements and other aspects, an unofficial standard has emerged to account for the differences in perovskite’s behavior compared with silicon. This involves a longer exposure to light accompanied by monitoring of the maximum power point to ensure a stable measurement.
Measuring the long-term performance of a cell or module in an outdoor setting, however, is a more complex affair with many more factors to consider. And doing this accurately will be key to convincing the industry of perovskite technology’s potential, developing appropriate new standards to ensure quality, and opening up new pathways to further improve on efficiency and durability.
With this in mind, scientists at Jaume I University in Spain and Colombia’s University of Antioquia developed a new methodology to monitor the outdoor performance of perovskite PV modules, utilizing the ‘ideality factor’, which measures how closely actual device performance follows the calculated performance of an ‘ideal’ device. The group noted further properties of perovskite cells, such as the weak dependence of open-circuit voltage on temperature, to develop a methodology that could both determine the lifetime of a module (the time it takes for performance to degrade to 80% of its initial value) and also to better understand and limit the mechanisms that cause performance degradation.
The methodology is described in the paper High-throughput analysis of the ideality factor to evaluate the outdoor performance of perovskite solar minimodules, published in Nature Energy. To validate it, the group fabricated ‘minimodules’ of the perovskite methylammonium lead-triiodide and placed these outdoors to gather performance data.
By monitoring the ideality factor, the group was able to monitor three separate degradation patterns in the material. And for perovskite cells and modules, they suggest that reporting data on nominal operating cell temperature could offer a high throughput method for assessing outdoor performance in the future.
“The main advantage of this approach is that it provides direct physical insight related to recombination processes,” the researchers explain. “…complementary analysis and determination of [the ideality factor] can provide critical information for device characterization and the understanding of degradation processes to accelerate the optimization of this technology or other technologies with similar properties that could be under development.”
This content is protected by copyright and may not be reused. If you want to cooperate with us and would like to reuse some of our content, please contact: editors@pv-magazine.com."
https://www.pv-magazine.com/2021/01/19/total-to-acquire-20-stake-in-adani-green-energy/,"UTILITY SCALE PV,INDIA",UMA GUPTA,"JANUARY 19, 2021",Total to acquire 20% stake in Adani Green Energy,"From pv magazine India
Adani Group has announced the acquisition of a 20% minority stake in Adani Green Energy by France's Total.
The deal follows the recent acquisition by Total’s renewable unit of half the stake in Adani Green’s 2.3 GW operational PV portfolio in India.
The investment in Adani Green Energy is another step in the strategic alliance between Adani Group and Total, a partner in Adani’s natural gas business.
“This is in line with the commitment of both Adani and Total to be leading participants in the sustainable economy of the future and help India in its quest for the development of renewable energy,” Adani said. 
In 2018, Total embarked on an energy partnership with Adani by investing in Adani Gas Ltd.
To keep reading, please visit our pv magazine India website.
This content is protected by copyright and may not be reused. If you want to cooperate with us and would like to reuse some of our content, please contact: editors@pv-magazine.com."
https://www.pv-magazine.com/2021/01/19/industrial-processes-key-for-australian-solar-wind-projects/,"UTILITY SCALE PV,UTILITY SCALE STORAGE,AUSTRALIA",JONATHAN GIFFORD,"JANUARY 19, 2021","Industrial processes key for Australian solar, wind projects","From pv magazine Australia
Northern Australia is home to a number of plans to create a new clean energy export industry. The 10 GW Sun Cable solar project slated for the Northern Territory and the 15-26 GW solar and wind Asian Renewable Energy Hub (AERH) in Western Australia's Pilbara region are leading the way.
While seemingly impossibly sized, the projects are seeing support from influential energy industry analysts.
“The two mega-projects would elevate Australia to a renewable energy export superpower,” said Ernst & Young’s (EY) infrastructure advisory director Jomo Owusu, when releasing the consultancy’s 2020 Renewable Country Attractiveness.
The EY analysis noted that such projects could allow Australia to remain an energy exporter, as coal and gas exports recede.
Renewable energy analyst Michael Liebreich, the cofounder of what is now BloombergNEF, says that he too is “very impressed by the Australian developments …  it’s all about industrial processes, it might be hydrogen, it might be desalination. I would love to see them linking up with ammonia and fertilizer production as it’s easily storable and transportable. Most of the process in renewables in Australia has been on the supply side, notwithstanding the efforts of the federal government, which has just been confused and misguided. The more difficult question is demand and that’s what I like about the plans for the Pilbara.”
Liebreich explains that in locations where there is available low-cost land and a strong wind and solar resource, the cheap electricity produced at good capacity factors will cause a migration of energy intensive industries, or the production of hydrogen – the latter only when transportation challenges can be addressed.
“Wherever you can have both very cheap wind and solar – and when you connect those two then you don’t have the 22% capacity factor of solar, but you can get to 60% – then there really is an economic strategic advantage,” says Liebreich.
Crunching the numbers, Liebreich says that while sub-$0.015/kWh may not be achievable from solar in Australia today, something approaching $0.03-0.04/kWh could be possible. Adding a battery storage component, at $0.05/kWh for “the biggest batteries in the world,” then energy intensive industries could be attracted. “When these costs can be achieved then there is strong argument that all energy intensity industry will be migrating to these sorts of areas.”
Liebreich suggests that outside of Australia, some parts of the United States, some parts of China, India, Chile, and Spain, or “almost all of North Africa and the Gulf,” could support such “renewable superpower” conditions.
“They [GW-scale renewable projects] are very significant because it was not that long ago that 10 MW was the size of solar projects – maybe a little over a decade ago. When you get to 2 GW that is a lot of power.”
This content is protected by copyright and may not be reused. If you want to cooperate with us and would like to reuse some of our content, please contact: editors@pv-magazine.com."
https://www.pv-magazine.com/2021/01/19/puerto-rico-awaits-procurements-to-add-3-75-gw-solar-1-5-gw-storage/,"HIGHLIGHTS,UTILITY SCALE PV,UTILITY SCALE STORAGE,PUERTO RICO",PV MAGAZINE,"JANUARY 19, 2021","Puerto Rico awaits procurements to add 3.75 GW solar, 1.5 GW storage","From pv magazine USA
The Puerto Rico Energy Bureau has ordered utility PREPA to issue six procurements in the next 30 months, totaling 3.75 GW of solar and 1.5 GW of four-hour storage, or their equivalents.
PREPA will issue the first of the six procurements “as early in 2021 as possible,” the utility said in a regulatory filing. Regulators had set a target release date of last December for that first procurement, to secure 1,000 MW of solar and 500 MW of storage.
A study released by PREPA in mid-January, however, concludes that Puerto Rico’s grid can handle only 650 MW of utility-scale renewable generation, including existing renewables. That value does not reflect “expected system upgrades or energy storage systems that will be incorporated in the near future,” said the study, which was prepared by engineering consultants Sargent & Lundy.
“We understand that the system supports between 500 and 600 megawatts” of renewables, PREPA Board Chairman Ralph Kreil told local newspaper El Nuevo Dia, in an apparent reference to the study. “Amd the bureau understands that it must be 1,000.”
Kreil added that PREPA’s request for proposals will call for 1,000 MW of solar. “As the bureau says, and we will see what happens.”
The Puerto Rico Energy Bureau’s dockets for this matter are NEPR-MI-2020-0012 and CEPR-AP-2018-0001.
“We have 3% renewable energy” in Puerto Rico, said PJ Wilson, president of the Solar+Energy Storage Association of Puerto Rico. “We can build 2,000 MW of renewables before we get the integration challenges that they saw in Hawaii and elsewhere. Let’s get construction going on those 2,000 MW now, and solve the integration challenges for higher levels as we go.”
Wilson said that PREPA indicated last week that each solar and storage procurement would be issued via the utility’s software, PowerAdvocate. He charged that the procurements would be “posted publicly nowhere” so that “not even the energy bureau” would be able to see it. The association he leads plans to ask the energy bureau to order PREPA to post each request for proposals in a public docket.
Puerto Rico’s Act 17, enacted in 2019, requires PREPA to reach 20% renewable generation by 2022 and 40% renewables by 2025.
The energy bureau’s Final Resolution and Order on PREPA’s integrated resource plan provided a target schedule of six solar and storage procurements by June 2023, which is intended to enable the projects to go online by 2025:

Author: William Driscoll
This content is protected by copyright and may not be reused. If you want to cooperate with us and would like to reuse some of our content, please contact: editors@pv-magazine.com."
