url,tag,author,updated_date,title,contents
https://pv-magazine-usa.com/2023/09/13/a-terawatt-of-solar-module-capacity-expected-within-16-months/,"MANUFACTURING,MODULES & UPSTREAM MANUFACTURING,RESEARCH,CHINA,UNITED STATES,WORLD",JOHN FITZGERALD WEAVER,"SEPTEMBER 13, 2023",A terawatt of solar module capacity expected within 16 months,"The terawatt era has arrived, and the world is unprepared. As the industry explodes in volume, solar and related professionals must prepare, adapt – and deploy.
In its recent Q2 PV Supplier Market Intelligence report, Clean Energy Associates (CEA) highlighted significant growth in solar module manufacturing by Chinese solar module manufacturers. From a 405 GW manufacturing capacity in 2022, a projected 114% increase is expected, reaching 866 GW by the end of 2023. Following that, a subsequent 21% surge in 2024 will bring the total to an impressive 1.043 TW globally.

This rapid growth surpassed many industry predictions. Still, insiders within the Chinese government, having played a pivotal role in this boom, likely foresaw such a rise.
A closer look at the numbers reveals that by the end of 2024, Chinese domestic capacity could be responsible for approximately 0.93 terawatts of their total global capacity. Southeast Asia is anticipated to account for less than 7% (0.068 TW), the Americas just over 2% (0.023 TW), and non-China Asian markets might contribute about 1% (0.011 TW).
Major, European and American manufacturers, such as Meyer Burger and First Solar, were not considered in this study. The assessment predominantly revolved around:

The majority of this capacity is earmarked for n-type solar cells. Yet, a bottleneck seems evident in the production process. CEA’s data suggests that cell production lags behind module manufacturing, with wafer and polysilicon ingot capacities trailing by several hundred gigawatts.
China’s heavily centralized solar power market, underpinned by extensive governmental oversight, might see these predictions shift. Whether solar module manufacturing capacities will be fine-tuned remains uncertain.

Aligning with – and surpassing – these projections, Bernreuter Research suggests that long term Chinese plans include up to 3.5 TW of polysilicon manufacturing capacity by 2027. PVEL’s findings indicate that the 3.5 million metric tons of capacity might be operational by the end of next year. Considering 2.2 grams of polysilicon are required for a watt of solar panels, PVEL estimates that polysilicon supplies could generate 1.6 TW of solar modules.
If we build it, will they come?
The question remains: if this manufacturing capacity is available, will there be adequate installers, grid capacity, and batteries to absorb the surplus daytime production?
Analyst Jenny Chase of BNEF splashed a little cold-water on our enthusiasm, pointing out the reality that oftentimes, solar module factory capacity is 1.5 to 3 times greater than actual installed capacity. Underutilization of manufacturing capacity is normal.
Chase noted:
Maybe 1TW will be installed in 2025, but not just because the module factories exist.
BloombergNEF’s recent projections estimate 392 GW to be installed in 2023 and around 500 GW in 2025. These figures are based on their medium volume projections, though they also offer both lower and higher range projections.

Integrating such a large volume safely into the power grid poses daunting technical challenges. The U.S., the world’s second-largest solar market, has experienced delays in interconnections, slowing solar’s rapid ascent. Specifically, the PJM territory, within the broader United States’ Eastern Interconnection region, halted all new renewable energy projects for two years while grappling with hundreds of gigawatts of projects vying for grid access. As the U.S. interconnection queue nears 2 TW of capacity, both the time and cost of connections have escalated.

State markets have also put the brakes on their local distribution markets. When Massachusetts’ SMART program was launched, National Grid’s territory was overwhelmed with applications, causing unforeseen halts in development. Using public data, pv magazine USA predicted that National Grid’s area would instantly fill its entire 800 MW project tranche. Our prediction was spot on. Yet, the utility expressed astonishment, stating, “we’re all a little surprised by how quickly we got to this saturation.” As a result, they slammed the brakes on development, putting a billion dollars of projects on standby.
This unexpected turn prompted a state investigation. Despite this, grid connections remained sluggish, and currently, numerous substations within the state can’t accommodate additional solar projects.
China, the world’s largest renewable market, initially managed the surge in wind and solar by curtailing excess generation. They later developed a nationwide high voltage direct current (HVDC) network to channel power from the interior regions to the densely populated coast.
The growth rate of solar energy is undeniably accelerating. Having achieved our first terawatt of installed solar in early 2022, discussions swiftly transitioned to reaching 1 TW of capacity annually before the end of the decade. We then speculated that a second terawatt might be realized in just three years.
There’s a budding optimism that we might witness a unique milestone: a terawatt installed within a single year in the near future. Truly, that would be an accelerating transition.
This content is protected by copyright and may not be reused. If you want to cooperate with us and would like to reuse some of our content, please contact: editors@pv-magazine.com."
https://pv-magazine-usa.com/2023/09/13/microgrids-in-the-spotlight-on-wednesday-walking-tour-at-re-in-las-vegas/,"MARKETS & POLICY,MICROGRID,UNITED STATES",PV MAGAZINE,"SEPTEMBER 13, 2023",Microgrids in the spotlight on Wednesday walking tour at RE+ in Las Vegas,"The microgrid walking tour at RE+ 2023 will kick off at the pv magazine (booth 205) at 11:00 a.m. Sign up here to take part in the tour.
During the booth tour, attendees will learn about the newest generation of the Evervolt Home Battery System, which supports both DC and AC coupling. This battery system is a fully integrated solution that combines a hybrid inverter, a lithium-ion battery and the new Evervolt SmartBox, an all-in-one home energy management device. Featuring a compact design, this newest generation of battery system can be installed indoors or outdoors and can be mounted to the floor or wall. In addition, attendees can see the latest Evervolt high-efficiency solar modules featuring temperature coefficient of 0.24%/ C.
With a purpose to empower all to make the most of our energy and resources, Schneider Electric is showcasing sustainable solutions at RE+ for both the residential and commercial market. Highlighted are Schneider Home, a dynamic home energy system controlled by a Schneider Home app, EcoStruxure Microgrid Flex, a standardized microgrid system designed to reduce project timelines, and strategic partners to meet the growing needs of the prosumer.
PEAK 3 stands for pure power. With its compact design, the inverter offers maximum power density at minimum weight. This results in less expensive transportation and simplified installation, In combination with the project-specific DC combiner boxes, the PV array can be oversized up to 200%, SMA reports. The Data Manager powered by ennexOS completes the system and enables it t fulfill all of the grid  operator’s requirements.
In the Maxeon booth, attendees will see Maxeon’s advanced solar panel technologies for the U.S. market, two lines of solar panels for homes, businesses and power plants. The company’s IBC solar panels come with a 40-year warranty. Maxeon’s shingled cell Performance solar panels will also be shown. These combine conventional solar cells, which are designed to deliver the quality and reliability for today’s EPCs and developers.
Emerge Alliance, along with multiple vendors, is facilitating a live demonstration of a residential microgrid on the show floor. The Emerge Alliance is a non-profit open industry association that includes commercial, government and academic member organizations that are working to develop standards leading to the rapid adoption of hybrid AC/DC microgrids in commercial/industrial and residential buildings, neighborhoods and communities.
This content is protected by copyright and may not be reused. If you want to cooperate with us and would like to reuse some of our content, please contact: editors@pv-magazine.com."
https://pv-magazine-usa.com/2023/09/13/people-on-the-move-american-battery-factory-puresky-energy-spearmint-energy-and-more/,"BUSINESS,EMPLOYMENT,MARKETS & POLICY,NORTH AMERICA,TEXAS,UNITED STATES",PV MAGAZINE,"SEPTEMBER 13, 2023","People on the move: American Battery Factory, PureSky Energy, Spearmint Energy, and more.","OCI Solar Power announced the promotion of Sabah Bayatli from his role as vice president of project development, EPC, and operations to the esteemed position of president, effective September 1, 2023.
MoveEV, the AI-backed mobility tech company that helps convert fleet and employee-owned gas vehicles to electric and reimburse for charging at home, announced the addition of two former Enterprise Fleet Management executives, Tara Spencer and Chris Lemone, to its leadership team. The duo, who worked together for 18 years to help grow Enterprise Fleet Management into the largest leasing company in North America, will be joining MoveEV to lead the ReimburseEV product division with Lemone as Head of Strategy and Spencer as Head of Sales.
American Battery Factory Inc. (ABF), an emerging battery manufacturer leading the development of the first network of lithium iron phosphate (LFP) battery cell gigafactories in the United States, hired Dr. Jun Liu as the company’s chief scientist to lead and support all aspects of ABF’s research and development. In addition to his role at ABF, Liu serves as the director for the Innovation Center for the Battery500 Consortium, Washington Research Foundation Innovation Chair in Clean Energy, Campbell Chair of Materials Science & Engineering and Battelle Fellow at the Pacific Northwest National Laboratory (PNNL).
PureSky Energy is pleased to announce the appointment of Jared Donald as CEO and Nicole LeBlanc as COO. This strategic move follows our recent acquisition by a consortium comprising Palisade Infrastructure Group and Fiera Infrastructure Inc. Jared Donald, a founding member of PureSky Energy since 2016, brings a wealth of experience, having successfully led over 500MWDC of community solar and energy storage projects in North America. Nicole LeBlanc, also a key team member since inception, has played an instrumental role in project success. These appointments reinforce our commitment to driving the clean energy transition across the United States. Over the past year, we’ve added nearly 20 solar and storage projects to our portfolio, reaching new milestones in providing clean energy access to communities nationwide.
Salient Energy, a leading developer of zinc-ion batteries for stationary energy storage systems, today shared a corporate update on its technology and commercialization efforts, as well as announced the appointment of Ken Rudisuela as its CEO.
Tara Young, former deputy general counsel at Plus Power, has joined Spearmint Energy. In this new role, Ms. Young will serve as Spearmint’s lead internal attorney, supporting corporate matters as well as Company’s continued development of fast-expanding battery storage projects across the United States. Ms. Young brings twenty years of regulatory affairs, compliance, and corporate governance experience to Spearmint. As lead internal attorney for Plus Power’s utility-scale energy storage business, she reviewed and negotiated complex commercial contracts across the full life cycle of renewable development projects, supported enterprise-wide compliance, and oversaw a team of in-house attorneys, paraprofessional staff, and outside counsel.
Key Capture Energy, a developer, owner, and operator of battery energy storage systems and energy solution services across the United States, announced today that Colin Tareila has been appointed as the new executive vice president of Asset Operations to assist with the company’s continued expansion. In this role, Tareila will oversee KCE’s growing portfolio of operating battery energy storage systems — resources that have proven increasingly critical for Texas to keep the lights on during extreme strain on the ERCOT grid. Prior to joining KCE, Tareila led the creation, development, and scaling of AWS Truepower, now UL’s Solutions, technical due diligence and independent engineering teams from its initial inception to one of the largest and most respected in North America.
The International Code Council announced that Jordana Rubel has joined its staff as general counsel. Rubel will oversee the organization’s legal matters with a particular emphasis on preserving and protecting its intellectual property rights.
More jobs provided by EnergeiaWorks:
 
 

North America’s leading renewable energy search firm
As Senior Manager of Development, you will be responsible for leading development, origination and asset management efforts of grid-scale stand alone energy storage projects and EV battery-related initiatives. You will bring experience in developing strategies to drive growth, lead teams and have a deep understanding of the energy storage and EV markets.
Why you should apply:
Responsibilities:
Requirements
Apply here.
This content is protected by copyright and may not be reused. If you want to cooperate with us and would like to reuse some of our content, please contact: editors@pv-magazine.com."
https://pv-magazine-usa.com/2023/09/13/sharp-unveils-all-black-420-w-topcon-solar-panel-with-21-51-efficiency-2/,"MARKETS & POLICY,PRODUCTS,WORLD",EMILIANO BELLINI,"SEPTEMBER 13, 2023",Sharp unveils all-black 420 W TOPCon solar panel with 21.51% efficiency,"From pv magazine global
Sharp has developed new n-type monocrystalline bifacial solar panels based on tunnel oxide passivated contact (TOPCon) cell technology. The NUJC420B double-glass module features 108 half-cut solar cells based on M10 wafers and a 16-busbar design.
The new panels measure 1,722 mm x 1,134 mm x 30 mm and weigh 20.7 kg. They can be used in PV systems with a maximum voltage of 1,000 V and an operating temperature between -40 C and 85 C.
The IEC61215- and IEC61730-certified panel also features a power conversion efficiency of 21.51% and an operating temperature coefficient is -0.30% per degree Celsius.
The company offers a 25-year linear power output guarantee and a 25-year product guarantee. The 25-year end power output is guaranteed to be no less than 85% of the nominal output power.
“The use of round conductors in the 16-busbar system enhances power gain for each cell and reduces vulnerability to microcracks, which improves module reliability,” the manufacturer said. “The half-cell module has three small junction boxes, each equipped with a single bypass diode. This design reduces heat transfer to the cells above, thus increasing module longevity and overall system performance.”
 
This content is protected by copyright and may not be reused. If you want to cooperate with us and would like to reuse some of our content, please contact: editors@pv-magazine.com."
https://pv-magazine-usa.com/2023/09/13/sunrise-brief-big-name-speakers-deliver-powerful-message-of-inclusion-at-re-2023-opening/,"MARKETS,MARKETS & POLICY,OPTIMIZERS & INVERTERS,POLICY,PRODUCTS,UNITED STATES",PV MAGAZINE,"SEPTEMBER 13, 2023",Sunrise brief: Big name speakers deliver powerful message of inclusion at RE+ 2023 opening ,"Solar-plus-storage in the spotlight on Tuesday walking tours at RE+ 2023  This series of tours guides attendees through key companies in a variety of energy sectors that are helping shape the clean energy industry. Pre-registration is required.
Big name speakers deliver powerful message of inclusion at RE+ 2023 opening  Georgia Senator Jon Ossoff, actor and former White House aide Kal Penn, and CNN’s Van Jones addressed the opening ceremony of RE+ yesterday. The high-profile speakers opened the event and delivered a rallying cry to the solar and energy storage industry to be more inclusive of disadvantaged communities and people of color as it undergoes a period of unprecedented expansion.
Planes, trains, or automobiles: Which has the lowest carbon footprint?  Three industry professionals traveled 3,000 miles across America. Their mission: to dissect their carbon footprint. What they found was a complex calculation, with results more tightly-knit than anticipated – and a CO2 revelation.
Carrier launches new series of high-temperature heat pumps  Carrier, a U.S.-based heating solutions provider, has introduced a new line of high-temperature heat pumps with capacities ranging from 30 kW to 735 kW, with hydrofluoroolefins as a refrigerant.
Storage, inverters, design tools and more at RE+ 2023  A brief glimpse at what seven exhibitors are showing at the U.S. solar industry’s largest trade show, taking place this week in Las Vegas.
How long do residential solar inverters last?  Multiple factors affect the productive lifespan of a residential solar inverter. In Part 2 of our series, we look at solar inverters.
This content is protected by copyright and may not be reused. If you want to cooperate with us and would like to reuse some of our content, please contact: editors@pv-magazine.com."
