url,tag,author,updated_date,title,contents
https://www.pv-magazine.fr/2023/11/06/tribune-pourquoi-la-production-photovoltaique-est-profitable-au-marche-de-lelectricite/,"FOURNITURE D'ÉLECTRICITÉ,MARCHÉS,OPINION ET ANALYSE,RÉSEAUX ET INTÉGRATION,TECHNOLOGIE ET R&D,EUROPE,FRANCE",,"NOVEMBRE 6, 2023",[Tribune] Pourquoi la production photovoltaïque est profitable au marché de l’électricité,"L’affirmation selon laquelle le photovoltaïque ne serait pas pertinent en France, car il se substitue à une énergie décarbonée, revient régulièrement dans le débat public. Pourtant, cette information est erronée, voici pourquoi.
Au vu du bouquet électrique français actuel, une méthodologie communément reprise consiste à considérer que le photovoltaïque se substitue à une production moyenne française, c’est-à-dire à une électricité majoritairement nucléaire. Or, le système électrique ne fonctionne pas de cette manière. Les EnR se substituent en priorité aux énergies les plus coûteuses pour le système que sont le gaz et le charbon (on parle de merit order). Elles ne remplacent le nucléaire que lorsque le gaz et le charbon ont déjà été entièrement substitués, ou que l’on souhaite économiser du combustible nucléaire. Or, cela est relativement rare, y compris en été et au printemps ou cela peut concerner certains week-ends où la consommation est basse et la production EnR forte.
Par ailleurs, même lorsque les centrales à gaz ou à charbon ne fonctionnent pas en France, une grande partie de notre production électrique est exportée dans des pays utilisant massivement les énergies fossiles, et contribue donc à la diminution de leur utilisation dans ces pays. Cela est bénéfique pour la lutte contre le changement climatique, car celui-ci est un phénomène planétaire, que les émissions soient évitées en France ou en Allemagne, le résultat est le même pour le climat.
Pour obtenir une évaluation de l’impact de l’électricité verte sur les bouquets européen et français, RTE a simulé le comportement du système électrique sur l’année 2019 en retirant l’éolien et le photovoltaïque installés en France. Le résultat a montré que ces capacités renouvelables ont permis d’éviter l’émission de 22 millions de tonnes de CO2 (17 via les exportations, 5 sur le territoire national) pour 45 TWh produits, soit environ 490 gCO2 évitées/kWh.
Les EnR remplacent et remplaceront majoritairement du fossile, que ce soit maintenant, dans la décennie en cours, ou dans les décennies à venir. Toutefois, plus celles-ci seront présentes dans le réseau, plus elles pourront remplacer une production nucléaire décarbonée à certains moments (certes minoritaires) de faible consommation et forte production EnR. Aujourd’hui, ce phénomène est quasi inexistant selon RTE, mais pourrait survenir plus souvent en France dans les 12 prochaines années. Dans son dernier Bilan prévisionnel, RTE prévoit ainsi une modulation de 15 TWh/an liée à la baisse des prix du marché provoquée par les EnR entre 2030 et 2035. Comparée à la production éolienne et photovoltaïque qui serait aux alentours de 200 TWh/an en 2035, cette modulation reste faible et présente une grande utilité pour le réseau.
De même, nos exports éviteront à l’avenir moins de charbon et davantage de gaz, ce qui limitera là aussi les bénéfices sur le CO2, le charbon étant beaucoup plus émetteur que le gaz. Selon notre méthodologie en résulterait une baisse des émissions évitées par kWh. Celle-ci a été calculée par Artelys dans une étude de France territoire solaire qui estimait ainsi au minimum à 270 gCO2/kWh les émissions de CO2 brutes évitées à horizon 2030 par du photovoltaïque.
Les différences de méthodologie pour le calcul du temps de retour carbone d’une énergie peuvent faire ce résultat sur des ordres de grandeur impressionnants, en considérant par exemple que le photovoltaïque français remplace un mix moyen français – dis autrement cela voudrait dire que chaque kWh de PV injecté sur le réseau remplace 70 % de nucléaire, 10 % d’hydroélectricité, 10 % d’éolien et de PV, 10 % de thermique fossile et d’exports/imports.
Par ailleurs, l’empreinte carbone du photovoltaïque peut là aussi faire varier le temps de retour carbone. Celle-ci peut fortement varier en fonction de la période à laquelle a été faite l’étude. En 2015, l’empreinte carbone d’une installation basée sur des modules chinois monocristallins, aujourd’hui majoritaire sur le marché, pouvait atteindre 2 tCO2/kWc, celle-ci a quasiment baissé à 1 tCO2/kWc en 2020.

En intégrant les données actualisée et le principe du merit order, on trouve donc un temps de retour carbone du photovoltaïque de 2 à 3,5 ans. C’est-à-dire qu’il faut au maximum, en prenant des hypothèses très pessimistes, 3,5 années pour rembourser la dette CO2 d’un panneau solaire en exercice en France aujourd’hui.
Détail des calculs :
Pour calculer le temps de retour carbone, il faut diviser les émissions émises sur la durée de vie du système par celles évitées chaque année, dans le scénario le plus optimiste on est ainsi autour de 1100 / 560 = 2 ans, en prenant un chiffre pessimiste des émissions évitées à 2030n, on est autour de 1100 / 310 = 3,5 ans.
La méthode présentée ci-dessus présente toutefois certaines limites. Par exemple, le chiffre de RTE de 22 millions de tonnes évitées est considéré pour l’éolien ET le photovoltaïque, non pour le photovoltaïque seul. La courbe de production étant différente, il est possible que les émissions évitées le soient aussi, potentiellement en défaveur du photovoltaïque. Mais malgré ces incertitudes, cette approche prend en compte la réalité du fonctionnement du système électrique et du merit order. 
Il est important de produire en France… mais le critère carbone n’est pas l’enjeu. Qu’il soit produit en Chine ou en France, le PV reste très intéressant au niveau climatique dans n’importe quelle ville de France, même Lille ! De plus, la question du réchauffement climatique n’entend pas de limite géographique : s’il est difficile de raisonner à l’échelle mondiale, on peut tout du moins s’accorder à réfléchir à l’échelle européenne dans un contexte d’interconnexion et de marché de gros de l’électricité.
Damien Salel est expert photovoltaïque et intégration des EnR réseaux.
The views and opinions expressed in this article are the author’s own, and do not necessarily reflect those held by pv magazine.
Ce contenu est protégé par un copyright et vous ne pouvez pas le réutiliser sans permission. Si vous souhaitez collaborer avec nous et réutiliser notre contenu, merci de contacter notre équipe éditoriale à l’adresse suivante: editors@pv-magazine.com."
https://www.pv-magazine.fr/2023/11/06/longi-revendique-un-rendement-de-339-pour-une-cellule-solaire-tandem-perovskite-silicium/,"CELLULE,INNOVATION,CHINE,ÉTATS-UNIS",VINCENT SHAW,"NOVEMBRE 6, 2023","Longi revendique un rendement de 33,9 % pour une cellule solaire tandem pérovskite-silicium","D’après pv magazine International
Longi a annoncé cette semaine qu’elle avait atteint un rendement de conversion d’énergie de 33,9 % pour une cellule solaire tandem pérovskite-silicium. L’entreprise a indiqué que le Laboratoire national des énergies renouvelables (NREL) avait confirmé ces résultats, qui constituent un record mondial pour ce type de cellule. Le précédent record était détenu par l’université saoudienne King Abdullah University of Science and Technology (KAUST), qui avait obtenu en juin un rendement de 33,7 % pour un dispositif présentant la même configuration.
« L’efficacité théorique des cellules tandem pérovskite-silicium est de 43 %, ce qui en fait l’alternative la plus réalisable aux cellules actuelles à mono-jonction en silicium », a déclaré Li Zhenguo, président de Longi, sans fournir de détails techniques. En juin, le fabricant chinois a annoncé un rendement de 33,5 % pour la même cellule. L’installation européenne d’essais solaires (ESTI) a certifié les résultats, qui représentent une augmentation significative par rapport à l’efficacité de 31,8 % annoncée lors de la conférence SNEC à la fin du mois de mai à Shanghai, en Chine.
Longi a battu le record mondial d’efficacité des cellules solaires à 15 reprises depuis avril 2021. Elle a revendiqué le meilleur rendement mondial pour les cellules en silicium en novembre 2022, avec une efficacité de 26,81 % pour une cellule solaire à hétérojonction non spécifiée.
Ce contenu est protégé par un copyright et vous ne pouvez pas le réutiliser sans permission. Si vous souhaitez collaborer avec nous et réutiliser notre contenu, merci de contacter notre équipe éditoriale à l’adresse suivante: editors@pv-magazine.com."
https://www.pv-magazine.fr/2023/11/06/six-projets-agrivoltaiques-de-baywa-r-e-obtiennent-un-financement-de-65-me-de-lue/,"AGRIVOLTAÏSME,ALLEMAGNE,ESPAGNE,FRANCE,ITALIE,PAYS-BAS",GWÉNAËLLE DEBOUTTE,"NOVEMBRE 6, 2023","Six projets agrivoltaïques de BayWa r.e. obtiennent un financement de 6,5 M€ de l’UE","Le producteur d’énergies renouvelables allemand BayWa r.e. a obtenu un financement de 6,5 millions d’euros dans le cadre du programme européen “Life”. Cette somme sera utilisée pour développer d’ici à 2027 six projets agrivoltaïques dans cinq pays différents : France, Espagne, Pays-Bas, Allemagne et Italie. Selon l’entreprise, « chacun d’eux représente une première ou une avancée significative pour son marché respectif ».
Dans le cadre du programme “EU LIFE ADAPT-PV”, trois nouveaux projets localisés en France, en Espagne et aux Pays-Bas visent ainsi à accroître la résilience au changement climatique des projets d’arboriculture fruitière. En France, le site lauréat de 1 MWc situé en Auvergne Rhône-Alpes concerne différentes variétés de pommiers sous ombrières semi-transparentes. Sur les 2,8 hectares concernés, 1 hectare servira de témoin, sans panneaux solaires. Un suivi agronomique est aussi prévu sur plusieurs années.
Les trois autres projets, en Allemagne, Espagne et Italie, s’intéresseront quant à eux au déploiement de l’agrivoltaïsme aux côtés des grandes cultures, telles que les blés d’été et d’hiver ou le soja, dans le cadre du projet “LIFE LEAD-PV” de l’UE. « À l’heure où la croissance démographique et la demande énergétique augmentent, il est urgent de se pencher sur l’efficacité de l’utilisation des sols », note BayWa r.e. dans un communiqué. Le projet espagnol sera par exemple, à l’échelle nationale, le premier à faire appel à la culture des amandes. En Allemagne, le projet de BayWa r.e. sera le premier projet de recherche sur l’agrivoltaïsme alliant les cultures traditionnelles à une aussi grande échelle.
Life est l’instrument de financement de l’UE pour l’environnement et l’action climatique, qui cofinance des projets soutenant des politiques telles que la stratégie « De la ferme à la fourchette » visant à promouvoir un système alimentaire durable. « L’adaptation au changement climatique et l’atténuation de ses effets constituent un défi majeur pour l’agriculture. Les initiatives innovantes, qui optimisent l’utilisation des terres et la production d’énergie, sont accueillies à bras ouverts », a salué Bernd Decker, représentant de l’Agence exécutive européenne pour le climat, les infrastructures et l’environnement créée par la Commission européenne.
Ce contenu est protégé par un copyright et vous ne pouvez pas le réutiliser sans permission. Si vous souhaitez collaborer avec nous et réutiliser notre contenu, merci de contacter notre équipe éditoriale à l’adresse suivante: editors@pv-magazine.com."
https://www.pv-magazine.fr/2023/11/06/voltalia-accompagne-la-delegation-presidentielle-pour-ses-projets-solaires-en-ouzbekistan/,"MARCHÉS,POLITIQUE,PV À GRANDE ÉCHELLE,STOCKAGE D'ÉNERGIE,OUZBÉKISTAN",MARIE BEYER,"NOVEMBRE 6, 2023",Voltalia accompagne la délégation présidentielle pour ses projets solaires en Ouzbékistan,"La diplomatie bénéficie aussi à l’industrie solaire. Lors de sa visite officielle en Ouzbékistan les 1er et 2 novembre 2023, Emmanuel Macron était accompagné de plusieurs dirigeant·e·s d’entreprise pour signer des accords économiques et notamment des partenariats publics privés au bénéfice des entreprises françaises.
A cette occasion, Voltalia a annoncé avoir signé deux accords de coopération pour deux grands projets d’énergies renouvelables.
Le premier protocole concerne le projet hybride solaire + éolien + stockage, signé en 2022 lors d’une visite diplomatique du président ouzbec Shavkat Mirziyoyev en France. Le groupe EnR de la famille Mulliez (Auchan, Leroy Merlin, Decathlon, …) avait alors décroché un accord de co-développement avec le gouvernement ouzbek pour la mise en place de 200 MW de solaire, 200 MW d’éolien et 60 mégawatts / 240 mégawattheures de stockage par batteries. Aujourd’hui le site a été défini puisque le projet sera implanté dans la localité de Shurkul, dans la région de Navoi. La capacité totale pourrait atteindre jusqu’à 500 MW.
Le second protocole entérine l’extension du projet solaire de Sarimay, remporté en janvier 2023 par Voltalia à l’issu d’un appel d’offres avec un tarif de 0,02888 $/kWh (0,027 €/kWh). Dans le détail, le site de la région de Khorezm sera hybridé avec une capacité de 100 MW d’éolien et des solutions de stockage par batteries dont la capacité n’a pas encore été déterminée.
Pour contexte, l’Ouzbékistan produit la majorité de son énergie à partir de source thermique, utilisant du gaz naturel et du charbon qu’il détient en abondance sur son territoire. Depuis 2019 le gouvernement a engagé une réforme du modèle du secteur de l’énergie détenu et exploité par l’État. Le pays vise la neutralité carbone d’ici 2050 et une capacité renouvelable de 8 GW d’ici 2026 et de 12 GW d’ici 2030. Pour ce faire, le pays compte sur les appels d’offres et les partenariats bilatéraux, signés avec des groupes privés nationaux, en marge d’événements diplomatiques.
Ce contenu est protégé par un copyright et vous ne pouvez pas le réutiliser sans permission. Si vous souhaitez collaborer avec nous et réutiliser notre contenu, merci de contacter notre équipe éditoriale à l’adresse suivante: editors@pv-magazine.com."
