url,tag,author,updated_date,title,contents
https://www.pv-magazine.de/2021/02/15/ecoligo-sucht-crowdinvestoren-fuer-photovoltaik-anschlussprojekt-in-vietnam/,"MÄRKTE,DEUTSCHLAND,VIETNAM",PETRA HANNEN,15. FEBRUAR 2021,Ecoligo sucht Crowdinvestoren für Photovoltaik-Anschlussprojekt in Vietnam,"Ecoligo weitet sein Engagement in Vietnam weiter aus. Am Montag ist auf der Plattform „ecoligo.investment“ ein weiteres Photovoltaik-Projekt hinzugekommen: Für die Photovoltaik-Anlage „Lac Long II“ mit 483 Kilowatt Leistung sollen 395.000 Euro bei Crowdinvestoren eingeworben werden. Die Laufzeit beträgt vier Jahre. Die Zinsen für das Investment liegen bei 5 Prozent, wobei es bis zum 25. Februar einen Early-Bird-Bonus von 1,5 Prozent gibt – Anlass ist das vietnamesische Neujahrsfest. Die Tilgung erfolgt Ecoligo zufolge zu 20 Prozent annuitätisch und zu 80 Prozent zum Ende der Laufzeit. Eine Beteiligung ist zwischen 100 und 25.000 Euro möglich.
Wie Ecoligo mitteilt, wurde Lac Long 1998 gegründet und ist seit 18 Jahren auf die Herstellung von Möbeln und Massagesesseln für Spa- und Pediküresalons spezialisiert. Im Laufe der Zeit habe sich das Unternehmen zum weltweit größten Hersteller dieser Produkte entwickelt und exportiert diese exklusiv nach Nordamerika und Europa. Lac Long sei mehrfach und von unabhängigen Prüfstellen für seine Produktqualität und -sicherheit ausgezeichnet worden.
Zum Unternehmen gehören laut Ecoligo drei Fabrikgebäude in der Stadt Long Hau. Zwei der drei Fabrikdächer sollen nun mit einer Photovoltaik-Anlage ausgestattet werden, um den Betrieb mit sauberer Energie zu versorgen und die Stromkosten signifikant zu senken. Das Projekt ist die zweite Finanzierungsphase des Solarprojektes für Lac Long mit einer Gesamtkapazität von 1028 Kilowatt. Die ersten 545 Kilowatt wurden über Projekt „Lac Long I“ bereits finanziert.
Transparenzhinweis: pv magazine ist Affiliate-Partner von Ecoligo. Wenn Sie auf den oben angegebenen Link klicken und sich an dem Crowdinvesting beteiligen, erhält pv magazine einen kleinen Anteil.
Dieser Inhalt ist urheberrechtlich geschützt und darf nicht kopiert werden. Wenn Sie mit uns kooperieren und Inhalte von uns teilweise nutzen wollen, nehmen Sie bitte Kontakt auf: redaktion@pv-magazine.com."
https://www.pv-magazine.de/2021/02/15/oesterreich-photovoltaik-foerdertopf-2020-vollstaendig-ausgeschoepft/,"POLITIK,ÖSTERREICH",PETRA HANNEN,15. FEBRUAR 2021,Österreich: Photovoltaik-Fördertopf 2020 vollständig ausgeschöpft,"Eine positive Bilanz für das Photovoltaik-Jahr 2020 zieht die österreichische Klimaschutzministerin Leonore Gewessler (Die Grünen).  2020 hatte ihr Ministerium insgesamt 50 Millionen Euro an Förderungen für den Ausbau der Photovoltaik in Österreich bereit gestellt. Dieser Fördertopf sei vollkommen ausgeschöpft worden. Dem Ministerium zufolge haben mit Hilfe der Förderung Privatleute, Betriebe, Unternehmen, Gemeinden und Gebietskörperschaften sowie Vereine insgesamt 15.957 Photovoltaik-Projekte mit zusammen rund 332 Megawatt Leistung installiert. Der Fördertopf habe damit rund 332,4 Millionen Euro an Investitionen ausgelöst.
„Unser Ziel ist klar: 100 Prozent sauberer Strom aus erneuerbaren Energien bis 2030“, so Gewessler. Der Photovoltaik-Ausbau mit seinem Eine-Million-Dächer-Programm sei dafür ein wichtiger Baustein. „Wir wollen weiterhin erfolgreich tausende Photovoltaik-Anlagen auf unseren Dächern sehen“, so Gewessler weiter. Zudem sei Klimaschutz ein Job- und Wirtschaftsmotor. Die erfolgreiche und positive Bilanz mache das deutlich.
Derweil hat das Präsidium des österreichischen Klima- und Energiefonds das Jahresprogramm für 2021 beschlossen. 217,3 Millionen Euro stehen zur Verfügung, die vor allem in Programme zum Ausbau erneuerbarer Energien, in den Umbau des Energie- und Mobilitätssystems sowie in die Dekarbonisierung der Industrie fließen sollen. Das Geld stammt aus Mitteln des Bundesministeriums für Klimaschutz sowie aus europäischen Fördertöpfen.
Einen wahren Boom für die dezentrale Versorgung mit erneuerbaren Energien erwartet der Klima- und Energiefonds durch das Erneuerbaren-Ausbau-Gesetz: Erstmals können demnach Nicht-Energieversorger über Grundstücksgrenzen hinweg Strom und Wärme produzieren, speichern, handeln und verbrauchen. Der Fonds legt daher 2021 neue Förderprogramme auf, die den Aufbau und den Betrieb von erneuerbaren Energiegemeinschaften unterstützen. „Jetzt haben die Menschen vor Ort endlich die Möglichkeit, sich selbst mit sauberer Energie zu versorgen – und sie können darüber hinaus zum Kraftwerk für ihre Umgebung zu werden“, sagt Geschäftsführer Ingmar Höbarth. Aus den Modellregionen sei bekannt, dass es in den Regionen Begeisterung für dieses Thema gebe. Aus dieser Begeisterung solle nun eine Erfolgsstory für den Klimaschutz entstehen.
 
Dieser Inhalt ist urheberrechtlich geschützt und darf nicht kopiert werden. Wenn Sie mit uns kooperieren und Inhalte von uns teilweise nutzen wollen, nehmen Sie bitte Kontakt auf: redaktion@pv-magazine.com."
https://www.pv-magazine.de/2021/02/15/sensationelle-aufdeckungen-zum-netzwerk-der-klimaschutzverhinderer-in-deutschland/,"MEINUNG,DEUTSCHLAND",,15. FEBRUAR 2021,Sensationelle Aufdeckungen zum Netzwerk der Klimaschutzverhinderer in Deutschland,"Mit großer wahlbeeinflussender Resonanz hatte der Youtuber Rezo 2019 die Anti-Klimapolitik der CDU aufgezeigt. Doch das war zum Glück nicht die einzige kraftvolle junge Stimme für den Klimaschutz. Es ist wichtig, dass es immer mehr investigative Journalisten gibt, die die im Hintergrund arbeitenden Netzwerke der Klimaschutzverhinderer aufdecken.
Seit über einem Jahrzehnt arbeitet ein Netzwerk von Klimawandelleugnern, Managern der Kohlewirtschaft und energieintensiven Industrie, Windkraftgegnern, Wirtschaftswissenschaftlern und Politikern aus CDU, FDP und AfD konsequent und teilweise gemeinsam an der Abwehr funktionierender Klimaschutzmaßnahmen und am Abschaffen der Förderung der erneuerbaren Energien, insbesondere des EEG.
In einer genialen Analyse hat das Online-Magazin „Europäische Energiewende“ die Vernetzungen, Strippenzieher und willfährigen Erfüllungsgehilfen (es sind in der Tat nur Männer), insbesondere Bundesminister Altmaier und den neugewählten CDU-Vorsitzenden Laschet, analysiert und dargestellt.
Es ist jedem zu empfehlen, dieses Netzwerk ausführlich zu studieren, wenn er verstehen will, warum der Klimaschutz in Deutschland seit Jahren nicht vorankommt und der Ausbau der erneuerbaren Energien im letzten Jahrzehnt Stück für Stück dezimiert wurde.
Ich empfehle dringend diese geniale Netzwerkdarstellung als Plakat auszudrucken und in jedes Büro von Klimaaktivisten zu hängen, in die Schaufenster und Schaukästen, damit auch eine breitere Öffentlichkeit über die schamlose Klimazerstörungspolitik und deren Hintergrundnetzwerk aufgeklärt wird.
Auch der Spiegel berichtete kürzlich von einer Greenpeace-Recherche, die das Netzwerk der Anti-Windkraft-Bewegung aufzeigt. Sie wird getragen von angeblichen Umweltvereinen, die in Wirklichkeit Antiwindkraftklagevereine sind, bis hinein in die Reihen der CDU, in das Wirtschaftsministerium von Peter Altmaier und in die AfD.
Diese Netzwerke arbeiten konsequent am Niedergang der erneuerbaren Energien und sabotieren so den Klimaschutz. Statt endlich den Ausbau der erneuerbaren Energien zu beschleunigen, bereitet das eng in das Netzwerk eingebundene Wirtschaftsministerium unter Peter Altmaier die nächsten Schritte gegen die Förderung der erneuerbaren Energien vor.
Wie „Tagesspiegel Background“ berichtete, arbeitet das BMWi nach eigenen Angaben derzeit an einem Vorschlag, die EEG-Umlage mittelfristig vollständig abzuschaffen und die Förderung über den Haushalt zu finanzieren. Dabei schlage das Ministerium vor, die Finanzierung aller Neuanlagen, die ab 2022 in Betrieb gehen, aus dem Haushalt zu decken. Spätestens 2027 legt die Regierung laut Gesetz einen umfassenden Vorschlag zum Umstieg auf einen marktgetriebenen Ausbau vor.
Damit ist klar, es geht Altmaier, der CDU/CSU und weiten Teilen der SPD nicht um Klimaschutz, nicht um einen dringend benötigten beschleunigten Ausbau der erneuerbaren Energien, sondern um umfassende Eingriffe in die erfolgreiche Funktionsfähigkeit des EEG, mit dem Ziel des Schutzes von Kohle, Erdöl und Erdgas. Wie immer muss die EEG-Umlage als Sündenbock herhalten, obwohl sie laut Zahlen von BDEW und VZBV nicht einmal sechs Prozent der Energiekosten eines typischen Vier-Personen-Haushaltes ausmacht.
Seit über einem Jahrzehnt wird die EEG-Umlage als Symbol für zu hohe Energiepreise stigmatisiert, obwohl deren Abschaffung eben nur eine Winzigkeit im Geldbeutel der Energieverbraucher ausmachen würde.
Die Stimmungsmache gegen die EEG-Umlage ist seit zehn Jahren Vehikel mit dem Ziel, das EEG und damit die Förderung der erneuerbaren Energien insgesamt abzuschaffen. Nichts anderes hat die Bundesregierung im Ziel, wenn sie meint, dass die erneuerbaren Energien sich am Markt nun selbst behaupten sollten. Sie verschweigt aber die hohen und ständig neuen marktverzerrenden Subventionen der fossilen Energien, weshalb die erneuerbaren Energien es weiter schwer haben, sich durchzusetzen, obwohl sie schon erheblich billiger sind als die fossilen.
Die vollständige Abschaffung der EEG hat auch genau dieses Ziel. Die Einspeisevergütungen aller neuen Anlagen sollen nach den Vorstellung von Altmaier ab 2022 nur noch aus Steuermitteln finanziert werden. Dann wird es jedes Jahr im ministeriellen Aufstellungsprozess des Bundeshaushaltes einen Hickhack darum geben, wieviel erneuerbare Energien überhaupt noch zugebaut werden und was da dem Steuerzahler zumutbar wäre. In den Haushaltsberatungen werden dann die Finanzpolitiker wie immer alle Rotstifte ansetzen und die Ausbauvolumina der geförderten erneuerbaren Energien drastisch reduzieren. Erklärung wird dann sein, dass man wegen der hohen Staatsverschuldung durch die Corona-Wirtschaftskrise „leider“ überall streichen müsse.
Genau das ist das Kalkül der fossilen Kohlewirtschaft, die gerade in den letzten Tagen ihre Unterschrift zum Erhalt der vier Milliarden Euro an neuen Subventionen geleistet hat und damit bis 2038 hofft, auch tatsächlich die letzten Kohlemeiler betreiben zu können.
Auch die Erdgaswirtschaft freut sich über die ständig steigenden Angebote zur Finanzierungsunterstützung von neuen Gaspipelines und LNG-Terminals. Die marktverzerrenden Subventionen für die fossile Wirtschaft steigen ständig. Nun ist offenkundig geworden, dass Finanzminister Olaf Scholz Milliardenunterstützung für neue LNG-Terminals angeboten hat, wenn die USA im Gegenzug die Sanktionen gegen die russische Nordstream-II-Pipeline fallen lassen.
Das wäre ein doppelter Schlag für das klimaschädliche Erdgas und gegen die erneuerbaren Energien, die es dann noch schwerer hätten, sich gegen den hochsubventionierten fossilen Markt durchzusetzen. Da ist es ein Hohn, wenn nun immer stärker gefordert wird, dass sich die erneuerbaren Energien am Markt selbst behaupten sollten. Die Abschaffung der EEG-Umlage und Finanzierung aus dem Steuerhaushalt ist also genau ein wichtiger Etappenschritt dafür, den Ausbau der erneuerbaren Energien weiter zu drosseln.
Genau dies ist die Strategie der Klimazerstörer aus dem oben aufgezeigten Netzwerk der Klimazerstörer.
— Der Autor Hans-Josef Fell saß für die Grünen von 1998 bis 2013 im Deutschen Bundestag. Der Energieexperte war im Jahr 2000 Mitautor des EEG. Nun ist er Präsident der Energy Watch Group (EWG). Mehr zu seiner Arbeit finden Sie unter www.hans-josef-fell.de. —
Die Blogbeiträge und Kommentare auf www.pv-magazine.de geben nicht zwangsläufig die Meinung und Haltung der Redaktion und der pv magazine group wieder. Unsere Webseite ist eine offene Plattform für den Austausch der Industrie und Politik. Wenn Sie auch in eigenen Beiträgen Kommentare einreichen wollen, schreiben Sie bitte an redaktion@pv-magazine.com.
Dieser Inhalt ist urheberrechtlich geschützt und darf nicht kopiert werden. Wenn Sie mit uns kooperieren und Inhalte von uns teilweise nutzen wollen, nehmen Sie bitte Kontakt auf: redaktion@pv-magazine.com."
https://www.pv-magazine.de/2021/02/15/borg-warner-will-akasol-uebernehmen/,"HIGHLIGHTS DER WOCHE,MÄRKTE,DEUTSCHLAND,GLOBAL,USA",PETRA HANNEN,15. FEBRUAR 2021,Borg Warner will Akasol übernehmen,"Die Akasol AG kommt in neue Hände. Wie der Hersteller von Lithium-Ionen-Batteriesystemen am Montag mitteilte, hat Borg Warner ein freiwilliges öffentliches Übernahmeangebot für die Akasol-Aktien angekündigt. Der US-amerikanische Automobilzulieferer will über sein Tochterunternehmen Blitz F21-842 AG, das künftig als ABBA BidCo AG firmieren soll, sämtliche ausstehenden auf den Inhaber lautenden Stückaktien für 120 Euro je Aktie erwerben. Dieser Angebotspreis entspreche einer Prämie von 23,4 Prozent auf den volumengewichteten Durchschnittskurs der letzten drei Monate vor der Ankündigung.
Zudem haben Akasol und Borg Warner ein Business Combination Agreement für eine strategische Partnerschaft abgeschlossen. Diese Partnerschaft soll es Akasol ermöglichen, die globale Plattform von Borg Warner für seine Wachstumsstrategie im Elektromobilitätsumfeld zu nutzen und seine Marktposition für Batteriesysteme weiter zu stärken. Dabei soll das Unternehmen eigenständig und unter der Marke Akasol weitergeführt werden.
Wie Akasol weiter mitteilte, haben Sven Schulz über die Schulz Group GmbH sowie die weiteren Akasol-Gründer bereits unwiderrufliche Andienungsvereinbarungen unterzeichnet. Sie verfügen demnach gemeinsam über rund 59,4 Prozent des Grundkapitals und der Stimmrechte. Der Vorstand um Sven Schulz und Carsten Bovenschen sowie alle Gründer sollen dem Unternehmen erhalten bleiben und Akasol weiterentwickeln.
Vorstand und Aufsichtsrat von Akasol befürworten dem Unternehmen zufolge das freiwillige öffentliche Übernahmeangebot und das Business Combination Agreement. Die strategische Partnerschaft mit Borg Warner biete Akasol eine hervorragende strategische Perspektive. „Nachdem ich Akasol in den vergangenen zwölf Jahren als Hauptaktionär und Vorstandsvorsitzender aufgebaut und entwickelt habe, bin ich davon überzeugt, dass dies der richtige nächste Schritt für eine sehr vielversprechende Zukunft unseres Unternehmens ist, sodass ich gemeinsam mit den anderen Gründern beschlossen habe, meine Aktien Borg Warner zum Angebotspreis anzubieten“, so Sven Schulz.
Erst im Oktober 2020 hatte Akasol den neuen Hauptsitz in Darmstadt bezogen und die Serienproduktion von Nutzfahrzeug-Batteriesystemen in der „Gigafactory 1“ aufgenommen. Ab Mitte 2021 soll dort auf vollautomatisierten Fertigungslinien eine Produktionskapazität von 2,5 Gigawattstunden zur Verfügung stehen, die dem Unternehmen zufolge je nach Geschäftsentwickung auf bis zu 5 Gigawattstunden ausgebaut werden kann. Zudem wurde an dem Standort ein Technologie- und Entwicklungszentrum sowie ein Test- und Validierungszentrum errichtet. Dort sollen umfangreiche mechanische und elektrotechnische Tests von Zellen, Modulen und Systemen erfolgen.
 
Dieser Inhalt ist urheberrechtlich geschützt und darf nicht kopiert werden. Wenn Sie mit uns kooperieren und Inhalte von uns teilweise nutzen wollen, nehmen Sie bitte Kontakt auf: redaktion@pv-magazine.com."
https://www.pv-magazine.de/2021/02/15/silber-soll-2021-um-11-prozent-teurer-werden/,"HIGHLIGHTS DER WOCHE,MÄRKTE,GLOBAL",EMILIANO BELLINI,15. FEBRUAR 2021,Silber soll 2021 um 11 Prozent teurer werden,"Von pv magazine International
Die Silbernachfrage wird in diesem Jahr wegen eines starken Anstiegs der industriellen und physischen Silberinvestitionen voraussichtlich um elf Prozent steigen. Das meldet der Branchenverband Silver Institute. „Die Aussichten für die Silbernachfrage sind rosig. Die globale Gesamtmenge wird im Jahr 2021 mit 1,025 Milliarden Unzen voraussichtlich ein Achtjahreshoch erreichen und damit alle Verluste aus dem Jahr 2020 wieder wettmachen“, sagte ein Analyst in einer Stellungnahme. „Dies spiegelt die erwarteten Zuwächse in den kritischen Segmenten der industriellen Nachfrage, der physischen Investitionen, des Schmucks und der Herstellung von Silberwaren wider.“
Das Silver Institute teilte weiter mit, dass der durchschnittliche jährliche Silberpreis von 16,19 US-Dollar pro Unze im Jahr 2019 auf 20,52 US-Dollar pro Unze im vergangenen Jahr gestiegen ist und dass dieser Preis in diesem Jahr um 46 Prozent auf ein Siebenjahreshoch von 30 US-Dollar pro Unze steigen könnte. „In Anbetracht des kleineren Silbermarktes und der damit verbundenen erhöhten Preisvolatilität erwarten wir, dass Silber in diesem Jahr Gold deutlich übertreffen wird“, heißt es weiter.
„Obwohl dieser Anstieg des Durchschnittspreises signifikant ist, ist er immer noch weit von einem kritischen Schwellenwert entfernt, der die Versorgung der Solarindustrie mit Silber problematisch machen würde“, erklärte Michael DiRienzo vom Silver Institute auf Anfrage von pv magazine. Aus seiner Sicht wäre dieser kritische Schwellenwert ein Durchschnittspreis von über 40 US-Dollar, was Spitzenpreise von etwa 45 US-Dollar bedeuten würde.
Für die Photovoltaik-Industrie wird prognostiziert, dass sie in diesem Jahr 105 Millionen Unzen Silber kaufen wird – ein deutliches Wachstum im Vergleich mit etwa 88 Millionen Unzen im Jahr 2020 und rund 93 Millionen Unzen im Jahr 2019. „Obwohl die Silberfrachten weiter nach unten driften, wird der Sektor von einer wachsenden Anzahl von Ländern profitieren, die neue Photovoltaik-Kapazitäten installieren“, so der Analyst zu der steigenden Nachfrage.
Im Juni vergangenen Jahres hatte das Silver Institute festgestellt, dass die Fähigkeit der Photovoltaik-Hersteller, den Silbergehalt in der Solarzellenproduktion zu reduzieren – ein Prozess, der als Thrifting bezeichnet wird – seit 2016 abgenommen hat. Trotzdem wird erwartet, dass die durchschnittlichen 111 Milligramm des Edelmetalls, die 2019 für jede Solarzelle benötigt wurden, bis 2030 dennoch auf 80 Milligramm sinken werden.
In einem im Juni 2018 veröffentlichten Bericht hatte der Analyst aufgezeigt, wie die von der Photovoltaik-Industrie benötigte Silbermenge von 130 Milligramm pro Zelle im Jahr 2016 auf etwa 65 Milligramm im Jahr 2028 sinken könnte. Laut einer aktuellen Studie der University of Kent macht Silber etwa 6,1 Prozent der gesamten Produktionskosten für Solarmodule aus. Laut BloombergNEF macht das Metall etwa 4,7 Prozent der Kosten für ein Modul aus.
Dieser Inhalt ist urheberrechtlich geschützt und darf nicht kopiert werden. Wenn Sie mit uns kooperieren und Inhalte von uns teilweise nutzen wollen, nehmen Sie bitte Kontakt auf: redaktion@pv-magazine.com."
