url,tag,author,updated_date,title,contents
https://www.pv-magazine.fr/2021/07/07/vol-v-et-falkor-creent-elyse-energy-pour-accelerer-lemergence-de-lhydrogene-vert-en-europe/,"HYDROGÈNE,EUROPE",GWÉNAËLLE DEBOUTTE,"JUILLET 7, 2021",Vol-V et Falkor créent Elyse Energy pour accélérer l’émergence de l’hydrogène vert en Europe,"Engagée dans le développement de l’hydrogène vert en Europe depuis 2019, la société d’investissement Falkor s’est associée au spécialiste des énergies renouvelables Vol-V pour créer Elyse Energy, une filiale 100% dédiée à l’hydrogène vert. « Les vingt dernières années ont permis de démontrer que l’éolien et le solaire produisaient une électricité compétitive et déployable en masse, observe la nouvelle société dans un communiqué de presse. La transition énergétique passe désormais par la résolution des questions de l’intermittence électrique et des gaz renouvelables avec une urgence encore accrue ».
Dotée d’une capacité d’investissement de plusieurs dizaines de millions d’euros pour les cinq prochaines années, Elyse Energy se positionne comme une plateforme d’initiation de projets de production d‘hydrogène vert, qu’elle accompagnera tout au long de leur phase de développement, jusqu’à la construction et l’exploitation des unités de production. Portée par une équipe dédiée, experte des technologies et des grands projets énergétiques, elle entend multiplier les partenariats avec les acteurs de la filière hydrogène : développeurs, fournisseurs de technologies, consommateurs. « A travers Elyse Energy, Vol-V entend, comme par le passé dans l’éolien ou le biométhane, promouvoir des technologies à la fois très en avance de phase et nécessaires à la transition énergétique, ainsi que démontrer qu’elles peuvent être déployées à l’échelle industrielle et de manière rentable », déclare Cédric de Saint-Jouan, fondateur de Vol-V et président du comité stratégique d’Elyse Energy. Actif depuis 2008 dans le photovoltaïque, la société montpelliéraine a conclu avec CNR (la Compagnie Nationale du Rhône) l’acquisition de sa filiale VOL-V Electricité Renouvelable (Vol-V ER) ainsi que de la totalité de ses projets et actifs de production éoliens et solaires en 2019.
« Nous sommes très heureux de nous associer au groupe Vol-V, acteur reconnu des énergies renouvelables, pour accompagner le développement de la filière hydrogène vert, a de son côté affirmé Pascal Pénicaud, fondateur de Falkor et président d’Elyse. Notre complémentarité confère à Elyse toute l’expérience, l’expertise et les moyens financiers dont elle a besoin pour soutenir plus de projets et apporter tout son savoir-faire pour leur développement ». Basée à Marseille Falkor est une société d’investissement dédiée à la transition des entreprises et des collectivités vers la neutralité carbone. Elle répond notamment aux besoins de financement des entreprises et des porteurs de projets acteurs de cette transition dans quatre domaines : les énergies renouvelables, le stockage de l’énergie, l’hydrogène vert et les Civic Tech.
Ce contenu est protégé par un copyright et vous ne pouvez pas le réutiliser sans permission. Si vous souhaitez collaborer avec nous et réutiliser notre contenu, merci de contacter notre équipe éditoriale à l’adresse suivante: editors@pv-magazine.com."
https://www.pv-magazine.fr/2021/07/07/eit-innoenergy-et-letat-francais-sengagent-dans-la-formation-des-salaries-de-la-batterie-electrique/,"MARCHÉS,STOCKAGE D'ÉNERGIE,FRANCE",GWÉNAËLLE DEBOUTTE,"JUILLET 7, 2021",EIT InnoEnergy et l’État français s’engagent dans la formation des salariés de la batterie électrique,"Visant la construction de trois gigafactories sur le territoire national d’ici à 2023, la France doit accompagner le développement de compétences adaptées à ces nouvelles implantations et à toutes les applications associées dans le domaine de la mobilité et de l’énergie au sens large. Pour répondre à cette demande, EIT InnoEnergy, qui anime depuis sa création l’Alliance Européenne de la Batterie, a développé une plateforme de services de formations développées par l’industrie et pour l’industrie, couvrant toute la chaîne de valeur des batteries, des matières premières aux applications et recyclage.
Le 6 juillet, EIT InnoEnergy et l’État français ont ainsi signé un contrat de partenariat pour lancer l’académie européenne de la batterie en France, une initiative qui va permettre d’accompagner la compétitivité de l’industrie et la création d’emplois en France. Elle permettra d’accélérer la formation des salariés français via l’aide au financement de formations dans les domaines d’expertise, de connaissances et de compétences exigés par le secteur de la batterie et de l’électromobilité tout au long de la chaîne de valeur. Rien qu’en France, l’académie européenne de la batterie ambitionne de former 150 000 travailleurs d’ici 2025. « L’académie européenne de la batterie permet de former ou de reconvertir des personnes qui joueront un rôle stratégique essentiel dans le développement de la filière des batteries en France, a indiqué Karine Vernier, directrice générale d’EIT InnoEnergy France. Le développement coordonné de l’industrie et de l’emploi est un enjeu clé pour que la transition énergétique soit un succès partagé par tous. Nous montrons aujourd’hui un exemple inspirant sur la manière dont l’Europe peut et va réussir à engager ses citoyens via des transitions professionnelles déterminantes pour un monde plus vert ».
Cette plateforme dispose aujourd’hui de plus de 30 modules de formation conçus par et pour l’industrie. La plateforme est constamment mise à jour et enrichie grâce aux retours des entreprises de la chaîne de valeur. Quelques 37 000 apprenants ont déjà été formés. Grâce à cet accord, coconstruit avec le ministère du Travail, de l’Emploi et de l’Insertion et le ministère de l’Industrie, l’académie européenne de la batterie pourra se déployer en France dès le 1er septembre.
« La France s’est donnée les moyens d’attirer et d’accueillir sur son sol un écosystème complet de la batterie électrique, nécessaire à l’avenir de la filière automobile. Avec le Président de la République, nous avons officialisé l’implantation d’une nouvelle usine de batterie le 28 juin dernier, qui créera à terme 2 000 emplois. La convention que nous signons aujourd’hui permettra de former les personnes qui viendront apporter leurs compétences à ce secteur d’avenir », a pour sa part rappelé Agnès Pannier-Runacher, ministre déléguée, chargée de l’Industrie.
Ce contenu est protégé par un copyright et vous ne pouvez pas le réutiliser sans permission. Si vous souhaitez collaborer avec nous et réutiliser notre contenu, merci de contacter notre équipe éditoriale à l’adresse suivante: editors@pv-magazine.com."
https://www.pv-magazine.fr/2021/07/07/qair-remporte-72-mwc-solaires-en-pologne-lors-du-dernier-appel-doffres/,"APPEL D'OFFRES,INSTALLATIONS,MARCHÉS,MARCHÉS ET STRATÉGIES,PV À GRANDE ÉCHELLE,PV EN TOITURE,PV RÉSIDENTIEL,POLOGNE",JOËL SPAES,"JUILLET 7, 2021",Qair remporte 72 MWc solaires en Pologne lors du dernier appel d’offres,"Le développeur précise que 1 260 projets étaient en concurrence le segment inférieur à 1 MWc et plus de 88 dans celui des parcs supérieurs à 1 MWc, ce qui a permis d’obtenir des contrats en complément de rémunération (CfD, en initiales angalises) pour 10 projets PV totalisant 72 MWc.
Parmi les projets, Qiar a notamment remporté celui de Kalisz Pomorski 60 MWc et celui de Stoszowice, 6 MWc, lesquels disposeront de tarifs pour les 15 prochaines années.
Krzysztof Wojtysiak, PDG de Qair Polska, confirme, dans un communiqué publié ce jour : « Année après année, depuis 2017, nous livrons des portefeuilles de projets éoliens et photovoltaïques en constante augmentation aux enchères ENR de chaque année et nous gagnons avec des tarifs CfD proches du maximum. Comme le rythme des enchères s’est accéléré récemment en Pologne, nous accélérons également et augmentons notre portefeuille ».
En d’ajouter, que « dans les années à venir, nous prévoyons d’obtenir des tarifs non seulement par le biais des enchères ENR, mais aussi sur le marché CPPA (Corporate PPA, ou contrats de gré à gré) et d’étudier d’autres opportunités sur le marché local. Qair est bien préparée pour réaliser d’autres projets attractifs à partir de son portefeuille de plus de 2 GW dans les années à venir et considère la Pologne comme l’un des marchés SER les plus dynamiques d’Europe aujourd’hui. »
La prochaine étape pour Qair est de financer et de commencer la construction de ce nouveau portefeuille de 82 MW, composé des 72 MWc solaires mentionnés ci-dessus et de 10 MW supplémentaires dans des projets éoliens.
Avec l’achèvement de ces parcs à tarif garanti, les actifs opérationnels de Qair en Pologne atteindront presque 400 MW.
Selon les données de Polskie Sieci Elektroenergetyczne (PSE), le gestionnaire du réseau de transport d’électricité polonais, la puissance installée en photovoltaïque à la fin de 2020 était de 3 935,74 MWc., en hausse de 2 463 MWc d’une année sur l’autre. Autrement dit, la puissance installée en photovoltaïque a augmenté de 200% au cours de l’année. La structure du marché reste inchangée – 75% sont des micro-installations, et les parcs PV, 21%. Cependant, selon les prévisions de l’IEO, l’institut des énergies renouvelables polonais, un changement dans la structure du marché commencera à partir de cette année et les parcs solaires au sol constitueront un pourcentage croissant de la puissance totale installée.
Ce contenu est protégé par un copyright et vous ne pouvez pas le réutiliser sans permission. Si vous souhaitez collaborer avec nous et réutiliser notre contenu, merci de contacter notre équipe éditoriale à l’adresse suivante: editors@pv-magazine.com."
https://www.pv-magazine.fr/2021/07/07/serie-dom-tom-la-guyane-terre-du-solaire-a-puissance-garantie/,"FOURNITURE D'ÉLECTRICITÉ,PV À GRANDE ÉCHELLE,PV AU SOL,PV COMMERCIAL ET INDUSTRIEL,PV EN TOITURE,STOCKAGE D'ÉNERGIE,FRANCE",GWÉNAËLLE DEBOUTTE,"JUILLET 7, 2021","[Série DOM-TOM] La Guyane, terre du solaire à puissance garantie","Nichée entre le Suriname et le Brésil sur le continent sud-américain, la Guyane est une véritable « île électrique ». Son réseau, qui s’étend le long du littoral, est en effet caractérisé par l’absence d’interconnexion avec les pays voisins et par sa taille réduite. « Actuellement, le mix électrique guyanais est principalement porté par la production hydraulique », décrit Frédéric Moyne, PDG d’Albioma. Celle-ci est assurée par un seul barrage au fil de l’eau, celui de Petit-Saut, qui assure en moyenne 60 % de la production électrique, mais dont la part est fortement corrélée à l’aléa d’hydraulicité entre la saison des pluie et la saison sèche. Pour compenser ces fluctuations, la production est complétée par environ 35 % de moyens thermiques (centrales de Dégrad-des-Cannes et Kourou). Enfin, la part des énergies renouvelables biomasse et photovoltaïque s’établit à environ 5 % de la production. « Contrairement à d’autres départements d’Outre-mer, la Guyane est moins dépendante des énergies fossiles importées », souligne Frédéric Moyne.
Comme les autres DOM-TOM, la ZNI vise l’autonomie énergétique d’ici 2030. De plus, la règlementation thermique en Outre-mer impose au moins 50 % de la production d’eau chaude domestique par des énergies renouvelables. L’un des objectifs de la Programmation pluriannuelle de l’énergie (PPE) est donc de renforcer la présence du PV, notamment en remplacement des sources fossiles (diesel et fioul), sur ce territoire qui connaît un fort ensoleillement (1222 kWh/m²/an). La PPE, votée en 2017 et qui doit être révisée en 2022, fixe comme objectif d’ajouter 26 MWc de PV sans stockage et 25 MWc avec stockage d’ici à 2023, par rapport aux chiffres de 2015.
Photo : TotalEnergies
Souhaitant profiter du développement des renouvelables dans la région, TotalEnergies a ainsi annoncé début juillet l’ouverture d’une agence à Cayenne et l’arrivée d’Olivier Wattez comme responsable de développement. Le groupe, qui exploite actuellement 4 MWc de toitures PV, installées sur trois grands lycées et deux hangars de la zone industrielle de Cayenne, a récemment remporté le projet de réalisation d’une centrale en ombrières de parking de 1,5 MWc qui sera installée à l’aéroport international Felix Eboué de Cayenne, avec une mise en service espérée fin 2022.
De son côté, le solariste Albioma a sécurisé 7 MWc sur les années 2021 et 2022 en toitures et au sol, en appels d’offres et obligations d’achat. Pour l’heure, le développeur possède deux centrales au sol, celle de Kourou de 12 MWc déployée depuis 2010 sur un terrain impropre à d’autres usages et celle de 4  MWc de Matouri située sur un terrain marécageux, soit 16 MWc en tout, pour 19 GWh/an produits.
Photo : Albioma
Parmi ses futurs développements, Albioma se positionne également sur le secteur du solaire à puissance garantie et développe plusieurs projets, qu’il compte concrétiser dans les deux ans. Dans le solaire à puissance garantie, le parc de batteries est en effet calibré pour être en mesure d’assurer au gestionnaire de réseau une disponibilité de l’outil de production sur 24 heures, et non plus d’injecter en fonction de la priorité de dispatch. « Ces projets innovants correspondent à une disposition spécifique de la PPE actuelle et répondent à un besoin du gestionnaire de réseau pour réduire l’intermittence de la production photovoltaïque, en garantissant une puissance sur 24 heures, explicite Frédéric Moyne. De plus, l’emplacement géographique de la Guyane se prête particulièrement bien à ce type d’expérimentations. En effet, comme elle est située très proche de l’équateur, il y a peu de variabilité saisonnière, avec des alternances jour/nuit à peu près identiques entre l’été et l’hiver. Cela facilite le dimensionnement de la puissance de batteries ».
Photo : EDF Renouvelables
D’où la multiplication des dossiers qui arrivent à la CRE. C’est le cas par exemple du projet que mène EDF Renouvelables à Saint-Laurent-du-Maroni dans l’ouest. Pour venir en soutien de la fragilité du réseau dans cette partie de la Guyane, l’entreprise développe un parc de 40 MWc de panneaux photovoltaïques, dont la puissance serait (les dimensionnements sont encore en cours) garantie grâce à 8 MWh de moteurs fonctionnant à l’huile végétale et à 20 MWh de stockage par batterie, ce qui permet d’assurer une heure, deux heures ou quatre heures de puissance. L’installation, de 30 à 35 hectares, sera implantée sur un foncier délaissé agricole. Compte-tenu de l’effet d’échelle, EDF Renouvelables espère approcher les 110 euros/MWh pour ce parc, un prix actuellement obtenu sur des centrales de plus petite puissance sur le littoral.
Par ailleurs, TotalEnergies développe plusieurs projets de parcs au sol, dont un à puissance garantie dans la périphérie de Cayenne, en gré à gré avec la CRE. « Notre parc Maya garantira une puissance sur 24 heures, avec un pic de pointe de trois heures, le midi ou le soir, avec l’objectif d’atteindre un prix inférieur au coût moyen de production du parc électrique guyanais actuel », souligne Olivier Wattez.
Outre la stabilisation du réseau, ces centrales permettent aussi de répondre à la demande croissante en électricité, en particulier dans l’ouest autour de Saint-Laurent-du-Maroni à la frontière avec le Suriname. « La Guyane connaît un fort dynamisme démographique, observe Olivier Wattez. Depuis les années 2000, la population a été multipliée par deux et atteint actuellement près de 300 000 personnes, ce qui est un défi en termes de production électrique pour alimenter les activités résidentielles et économiques ». Outre 20 MWc de moyens de production à partir de sources renouvelables à puissance garantie qui doivent être répartis dans tout le pays, la PPE prévoit donc spécifiquement la mise en service de 20 MWc en puissance garantie dans l’ouest d’ici à 2023.
Carte : Hachette Tourisme
En dépit de sa taille – la Guyane est le plus grand des départements français d’Outre-Mer avec ses 83 800 km2 – elle connaît elle aussi des contraintes au niveau de la recherche de terrains disponibles pour le PV, comme c’est le cas dans tous les DOM-TOM. En effet, tout le sud est couvert par la forêt primaire, loin des lieux d’habitation et de consommation. « L’activité humaine se concentre majoritairement sur la bande littorale, d’où le fait que nous privilégions le développement de parcs soit sur des zones industrielles (carrières, décharges), soit en couplage avec une activité agricole », assure Frédéric Moyne.
Mais la bande littorale n’est pas la seule à faire l’objet de projets de solarisation. EDF Renouvelables a en effet obtenu récemment deux permis de construire portant sur la Guyane de l’intérieur. « Le premier se situe à Maripasoula, un village de 10 000 habitants dans les terres à la frontière avec le Suriname qui connaît un fort développement démographique, notamment en raison de l’immigration, souligne David Augeix, directeur régional Sud et Outre-Mer de EDF Renouvelables. Dans ces régions isolées, qui ne sont pas raccordées au réseau principal qui longe la bande de littoral, les populations s’approvisionnent à partir de micro-réseaux fonctionnant au fioul ou au diesel. L’objectif de la Collectivité Territoriale de Guyane est donc de couvrir les besoins croissants en électricité par du renouvelable ». L’énergéticien installera donc une centrale au sol de 1,2 MWc avec stockage, dont la construction se fera en 2022. Pour prévoir l’accroissement des besoins, l’adjonction de 4 MWc d’ici à 2023 ou 2024 est d’ores et déjà prévue.
Photo : Parc national guyanais
De l’autre côté du territoire, à la frontière avec le Brésil, le village de Camopi connaît les mêmes conditions d’isolement et de production d’électricité d’origine fossile et EDF Renouvelables y construira une centrale au sol de 1 MWc. « Dans ces deux cas, la construction dans ces régions très isolées est un défi, ajoute David Augeix. L’acheminement des panneaux photovoltaïques et du matériel se fait par pirogue pendant la saison des pluies, puis la construction se fait pendant la saison sèche ». En outre, pour plus de réactivité en cas de panne, toute l’installation électrique est redondante. Par conséquent, compte-tenu de ces contraintes, le prix de production du photovoltaïque dans ces zones est, selon EDF Renouvelables, de l’ordre de 350 à 400 euros/MWh. « Cela reste toutefois inférieur au prix des carburants fossiles qui doivent être amenés chaque semaine par bidons dans des pirogues », tempère David Augeix. Pour la construction de ces installations, comme des autres sur le littoral, le groupe fait appel à des entreprises locales, comme c’est le cas avec Solamaz, qui connaît bien ces sites isolés pour y déployer des lampadaires solaires, et qui réalise la maîtrise d’œuvre des centrales de Maripasoula et de Camopi.
A venir la semaine prochaine : la Martinique
Retrouvez nos précédents articles : la Nouvelle-Calédonie ; la Réunion.
Ce contenu est protégé par un copyright et vous ne pouvez pas le réutiliser sans permission. Si vous souhaitez collaborer avec nous et réutiliser notre contenu, merci de contacter notre équipe éditoriale à l’adresse suivante: editors@pv-magazine.com."
https://www.pv-magazine.fr/2021/07/07/lufe-constate-un-bond-des-points-de-charge-pour-vehicules-electriques/,"MARCHÉS,MARCHÉS ET STRATÉGIES,VÉHICULE ÉLECTRIQUE,FRANCE",JOËL SPAES,"JUILLET 7, 2021",L’UFE constate un bond des points de charge pour véhicules électriques,"Cette accélération est particulièrement visible pour les autoroutes que pour les autres bornes de recharge accessibles au public. En effet, entre le 31 mars 2021 et le 30 juin 2021, ces dernières ont progressé de 16 %. Si la tendance se poursuit, il serait possible d’atteindre l’objectif fixé par le ministre délégué auprès de la ministre de la Transition écologique chargé des Transports J.-B. Djebbari d’équiper la moitié des aires de service d’ici la fin de l’année.
Pour la première fois depuis le lancement de cette carte, l’axe autoroutier A8 entre Aix-en-Provence et la côte d’Azur a doté presque l’ensemble de ses aires de service existantes en bornes de plus de 50kVA, multipliant ainsi son nombre par plus de 2 en un trimestre. Désormais, 20 axes autoroutiers sont équipés de plus de 50 %, signale l’UFE.
En revanche, l’autoroute A89, reliant Bordeaux à Lyon, demeure l’une des autoroutes les moins équipées de France. A noter, le nombre d’autoroutes peu ou mal équipées en bornes rapides a tout de même diminué de 30 %.
Depuis le mois de mai, rappelle l’UFE, le gouvernement a publié l’ensemble des textes règlementaires, relatifs à l’élaboration des schémas directeurs des IRVE (installations de recharge pour véhicules électriques) ouvertes au public, prévus par la loi d’orientations des mobilités. Dorénavant, les collectivités ainsi que les établissements publics de coopération intercommunale peuvent prévoir des schémas de déploiement des bornes de recharge sur leurs territoires en tenant compte des caractéristiques territoriales ainsi que du trafic de véhicules électriques.
Le guide de bonnes pratiques, à la préparation duquel l’UFE a contribué, est disponible à l’attention des acteurs en question. Ainsi, le recours à ces schémas directeurs permet, d’une part, d’offrir un maillage homogène sur les différents territoires et, d’autre part, de développer une vision prospective des besoins en matière de recharge de véhicules électriques sur chaque territoire.
L’UFE considère qu’il serait nécessaire de prévoir un dispositif équivalent pour le déploiement de bornes sur les autoroutes, afin d’avoir un réseau couvrant toute la France et répondant aux besoins d’itinérance, notamment lors des trajets liés aux grands week-ends ou aux vacances. Une proposition déjà portée par le lobby électrique dans le cadre d’une tribune co-signée avec l’Association des sociétés françaises d’autoroutes.
Ce contenu est protégé par un copyright et vous ne pouvez pas le réutiliser sans permission. Si vous souhaitez collaborer avec nous et réutiliser notre contenu, merci de contacter notre équipe éditoriale à l’adresse suivante: editors@pv-magazine.com."
