url,tag,author,updated_date,title,contents
https://www.pv-magazine.fr/2021/07/07/lademe-presente-sa-feuille-de-route-environnementale-pour-le-solaire-pv-en-france/,"BILAN CARBONE,DÉVELOPPEMENT DURABLE,MARCHÉS,MARCHÉS ET STRATÉGIES,FRANCE",JOËL SPAES,"JUILLET 7, 2021",L’Ademe présente sa feuille de route environnementale pour le solaire PV en France,"L’Agence gouvernementale rappelle qu’en France, la filière PV représentait, fin décembre 2020, une capacité installée de près de 11 GWc. La Programmation Pluriannuelle de l’Énergie fixe l’objectif que cette capacité atteigne 20 GWc en 2023 et jusqu’à 44 GWc en 2028. Le cadre de soutien mis en place par l’Etat pour son déploiement favorise déjà les produits ayant un impact carbone faible et les implantations limitant les impacts environnementaux.
Cette étude révèle que l’aspect environnemental est de plus en plus présent dans les pratiques industrielles et qu’il tend à prendre de l’ampleur. « En effet, on constate un nombre croissant d’acteurs de la filière qui ont déjà mis en place ou envisagent de mettre en place des pratiques ou initiatives permettant d’améliorer leurs impacts environnementaux », indique l’Ademe. Cependant, la maturité et la pertinence de ces pratiques industrielles sont aujourd’hui encore très variables et il reste un potentiel de progression important.
En plus d’améliorer le cycle de vie du photovoltaïque, la mise en œuvre de cette feuille de route pourrait également être un atout stratégique pour la filière française, voire européenne, notamment dans le cadre des travaux européens sur la mise en place d’outils comme l’Ecodesign, l’Ecolabel ou l’Etiquette Energie pour le secteur photovoltaïque afin de défendre une stratégie d’excellence environnementale.
La filière est déjà considérée par les français comme l’une des plus vertueuse d’un point de vue environnemental, précise l’Ademe. Mais, l’agence insiste : « Pour assurer un tel niveau d’appropriation dans la durée au vu de l’ambition de son développement, la filière photovoltaïque se doit d’être encore plus exemplaire notamment au niveau environnemental. »
Grâce à cette large consultation, auprès de 119 acteurs, et aux différents retours collectés, un benchmark des pratiques industrielles du domaine photovoltaïque en lien avec les enjeux environnementaux de leurs activités a été réalisé. Les trois enjeux environnementaux jugés les plus prioritaires par la filière sont la performance énergétique, la durée de vie et la fiabilité des installations et l’écoconception.
A partir de là, l’Ademe a réalisé, en collaboration avec les parties prenantes, une feuille de route afin de réduire l’empreinte environnementale de cette filière. Celle-ci est constituée d’une trentaine d’actions regroupées en quatre clusters thématiques :
« La large consultation réalisée est de nature à assurer une bonne appropriation de cette feuille de route par la filière. Toutefois, sa réussite dépend entièrement de sa prise en main proactive par les parties prenantes pour garantir la mise en œuvre effective des actions », signale l’Ademe.
Ce contenu est protégé par un copyright et vous ne pouvez pas le réutiliser sans permission. Si vous souhaitez collaborer avec nous et réutiliser notre contenu, merci de contacter notre équipe éditoriale à l’adresse suivante: editors@pv-magazine.com."
