url,tag,author,updated_date,title,contents
https://www.pv-magazine.com/2023/11/01/storing-renewables-with-landscaping-gravel/,"DISTRIBUTED STORAGE,ENERGY STORAGE,ENERGY STORAGE,TECHNOLOGY AND R&D,UTILITY SCALE STORAGE,UNITED STATES",RYAN KENNEDY,"NOVEMBER 1, 2023",Storing renewables with landscaping gravel,"From pv magazine USA
New Mexico-based CSolPower LLC is partnering with Sandia National Laboratories to research and develop the use of landscape gravel as a thermal energy storage medium for intermittent sources of generation like solar and wind.
The system is comprised of rocks held in a bed that are heated or cooled with air to store thermal energy. Sandia’s researchers said the gravel from landscaping companies can be successfully used for the system without requiring extensive washing or preparation.
Sandia designed a small 100 kWh test project at its National Solar Thermal Test Facility. PV panels are installed at the site, which is being tested for its ability to store intermittent generation.
“One of the advantages of thermal energy storage in rocks is that it can be built anywhere,” said Walter Gerstle, co-founder of CSolPower. “It can be commodified and doesn’t require extensive permitting. We believe it can be implemented more quickly and economically than other approaches.”
The rock bed is a long-duration energy storage system, a category of energy storage that has introduced creative solutions like gravity-based storage, rusted iron pellets, and thermal bricks.
Sandia tested the bed by charging it with heated air greater than 900 F (482 C) and maintained that temperature for up to 20 hours. The system was successfully discharged, and Sandia said the performance of the system has been in-line with modeling and predictions. The lab said prototype testing will continue until June 2024.
CSolPower said it intends to make the product ready for utility-scale use, but first it will develop small-scale versions.
“A natural approach is to store excess electricity generated during the day as heat, and then use it to heat water and homes at night,” said Gerstle. “This is an example of the small-scale use of this storage option.”
If the current phase of testing is successful, several greenhouses in northern New Mexico are prepared to use the rock bed storage in another pilot project.
“Instead of curtailing solar energy production, we would store it and use it during cold nights to keep the greenhouses warm enough to grow plants year-round,” said Gerstle.
The project is financed by the Technology Readiness Gross Receipts Initiative. Sandia’s economic development department administers the tax-funded program, which enables New Mexico businesses to work alongside scientists and engineers from Sandia and Los Alamos national laboratories.
This content is protected by copyright and may not be reused. If you want to cooperate with us and would like to reuse some of our content, please contact: editors@pv-magazine.com."
https://www.pv-magazine.com/2023/11/01/global-pv-must-grow-to-5400-gw-by-2030-to-limit-global-warming/,"COMMERCIAL & INDUSTRIAL PV,MARKETS,MARKETS & POLICY,RESIDENTIAL PV,UTILITY SCALE PV,WORLD",ANGELA SKUJINS,"NOVEMBER 1, 2023","Global PV must grow to 5,400 GW by 2030 to limit global warming","Global installed renewable energy power generation capacity needs to expand three-fold to 11,174 GW by the end of the decade to meet the 1.5 C Paris Agreement climate warming ceiling, the International Renewable Energy Agency (IRENA) said in a recently published report.
Solar PV capacity, in particular, needs to hit at least 5,400 GW by 2030 – a 4,345 GW increase from 2022, IRENA said in the report.
The Paris Agreement, dubbed by the United Nations as a “legally binding international treaty on climate change”, was adopted by 196 countries and enforced in 2016. The goal is to hold the global average temperature increase to below 2 C above pre-industrial levels and pursue efforts to limit the temperature increase to 1.5 C above pre-industrial levels.
IRENA said in the report that as it currently stands the deployment of energy transition technologies is “insufficient” to achieving Paris Agreement goals. An acceleration of renewable energy deliverables over the next decade is crucial to determining whether global warming can be limited to 1.5 C, the document said.
“Global energy-related CO2 emissions would need to decline significantly to 23 gigatonnes of CO2 (GtCO2) in 2030, from the record high of 36.8 GtCO2 in 2022,” the report said. The pathway to achieving this is the “urgent” increase in variable renewable energy (VRE) in electricity generation from 10% in 2021 to 46% by 2030.
The acceleration would need to cover energy supply, end-use sectors and technology. It would also involve the deployment of renewable power generation systems in more countries and regions, the report said.
Wind installation figures need to reach 3,500 GW – comprising 3,040 GW onshore and 500 GW offshore – to limit warming to 1.5 C. This is 2,141 GW more than what was recorded in 2022. Hydropower also needs to grow by almost 17% from 2022 levels, reaching 1,465 GW, the report said.
IRENA acknowledges different countries and regions will deploy renewable energy generation at varying speeds, with barriers to investment, higher renewable energy resource potential and market maturity affecting the pace of development. The global PV market will also be dominated by G20 countries in the next decade, the report said, and they will need to reach 4,530 GW installed capacity. Non-G20 countries must surpass 900 GW by 2030.
The report, titled “Tripling Renewable Power and Doubling Energy Efficiency by 2030: Crucial Steps Towards 1.5 C,” was published online this week.
This content is protected by copyright and may not be reused. If you want to cooperate with us and would like to reuse some of our content, please contact: editors@pv-magazine.com."
https://www.pv-magazine.com/2023/11/01/atlas-renewable-energy-to-sell-solar-plants-to-engie-brasil-energia/,"INSTALLATIONS,UTILITY SCALE PV,BRAZIL,CENTRAL & SOUTH AMERICA",LÍVIA NEVES,"NOVEMBER 1, 2023",Atlas Renewable Energy to sell solar plants to Engie Brasil Energia,"From pv magazine Brazil
Atlas Renewable Energy said in a press release this week that it has sold a portfolio of Brazil-based operating assets to Engie Brasil Energia Complementares Participações. The assets, sold to Engie Group based in Brazil, are five solar power plants with a combined installed capacity of 545 MW.
Analyst Bernardo Viero from Suno Research said that Engie's operational installed capacity will increase by 6.4% following the sale, growing its commercial capacity by 3.4%, while accounting for assets under construction.
Atlas Renewable Energy plans to reinvest the BRL 3.2 billion from the transaction in new renewable projects in Brazil, maintaining 1.8 GW of installed capacity in the country after the sale, including two solar PV parks under construction in Minas Gerais, one of which is the largest solar plant in Latin America, as well as two operational projects.
Atlas Renewable Energy's portfolio in Brazil includes over 15 GW of sustainable energy under development. The deal is pending approval from the national competition regulator, the Administrative Council for Economic Defense (CADE), among other conditions.
This content is protected by copyright and may not be reused. If you want to cooperate with us and would like to reuse some of our content, please contact: editors@pv-magazine.com."
https://www.pv-magazine.com/2023/11/01/scottish-lobby-group-praises-purported-plan-to-install-4-6-gw-of-solar-by-2030/,"MARKETS,MARKETS & POLICY,UNITED KINGDOM",ANGELA SKUJINS,"NOVEMBER 1, 2023",Scottish lobby group praises plan to install 4-6 GW of solar by 2030,"The Scottish government has committed to deploy between 4 GW and 6 GW of solar capacity by 2030 subject to industry support, the Scottish government has confirmed to pv magazine. The commitment hinges on the condition of large-scale solar projects providing an appropriate level of community benefit, the government document said.
Scottish Renewables, the country’s leading renewable energy association, has published a press release welcoming the news. The organization said the target would be included in the government’s upcoming Energy Strategy and Just Transition Plan.
Helen Melone, senior policy manager at Scottish Renewables, said in the press release that these targets were what the association has been long calling for, but added that there must be a “clear plan with key milestones” showing how to get there.
Planning should cover targets for commercial rooftop, domestic rooftops and for utility-scale, ground-mounted solar, she said. “And it must ensure that Scotland’s public sector harnesses the full solar energy potential of its buildings by 2030.”
In January, the government published its Draft Energy Strategy and Just Transition Plan – its roadmap for the country to achieve its “climate change ambitions,” according to a government website. It is expected the final copy will be published “in 2023,” according to the draft plan. pv magazine has asked the Scottish government when the final plan will be published but has not received a response.
The Scottish government wants to achieve more than 20 GW of low-cost renewable generation capacity by 2030, the draft policy states. But unlike other renewable energy sources, such as onshore wind, it does not include specific solar installation targets. The draft foreshadows that the final version will have these PV-specific milestones.
According to Scottish Renewables, as of the first quarter of 2023, onshore wind accounted for 9 GW of the country’s total installed capacity, which is well over half of the 14 GW of total installed capacity. PV recorded the lowest installed capacity at only 522 MW.
The Draft Energy Strategy and Just Transitions Plan, however, shows the government’s appetite to increase installed solar capacity.
The November issue of pv magazine, due out next week, is dominated by the issue of global oversupply and examines the effects of a solar glut in the European Union, the United States, and other markets. We turn the spotlight on PV developments in South Korea, Taiwan, and Africa and update readers on technological progress in thin films, kerfless wafering, and mass produced heterojunction PV.
“We see a strong role for solar thermal, as well as domestic and commercial solar PV combined with battery storage systems – which have the potential to help reduce consumer bills,” said the draft plan.
The draft document said the government’s 2020-25 Climate Emergency Skills Action Plan establishes a framework for creating and supporting the PV workforce, which is reportedly experiencing a “skills gap” for installation and maintenance. The draft also mentions the government’s ambition to introduce an exemption for plant and machinery used in onsite renewable energy generation storage, made available from April 2023 until March 2035.
Update: An earlier version of this story did not have the 4-6 GW ambition by 2030 confirmed by the Scottish government. The article has been updated to reflect that this claim and commitment has been verified by the government. 
This content is protected by copyright and may not be reused. If you want to cooperate with us and would like to reuse some of our content, please contact: editors@pv-magazine.com."
https://www.pv-magazine.com/2023/11/01/cadmium-telluride-solar-cells-show-strong-resistance-after-30000-orbits-around-earth/,"MODULES & UPSTREAM MANUFACTURING,TECHNOLOGY AND R&D,UNITED KINGDOM",EMILIANO BELLINI,"NOVEMBER 1, 2023","Cadmium telluride solar cells show strong resistance after 30,000 orbits around Earth","An international research team has found that cadmium telluride (CdTe) solar cells had no cell delamination signs, nor deterioration in the short circuit current and series resistance after operating for almost six years on a satellite orbiting the Earth.
The scientists integrated the cells onto the AlSat-1N 3U CubeSat satellite, which was launched from India into a 661 km × 700 km orbit on September 26, 2016.
We are very pleased that a mission designed to last one year is still working after six,” said the research's lead author Craig Underwood. “These detailed data show the panels have resisted radiation and their thin-film structure has not deteriorated in the harsh thermal and vacuum conditions of space.
The researchers built the cells using an ultra-thin space-qualified cerium-doped alumino-silicate cover-glass developed by photonic products provider Qioptiq Space Technology (QST). They deposited the transparent conducting oxide (TCO) and thin-film CdTe layers onto this substrate via metal-organic chemical vapour deposition (MOCVD).
“The industry leader then and now, for CdTe manufacturing, is First Solar Inc. who utilize High-Rate Vapour Transport Deposition (HR VTD),” the academics emphasized. “It is assumed, by the authors, that any future large-scale adoption of CdTe directly on cover-glass would employ this HR VTD mature manufacturing process with its inherently lower production cost than MOCVD.”
The cell was designed with an aluminium-doped zinc oxide (AZO) front contact, a zinc oxide high resistive transparent (HRT) layer, a cadmium zinc sulphide (Cd0.3Zn0.7S) n-type window layer, an arsenic-doped cadmium telluride (CdTe:As) p-type absorber, gold (Au) contacts, and a 100 μm thick QST glass.
Image: Swansea University, Acta Astronautica, Creative Commons License CC BY 4.0
Tested on earth, the cell achieved an average power conversion efficiency of 12.1%, an open-circuit current of 788 mV, a short-circuit current density of 28.0 mA·cm−2, and a fill factor of 76.4%.
In orbit, the cells endured temperature cycling between +85 C and −40 C without significant change in performance or sign of delamination, according to the research team.
Their I–V measurements showed, however, that the devices suffered a significant degradation of shunt resistance. “We ascribe this to the diffusion of gold from the back contact into the CdTe layer forming micro-shunts along the grain boundaries,” they specified. “Any future demonstration of the CdTe TFSC technology will require a new back contact architecture to be developed to realise the true potential of these cells for spaceflight.”
Their results are presented in the paper “IAC-22-C3.3.8 Six years of spaceflight results from the AlSat-1N Thin-Film Solar Cell (TFSC) experiment,” published in Acta Astronautica. “The findings could pave the way for commercially viable solar farms in space,” the scientists stated.
The research team includes academics from the University of Surrey and Swansea University in the United Kingdom, as well as the Algerian Space Agency (ASAL). Scientists from the University of Surrey designed the instruments to measure the cell performance in orbit, while the Surrey Space Centre and the ASAL designed the satellite. Researchers from the University of Swansea's Centre for Solar Energy Research developed the CdTe cells.
 
This content is protected by copyright and may not be reused. If you want to cooperate with us and would like to reuse some of our content, please contact: editors@pv-magazine.com."
https://www.pv-magazine.com/2023/11/01/panasonic-introduces-residential-solar-kits/,"MARKETS,MARKETS & POLICY,ASIA,INDIA",UMA GUPTA,"NOVEMBER 1, 2023",Panasonic introduces residential solar kits,"From pv magazine India
Panasonic Life Solutions India has unveiled new residential solar kits in the Indian cities of Pune and Nashik, in the state of Maharashtra. It said it plans to expand its offerings to multiple cities and achieve pan-India coverage by 2025.
“Panasonic’s residential solar kit, introduced under the brand name “Anchor,” provides top-of-the-line products with Panasonic’s assurance, along with easy installation and minimal maintenance,” said the company.
The kit offers easy installation and maintenance, supported by a mobile app-based energy monitoring system. Certified system integrators handle installations, and Panasonic provides warranty-based after-sales service for customer satisfaction.
In addition, the solar modules and inverters in the kits meet BIS, IEC, and Panasonic's Corporate Safety Standards (PCSS) for enhanced safety and fire protection.
“We have accumulated significant consumer data over the years about the need for an end-to-end branded solar solution in the residential arena,” said Amit Barve, solar business unit chief for Panasonic. “Our goal is to be the trusted partner throughout the consumer’s solar journey with the solar residential kits.”
This content is protected by copyright and may not be reused. If you want to cooperate with us and would like to reuse some of our content, please contact: editors@pv-magazine.com."
