url,tag,author,updated_date,title,contents
https://www.pv-magazine-brasil.com/2023/04/03/renovaveis-geraram-90-da-eletricidade-no-brasil-no-primeiro-trimestre-do-ano/,"GERAÇÃO CENTRALIZADA,INSTALAÇÕES,BRASIL",LÍVIA NEVES,"ABRIL 3, 2023",Renováveis geraram 90% da eletricidade no Brasil no primeiro trimestre do ano,"Indicadores do Operador Nacional do Sistema Elétrico (ONS) apontam que o Sistema Interligado Nacional (SIN) foi abastecido basicamente por fontes renováveis no primeiro trimestre de 2023. Hidráulica, eólica e solar foram responsáveis por mais de 90% da eletricidade demandada pelos brasileiros.
Em janeiro, as três fontes somadas chegaram a 91,2%. Nos meses seguintes, esse patamar se manteve elevado, com fevereiro registrando 92,6% e março, com base nos dados apurados até o dia 29 do mês, chegando a 92,4%.
É o maior patamar desde 2011, quando a fonte hidrelétrica sozinha correspondeu sozinha a 92% da geração hidrelétrica nos três primeiros meses do ano.
A fonte hídrica representou aproximadamente 76% da geração elétrica de janeiro a março de 2023, enquanto a eólica correspondeu a 12,7% e a solar a 2,6%. A fonte térmica, que inclui combustíveis fósseis como o gás e renováveis como a biomassa, correspondeu a 5,3%.
O sistema elétrico brasileiro já é sustentado por fontes renováveis que também oferecem segurança energética, isto é, conseguem atender plenamente às demandas de carga e potência.
Em março de 2023, o Sudeste/Centro-Oeste registra 82,6% de Energia Armazenada (EAR), ou seja, a capacidade de gerar eletricidade da fonte hídrica,  o que configura o melhor março desde 2011, quando chegou a 82,9%. Em março de 2022m o nível de armazenamento estava em 63,6%. Até o final de agosto a Energia Armazenada (EAR) no subsistema SE/CO, deve ficar entre 76,2%, nas análises menos favoráveis, e 90%, na perspectiva mais elevada. O SE/CO é responsável por 70% da energia armazenada no país.
A alta disponibilidade de geração hidrelétrica tem levado os preços da energia para os patamares mínimos no mercado de curto prazo. O Preço de Liquidação das Diferenças, que precifica energia para ajustes de contratos, está no patamar mínimo possível, R$ 69/MWh.
O cenário inclusive tem tornado desafiador fechar novos contratos de venda de energia solar no longo prazo (entre cinco e oito anos) no mercado livre, já que os consumidores podem optar por adquirir a energia que está sendo liquidada no curto prazo por preços mais baixos. Para 2024, com a possível entrada de novos consumidores de alta tensão no mercado livre, a demanda pode reequilibrar os preços.
Este conteúdo é protegido por direitos autorais e não pode ser reutilizado. Se você deseja cooperar conosco e gostaria de reutilizar parte de nosso conteúdo, por favor entre em contato com: editors@pv-magazine.com."
https://www.pv-magazine-brasil.com/2023/04/03/boas-politicas-publicas-podem-ampliar-protagonismo-brasileiro/,"OPINIÃO,BRASIL",ABSOLAR,"ABRIL 3, 2023",Energia solar: boas políticas públicas podem ampliar protagonismo brasileiro,"O Brasil caminha para se tornar uma liderança mundial cada vez mais relevante em energia solar fotovoltaica, a fonte renovável que mais cresce no planeta. Recentemente, o país entrou, pela primeira vez, na lista das dez nações com maior potência instalada acumulada da fonte fotovoltaica, fechando 2022 com 24 GW e assumindo, de forma inédita, a oitava colocação no ranking internacional.
Entretanto, para que o imenso potencial brasileiro para a energia solar seja mais bem aproveitado, a estruturação de boas políticas públicas de desenvolvimento e incentivo da fonte é fundamental, seja no âmbito federal ou nas esferas estaduais e municipais. Em fevereiro de 2023, o tema foi levado ao ministro da Fazenda, Fernando Haddad, pela Associação Brasileira de Energia Solar Fotovoltaica (Absolar). Na ocasião, discutiram como a energia solar fotovoltaica pode ser uma ferramenta estratégica para a transição energética sustentável e o combate à crise climática que preocupa a humanidade.
Na prática, a entidade recomenda a inclusão da fonte solar como alavanca para o desenvolvimento social, econômico e ambiental do país. Em especial, há uma grande oportunidade de uso da tecnologia em programas sociais do Governo Federal, como nas casas populares do Programa Minha Casa Minha Vida, bem como para reduzir os custos de energia elétrica de prédios públicos, como escolas, hospitais, postos de saúde, delegacias, bibliotecas, museus, parques, entre outros. Com isso o Governo Federal daria também um sinal de liderança pelo exemplo, fortalecendo o protagonismo internacional do Brasil no tema da sustentabilidade.
Nesse sentido, como promessa de campanha para o setor elétrico, o presidente Lula sinalizou a priorização da agenda de transição energética e os indícios puderam ser observados com a simbólica mudança do nome da “Secretaria de Planejamento e Desenvolvimento Energético” para “Secretaria de Planejamento e Transição Energética”.
No caso das grandes usinas solares, a associação propõe um maior protagonismo da fonte nas contratações de leilões de energia elétrica do governo federal, já que a solar é a mais competitiva no país e pode ajudar na redução da conta de luz da população.
Portanto, para o Brasil se tornar a potência sustentável que se almeja, é preciso inverter a lógica de políticas públicas no setor de energia: diminuir subsídios, incentivos e desonerações às fontes fósseis e aumentar o apoio às fontes limpas e renováveis, bem como às novas tecnologias de armazenamento de energia elétrica e hidrogênio verde. É nesta direção que o mundo caminha e é isso que a sociedade brasileira e a comunidade internacional esperam de nossos líderes.
No âmbito do poder executivo, o vice-presidente e ministro de Desenvolvimento, Indústria e Comércio (MDIC), Geraldo Alckmin, demonstrou atenção ao tema, ao publicar a nova versão do Programa de Apoio ao Desenvolvimento Tecnológico da Indústria de Semicondutores (Padis), com a inclusão de importantes insumos produtivos para a fabricação de módulos fotovoltaicos e células fotovoltaicas. Este é um importante primeiro passo na direção correta, para incentivar a vinda de novos investimentos em indústrias solares, contribuindo para a industrialização verde do Brasil, com mais capital estrangeiro, novas oportunidades de negócios, novas tecnologias e, principalmente, mais empregos e renda para a população.
Estudo realizado pela consultoria alemã Roland Berger indica que o Brasil pode ser um dos maiores exportadores globais de hidrogênio verde, com potencial de alcançar uma receita anual de R$ 150 bilhões em 2050, dos quais R$ 100 bilhões provenientes de exportações. Para isso, a cadeia relacionada à produção desta nova commodity receberia investimentos de cerca de R$ 600 bilhões nos próximos 25 anos.
Atualmente, o Brasil possui mais de 27 GW de potência instalada da fonte solar fotovoltaica, somando as usinas de grande porte e os sistemas de geração própria de energia solar em telhados, fachadas e pequenos terrenos, o equivalente a mais de 11,6 % da matriz elétrica do País.
Desde 2012, o setor solar já trouxe ao Brasil mais de R$ 134,5 bilhões em novos investimentos, mais de R$ 41,2 bilhões em arrecadação aos cofres públicos e gerou mais de 811,4 mil empregos acumulados. Com isso, também evitou a emissão de 35,8 milhões de toneladas de CO2 na geração de eletricidade.
Assim, fica evidente a notável contribuição e o imenso potencial do setor fotovoltaico para a sociedade, os setores produtivos, a economia e o meio ambiente. O setor está pronto para fazer ainda mais e colaborar com o poder público, para o avanço dos programas sociais e das políticas de transição energética no país, elevando cada vez mais o protagonismo brasileiro no cenário internacional.
Autores
Rodrigo Sauaia, CEO da ABSOLAR; Ronaldo Koloszuk, presidente do Conselho de Administração da ABSOLAR; e Wagner Parente, CEO da BMJ Consultores Associados.
Os pontos de vista e opiniões expressos neste artigo são dos próprios autores, e não refletem necessariamente os defendidos pela pv magazine.
Este conteúdo é protegido por direitos autorais e não pode ser reutilizado. Se você deseja cooperar conosco e gostaria de reutilizar parte de nosso conteúdo, por favor entre em contato com: editors@pv-magazine.com."
https://www.pv-magazine-brasil.com/2023/04/03/byd-e-orion-e-firmam-parceria-para-construir-100-mw-de-gd-solar-ate-2025/,"GERAÇÃO DISTRIBUIDA,INSTALAÇÕES,BRASIL",LÍVIA NEVES,"ABRIL 3, 2023",BYD e Orion-E firmam parceria para construir 100 MW de GD solar até 2025,"BYD anunciou parceria com a ORION-E Sustainable Energy para a construção no formato Full EPC de 1.000 usinas de 100 kWp cada uma, somando 100 MWp em um período de dois anos.
A parceria atenderá o Projeto 3 Marias desenvolvido pela Orion-E, voltado para a produção e entrega de energia solar por meio do arrendamento de terras do pequeno produtor rural para a instalação de usinas fotovoltaicas, produzindo energia solar na modalidade de microgeração distribuída.
No projeto, a BYD construirá as usinas por meio de seus parceiros integradores credenciados em todo Brasil e a Orion-E Sustainable Energy será responsável pela distribuição desta energia por meio da locação destas usinas ao cliente final. A BYD será a responsável pelo Full EPC (Engineering, Procurement and Construction), ou seja, a entrega das usinas no modelo “turn-key”, instaladas e funcionando.
ESG
O projeto serve como instrumento de inclusão social, com potencial de alcançar parte dos quase 4 milhões de produtores rurais inscritos na agricultura familiar espalhados por todo o território brasileiro. A parceria eleva a renda destas famílias em até 40%, com contratos por um período de até 30 anos.
Como impacto ambiental positivo do projeto, está a mitigação e compensação das emissões de GEE (gases de efeito estufa) proveniente dos quase 30 GW de usinas que utilizam combustíveis não renováveis. E, também, o acordo de que todas as usinas construídas, ao completarem sua vida útil, tenham os seus componentes reciclados por meio da empresa de reciclagem Beta-O, que pertence ao Grupo Orion-E.
Como prática de governança, foi criado o MegaWatt Validado, selo que garante o padrão das operações do segmento em território nacional, trazendo mais segurança para todo o mercado e seus partes interessadas.
“A energia renovável, incluindo a solar, chegou tardiamente ao Brasil, mas de forma correta. Se olharmos com atenção para as oportunidades que a Lei 14300 traz ao setor, é evidente que 2023 tem todo o potencial de ser o ano da energia renovável, com segurança jurídica e auditoria comprovada para as boas práticas. Os projetos de geração e distribuição da Orion-E seguem acelerados, oferecendo energia acessível mesmo com a novas regras do mercado”, diz  o diretor de Operação da Orion-E, Marco Aurélio.
Este conteúdo é protegido por direitos autorais e não pode ser reutilizado. Se você deseja cooperar conosco e gostaria de reutilizar parte de nosso conteúdo, por favor entre em contato com: editors@pv-magazine.com."
