url,tag,author,updated_date,title,contents
https://www.pv-magazine.com/2022/03/21/netherlands-sets-e13bn-budget-for-2022-sde-program-green-hydrogen-included-for-first-time/,"HIGHLIGHTS,HYDROGEN,MARKETS,UTILITY SCALE PV,UTILITY SCALE STORAGE,NETHERLANDS",EMILIANO BELLINI,"MARCH 21, 2022","Netherlands sets €13bn budget for 2022 SDE+ program, green hydrogen included for first time","The Dutch government announced on Wednesday that the budget for the 2022 SDE++ program for large scale renewable energy projects will be €13 billion, the highest sum ever devoted to the scheme to date.
Starting from this year, the scheme will also be open to green hydrogen facilities that are directly linked to wind or solar parks, and industrial electrification projects based on hybrid glass furnaces. Furthermore, the Dutch authorities have decided to extend the construction timeframe for geothermal and CO2 capture and storage (CCS) projects.
“I am pleased that a substantial budget is available for the upscaling of renewable energy and other sustainable technologies,” said the Dutch minister of climate and energy, Rob Jetten. “This is not only necessary to become more sustainable more quickly and to achieve our climate goals but also to reduce our dependence on the import of fossil fuels as quickly as possible.”
In the latest round of the program, the Dutch government selected 3,426 PV projects with a combined capacity of 3,535MW.
The Netherlands could reach between 38GW and 125GW of total installed solar capacity by 2050, according to a recent report by Netbeheer Nederland. By the end of December, the country’s cumulative installed solar capacity hit 14.3GW.
This content is protected by copyright and may not be reused. If you want to cooperate with us and would like to reuse some of our content, please contact: editors@pv-magazine.com."
https://www.pv-magazine.com/2022/03/21/swedens-first-rock-cavern-for-green-hydrogen-storage-takes-shape/,"DISTRIBUTED STORAGE,ENERGY STORAGE,ENERGY STORAGE,HYDROGEN,TECHNOLOGY AND R&D,UTILITY SCALE STORAGE,SWEDEN",EMILIANO BELLINI,"MARCH 21, 2022",Sweden’s first rock cavern for green hydrogen storage takes shape,"Vattenfall, Sweden-based steel company SSAB, and Swedish state-owned miner LKAB announced they have reached the halfway point in the construction of a rock cavern storage facility for green hydrogen near Luleå, in northern Sweden.
“The various parts of the plant are now mostly in place,” the consortium said in a statement. “Rock caverns and connecting tunnels have been constructed in the rock and a ventilation shaft has been drilled from the top of the rock down to the upper part of the rock cavern.”
The three companies are investing a total of around SEK 200 million ($21.1 million) in three equal parts in the new facility and the Swedish Energy Agency is contributing SEK 50 million. “Intensive work is underway at the moment to complete and inspect all installations, while the facility’s steel lining is being welded together in the cavern,” the statement reads.

The 100-cubic-meter “Hybrit” facility will be built approximately 30 meters below ground. It is expected to begin operations in 2022 and will reach full capacity in 2024.
The cavern is being built via the so-called lined rock cavern (LRC) approach, which involves covering the walls of the cavern with a selected material as a sealing layer.
A recent study by the Jülich Institute for Energy and Climate Research (IEK-3) showed that salt caverns offer a flexible, efficient option for hydrogen storage. The research group estimates that Europe has the technical potential to store 84.8 PWh of hydrogen in bedded salt deposits and salt domes.
The IEK-3 researchers said the proximity of the caverns to the coast will be helpful, as brine disposal remains economical up to 50 km from the sea.
This content is protected by copyright and may not be reused. If you want to cooperate with us and would like to reuse some of our content, please contact: editors@pv-magazine.com."
https://www.pv-magazine.com/2022/03/21/monolithic-fuel-cell-with-power-density-of-5-6kw-l/,"DISTRIBUTED STORAGE,ENERGY STORAGE,HYDROGEN,TECHNOLOGY AND R&D,UTILITY SCALE STORAGE,DENMARK,NORWAY",EMILIANO BELLINI,"MARCH 21, 2022",Monolithic fuel cell with power density of 5.6kW/L,"A Danish-Norwegian research group has designed a metal-based monolithic solid oxide fuel cell (SOFC) that is claimed to be suitable for transport applications. The scientists explained that SOFCs are generally utilized for stationary applications, in particular with combined heat and power systems, thanks to the high temperature at which they can operate. These devices, however, are generally considered less suitable for vehicles due to their lower power density and the limited thermal cycling robustness of their ceramic anode.
In the proposed fuel cell configuration, the ceramic anode was replaced with metallic interconnects. “The monolith concept integrates the cell support, gas channels, and the interconnects into a single layer, thereby reducing the stack height by a factor of 2–4,” the researchers explained, noting that the metal-based monolith stack is significantly cheaper than a conventional stack. “This considerably increases the volumetric density and specific power of the stack, which are important parameters considering the space and weight constraints in vehicles.”
Furthermore, the high metal content of the SOFC is claimed to lower temperature differences across the stack and offer more robustness to fast thermal cycles during operation, which the scientists said could be important when combining the fuel cell with electric batteries in a vehicle. “Previous work on monolithic SOFCs designs were reported by Saint-Gobain, which developed fully ceramic monolithic SOFC stacks, and by Argonne National Laboratory, which designed metal-supported SOFC stacks (‘TuffCell'),” the research group stated. “However, our concept of metal-based monolithic SOFCs comprises several significant differences when compared to the one developed by Argonne National Laboratory, such as the processing techniques to integrate gas flow channels, the electrode materials and thicknesses, and the concept of integrated seals.”
A monolith SOCF with an active cell area of around 18 cm2 was built through four processes – tape casting, lamination, co-sintering, and catalyst infiltration – which the scientists described as common techniques utilized in fuel cell manufacturing. The device was found to have an open-circuit voltage of 1065mV and a power density of5.6 kW/L, which the researchers said are on par with the best performing fuel cells based on ceramic anodes. ” We speculate that this design, or similar, could enable large-scale production of electrified transportation powered by fuel cells with considerably increased range, decreased charging times, and lower cost,” they concluded.
The fuel cell tech is introduced in the paper Production of a monolithic fuel cell stack with high power density, published in nature communications. The research team includes academics from the Technical University of Denmark and Norwegian research entity Sintef.
This content is protected by copyright and may not be reused. If you want to cooperate with us and would like to reuse some of our content, please contact: editors@pv-magazine.com."
https://www.pv-magazine.com/2022/03/21/australian-utility-gets-tick-of-approval-for-2gwh-liddell-battery/,"DISTRIBUTED STORAGE,ENERGY STORAGE,HIGHLIGHTS,MARKETS,UTILITY SCALE STORAGE,AUSTRALIA",DAVID CARROLL,"MARCH 21, 2022",Australian utility gets tick of approval for 2GWh Liddell battery,"From pv magazine Australia
Australian energy utility AGL confirmed at the weekend it has received approval from the New South Wales (NSW) Department of Planning and Environment (DPIE) to build a 500MW big battery, with up to four hours of storage, at the site of the soon-to-be-closed Liddell power plant near Muswellbrook in the Hunter Valley.
The grid-scale lithium-ion battery energy storage system is part of AGL’s plans to establish an integrated, low-carbon energy hub at the site of the ageing coal-fired generator that is to be shuttered early next year.
AGL said the first unit of Liddell is due to close next month, with the remaining three units to close in April 2023.
Planning documents indicate the big battery will have at least a 20-year operational life and will be built in three stages. The first phase of the project involves the installation of 150MW of battery storage. Work on Phase 1 is expected to be complete by the time the coal-fired plant shuts down.
NSW Treasurer Matt Kean said the Liddell battery would play an important role in supporting the transition of the energy sector to renewable power generation as coal-fired generation is increasingly withdrawn.
“Big batteries combined with solar, wind and pumped hydro will help to deliver some of the cheapest and most reliable energy to the families and businesses of NSW,” he said.
The approval of the Liddell big battery comes just weeks after AGL announced it had fast-tracked the closures of its two biggest coal-fired power plants by several years.
AGL said the 2,640MW Bayswater power station in the Hunter Valley will be shuttered “no later than” 2033, two years ahead of its previously scheduled closure of 2035, while the 2.210MW Loy Yang A plant in Victoria’s Latrobe Valley will now close by 2045 rather than 2048.
Fellow gen-tailer Origin Energy has also brought forward plans to close its coal-fired Eraring power station in the Hunter region, announcing last month the 2,880MW plant will be closed in August 2025, seven years earlier than previously scheduled.
AGL chief operating officer Markus Brokhof said the transition of the Liddell coal-fired power plant into a renewable energy hub would mark the company’s first rehabilitation of a thermal coal site.
“This planning approval marks a significant milestone for the transition of the Liddell site,” he said. “We look forward to working with partners to progress other developments on and around the site, including a wind farm, a solar storage system, pumped hydro, a waste-to-energy plant and our recently announced green hydrogen pilot with Fortescue Future Industries (FFI).”
The Liddell battery forms part of AGL’s plans to add 850MW of grid-scale batteries to its portfolio by 2024.
Construction had has already started on a 250MW/1GWh battery being developed at the site of its Torrens Island power station in South Australia.
It has also lodged a planning application to construct a 200MW/800MWh battery at its Loy Yang power station. AGL has already received the tick of approval from NSW planning authorities for a 50MW/100MWh battery in Broken Hill and has announced support for battery projects at Wandoan (100 MW) in Queensland and Maoneng (4 x 50MW) in NSW. It is already operating the 30 MW/8MWh BESS at Dalrymple in South Australia.
Brokhof said firming technology like grid-scale battery storage would be critical to the ongoing integration of renewable sources into the national grid.
“As Australia moves forward and we increase our reliance on renewable generation, batteries will be critical in providing the storage needed to maintain a consistent, reliable and affordable energy system,” he said.
“All of these developments will benefit from the excellent resources and infrastructure these sites feature and create the jobs of the future across many industries, not just energy.
“This is a trend that is already happening overseas with more than 150 energy hub projects announced globally, all of them aimed at creating new business development opportunities and value creation.”
The planning approval for the Liddell battery comes as AGL continues to progress its plan to split into two listed entities – energy retailer AGL Australia and electricity generator Accel Energy – by June 30.
Under the proposal, AGL Australia would own its retailing division and some cleaner generation assets, while Accel Energy would house its fleet of coal- and gas-fired power stations.
As part of the demerger, AGL has outlined plans to diversify these thermal power sites into renewable energy hubs, which may include big batteries, hydrogen production and carbon capture and storage.
Earlier this month AGL rejected a $9 billion buyout offer from a consortium including software billionaire Mike Cannon-Brookes and Canada’s Brookfield Asset Management, saying the offer understated the value it believes will be unlocked through the demerger, including its vision for energy hubs.
 
This content is protected by copyright and may not be reused. If you want to cooperate with us and would like to reuse some of our content, please contact: editors@pv-magazine.com."
https://www.pv-magazine.com/2022/03/21/greening-us-solar-with-end-of-life-plan/,"MARKETS,MODULES & UPSTREAM MANUFACTURING,UNITED STATES",ANNE FISCHER,"MARCH 21, 2022",Greening US solar with end-of-life plan,"From pv magazine USA
The US Department of Energy (DOE) today released an action plan to enable the safe and responsible handling of solar photovoltaic (PV) end-of-life (EOL) materials. In order for solar to truly be a “clean” technology, it is imperative to have a plan for the disposal of solar panels at the end of their useful life. The current lifetime for solar panels is about 30 years, and while the solar industry grew slowly for several decades, about 70% of existing solar energy systems were deployed within the last five years.
The International Renewable Energy Agency forecasts that the cumulative end-of-life waste from PV in the US in 2030 is projected to be between 0.17 and 1 million tons. For perspective, there are 200 million tons of solid waste, excluding recycled and composted materials, generated in the United States each year.
Although 95% of a cadmium telluride (CdTe) and silicon (Si) solar module is recyclable, the current cost to recycle solar modules is around $15-$45 per module, while the landfill fee is $1-$5 per module, not including transportation costs. Recycling processes that have been developed in the US for CdTe and Si solar modules also cost more than the value of materials obtained from recycling.
“As we accelerate deployment of photovoltaic systems, we must also recognize the pressing need to address end-of-life for the materials in a sustainable way,” said Kelly Speakes-Backman, Principal Deputy Assistant Secretary for the Office of Energy Efficiency and Renewable Energy at the US Department of Energy.
The DOE Solar Energy Technologies Office (SETO) is funding research to improve the performance, lower the cost, and support widespread deployment of solar. Research areas that SETO will focus on include reliability and durability to increase the operating life of solar PV systems, lowering the resource-intensity of manufacturing, improving solar module recycling processes, and understanding environmental and health impacts of the EOL options. In addition, SETO will support research on how to cut the cost of module recycling by more than half by 2030. Overall, the plan is to reduce the environmental impact of solar energy while supporting the Biden Administration’s goal to decarbonize the electricity grid by 2035.
This content is protected by copyright and may not be reused. If you want to cooperate with us and would like to reuse some of our content, please contact: editors@pv-magazine.com."
