url,tag,author,updated_date,title,contents
https://www.pv-magazine.de/2023/06/27/pilotprojekt-fuer-photovoltaik-autobahnueberdachung-fertiggestellt/,"HIGHLIGHTS DER WOCHE,INSTALLATION,DEUTSCHLAND,ÖSTERREICH,SCHWEIZ",SANDRA ENKHARDT,27. JUNI 2023,Pilotprojekt für Photovoltaik-Autobahnüberdachung fertiggestellt,"An der Autobahn 81 – genauer auf der Rastanlage Hegau-Ost – ist ein Pilotprojekt fast fertiggestellt. Am Dienstag besuchte Bundesverkehrsminister Volker Wissing (FDP) die erste Photovoltaik-Anlage zur Überdachung der Autobahn. Bei der Versuchungsanlage handelt es sich um ein gemeinsam finanziertes Forschungsprojekt aus Deutschland, Österreich und der Schweiz.
Bereits im Mai 2021 waren die groben Pläne von den beteiligten Forschungsinstituten – Fraunhofer ISE (Freiburg), Forster FF und Austrian Institute of Technology (beide aus Österreich) – vorgestellt worden. Letztendlich ist jedoch nicht die Autobahn direkt überdacht worden, wie ursprünglich geplant, sondern eine danebenliegende Durchfahrgasse. Die 12 mal 14 Meter große Photovoltaik-Dachfläche aus Solarmodulen ist auf einer Stahlkonstruktion installiert. Die Höhe liegt bei etwa 5,50 Meter. Die Solarmodule für das Pilotprojekt lieferte Solarwatt. Nach Angaben eines Sprechers hat die Photovoltaik-Anlage eine Gesamtleistung von 33 Kilowatt. Die Solarmodule verfügten über eine bauaufsichtliche Zulassung. Die finale Fertigstellung der Photovoltaik-Anlage ist für Juli geplant.
Ein Solardach über der Autobahn bietet sich grundsätzlich dort an, wo der Strom direkt genutzt werden kann, etwa in der Nähe von Tunneln oder Rastanlagen, wie es vom Bundesverkehrsministerium hieß. Dabei müssten jedoch hohe Sicherheitsanforderungen für den darunter sehr schnell fließenden Verkehr beachtet werden.
„Photovoltaik an und auf Bundesfernstraßen ist für die Bundesregierung ein wichtiger Schritt auf dem Weg zur Klimaneutralität. Deshalb denken wir Photovoltaik künftig immer mit. Mit unserem Genehmigungsbeschleunigungsgesetz werden wir den Ausbau von Solaranlagen auf und an Autobahnen beschleunigen und vereinfachen“, erklärte Bundesverkehrsminister Wissing. Die Autobahn GmbH des Bundes suche bereits nach geeigneten Standorten. Deren Geschäftsführerin Anne Rethmann bekräftigte, dass der Ausbau von Photovoltaik-Anlagen im Autobahnnetz stufenweise vorangetrieben werde, um das Ziel der Klimaneutralität bis 2040 für den eigenen Bereich zu erreichen. Der Präsident der Bundesanstalt für Straßenwesen, Markus Oeser, ergänzte, dass seine Behörde das Pilotprojekt nun ein Jahr wissenschaftlich begleitet werde.
„Außerdem erleichtern wir es Kommunen, Anliegern und Investoren, Photovoltaik-Module im Bereich der Bundesautobahnen zu errichten“, so Wissing weiter. Die Beschleunigung des Ausbaus von Anlagen für erneuerbare Energie im Bereich der Verkehrsinfrastruktur sei Teil des Genehmigungsbeschleunigungsgesetzes. Das Kabinett hatte den Entwurf am 3. Mai beschlossen. Demnach soll beim Neu- und Ausbau von Bundesautobahnen künftig geprüft werden, inwieweit die zugehörigen Flächen und Einrichtungen für Erneuerbaren-Anlagen genutzt werden können. Es habe sich gezeigt, dass besonders Lärmschutzwälle als Aufstellflächen für Photovoltaik-Anlagen eine gute Eignung aufweisen, erklärte das Bundesverkehrsministerium. Derzeit werde ein Kataster sämtlicher potenziellen Flächen erstellt. „Außerdem wird das anbaurechtliche Verfahren erleichtert, damit Dritte – beispielsweise Kommunen, Anlieger und Investoren – Anlagen für die Erzeugung erneuerbarer Energien auf den an die Bundesfernstraßen angrenzenden Flächen einfacher realisieren können“, so das Ministerium.
Dieser Inhalt ist urheberrechtlich geschützt und darf nicht kopiert werden. Wenn Sie mit uns kooperieren und Inhalte von uns teilweise nutzen wollen, nehmen Sie bitte Kontakt auf: redaktion@pv-magazine.com."
https://www.pv-magazine.de/2023/06/27/juni-bringt-neuen-solarstrom-rekord/,"HIGHLIGHTS DER WOCHE,MÄRKTE,DEUTSCHLAND",SANDRA ENKHARDT,27. JUNI 2023,Juni bringt neuen Solarstrom-Rekord,"Das ZSW und der BDEW haben die Zahlen für die Bruttostromerzeugung im ersten Halbjahr vorläufig ausgewertet. Demnach kommen die Erneuerbaren auf rund 52 Prozent des Bruttoinlandstromverbrauchs, drei Prozentpunkte mehr als noch im Vorjahreszeitraum. Besonders im Mai sei der Anteil mit 57 Prozent am Stromverbrauch sehr hoch gewesen. Der Rekordwert mit 62 Prozent ist bislang im Februar 2022 wegen der hohen Windstromeinspeisung erreicht worden.
Gerade der Juni – wenngleich er noch nicht einmal zu Ende ist – wird neue Rekorde für Solarstrom bringen. ZSW und BDEW gehen davon aus, dass die Erzeugung erstmals bei mehr als 10 Milliarden Kilowattstunden liegen wird. Die 8,8 Milliarden Kilowattstunden aus dem Mai, der bisherige Höchstwert, wird auf jeden Fall übertroffen werden. Der Bruttostromverbrauch bildet das gesamte Stromsystem eines Landes ab.
Die Ermittlung der Daten erfolgt durchaus unterschiedlich. Bei Energy-Charts vom Fraunhofer ISE wird dabei die Nettostromerzeugung in den Blick genommen, also der Strommix, der letztlich aus der Steckdose kommt. Die Daten der Freiburger Forscher zeigen, dass Photovoltaik-Anlagen bis zum 27.6. bereits etwa 8,26 Milliarden Kilowattstunden zur öffentlichen Nettostromerzeugung in Deutschland beigetragen haben. Der Anteil von Solar liegt damit für den Monat Juni bei aktuell 30,4 Prozent und weit vor allen anderen Erzeugungsquellen. Die Erneuerbaren insgesamt kommen bei Energy-Charts im Juni bisher auf einen Anteil von 68,4 Prozent.

Und auch Eon wertet die Erzeugung auf Grundlage von Daten der Bundesnetzagentur, Wetterprognosen sowie erwarteten Energiemengen im Strommarkt aus. Auch nach seiner Analyse wird im Juni ein neuer Solarstrom-Rekord erreicht. Bereits bis einschließlich Montag (26. Juni) seien mehr als 7,8 Milliarden Kilowattstunden Solarstrom ins deutsche Stromnetz eingespeist worden, so der Energiekonzern am Dienstag. Dies sei bereits mehr als jemals zuvor in einem Juni. Im vergangenen Jahr waren es Eon zufolge rund 7,7 Milliarden Kilowattstunden. Der ertragreichste Tag des Monats war Eon zuolge der 3. Juni mit rund 360 Millionen Kilowattstunden Solarstrom.
Dieser Inhalt ist urheberrechtlich geschützt und darf nicht kopiert werden. Wenn Sie mit uns kooperieren und Inhalte von uns teilweise nutzen wollen, nehmen Sie bitte Kontakt auf: redaktion@pv-magazine.com."
https://www.pv-magazine.de/2023/06/27/neues-flexibles-speichersystem-fuer-gewerbekunden-von-sonnen/,"HIGHLIGHTS DER WOCHE,SPEICHER,DEUTSCHLAND,ITALIEN,SPANIEN",CORNELIA LICHNER,27. JUNI 2023,Neues flexibles Speichersystem für Gewerbekunden von Sonnen,"Das neue Speichersystem „sonnenPro FlexStack“, das Sonnen erstmals auf der The Smarter E in München vorgestellt hat, ist nun auch Teil unserer Marktübersicht für Groß- und Gewerbespeicher. Das Speichersystem für Indoor- und Outdoor-Anwendungen besteht aus mindestens zwei würfelförmigen Einheiten, mit denen sich eine Mindestleistung von 92 Kilowatt mit 110 Kilowattstunden erreichen lässt. Zwei weitere Cubes können für eine Leistung bis 368 Kilowatt und eine Kapazität bis 495 Kilowattstunden dazugestellt werden. Per Kaskadierung seien auch größeren Blöcke mit mehr Leistung und Kapazität möglich, teilt das Unternehmen mit. Je nach Kundenanforderung und Anwendungsfall werde der Speicher mit einer passenden Konfiguration für den Betrieb, sei es im öffentlichen Netz oder im Unternehmensnetz, aus über 20 Möglichkeiten bereitgestellt. Zudem offeriert Sonnen Unterstützung für komplexere Projektierungsphasen, wie sie im Großspeicherbereich üblich seien.

Das Produkt ist in der aktualisierten pv magazine Marktübersicht Groß- und Gewerbespeicher gelistet. Für diese haben wir 80 Details zu mehr als 270 Produkten und Dienstleistungen abgefragt und dargestellt. Zur Startseite der pv magazine Datenbank Groß- und Gewerbespeicher. Eine Interpretation der Trends zu den in der Produktdatenbank enthaltenen Einträgen finden Sie in der pv magazine März-Ausgabe 2023 (Premium Inhalt) in vier Artikeln. Dort finden Sie auch eine übersichtliche Tabelle mit den wichtigsten Details der Einträge der Produktdatenbank im Vergleich.
„Unsere gesamte Erfahrung und Technologiekompetenz ist in ein hochflexibles und digital vernetztes Speichersystem geflossen“, sagt Susan Käppeler, Country-Managerin DACH bei Sonnen. Mit dem ersten Produkt der neuen Sparte „sonnenPro“ gehe das Unternehmen, das sich bislang auf das Privatkundensegment konzentriert hat, den nächsten konsequenten Schritt und zeigt nun eine Lösung für die Energiewende in Unternehmen. Diese können mit dem Lithium-Eisenphosphat-Speicher ihre selbsterzeugte, erneuerbare Energie rund um die Uhr nutzen. Zu den Komponenten im outdoorfähigen IP65-Metallgehäuse gehören neben den Powerpack 4-Batteriemodulen eine Klimaanlage zum Kühlen und Heizen und passive Brandschutzeinrichtungen. Die kompakten Maße seien auch für kleinste Flächen im Außenbereich geeignet. Der Speicher kann neben der Eigenverbrauchserhöhung optional zum Glätten von Last- und Erzeugungsspitzen oder als Ladebooster genutzt werden. Dadurch können mögliche Beschränkungen beim Netzanschluss abgefangen werden.
Die ersten Systeme sollen voraussichtlich im vierten Quartal 2023 zur Verfügung stehen. Der Verkaufsstart ist für Ende Oktober in Deutschland, Spanien und Italien geplant. Mittelfristig könnten die Flexstacks Teil des virtuellen Kraftwerks werden, mit dem Sonnen bereits heute private Photovoltaik-Heimspeicher zu einer virtuellen Großbatterie vernetzt. Die nötigen Schnittstellen seien bereits angelegt, so der Hersteller. Dadurch ließen sich zukünftig Flexibilitäten am Energiemarkt bereitstellen und zusätzliche Mehrwerte generieren, die über das reine Kostensparen hinausgehen.
Weiter zum detaillierten Eintrag in der Datenbank.
Der Artikel wurde am 29.06.2023 geändert, es hieß zuvor, die platzsparenden Speicherwürfel seien für 20 verschiedene Betriebsmodi konfigurierbar, tatsächlich sind es 20 unterschiedliche Konfigurationsmöglichkeiten.    
Dieser Inhalt ist urheberrechtlich geschützt und darf nicht kopiert werden. Wenn Sie mit uns kooperieren und Inhalte von uns teilweise nutzen wollen, nehmen Sie bitte Kontakt auf: redaktion@pv-magazine.com."
https://www.pv-magazine.de/2023/06/27/erste-kommerzielle-v2g-wallboxen-auf-der-the-smarter-e-gesichtet/,"MÄRKTE,DEUTSCHLAND",MARIAN WILLUHN,27. JUNI 2023,Erste kommerzielle V2G-Wallboxen auf der The smarter E gesichtet,"Endlich Bewegung im Vehicle-To-Grid. Christopher Hecht von The Mobility House und der RWTH Aachen beobachtete auf der The smarter E in München, dass der Markt für Wallboxen reifer wird. Was vor kurzem noch Markenzeichen einiger Hersteller war, können heute alle. Der Markt ist anspruchsvoll geworden. Und bei der neuen Kür – dem Ausspeisen aus dem Auto ins Hausnetz, gab es auch einige Angebote auf der Messe zusehen, die zum ersten Mal über Pilot- und Forschungsprojekte hinaus tatsächlich in die kommerzielle Anwendung gehen.
 
Dieser Inhalt ist urheberrechtlich geschützt und darf nicht kopiert werden. Wenn Sie mit uns kooperieren und Inhalte von uns teilweise nutzen wollen, nehmen Sie bitte Kontakt auf: redaktion@pv-magazine.com."
