url,tag,author,updated_date,title,contents
https://www.pv-magazine.de/2022/05/25/senec-will-gedrosselte-leistung-der-speicher-in-naechsten-tagen-auf-altes-niveau-zurueckbringen/,"HIGHLIGHTS DER WOCHE,SPEICHER,DEUTSCHLAND",SANDRA ENKHARDT,25. MAI 2022,Senec will gedrosselte Leistung der Speicher in nächsten Tagen auf altes Niveau zurückbringen,"Die Wiederinbetriebnahme der in Stand-by versetzten Photovoltaik-Heimspeicher von Senec läuft. Nach Angaben des Leipziger Unternehmens sind die meisten Systeme wieder 100 Prozent nutzbar. Doch nach dem letzten Bericht im pv magazine meldeten sich unzählige Senec-Kunden, die mehr als unzufrieden mit dem jetzigen Zustand ihrer Speicher sind – denn Lade- und Entladeleistung stehen ihnen nur sehr eingeschränkt zur Verfügung.
Nicht wenige Kunden von Senec fürchten, dass der Hersteller die Wiederinbetriebnahme für abgeschlossen hält, obwohl die Systeme noch weit entfernt vom Zustand vor der Fernabschaltung sind. Aktuell können die Speicher nur zu 100 Prozent geladen werden, weil die Tage so lang sind, was Senec auch einräumt. An einer Erhöhung der Lade- und Entladeleistung werde kontinuierlich weitergearbeitet, betonte das Unternehmen am Mittwoch. „Durch sukzessive Software-Updates wird die Leistung wieder auf das bekannte ursprüngliche Niveau gebracht. Zusätzlich unterstützen wir mit der neuen Optimierung des Ladeverhaltens die Lebensdauer der Batteriezellen maßgeblich“, heißt es bei Senec. Wann genau die Speicher wieder ihre alte Leistungsfähigkeit erreichen, kann noch niemand genau sagen. Doch für viele Betreiber solle dies bereits in den nächsten Tagen der Fall sein, verspricht Senec.
Dazu kommt die tägliche Konditionierung der Batterien, die aktuell vormittags stattfindet und währenddessen die Systeme nicht geladen werden können. „Unser Plan ist, diese wichtige Batterieoptimierung in für die Kunden idealere Zeiten zu verlegen und zu verkürzen. Auch um dieses Thema kümmern wir uns zurzeit mit Hochdruck“, sagt Aurelie Alemany, CEO von Senec.
Viele Senec-Kunden wandten sich wegen der aktuellen Leistungsdrosselung beim Be- und Entladen der Heimspeicher auch direkt an pv magazine. Exemplarisch ein Szenario, was uns erreichte. Der Heimspeicher sei vor der Fernabschaltung in etwa fünf Stunden voll beladen gewesen, aktuell brauche es dafür acht bis neun Stunden, schreibt der Betreiber. Das Entladen wiederum sei nach dem Wiederanfahren der Speicher so schlecht, dass kaum noch Energie aus dem voll geladenen Batteriespeicher komme.
Konkret gibt der Betreiber an: „Ich habe einen 5 Kilowattstunden Akku. Dieser soll mit einer Leistung von bis zu 1.250 Watt laden und 2.500 Watt entladen. Bis März 2022 wurde der Akku von 0 bis 90 Prozent mit 1.250 Watt geladen, danach nahm die Ladeleistung bis zum Erreichen der 100 Prozent ab. Beim Entladen standen von 100 bis 10 Prozent die volle Entladeleistung an. Unterhalb von 10 Prozent lässt sich die Leistung nicht mehr genau beschreiben.“ Dann kam die Versetzung des Systems in Stand-by. „Seit letzter Woche lädt der Akku bis circa 55 Prozent mit den angegeben 1.250 Watt; von 55 bis 65 Prozent mit circa 650 Watt und zwischen 65 und 90 Prozent mit 450 Watt. Die letzten 10 Prozent werden mit abnehmende Ladekurve geladen. Entladen kann man bis circa 70 Prozent nur mit 900 Watt; von 70 bis 50 Prozent mit circa 1.300 Watt und unterhalb von 50 Prozent wieder mit den angegeben 2.500 Watt“, beschreibt der Senec-Kunde den aktuellen Zustand seines im kühlen Keller stehenden Systems. Die Gefahr einer Überhitzung der Batteriezellen, mit dem die gedrosselte Leistung der Speichersysteme begründet wird, sieht er nicht.
Johannes Weniger, Forscher an der HTW Berlin und Mitautor der alljährlichen Stromspeicher-Inspektion, hat sich bereits in der Vergangenheit mit dem Thema „Verluste durch limitierte Batteriewechselrichterleistung“ befasst. Nach seiner Einschätzung waren die Lade- und Entladeleistung der Senec-Systeme laut Datenblättern schon vor der Fernabschaltung sehr gering. „Bei Standardhaushalten ohne elektrische Großverbraucher gehen bei maximalen Batterieleistungen von unter 1 Kilowatt gegenüber dem Optimum mindestens 10 Prozent verloren. Der Batteriespeicher gibt also mindestens 10 Prozent weniger Energie ab, als dies im unlimitierten Betrieb der Fall wäre“, sagt Weniger.
Wenn der Speicher größer sei und üblicherweise im Sommerhalbjahr nachts nicht komplett entladen werde, seien die Verluste auch noch höher. „Der Energiedurchsatz durch den Batteriespeicher wird bei einer maximalen Ladeleistung und Entladeleistung von unter einem Kilowatt also stark beeinträchtigt“, erklärt der HTW-Berlin-Forscher.
Den aktuellen Ärger der Senec-Kunden kann auch Rechtsanwalt Andreas Kleefisch nachvollziehen. Es sei ja für viele Käufer schon ein Ärgernis, wenn sie nach dem Kauf eines 10-Kilowattstunden-Speichers im Datenblatt feststellen müssen, dass sie in Wahrheit nur vier bis fünf Kilowatt „netto“ haben. Nun mit der offenbar gedrosselten Leistung stehe den Kunden nicht mal mehr das zur Verfügung. Kleefisch bringt es mit einem Vergleich auf den Punkt: „Stellen Sie sich vor, sie kaufen sich einen Sportwagen. Und dann sagt der Hersteller, bitte fahren Sie nur maximal 30 Kilometer pro Stunde! Dann müssen Sie nicht so viel bremsen und die Bremsbeläge halten einfach länger und sie können das Auto länger nutzen.“
Der Rechtsanwalt von der Kanzlei Baumeister Rechtsanwälte Partnerschaft sieht zwei Optionen für die Kunden von Senec. „Die Kunden können gegenüber ihrem direkten Vertragspartner einen Mangel wegen Abweichung von der Beschaffenheitsvereinbarung geltend machen“, sagt er. Dabei verweist Kleefisch auf die üblicherweise bestehenden fünf Jahre Gewährleistung, in denen sich die meisten der betroffenen Kunden befänden. Bis zum Ablauf dieses Zeitraums kann der Betreiber gegen den Lieferanten, also in der Regel einen Senec-Fachpartner, wegen der Mängel Ansprüche stellen. Die Verkäufer der Speicher sollten dann gegebenenfalls gemeinsam gegen Senec vorgehen, um die Situation für die Kunden zu verbessern, so ein Rat von Kleefisch.
Einige Senec-Speicherbetreiber scheinen diesen Weg bereits gegangen zu sein. Dies bestätigt Mathias Hammer, seines Zeichens Gründer von Senec und mittlerweile Generalbevollmächtigter von Energiekonzepte Deutschland (EKD). Der Installationsbetrieb verbaut bei seinen Kunden vornehmlich Senec-Speicher zu den Photovoltaik-Anlagen und dies habe sich auch nach den Zwischenfällen im März nicht geändert. „Ich weiß aus sicherer Quelle, dass Senec in Kürze das Hauptladefenster wieder hochsetzen wird und die nach Datenblatt zugesagten Lade- und Entladeleistungen bei den Speichern wieder erreicht werden“, bestätigt auch er die Angaben des Leipziger Unternehmens. Nach seinen Erfahrungen sei die überwiegende Mehrheit der Kunden mit dem aktuellen Vorgehen von Senec einverstanden. Ihnen sei die Sicherheit momentan wichtiger als die schnelle Rückkehr der Systeme zum Normalbetrieb, so Hammer weiter.
Neben der individuellen Klage wegen der Beschaffenheitsvereinbarung hält Rechtsanwalt Andreas Kleefisch als zweite Option eine Musterfeststellungsklage gegen Senec für den besseren Weg, wenn das alte Leistungsniveau bei den Speichersystemen nicht wieder erreicht werde. Sören Demandt von der Verbraucherzentrale NRW bestätigt pv magazine, es gebe diesbezüglich interne Abstimmungen, ob man diesen Weg gehe. Final entschieden sei es aktuell noch nicht.
Wenngleich die meisten, so sind doch noch nicht alle Speichersysteme komplett wieder in Betrieb. Von den Speichern in Stand-by gehe keine Gefahr für die Betreiber aus, beruhigt Alemany. Dass die Speicher noch in Fernabschaltung sind, heiße auch nicht, dass diese zwingend defekt sind. Hier braucht Senec einfach noch mehr Zeit für die Prüfungen. Zudem habe der Hersteller vereinzelte Speicher identifiziert, bei denen ein Modultausch erforderlich sein wird.  Mit diesem Austausch hat Senec nach eigenen Angaben bereits begonnen. Dieser Vorgang könne jedoch etwas andauern.
Dieser Inhalt ist urheberrechtlich geschützt und darf nicht kopiert werden. Wenn Sie mit uns kooperieren und Inhalte von uns teilweise nutzen wollen, nehmen Sie bitte Kontakt auf: redaktion@pv-magazine.com."
https://www.pv-magazine.de/2022/05/25/wacker-will-seine-siliziummetall-produktion-in-norwegen-ausbauen/,"HIGHLIGHTS DER WOCHE,MÄRKTE,DEUTSCHLAND,NORWEGEN",RALPH DIERMANN,25. MAI 2022,Wacker will seine Siliziummetall-Produktion in Norwegen ausbauen,"Wacker Chemie bereitet den Ausbau seiner Produktionskapazität für Siliziummetall am Standort im norwegischen Holla nahe Trondheim vor. Dazu hat das Unternehmen jetzt eine Machbarkeitsstudie begonnen. Konkret plant Wacker den Bau eines neuen Schmelzofens, der die Kapazität in Holla gegenüber dem jetzigen Stand um etwa 50 Prozent erhöhen wird. In diesem Zuge untersucht Wacker zudem, die Infrastruktur in Holla so auszulegen, dass sie für mögliche weitere Ausbaumaßnahmen bereits vorbereitet ist. Hierzu finden auch Gespräche mit den lokalen Behörden zum angepassten Bebauungsplan und mit Energieversorgern statt.
Die behördliche Genehmigung vorausgesetzt, könnte die Entscheidung zum Bau des neuen Schmelzofens gegen Ende des Jahres gefällt werden, so Wacker. Die neue Anlage würde dann planmäßig 2025 fertiggestellt werden.
Siliziummetall ist einer der wichtigsten Rohstoffe für Wacker. Der Konzern benötigt es unter anderem für die Herstellung von hochreinem Polysilizium. Gegenwärtig deckt das in Holla hergestellte Siliziummetall etwa ein Drittel des Bedarfs der deutschen Standorte von Wacker.
„Die geplanten Ausbaumaßnahmen in Holla sind eine wichtige Voraussetzung, um unser Wachstum wie geplant zu beschleunigen“, erläutert Vorstandsvorsitzender Christian Hartel. Der Ausbau der Eigenproduktion von Siliziummetall mache Wacker unabhängiger von Preisschwankungen an den Rohstoffmärkten und steigere die Versorgungssicherheit, sowohl in Zeiten hoher Nachfrage als auch bei Problemen im Zusammenhang mit Einschränkungen in den globalen Lieferketten.
Wacker will Treibhausgasemissionen bis 2030 halbieren
Für Wacker sind der Kapazitätsausbau sowie die Erweiterung und Modernisierung der Infrastruktur zudem wichtige Hebel dafür, die eigenen Treibhausgasemissionen wie geplant bis 2030 zu halbieren. Der Standort Holla spiele hierbei eine Schlüsselrolle. „Die Herstellung von Siliziummetall ist sehr energieintensiv“, erklärt Robert Gnann, Leiter des Geschäftsbereichs Wacker Silicones. „Um die Treibhausgasemissionen in einer solchen Produktion massiv zu senken, müssen die Anlagen dem neuesten Stand der Technik entsprechen. Genau darauf zielen wir mit dem Kapazitätsausbau ebenso wie mit den geplanten Infrastrukturmaßnahmen in Holla ab.“
Weitere Ansatzpunkte zur Senkung der Emissionen sind die Elektrifizierung von Produktionsprozessen und der Einsatz von Strom aus erneuerbaren Quellen. Erst kürzlich hatten Wacker und der norwegische Stromerzeuger Statkraft einen Liefervertrag über grünen Strom aus Wasserkraft abgeschlossen. Statkraft wird im Zeitraum von Januar 2022 bis Dezember 2027 insgesamt 2,35 Terawattstunden zertifizierten Grünstrom aus Wasserkraft für Holla liefern. Das entspricht rund 40 Prozent des Jahresbedarfs am Standort.
Gleichzeitig arbeitet Wacker eigenen Angaben zufolge daran, die bislang bei der Herstellung von Siliziummetall als Reduktionsmittel eingesetzte Steinkohle durch nachwachsende Materialien wie beispielsweise Holzkohle oder Pellets zu ersetzen. Ziel ist es, in Holla auf diese Weise bis zu 430.000 Tonnen CO2 pro Jahr einzusparen.
Außerdem untersucht das Unternehmen Möglichkeiten, in der Produktion entstehendes CO2 zu speichern und so der Atmosphäre zu entziehen oder es als Rohstoff für chemische Produkte zu verwenden. Einen entsprechenden Anlagenkomplex, mit dem aus grünem Wasserstoff und CO2 aus bestehenden Produktionsprozessen erneuerbares Methanol hergestellt werden soll, plant WACKER an seinem Standort Burghausen unter der Bezeichnung RHYME Bavaria.
Dieser Inhalt ist urheberrechtlich geschützt und darf nicht kopiert werden. Wenn Sie mit uns kooperieren und Inhalte von uns teilweise nutzen wollen, nehmen Sie bitte Kontakt auf: redaktion@pv-magazine.com."
https://www.pv-magazine.de/2022/05/25/batteriezellen-hersteller-freyr-schliesst-wasserkraft-liefervertrag-mit-statkraft/,"MÄRKTE,NORWEGEN",RALPH DIERMANN,25. MAI 2022,Batteriezellen-Hersteller Freyr schließt Wasserkraft-Liefervertrag mit Statkraft,"Der norwegische Batteriezellen-Hersteller Freyr baut derzeit in Mo i Rana nahe des Polarkreis im Norden des Landes einen großen Produktionsstandort. Per verbindlicher Absichtserklärung hat Freyr nun mit Statkraft vereinbart, dass der Energiekonzern den gesamten Strombedarf des Werks zwischen 2024 und 2031 decken wird. In diesem Zuge hat sich Statkraft verpflichtet, bis zu 23 Megawatt Grundlast sowie eine kumulierte Strommenge von 1,4 Terawattstunden über die Vertragslaufzeit an Freyr zu liefern.
Zudem wird Statkraft Herkunftsnachweise zu erbringen, die dokumentieren, dass der Strom aus Wasserkraftwerken des Unternehmens in der Region stammt. So erzeugt Statkraft die zu liefernde Energie in seinem Wasserkraftwerk Rana, das in Nähe der geplanten Produktionsanlagen liegt. Die Anlage hat eine Leistung von 500 Megawatt und liefert jährlich 1,25 Terawattstunden Strom.
Freyr verfolgt die Strategie, seine Werke dort anzusiedeln, wo eine ausreichende Versorgung mit lokal erzeugter sauberer Energie gewährleistet ist. Das Unternehmen prüft derzeit, im finnischen Vaasa und in den USA weitere große Fabriken für die Zellproduktion aufzubauen. Bis 2025 will Freyr bis Batteriezellen mit einer Kapazität von bis zu 43 Gigawattstunden fertigen, bis 2028 mit bis zu 83 Gigawattstunden.
„Unser Ziel ist es, saubere Batteriezellen zu produzieren – und ein Schlüsselelement unserer Strategie ist es, unseren Betrieb mit erneuerbarer Energie zu versorgen“, sagt Tove Nilsen Ljungquist, EVP Operations von Freyr.
Dieser Inhalt ist urheberrechtlich geschützt und darf nicht kopiert werden. Wenn Sie mit uns kooperieren und Inhalte von uns teilweise nutzen wollen, nehmen Sie bitte Kontakt auf: redaktion@pv-magazine.com."
https://www.pv-magazine.de/2022/05/25/bundesregierung-beschliesst-gesetzesentwurf-fuer-aufteilung-der-co2-kosten-zwischen-vermietern-und-mietern/,"HIGHLIGHTS DER WOCHE,POLITIK,DEUTSCHLAND",RALPH DIERMANN,25. MAI 2022,Bundesregierung beschließt Gesetzesentwurf für Aufteilung der CO2-Kosten zwischen Vermietern und Mietern,"Den CO2-Aufschlag auf fossile Brennstoffe zahlen bislang allein die Mieter. In den Augen vieler Menschen ist das nicht gerecht, weil Mieter keinen Einfluss auf die energetische Qualität des Gebäudes haben, in denen sie leben. Dazu kommt, dass die CO2-Bepreisung bei vermieteten Immobilien nur bedingt zum Klimaschutz beiträgt, da sie den Eigentümern keinen Anreiz für eine energetische Sanierung gibt.
Das Bundeskabinett hat daher jetzt einen Gesetzesentwurf verabschiedet, der mehr Klimaschutz im Wärmesektor bringen und zugleich mehr Gerechtigkeit bei der Kostenaufteilung schaffen soll. Das Gesetz soll am 1. Januar 2023 in Kraft treten und für alle Abrechnungszeiträume gelten, die an diesem Tag beginnen.
Wohngebäude: Verteilung der Kosten je nach energetischer Qualität
Bei Wohngebäuden sieht der Entwurf ein Stufenmodell vor, bei dem anhand der CO2-Emissionen des vermieteten Gebäudes die Kosten künftig anteilig zwischen Mietern und Vermietern umgelegt werden. Je schlechter die energetische Qualität des jeweiligen Gebäudes, desto höher ist der zu tragende Kostenanteil für die Vermieter. Insgesamt zehn Stufen sieht das Modell vor, die durch die CO2-Emissionen pro Quadratmeter Wohnfläche und Jahr definiert werden. So müssen die Vermieter bei Gebäuden der schlechtesten Klasse 90 Prozent tragen, die Mieter zehn Prozent. Wenn das Gebäude jedoch mindestens dem Effizienzstandard EH 55 entspricht, bleiben die Kosten allein beim Mieter.
„Wir haben mit der Aufteilung der CO2-Kosten eine Lösung gefunden, die sozial gerecht ist und künftig die Mieter auch entlastet“, sagt Bundeswirtschaftsminister Robert Habeck (Grüne). Je schlechter ein Gebäude gedämmt ist, je älter zum Beispiel die Heizung oder die Fenster sind, umso höher sind die CO2-Kosten für Vermieter und umso größer die Entlastung für Mieter, so Habeck. Denn in diesen Fällen leide der Mieter häufig unter hohen Energiekosten wegen schlechter Dämmung und Heizung, ohne aber selbst gut gegensteuern zu können. Umgekehrt könne ein Vermieter, der das Gebäude gut energetisch saniert hat, die Kosten auch umlegen. „Denn dann sind beispielsweise Dach und Fenster gut gedämmt, so dass vor allem die Mieter durch ihr Verhalten noch dazu beitragen können, Energie einzusparen und so die Heizkosten zu reduzieren.“
Grafik: BMWK
Das Modell basiert auf Daten, die im Rahmen der Heizkostenabrechnung bereits rechtssicher erhoben werden. Die Mietparteien teilen die CO2-Kosten im Rahmen der Heizkostenabrechnung selbst untereinander auf. Die Vermieter erhalten nach Angaben des Bundeswirtschaftsministeriums mit der Brennstoffrechnung alle erforderlichen Daten, um die CO2-Kosten ohne Mühe verteilen zu können. Behörden oder private Dritte müssten nicht hinzugezogen werden.
Nichtwohngebäude: Zunächst hälftige Aufteilung
Bei Gewerbe- und anderen Nichtwohngebäuden teilen sich Vermieter und Mieter die CO2-Kosten übergangsweise hälftig. Bis Ende 2025 will die Bundesregierung für diese Immobilien aber ebenfalls ein Stufenmodell entwickeln. Aufgrund der Heterogenität von Nichtwohngebäuden fehlten derzeit noch die nötigen Datengrundlagen, um eine valide Berechnung der Abstufungen für Nichtwohngebäude vornehmen zu können. Die Daten sollen bis zum Ende des Jahres 2024 erhoben werden.
Viele Ausnahmeregeln
Das Gesetz sieht Ausnahmen von der vorgesehenen Aufteilung der Kosten dort vor, wo der Kohlendioxidpreis seine Anreizwirkung nicht entfalten kann. So können die Vermieter etwa bei denkmalgeschützten Gebäuden oder in Milieuschutzgebieten unter Umständen nur einen eingeschränkten Beitrag zur energetischen Sanierung leisten. In diesen Fällen werden sie teilweise oder vollständig von ihrem Anteil befreit.
Auch müssen die Vermieter nicht für die CO2-Kosten zahlen, die durch Gasherde der Mieter entstehen. Dieser Aufwand wird in Form eines pauschalen Abzugs von fünf Prozent des CO2-Kostenanteils des Vermieters kompensiert.
Zugleich werden Mieter entlastet, wenn ein Vermieter den Betrieb einer Gastherme auf einen klimaneutralen, aber teureren Ersatzbrennstoff umstellt. In diesem Fall ist die Umlage der Brennstoffkosten auf den Mieter auf den Grundversorgungstarif für Erdgas begrenzt. Wird auf ein Brennstoffgemisch aus Erdgas und Biogas umgestellt, kann der Vermieter aber weiterhin die darauf anfallenden CO2-Kosten verteilen.
Dieser Inhalt ist urheberrechtlich geschützt und darf nicht kopiert werden. Wenn Sie mit uns kooperieren und Inhalte von uns teilweise nutzen wollen, nehmen Sie bitte Kontakt auf: redaktion@pv-magazine.com."
https://www.pv-magazine.de/2022/05/25/photovoltaic-austria-meldet-volle-auslastung-der-oesterreichischen-solarbranche/,"MÄRKTE,ÖSTERREICH",RALPH DIERMANN,25. MAI 2022,Photovoltaic Austria meldet volle Auslastung der österreichischen Solarbranche,"Eine Umfrage des Bundesverbandes Photovoltaik Austria (PV Austria) unter seinen mehr als 300 Mitgliedsunternehmen zeigt, dass die österreichische Solarbranche 2021 durchwegs sehr stark ausgelastet war. Angesichts des russischen Einmarschs in die Ukraine und aktueller energiepolitischer Entwicklung hat die Nachfrage im laufenden Jahr noch einmal angezogen, so der Verband.
Der Preisverfall bei Modulen und Komponenten ist nach Einschätzung von PV Austria nun endgültig vorbei. „Wir gehen davon aus, dass nach den aktuellen Preissteigerungen aufgrund der hohen weltweiten Nachfrage, den fehlenden Bestandteilen und den reduzierten Produktionskapazitäten sowie Logistik-Ausfällen langfristig der Preis auf einem höherem Niveau als zuletzt bleiben wird“, erklärt Vera Immitzer, Geschäftsführerin des PV Austria.
Insgesamt 76 Prozent der teilnehmenden Unternehmen nennen die Preissteigerungen als wesentliche Herausforderung im Tagesgeschäft. Lieferengpässe führen 67 Prozent an, Hindernisse beim Netzzugang 62 Prozent. „Diese Hürde für den Photovoltaik-Ausbau ist rein hausgemacht. Als Verband kritisieren wir die Unzulänglichkeiten rund um das Thema Stromnetz bereits seit Jahren, jetzt werden sie immer eklatanter und zum größten Hindernis der Energiewende mit Solarstrom“, sagt Immitzer. Unter Fachkräftemangel leiden dagegen vergleichsweise wenig Unternehmen.
Grafik: PV Austria
Dieser Inhalt ist urheberrechtlich geschützt und darf nicht kopiert werden. Wenn Sie mit uns kooperieren und Inhalte von uns teilweise nutzen wollen, nehmen Sie bitte Kontakt auf: redaktion@pv-magazine.com."
https://www.pv-magazine.de/2022/05/25/europa-braucht-fuer-15-grad-ziel-400-gigawatt-erneuerbare-zubau-pro-jahr/,"POLITIK,DÄNEMARK,DEUTSCHLAND,EUROPA,GLOBAL",MAX HALL,25. MAI 2022,"Europa braucht für 1,5-Grad-Ziel 400 Gigawatt Erneuerbare-Zubau pro Jahr","Ohne CO2-Abscheidung aus der Luft wird es nicht möglich sein, in Europa bis Mitte des Jahrhunderts Treibhausgasneutralität zu erreichen. Zu diesem Ergebnis kommen Forscher der Universität im dänischen Aarhus, mit Unterstützung von Kollegen der TU Berlin. Zugleich weisen sie darauf hin, dass der Kontinent zwischen 2025 und 2035 jährlich 400 Gigawatt an zusätzlicher Solar- und Windenergieleistung benötigt.
Die Wissenschaftler haben den Weg des europäischen Energiesystems zu einer Netto-Null-Energieversorgung und zur Begrenzung des globalen Temperaturanstiegs in diesem Jahrhundert auf 1,5 Grad modelliert. Die Ergebnisse wurden letzte Woche in der Zeitschrift Joule veröffentlicht.
Der Studie zufolge muss das Stromnetz ausgebaut werden, um die Flut der intermittierend erzeugenden erneuerbaren Energien aufnehmen zu können. Power-to-X-Technologien, einschließlich der Erzeugung von grünem Wasserstoff, werden auch benötigt, um schwer dekarbonisierende Industrien, die Luftfahrt, die Schifffahrt und den Güterverkehr mit Strom zu versorgen. Grüner Wasserstoff ist unverzichtbar, um die fluktuierenden Erträge von Solar- und Windparks auszugleichen.
Nach Angaben der Wissenschaftler liegt der bisherige europäische Rekord für den jährlichen Zubau von Photovoltaik und Windenergie-Leistung bei 50 Gigawatt. Den Forschern zufolge würde eine Anhebung des maximalen Temperaturanstiegs in diesem Jahrhundert auf zwei Grad weniger Zubau erfordern, wäre aber teurer, wenn man die Auswirkungen des verschärften Klimawandels mit einbezieht.
Die Modellierung wurde mit dem Prime-Computing-Cluster der Universität Aarhus durchgeführt.
Dieser Inhalt ist urheberrechtlich geschützt und darf nicht kopiert werden. Wenn Sie mit uns kooperieren und Inhalte von uns teilweise nutzen wollen, nehmen Sie bitte Kontakt auf: redaktion@pv-magazine.com."
https://www.pv-magazine.de/2022/05/25/octopus-energy-schliesst-partnerschaft-mit-projektierer-von-105-gigawatt-erneuerbaren-vorhaben-in-marokko/,"INSTALLATION,GROSSBRITANNIEN",RALPH DIERMANN,25. MAI 2022,"Octopus Energy schließt Partnerschaft mit Projektierer von 10,5-Gigawatt-Erneuerbaren-Vorhaben in Marokko","Das britisch-marokkanische Unternehmen Xlinks will in der marokkanischen Wüste auf 1.500 Quadratkilometern Fläche Solar- und Windenergieanlagen mit einer Gesamtleistung von 10,5 Gigawatt sowie Batteriespeichern mit 20 Gigawattstunden Kapazität installieren. Über eine 3.800 Kilometer lange unterseeische HGÜ-Leitung soll der Strom nach Großbritannien transportiert werden. Mithilfe des Speichers will Xlinks für mindestens 20 Stunden am Tag konstant 3,6 Gigawatt Leistung bereitstellen. Das soll genügen, um mehr als sieben Millionen britische Haushalte zu versorgen.
Das Projekt befindet sich derzeit in der Entwicklungsphase und soll im Jahr 2027 in Betrieb genommen werden. Nach der Inbetriebnahme soll Xlinks Strom zu einem Preis von 48 Pfund pro Megawattstunde (56 Euro) liefern, also auf einem Preisniveau vergleichbar mit Offshore-Windkraftanlagen.
Der britische, auch in Deutschland präsente Versorger Octopus Energy hat nun eine strategische Partnerschaft mit Xlinks geschlossen. In diesem Rahmen prüfen die Partner Abnahmevereinbarungen sowie den Einsatz von Octopus‘ firmeneigener Technologieplattform KrakenFlex.
„Die Umstellung auf grüne Energie wird die Energiekosten für Großbritannien senken“, sagt Greg Jackson, Gründer und CEO der Octopus Energy Group. „Dass wir aus fossilen Energien aussteigen müssen, wenn wir den Klimawandel bekämpfen wollen, ist schon lange klar. Aber jetzt ist deutlich geworden, dass wir dies auch tun müssen, um Energie billiger und sicherer zu machen.“
Dieser Inhalt ist urheberrechtlich geschützt und darf nicht kopiert werden. Wenn Sie mit uns kooperieren und Inhalte von uns teilweise nutzen wollen, nehmen Sie bitte Kontakt auf: redaktion@pv-magazine.com."
