url,tag,author,updated_date,title,contents
https://www.pv-magazine.fr/2021/03/15/edf-choisit-inddigo-pour-la-maitrise-doeuvre-de-ses-futures-centrales-solaires-de-beaurepaire-et-saumur/,"PV AU SOL,FRANCE",GWÉNAËLLE DEBOUTTE,"MARS 15, 2021",EDF choisit Inddigo pour la maîtrise d’oeuvre de ses futures centrales solaires de Beaurepaire et Saumur,"Le cabinet de conseil et d’ingénierie Inddigo a annoncé avoir été choisi par EDF Renouvelables pour réaliser la maîtrise d’œuvre de deux installations photovoltaïques au sol en Pays de la Loire :
Inddigo a précisé qu’il réalisera les études et lancera une consultation des entreprises en avril pour un démarrage des travaux fin août et une mise en service des centrales au printemps 2022. Toutes deux feront également l’objet d’une campagne de financement participatif.
Ce contenu est protégé par un copyright et vous ne pouvez pas le réutiliser sans permission. Si vous souhaitez collaborer avec nous et réutiliser notre contenu, merci de contacter notre équipe éditoriale à l’adresse suivante: editors@pv-magazine.com."
https://www.pv-magazine.fr/2021/03/15/un-nouveau-nanomateriau-pour-remplacer-le-graphite-dans-les-batteries-lithium-ion/,"STOCKAGE D'ÉNERGIE,ASIE,CORÉE DU SUD,EUROPE DE L'EST,MONDE,RUSSIE",EMILIANO BELLINI,"MARS 15, 2021",Un nouveau nanomatériau pour remplacer le graphite dans les batteries lithium-ion,"Un groupe international de chercheurs a remplacé le graphite par un nouveau matériau – élaboré avec des microsphères nanostructurées composées de cuivre, de fer et d’oxyde de fer de formule Cu0,4Zn0,6Fe2O4 – pour l’anode négative des batteries lithium-ion destinées aux appareils ménagers, aux smartphones et aux véhicules électriques.
Les microsphères ont été synthétisées avec une méthode de pyrolyse par pulvérisation : une technique utilisée pour la décomposition thermique de matières organiques en l’absence d’oxygène. Ce procédé est connu pour offrir une excellente capacité de vitesse et une grande stabilité de cycle. Il est utilisé dans l’industrie chimique pour produire de l’éthylène et du carbone – à partir du pétrole, du charbon et du bois – ainsi que pour créer du coke à partir du charbon.
Une solution aqueuse contenant des ions a été transformée par une technique à ultrasons. L’eau a été évaporée à 1 200 degrés Celsius, ce qui a décomposé les sels métalliques d’origine. Le procédé a permis de former des sphères de l’ordre du micron ou du submicron avec les niveaux de porosité requis pour le stockage des ions lithium.
Le nouveau matériau anodique offrirait une capacité trois fois supérieure à celle des batteries actuellement disponibles dans le commerce et multiplierait par cinq le nombre de cycles de charge-décharge par rapport à d’autres alternatives prometteuses au graphite. « Cette amélioration est obtenue grâce à un effet synergique résultant d’une nanostructure spéciale combinée à la composition des éléments utilisés », explique le chercheur Evgeny Kolesnikov.
« L’effet synergique entre les différents cations, ainsi que la nanodimension couplée à un intérieur creux et à une porosité de surface des matériaux d’électrode, facilitent non seulement la cinétique de transport des ions li et des électrons, mais permettent également une grande expansion du volume », précise l’équipe de recherche. Aucune information n’a été fournie sur le coût du nouveau matériau et le processus de fabrication.
Le nouveau matériau a été présenté dans l’étude Hollow-structured Cu0.4Zn0.6Fe2O4 as a novel negative electrode material for high-performance lithium-ion batteries, publiée dans le Journal of Alloys and Compounds. Les membres de l’équipe de recherche viennent de l’Université nationale de science et de technologie de Russie (NUST), de l’Université nationale de science et de technologie de Séoul en Corée, de l’Institut de science et de technologie SRM en Inde et de l’Université de science et de technologie de Norvège (NTNU).
Ce contenu est protégé par un copyright et vous ne pouvez pas le réutiliser sans permission. Si vous souhaitez collaborer avec nous et réutiliser notre contenu, merci de contacter notre équipe éditoriale à l’adresse suivante: editors@pv-magazine.com."
https://www.pv-magazine.fr/2021/03/15/linstallateur-malouin-emeraude-solaire-entre-au-capital-de-la-start-up-dropn-plug/,"FINANCE,INSTALLATIONS,MARCHÉS,MARCHÉS ET STRATÉGIES,OMBRIÈRES DE PARKING,PV À GRANDE ÉCHELLE,PV COMMERCIAL ET INDUSTRIEL,VÉHICULE ÉLECTRIQUE,BRETAGNE PAYS-DE-LOIRE,FRANCE",JOËL SPAES,"MARS 15, 2021",L’installateur malouin Emeraude Solaire entre au capital de la start-up Drop’n Plug,"Née de plusieurs années de travaux de R&D, Drop’n Plug – littéralement, “déposez et branchez” – a été créée en février 2020 par Claude Le Brize. Implantée à Rennes, la start-up conçoit les systèmes des bornes de recharge intelligentes pour véhicules électriques, explique un communiqué d’Emeraude Solaire ce jour. Le système permet de piloter et d’optimiser la recharge de véhicules électriques. Les évolutions sont tournées vers la facilité d’accès à la recharge et aux moyens d’identification des usagers et de leurs véhicules : le « plug & charge ». Côté gestionnaire de parc de bornes (parkings, co-propriétés, …) le système est un outil efficace de supervision, qui facilite la gestion au quotidien des bornes (énergie consommée, identification des usagers, système de facturation du service, …). La plateforme web est agencée en fonction des besoins des clients, précise le communiqué.
Une quarantaine de bornes de recharge de véhicules électriques intelligentes ont déjà été déployées à Saint-Malo, Rennes, Nantes, Cholet, Saint-Brieuc, Lisieux, Langouet, Aix-en-Provence…
Drop’n Plug est également un projet homologué Smile – Smart Ideas to Link Energies, projet piloté par les régions Bretagne et Pays-de-la-Loire pour faire de l’Ouest de la France le territoire national de référence en réseaux électriques intelligents – soulignant les travaux innovants destinés à permettre la mobilité décarbonée.
« Le développement des infrastructures de recharge est primordiale, notamment pour rassurer les possesseurs et futurs acquéreurs de véhicules électriques et favoriser le déploiement du parc de véhicules électriques » souligne Claude Le Brize, responsable de Drop’n Plug dans le communiqué d’Emeraude Solaire.
Pour Xavier Borel, dirigeant d’Émeraude Solaire « Nous sommes heureux de pouvoir accompagner Drop’n Plug dans son développement. Notre souhait est de coupler nos savoir-faire, en associant notre expertise en centrales photovoltaïques et les bornes solaires de recharge de Drop’n Plug. Ensemble, nous pourrons répondre aux enjeux environnementaux, forts sur le secteur du transport et de la mobilité verte. »
Une association qui fait sens également pour Claude Le Brize « l’entrée au capital d’Émeraude Solaire nous ouvre de nouvelles perspectives de croissance, grâce à leur expertise et à leur réseau notamment. La mobilité décarbonée est un enjeu majeur de la transition énergétique. Il est aujourd’hui capital de s’inscrire dans cette démarche vertueuse de mobilité à partir d’énergies renouvelables. »
Depuis sa reprise en mai 2020 par son dirigeant Xavier Borel, Émeraude Solaire poursuit sa croissance avec son déploiement sur de nombreux marchés. Émeraude Solaire vient de terminer l’installation 300kWc en autoconsommation sur le siège du Crédit Agricole à Vannes, dans le Morbihan, et le projet du parking de l’hôpital de Pontivy (850 kWc d’ombrières photovoltaïques en autoconsommation) remporté en 2020 va notamment venir compléter les nombreux chantiers de la société malouine en 2021. La société conçoit, réalise et exploite des centrales photovoltaïques. Producteur indépendant, l’entreprise a réalisé sur l’année 2020 plus de 200 centrales solaires, sur le Grand Ouest : de la pointe Finistère à la Seine-Maritime, jusqu’en Vendée et la Vienne. Depuis sa création, Émeraude Solaire a mis en service plus de 80 MWc de puissance installée, pour plus de 1 200 projets.
Ce contenu est protégé par un copyright et vous ne pouvez pas le réutiliser sans permission. Si vous souhaitez collaborer avec nous et réutiliser notre contenu, merci de contacter notre équipe éditoriale à l’adresse suivante: editors@pv-magazine.com."
https://www.pv-magazine.fr/2021/03/15/les-etats-unis-appellent-a-ne-plus-sapprovisionner-en-silicium-polycristallin-de-la-region-du-xinjiang/,"OPINION ET ANALYSE,ÉTATS-UNIS",,"MARS 15, 2021",Les Etats-Unis appellent à ne plus s’approvisionner en silicium polycristallin de la région du Xinjiang,"D’après pv magazine USA
L’Association américaine de l’industrie de l’énergie solaire (Solar Energy Industries Association,  SEIA) a lancé en décembre 2020 une campagne contre le travail forcé et a annoncé le développement d’un protocole de traçabilité sur la chaîne d’approvisionnement des matières premières utilisées pour produire des modules solaires. Elle a ainsi déclaré qu’elle « encourageait fortement » ses adhérents à se détourner des produits originaires de la région du Xinjiang en Chine. Dans une interview accordée à pv magazine USA, la présidente et PDG de SEIA, Abigail Ross Hopper, a annoncé que les entreprises avaient pour objectif de réajuster leurs chaînes d’approvisionnement d’ici à juin.
La production mondiale de plaquettes solaires est presque entièrement entre les mains des Chinois, mais la plupart du temps n’est pas située au Xinjiang (à l’exception notable d’un grand fabricant verticalement intégré). L’une des hypothèses est donc que les fabricants de wafers, qui se fournissent généralement en polysilicium de différents fournisseurs, excluront les matières premières du Xinjiang afin de proposer des wafers « sans Xinjiang ». Ceux-ci pourront ensuite être utilisés pour les cellules solaires et les modules destinés à l’exportation vers les États-Unis. Les clients européens pourraient également exiger également des produits qui n’ont pas été extraits par des travailleurs forcés. Les prestataires de services, tels que Clean Energy Associates, effectueront des audits de la chaîne d’approvisionnement qui garantiront les preuves nécessaires à la douane.
pv magazine USA
En termes de volumes, cette évolution de la production de plaquettes pourrait ne pas poser de défi majeur : les installations photovoltaïques aux États-Unis et en Europe représentaient ensemble environ 30 % du marché mondial en 2020.
En revanche, environ 45 % de la production mondiale de silicium polycristallin de qualité solaire provenait en 2020 des quatre fabricants du Xinjiang : Daqo, Xinte, Xinjiang GCL et East Hope. Il reste donc 55 % de silicium produit hors du Xinjiang (35 % dans d’autres régions chinoises et 20 % hors de Chine), ce qui est suffisant pour approvisionner les marchés photovoltaïques aux États-Unis et en Europe. Toutefois, si tous les développeurs de projets internationaux s’intégraient à cette démarche, la chaîne d’approvisionnement photovoltaïque pourrait connaître des frictions importantes.
Michael Parr, directeur exécutif de la Western Ultra Low-Carbon Solar Alliance, a suggéré que les capacités de production excédentaires de silicium polycristallin aux États-Unis et en Europe pourraient venir en complément, mais leur contribution reste trop faible. On compte ainsi une installation de 1 600 tonnes en Allemagne et aux Etats-Unis, deux usines de 40 000 tonnes sont en projet. C’est encore une goutte d’eau comparée à la capacité de 330 000 tonnes que les quatre acteurs du Xinjiang visent à atteindre d’ici la fin de cette année.
Les tensions s’intensifient dans le monde autour de la question du travail forcé, avec des appels croissants à la transparence de la chaîne d’approvisionnement, et un projet de loi de l’UE récemment publié sur la diligence raisonnable et la responsabilité des entreprises pour améliorer les mesures volontaires actuellement disponibles. Dans ce contexte, l’initiative UP du magazine PV passera le deuxième trimestre 2021 à examiner ce que les entreprises du solaire et du stockage d’énergie peuvent faire pour montrer l’exemple positif en ce qui concerne les travailleurs, souvent très éloignés, impliqués dans la production de leurs produits et services.
The views and opinions expressed in this article are the author’s own, and do not necessarily reflect those held by pv magazine.
Ce contenu est protégé par un copyright et vous ne pouvez pas le réutiliser sans permission. Si vous souhaitez collaborer avec nous et réutiliser notre contenu, merci de contacter notre équipe éditoriale à l’adresse suivante: editors@pv-magazine.com."
https://www.pv-magazine.fr/2021/03/15/credit-mutuel-capital-prive-acquiert-six-centrales-solaires-dans-le-nord-est-de-la-france/,"PV À GRANDE ÉCHELLE,PV AU SOL,FRANCE",GWÉNAËLLE DEBOUTTE,"MARS 15, 2021",Crédit Mutuel Capital Privé acquiert six centrales solaires dans le Nord-Est de la France,"Acteur de l’investissement en fonds propres, Crédit Mutuel Capital Privé a annoncé l’acquisition d’un portefeuille de six parcs photovoltaïques en phase de construction (projet « Greenfield »), localisés dans le Nord et l’Est de la France. Ils ont été acquis auprès du développeur français d’énergies renouvelables TSE (anciennement Third Step Energy). Pour cette opération, Crédit Mutuel Capital Privé qui a agi via fonds dédié Fonds Siloé Infrastructures s’est fait conseiller par De Gaulle Fleurance & Associés.
Représentent une capacité installée de 95 MWc, les projets se répartissent entre :
Le projet de Marville est situé sur une ancienne base aérienne de l’OTAN dont le terrain appartient à la Communauté des Communes du Pays de Montmedy. Le site d’Oxelaere est une ancienne friche SNCF appartenant aujourd’hui à un bailleur privé. Ainsi, les deux sites n’ont pas d’emprise sur des terres agricoles et les installations photovoltaïques permettent de réhabiliter les sites existants. « Une importance toute particulière a été accordée à la politique RSE et environnementale des projets. Implantés sur des terrains en phase de réhabilitation, ces derniers bénéficient de mesures emblématiques en matière d’environnement », écrit Crédit Mutuel Capital Privé. Sur le site de Marville, en plus des 800 k€ investis pour dépolluer le site, un budget de 400 k€ a été engagé pour favoriser la reconquête de la biodiversité : remise en état naturel des emprises bétonnées, création de couverts végétaux et éradication des espèces invasives. Sur le site d’Oxelaere, une compensation écologique est actuellement déployée afin de valoriser des habitats naturels pour différentes espèces d’oiseaux : deux zones humides sont prévues avec la création d’une prairie. Un suivi écologique de la faune et un entretien des milieux naturels et des espèces exotiques envahissantes, permettront de retracer l’évolution de la biodiversité locale sur une période de 30 ans.
Les deux projets sont entièrement développés et bénéficient d’un contrat Complément de Rémunération de 20 ans accordé dans le cadre d’un appel d’offre de la CRE à des tarifs compétitifs.
Les actifs sont construits par SPIE et seront exploités et maintenus par Altus Energy via des contrats opérationnels négociés sur le long-terme limitant les risques liés à la construction et l’exploitation des centrales. Les modules et panneaux photovoltaïques seront fournis par des sociétés reconnues dans le secteur et utilisant une technologie éprouvée.
La mise en service est prévue pour le premier semestre 2021 sur les sites de Marville et Oxelaere. Le portefeuille générera ainsi environ 100 GWh d’énergie verte en 2022 – soit l’équivalent de la consommation d’une ville de 23 000 habitants.
Ce contenu est protégé par un copyright et vous ne pouvez pas le réutiliser sans permission. Si vous souhaitez collaborer avec nous et réutiliser notre contenu, merci de contacter notre équipe éditoriale à l’adresse suivante: editors@pv-magazine.com."
https://www.pv-magazine.fr/2021/03/15/cve-chile-signe-avec-solarpack-lachat-de-4-centrales-solaires-au-chili-50-mwc/,"INSTALLATIONS,PV À GRANDE ÉCHELLE,PV AU SOL,AMÉRIQUE DU SUD ET CENTRALE,CHILI",JOËL SPAES,"MARS 15, 2021",CVE Chile signe avec Solarpack l’achat de 4 centrales solaires au Chili (50 MWc),"Ces quatre projets récemment acquis – trois en construction (38 MWc) et un en phase finale de développement (12 MWc) – sont des centrales solaires montées au sol d’une capacité de production de 50 MWc au total. Leur mise en service est prévue pour le deuxième ou le troisième trimestre 2021.
Situées dans les régions Bío Bío pour deux d’entre elles, de Maule et de Coquimbo pour les deux autres, ces centrales sont construites dans le cadre du programme PMGD (Pequeños Medios de Generación Distribuida) du gouvernement chilien destiné à encourager le développement de petites centrales de production d’énergie décentralisées.
 « Cette transaction, menée par CVE Chile avec le support de Guerrero Olivos, avocat-conseil dans le cadre de l’opération, accélère le développement de CVE au Chili, et renforce sa position de leader sur le marché des PMGD. CVE Chile, qui détient aujourd’hui 8% des parts de marché du segment PMGD solaire prévoit d’atteindre 15% de détention de ces parts de marché et de multiplier par quatre le parc à horizon 2025, avec une capacité de production renouvelable de 460 MWc. Cette opération renforce par ailleurs notre partenariat avec Solarpack, après une première acquisition de quatre centrales réalisée en 2018 » s’enthousiasme Pierre Boulestreau, directeur général de CVE Chile.
« Solarpack reste engagé dans le secteur PV au Chili, marché que nous considérons comme clé pour le développement de notre société. Nous sommes ravis d’avoir conclu cet accord avec CVE, en vertu duquel nous exécutons pour eux une série de projets solaires PV totalisant 50 MWc » réagit Jaime Solaun, Directeur de Solarpack Amériques et Afrique. À ce jour, Solarpack exploite neuf centrales solaires au Chili, pour une capacité installée totale de 202,2 MWc.
Ce contenu est protégé par un copyright et vous ne pouvez pas le réutiliser sans permission. Si vous souhaitez collaborer avec nous et réutiliser notre contenu, merci de contacter notre équipe éditoriale à l’adresse suivante: editors@pv-magazine.com."
