url,tag,author,updated_date,title,contents
https://www.pv-magazine.fr/2023/03/24/baywa-r-e-devoile-les-details-de-ses-deux-premiers-projets-flottants-en-france/,"PV FLOTTANT,FRANCE",GWÉNAËLLE DEBOUTTE,"MARS 24, 2023",BayWa r.e. donne des détails sur ses deux premiers projets flottants en France,"BayWa r.e. a dévoilé les détails de ses deux premiers projets flottants en France, tous deux sur d’anciennes carrières. A Dordives, dans le Loiret, les demandes d’autorisations seront déposées à l’été pour un projet d’environ 14 MWc sur un site d’extraction de granulat toujours en activité. Le producteur prévoit en effet de convertir dès 2026 en parc photovoltaïque flottant un des plans d’eau artificiels de la carrière de granulat de Nançay, anciennement exploitée par le groupe Lafarge Holcim. L’emplacement du projet, situé entre la carrière toujours en exploitation et la ligne de train Paris-Montargis, contribuera à revaloriser la zone désormais inexploitée du site d’extraction de matériaux. Environ 34 000 panneaux photovoltaïques, installés sur des supports flottants, pourraient recouvrir une superficie d’un peu plus de 7 hectares de panneaux, pour une production annuelle d’environ 15 GWh.
A Dompierre-sur-Besbre, BayWa r.e. développe le premier projet photovoltaïque flottant du département de l’Allier sur une ancienne sablière. Les demandes d’autorisation seront déposées fin 2023. A l’issue de son exploitation en 2010, la sablière a été convertie en plan d’eau artificiel de 10 hectares. Le projet prévoit l’installation de 5 à 10 MWc de panneaux photovoltaïques sur des supports flottants. Sous réserve d’obtention des autorisations, il pourrait générer de l’électricité à l’horizon 2026.
Tout comme le projet de Dordives, une partie limitée de 40 à 60 % des plans d’eau sera occupée par les panneaux solaires, qui seront installés à plus de 20 mètres des berges, afin de maintenir les activités en toute sécurité et préserver la faune et la flore. Les transformateurs électriques seront également installés sur l’eau, limitant l’impact sur les berges. Enfin, les flotteurs seront reliés entre eux et ancrés au fond du plan d’eau.
Le projet de Dordives été présenté au pôle Energies Renouvelables et Hydrogène (ENR) du Loiret et en commission Environnement, Mobilité, Transition écologique de la Communauté de Communes des 4 Vallées, assurant ainsi une information continue des acteurs locaux.  Le Conseil municipal de Dordives a délibéré à l’unanimité en sa faveur du projet en mars 2022. En parallèle, BayWa r.e. a lancé une démarche de communication et concertation continue auprès des riverains. Une campagne de financement participatif, ouverte prioritairement aux habitants de Dordives et des communes voisines, a été lancée en mars 2023.
Ce contenu est protégé par un copyright et vous ne pouvez pas le réutiliser sans permission. Si vous souhaitez collaborer avec nous et réutiliser notre contenu, merci de contacter notre équipe éditoriale à l’adresse suivante: editors@pv-magazine.com."
https://www.pv-magazine.fr/2023/03/24/stockage-de-lenergie-une-start-up-australienne-utilise-des-batteries-de-seconde-vie-de-nissan-leaf/,"BATTERIES,STOCKAGE D'ÉNERGIE,VÉHICULE ÉLECTRIQUE,MONDE,SUISSE",DAVID CARROLL,"MARS 24, 2023",Stockage de l’énergie : une start-up australienne utilise des batteries de seconde vie de Nissan Leaf,"D’après pv magazine Australie
Relectrify se targue d’une première mondiale après que la Commission électrotechnique internationale (CEI), installée en Suisse, a certifié que son système modulaire de stockage de l’énergie sur batterie de 36 kW/120 kWh était conforme aux normes technologiques internationales et aux règlements techniques de raccordement spécifiques à chaque réseau.
Le système de stockage de l’énergie sur batterie ReVolve, qui utilise des blocs batterie usagés provenant de voitures électriques Nissan Leaf, présente la technologie de contrôle au niveau cellulaire brevetée de Relectrify, laquelle associe un système de gestion de batterie (battery management system – BMS) intégré à une solution matérielle d’onduleur. Ce système hybride remplace le BMS et les onduleurs traditionnels par une solution électronique unique qui permet de contrôler les cellules au niveau individuel pour générer un courant alternatif (CA) compatible avec le réseau directement à partir d’un bloc batterie.
Pour Relectrify, installée à Melbourne, cette certification constitue une première. En effet, c’est la première fois qu’un système de stockage de l’énergie commercial, fabriqué à l’échelle industrielle et utilisant le contrôle au niveau cellulaire est certifié conforme aux normes internationalement reconnues de la CEI. L’entreprise affirme en outre qu’il s’agit du premier produit fixe de stockage de l’énergie sur batterie donnant une seconde vie aux batteries de véhicules électriques à être certifié pour un déploiement connecté au réseau en Australie.
Pour Valentin Muenzel, PDG de Relectrify, les certifications sont la preuve qu’une technologie fonctionne de manière sûre et conformément aux normes technologies mondiales, permettant ainsi à l’entreprise de fournir cette technologie pour des applications raccordées au réseau sur les marchés du stockage de l’énergie en Europe et aux États-Unis, en pleine expansion.
« Le ReVolve prouve que notre technologie BMS+onduleur répond aux besoins en termes de performance, de sécurité et de conformité au réseau, ce qui favorise l’intégration de cette technologie dans des projets collaboratifs avec des entreprises internationales leaders dans le domaine des batteries pour des applications résidentielles, industrielles et à l’échelle du réseau », indique Valentin Muenzel.
Selon Relectrify, sa technologie qui associe onduleur et gestion de batterie révolutionne le stockage sur batterie en allongeant le cycle de vie des batteries lithium-ion d’un tiers et en réduisant les coûts de l’électronique de puissance de 30 % par rapport aux systèmes classiques de batteries.
Cette technologie, qui peut être utilisée aussi bien dans des systèmes de stockage résidentiels et industriels qu’au niveau du réseau, avec des batteries neuves ou de seconde vie, a déjà été testée dans le cadre de nombreux projets pilotes dans le monde entier. D’après Moonis Vegdani, Chef stratégie et transformation pour le groupe Counties Energy, le propriétaire du réseau de distribution va à présent élargir le déploiement de la technologie de stockage de Relectrify, ce qui l’aidera à intégrer des sources de production décentralisée de manière plus sûre, moins chère et plus rapide.
« Nous sommes parmi les premiers à avoir adopté la technologie BMS+onduleur de Relectrify dans le cadre d’un programme pilote pour un système de batterie à l’échelle du réseau, et à ce titre, nous sommes enchantés d’apprendre que l’équipe de Relectrify a reçu la certification pour la connexion au réseau, dit-il. Nous avons hâte d’installer cette technologie en Nouvelle-Zélande cette année. »
La certification de la CEI arrive quelques semaines seulement après que Relectrify a obtenu une aide financière de la part d’un groupe de grandes entreprises internationales, notamment la société de capital-risque du constructeur automobile japonais Toyota.
Traduction assurée par Christelle Taureau.
Ce contenu est protégé par un copyright et vous ne pouvez pas le réutiliser sans permission. Si vous souhaitez collaborer avec nous et réutiliser notre contenu, merci de contacter notre équipe éditoriale à l’adresse suivante: editors@pv-magazine.com."
https://www.pv-magazine.fr/2023/03/24/dans-les-allees-de-bepositive-elevage-de-truites-potager-et-photovoltaique/,"FOURNITURE D'ÉLECTRICITÉ,HORS-RÉSEAU,STOCKAGE D'ÉNERGIE,FRANCE",MARIE BEYER,"MARS 24, 2023","[Dans les allées de BePositive] Elevage de truites, potager et photovoltaïque","Le photovoltaïque en autoconsommation se décline dans une nouvelle application hors réseau en France. Le système PV + stockage de Ri2E, une entreprise basée en Ardèche spécialisée sur les armoires électriques photovoltaïques, va ainsi partir en test dans un projet d’aquaponie, une méthode de culture qui associe l’élevage des poissons et la culture de plante.
L’installation hors réseau se compose de deux panneaux de 400 watts, d’une batterie 165 Ah 12 V et d’une structure support qui peut se monter (ou plutôt se déployer et se visser) en 15 minutes. Le kit a été conçu par Ri2E pour proposer une solution clé en main à ses clients résidentiels, aux petites entreprises et aux projets en sites isolés. Le dispositif solaire-batteries présente une autonomie de 33 heures.

Il sera intégré au projet de Timothée Saurel, fondateur et dirigeant de T’air-eau qui a mis au point un système d’aquaponie quasi-autonome. Concrètement, un bassin d’élevage de truites est relié à un espace de culture : l’eau du bassin, chargée des matières organiques produites par les poissons, irrigue les plantes en leur apportant les nutriments nécessaires à leur croissance. L’eau est ensuite récupérée, filtrée et rejetée dans l’aquarium. Une pompe à eau de 27 watts permet de faire fonctionner le système et d’oxygéner l’eau pour les poissons.

« La pompe n’a pas une forte consommation, mais elle ne doit pas s’arrêter de fonctionner au risque d’impacter le bien être et la santé des poissons », explique Rudy Bricout, responsable technique établissement secondaire à pv magazine. Avec le kits solaire + stockage de Ri2E, Timothée Saurel se dote d’une solution fiable pour assurer l’alimentation des dispositifs T’air-eau. Cela permet également d’envisager le déploiement de la solution sur sites isolés.
Ce contenu est protégé par un copyright et vous ne pouvez pas le réutiliser sans permission. Si vous souhaitez collaborer avec nous et réutiliser notre contenu, merci de contacter notre équipe éditoriale à l’adresse suivante: editors@pv-magazine.com."
https://www.pv-magazine.fr/2023/03/24/dans-les-allees-de-bepositive-sirea-presente-un-nouveau-systeme-de-stockage-pilotable-pour-lautoconsommation-pv/,"AUTOCONSOMMATION,BATTERIES,PV COMMERCIAL ET INDUSTRIEL,FRANCE",MARIE BEYER,"MARS 24, 2023",[Dans les allées de BePositive] Sirea présente un nouveau système de stockage pilotable pour l’autoconsommation PV,"Sirea a présenté sa nouvelle gamme d’armoire d’autoconsommation spécialisée sur le pilotage du stockage de l’énergie photovoltaïque. Produits de deux ans de développement, ces nouveaux dispositifs sont fabriqués en France et permettent de délivrer, selon le modèle, de 20 à 500 kW en sortie AC, avec des capacités de stockage allant de 100 kWh à 1 MWh.
Les nouvelles armoires dites PSS (Programmable Storage Systems pour systèmes de stockage programmables) sont calibrées pour des projets d’autoconsommation de taille moyenne et peuvent servir d’outils pour optimiser la recharge de véhicule électrique, faire de l’effacement réseau, du zéro-injection ou encore de l’écrêtage de puissance. Cette nouvelle brique technologique devrait ainsi permettre d’« aller plus loin dans l’efficience énergétique des sites industriels, supermarchés ou hôtels », explique Bruno Bouteille, le dirigeant de l’entreprise.
Sirea affirme que les systèmes apportent des garanties sur la sécurité du stockage et la durée de vie des batteries avec des dispositifs de régulation thermique, des capteurs d’intrusion et de détection d’incendie, un système de report d’alarme et un agencement séparant les batteries de l’électronique. Par ailleurs le format dit « shelter » permet d’installer le système à l’extérieur des bâtiments, a proximité du système PV rattaché ou même, tout simplement, près du point de raccordement.
Les nouveaux produits intègrent un contrôle et un monitoring pour réguler les variations de température, piloter les cycles de charge/décharge ou surveiller l’état de la batterie (SOH). « Maintenant que le déploiement de batteries tend à se démocratiser, les shelters PSS se démarquent par leur capacité à piloter le stockage selon la demande du client et son cahier des charges », se réjouit David Grand, chargé de communication à Sirea.
Sirea a aussi profité du soutien de la région Occitanie pour renforcer son appareil industriel situé dans le Tarn en s’équipant de nouvelles machines de production destinées à la fabrication des châssis et shelters métalliques. Trois nouveaux shelters qui vont quitter l’usine castraise en mars 2023.
Ce contenu est protégé par un copyright et vous ne pouvez pas le réutiliser sans permission. Si vous souhaitez collaborer avec nous et réutiliser notre contenu, merci de contacter notre équipe éditoriale à l’adresse suivante: editors@pv-magazine.com."
https://www.pv-magazine.fr/2023/03/24/dapres-une-etude-des-panneaux-solaires-made-in-usa-pourraient-reduire-lempreinte-carbone-de-30/,"MARCHÉS,MODULES ET PRODUCTION EN AMONT,ASIE,ÉTATS-UNIS",BEATRIZ SANTOS,"MARS 24, 2023","D’après une étude, des panneaux solaires made in USA pourraient réduire l’empreinte carbone de 30 %","D’après pv magazine international.
Selon une récente étude menée par des chercheurs de l’Université Cornell, la production nationale de panneaux solaires pourrait accélérer la décarbonation aux États-Unis. Les universitaires exposent leurs conclusions dans « Reshoring silicon photovoltaics manufacturing contributes to decarbonization and climate change mitigation », publié il y peu dans Nature Communications.
D’après eux, relocaliser la fabrication de panneaux solaires aux États-Unis d’ici à 2035 permettrait de réduire les émissions de gaz à effet de serre (GES) de 30 %. La consommation énergétique pourrait elle aussi reculer de 13 % par rapport à 2020, lorsque les États-Unis dépendaient presqu’entièrement des importations de modules PV en provenance de la Malaisie (38 %), du Vietnam (21 %), de la Thaïlande (17 %), de la Corée du Sud (9 %), de la Chine (6 %) et de Singapour (3 %).
Les chercheurs ont réalisé une analyse du cycle de vie (ACV) comparative et prospective en vue d’apporter des éclaircissements sur les impacts du rapatriement de la production de modules PV en silicium cristallin (c-Si) aux États-Unis. L’ACV prend en compte les émissions dues à la fabrication du module en amont ainsi que celles résultant de son fonctionnement, de sa maintenance et de son traitement en fin de vie.
Ils ont mené une analyse quantitative basée sur le potentiel de réchauffement de la planète (PRP) et la demande cumulée en énergie, en comparant les cas de fabrication à l’étranger entre 2010 et 2020 et les scénarios de fabrication relocalisée de 2020 à 2050.
« L’étude du scénario de relocalisation en 2020 permet d’examiner les répercussions sur le climat du rapatriement de la fabrication seule aux États-Unis en le comparant avec la fabrication à l’étranger en 2020, expliquent les scientifiques. De plus, les scenarios de relocalisation entre 2025 et 2050 par tranches de cinq ans prévoient des mixes énergétiques plus propres, notamment avec l’éolien, le solaire, la géothermie, etc., faisant ainsi grimper la contribution des énergies renouvelables de 21 % en 2020 à 42 % en 2050. »
Les résultats indiquent que la fabrication nationale de modules PV c-Si aux États-Unis en 2020 aurait pu réduire les émissions de GES de 23 % et la consommation énergétique de 4 %.
« Les différences de mixes énergétiques d’un pays à l’autre entraînent des différences au niveau des répercussions sur le changement climatique de la fabrication de silicium, ce qui influe directement sur l’écart en termes d’émissions de GES entre les différents [scénarios] », précisent les chercheurs.
Si l’on se projette en 2050, il est probable que la part croissante du PV solaire dans le mix énergétique des États-Unis contribuera à réduire les émissions de GES liées à la fabrication nationale des panneaux solaires de 33 %, par rapport à la situation de 2020, lorsque le pays dépendait des importations internationales.
« D’ici à 2050, près de la moitié de l’électricité américaine proviendra de l’énergie solaire, affirme Fengqi You, l’un des co-auteurs de l’étude. Aujourd’hui, celle-ci ne représente que 3 % environ. Mais les États-Unis sont en train de monter en puissance. Selon les prévisions, nous allons augmenter la capacité solaire de 74 GW en 2022 à 1 600 GW d’ici à 2050. Cela signifie que nous allons avoir besoin de beaucoup plus de panneaux solaires au cours des trois prochaines décennies. »
Ce contenu est protégé par un copyright et vous ne pouvez pas le réutiliser sans permission. Si vous souhaitez collaborer avec nous et réutiliser notre contenu, merci de contacter notre équipe éditoriale à l’adresse suivante: editors@pv-magazine.com."
