url,tag,author,updated_date,title,contents
https://www.pv-magazine.com/2022/03/24/pumped-hydro-as-ultimate-storage-solution-for-australias-energy-transition/,"ENERGY STORAGE,ENERGY STORAGE,MARKETS,UTILITY SCALE PV,UTILITY SCALE STORAGE,AUSTRALIA",DAVID CARROLL,"MARCH 24, 2022",Pumped hydro as ‘ultimate’ storage solution for Australia’s energy transition,"From pv magazine Australia
With the Australian Energy Market Operator (AEMO) forecasting at least 45GW/620GWh of energy storage will be needed to cater for the transition of the nation’s energy system from fossil fuels to renewables, former prime minister Malcom Turnbull has pointed to pumped hydro energy storage projects, including the $4.6 billion Snowy 2.0 project, as the ideal technology.
Speaking at the Australian Energy and Battery Storage conference in Sydney on Wednesday Turnbull said energy storage, and in particular Long Duration Energy Storage (LDES), is the single most important element in Australia’s ongoing energy transition.
“The transition will require not simply green power to replace coal, but vastly more supplies of electricity to cater for the electrification of sectors, like transportation, household heating which rely on fossil fuels as well as the production of green hydrogen,” he said.
“We need more storage and above all we need projects which provide at least eight hours storage and more and are in a form that can be widely emulated.”
This need for energy storage is predominantly driven by the urgency to replace aging coal units with AEMO’s modeling showing that up to 14GW of the current 23GW of coal-fired generation could exit the market by 2030.
In its Draft Integrated System Plan (ISP) released late last year AEMO highlights that 60% of coal capacity would come out of the Australian system in the next eight years.

In its Draft Optimal Development Path, AEMO says nine times today’s utility-scale renewable energy would be needed to continue delivering affordable, reliable and secure power to consumers.
To firm that renewable generation, major investment in storage is required, with 45GW/620 GWh of dispatchable generation, including utility-scale batteries, hydro and other forms of energy storage needed. These will play the critical role of filling the gaps when renewable energy is not available.
“We need much more storage,” Turnbull said on Wednesday. “AEMO suggests at least another 45GW and for all the obvious reasons of security and grid stability it should be distributed and ideally located close to existing transmission.
“Even more importantly it should be, wherever possible, in a format that is repeatable.
“Obviously pumped storage is not replicable in the way a battery is, but the raw truth is that about 95% of the world’s stored electricity is in pumped hydro systems.”
Turnbull pointed to the $4.6 billion expansion of the existing 4.1GW Snowy Mountain Scheme as a prime example of a long-duration energy storage solution.
The Snowy 2.0 project, which involves linking the Tantangara and Talbingo dams via 27 kilometers of tunnels, will provide 2GW of dispatchable energy and provide 350GWh of large-scale storage, enough to power the equivalent of 500,000 homes for over a week during peak demand.
“Snowy 2.0 is the ultimate long-duration storage asset,” he said. “It will be able to generate 2000MW for seven-and-a-half days without repumping. Which is enormously valuable.”

Turnbull, who is now serving as chair of Andrew Forrest’s Fortescue Future Industries (FFI), said pumped hydro energy storage projects are ideally suited to provide longer-duration forms of energy storage, with the economics for battery projects of that scale not yet competitive.
“It’s easy to see a business case for a battery that can discharge for an hour or two or three or four,” he said. “FCAS (Frequency Control Ancillary Services) revenues, basic arbitrage all stack up. But storage for eight or more and more hours is harder to justify, at least in today’s market. But if we want to keep the lights on all the time, we will need it.
“We have to plan for a world where we have stopped burning coal and gas and when the wind isn’t blowing and the sun isn’t shining. We won’t have any electricity unless we have stored it in some way.”
Turnbull said the technology already exists to support the transition to a net-zero economy, dismissing the Federal Government’s continued support for coal and gas as “as irresponsible as it is surreal”.
“There is a lot of lazy, glib talk about how the transition to net zero requires new technologies, innovations yet to spring from the imagination of a new generation of inventors,” he said.
“Don’t believe a word of it. We have the tools to do this job, right now. Variable renewable energy – wind and solar – supported by storage – batteries, pumped storage and green hydrogen – can take us to a zero-emission energy world.
“Of course new technologies, and refinements to existing ones, will emerge – whether it is bigger and better batteries and electrolysers, smarter turbines, or the creation of virtual power plants to name just a few.
“That’s great. But it is no excuse for not moving fast today. We have no time to waste.”
This content is protected by copyright and may not be reused. If you want to cooperate with us and would like to reuse some of our content, please contact: editors@pv-magazine.com."
https://www.pv-magazine.com/2022/03/24/hanwha-commits-to-us-manufacturing-across-the-supply-chain/,"HIGHLIGHTS,MARKETS,MODULES & UPSTREAM MANUFACTURING,UNITED STATES",ANNE FISCHER,"MARCH 24, 2022",Hanwha commits to US manufacturing across the supply chain,"From pv magazine USA
Hanwha Solutions announces stepped up efforts to supply customers with “Made-in-America” products. Hanwha, the Korean company that owns Q CELLS, launched this effort by becoming the largest shareholder of REC Silicon, a major US manufacturer of polysilicon.
Following its initial $160 million acquisition to acquire a 16.67% stake in REC Silicon in January 2022, Hanwha is acquiring an additional 4.67% stake from Aker Horizons in a deal valued at around $44 million. This investment will help American manufacturers secure the raw material critical to the solar supply chain.
“Our commitment to the U.S. is more serious than ever before,” said Justin Lee, CEO of Q CELLS. “We plan to make investments to secure capabilities across the entire solar supply chain, with the goal of supplying our partners with ‘Made in America’ products that will help the U.S. regain its leadership in clean energy solutions.”
In the announcement, Hanwha indicated that it intends to make additional investments in virtually every sub-sector of the US solar manufacturing industry, ranging from key raw materials like polysilicon to fully assembled solar modules. The company currently operates the largest module production facility in the US through its solar panel business unit, Q CELLS. The Georgia factory can produce 1.7GW of solar modules per year, accounting for nearly 20% of total module production capacity in the US.
Hanwha’s US initiative supports the Biden administration’s efforts to increase solar power generation by 40% and to decarbonize all electricity by 2035. Hanwha sees the enactment of the Solar Energy Manufacturing Act (SEMA) as critical to a US-based solar supply chain. Once passed by the Senate and signed into law by President Biden, the legislation is intended to boost America’s panel manufacturing capacity and create jobs. The SEMA Coalition, representing American solar manufacturers supporting the legislation, said in a letter to President Biden, that the bill would add more than 30GW to domestic solar manufacturing capacity in the US by 2025, creating 18,000 direct and 60,000 indirect manufacturing jobs. Hanwha stated in its announcement that once SEMA is passed, the company “will implement a multi-phase, multi-billion-dollar expansion across the full solar energy supply chain”.
“Enacting SEMA is key to fulfilling our pledge to rebuild the U.S. solar supply chain with fully ‘Made in America’ products,” said the Hanwha Solutions spokesperson. “With a long term plan to support domestic solar manufacturing, we can help America lead the clean energy revolution and win the fight against climate change.”
Hanwha’s investment is also expected to add a substantial number of well-paying, local renewable energy jobs across America. Hanwha currently employs up to 750 staff in its Q-CELL production facility in Georgia.
“We imagine a Moses Lake factory brought back to life with local workers clocking in and operating the plant,” said a Hanwha spokesperson, referring to the currently idle REC factory, which is planned to reopen in 2023. “Together with our module factory in Georgia and new planned investments, we will fulfill our pledge to create quality clean energy manufacturing jobs across the United States.
Completion of the REC Solar transaction with Aker Horizons is scheduled in May 2022, subject to a customary anti-trust filing in the US. REC Silicon is expected to become operational in 2023.
This content is protected by copyright and may not be reused. If you want to cooperate with us and would like to reuse some of our content, please contact: editors@pv-magazine.com."
