url,tag,author,updated_date,title,contents
https://www.pv-magazine.fr/2023/06/08/totalenergies-acquiert-un-portefeuille-de-34-mwc-au-vietnam-et-envisage-dautres-opportunites-de-cooperation/,"MARCHÉS,MARCHÉS ET STRATÉGIES,PV COMMERCIAL ET INDUSTRIEL,PV EN TOITURE,VIETNAM",GWÉNAËLLE DEBOUTTE,"JUIN 8, 2023","TotalEnergies acquiert un portefeuille de 3,4 MWc au Vietnam et envisage d’autres opportunités de coopération","Sao Mai Solar Company, une filiale du groupe vietnamien Sao Mai, a signé un SPA (Share Purchase Agreement) avec TotalEnergies Eneos pour la vente de son portefeuille de systèmes solaires en toiture de 3,4 MWc. Par ailleurs, les deux parties ont également signé un protocole d’accord pour développer ensemble d’autres énergies renouvelables, en commençant par le développement de systèmes photovoltaïques en toiture supplémentaires pour les unités de production du groupe Sao Mai. TotalEnergies Eneos, joint-venture entre le Français et le Japonais créé en avril 2022, s’appuiera pour cela sur son expertise technique internationale et exploitera ce portefeuille de manière efficace pour servir ses clients B2B.
Le portefeuille de 3,4 MWc de projets solaires photovoltaïques en toiture a été installé sur les toits de l’usine Asia Fish Oil (AFO) et de l’usine IDI International Development and Investment Joint Stock Company situées dans le pôle industriel de Vam Cong, dans la commune de Binh Thanh, dans le district de Lap Vo, dans la province de Dong Thap. Elle produit actuellement 4,4 GWh d’énergie renouvelable par an.
« Nous sommes très heureux non seulement de ce nouvel ajout à notre portefeuille de projets solaires au Vietnam, mais aussi de la démonstration d’une volonté commune de partenariat à long terme à travers le protocole d’accord signé. Cela souligne notre engagement dans la production distribuée dans la région APAC (Asie-Pacifique) et notre volonté à aider davantage de clients B2B à atteindre leurs objectifs en matière de développement durable », a indiqué Elodie Renaud, directrice de TotalEnergies Eneos Renewables Distributed Generation Asia.
Ce contenu est protégé par un copyright et vous ne pouvez pas le réutiliser sans permission. Si vous souhaitez collaborer avec nous et réutiliser notre contenu, merci de contacter notre équipe éditoriale à l’adresse suivante: editors@pv-magazine.com."
https://www.pv-magazine.fr/2023/06/08/le-groupe-immobilier-idec-cree-une-filiale-dediee-au-solaire-idec-solar/,"AUTOCONSOMMATION,MARCHÉS,MARCHÉS ET STRATÉGIES,OMBRIÈRES DE PARKING,PV AU SOL,PV COMMERCIAL ET INDUSTRIEL,PV EN TOITURE,PV RÉSIDENTIEL,FRANCE",GWÉNAËLLE DEBOUTTE,"JUIN 8, 2023","Le groupe immobilier IDEC crée une filiale dédiée au solaire, IDEC Solar","Après avoir créé une filiale dans l’hydrogène en juillet 2022, le groupe immobilier IDEC poursuit son offensive dans les énergies renouvelables, avec le lancement de IDEC Solar, sa filiale en charge de concevoir et d’optimiser l’aménagement photovoltaïque de ses parcs et bâtiments, en synergie avec les équipes et entités dédiées aux autres énergies renouvelables. « Pour chaque projet, nous recherchons le mix énergétique idéal, qui peut inclure solaire, éolien, biomasse, géothermie, hydrogène vert, récupération de chaleur des datacenters…Nous faisons du sur-mesure en fonction des caractéristiques géographiques et climatiques du site, de son activité future, de la stratégie de développement durable mise en place par le territoire et, bien sûr, des attentes exprimées par les futurs occupants des lieux », souligne Patrice Lafargue, président et fondateur du Groupe IDEC.
C’est pourquoi l’entreprise a aussi décidé d’investir en complément dans l’amont en créant autour de lui un écosystème de startups spécialisées dans la production d’énergies vertes, la logistique et la mobilité durables. Cet investissement s’inscrit une stratégie de décarbonation à 360°, portant à la fois sur le bâtiment, sur son environnement, sur les flux entrants et sortants. Le groupe est notamment devenu l’un des trois actionnaires fondateurs, en mars 2022, d’Holosolis. Ce consortium ouvrira à Sarreguemines (Moselle), en 2025, la plus grande usine européenne de fabrication de panneaux photovoltaïques, pour un investissement total de 700 millions d’euros et la création de 1700 emplois directs. L’opérateur immobilier s’est associé ici au producteur d’énergie solaire TSE et à l’investisseur européen dans les cleantechs et les greentechs EIT InnoEnergy.
« Nous nouons ainsi un partenariat privilégié avec un fournisseur qui sera capable de produire, à prix compétitif, plus de 10 millions de panneaux solaires par an, soit 8 % des importations européennes de modules photovoltaïques chinois en 2022. Nous recherchons non seulement une réduction maximale des émissions de gaz à effet de serre mais aussi une diminution de notre dépendance énergétique, à l’échelle d’un territoire, d’un pays et du continent. D’où la nécessité de faire émerger des champions européens des renouvelables, sur toute la chaîne de valeur ajoutée. Holosolis peut devenir l’un deux. », explique Christelle Rougebief, la nouvelle directrice générale d’IDEC Energy. Ingénieure de l’ENSTA Paris, cette dernière a exercé de nombreuses responsabilités chez GRDF (directrice expérience client, directrice clients-territoires de la Région Ouest) et chez Engie Solutions (directrice territoire Ile-de-France).
Dans cette même logique de sécurisation des approvisionnements, IDEC a aussi investi dans la startup savoyarde Heliup, qui conçoit des panneaux photovoltaïques ultra-légers, réduisant de 60 % le poids d’un module classique, à performance énergétique égale. Ici encore, la prise de participation ne doit rien au hasard. « Nous pourrons retourner auprès d’anciens clients, et au-delà rencontrer toutes les entreprises dont les toitures, de conception classique, sont inadaptées à la contrainte structurelle d’un panneau photovoltaïque normal. Et leur proposer un « retrofit », un module solaire ultra-léger signé Heliup », justifie Christelle Rougebief.
Ce contenu est protégé par un copyright et vous ne pouvez pas le réutiliser sans permission. Si vous souhaitez collaborer avec nous et réutiliser notre contenu, merci de contacter notre équipe éditoriale à l’adresse suivante: editors@pv-magazine.com."
https://www.pv-magazine.fr/2023/06/08/un-tracker-solaire-pour-terrain-irregulier-equipe-dun-dispositif-dinclinaison-pneumatique/,"PV À GRANDE ÉCHELLE,PV AU SOL,ÉTATS-UNIS",ANNE FISCHER,"JUIN 8, 2023",Un tracker solaire pour terrain irrégulier équipé d’un dispositif d’inclinaison pneumatique,"D’après pv magazine International
Ce qui différencie le tracker solaire Sunfolding pour terrain irrégulier des autres mécanismes, c’est un dispositif pneumatique, une technologie vieille de 360 ans qui convertit l’énergie en mouvement.
Les traceurs classiques sont plus complexes d’un point de vue mécanique, ce qui rend leur installation et leur maintenance coûteuses. Les ingénieurs de Sunfolding ont découvert que la technologie pneumatique permettait une approche plus simple comportant des avantages pour la conception de certains dispositifs solaires. Ainsi, grâce à une poche (vessie) pour le stockage de l’air, l’appareil peut continuer à fonctionner pendant les coupures de courant.
Ces poches peuvent aussi fonctionner sans air et de manière continue sans risque de surchauffe. Pour en savoir plus sur la technologie pneumatique appliquée au solaire, lisez le livre blanc de Sunfolding. Fonctionnant sans batteries ni composants métalliques de transmission, la technologie pneumatique est aussi capable de résister à des températures extrêmement basses, là où les trackers classiques ont rencontré des problèmes par le passé.
Comme le souligne Chip McDaniel dans Industrial Equipment News, la technologie pneumatique a pour elle l’avantage de la simplicité, d’un coût faible et de la fiabilité. Capable d’apporter une force significative dans un espace réduit, elle offre une « voie rapide vers le mouvement ».
La technologie brevetée AirDrive utilisée par Sunfolding a été inventée par Leila Madrone, fondatrice de l’entreprise et directrice de la technologie. Titulaire des bachelors et masters du MIT en génie électrique et en informatique, avec une spécialisation dans la robotique et la mécatronique, Leila Madrone est roboticienne. Très tôt dans sa carrière, elle a travaillé sur l’automatisation dans la génomique et la commercialisation de matériel de robotique pour la NASA. Fondée en 2012, Sunfolding est issue du Otherlab du MIT. En 2016, l’entreprise a reçu une récompense ARPA de 3,93 millions d’euros pour son « système de tracker PV activé par pneumatique ».
Le système AirDrive
Ce système de tracker repose sur AirDrive. Fondé sur l’invention de Leila Madrone, AirDrive se compose de vessies souples (voir photo ci-dessus) intégrées dans un logement métallique : une vessie à l’est et une autre à l’ouest. Les vessies sont pressurisées à différents niveaux pour gonfler l’un des côtés, ce qui incline la structure solaire dans la direction opposée. Les vérins AirDrive X du système de Sunfolding pèseraient moins de 22 kg. Wes Fuller, vice-président des ventes et des partenariats stratégiques, a indiqué à pv magazine USA que deux personnes suffisaient pour les soulever et les fixer aux poteaux fichés dans le sol. Les équipements pneumatiques de qualité automobile sont reliés au système d’approvisionnement en air (un par tranche de 5 MW). Ces systèmes sont livrés préassemblés et peuvent être mis en place directement sur site.
Ce système pneumatique affiche moins de points de défaillance critiques que les systèmes mécaniques traditionnels, ce qui, d’après Sunfolding, permet de réduire considérablement les coûts de maintenance. Le vérin AirDrive X utilise des polymères d’avant-garde fournis par DuPont, pour une meilleure résistance au vent, à la chaleur, à la pluie et à la neige.
Selon Sunfolding, son premier produit, le tracker T29, aurait révolutionné le domaine des trackers avec l’introduction du pneumatique. Il est utilisé dans 39 projets dans 12 États des États-Unis, notamment en Californie, dans le Colorado, en Géorgie, en Pennsylvanie et au Texas.
Lancé en septembre 2022, le TopoTrack est conçu pour les terrains irréguliers. À l’instar du T29, il utilise la technologie AirDrive, mais il affiche des rangées de trackers plus petites et indépendantes sur le plan mécanique.
D’après l’entreprise, les rangées de TopoTrack sont 10 fois plus courtes que celles des trackers classiques et peuvent faire varier l’inclinaison de 20 degrés d’un tracker à l’autre, ce qui améliore la tolérance à la pente entre les rangées et permet une articulation sur le terrain, notamment un changement de direction total si nécessaire.
Le dispositif repose sur deux poteaux, deux vérins et deux pannes. Grâce à la flexibilité et à la simplicité du tracker, Sunfolding affirme que son empreinte sur le site du projet peut être augmentée lorsque l’espacement entre les trackers est réduit. D’après Wes Fuller, TopoTrack permet de réduire de 97 % les besoins en nivellement selon certaines estimations, augmentant encore les économies réalisées.
Installée à Alameda, en Californie, Sunfolding fait fabriquer ses poteaux, vérins et pannes aux États-Unis. L’entreprises a noué des partenariats avec des fournisseurs du secteur automobile pour la fabrication d’AirDrive et affirme que 90 % de ses matériaux sont fabriqués dans un rayon de 400 km autour de son site de production dans le Midwest des États-Unis. Cela lui permet d’afficher des délais de réalisation courts et de réduire les risques liés à l’approvisionnement.
Le TopoTrack a récemment été déployé sur un site soumis à une protection environnementale stricte. Ce site présente un terrain complexe qui enregistre de fortes précipitations de neige. La technologie TopoTrack aurait permis au client de se passer entièrement de nivellement sur le site, minimisant ainsi considérablement les coûts liés à la gestion d’un terrain difficile et aux risques associés.
Traduction assurée par Christelle Taureau
Ce contenu est protégé par un copyright et vous ne pouvez pas le réutiliser sans permission. Si vous souhaitez collaborer avec nous et réutiliser notre contenu, merci de contacter notre équipe éditoriale à l’adresse suivante: editors@pv-magazine.com."
https://www.pv-magazine.fr/2023/06/08/retour-sur-la-mise-a-jour-de-la-nit-sur-leblouissement-cause-par-les-centrales-solaires/,"OPINION ET ANALYSE,POLITIQUE,PV À GRANDE ÉCHELLE,PV AU SOL,FRANCE",,"JUIN 8, 2023",Retour sur la mise à jour de la NIT sur l’éblouissement causé par les centrales solaires,"La note d’information technique (NIT) de la Direction de la sécurité de l’aviation civile (DSAC) dans sa version de 2011 traitait des enjeux de sécurité de l’aviation en se concentrant plus particulièrement sur l’enjeu de gêne visuelle pour autoriser les installations de panneaux photovoltaïques à à moins de trois kilomètres des aérodromes. Le 10 novembre 2022, la Direction générale de l’aviation civile (DGAC) a publié une mise à jour introduisant de nouvelles consignes en tenant compte de la dizaine d’années d’expérience, en termes de zones concernées ou d’évaluation de la gêne occasionnée, et du développement de nouveaux verres antiéblouissement.
« Il faut prendre en compte de la volonté politique de favoriser le développement des énergies renouvelables, tout en introduisant des simplifications administratives, notait la DGAC dans un webinaire organisé sur le sujet en février 2023. De plus, un benchmarking auprès des différentes autorités nationales a été réalisé. Ainsi, la Federal Aviation Administration (FAA) et l’ENAC italienne ont mis en place un système déclaratif avec responsabilisation des porteurs de projet. Or, aucun incident ou accident aérien du à la présence des panneaux photovoltaïques aux abords des aérodromes n’a été recensé ».
Selon la société spécialisée depuis 2008 dans l’ingénierie et le conseil PVSolaïs, qui a réalisé pour pv magazine France un travail d’analyse de la nouvelle NIT, les principaux changements relatifs à la maîtrise de l’éblouissement sont :
• l’introduction d’un guichet unique SNIA pour les dossiers de demande ;
• la suppression des zones de protection B et C au profit d’une unique zone de protection équivalente à l’ancienne zone A pour les surfaces PV supérieures à 500 m² ; cette zone de protection est fortement réduite pour les surfaces PV inférieures à 500 m².
• le regroupement des différentes procédures d’approches des hélicoptères à travers une unique procédure dégagée ;
• la suppression des seuils de luminance (10 000 ou 20 000 cd/m² dans la v4) qui s’avéraient très bas et contraignants pour les porteurs de projet (exemple : LED > 30 000 000 cd/m²). De plus, ces seuils ont été supprimés en raison notamment de l’arrêt de production d’un certain type de verres ;
• l’introduction de deux nouvelles notions liées à la gêne visuelle : éblouissement d’incapacité (phénomène physiologique qui correspond à une baisse des performances visuelles) et éblouissement d’inconfort (dégradation des conditions visuelles sans empêcher la réalisation de la tâche). Dans le cas où un éblouissement incapacitant les pilotes ou les contrôleurs ou personnels AFIS est constaté après installation des panneaux photovoltaïques, les actions correctives ou de mitigation à mettre en place incombent à l’exploitant de l’installation. En cas d’éblouissement n’engendrant pas un éblouissement incapacitant, l’exploitant d’aérodrome devrait être amené à proposer des mesures d’atténuation et a minima à préciser la gêne dans l’information aéronautique.
• la nécessité de l’information des pilotes de la gêne visuelle à travers la publication aéronautique. En effet, le retour d’expérience a démontré que la plupart des cas d’éblouissement sont dus à l’effet de surprise et peuvent être supprimés grâce à une information adaptée auprès des pilotes ;
• la responsabilisation des porteurs de projet quant à l’absence d’impact en termes de sécurité aérienne et ce à travers deux éléments constitutifs du dossier Sécurité :
Des études complémentaires, avec définition d’un cahier des charges spécifique, vont être lancées au niveau français et les résultats de l’étude seront disponibles normalement à l’été 2024.
The views and opinions expressed in this article are the author’s own, and do not necessarily reflect those held by pv magazine.
Ce contenu est protégé par un copyright et vous ne pouvez pas le réutiliser sans permission. Si vous souhaitez collaborer avec nous et réutiliser notre contenu, merci de contacter notre équipe éditoriale à l’adresse suivante: editors@pv-magazine.com."
https://www.pv-magazine.fr/2023/06/08/appel-doffres-75-entreprises-luxembourgeoises-aidees-dans-leur-projet-dautoconsommation-solaire/,"AUTOCONSOMMATION,OMBRIÈRES DE PARKING,PV AU SOL,PV COMMERCIAL ET INDUSTRIEL,PV EN TOITURE,LUXEMBOURG",GWÉNAËLLE DEBOUTTE,"JUIN 8, 2023",Appel d’offres : 75 entreprises luxembourgeoises aidées dans leur projet d’autoconsommation solaire,"85 projets de 75 entreprises différentes se sont qualifiés pour bénéficier d’un soutien public pour l’installation d’une centrale photovoltaïque en autoconsommation. Selon les résultats communiqués par les ministères de l’Économie et de l’Énergie et de l’Aménagement du territoire, les projets retenus lors de l’appel d’offres du 31 octobre 2022 représentent un investissement de 44,4 millions d’euros par les entreprises, et sont soutenus par des aides à l’investissement d’un montant total de 16,1 millions d’euros. Au total, 106 dossiers ont été soumis lors de l’appel d’offres et des entreprises issues d’une grande diversité de secteurs d’activités et de toutes les tailles ont participé à l’appel à projets.
Trois lots étaient soumis à appel d’offres : les installations de plus de 30 kWc et de moins de 200 kWc, pour un montant plafond de l’aide de 810 €/kWc (lot 1) ; les installations inférieures à 500 kWc, pour un montant plafond de l’aide de 620 €/kWc (lot 2) et enfin les installations entre 500 kWc et 5 MWc pour une aide maximale de 530 €/kWc (lot 3). Le budget disponible était de 30 millions d’euros (10 M€ par lot).
Les entreprises aidées réaliseront les projets de centrales photovoltaïques avec une autoconsommation au moins partielle dans les prochains 18 mois. Ces centrales auront une puissance totale de plus de 46 MWc. Le troisième lot, avec les installations de plus grande puissance, a été celui où l’aide distribuée sera la plus importante : 9 788 530,58 euros pour 32,73 MWc). Le lot 1 bénéficie d’une aide de 3 083 767,13 euros pour 5,37 MWc et le lot 2 de 3 252 959 euros alloués pour des projets de 8,24 MWc.
« Avec de telles mesures nous orientons les investissements vers les énergies renouvelables et nous incitons de plus en plus d’entreprises, industrielles, artisanales ou du secteur des services, à investir dans leur autonomie énergétique et dans les énergies renouvelables », s’est félicité Franz Fayot, le ministre de l’Économie lors d’une conférence qui s’est tenue le 6 juin dans les locaux de l’IFSB (Institut de formation sectoriel du bâtiment).
Devant le succès de ce premier appel à projets pour des installations photovoltaïques auprès d’entreprises prévoyant une autoconsommation au moins partielle de l’électricité produite, la tenue d’un deuxième appel à projets a d’ores et déjà été annoncée. Celui-ci sera lancé en juillet et se tiendra jusqu’en octobre 2023. « L’énergie solaire est une source d’énergie propre, qui aide le Grand-Duché à atteindre ses objectifs de développement des énergies renouvelables, et qui fait partie des solutions pour sortir de la dépendance des énergies fossiles russes. La tendance de l’autoconsommation est lancée: en 2022, 793 installations des 1053 nouvelles installations au Luxembourg font recours à l’autoconsommation », a poursuivi Claude Turmes, ministre de l’Énergie.
Ce contenu est protégé par un copyright et vous ne pouvez pas le réutiliser sans permission. Si vous souhaitez collaborer avec nous et réutiliser notre contenu, merci de contacter notre équipe éditoriale à l’adresse suivante: editors@pv-magazine.com."
https://www.pv-magazine.fr/2023/06/08/pour-le-gestionnaire-de-reseau-rte-il-faudra-doubler-la-production-des-enr-dici-a-2035/,"AGRIVOLTAÏSME,AUTOCONSOMMATION,OMBRIÈRES DE PARKING,PV AU SOL,PV EN TOITURE,PV FLOTTANT,PV RÉSIDENTIEL,FRANCE",GWÉNAËLLE DEBOUTTE,"JUIN 8, 2023","Pour le gestionnaire de réseau RTE, il faudra doubler la production des EnR d’ici à 2035","Le gestionnaire du réseau de haute tension a détaillé le 7 juin la mise à jour de ses prévisions de production et de consommation d’électricité en France à horizon 2035. Selon RTE, celles-ci intègrent les bouleversements intervenus depuis deux ans, à savoir la publication du programme européen “Fit for 55”, qui renforce les obligations de réduction des émissions de CO2 des pays européens (-55% par rapport à 1990) et les conséquences de la guerre en Ukraine sur les politiques énergétiques. La nécessité de sortir rapidement des énergies fossiles, ainsi que les ambitions de réindustrialisation portées par le gouvernement français, devraient en effet conduire à une augmentation de l’électrification des usages des entreprises et des ménages.
Selon l’étude « Comprendre et piloter l’électrification d’ici 2035 », RTE table donc sur une consommation annuelle d’électricité en forte hausse, comprise entre 580 à 640 terawattheures en 2035, alors qu’en 2021, il prévoyait encore sur une consommation de 540 TWh dans un scénario moyen dit de référence, et de 585 TWh en cas de “réindustrialisation profonde” du pays. En 2022, les Français ont consommé 460 TWh d’électricité.
Ce rythme de croissance « met en évidence l’ampleur du défi auquel le système électrique est confronté », insiste RTE. « La France peut y faire face, à condition d’accélérer le développement des énergies renouvelables, de maximiser la production nucléaire des réacteurs existants, d’accroître l’efficacité énergétique et de développer la sobriété », poursuit le rapport.
Dans ce contexte, RTE estime qu’il faudra doubler la production des EnR d’ici 2035 pour couvrir cette augmentation de consommation. « Les besoins d’électrification rendent nécessaire de porter le volume annuel de production renouvelable au minimum à 250 TWh par an d’ici 2035 (contre environ 120 TWh aujourd’hui), y compris en intégrant le renouvellement des installations les plus anciennes. Sur la base des éléments recueillis dans le cadre de la concertation, un volume de production d’environ 300 TWh par an à cette échéance apparaît même accessible », assure le gestionnaire.
Une prévision qui a fait réagir Jules Nyssen, président du Syndicat des énergies renouvelables (SER) : « ouvrons les yeux sur la réalité de notre système électrique ! Pour répondre aux impératifs de décarbonation et de réindustrialisation, la France aura besoin de tous les gisements de production d’énergie disponibles. Les EnR électriques, telles que l’éolien terrestre et le solaire au sol, font partie de la solution : décarbonées et compétitives, ces solutions constituent un pilier de la stabilité de notre système électrique. Les ENR sont une chance pour notre pays », insiste le président.
A ce jour, les éléments publiés par RTE sur l’électrification à l’horizon 2035 comprennent les enseignements de la consultation publique de RTE organisée en février et mars auprès de l’ensemble des parties prenantes et l’analyse des résultats d’une enquête inédite, réalisée pour RTE par Ipsos auprès d’un échantillon de 11 000 à 13 000 personnes, sur l’appétence des Français à adopter des comportements favorisant la transition énergétique. Ces travaux permettront l’élaboration du Bilan Prévisionnel 2035, articulé autour de trois scénarios, et dont la publication est prévue en septembre 2023.
Ce contenu est protégé par un copyright et vous ne pouvez pas le réutiliser sans permission. Si vous souhaitez collaborer avec nous et réutiliser notre contenu, merci de contacter notre équipe éditoriale à l’adresse suivante: editors@pv-magazine.com."
