url,tag,author,updated_date,title,contents
https://www.pv-magazine.it/2023/09/20/nuovo-progetto-di-facciate-continue-fotovoltaiche-integrate-sottovuoto/,"MODULI,TECNOLOGIA E SCIENZA,CINA",EMILIANO BELLINI,"SETTEMBRE 20, 2023",Nuovo progetto di facciate continue fotovoltaiche integrate sottovuoto,"Un gruppo di ricercatori cinesi ha sviluppato un nuovo progetto per le facciate continue fotovoltaiche integrate sottovuoto (VPV), che secondo loro può combinare in modo efficiente la produzione di energia fotovoltaica e l’isolamento termico dell’edificio.
“Per la prima volta è stato proposto un metodo di progettazione suddiviso in più funzioni per le facciate continue fotovoltaiche, che mira a conciliare la domanda concorrente di diverse funzioni delle facciate continue fotovoltaiche, come la luce diurna, la vista e la produzione di energia”, ha dichiarato l’autore principale della ricerca, Jinqing Peng, alla rivista pv. “Ora stiamo ottimizzando l’altezza e il tasso di copertura fotovoltaica di ciascuna sezione e, dopo questo studio, collaboreremo con le imprese per produrre le facciate continue fotovoltaiche suddivise”.
I ricercatori hanno spiegato che le facciate continue VPV con un’elevata copertura fotovoltaica possono essere vantaggiose per un edificio, in quanto possono impedire a grandi quantità di radiazioni solari di entrare nell’edificio, evitando così problemi di surriscaldamento. Al contrario. Le facciate continue VPV con bassa copertura fotovoltaica possono avere problemi di surriscaldamento, ma possono aiutare l’edificio a richiedere meno energia per l’illuminazione e il riscaldamento.
“Pertanto, la progettazione ottimale mono-obiettivo delle facciate continue VPV non è in grado di bilanciare le sue funzioni restrittive e persino contraddittorie”, hanno dichiarato. “L’obiettivo primario di questo studio è bilanciare i compromessi tra le diverse funzioni delle facciate continue VPV e migliorare il loro potenziale di risparmio energetico, garantendo al contempo il comfort degli occupanti”.
Il sistema è costituito da un vetro stratificato fotovoltaico basato su celle solari al tellururo di cadmio (CdTe), da una cavità d’aria e da una lastra di vetro sottovuoto. Gli scienziati hanno inciso le celle solari in strisce con il laser.
Il sistema è inoltre suddiviso in sezioni per la luce diurna, per la vista e per la facciata, in base alle diverse funzioni, e la copertura fotovoltaica di ciascuna sezione deve essere determinata separatamente. Le sezioni luce diurna e vista sono progettate per fornire luce diurna e un collegamento visivo con l’esterno, mentre la sezione spandrel è destinata principalmente alla produzione di energia. Ciò consente di modulare le trasmittanze di ciascuna sezione regolando la densità delle strisce di celle fotovoltaiche.
Il gruppo cinese ha simulato le prestazioni della tenda VPV tramite i software Radiance ed EnergPlus e la tecnica dell’ordine di preferenza per somiglianza alla soluzione ideale (TOPSIS). Hanno ipotizzato che il sistema fosse installato in un edificio privato per uffici esposto a sud.
“Si è ipotizzato che si trattasse del piano intermedio di un edificio con facciata continua in vetro di dimensioni pari a 2,7 m di altezza, 4,0 m di profondità e 3,0 m di larghezza”, hanno dichiarato i ricercatori. “La facciata continua VPV è stata installata sulla facciata sud con un ampio rapporto finestra/parete dell’86%”.
La simulazione ha dimostrato che la variazione della copertura fotovoltaica della sezione di luce diurna ha un forte impatto sull’illuminamento utile di luce diurna e sull’indice di abbagliamento da disagio. L’abbagliamento fastidioso è una sensazione psicologica causata dall’elevata luminosità, mentre l”indice di abbagliamento da disagio si riferisce alla quantità di luce diurna utile per gli occupanti di uno spazio.
Inoltre, gli studiosi hanno scoperto che la configurazione ottimale del sistema richiederebbe una copertura fotovoltaica del 20% nella sezione di luce diurna, del 40% nella sezione di vista e del 90% nella sezione spandrel. “La facciata continua VPV ottimale, con coperture fotovoltaiche del 50%, 40% e 90% per le sezioni luce diurna, vista e spandrel, ha ottenuto una riduzione del 34,5% dell’indice di abbagliamento, un incremento del 4,9% dell’UDI, un incremento del 5,2% del rapporto tra luce netta e luce solare”, hanno spiegato.
Il sistema è stato descritto nello studio “Multi-function partitioned design method for photovoltaic curtain wall integrated with vacuum glazing towards zero-energy buildings”, pubblicato su Renewable Energy. Il gruppo di ricerca comprende scienziati della Shanghai Jiao Tong University e della Hunan University in Cina.
“Per quanto riguarda il costo di questo sistema, la facciata continua fotovoltaica a partizione si differenzia da quella tradizionale solo per la disposizione delle strisce di celle solari”, ha concluso Peng. “Di conseguenza, non c’è una differenza di costo significativa tra i due progetti, ma la facciata continua fotovoltaica suddivisa proposta può ridurre il consumo energetico dell’edificio e produrre più energia elettrica in eccesso”.
I presenti contenuti sono tutelati da diritti d’autore e non possono essere riutilizzati. Se desideri collaborare con noi e riutilizzare alcuni dei nostri contenuti, contatta: editors@pv-magazine.com."
https://www.pv-magazine.it/2023/09/20/ilfab-solar-avviera-la-produzione-di-celle-negli-stati-uniti-e-una-nuova-linea-di-pannelli-topcon/,"BANDI E ASTE,FINANZA,INDUSTRIA & FORNITORI,LEGGI & ATTI,MERCATI & POLITICHE,MODULI,POLITICA,TECNOLOGIA E SCIENZA,CANADA,STATI UNITI",RYAN KENNEDY,"SETTEMBRE 20, 2023",Silfab Solar avvierà la produzione di celle negli Stati Uniti e una nuova linea di pannelli TOPCon,"Silfab Solar, produttore di celle e moduli solari con sede a Toronto, sta investendo 150 milioni di dollari in un sito di produzione di celle negli Stati Uniti. L’impianto di York County, nella Carolina del Sud, dovrebbe creare più di 850 posti di lavoro.
Lo stabilimento avrà una capacità produttiva di 1 GW di celle e 1,2 GW di moduli aggiuntivi. L’inizio delle operazioni è previsto per il terzo trimestre del 2024, con l’aggiunta di una capacità critica di produzione di celle, che attualmente rappresenta un collo di bottiglia nella catena di approvvigionamento solare degli Stati Uniti.
Il Consiglio di Coordinamento per lo Sviluppo Economico ha approvato i crediti per lo sviluppo dell’occupazione relativi al progetto e ha concesso una sovvenzione di 2 milioni di dollari alla Contea di York per sostenere i costi dei miglioramenti edilizi.
L’azienda ha anche recentemente firmato un importante accordo di fornitura con il produttore norvegese di lingotti e wafer NorSun. Silfab acquisterà wafer solari per la produzione di celle dall’impianto di produzione di lingotti e wafer da 5 GW previsto da NorSun negli Stati Uniti.
Nuovi moduli
Immagine: Silfab Solar
Silfab ha presentato diversi nuovi moduli alla conferenza RE+ di Las Vegas. I moduli TOPCon residenziali e commerciali saranno disponibili a partire dal primo trimestre del 2024.
TOPCon è un’altra pietra miliare nel continuo impegno di Silfab verso l’innovazione e i progressi tecnologici per soddisfare la crescente domanda di solare fotovoltaico di alta qualità e made in America”, ha dichiarato il Presidente e CEO di Silfab Paolo Maccario.
La linea TOPCon offre una maggiore potenza di uscita, una maggiore efficienza in condizioni di scarsa illuminazione e prestazioni costanti a temperature elevate. La nuova linea NTC è coperta da una garanzia di 25 anni sul prodotto e di 30 anni sulle prestazioni lineari. L’edizione Prime NTC si basa sui moduli residenziali dell’azienda, con un look nero su nero per le installazioni su tetto.
Silfab ha anche annunciato che lancerà la nuova generazione di Silfab Elite 430 BG+ all’inizio del 2024. Elite è il pannello più avanzato e ad alta efficienza di Silfab, che utilizza il design proprietario X-Cell e il design delle celle integrate con il contatto posteriore per migliorare le prestazioni e la durata.
Attualmente, il modulo è offerto come Silfab Elite SIL 410 e 420. Disponibile nel primo trimestre del 2024, il Silfab SIL 430 BG+ includerà ulteriori caratteristiche di mezza cella.
I presenti contenuti sono tutelati da diritti d’autore e non possono essere riutilizzati. Se desideri collaborare con noi e riutilizzare alcuni dei nostri contenuti, contatta: editors@pv-magazine.com."
https://www.pv-magazine.it/2023/09/20/alleanza-per-il-fotovoltaico-conferma-unita-del-settore-contro-bozza-decreto-aree-idonee/,"BANDI E ASTE,INSTALLAZIONI E IMPIANTI,LEGGI & ATTI,MERCATI & POLITICHE,POLITICA,SVILUPPI DI MERCATO,ITALIA",SERGIO MATALUCCI,"SETTEMBRE 20, 2023",Alleanza per il fotovoltaico conferma unità del settore contro bozza decreto aree idonee,"Il decreto aree idonee dovrebbe mirare alla definizione di aree idonee per lo sviluppo delle FER e non all’individuazione di vincoli di utilizzazione delle stesse, lo dice l’Alleanza per il fotovoltaico in Italia in una nota diramata ieri.
“I numerosi vincoli contenuti nella bozza di decreto ministeriale relativo alle aree idonee, associati al mancato coinvolgimento degli operatori del settore nella redazione del testo rischiano di provocare uno stop agli investimenti”, dice l’organizzazione fondata da Enfinity Global, Solarig, Vexuvo, Ilos Energy,  X-ELIO, Novasource Power, Heliopolis e Ox2.
L’Alleanza per il fotovoltaico valuta positivamente la conferma delle aree idonee definite dalle disposizioni normative adottate nell’attesa del decreto, ma sottolinea i rischi e i possibili ostacoli al percorso autorizzativo e realizzativo degli impianti FER, “vanificando, di conseguenza, la definizione delle aree idonee”.
Questo specialmente per i progetti agrivoltaici già presentati; questo il segmento di mercato più esposto ai rischi.
L’Alleanza per il fotovoltaico ha presentato delle proposte che possano migliorare la bozza, sottolineando che il rischio è che si ragioni per una contrapposizione tra rinnovabili e paesaggio, soprattutto in quelle aree già interessate da investimenti, su cui ora vengono avviati procedimenti per l’apposizione di vincoli paesaggistici.
La posizione dell’Alleanza è simile a quella di altre organizzazioni per il fotovoltaico come Italia Solare e Elettricità Futura.
“Alcuni criteri sono troppo restrittivi, altri sono vere e proprie limitazioni alla realizzazione degli impianti che vanno, a nostro avviso, oltre le competenze della materia oggetto di Decreto”, ha scritto Elettricità Futura.
I presenti contenuti sono tutelati da diritti d’autore e non possono essere riutilizzati. Se desideri collaborare con noi e riutilizzare alcuni dei nostri contenuti, contatta: editors@pv-magazine.com."
https://www.pv-magazine.it/2023/09/20/sanzione-gse-al-comune-di-san-felice-sul-panaro-per-presunto-illecito/,"MERCATI & POLITICHE,POLITICA,SVILUPPI DI MERCATO,EMILIA-ROMAGNA,ITALIA",LARA MORANDOTTI,"SETTEMBRE 20, 2023",Sanzione GSE al Comune di San Felice sul Panaro per presunto illecito,"Lo scorso 25 luglio è arrivata in municipio a San Felice sul Panaro una comunicazione del GSE – Gestore dei servizi energetici, con la quale il Comune è stato sanzionato per il presunto illecito frazionamento di tre campi di fotovoltaico realizzati nel 2011 e denominati Lavacchi 1-2-3 della potenza di 1 Mw ciascuno.
È ciò che ha spiegato a pv magazine Italia Luca Marchesi, addetto stampa Comune di San Felice sul Panaro, come da testo diffuso alla stampa. “Di tale irregolarità il Gse si sarebbe accorto nel corso di sopralluoghi effettuati nel 2017. In pratica il Gestore dei servizi energetici sostiene che i tre campi, al momento della loro realizzazione, avrebbero dovuto essere invece censiti come un solo campo di potenza pari a 3 Mw”.
Il nocciolo della questione? “Questo presunto illecito avrebbe consentito al Comune di ricevere maggiori introiti rispetto a quanto previsto per gli impianti di potenza pari a 3 Mw. In pratica, al Comune di San Felice verrebbero tolti 100.000 euro all’anno, mentre l’Ente dovrebbe rendere al Gse, per i periodi passati, 1.158.000 euro, una cifra che se pagata in una sola tranche rischierebbe di portare il Comune, già provato da bilanci difficili, in dissesto”.
La delibera di Arera – Autorità di regolazione per energia reti ed ambienti – ha stabilito la restituzione di circa 900.000 euro a favore del GSE ai danni del Comune emiliano produttore di energia: si tratta degli introiti realizzati fino al 31 dicembre 2022, retroattivamente fino al 1° febbraio 2022, oltre il prezzo massimo fissato da Arera.
Il sindaco Michele Goldoni si è espresso in merito nel corso del passato Consiglio comunale a fine luglio. «L’attuale Amministrazione comunale e gli uffici che vi operano non erano al corrente di questo procedimento perché i sopralluoghi sono avvenuti nel 2017, quando noi non c’eravamo, e di questo non ci è stata trasmessa alcuna memoria storica. Questo quindi ci ha colpiti in maniera del tutto inaspettata. Ci tuteleremo comunque in tutti i modi possibili e abbiamo già individuato un legale esperto in materia che ci supporterà per contrastare questa decisione».
Si evince, quindi, che l’Amministrazione comunale di San Felice, si stia attivando – anche ricorrendo a vie legali – per tutelarsi ed evitare il pagamento della sanzione. “Noi siamo un ente pubblico e non un’azienda privata che ha come finalità di realizzare utili: quelle risorse ci servono per erogare servizi ai nostri cittadini e far funzionare la macchina comunale”.
Nella nota del Comune si legge “Il prezzo di mercato di giugno è stato pari a 0,22 euro al Mwh, mentre il prezzo fissato massimo è 0,058 euro al Mwh: quasi tre quarti in meno. Il Comune di San Felice è considerato produttore di energia perché possiede otto campi fotovoltaici i quali rientrano nel perimetro di applicazione della deliberazione. Tra costi e ricavi questi campi generano un surplus di risorse pari a circa 500.000 euro ogni anno, che sono necessari a finanziare le spese ordinarie del bilancio comunale. La restituzione dei 900mila euro è un fulmine a ciel sereno, non preventivata in alcun modo, e che rischia di paralizzare la vita amministrativa e finanziaria dell’Ente, drenando le poche risorse a disposizione dell’Amministrazione, considerando che solo per le utenze quest’anno il Comune sostiene un incremento di costi del 100-120 per cento rispetto al 2019”.
 
 
 
 
I presenti contenuti sono tutelati da diritti d’autore e non possono essere riutilizzati. Se desideri collaborare con noi e riutilizzare alcuni dei nostri contenuti, contatta: editors@pv-magazine.com."
https://www.pv-magazine.it/2023/09/20/valencia-testa-un-prototipo-di-fotovoltaico-galleggiante-in-acque-marine-utilizzando-oltre-il-90-di-materiali-plastici/,"INSTALLAZIONI E IMPIANTI,TECNOLOGIA E SCIENZA,SPAGNA",PILAR SÁNCHEZ MOLINA,"SETTEMBRE 20, 2023",Valencia testa un prototipo di fotovoltaico galleggiante in acque marine utilizzando oltre il 90% di materiali plastici,"La startup valenciana Pv Nexus ha lanciato la prima unità di un progetto pilota di fotovoltaico galleggiante in acque marine con pannelli composti per oltre il 90% da materiali plastici. Il porto di Valencia ospita questo primo prototipo modulare, frutto del progetto PVFOILX1-PORTS, che mira a definire e superare diverse sfide tecniche come la fabbricazione di pannelli solari con materiali compositi o l’ottimizzazione del comportamento strutturale con design innovativi per ottimizzare i carichi ambientali causati da onde, correnti e vento.
Dopo mesi di progettazione, simulazioni numeriche e produzione nel Laboratorio Strutture dell’ETSI de Caminos, Canales y Puertos dell’Universidad Politécnica de Madrid, è stata avviata la prima fase di sperimentazione nelle acque del bacino del terzo comune spagnolo. A tal fine, è stato installato un primo prototipo su piccola scala con una potenza inferiore a 1 KWp, monitorato e controllato a distanza dalla tecnologia IoT.
Il sistema include pannelli solari flessibili e un meccanismo per raccoglierli ed estenderli in base alle esigenze operative del porto. Si tratta di unità modulari collegate a banchine o moli in grado di distribuire automaticamente i pannelli solari galleggianti. I membri del progetto affermano che utilizzeranno materiali leggeri e riciclabili e operazioni più snelle rispetto ai sistemi galleggianti esistenti, e mirano a ottenere pannelli integrati all’avanguardia realizzati con oltre il 90% di materiali plastici.
La startup afferma che sta già studiando la possibilità di sviluppare nuovi progetti pilota su scala più ampia, tra cui una potenziale integrazione per la produzione di idrogeno verde, che grazie al programma Ports 4.0 – in cui si inquadra il progetto PVFOILX1-PORTS – aprirebbe un’ampia gamma di possibilità di crescita per il progetto.
Il Porto di Valencia sta inoltre testando una parete fotovoltaica verticale pilota per studiarne l’impiego su larga scala. Il prototipo è composto da 21 moduli con una potenza installata di 8,6 kWp.
I presenti contenuti sono tutelati da diritti d’autore e non possono essere riutilizzati. Se desideri collaborare con noi e riutilizzare alcuni dei nostri contenuti, contatta: editors@pv-magazine.com."
https://www.pv-magazine.it/2023/09/20/biometano-e-fotovoltaico-a-cremona-potrebbe-sorgere-un-impianto-da-700-kw/,"INSTALLAZIONI E IMPIANTI,ITALIA,LOMBARDIA",LARA MORANDOTTI,"SETTEMBRE 20, 2023",Biometano e fotovoltaico a Cremona: potrebbe sorgere un impianto da 700 kW,"Durante la recente Conferenza dei Servizi che si è svolta presso la Provincia di Cremona, è stato presentato il progetto di un nuovo impianto agricolo di digestione anaerobica e l’upgrading a biometano, con capacità produttiva di 500 Sm3/h, da realizzare a Cremona.
L’autorizzazione è stata chiesta dalla società agricola Fragea (A2A) e il luogo si trova in Via Antichi Budri, circa 1 km a Sud del centro abitato, in un contesto prevalentemente agricolo dove sono già presenti l’impianto a biomasse legnose di Agripower e il termovalorizzatore di A2A Ambiente, Gruppo A2A.
Vicino all’ipotetico impianto di biometano, nel progetto è previsto anche un parco fotovoltaico a terra con una potenza pari a circa 600-700 kW per un’area totale di 8.000 mq.
Ai piedi dell’impianto fotovoltaico sarebbe presente un prato fiorito in modo da rispettare le richieste di biodiversità e l’attività degli insetti impollinatori indicate dal Comune di Cremona.
“Come è riportato dallo stesso proponente nella relazione integrativa presentata in conferenza di servizi, allegata al verbale pubblicato, si legge che il proponente sta valutando la possibilità di realizzare un impianto fotovoltaico a terra ad ampliamento dell’impianto  per la produzione di biometano attualmente in esame. Ad oggi non sono note altre informazioni, se non che il progetto dell’impianto fotovoltaico in ogni caso non sarà ricondotto nel procedimento amministrativo attualmente in corso e, pertanto, sarà oggetto di eventuale specifica istanza futura”, ha spiegato a pv magazine Italia Mattia Guastaldi, Settore Ambiente e Territorio della Provincia di Cremona.
 
I presenti contenuti sono tutelati da diritti d’autore e non possono essere riutilizzati. Se desideri collaborare con noi e riutilizzare alcuni dei nostri contenuti, contatta: editors@pv-magazine.com."
https://www.pv-magazine.it/2023/09/20/diminuzione-della-popolazione-libera-terreni-agricoli-per-grandi-quantita-di-energia-solare-in-paesi-densamente-popolati/,"INSTALLAZIONI E IMPIANTI,MERCATI & POLITICHE,POLITICA,SVILUPPI DI MERCATO,TECNOLOGIA E SCIENZA,CINA,COREA DEL SUD,GERMANIA,GIAPPONE,ITALIA,POLONIA,RUSSIA,SPAGNA,UCRAINA",PV MAGAZINE,"SETTEMBRE 20, 2023",Diminuzione della popolazione libera terreni agricoli per grandi quantità di energia solare in Paesi densamente popolati.,"Si prevede che la popolazione mondiale aumenterà dagli attuali 8 miliardi di persone a 9,7 miliardi entro la metà del secolo. La forte crescita è particolarmente evidente in Africa, che aggiungerà un miliardo di persone.
Tuttavia, in molti Paesi la popolazione è stabile o addirittura in calo. Ci sono nove Paesi con una popolazione superiore ai 20 milioni di persone che nel 2050 dovrebbero avere una popolazione inferiore a quella attuale: Cina, Russia, Giappone, Germania, Italia, Corea del Sud, Spagna, Ucraina e Polonia. Si prevede che la popolazione complessiva di questi Paesi diminuirà del 10%, passando dagli attuali 2 miliardi di persone a 1,8 miliardi nel 2050.
Un Paese con una popolazione in calo richiede meno cibo. In linea di principio, lo spazio agricolo potrebbe essere liberato per altri scopi. Uno di questi scopi potrebbe essere quello di ospitare parchi solari. Analizziamo la quantità di energia solare fotovoltaica che potrebbe essere raccolta dai terreni agricoli liberati. I pannelli solari sono oltre 100 volte più efficienti nel convertire l’energia solare in energia utile rispetto all’energia da biomassa ricavata dalla canna da zucchero, che è la più grande coltura al mondo per massa. Con il solare fotovoltaico, aree relativamente piccole di terreno agricolo possono produrre grandi quantità di elettricità.
Per il 2050 facciamo le seguenti ipotesi:
– Il mondo raggiunge l’azzeramento del consumo di combustibili fossili.
– Il solare e il vento favoriscono l’elettrificazione dei trasporti, del riscaldamento e dell’industria.
– Il solare e l’eolico favoriscono la produzione elettrolitica di grandi quantità di idrogeno per i prodotti chimici [ammoniaca, metalli, ceramica, plastica, carburanti sintetici per l’aviazione, ecc.] – Tutti nel mondo raggiungono il consumo energetico pro capite dei Paesi ad alto reddito.
– I terreni agricoli si liberano per gli impianti fotovoltaici nella stessa proporzione in cui diminuisce la popolazione. Oggi il consumo tipico di elettricità nei Paesi ad alto reddito è di 7-12 MWh per persona all’anno. Questo consumo deve raddoppiare o triplicare per eliminare tutti i combustibili fossili, a seconda della partecipazione all’industria chimica. Si ipotizza che il consumo energetico di 9,7 miliardi di persone raggiunga i 20 MWh per persona all’anno (tutte le esigenze incluse) a metà del secolo. Pertanto, un mondo benestante, completamente elettrificato e completamente decarbonizzato avrà bisogno di circa 200.000 TWh all’anno di elettricità. Per fare un confronto, il consumo globale di elettricità oggi è di circa 30.000 TWh all’anno.
Massimizziamo la raccolta di energia per unità di superficie ipotizzando schiere dense di pannelli solari ad alta efficienza con un’inclinazione bassa [10 gradi] sparsi in tutto il mondo, ma soprattutto nei Paesi della fascia solare. Si ipotizza che la potenza nominale di ciascun blocco di pannelli solari sia di 200 W per m2 e che la loro efficienza sia del 20%. I blocchi di pannelli solari sono sparsi nelle regioni agricole. Il rendimento energetico annuale (MWh/MW) per ogni regione è calcolato utilizzando il calcolatore del fattore di capacità del Global Solar Atlas. La Tabella 1 mostra (B) la popolazione prevista per il 2050; (C) il calo demografico previsto dal 2022 al 2050; (D) il terreno agricolo nel 2022; (E) il terreno agricolo liberato nel 2050 a causa del calo demografico; (F) la potenziale generazione solare dal terreno liberato; e (G) la generazione necessaria nel 2050 per fornire 20 MWh di elettricità per persona all’anno.
Per tutti i Paesi, ad eccezione della Corea del Sud, la generazione solare su terreni agricoli liberati (colonna F) è sufficiente (o molto più che sufficiente) a fornire l’energia necessaria (colonna G) per far funzionare un’economia completamente decarbonizzata. In effetti, la superficie totale dei terreni potenzialmente disponibili nei 9 Paesi è sufficiente a fornire due terzi dell’energia richiesta (143.000 TWh) da una popolazione globale di 10 miliardi di persone nel 2050, completamente elettrificata, decarbonizzata e benestante.
A ciò si aggiungono, naturalmente, i grandi contributi energetici provenienti dall’energia solare sui tetti, dall’energia solare galleggiante, dalle fattorie solari nelle zone aride, dall’energia solare in combinazione con l’agricoltura (agrivoltaico), dall’energia eolica, dall’energia idroelettrica e da altre fonti.
Si tratta di un calcolo ingenuo a scopo puramente illustrativo. È importante notare che la Russia e l’Ucraina esportano gran parte della loro produzione agricola, per cui il calo demografico in questi Paesi non porta a una diminuzione del fabbisogno di produzione agricola. Inoltre, i Paesi potrebbero destinare i nuovi terreni agricoli disponibili ad altri scopi, tra cui l’agricoltura per l’esportazione, l’aumento dell’autosufficienza agricola, le colture alternative con una resa inferiore [come la carne], le foreste e il ripristino degli ecosistemi.
Tuttavia, in Cina, Giappone, Germania, Italia, Spagna e Polonia c’è una reale opportunità di raccogliere frazioni sostanziali dell’energia solare richiesta dai terreni agricoli liberati dal calo demografico.
Autori: Prof. Andrew Blakers /ANU) e Prof. Ricardo Rüther (UFSC)
Andrew.blakers@anu.edu.au e rruther@gmail.com
L‘ISES, International Solar Energy Society, è una ONG accreditata dalle Nazioni Unite e fondata nel 1954 che lavora per un mondo con il 100% di energia rinnovabile per tutti, utilizzata in modo efficiente e saggio.
I presenti contenuti sono tutelati da diritti d’autore e non possono essere riutilizzati. Se desideri collaborare con noi e riutilizzare alcuni dei nostri contenuti, contatta: editors@pv-magazine.com."
