url,tag,author,updated_date,title,contents
https://www.pv-magazine-australia.com/2021/11/15/distribution-networks-set-to-shrink-standalone-solar-hybrid-systems-are-safer-more-reliable/,"COMMERCIAL & INDUSTRIAL PV,COMMUNITY,DISTRIBUTED STORAGE,ENERGY MANAGEMENT SYSTEMS,ENERGY STORAGE,HYDROGEN,INSTALLATIONS,MARKETS & POLICY,RESIDENTIAL PV,TECHNOLOGY,TECHNOLOGY AND R&D,WESTERN AUSTRALIA",NATALIE FILATOFF,"NOVEMBER 15, 2021","Distribution networks set to shrink: standalone solar hybrid systems are safer, more reliable","Last month Boundary Power, the joint venture between West Australian Government-owned Horizon Power and east-coast, Newcastle-based, globally recognised electrical control solutions provider Ampcontrol hadn’t even turned one year old when it scooped design, innovation, and manufacturing awards for its standalone power systems (SAPS). 
It is currently manufacturing and deploying some 50 customised SAPS in regional and remote WA, but in the new year it expects to jump the deserts of central Australia, cross the boundary into New South Wales and take that state’s strung out customers at the edges of the state’s grid by storm — dazzling them with the power of its reliable power supplies. 
Reliability is the stand-out quality of the Boundary Power range of systems company Director Rod Henderson tells pv magazine Australia.
In October, Ampcontrol won the 2021 Hunter Manufacturing Award for Excellence in Product Design for Boundary Power’s Solar Cube, an integrated, foldout, solar-battery-generator combination that can be installed and providing electricity within 90 minutes of hitting the ground.
The clever Cube also took out the prestigious 2021 Australian Good Design Award for the Engineering Design of its Solar Cube. And Boundary Power shone at the WA Energy Awards, winning the Energy Innovation of the Year for its entire range — Nano SAPS, Solar Cube, R-series SAPS and Kiosk SAPS — of standalone solutions.
All that celebrated innovation and excellence is channeled into reliability and safety of systems that must provide utility-standard energy supply to homes, businesses and communities at the edges or beyond the reach of Australia’s stretched grids.
As Henderson points out, if rooftop solar in the suburbs stops working for some reason, those properties are connected to the grid, “but in the case of our standalone power supplies, they’re the only energy source those consumers have, so the right technology, the right components, the right partnerships are all-important aspects of our designs”.
He also cites Horizon Power’s flexibility, as a government trading entity, to enter into a partnership with a private company as one of the true innovations behind Boundary Power: “You know that’s innovative thinking led by Stephanie Unwin. It makes a big difference when you’re working with people who are really on the front foot,” he says of the unique arrangement.
In 2018, when Ampcontrol was in the process of acquiring CPS National, a company providing SAPS to telcos, utilities, resources companies and the rail sector in remote areas of Australia, Horizon Power was seeking to address the risks, cost and reliability of providing energy to its most far-flung customers.
After the fires in WA in 2015, ageing electricity infrastructure was identified as one potential spark for disaster, the cost of providing and maintaining new infrastructure at remote homesteads and agribusinesses was prohibitive, so Horizon Power investigated the viability of a renewables-led solution and found it promising. 
It approached Ampcontrol, with its new CPS subsidiary, to tender for the supply of the first 17 proposed Horizon Power SAPS, but quickly decided that a separate venture combining Ampcontrol engineering expertise with Horizon Power’s energy-utility expertise and customer understanding could have a great future in the transitioning Australian energy scene.
“We sat down with Horizon engineers and analysed many of their customers’ needs, we looked at their electrical loads,” says Henderson, who is also CEO and Managing Director of Ampcontrol,  in order to come up with the range of capacities now in Boundary’s product offering.
They include the small-load generation supplied by Nano SAPS to power water pumps, electric fences and small dwellings, up to the modular extendability of Kiosk SAPS that deliver up to 120 kW of three-phase power from a 239.4kWp – 319.2kWp solar array and up to 310 kWh of battery storage.
Boundary Power
The initial 17 SAPS delivered to regional Western Australia proved a hit with recipients: some farmers celebrated not having to plough and harvest around electricity poles; other remote customers were enabled by the improvement in electricity supply from their new hybrid solar-battery-generator system.
“The the single-wire earth return, or the SWER system, that a lot of these customers were previously on was developed in the middle of last century,” says Henderson, “and the electrical loads that customers have now are obviously very different to what they were 60 or 70 years ago, so the system had not been meeting their needs.”
To now have the reliability of a generation source that can run chillers or a three-phase welder, and air-conditioning, as well as power electronics for charging phones and running TVs, was a revelation to many.
Reliability of power supply, Henderson feels, will open opportunities for new enterprises in the regions, and the SAPS, maintained by Horizon Power, and charged out at a kilowatts-consumed rate the same as if they were being served from the grid, are scalable to provide for growing businesses; businesses which are now primarily powered by renewables.
Boundary Power
In 2019, Horizon Power estimated that a diesel generator working in tandem with suitably sized solar and battery, and programmed to kick in when renewable energy sources are exhausted, would operate for fewer than 500 hours a year, delivering a carbon reduction on gas-generated energy from the grid.
Since then the government-owned utility has set a 2025 cut-off date for the addition of any new diesel generation to power its customers, and Boundary Power is investigating alternative backup generation, including a number of green-hydrogen-fuelled technologies.
In July, Boundary Power announced a new strategic partnership with hydrogen technology company LAVO and Ampcontrol, which it said would develop power solutions for remote energy users, data centres, and energy-intensive industries.
Alan Yu, LAVO’s Chief Executive Officer, said at the time, “LAVO’s hydrogen storage technology is ideally suited for integration with remote standalone power systems and for other containerised and mobile power solutions.”
As Boundary Power now rolls out a further 45-50 SAPS in the Esperance and Kimberley regions as part of the Western Australian Government’s $5 billion WA Recovery Plan, it has its eye on efforts in Australia’s eastern states to change utility regulations to allow electricity retailers there to also meet customer needs with SAPS where appropriate.
“It’s just getting through the legislation process, and New South Wales is very close — if we don’t see that before the end of this calendar year we’ll see it very early in the new year,” says Henderson, “and it’s on the drawing boards for Victoria, Queensland and South Australia to come online over the next few years as well.”
In a 2020 report by the Australian Energy Market Commission — Updating the regulatory frameworks for distributor-led standalone power systems — Essential Energy in NSW said it had identified some 2,000 customers for whom SAPS could represent the lowest-cost to serve; and AusNet Services in Victoria said it may be economic to deploy SAPS solutions for between 300 and 400 of its customers in bushfire-prone areas.
Boundary Power will likely target export markets sometime after successful SAPS deployments on the east coast of Australia, with Ampcontrol’s network of sales offices and agents ready to assist the deployment of these Australian standalone, low-carbon energy solutions into Southeast Asia and the Pacific Rim.
Boundary Power
“I think we have a very competitive, well placed product in that space,” says Henderson, who adds, “For Fiji and other Pacific nations that are prone to cyclones and the like, we have a high-quality, well-engineered, reliable, tested and certified product.”
At the same time, Ampcontrol subsidiary CPS National is working to solve the ongoing challenge of providing remote communities with clean water. The company has developed and installed its first two systems — one near Alice Springs and the other in the East Pilbara — that integrate water treatment with reliable, renewably powered SAPS.
“There are up to 300 communities in the Northern Territory alone that don’t have access to clean drinking water,” Henderson says, and CPS National “has a cost effective solution. We need governments to get behind it to make sure that they’re giving all our citizens access to what is a basic human need”.
Henderson has taken but a brief moment to bask in the sunny glow of Boundary Power’s awards bonanza. He says, “We have fantastic engineers on both sides of the Boundary Power equation, and the awards are due credit for those teams who have worked so hard to get these terrific outcomes.”
 
This content is protected by copyright and may not be reused. If you want to cooperate with us and would like to reuse some of our content, please contact: editors@pv-magazine.com."
https://www.pv-magazine-australia.com/2021/11/15/off-grid-green-hydrogen-production-in-australia-may-already-be-competitive-with-blue/,"ENERGY STORAGE,UTILITY SCALE STORAGE,AUSTRALIA,WORLD",EMILIANO BELLINI,"NOVEMBER 15, 2021",Off-grid green hydrogen production in Australia may already be competitive with blue,"From pv magazine Global
Researchers at Engie Laborelec, a unit of French energy giant Engie, have developed a new way to determine the levelised cost of hydrogen (LCOH) generated by alkaline electrolysers powered by offgrid, utility-scale solar power plants.
“The study is exclusively based on off-grid electrolysers as this is a use-case that we have experienced,” researcher Jonathan Lehmann told pv magazine. “In a grid-constrained environment, due to the cheap cost of PV electricity, powering up a 50 MW electrolyser with a 100 MW off-grid PV plant coupled to a battery might be cheaper than investing in a grid connection upgrade to purchasing electricity from the grid.”
The current LCOH produced from fossil fuels ranges between $1.34 and $2.4 per kg, depending on the technology and location. Solar-powered hydrogen may already compete with blue hydrogen in certain locations, according to the researchers – particularly in Australia, where an LCOH of $2.36 per kg is already considered achievable.
The researchers studied the LCOH impact of the data used to simulate the PV production. When designing a photovoltaic plant coupled to an electrolyser, the consideration of irradiance or hourly typical meteorological year (TMY) measurements does not accurately represent the dynamic behaviour of the plant. This can cause an underestimation of the power produced by the solar plant and, as a consequence, an overestimation of the LCOH.
Their analysis was conducted on a seven-month set of historical data from a 36 MW photovoltaic plant located in Brazil’s Rio Grande do Norte state. The LCOH was calculated using power production simulated by two different methods, both based on irradiance measurement.
One of the two methods is the system adviser model (SAM) developed by the U.S. Department of Energy’s National Renewable Energy Laboratory (NREL). This modelling software combines time-series weather data and system specifications to assess the electricity production of a renewable energy system.
The second method, described as a transfer function method, was developed by the Engie research group on a model conceived by researchers at the Universidad Pública de Navarra in Spain to assess PV plant variability. It purportedly can precisely simulate the output power of a PV facility from incident irradiance measurement by considering the plant itself as a low-pass filter in the frequency domain.
Indeed, short-term fluctuations of power production are caused by cloud passage. Because of the large spatial distribution of solar panels on a utility-scale PV plant, the impact of cloud passage on the power output is significantly lower than the impact of cloud passage on the irradiance measured by a single sensor. As a consequence, the power produced by a solar plant can be simulated from irradiance measurement by using a low-pass ﬁlter transfer function.
The researchers calculated the LCOH for alkaline electrolyser capacities from 0.1 to 1 times the DC capacity of the solar park. They assumed the inverters of the PV facility would be linked to the grid and that the grid connection would not be sufficient to power the electrolyser without additional onsite power generation. The cost of the PV plant was assumed to be €600 per kilowatt installed.
The SAM method underestimates the capacity factor of a project and as a result, it overestimates LCOH. The transfer function method, by contrast, more effectively determines the low pass filter nature of the solar plant and was closer to the values provided by the analysis conducted on historical power production.
“It was demonstrated that, with the hypothesis considered, the lowest LCOH were obtained for electrolyser sizes between 0.6 and 0.8 times the size of the PV plant,” Lehman explained. “On average, a LCOH 4.2% higher was obtained when using the transfer function method as compared to the historical power production whereas a LCOH 7.3% higher was calculated with SAM.”
The researchers noted that several aspects of the LCOH calculation, such as the price of the battery, were not included. This is because the study mainly focused on the power produced by the PV plant. They will soon conduct follow-up research. They described the novel methodology in “Levelized Cost of Hydrogen Calculation from Off-Grid Photovoltaic Plants Using Different Methods,” which was recently published in RRL Solar.
This content is protected by copyright and may not be reused. If you want to cooperate with us and would like to reuse some of our content, please contact: editors@pv-magazine.com."
https://www.pv-magazine-australia.com/2021/11/15/analysts-revise-up-zero-emission-vehicle-forecast-after-bumper-year/,"EV,FINANCE,MARKETS,POLICY,SUSTAINABILITY,WORLD",MAX HALL,"NOVEMBER 15, 2021",Analysts revise up zero-emission vehicle forecast after bumper year,"From pv magazine Global
With electric vehicle (EV) sales rising rapidly, U.S.-based business intelligence group Bloomberg has said the world’s roads hosted 8.5 million truly zero-emission vehicles by the end of June.
In a report published at the request of the U.K. government, as it hosts the COP26 climate change summit in Glasgow, Bloomberg New Energy Finance included a graphic which showed central business district the City of London, and Bergen, in Norway, lead the way in commitments to phase out the sale of fossil-fuelled vehicles.
Both cities, according to BloombergNEF, have committed to halt new internal combustion engine (ICE) vehicle sales by 2025. The Zero-emission Vehicles Factbook indicates the Norwegian government has also committed to halt new ICE sales by that date but the graphic has the capital, Oslo, with a 2030 cut-off date.
A press release issued by BloombergNEF yesterday to publicise the report stated carmakers which account for 32% of global sales have committed to 100% zero-emission new vehicles by 2035. That is the final cut-off date to ban the sales of ICE vehicles if the world is to reach zero-emission road transport by mid century, according to Aleksandra O’Donovan, lead author of the report.
If that estimate is correct, the coalition of governments and auto manufacturers at COP26 which was set to commit to 100% zero-emission new cars, vans and HGVs by 2040, has not set an ambitious enough target.
Similarly, while BloombergNEF lauded the many municipal, state-level and national targets for eliminating the sale of new ICE vehicles, the 2040 date set by the Canadian province of British Columbia, and by France, Spain, Hong Kong, and Singapore, needs to come in by at least five years, even though the cities of Paris and Barcelona have set a more ambitious, 2030 deadline. Hawaii will also miss the cut for zero-emission roads in 2050 as it is committed to ending new ICE sales in 2045 and, with that cut-off date not even arriving until mid-century in Costa Rica; in the U.S. state-level authorities of Connecticut, Maryland, Oregon, Rhode Island, and Vermont; and in the Texan city of San Antonio, more work clearly needs to be done.
The U.S. state-level commitments account for a quarter of sales in the country, according to BloombergNEF and, when national goals and zero-emission vehicle sales targets are thrown in, the analyst estimated 41% of sales across China, India and the U.S. are committed to be zero-emission units.
The report states improving battery technology and falling costs, faster charging point roll-out, a wider choice of car models, and longer ranges plus faster charging have amped up EV sales this year.
When fuel cell vehicles and part-fossil-fuel plug-in hybrids are included in the numbers, BloombergNEF said, sales will be expected to hit 5.6 million this year, to a cumulative 13 million such autos on the world’s roads.
Perhaps even more impressively, the analyst has predicted 18% of the world’s municipal buses will be zero-emission vehicles by the end of the year.
The rising popularity of such vehicles has prompted BloombergNEF to raise its 2040 estimate of the extent of the world zero-emission vehicle fleet, from 495 million to 677 million. The analyst noted the International Energy Agency and OPEC (the Organization of the Petroleum Exporting Countries) have also raised their expectations, for 2030 and 2040, respectively.
This content is protected by copyright and may not be reused. If you want to cooperate with us and would like to reuse some of our content, please contact: editors@pv-magazine.com."
