url,tag,author,updated_date,title,contents
https://www.pv-magazine-australia.com/2021/11/15/investability-of-australian-renewables-remains-low/,"COMMUNITY,DISTRIBUTED STORAGE,ENERGY MANAGEMENT SYSTEMS,ENERGY STORAGE,FINANCE,INSTALLATIONS,MARKETS & POLICY,POLICY,UTILITY SCALE PV,AUSTRALIA",NATALIE FILATOFF,"NOVEMBER 15, 2021",Investability of Australian large-scale renewables remains low,"In a briefing held today by David Scaysbrook, co-founder of renewable-energy specialists Quinbrook Infrastructure Partners, the long-term industry investor named the US as the most investable market for renewables, and solar and batteries as the technologies to back.
In the meantime, the Clean Investor Energy Group last week released its inaugural Clean Energy Investment Confidence Survey, which shows that Australia’s net-zero by 2050 commitment had not shifted the dial on a now long-term malaise in investor confidence in the Australian renewables landscape.
CEIG CEO Simon Corbell summarised results of the survey saying “Investor confidence remains stalled, with a deterioration in terms of the cost of equity and risk… Investors consider there remains a lack of sufficient scenario planning in the NEM [National Electricity Market] around coal closures and emissions targets.”
Scaysbrook said that Quinbrook, an investment manager that specialises in new asset creation — infrastructure and business development — as opposed to mergers and acquisitions, was never expecting anything to come out of COP26 that would heighten the investability of renewables in general.
But he says that other countries’ commitments made at COP26 — such as the UK going for zero coal within two years and for zero carbon in its power sector by 2025 — “stand in very stark contrast to what we’re going to see, at least with this current government, in near-term propulsion of new investment activity in the Australian market.”
Quinbrook has about 20% of its portfolio in Australia, including two 30 MW plants producing biogas from sugar cane waste in Byron Bay; a specialist green energy retailer called Energy Locals that provides businesses with the tools to set up their own energy plan and is also partnered with Tesla in the SA VPP; Energy Trade, one of Australia’s largest behind-the-meter, community energy network businesses; and APAC Green Data, a developer of data centre campuses — so far one in Queensland and another in New South Wales — which deliver low-cost 24/7 renewable power to help customers meet their carbon-reduction targets.
Its investments reflect Quinbrook’s identification of two strong themes: that Australia’s vast and growing number of distributed energy assets in the form of rooftop solar and battery energy storage create a compelling environment for the development of energy-management technologies; and that industry decarbonisation, where switching to renewably generated electricity is the first step towards company net-zero targets, is a “systemic driver of more interesting investment opportunities”.
But he describes the United States as “the most opportunity-rich market in the energy transition” with the UK running a very close second, whereas “Australia is really a bit of a non-event in terms of the scale and volume of investment opportunity, particularly for institutional investors”. 
Part of this assessment is due to the level of transition achieved in the US relative to its carbon-reduction ambitions. Scaysbrook describes the US as so far behind in decarbonising its power sector that the funding required to repower with renewables is “staggering”; as for the UK, an island that has chosen to totally eradicate coal-generated electricity by 2024— “that naturally creates new opportunity.”
In comparison, the CEIG survey identified that “Australia is not planning for a fast enough transition to clean energy”, which makes it “a risky destination for investors focused on net-zero outcomes”, says Corbell.
Both Quinbrook and CEIG acknowledge the leadership of Australian state governments in accelerating policies that support decarbonisation, but, says Scaysbrook, “You can’t ignore the Federal Government because the National Electricity Market is a confederation of interests, but the Federal Government has the constitutional power to regulate interstate power flow.”
He adds, “You can have as many renewable energy zones as you like, but if we’re all investing in an integrated and interconnected power market, the power has to go somewhere; f you flood or saturate that market with power, investors are going to lose a lot of money. We’ve already seen that in Australia and we’re going to see more of it.”
The CEIG survey reveals that among the organisation’s 18 members, which have combined operational portfolio of 11 GW of renewable energy across 70 power stations, only two new projects — wind farms with a total of 553 MW capacity — have achieved financial close in the first quarter (July-September) of the new financial year.
CEIG research released in August this year showed that the cost of equity for clean-energy investments in Australia is some 100-250 basis points higher than in other OECD countries, a difference it puts down to “climate and energy risks”.
Scaysbrook adds to this analysis, saying that for the first time in decades, the future value of electricity “is a great conundrum, because we are seeing not only policy change, but technology change, technology advancement, in circumstances where our power markets are poorly designed for the world we find ourselves in.”
He says that as a result the power market designs will change “in ways that are difficult to predict”.
Structuring of investments in long-term assets — across 25- to 30-year investment horizons — therefore becomes complicated, and perhaps “matters more than what you think the headline return is going to be”.
Opinion at Quinbrook is that in the coming Federal election the most effective combination of policies will be to introduce a well-structured emissions trading scheme — “Price drives capital in just about every other industry, and I think we need to put a price on carbon,” says Scaysbrook; and to boldly incentivise new green industries.
“We have this unique opportunity where we can create vertical supply chains in Australia … whether it’s for green steel, green aluminium, green hydrogen,” he says. The country’s abundance of cheap land, solar and wind resources “is an exportable value”.
Corbell says the two market reform priorities for the coming 12 months are still, “fixing grid access rules to remove arbitrary risks for generators wanting to connect”, and streamlining the building of new transmission infrastructure to enable clean energy to replace ageing coal-fired generation.
 
This content is protected by copyright and may not be reused. If you want to cooperate with us and would like to reuse some of our content, please contact: editors@pv-magazine.com."
https://www.pv-magazine-australia.com/2021/11/15/when-evs-cant-get-a-purchase/,"OPINION & ANALYSIS,AUSTRALIA",,"NOVEMBER 15, 2021",When EVs can’t get a purchase …,"Australia’s latest electric vehicle policy makes me wince, especially when you consider some of the alternatives that came out of the COP26 conference.
Yes, Australia is installing chargers across the country. And yes, various state governments have also put in place some incentives for purchasing an EV. But Australia is one the few remaining developed countries without a cohesive national EV strategy. Instead, we’re left with tokenistic policy announcements timed to placate the international community. Although they acknowledge the issue of emissions-free transport, they won’t drive real change. 

Others countries, such as Japan, France, Germany, and the UK, have pledged to ban the purchase of petrol cars by 2030 — a policy proposal that has done the rounds in Australia since 2019, but never gained traction. They are also incentivising the purchase, manufacturing and importation of EVs.

Our laggardly approach is disappointing given we have a significant horse in this race — that is, Australia is globally one of the biggest users of cars per capita. We rank well above the UK, Japan and many other countries in this regard. Our only competitors are the US and a number of very small nations.

Moreover, according to the Grattan Institute, Australia can’t reach net zero emissions by 2050 unless we ban petrol and diesel cars by at least 2035. It’s that simple.

Australia has surged ahead on one point: How it will tax EVs when they are rolled out. That’s largely because EVs escape the fuel excises that governments have in place to pay for building and maintenance of the nation’s roads.
Other countries take the opposite position on taxing EVs: In the UK, for example, EVs currently are and will continue to be exempt from road taxes  — which are pegged to CO2 emissions. EV drivers in the UK are, however, subject to congestion taxes. This may change in the future as EV adoption becomes mainstream, but given that we should be minimising barriers to adoption, lowering the cost of owning and running an EV is key.

On the flip side, there has never been a greater demand for EVs. In the past few months, Carbar has doubled the total proportion of EVs in its fleet from 5 per cent to 10 per cent, in response to a dramatic shift in subscriber preference for EVs over petrol cars. By 2025, we anticipate that 1 in 3 requests for a car through our subscription service will be for an EV.

But, as every founder/would-be disruptor knows, it’s difficult to grow this new segment of our business while the policy surrounding the sector remains uncertain and is becoming increasingly political.

For instance, if other states follow Victoria’s lead and introduce a travel-based tax on EVs — charging for every kilometre travelled — it will add more complexity, admin and costs to an already complex industry. It will slow EV adoption, especially within subscription services.
The other pain point is that existing Federal Government support for EV adoption is myopic: it focuses on charging stations, but offers little in the way of incentivising availability of EVs in Australia. At a state level, grants are focused towards the purchase of an EV rather than alternative means of accessing them.

A study by Boston Consulting Group found that by 2030, up to 15 per cent of US total new car sales will be through subscription. Evidence is also emerging that subscription services will play a key role in the broader adoption of EVs, allowing consumers access to an EV without needing the upfront capital to pay for one outright.

We can turn a corner here if our Federal Government simply takes charge of this discussion and sets the agenda.
The views and opinions expressed in this article are the author’s own, and do not necessarily reflect those held by pv magazine.
This content is protected by copyright and may not be reused. If you want to cooperate with us and would like to reuse some of our content, please contact: editors@pv-magazine.com."
https://www.pv-magazine-australia.com/2021/11/15/not-a-total-cop-out-except-for-australia/,"MARKETS & POLICY,POLICY,AUSTRALIA",NATALIE FILATOFF,"NOVEMBER 15, 2021",Not a total COP out … except for Australia,"And it’s a wrap. COP26, the nemesis of the Australian coalition government is over and all 197 participating nations have pledged to “phase down” rather than “phase out” coal, the number-one cause of climate change.
This morning, government backbencher Matt Canavan chose to interpret the softening of language around the global coal commitment as “a big green light” for Australia “to build more coal mines, supply the world with more coal, because that is what brings millions of people out of poverty”.
Commenting yesterday afternoon on the Australian Science Media Centre website, AusSMC, Professor John Quiggin, Australian Laureate Fellow in Economics at the University of Queensland interpreted the revised coal terminology in a broader context when he said, “The compromises made to reach a final text have been disappointing, but relatively minor. For example, while “phasing down” coal is less satisfactory than “phasing out”, either contrasts sharply with the view of the Australian government (at least until recently) that coal demand will remain strong indefinitely into the future.”
In a statement from the Australian Conservation Foundation today, the organisation’s Climate Program Manager, Gavan McFadzean said that the gap in climate policies and commitment  between “Australia and some of its closest allies and trading partners – like the US, UK and the EU – has widened and it will result in dire consequences for our climate, economy and jobs.”
Speaking on ABC Radio National this morning McFadzean contextualised the overall achievement of COP26 in the light of recognition and mitigations achieved since the Paris agreement of COP21: “People need to remember that before Paris, we were heading to five or six degrees of global warming; between Paris and now we were heading for three to four degrees, and now, this agreement brings us within two degrees, so there’s no doubt that significant progress is being made to get emissions down.”
Outcomes of the summit continue to elicit a variety of responses from experts and commentators in Australia. The following is a selection from the Australian Science Media Centre’s stream of informed opinion:
“It’s extremely disappointing to see COP26 end like this — coal has to be abandoned for us to secure a safe climate future. Simply phasing down rather than eliminating our reliance on coal is fundamentally at odds with a commitment to net zero by 2050. Net zero cannot be achieved without urgent action to leave the world’s reserves of fossil fuels in the ground.”
“Side agreements have been much more impactful: 23 countries increased their emissions targets and agreements were announced to phase out coal in rich countries by 2040, end deforestation by 2030 and reduce methane emissions by 30% by 2030. 
Even more importantly the finance sector is driving change across whole economies and the companies that operate within them. The Glasgow Financial Alliance for Net-Zero (GFANZ), 450 financial firms with $130 trillion of assets under management, committed to net zero for both their operations, and their lending and investing. This will impact the financing practices of every bank and lender globally.”
“All countries can now transition to a 100 per cent renewable grid by at least 2035, so the discussion around coal and the last minute softening of the language requested by India seems quite pointless and unnecessary. The hard to abate sectors are all outside electricity and light transport now, with electric vehicles showing a rapid pathway to total decarbonisation of about 50 per cent of global energy use as early as 2035. Hence many of the obstacles seem to now be more political rather than economic.”
“With the emissions projections released on Friday leaving lingering questions on how we transition from rhetoric to action, the Government need look no further than existing mature technologies ready for widespread deployment.
It’s time for a credible and robust plan which maximises Australia’s global leadership position in low-carbon technologies like solar, wind and energy storage (batteries and pumped hydro), combined with electrification of transport and sustainably designed buildings.”
“From a human rights perspective the COP agreement is a failure. 1.5 is the only target that keeps the world safe, including our Pacific neighbours and most of northern Australia. This is not a “near enough is good enough” kind of deal.
The Article 6 carbon market provisions failed to incorporate human rights standards. The fossil fuel provisions have too many carve outs. 
This was the moment to accept a “loss and damage” mechanism for rich countries to compensate poor countries and accept the injustice of emission impacts but that chance was lost. 
We need to kick fossil fuel lobbyists out of the next COP in Cairo. 
Australians need to vote climate. We need to understand what is in the balance here for our own increasingly short-term futures: Livable summers, insurable homes, water security, healthy cities, preparedness for weather events. Not to mention the ability to look your grandchildren in the eyes.
This content is protected by copyright and may not be reused. If you want to cooperate with us and would like to reuse some of our content, please contact: editors@pv-magazine.com."
