url,tag,author,updated_date,title,contents
https://www.pv-magazine-australia.com/2023/11/02/brookfield-eig-boost-origin-energy-takeover-bid/,"FINANCE,MARKETS,MARKETS & POLICY,STRATEGIC ALLIANCES,UTILITY SCALE PV,UTILITY SCALE STORAGE,AUSTRALIA",DAVID CARROLL,"NOVEMBER 2, 2023","Brookfield, EIG boost Origin Energy takeover bid","Canadian investment giant Brookfield, in a consortium with US investor EIG Partners, has boosted its takeover offer for Origin Energy, increasing its bid for Australia’s largest energy utility to $9.53 a share and declaring it their final bid under the scheme deal.
The announcement comes just days after Origin’s largest shareholder, superannuation giant AustralianSuper, said it would reject the prior buyout offer from Brookfield and EIG, describing it as “substantially below” its estimate of long-term value for the energy generator and retailer. The position taken by AustralianSuper, which owns 13.7% of Origin, was supported by several other institutional shareholders.
The Brookfield-led consortium is now offering Origin shareholders $9.53 per share, up 8.2% from the prior offer of $8.81 apiece. The revised bid pushes Origin’s valuation closer to $20 billion.
Importantly, the consortium said the increased offer is its “best and final” proposal meaning it cannot be increased unless a rival offer emerges.
“The fact that no competing offer has surfaced in nearly a year, together with the massive premium in our proposal, evidences the fact that we have identified every element of value available,” EIG Chief Executive Officer Blair Thomas said in a statement.
Origin’s board said it unanimously recommends shareholders vote in favour of the revised deal at the scheme meeting which is currently scheduled for 23 November 2023.
“The revised consideration is now above the top end of the independent expert’s 30 June 2023 valuation range,” Origin Chairman Scott Perkins said in a statement. “We encourage all shareholders to vote in favour of the scheme.”
Perkins said while Origin is already well placed to navigate the energy transition, Brookfield’s ownership will accelerate the build out of cleaner energy at a speed and scale much greater than Origin’s existing plans.
Brookfield has said it will invest up to $30 billion in Origin in the next decade to fund the company’s energy transition, using that capital to develop up to 14 GW of new renewable generation and storage assets by 2033.
Brookfield Asia Pacific Chief Executive Officer Stewart Upson said with its current funding sources and as a public company Origin will not to be able to match the level of investment at the scale and speed as it could achieve under Brookfield’s ownership.
“Under Brookfield’s ownership, we will fund and facilitate the required investment,” he said. “Our capital is committed and not contingent on any future capital raise processes.”
“The combination of Brookfield and Origin in Australia will fast-track significant decarbonisation in the National Electricity Market. We also intend to support a local manufacturing industry that will make components for the renewables development industry in Australia, creating jobs.”
This content is protected by copyright and may not be reused. If you want to cooperate with us and would like to reuse some of our content, please contact: editors@pv-magazine.com."
https://www.pv-magazine-australia.com/2023/11/02/akaysha-to-begin-building-300-mwh-ulinda-park-battery-project/,"ENERGY STORAGE,UTILITY SCALE STORAGE,AUSTRALIA,QUEENSLAND",DAVID CARROLL,"NOVEMBER 2, 2023",Akaysha to begin building 300 MWh Ulinda Park battery project,"Akaysha Energy, the battery storage developer owned by United State-based investment giant BlackRock, has reached a final investment decision (FID) and finalised a balance of plant contract for the $150 million (USD 96.3 million) Ulinda Park project which will include a 150 MW battery, with two hours of storage at maximum output.
The Ulinda Park battery energy storage system is being developed adjacent to the Western Downs substation at Hopeland near Chinchilla in Queensland’s Western Downs region.
Melbourne-based Akaysha said the project will support the rapid expansion of solar and wind projects leveraging existing transmission infrastructure in the region.
Akaysha said construction of the first phase of the Ulinda Park project, which will involve the installation of a 150 MW/300 MWh battery featuring lithium Iron phosphate (LFP) cell technology, would begin this month. The battery is expected to commence commercial operations in 2025.
Adelaide-headquartered Consolidated Power Projects (CPP) has been awarded the engineering, procurement, and construction contract with Akaysha handing the battery equipment supply agreement to US battery specialist Powin and eks Energy.
Akaysha Managing Director and Chief Executive Officer Nick Carter said reaching FID is an “amazing milestone” for the company which has also secured the contract to deliver the 850 MW/1.68 GWh Waratah Super Battery project in New South Wales.
“Ulinda Park was our first-ever development at Akaysha Energy right back at the start, so we have a soft spot for it,” he said. “The Waratah Super Battery gets a lot of the attention/headlines, but the unsung heroes of the Akaysha Energy battery portfolio will become Ulinda Park BESS and the other large battery developments that are rapidly marching towards FID across the NEM.”
Other projects in Akaysha’s development pipeline include the Orana energy storage project near Wellington in central-west NSW, which is to deliver a 400 MW to 1600 MW big battery with up to 1600 MWh of energy storage capacity.
It is also developing the 200 MW/400 MWh Brendale BESS in Queensland, the 200 MW/800 MWh Elaine big battery in Victoria, the 100 MW/200 MWh Palmerston battery energy storage system in Tasmania, and the 200 MW/800 MWh Mobilong big battery in South Australia. The company has also announced plans to develop a 300 MW/1,200 MWh battery and 200 MWp solar farm near Brinkworth in South Australia’s mid-north region.
This content is protected by copyright and may not be reused. If you want to cooperate with us and would like to reuse some of our content, please contact: editors@pv-magazine.com."
https://www.pv-magazine-australia.com/2023/11/02/aiko-showcases-abc-modules-ahead-of-australian-launch/,"COMMERCIAL & INDUSTRIAL PV,DISTRIBUTED STORAGE,ENERGY STORAGE,INVERTERS,MARKETS,MODULES & UPSTREAM MANUFACTURING,RESIDENTIAL PV,AUSTRALIA,CHINA",CHAD BENNETT,"NOVEMBER 2, 2023",AIKO showcases ABC modules ahead of Australian launch,"As part of the Shanghai-based company’s introduction into Australia, it has already set up product and service teams ahead of an expected launch in Q1, 2024.
AIKO CEO Tiger Lu said the company would also be looking to launch its inverter and storage systems, which are currently available in China, to global markets in the coming year.
The centrepiece of AIKO’s exhibition was its N-Type All Back Contact (ABC) modules, which deliver efficiency ratings of up to 24% and earned Intersolar and Red Dot Product Design Awards in 2023.
The ABC double-glass solar component uses dual-glass encapsulation technology, building on the core strengths of the ABC single glass component, enhancing its properties in terms of barrier, moisture resistance, and fire retardance.
Image: Dave Tacon/pv magazine
Its 54-cell distributed modules deliver power output ranging from 445W to 465W at an efficiency of 23.6% and 23.8%. The 72-cell modules for ground-mounted applications can deliver up to 620W at an efficiency rating of between 23.8% and 24%. ‘
The modules come with a 25-year product quality and 30-year power quality warranty, with an annual degradation rate of less than 1% in the first year and less than 0.35% in years two to 30.
Speaking to pv magazine Australia, AIKO Director of Digital Energy Products Yao Lu said the company’s high-efficiency modules were a result of its commitment to innovation. The company currently has a 2,300-strong R&D team, and invests around 3% of its annual revenue in R&D.
While there is no indication yet around pricing, it is expected AIKO’s products will be at the higher-end of the market.
The appearance at All-Energy is part of a global expansion for AIKO, having established subsidiary companies this year in nine countries including Germany, the Netherlands, Italy, the United Kingdom, Singapore and Japan. 
In 2020, AIKO established the Solarlab Aiko Europe research institute in Germany, and currently partners with a number of other research organisations in Western Europe.
In addition to its foray in the Australian market AIKO said it plans to launch into the United States and North Africa, and continue to grow throughout Europe and the Asia-Pacific.
This content is protected by copyright and may not be reused. If you want to cooperate with us and would like to reuse some of our content, please contact: editors@pv-magazine.com."
https://www.pv-magazine-australia.com/2023/11/02/solar-module-prices-dive-to-record-low/,"FINANCE,MANUFACTURING,MARKETS,MODULES & UPSTREAM MANUFACTURING,CHINA,WORLD",PV MAGAZINE,"NOVEMBER 2, 2023",Solar module prices dive to record low,"From pv magazine Global
The Chinese Module Marker (CMM), the OPIS benchmark assessment for Mono PERC modules from China, and TOPCon module prices, declined this week by the same amount of USD 0.005 per Wp to ISD 0.140/wp and USD 0.147/wp respectively. With falling upstream prices and weak demand in China with its key export markets these are the lowest prices ever recorded, according to OPIS data.
Upstream prices across the supply chain in China continue to slide, weighing on module prices. China polysilicon prices extended losses by falling 3.33 yuan/kg, or 4.19%, to 76.17 yuan/kg this week. The wafer and cell segments saw prices fall for a third consecutive week, with Mono G12 cells seeing a 10.45% plummet to USD 0.0703/wp. Buyers and sellers of modules alike reported lower prices during OPIS’ weekly market survey. P-type modules are on the threshold of 1 yuan/W, while n-type modules are a little more than 0.10 yuan/W higher, a developer said.

Sentiment in China remains bearish. While domestic demand will come from fourth-quarter installations, this is typically a low-demand period, concurred multiple sources. As available land for projects is decreasing, demand will not be as high as hoped, one module manufacturer explained. Orders signed last quarter have been cancelled and buyers want to re-sign contracts at current low prices, another module manufacturer said. The supply picture is gloomy, too, as China’s module manufacturers are sitting on 1-2 months of inventory, according to one seller.
China’s key export markets continue to struggle, with inventories in the European distributed market so large that there’s “basically no need to replenish supply,” according to one source. Even with low prices, approvals for ground-mounted projects are slow and there is insufficient labor to set up projects, they said. Over in Latin America, Brazil’s market is also facing weakness. Brazil is “hoarding too much” inventory, a seller said.
Looking ahead, module prices are expected to continue falling as we reach the end of the year, OPIS learned during its weekly market survey. Many sources pointed to how the 1 yuan/W era has arrived already, with a recent major China procurement tender seeing P-type module bids of as low as 0.993 yuan/W. There is “brutal competition” coming, and “industry consolidation may see more momentum,” according to one solar market veteran.
OPIS, a Dow Jones company, provides energy prices, news, data, and analysis on gasoline, diesel, jet fuel, LPG/NGL, coal, metals, and chemicals, as well as renewable fuels and environmental commodities. It acquired pricing data assets from Singapore Solar Exchange in 2022 and now publishes the OPIS APAC Solar Weekly Report.
This content is protected by copyright and may not be reused. If you want to cooperate with us and would like to reuse some of our content, please contact: editors@pv-magazine.com."
