url,tag,author,updated_date,title,contents
https://www.pv-magazine.de/2022/01/20/pilotprojekt-mini-windraeder-und-photovoltaik-direkt-am-funkmast/,"HIGHLIGHTS DER WOCHE,INSTALLATION,DEUTSCHLAND,EUROPA",SANDRA ENKHARDT,20. JANUAR 2022,Pilotprojekt: Mini-Windräder und Photovoltaik direkt am Funkmast,"Existierende Infrastruktur für die Erzeugung von Ökostrom zu nutzen, wird angesichts der schwierigen Verfügbarkeit von Flächen für neue Photovoltaik- oder Windkraftanlagen zur Königsdisziplin. Einen sehr innovativen Ansatz treiben nun Vantage Towers und Mowea voran. Insgesamt 752 Mini-Windturbinen sollen an 52 Funkmasten installiert, die Vantage Towers in Deutschland betreibt. Der erzeugte Windstrom werde dabei direkt vor Ort am jeweiligen Funkmast verbraucht. Bei durchschnittlichen Windverhältnissen ließen sich so 100 Prozent des Bedarfs decken, teilten die Unternehmen mit.
Grundlage für das Pilotprojekt ist eine Vereinbarung einer strategischen Zusammenarbeit zwischen dem Berliner Windenergie-Start-up und dem führenden Funkmastbetreiber in Europa. Die erwartete Erzeugung der 752 Mikro-Windturbinen soll jährlich bei bis zu 650 Megawattstunden liegen. Der erzeugte Windstrom wird nicht ins Netz eingespeist, sondern dient dem Berieb der Mobilfunktechnik von Vodafone, wie es weiter hieß. Vodafone ist der größte Kunde von Vantage Towers.
Sofern alle benötigten Genehmigungen vorliegen, könne die Installation der Mini-Windräder von Mowea in der zweiten Hälfte 2022 beginnen. Die Systeme seien modular aufgebaut und ließen sich an den Energiebedarf der Funkmasten anpassen. Standardmäßig seien die Mikro-Windturbinen mit Kommunikationsschnittstellen für eine intelligente Fernwartung und -steuerung der Anlagen, einer verbesserten Effizienz durch einen Algorithmus, der die größtmögliche Leistung bestimmt, höhere Sicherheit durch integrierte Bremsen sowie nahtlose Anschlussmöglichkeiten an gängige Batterie- und Energiemanagementsysteme ausgestattet, so die Unternehmen. Dabei habe Mowea seine Technologie nach einem ersten Pilotprojekt im Dezember 2019 mit der HTW Saar weiterentwickelt, um sie für die Integration der Windkraft zu wappnen.
„Verläuft das Pilotprojekt erfolgreich, haben wir mit unseren europaweit über 82.000 Standorten noch viel Potenzial für einen Ausbau der Kooperation“, erklärte Vivek Badrinath, CEO der Vantage Towers AG. Als wesentlichen Vorteil der Mini-Windräder von Mowea sehen die Unternehmen, dass sie modular in verschiedenen Bauformen auch dort installiert werden, wo herkömmliche Windräder keinen Platz finden. Vantage Towers hofft auf die Unterstützung der Bauämter für die Genehmigung der Anlagen. „Mit der Installation unserer Mikrowindturbinen auf Vantage Towers Standorten tragen wir dazu bei, dass Funknetze mit vor Ort produziertem, grünem Strom aufgebaut und betrieben werden können. Und das potenziell bald quer durch ganz Europa“, ergänzt Till Naumann, CEO der Mowea-Windenergieanlagen GmbH.
Ein weiterer Vorteil der Mikro-Turbinen, sie lieferten auch nachts Strom. Allerdings setzt Vantage Towers auch auf Photovoltaik. An rund 90 Standorten der Funkmasten seien deutschlandweit bereits Solarmodule auf den Dächern der dazugehörigen Technikcontainer oder -gebäude installiert worden, wie das Unternehmen auf Nachfrage von pv magazine erklärte. Bei der Installation von acht Solarmodulen belaufe sich die Photovoltaik-Leistung an den Standorten auf jeweils 2,5 bis 2,6 Kilowatt. Der erzeugte Solarstrom werde nicht ins Netz eingespeist, sondern werde direkt vor Ort für den Betrieb der Funkmasten genutzt. Nach einer erfolgreichen Testphase plane Vantage Towers auch hierfür einen weiteren Ausbau.
Dieser Inhalt ist urheberrechtlich geschützt und darf nicht kopiert werden. Wenn Sie mit uns kooperieren und Inhalte von uns teilweise nutzen wollen, nehmen Sie bitte Kontakt auf: redaktion@pv-magazine.com."
https://www.pv-magazine.de/2022/01/20/forschung-fuer-leichte-und-sichere-lithium-ionen-batterien-fuer-luftfahrt-gestartet/,"SPEICHER,TECHNOLOGIE,DEUTSCHLAND",SANDRA ENKHARDT,20. JANUAR 2022,Forschung für leichte und sichere Lithium-Ionen-Batterien für Luftfahrt gestartet,"Ende vergangenen Jahres startete am Zentrum für Sonnenenergie- und Wasserstoff-Forschung Baden-Württemberg (ZSW) ein Projekt, was den Weg für elektrisches Fliegen ebnen soll. Dem Forschungskonsortium gehören drei weitere Industrieunternehmen an: der Materialhersteller Johnson Matthey Battery Materials GmbH, das Maschinenbauunternehmen Coperion GmbH und der Zellhersteller Varta AG. Letztere koordiniert das vom Bundesforschungsministerium bis Ende Oktober 2024 mit 1,6 Millionen Euro geförderte Projekt.
Es geht um die Entwicklung von leichten und sicheren Lithium-Ionen-Batterien, die künftig unter anderem in der Luftfahrt oder auch für andere mobile Anwendungen eingesetzt werden könnten. Die kostengünstigen Hochenergiebatterien sollten zudem möglich nur ressourcenschonende und umweltverträgliche Materialen enthalten. In dem Vorhaben sollen dazu neue Aktivmaterialien mit hoher spezifischer Energie und Sicherheit entwickelt werden sowie die Prozesse, um sie zu Batterieelektroden zu verarbeiten, wie das ZSW erklärte. Kritische und teure Materialien sollen substituiert werden, wobei sowohl Anode als auch Kathode wässrig prozessiert werden und ohne die schädlichen Lösungsmittel NMP auskommen. Die Forschungsergebnisse würden dann für die industrietaugliche Herstellung von Rundzellen genutzt.
„Ein wichtiges Projektziel wird sein, kobaltfreie Kathodenmaterialien durch die Entwicklung geeigneter Prozessbedingungen in zukünftigen Batterien zum Einsatz zu bringen“, erklärte Markus Hölzle, ZSW-Vorstandsmitglied und Leiter des Geschäftsbereichs Elektrochemische Energietechnologien in Ulm. „Auf der Anodenseite soll durch den Einsatz von Siliziumoxid der Energieinhalt deutlich erhöht werden. Neu ist auch, dass die Herstellung beider Elektroden wasserbasiert erfolgt, also ohne die Nutzung der heute üblichen, toxischen Lösungsmittel.“
Mittels einer bereits verfügbaren Zellchemie solle zudem die spezifische Energie der Batteriezellen um bis zu 20 Prozent erhöht werden. Gerechnet auf den Energiegehalt würde dies das Gewicht der Batterien deutlich verringern. Vier Maßnahmen hat das Konsortium vorgesehen, um dies zu erreichen. Erstens sei die Verwendung des intrinsisch sicheren Lithium-Mangan-Eisenphosphats (LMFP) an Stelle des etablierten Lithium-Eisenphosphats (LFP) als Kathodenmaterial geplant. Beide Materialien kämen ohne die kritischen Rohstoffe Nickel und Kobalt aus, allerdings sei der Energiegehalt mit LMFP höher. Darauf aufbauend soll die Flächenkapazität um 40 Prozent gegenüber einer LFP-Kathode erhöht werden. Die dritte Maßnahme sei, auf der Anodenseite das stetig knapper und teurer werdende Graphit durch das reichlich verfügbare Siliziumoxid (SiOx) zu ersetzen. Weil der Energieinhalt von SiOx deutlich höher ist als der von Graphit, kann man hiermit Gewicht und Volumen der Batterien einsparen, wie es vom ZSW hieß. Dazu soll das zur Beschichtung der Elektroden bisher fast ausschließlich verwendete, gefährliche Lösungsmittel NMP durch Wasser substituiert werden.
Die Weiterentwicklung der Technologie müsse dann in industrietaugliche Prozesse übersetzt werden. Dazu würden in dem Projekt die Anforderungen für die Herstellung der hochkapazitiven Anoden und Kathoden beim Mischen, Beschichten, Trocknen und Kalandrieren untersucht werden. Dazu werde unter anderem die Verfahrenstechnik der Extrusion als innovative, hocheffiziente Möglichkeit des kontinuierlichen Prozessierens erforscht. Auf dieses Basis sollen am Ende dicke Elektroden wasserbasiert in einem industrierelevanten Rolle-zu-Rolle-Prozess herstellbar und für die Verwendung in Rundzellen wickelbar sein.
Am ZSW in Ulm könnten die Prozesse auf einer eigenen Pilotlinie dann bei der Herstellung kleiner Laborbatterien erprobt und validiert werden. Parallel werden die Ergebnisse in die Produktion von gewickelten Knopfzellen und 21700-Rundzellen bei Varta einfließen.
Dieser Inhalt ist urheberrechtlich geschützt und darf nicht kopiert werden. Wenn Sie mit uns kooperieren und Inhalte von uns teilweise nutzen wollen, nehmen Sie bitte Kontakt auf: redaktion@pv-magazine.com."
