url,tag,author,updated_date,title,contents
https://www.pv-magazine.de/2022/01/20/green-city-in-finanzieller-schieflage/,"HIGHLIGHTS DER WOCHE,MÄRKTE,DEUTSCHLAND",PV MAGAZINE,20. JANUAR 2022,Green City in finanzieller Schieflage,"Mitte Dezember präsentierte die Münchener Green City Energy AG Anlegern ein unangenehmes, verfrühtes „Weihnachtsgeschenk“: In einer Pflichtveröffentlichung teilte das Münchner Unternehmen mit, im Jahr 2021 habe es mehr als die Hälfte des Grundkapitals verloren. Zugleich lud es für den heutigen Donnerstag zu einer außerordentlichen Hauptversammlung ein. Dort sprachen sich die Aktionäre nach Angaben von Green City Energy dagegen aus, die Vorstände für das Geschäftsjahr 2019 zu entlasten.
Betroffen sind aber nicht nur Aktionäre, sondern auch die Anleger der Gesellschaften Green City Energy Kraftwerkspark II GmbH & Co. KG, Green City Energy Kraftwerkspark III GmbH & Co. KG sowie der Green City Solarimpuls I GmbH & Co. KG, die jeweils börsennotierte Schuldverschreibungen emittiert haben. Green City Energy Kraftwerkspark II sei möglicherweise drohend zahlungsunfähig sowie möglicherweise überschuldet, hieß es in dem Schreiben. „Die Green City Energy Kraftwerkspark III GmbH & Co. KG und die Green City Energy Solarimpuls I GmbH & Co. KG könnten möglicherweise drohend zahlungsunfähig sowie möglicherweise überschuldet werden.“ Im Klartext: Den Anlegern könnte schlimmstenfalls ein Totalausfall drohen. Finanzexperten äußerten gegenüber pv magazine die Befürchtung, dass auch weitere Anlagemöglichkeiten der Gruppe betroffen sein könnten, bei denen die Veröffentlichungspflichten nicht so streng reguliert sind, wie bei den börsennotierten Wertpapieren.
Als Grund für die Situation führte das Unternehmen Verzögerungen bei Projekten, Wertberichtigungen bei Projektrechten und Rückstellungen sowie niedirgere Werthaltigkeit von Energieprojekten als bislang angenommen an. Ein Restrukturierungskonzept sollte mit der Beratungsgesellschaft Demps & Partner erarbeitet und den Aktionären auf der außerordentlichen Hauptversammlung vorgestellt werden.
Dort räumte der Vorstand nach Angaben der Schutzgemeinschaft der Kapitalanleger (SdK), die einen Vertreter vor Ort hatte, ein, dass zwar mit einem Investor exklusiv gesprochen werde, es aber zu Beginn der Hauptversammlung noch nicht – wie geplant – eine Vereinbarung gebe. Green City Energy bleibt vage und will nach eigenen Angaben ein Restrukturierungskonzept erst vorlegen, wenn die Gespräche weiter fortgeschritten sind. Tagesordnungspunkte, die ein bedingtes Kapital vorsahen, seien von der Tagesordnung gestrichen worden, da diese keine Aussicht auf Zustimmung gehabt hätten, erklärt SdK-Sprecher Daniel Bauer auf Anfrage von pv magazine. „Das heißt für uns, dass der Großaktionär, Green City e.V., einer Verwässerung seiner Anteile durch eine Kapitalerhöhung nicht zustimmen dürfte.“ Es scheine unterschiedliche Auffassung zum Sanierungskonzept zu geben. Innerhalb der AG müssen sich die Aktionäre einigen. Dort hält der Green City e.V. laut Internetseite 53,6 Prozent der Anteile, die Mitarbeiter vereinen weitere 11,1 Prozent auf sich.
Es scheint, dass es zahlreiche Baustellen auch aufgrund der komplexen Unternehmensstrukur gebe, sagt Bauer. „Der Vorstand wollte eine Insolvenz der Gesellschaft nicht ausschließen.“ Die Anlegerschutzgemeinschaft versuche derzeit, Anleger zu bündeln, um deren Interessen wahrzunehmen. „Aktuell läuft alles ohne Einbeziehung der Privatanleger, was eigentlich kein Zustand ist“, kritisiert Bauer und fordert nicht nur ein fundiertes Konzept für die Zukunft, sondern auch, die Vergangenheit aufzuarbeiten.
Dazu gehört auch, zu klären, seit wann die finanziellen Probleme im Unternehmen bekannt sind und ob es rechtzeitig darüber informiert hat. Erst vergangenes Frühjahr hatte es eine Anleihe mit einem Volumen von zehn Millionen Euro emittiert. In der zweiten Jahreshälfte 2021 folgten weitere fünf Millionen, nur wenige Monate, bevor Green City Energy die finanzielle Schieflage publik machte. „Der Verdacht der Insolvenzverschleppung liegt nahe“, sagt Ralph Veil, Rechtsanwalt in der auf Kapitalanlagerecht spezialisierten Kanzlei Mattil, der Anleger in der Sache vertritt.
Zuvor hatte Ende Januar 2021 Finanzvorstand Marcus Jentsch nach nicht mal einem Jahr im Amt das Unternehmen verlassen. Der ehemalige Finanzchef Frank Wolf übernahm kommissarisch, bis im September Heike von der Heyden den Posten übernahm. „Da sind die von Bord gegangen, die den Einblick haben“, sagt Veil.
Schon vor ein paar Jahren hatte Green City Energy Probleme. Damals bezogen sich diese allerdings lediglich auf eine Anlagemöglichkeit, den Kraftwerkspark I. Hier hatte sich das Unternehmen verkalkuliert und die versprochenen Renditen für ausgegebene Genussrechte nicht erwirtschaftet. Eigentlich sollten die Investoren ihr Geld zurückerhalten. pv magazine liegt allerdings die Aussage eines Anlegers vor, er habe weder auf telefonisches noch auf schriftliches Nachhaken eine Überweisung erhalten. Die schriftliche Anfrage sei nicht einmal beantwortet worden. Das Unternehmen wollte sich gegenüber pv magazine kurzfristig nicht äußern, sagte aber eine Prüfung bis Anfang kommender Woche zu.
Die Anleger sind verunsichert. „Wir haben viele Anrufe“, bestätigt Marcus Pfingsten, leitender Mitarbeiter in der Vermögensverwaltung bei der GLS-Bank, die die Anleihen der Kraftwerkspark II vertrieben hat. Weiter äußert sich die Bank derzeit nicht.
An der Börse war der Handel mit Anleihen aus dem Green-City-Umfeld vorübergehend ausgesetzt. Mittlerweile werden wieder Kurse gestellt, mit Abschlägen von teilweise deutlich mehr als 50 Prozent gegenüber den Kursen vom Dezember 2021. Die Aktien werden über eine hauseigene Handelsplattform gehandelt. Dort verlangen Verkäufer derzeit zwischen 18 und 26 Euro. Kaufangebote betragen jedoch lediglich 10,60 beziehungsweise 12,80 Euro.
In Finanzkreisen heißt es, die Aktionäre seien von einer Insolvenz stärker bedroht als andere Investoren. Aber auch die Eigentümer von Anleihen könnten durchaus Probleme bekommen, da die Green City Energy AG auch Schuldner von Beteiligungsgesellschaften sei.
Gegen Ende des Jahres hatte das österreichische Unternehmen mmw versucht, mit niedrigen Kaufangeboten Green-City-Wertpapiere zu erwerben. Bereits in der Vergangenheit versuchte das Unternehmen, Wertpapiere maroder Firmen günstig zu erwerben.
Für Rechtsanwalt Veil reiht sich Green City in die Gruppe zahlreicher weiterer Anbieter von Geldanlagen aus dem Bereich erneuerbare Energien wie UDI und Leonidas ein. „Wir sehen in diesem Bereich derzeit große Schwierigkeiten und viel Restrukturierungsbedarf“, sagt der Jurist. Auch Aufsichtsbehörden und Staatsanwälte beschäftigen sich mit den Fällen. Es gehe unter anderem um unerlaubtes Einlagengeschäft und Betrug. (Jochen Bettzieche)
Dieser Inhalt ist urheberrechtlich geschützt und darf nicht kopiert werden. Wenn Sie mit uns kooperieren und Inhalte von uns teilweise nutzen wollen, nehmen Sie bitte Kontakt auf: redaktion@pv-magazine.com."
https://www.pv-magazine.de/2022/01/20/rheinenergie-weist-unterlassungsbegehren-der-verbraucherzentrale-nrw-zurueck/,"HIGHLIGHTS DER WOCHE,MÄRKTE,DEUTSCHLAND",SANDRA ENKHARDT,20. JANUAR 2022,Rheinenergie weist Unterlassungsbegehren der Verbraucherzentrale NRW zurück,"In den vergangenen Monaten haben gleich mehrere Strom- und Gasanbieter werden den Turbulenzen an den Energiemärkten Insolvenz angemeldet. Deren Kunden rutschen dann automatisch in die Grundversorgung ihres örtlichen Versorgers und erfuhren oft erst von diesem überhaupt von der Einstellung der Lieferungen ihres bisherigen Versorgers. In einer Stichprobe ermittelte die Verbraucherzentrale NRW eine Benachteiligung der Neukunden und hohe Preisunterschiede zu den Bestandskunde in der Grundversorgung. Die Verbraucherschützer verschickten daraufhin Abmahnung an Rheinenergie, die Stadtwerke Gütersloh und die Wuppertaler WSW Energie & Wasser AG.
„Bei allem Verständnis für die nicht ganz einfache Situation der Grundversorger – so geht es nicht. Die Benachteiligung von Verbraucher, die ohne eigenes Verschulden in die Grundversorgung zurückfallen, ist rechtswidrig und widerspricht dem eigentlichen Schutzzweck der Grundversorgung“, unterstreicht Wolfgang Schuldzinski, Vorstand der Verbraucherzentrale NRW. „Wir werden daher mit allen juristischen Mitteln gegen diese Benachteiligung vorgehen, die nur auf Grundlage eines willkürlich festgelegten Stichtags erfolgt.“ Die Verbraucherzentrale NRW sieht in den überhöhten Preisen einen Fall für die Energiekartellbehörde im Land.
Rheinenergie reagierte am Donnerstag nun auf die Abmahnung und wies das Unterlassungsbegehren der Verbraucherschützer zurück. Es sei von der Rechtmäßigkeit der Preisspreizung für Neukunden überzeugt. „Die Landeskartellbehörden NRW und Niedersachsen haben sich zu abweichenden Preisen für Neukunden bereits im November geäußert und sehen diese bei nachvollziehbaren Gründen als rechtmäßig an“, sagte Rheinenergie-Vertriebsvorstand Achim Südmeier. „Wir kommen unserem gesetzlichen Auftrag vollumfänglich nach und fangen als Grundversorger diejenigen Kunden auf, die von ihren bisherigen Lieferanten im Stich gelassen worden sind.“
Die örtlichen Grundversorger müssten daher viel zusätzliche Neukunden versorgen und die Energie dazu an den Großhandelsmärkten beschaffen. Daher habe Rheinenergie die Preise für Neukunden vorübergehend und nur für wenige Tage stark angehoben. „Inzwischen konnte die Rheinenergie diese durch intensive Bemühungen bei der Energiebeschaffung und gleichlaufend mit den Beschaffungskosten wieder deutlich senken; außerdem gibt es ergänzende Wahltarife für die Kunden mit Preisgarantien von zwölf oder 24 Monaten“, so das Unternehmen. Vor diesem Hintergrund sei die Abmahnung durch die Verbraucherzentrale NRW nicht verständlich.
„Das von der Verbraucherzentrale kritisierte Vorgehen der Rheinenergie und der anderen Grundversorger sichert zugleich die Preisstabilität bei Hunderttausenden von Bestandskunden, zu denen genauso auch einkommensschwache Haushalte gehören, die häufig nur Zugang zu Grundversorgungstarifen im Markt bekommen. Diese Kunden müssten sonst die Mehrkosten der aktuellen Belieferung der Neukunden mitbezahlen. Die Bestandskunden sind aufgrund des Handelns der Rheinenergie bislang von den Verwerfungen auf dem Energiemarkt nicht erfasst worden“, hieß es weiter. Die Verbraucherschützer sollten sich daher mit dem Marktverhalten einzelner Billiganbieter auseinandersetzen.
Die Verbraucherzentrale NRW hatte die Abmahnungen auf Basis seiner Marktanalyse sowie der Rückmeldungen von Betroffenen verschickt. „Sie [Die betroffenen Kunden] sind geradezu verzweifelt über die immensen Gas- und Strompreise, die einige Energieanbieter für die Ersatzversorgung aufrufen“, so Schuldzinski. „Die Höhe der Abschlagszahlungen beträgt ein Vielfaches der bisherigen monatlichen Kosten. Das bringt gerade Haushalte mit weniger Einkommen in Bedrängnis.“ Die Marktanalyse hatte ergeben, dass 18 von 23 Anbietern einen Neukundentarif für die Strom-Grundversorgung eingeführt hatten, wobei die Neukunden durchschnittlich mehr als das Doppelte zahlen mussten. Bei drei Anbietern habe der Neukundenarbeitspreis sogar bei über 90 Cent pro Kilowattstunde gelegen.
Dieser Inhalt ist urheberrechtlich geschützt und darf nicht kopiert werden. Wenn Sie mit uns kooperieren und Inhalte von uns teilweise nutzen wollen, nehmen Sie bitte Kontakt auf: redaktion@pv-magazine.com."
https://www.pv-magazine.de/2022/01/20/fraunhofer-ise-topcon-vs-perc/,"HIGHLIGHTS DER WOCHE,TECHNOLOGIE,DEUTSCHLAND,GLOBAL",EMILIANO BELLINI,20. JANUAR 2022,Fraunhofer ISE: Topcon vs. PERC,"Forscher des deutschen Fraunhofer-Instituts für Solare Energiesysteme ISE haben in einer aktuellen Studie die Entwicklung der Topcon- und PERC-Technologie verglichen. Sie präsentieren dabei eine Reihe von kostenorientierten Strategien entwickelt, um die industrielle Verbreitung von Topcon-Solarmodulen zu beschleunigen.
„Die Aufrechterhaltung eines hohen Umwandlungswirkungsgrades in der Massenproduktion ist ein Schlüsselaspekt, um mit den modernsten PERC-Zellen in Bezug auf die Systemkosten und die Stromgestehungskosten konkurrieren zu können“, sagte der Mitautor der Studie, Bishal Kafle, dem pv magazine. „Die jüngsten Entwicklungen in der Anlagenforschung haben dazu geführt, dass der Abstand zwischen den Umwandlungswirkungsgraden von Topcon und PERC-Zellen immer größer wird. Dennoch ist ein Standardprozessablauf für industrielle Topcon-Zellen noch nicht etabliert.“
Dem Fraunhofer-ISE-Forscher zufolge ist zwar eine Senkung der Produktionskosten wichtig, aber die wirtschaftliche Tragfähigkeit von Topcon erfordert eine stabile Produktion rund um die Uhr mit einer Betriebszeit und Auslastung, die derjenigen der derzeitigen Produktionsanlagen für passivierte Emitter-Rückseitenkontakt-Zellen (PERC) entspricht. „Darüber hinaus erfordert eine Topcon-Zelle auf einem n-Typ-Substrat Silberkontakte auf beiden Seiten, so dass die Reduzierung des Silberverbrauchs ebenfalls ein wichtiger Aspekt für dieses Konzept bleibt, zumindest mittel- und langfristig“, erklärte Kafle weiter.
In der Studie „Topcon – Technology options for cost efficient industrial manufacturing“, die in der Zeitschrift „Solar Energy Materials and Solar Cells“ veröffentlicht wurde, erklärt das deutsche Forscherteam, dass die Prozesse und bestehenden Anlagen, die üblicherweise für die Herstellung von PERC-Zellen verwendet werden, leicht an die Topcon-Zellenproduktion angepasst werden können, indem zwei Prozessschritte hinzugefügt werden: die Bildung von Tunneloxid und die Abscheidung von intrinsischem/dotiertem Polysilizium.
„Die Eigenschaften dieser Schichten sind von entscheidender Bedeutung für die Gestaltung der nachfolgenden Zellverarbeitungsschritte, um die vom Topcon-Konzept versprochene hohe Leerlaufspannung (VOC) und einen niedrigen Serienwiderstand zu erreichen“, erklärten die Forscher. Sie wiesen darauf hin, dass die Integration von n-Typ-Substraten teurer ist als die ihrer p-Typ-Gegenstücke, da der Bor-Emitter-Diffusionsprozess teurer ist als der Phosphor-Diffusionsprozess, der normalerweise bei der Herstellung von PERC-Zellen verwendet wird.
In der Studie wird ein technischer Weg zur Verbesserung des Low Pressure Chemical Vapour Deposition (LPCVD)-Verfahrens aufgezeigt, das derzeit der Industriestandard für Topcon-Produkte ist. Es werden mögliche Alternativen zu diesem Verfahren auf der Grundlage der Verfügbarkeit industrieller Werkzeuge, der Prozesskompatibilität, der Verfügbarkeit aller für eine Cost of Ownership (COO)-Modellierung erforderlichen Prozessparameter, des schlanken Prozessablaufs und der erfolgreichen Demonstration der Prozessfunktionalität bewertet.
Das LPCVD-Verfahren wird vom Forschungsteam nach wie vor als gängiger Ansatz angesehen, da es eine gute Dickenverteilung entlang des Wafers, lochfreie Schichten mit guter Stufenbedeckung, die Verwendung relativ niedriger Abscheidungstemperaturen nahe 600 Grad Celsius, eine große Anzahl von Wafern pro Charge und die Möglichkeit der In-situ-Dotierung mit konstantem Dotierprofil gewährleistet. Allerdings hat die LPCVD-Anlage auch einen geringeren Durchsatz aufgrund einer deutlich längeren Prozessdauer als bei der Herstellung von PERC-Zellen, was zwangsläufig zu höheren Produktionskosten führt.
„Für die Prozessroute mit in-situ abgeschiedenen LPCVD a-/poly-Silizium-Schichten haben wir jedoch eine Möglichkeit identifiziert, die Hochtemperatur-Ausglühung und die Oxidation des Bor-Emitters in einem einzigen Schritt zu kombinieren, was diesen Ansatz im Vergleich zur Prozessroute mit ex-situ LPCVD a-/poly-Silizium-Schichten wirtschaftlich wettbewerbsfähig macht“, so die Forscher weiter.
Als Alternativen zur LPCVD wurden die plasmagestützte chemische Gasphasenabscheidung (PECVD) und die chemische Gasphasenabscheidung bei Atmosphärendruck (APCVD) in Betracht gezogen. Die Analyse ergab, dass zwischen den drei Technologien kein klarer Sieger ermittelt werden kann. „Es wurde festgestellt, dass die COO der a-Si-Beschichtung mit der Dicke der a-Silizium-Schicht deutlich abnimmt, wobei die Kostenreduktion interessanterweise weitgehend von der verwendeten Beschichtungstechnologie abhängt“, so die Forscher des Fraunhofer ISE. „Eine wesentlich stärkere COO-Reduktion für dünnere Schichten wird für die PECVD- und APCVD-Abscheidungstechnologien beobachtet, was vor allem mit den deutlich höheren a-Silizium-Abscheidungsraten im Vergleich zur LPCVD zusammenhängt.“
Die Wissenschaftler verglichen auch die Stromgestehungskosten (LCOE) für 5-Megawatt-Freiflächen-Photovoltaik-Anlagen, die auf der bifazialen PERC-Technologie und Topcon-Produkten mit LPCVD, PECVD und APCVD basieren. Die Analyse ergab, dass die Topcon-Technologien im Vergleich zu PERC 13,5 bis 18,6 Prozent höhere Gesamtkosten für Solarzellen und 3,6 bis 5,5 Prozent höhere Modulgesamtkosten aufweisen.
„Die zusätzlichen Kosten für Topcon-Module stehen hauptsächlich im Zusammenhang mit höheren CAPEX- und anlagenbezogenen Kosten für die Zellproduktionsanlage, deutlich höheren Kosten für Verbrauchsmaterialien bei der Zellverarbeitung aufgrund der zusätzlichen Prozessschritte, die im Vergleich zu einer PERC-Zelle erforderlich sind, und dem höheren Preis des n-Typ-Wafersubstrats im Vergleich zum p-Typ-Wafersubstrat von PERC“, betonten sie. „Auf LCOE-Ebene zeigen alle evaluierten Topcon-Konzepte unter monofazialer Betrachtung leicht niedrigere LCOE-Werte als die bifaziale p-PERC-Technologie, wobei ein Topcon-Zellenwirkungsgradvorteil von 0,5 Prozent gegenüber PERC mit 23,5 respektive 23,0 Prozent angenommen wird.“
Um PERC wirtschaftlich zu übertreffen, müssten nach konservativsten Annahmen das Topcon-Konzept einen Mindestwirkungsgradvorteil von 0,55 Prozent erreichen. „Für das Topcon-Konzept im günstigsten Fall ermöglicht ein um 0,4 Prozent höherer Zellwirkungsgrad gegenüber bifacialem p-PERC bereits eine kosteneffiziente Großserienfertigung von Topcon-Solarzellen“, so die Forscher des Fraunhofer ISE.
Dieser Inhalt ist urheberrechtlich geschützt und darf nicht kopiert werden. Wenn Sie mit uns kooperieren und Inhalte von uns teilweise nutzen wollen, nehmen Sie bitte Kontakt auf: redaktion@pv-magazine.com."
https://www.pv-magazine.de/2022/01/20/neuer-wechselrichter-von-fronius-soll-grosse-photovoltaik-anlagen-wirtschaftlicher-machen/,"TECHNOLOGIE,DEUTSCHLAND,EUROPA,ÖSTERREICH",SANDRA ENKHARDT,20. JANUAR 2022,Neuer Wechselrichter von Fronius soll große Photovoltaik-Anlagen wirtschaftlicher machen,"Gut ein halbes Jahr nach der Einführung des Fronius „Tauro ECO“ bietet der österreichische Hersteller nun den Wechselrichter Fronius „Tauro“ an. Er ist für gewerbliche und große Photovoltaik-Anlagen entwickelt worden, um diese wirtschaftlicher betreiben zu können. Fronius bietet den neuen Photovoltaik-Wechselrichter, der über 3 MPP-Tracker und sehr breiten Eingangsspannungsbereich zwischen 200 und 1000 Volt verfügt, in der Leistungsklasse von 50 Kilowatt an, wie es am Donnerstag hieß. Der maximale Eingangsstrom (DC) liegt bei 134 Ampere und der maximale Kurzschlussstrom bei 125 Ampere.*
Dies sei von Vorteil für die Auslegung anspruchsvoller Photovoltaik-Anlagen. Zudem sei er durch innovative Systemarchitektur besonders flexibel einsetzbar. Bei dem neuen Wechselrichter sorgen ein doppelwandiges Gehäuse und die aktive Kühlung für Langlebigkeit und Robustheit. Gleichzeitig erbringe er volle Leistung. Der Wechselrichter könne selbst im ungeschützten Außenbereich und bei direkter Sonneneinstrahlung ohne zusätzliche Schutzvorrichtung montiert werden, so Fronius weiter. Zudem sei es möglich, das Produkt auf einer Aufständerung oder flach am Boden liegend zu installieren.
Der große Gestaltungsspielraum wirkt sich Fronius zufolge auch positiv auf die Kosten aus. Zusätzliche Kostenoptimierung erfolge durch das sogenannte AC Daisy Chaining, wo  durch die Verkettung der Wechselrichter, der Bedarf an Zusatzkomponenten und Verkabelungen reduziert werde. Der Wechselrichter lasse sich schnell installieren, sei mit smarter Technik ausgestattet, die die Wartung effizienter mache. Im Schadensfall könne das betroffene Leistungsteil einfach vor Ort ausgetauscht werden. Die Überwachung und Steuerung könne dabei per Smartphone oder Desktop erfolgen, wobei auch die Installateure bei der Inbetriebnahme digital unterstützt würden. Komponenten von Drittanbietern könnten wegen der offenen Systemarchitektur einfach integriert werden.
„Kostenoptimierung, Langlebigkeit, Designflexibilität und effizienter Service – das macht unsere ´Fronius Tauro`-Commercial-Wechselrichter aus“, erklärte Martin Hackl, Global Director der Business Unit Solar Energy, Fronius International GmbH. Die betrieblichen Gesamtsystemkosten seien minimal und machten große Photovoltaik-Anlagen damit noch wirtschaftlicher.
Ende Mai 2021 hatte Fronius die neuen Wechselrichter der „Tauro“-Serie – die unter dem Motto „design to perform“ beworben werden – bereits vorgestellt. Der Fronius „Tauro Eco“ mit einem MPP-Tracker ist bereits seit Juni verfügbar. Das Produkt Fronius „Tauro“ sollte im September folgen, was sich nun etwas verzögerte.
*Anmerkung der Redaktion: Der Artikel ist nachträglich am 24.1.2022 korrigiert worden. Fronius stellte klar, dass das Modell „Tauro“ nur in der Leistungsklasse mit 50 Kilowatt verfügbar ist, während das Modell „Tauro Eco“ in den Klassen 50, 99,99 und 100 Kilowatt mit einem MPP-Tracker erhältlich ist. Zudem sind die Eingangs- und Kurzschlussstromwerte angepasst worden
Dieser Inhalt ist urheberrechtlich geschützt und darf nicht kopiert werden. Wenn Sie mit uns kooperieren und Inhalte von uns teilweise nutzen wollen, nehmen Sie bitte Kontakt auf: redaktion@pv-magazine.com."
