url,tag,author,updated_date,title,contents
https://www.pv-magazine.fr/2022/04/08/voltalia-va-construire-une-centrale-flottante-de-33-mw-au-portugal/,"APPEL D'OFFRES,FINANCE,LÉGAL,MARCHÉS,PV À GRANDE ÉCHELLE,PV FLOTTANT,PORTUGAL",MARIE BEYER,"AVRIL 8, 2022",Voltalia va construire une centrale flottante de 33 MW au Portugal,"Voltalia est lauréat du récent appel d’offres du Ministère de l’Energie et de l’Environnement du Portugal. Le groupe français vient en effet d’annoncer qu’il va installer une centrale flottante de 33 MW près du barrage de Cabril, à Sertã, une commune située dans le centre du pays. Le communiqué relatif à l’opération précise que la capacité de l’installation pourrait atteindre jusqu’à 40 MWc selon l’optimisation.
Voltalia sera en charge de développemer, de construire et d’exploiter la centrale solaire qui s’étendra sur quelque 33 hectares. La production électrique devrait couvrir les besoins d’environ 70 300 personnes et sera rachetée dans le cadre d’un contrat de 15 ans attribué par le Ministère de l’Energie et de l’Environnement et qui prévoit un tarif de 41,025 euros par mégawattheure.
« Nous sommes impatients de construire notre première centrale solaire flottante. Cette expérience créera de nouvelles opportunités dans ce domaine dans d’autres pays où Voltalia est présent », a déclaré Sébastien Clerc, le directeur général de l’entreprise.
Ce contenu est protégé par un copyright et vous ne pouvez pas le réutiliser sans permission. Si vous souhaitez collaborer avec nous et réutiliser notre contenu, merci de contacter notre équipe éditoriale à l’adresse suivante: editors@pv-magazine.com."
https://www.pv-magazine.fr/2022/04/08/speciale-presidentielle-2022-le-programme-deric-zemmour-dans-les-enr-et-le-solaire/,"DÉVELOPPEMENT DURABLE,FOURNITURE D'ÉLECTRICITÉ,HYDROGÈNE,MARCHÉS,MARCHÉS ET STRATÉGIES,POLITIQUE,FRANCE",MARIE BEYER,"AVRIL 8, 2022",[Spéciale présidentielle 2022] Le programme d’Eric Zemmour dans les EnR et le solaire,"
Dans le programme présenté par Eric Zemmour, le volet énergie est principalement axé autour du nucléaire. Le candidat entend « revenir à une politique énergétique rationnelle fondée sur le nucléaire » et relancer la filière « qui doit demeurer le socle de notre approvisionnement en électricité ». Toutes les mesures destinées à baisser la part nucléaire dans le mix électrique seront donc abrogées et le parc actuel sera renouvelé via un programme visant à construire au moins 14 nouveaux réacteurs d’ici 2050. Il sera également question de relancer la recherche dans le secteur et de mettre en place un tarif régulé pour l’électricité nucléaire – qui viendrait en remplacement du dispositif ARENH (Accès Régulé à l’Electricité Nucléaire Historique), qui permet actuellement aux fournisseurs de s’approvisionner en électricité auprès d’EDF dans des conditions régulées.
Ce faisant, le programme d’Eric Zemmour ne prévoit pas de développement volontariste des énergies renouvelables. Le solaire n’est pas évoqué et l’éolien est rejeté puisque tous les projets actuel et futurs seront abandonnés. Le candidat prévoit seulement d’investir dans les installations hydroélectriques, « notre première source d’énergie renouvelable », et d’empêcher l’ouverture des barrages hydroélectriques à la concurrence.
En solutions énergétiques alternatives, le candidat mise notamment sur la géothermie, le bois-énergie et les technologies décarbonnées pour les transports (véhicules électriques, piles à combustible, biocarburants et carburants de synthèse). Le programme entend aussi favoriser le déploiement de la filière hydrogène mais manque de proposer des plans de recherche et d’innovation adéquats et de présenter les modalités de mise en œuvre d’une telle intégration technologique.
La décarbonation industrielle et la réduction de l’utilisation des énergies fossiles ne sont pas mentionnées, même si la relocalisation de l’industrie prévue devrait afficher, à terme un meilleur bilan carbone. Le programme annonce un investissement dans l’isolation des bâtiments sans toutefois préciser ni le rythme des rénovations ni le budget qui leurs sera alloué.
Ce contenu est protégé par un copyright et vous ne pouvez pas le réutiliser sans permission. Si vous souhaitez collaborer avec nous et réutiliser notre contenu, merci de contacter notre équipe éditoriale à l’adresse suivante: editors@pv-magazine.com."
https://www.pv-magazine.fr/2022/04/08/speciale-presidentielle-2022-le-programme-de-philippe-pouton-dans-les-enr-et-le-solaire/,"DÉVELOPPEMENT DURABLE,FOURNITURE D'ÉLECTRICITÉ,INNOVATION,POLITIQUE,FRANCE",MARIE BEYER,"AVRIL 8, 2022",[Spéciale présidentielle 2022] Le programme de Philippe Poutou dans les EnR et le solaire,"
Philippe Poutou présente un programme axé sur l’urgence sociale et écologique. Partant du principe qu’il ne peut pas y avoir de progrès social sans respect de l’environnement (et inversement), le candidat propose une politique écosocialiste contre le productivisme et contre le capitalisme, qui est inconciliable avec l’écologie.
Le programme du Nouveau Parti Anticapitaliste (NPA) fait des propositions pour planifier, centraliser et internationaliser la transition écologique. Pour mettre en place les mesures sociales et environnementales d’urgence, il s’agira dans un premier temps d’ « exproprier et socialiser l’énergie et la finance, sous le contrôle des salarié.e.s et de la population, pour empêcher les multinationales de brûler tout le pétrole et le gaz de la planète, et mettre fin aux investissements dans les projets polluants. »
L’expropriation évoquée prendra la forme d’une nationalisation des grands groupes français de l’énergie (EDF, Engie, Veolia, Total, …) pour créer des services publics de l’énergie et d’une réquisition des banques privées pour orienter les investissements et le crédit vers des projets écologiques. Les transports seront également abordés en tant que service public avec une orientation vers le ferroviaire.
Concrètement et en France, le candidat veut sortir des énergies fossiles et du nucléaire d’ici dix ans en développant les énergies renouvelables, en favorisant la sobriété énergétique (qui prévoit l’« isolement de tous les logements ») et en socialisant le secteur de l’énergie. Sont également prévus, l’arrêt et la reconversion des industries polluantes et des « productions inutiles » (armement, publicité) tout comme la réduction du transport aérien.
Le programme du NPA ne précise toutefois pas les modalités ou les objectifs du développement EnR, même s’il est précisé que l’artificialisation des terres sera prohibée et limitée à 10 % du territoire. Par ailleurs, le candidat n’évoque pas l’électrification et l’efficacité énergétique des véhicules qui pourrait être un levier important dans la décarbonation des transports. L’un dans l’autre, l’agenda proposé semble optimiste au regard des différents scénarios explorés par RTE. Cependant, la nature révolutionnaire du programme et les changements profonds que sa mise en place implique pourraient jouer en la faveur de ces objectifs ambitieux.
Ce contenu est protégé par un copyright et vous ne pouvez pas le réutiliser sans permission. Si vous souhaitez collaborer avec nous et réutiliser notre contenu, merci de contacter notre équipe éditoriale à l’adresse suivante: editors@pv-magazine.com."
https://www.pv-magazine.fr/2022/04/08/enphase-energy-veut-augmenter-sa-capacite-de-production-en-europe/,"ONDULEURS,STOCKAGE D'ÉNERGIE,EUROPE",GWÉNAËLLE DEBOUTTE,"AVRIL 8, 2022",Enphase Energy veut augmenter sa capacité de production en Europe,"Enphase Energy, fournisseur au monde de systèmes solaires et de batteries à base de micro-onduleurs, annonce qu’à partir du premier trimestre 2023, l’usine de son partenaire roumain Flex à Timisoara, en Roumanie, fabriquera des micro-onduleurs Enphase pour le marché européen.
Cette augmentation de capacité, dont l’ampleur n’a pas été précisée, permettra à la société californienne de répondre à la croissance rapide de la demande de solaire résidentiel en Europe, qui s’explique en partie selon elle par la hausse des prix de l’énergie et l’adoption accrue des véhicules électriques et des pompes à chaleur par les populations.
Le nouveau site de fabrication en Roumanie permettra donc d’améliorer les délais de livraison à ses clients en Europe. « Les décideurs politiques fixent de nouveaux objectifs ambitieux pour aider à accélérer la transition vers un avenir plus électrifié, et nous prévoyons de contribuer à répondre à la demande croissante avec nos principales solutions de micro-onduleurs et de batteries », a souligné Badri Kothandaraman, président et PDG d’Enphase Energy.
Ce contenu est protégé par un copyright et vous ne pouvez pas le réutiliser sans permission. Si vous souhaitez collaborer avec nous et réutiliser notre contenu, merci de contacter notre équipe éditoriale à l’adresse suivante: editors@pv-magazine.com."
https://www.pv-magazine.fr/2022/04/08/speciale-presidentielle-2022-le-programme-de-jean-lassalle-dans-les-enr-et-le-solaire/,"BILAN CARBONE,DÉVELOPPEMENT DURABLE,FOURNITURE D'ÉLECTRICITÉ,HYDROGÈNE,POLITIQUE,PV AU SOL,PV COMMERCIAL ET INDUSTRIEL,PV EN TOITURE,FRANCE",GWÉNAËLLE DEBOUTTE,"AVRIL 8, 2022",[Spéciale présidentielle 2022] Le programme de Jean Lassalle dans les EnR et le solaire,"Si Jean Lassalle estime dans son programme que le futur mix énergétique doit « miser sur les énergies renouvelables », il pose des conditions. Pour commencer, il veut mettre fin à l’éolien. « Il convient dès à présent d’interdire les projets éoliens non validés par les maires, après consultation des habitants », écrit le candidat de la ruralité. Pour le solaire photovoltaïque, s’il convient qu’il faut « développer l’énergie solaire (production et stockage) », sans fixer d’objectifs de capacités supplémentaires, il estime que la recherche fondamentale sur l’énergie photovoltaïque doit aussi vérifier sa viabilité et sa rentabilité. Selon lui, il faut donc se focaliser sur l’énergie de la mer (houle, écart thermique entre la surface et les grands fonds… ), « la puissance de la houle représentant cinq fois l’énergie produite par l’homme ». Ces technologies sont cependant encore peu matures.
L’autre pillier de sa politique énergétique repose sur le nucléaire. Le candidat de Résistons ! prône le prolongement de 25 ans des centrales nucléaires en fin de vie et veut investir directement dans les centrales de quatrième génération, « plus sûres et moins chères » et dans l’énergie de demain avec la fusion (projet ITER de Cadarache).
Or, selon la Stratégie nationale bas carbone (SNBC) du ministère de la Transition écologique, sur les 56 réacteurs en activité en France, 36 auront dépassé l’âge de 60 ans en dans 25 ans, soit en 2047. Selon les expertises, la possibilité de dépassement d’un âge de 60 ans ne pourra concerner que quelques réacteurs et est dans tous les cas très incertaine. Ainsi, le scénario de référence de RTE retient une fermeture progressive des réacteurs entre 50 et 60 ans de durée de fonctionnement, qui ne laissera à horizon 2050 que 16 GW de capacité nucléaire. Toujours selon le scénario de référence, cette capacité décarbonée représenterait 13-14% de la production électrique annuelle totale. Sans volonté affichée d’un très fort développement des ENR, la France sera en déficit électrique fort.
Enfin, Jean Lassalle veut redonner à l’État l’initiative dans les secteurs clefs de l’économie : agriculture, industrie, énergies nouvelles, automobile, aéronautique, routes, recherche spatiale… Cela passera pour lui par un achat des entreprises sensibles et stratégiques par la BPI (Banque Publique d’Investissement). De plus, un certain nombre de « re-nationalisations » s’imposent, par exemple : EDF, les autoroutes de France et les entreprises liées à la Défense nationale.
Ce contenu est protégé par un copyright et vous ne pouvez pas le réutiliser sans permission. Si vous souhaitez collaborer avec nous et réutiliser notre contenu, merci de contacter notre équipe éditoriale à l’adresse suivante: editors@pv-magazine.com."
https://www.pv-magazine.fr/2022/04/08/stockage-lithium-ion-un-developpement-indispensable-pour-lessor-des-renouvelables/,"HYDROGÈNE,INDICE DE PRIX,INNOVATION,MARCHÉS,OPINION ET ANALYSE,POLITIQUE,PV À GRANDE ÉCHELLE,RÉSEAUX ET INTÉGRATION,STOCKAGE D'ÉNERGIE,SYSTÈMES DE GESTION D'ÉNERGIE,TECHNOLOGIE ET R&D,EUROPE,FRANCE",,"AVRIL 8, 2022",Stockage lithium-ion : un développement indispensable pour l’essor des renouvelables,"Le 10 février dernier, le président Macron annonçait à Belfort, sa vision de la trajectoire énergétique globale française à horizon 2050. En complément de la relance de la filière nucléaire française, qui a déjà fait les gros titres depuis, le Président y réaffirmait son souhait de développer massivement le renouvelable, « seul moyen de répondre [aux besoins énergétiques] immédiats [de façon] rentable et compétitive », en s’appuyant principalement sur les sources intermittentes. D’ici 2050, la puissance du parc solaire français devrait être multipliée par plus de 10, pour dépasser 100 GWc, alors que la capacité éolienne terrestre pourrait doubler pour atteindre 37 GW sur cette même période. L’éolien en mer devrait également connaître un vrai décollage puisque la France ambitionne de développer et construire 40 GW avant 2050.
Depuis Belfort, l’invasion de l’Ukraine et la pluie de sanctions internationales qui s’est abattue sur la Russie n’ont fait qu’accentuer la nécessité pour la France, et plus largement l’Europe, d’œuvrer vers davantage d’autonomie et de sobriété énergétique. Le 8 mars, la Commission européenne dévoilait son plan, baptisé REPowerEU, pour tenter de mettre un terme aux importations de gaz et pétrole russes. L’un des 4 axes principaux de ce plan repose, là encore, sur le développement des énergies renouvelables.
L’inévitable pénétration des énergies renouvelables intermittentes dans le mix électrique européen pose aujourd’hui un défi majeur et grandissant quant à la stabilité du réseau. En Europe, le développement des énergies renouvelables s’opère à une vitesse bien supérieure à la croissance de la consommation électrique – en France, cette dernière n’augmente d’ailleurs plus depuis les années 2005-2010. L’émergence des renouvelables pénalise doublement les filières électriques conventionnelles pilotables – désignant communément les centrales gaz, pétrole et charbon (le nucléaire n’étant pilotable que sur des temps longs car inertiel) :
Le développement de l’éolien et du solaire s’est donc d’abord fait au détriment d’autres énergies qui étaient pilotables. Les gestionnaires de réseaux européens, chargés d’assurer à tout instant et tout au long de l’année l’équilibre offre-demande, jonglent désormais entre d’un côté, une consommation électrique variable ponctuée par des pointes de consommation électrique en période de canicule et de grand froid hivernal et de l’autre, des moyens de production électrique de plus en plus intermittents, donc de moins en moins prévisibles.

A plus long terme, les réseaux électriques vont devoir innover pour s’équiper de ressources de flexibilité, afin de maitriser et moduler cette production électrique intermittente grandissante. Demander aux centrales pilotables d’assurer la stabilité du réseau, comme cela est le cas aujourd’hui, n’apparait peut-être pas comme la meilleure option. Beaucoup de solutions alternatives, complémentaires entre elles, semblent aujourd’hui plus adaptées pour cette fourniture de services de flexibilité. L’adaptation des comportements de consommation électrique avec l’effacement et la sobriété énergétique est une première solution évidente ; mais l’innovation technologique avec le stockage d’électricité (batteries lithium-ion, power-to-gas hydrogène etc.) en est une également. Chaque technologie de stockage dispose d’un cas d’utilisation bien précis, principalement défini par sa rapidité d’activation ainsi que son temps de charge (ou de décharge). Dans ce paysage, le stockage avec batteries lithium-ion se distingue comme la technologie la plus mature pour répondre aux besoins à très courte échéance du réseau électrique. Ces actifs ont la particularité d’être activables en moins de 15 secondes par l’opérateur du réseau mais limités par un temps de charge, le plus souvent d’une heure ou deux (et allant jusqu’à 4 heures). Ils peuvent donc répondre très rapidement aux déséquilibres ponctuels du réseau, à la hausse comme à la baisse de fréquence, en stockant momentanément ou en injectant de l’électricité. Le temps de charge relativement court des batteries lithium les rend cependant inadaptés pour répondre aux déséquilibres sur des temps longs, été-hiver par exemple, où d’autres technologies comme les Stations de Transfert d’Energie par Pompage (STEP) ou le stockage hydrogène seront plus adaptées.
En France, la mise en place de ces nouvelles ressources de flexibilité s’accompagne par l’ouverture de nouveaux marchés pour rémunérer leurs services. Aujourd’hui, les projections de variations de prix de prix de l’électricité intraday à long-terme rendent improbable la bonne rentabilité des actifs lithium-ion seulement sur la base d’une stratégie d’arbitrage/achat-vente d’électrons sur le marché spot : l’actif achète et stocke de l’électricité lorsque son prix sur le marché est faible – au milieu de la journée lorsque le soleil bat son plein par exemple – puis la revend et l’injecte sur le réseau quand son prix remonte – comme le soir lors du pic de consommation des foyers au retour du travail.
Image : Finergreen
En France, deux marchés alternatifs permettent aujourd’hui au stockage lithium-ion d’être davantage rémunéré : le marché de capacité et la régulation de fréquence.
Image : Finergreen
Graphique : Finergreen
Au-delà de ces marchés déjà existants, la tendance est à la multiplication des sources de rémunération pour le stockage lithium-ion, à l’image de l’ouverture européenne de la réserve secondaire/aFRR à cette classe d’actifs (projet PICASSO), des appels d’offres expérimentaux  flexibilités en cours de mise en place par RTE ainsi que des appels d’offres territoriaux proposés par Enedis en France, les deux derniers visant à apporter une solution locale pour décongestionner les nœuds d’inflexibilité du réseau (bien que l’applicabilité aux batteries des appels d’offres territoriaux d’Enedis reste en l’état incertaine).
Malgré leur nombre, ces nouveaux marchés restent très volatiles et difficilement lisibles pour une classe d’actifs infrastructure de long terme. Contrairement aux projets d’électricité renouvelables qui se rémunèrent via un contrat d’achat d’électricité, souvent au prix fixe convenu à l’avance, les actifs de stockage lithium-ion en France sont soumis à des risques de marché importants : la tarification des services de flexibilité découle systématiquement d’une logique d’équilibre offre-demande. Que ce soit par l’intermédiaire des marché spots de l’électricité ou par l’organisation d’appel d’offres annuels ou quotidiens, les différentes sources de chiffre d’affaires de ces actifs sont, par essence, volatiles et difficilement prévisibles à long terme.
Cette volatilité a grandement ralenti la financiarisation de cette classe d’actifs par l’univers des grands prêteurs long terme de la transition énergétique française, freinés par ces risques de marché importants. En 2019, RTE apportait une première réponse au problème en organisant la première vague d’appels d’offres de long terme (AOLT), censée offrir de la visibilité aux opérateurs d’effacement et de stockage sur le marché des capacités en garantissant un prix fixé à l’avance pendant 7 ans. Bien qu’allant dans le bon sens, l’introduction de ces nouveaux appels d’offres ne répondait que partiellement au besoin de prédictibilité des prêteurs, le marché des capacités dépassant rarement 25% de l’assiette totale du chiffre d’affaires d’un projet de stockage lithium-ion.

Dans ce contexte, les développeurs qui souhaitent rapidement se positionner sur le marché de la flexibilité lithium-ion sont contraints d’assumer des choix forts :
Le besoin de flexibilité du réseau est aujourd’hui une vraie problématique, pour laquelle les réponses sont multiples. Parmi celles-ci, les batteries lithium-ion constituent une des solutions adaptées aux déséquilibres de court-terme pour assurer la stabilité structurelle du réseau. Le décollage de la filière française lithium-ion, pressenti depuis quelques années déjà, semble ralenti par le manque de visibilité sur les rentabilités des différents marchés de flexibilité. Avec la multiplication du nombre de projets et d’acteurs impliqués et la maturation des différents marchés de la flexibilité, la filière lithium-ion devrait continuer de se développer et se structurer de sorte à offrir un cadre de référence adapté à l’intervention des tiers-financeurs. Tous les intérêts semblent alignés en ce sens : les développeurs et les prêteurs y trouveraient un relai de croissance là où le gestionnaire du réseau diminuerait ses coûts d’équilibrage.

The views and opinions expressed in this article are the author’s own, and do not necessarily reflect those held by pv magazine.
Ce contenu est protégé par un copyright et vous ne pouvez pas le réutiliser sans permission. Si vous souhaitez collaborer avec nous et réutiliser notre contenu, merci de contacter notre équipe éditoriale à l’adresse suivante: editors@pv-magazine.com."
