,News_Url,News_tags,News_author,Released_Date,News_Title,News_Contents,News_Image,News_Nationality
6,https://www.pv-magazine-australia.com/2024/03/08/rec-launches-430-w-heterojunction-solar-module-with-22-2-efficiency/,"COMMERCIAL & INDUSTRIAL PV,MANUFACTURING,MODULES & UPSTREAM MANUFACTURING,RESIDENTIAL PV,AUSTRALIA,SINGAPORE",EMILIANO BELLINI,2024-03-08,REC launches 430 W heterojunction solar module with 22.2% efficiency,"Singapore-based PV module manufacturer REC has developed residential solar modules based on its Alpha heterojunction cell technology.
“Production has started at REC’s Industry 4.0 fab in Singapore and first shipments will reach the US market in May 2024,” the company said in a statement released.
The REC Alpha Pure-2 Series is available in four versions, with power ratings ranging from 400 W to 430 W, and efficiencies of 20.6% to 22.2%. They are made with 132 heterojunction, half-cut monocrystalline solar cells and have a maximum system voltage of 1,000 V.
The solar modules have open-circuit voltages ranging between 48.5 V and 49.3 V, along with short-circuit currents ranging from 10.60 A to 10.81 A. All four versions of the solar modules share dimensions of 2,237 mm × 1,246 mm × 30 mm and a weight of 21.7 kg.
These panels can operate within a temperature range of -40 C to 85 C and exhibit an operating temperature coefficient of -0.24% per degree Celsius. They feature a 4 mm solar glass with anti-reflective treatment, an IP68-rated junction box, and an anodized aluminum frame.
The manufacturer provides a 20-year linear power output guarantee and a 25-year product guarantee. Additionally, the module series qualifies for the premium REC ProTrust warranty package, offering up to 25 years of coverage for product, performance, and labor, with a guaranteed power output of at least 92% in the 25th year.
This content is protected by copyright and may not be reused. If you want to cooperate with us and would like to reuse some of our content, please contact: editors@pv-magazine.com.",https://www.pv-magazine-australia.com/wp-content/uploads/sites/9/2024/03/REC20Alpha20Pure202_HJT20cell-280x280.jpg,au
7,https://www.pv-magazine-australia.com/2024/03/08/redback-technologies-goes-into-voluntary-administration/,"FINANCE,LEGAL,AUSTRALIA,QUEENSLAND",BELLA PEACOCK,2024-03-08,Redback Technologies goes into voluntary administration,"Brisbane-based inverter and battery company Redback Technologies has entered voluntary administration and is now actively seeking new investment.
McGrathNicol Restructuring has been appointed as voluntary administrators of Redback Operations Pty Ltd, with McGrathNicol confirming partners Anthony Connelly, Mark Holland and Jamie Harris were appointed on March 5, 2024.
The administrators said they are working with Redback Operations’ employees, customers and suppliers while they “call for expressions of interest for the sale or recapitalisation of all or part of the business.”
Redback Technologies was exhibiting in Sydney’s Smart Energy Expo this week. It has a range of new products expected to hit the market in the next eight to 12 months, including its next generation hybrid battery system, for which commercial shipments are slated for June.

The company was also previewing its latest hybrid 3-phase inverter, which it hopes to launch late this year or early next.
“We firmly believe there is a place in the market for Australian-engineered products,” Aaron Moreton, the company’s Head of Sales and Partnerships, told pv magazine Australia.
Redback Technologies exclusively distributes through electrical wholesalers, meaning warranties on its products will be honoured should it fail to secure adequate investment. Its distributors include Greentech, Krannich, Rexel, Solar Plus Solutions (SPS), Middy’s Electrical and others.
Pylontech, which supplied the battery technology used in its latest hybrid battery product, will also honour warranties.
Redback’s installer and distribution channels have been alerted.
This content is protected by copyright and may not be reused. If you want to cooperate with us and would like to reuse some of our content, please contact: editors@pv-magazine.com.",https://www.pv-magazine-australia.com/wp-content/uploads/sites/9/2023/10/10252023_DTacon_All_Energy-_AUS_Redback-6-280x280.jpg,au
