url,tag,author,updated_date,title,contents
https://www.pv-magazine.com/2021/10/26/four-winning-bidders-in-indias-gigawatt-scale-solar-manufacturing-tender/,"HIGHLIGHTS,MARKETS,MODULES & UPSTREAM MANUFACTURING,TECHNOLOGY AND R&D,INDIA",UMA GUPTA,"OCTOBER 26, 2021",Four winning bidders in India’s gigawatt-scale solar manufacturing tender,"From pv magazine India
The Indian government’s INR4500-crore ($599 million) production-linked incentive scheme, to support the gigawatt-scale manufacturing of high-efficiency solar modules, has concluded, with at least four players emerging as beneficiaries.
Jindal India Solar Energy, owned by Jindal Polyfilms, made the most competitive bid by seeking the lowest production-linked incentive support for 4 GW of fully integrated module manufacturing capacity. Data from trade body the National Solar Federation of India, seen by pv magazine, indicated Jindal has applied for INR1390 crore ($185 million) of support.
Transformer manufacturer and installer Shirdi Sai Electricals (with a bid for INR1875 crore [$250 million] of incentives), the Reliance New Energy Solar business of conglomerate Reliance Industries (INR1917 crore [$255 million]), and the infrastructure unit of fellow multinational Adani (INR3600 crore [$479 million]) were the other successful bidders. The auction took into account the level of assistance sought, planned solar manufacturing capacity and whether manufacturers planned to produce polysilicon and solar ingots, wafers and cells, as well as assembling modules.
All four successful bidders sought incentives for the maximum eligible annual manufacturing capacity of 4 GW and pledged the full extent of integrated manufacturing, from poly to panels.
Under the manufacturing-linked tender rules, however, bidders will only receive support for half of the production capacity they are planning, capped at 2 GW. That would imply the four successful bidders will each receive half of the financial support they have applied for, for a total public spend of INR4391 crore ($585 million).
This content is protected by copyright and may not be reused. If you want to cooperate with us and would like to reuse some of our content, please contact: editors@pv-magazine.com."
https://www.pv-magazine.com/2021/10/26/russia-launches-major-solar-plant-in-siberia/,"MARKETS,MARKETS & POLICY,POLICY,UTILITY SCALE PV,RUSSIA",PV MAGAZINE,"OCTOBER 26, 2021",Russia launches major solar plant in Siberia,"Russian PV manufacturer Hevel has almost completed construction of its 30 MW Russko-Polyanskaya solar plant in Western Siberia, the government of the Omsk region has announced.
The solar field is expected to generate 35.5 GWh, enough to power 3,000 rural houses, the local government estimated. The RUB2.8 billion ($40 million) plant is slated to become operational on December 10.
Russko-Polyanskaya, not far from the border with Kazakhstan, will become the third solar plant in the Omsk Oblast, a warm part of Siberia with around 300 sunny days per year. The area is sparsely populated and is lacking infrastructure and power generation facilities. Most of the electricity in that part of Russia is generated by thermal power plants.
Pick up your copy of the latest edition of pv magazine for an in-depth look at the fire hazard concern of lithium-ion battery systems, with a focus on the blaze at Australia’s Victorian Big Battery which caught the world’s attention. Also, Saul Griffith, the guru of electrification, talks to pv magazine about reshaping the climate conversation; we delve into the evolution of residential PV in China; and we continue our coverage of global PV supply-chain issues and ask: Is there an alternative to Made in China?
“The [solar] plant's designed power generation capacity is equivalent to [the] burning of more than 1,800 tons of coal, and it would … avoid more than 5,000 tons of CO2 emissions into the atmosphere from the operation of coal-fired power plants,” said Oleg Shutkin, director of the engineering and generation department at Hevel.
In addition to avoiding emissions, the new solar plant will improve the Omsk region's self-sufficiency in power generation, added regional energy minister Anton Gaak. “Thanks to the solar plant, the efficiency of the power grid economy is rising,” said the politician. “With new power generation, we can adjust this [system] and, ultimately, reduce the price for electricity for customers in [the] Omsk region.”
The Russko-Polyanskaya plant is set to almost double Omsk's solar power generation capacity, to 61 MW. Solar plants will account for 3.8% of regional electricity output, Gaak said, adding that figure is projected to rise sharply in the coming years.
“We have achieved an agreement to launch new solar power plants with [a] combined production capacity close to 100 MW in the industrial zone of … Neftyanikov town and the southern districts of the Omsk region,” Gaak said, without elaborating further.
The Omsk government had already promised to build six solar plants in the region within the next three years.
In addition, the local authorities are mulling new incentives for investors willing to develop solar in the region. Proposals include a possible reduction of property tax for companies running renewable energy projects.
The development of solar generation is part of the national Clean Air program, under which the Omsk region wants to cut CO2 emissions by 20% by 2024. The investment cost of the program has been estimated at RUB116 billion ($1.66 billion).
By Vladislav Vorotnikov
This copy was amended on 26/10/21 to remove the statement Hevel is part of nanotechnology innovation business Rusnano, as the latter sold its stake in Hevel in 2018.
This content is protected by copyright and may not be reused. If you want to cooperate with us and would like to reuse some of our content, please contact: editors@pv-magazine.com."
https://www.pv-magazine.com/2021/10/26/whats-next-for-polysilicon/,"MODULES & UPSTREAM MANUFACTURING,OPINION & ANALYSIS,WORLD",,"OCTOBER 26, 2021",What’s next for polysilicon?,"From pv magazine 10/2021
The result of this surge in demand was a spike in poly prices. The contract price of solar-grade poly soared, from $40/kg in 2004 to more than $200/kg by 2008 – and the poly spot price at moments during that year went beyond $400. But while polysilicon manufacturing capacity wasn’t keeping up with demand, the ultimate raw material (quartz) was abundant, and the gap between the spot price of polysilicon and its manufacturing cost was unsustainably high.
Drawn by the high profit margins and lack of capacity, a host of Chinese manufacturers swept into the market, aggresively ramping capacity and optimizing manufacturing processes to reduce electricity usage. In addition, many of these manufacturers sprang up in coal-rich parts of northwest China, allowing access to electricity at lower prices than before.
By the end of 2013, the manufacturing cost of polysilicon had tumbled to below $20/kg among industry leaders. Meanwhile, capacity had grown from less than 50,000 MT per year in 2007 to over 350,000 MT per year by 2013. Overcapacity had taken hold, and many manufacturers were forced to sell at cash cost to remain in business.
Both polysilicon manufacturing costs and prices then followed a relatively steady downward trend – prices fell to around $15/kg by 2018, with only minor bumps along the way. Following the May 2018 announcements of changes to the Chinese government’s policies on support for PV projects, prices fell below $10/kg and remained there for over two years. In mid-2020, Covid-related uncertainty then pushed even mono-quality polysilicon spot prices down to record lows of just over $7/kg.
Uncompetitive producers
Against the backdrop of these relentlessly low prices, some polysilicon manufacturers chose to exit the market or scale back production. Nowhere was this more apparent than with South Korean manufacturers, where the problems caused by low selling prices were exacerbated by the struggles of the non-Chinese ingot manufacturers that had previously formed part of their customer base.
Hanwha Chemical closed down its polysilicon manufacturing in 2020. Hankook Silicon’s production, which had been dwindling for a number of years, finally came to an end. And OCI – previously a giant in the polysilicon world – made a strategic move to cease production of solar-grade polysilicon in Korea, bringing its total global capacity down from 79,000 MT/year to 36,500 MT/year. As well as this reduction in capacity outside of China, some smaller Chinese manufacturers have also exited the polysilicon market in recent years. And if that weren’t enough, in the first half of 2020, GCL-Poly reduced the capacity of its Jiangsu production base to transition some production to Fluidized Bed Reactor (FBR) technology.

New decade
Set against the reduction in manufacturing capacity has been an increasing demand for polysilicon, with strong growth in end demand for PV modules more than offsetting the decline in silicon usage per watt that has been driven by reduced wafer thickness, reduced kerf loss, and increased cell efficiencies.
In the middle of 2020, a series of unexpected incidents at polysilicon manufacturing facilities (including a fire, a flood, and an explosion) caused a decline in Chinese polysilicon production and a rise in polysilicon prices. Chinese polysilicon production rapidly bounced back and has since set a number of records for monthly production volumes (see chart, p. 53), but the reduction in global capacity has left the market with little room for maneuver in times of high demand.
The reduction in supply has also left some ingot manufacturers with little confidence that sufficient polysilicon (and especially polysilicon of the right quality) can be relied upon to be available when they require it. This has been exacerbated by the fact that ingot and wafer capacities have increased vastly out of proportion to polysilicon, with multiple new entrants to the market vying for wafer sales and scrambling for polysilicon supply. And while polysilicon production in the first half of 2020 appears to have been enough to satisfy end demand from module purchasers, there has been overproduction from ingot to module, with manufacturers building up inventory in expectation of very strong demand in the second half of the year.
Lean times
So, when can the industry expect to see relief from the current high prices? Several polysilicon capacity expansions from industry cost-leaders are due to ramp up production in early 2022, which should bring some balance back to the market. These include 40,000 MT/year of capacity from Daqo, due to ramp to full production in the first quarter of 2022, and 100,000 MT from Tongwei, notionally due online in late 2021, but not ramping to full output until the first two quarters of 2022. It also includes 30,000 MT from Asia Silicon, due to ramp in the first quarter of 2022, and expansions from East Hope and GCL-Poly in early 2022.
Beyond this, just how much prices fall later in 2022 will depend on the exact timings of other new capacity expansions, and how quickly they can ramp to full production of mono-quality material. Although there is some uncertainty around the exact timeframes for some of these expansions, not to mention whether planned timeframes will be met, it’s clear that through 2022 and 2023 there is a very significant volume of new capacity due online from the leading manufacturers.
Besides the established suppliers, the high polysilicon prices seen over the past 12 months have driven interest from new entrants to the industry. Of course, some of these plans may not come to fruition, and some may take longer than hoped to reach the quality requirements of the ingot manufacturers, which will only get more stringent as n-type cell manufacturing expands.
Still, with so much capacity in the pipeline, even if a significant proportion of the pipeline falls away, a major shift in the supply-demand balance in favor of polysilicon purchasers seems inevitable. With overcapacity looming and manufacturing costs at industry leaders such as Daqo and Tongwei being below $6/kg in 2020, we believe that the long-term outlook is for low polysilicon prices, much to the relief of those further downstream in the PV industry.
Alex Barrows is research director at Exawatt. He focuses on when and how new technologies will influence the PV market, and oversees PV market data analysis for the company. He obtained his PhD in the physics of perovskite-based solar cells from the University of Sheffield.
The views and opinions expressed in this article are the author’s own, and do not necessarily reflect those held by pv magazine.
This content is protected by copyright and may not be reused. If you want to cooperate with us and would like to reuse some of our content, please contact: editors@pv-magazine.com."
https://www.pv-magazine.com/2021/10/26/longi-achieves-25-82-efficiency-for-heterojunction-solar-cell/,"HIGHLIGHTS,MODULES & UPSTREAM MANUFACTURING,TECHNOLOGY AND R&D,CHINA",EMILIANO BELLINI,"OCTOBER 26, 2021",Longi achieves 25.82% efficiency for heterojunction solar cell,"Chinese PV module maker Longi announced it achieved a power conversion efficiency of 25.82% for a heterojunction solar cell based on an M6 wafer.
The manufacturer said the result was confirmed by Germany's Institute for Solar Energy Research Hamelin (ISFH). “The new record follows the previous benchmark of 25.26% in June, also established by Longi,” the manufacturer said in a statement. “The two world records set within five months of each other underline the company’s leading position in innovative high-efficiency solar cell technology and its vision to drive forward the sustainable and rapid development of the global PV industry.”
More technical details on the cell technology were not provided.
Longi had announced in July a 25.19% efficiency for p-type TOPCon solar cell and a month earlier a 25.21% efficiency for n-type TOPCon device.
In January 2019, Longi announced an efficiency rating of 24.06% for a monocrystalline p-type PERC cell on the front side.
This content is protected by copyright and may not be reused. If you want to cooperate with us and would like to reuse some of our content, please contact: editors@pv-magazine.com."
https://www.pv-magazine.com/2021/10/26/solar-panels-blasted-with-sound-to-better-understand-microcracking/,"MODULES & UPSTREAM MANUFACTURING,TECHNOLOGY AND R&D,UNITED STATES",RYAN KENNEDY,"OCTOBER 26, 2021",Solar panels blasted with sound to better understand microcracking,"From pv magazine USA
A team of researchers at the National Renewable Energy Laboratory (NREL) and the Electric Power Research Institute are testing solar panels by blasting sound waves at them. 
The team said it is working to understand the effect of small cracks in a solar module, and how they may cause power losses over time. On windy days, modules can bend and flex, which can help to wear down cracked modules.  
Prevailing reliability tests were evaluated by computer modeling, and it was found that current methods for simulating wind-related bending were too aggressive to match real-world scenarios. The researchers needed a new model for testing wind-related bend, and turned to subwoofers as a research tool. 
The team strapped panels into wooden frames and blasted loud bass rhythms at the modules. This caused them to bend and flex as if they were being pushed by high winds. The bass was played at infrasonic levels, which are frequencies that the human ear is not able to detect. As a result, years of vibration and flexing may be tested in a few hours or days. 
 
 
The test was supported by DuraMAT, short for Durable Module Materials, a consortium that seeks to develop, de-risk, and enable the commercialization of new materials and designs for PV modules.
A group of researchers led by the University of Utah (UU) in the United States presented this year a technique to isolate individual sources of electrical ‘noise’ within a solar cell. Comparing the technique to being able to pick out a single voice within a 200-person choir, they say the technique will help to improve understanding of where efficiency losses occur within a cell, and effective ways to mitigate them.
The group applied its technique to silicon heterojunction cells, and was able to identify several key areas within the cell where noise was generated and further research could lead to better efficiencies.
This content is protected by copyright and may not be reused. If you want to cooperate with us and would like to reuse some of our content, please contact: editors@pv-magazine.com."
https://www.pv-magazine.com/2021/10/26/plastic-for-solar-panels/,"MODULES & UPSTREAM MANUFACTURING,TECHNOLOGY AND R&D,UNITED STATES",JOHN FITZGERALD WEAVER,"OCTOBER 26, 2021",Plastic for solar panels?,"From pv magazine USA
Three manufacturers, Merlin Solar, Solarge, and LG, are making a move away from the standard aluminum and glass solar panel in a bid to lower weight, emissions, and cost.
The product from Merlin Solar has been found recently on yachts in pv magazine USA. Its value is that, first, it isn’t a standard framed product and so can be attached directly to a flat surface. Second, due to its unique busbar technology, the product is able to be walked on without damage.
Merlin Solar’s main goal, however, is to place its product on top of commercial structures whose limited available collateral load — the amount of weight that can be added to a structure’s roof and meet local building code regulations — doesn’t allow for the pounds per square foot (3-7 psf) that a standard solar installation requires.
The company recently installed 550 kWdc of its product on an oil storage tank in Rensselaer, New York. Merlin Solar said this site could neither take on the additional weight, nor gain owner approval for an attachment technique that might puncture the structure’s outer roofing layer.
Merlin Solar also markets its product in a framed format where a stronger structural attachment is required, or where a more rigid solar panel is desired. Even so, the product weighs considerably less than a standard solar panel because it does not use a glass front shield.
Solarge has released a product that replaces the glass of a solar panel with a plastic product. Currently, the company is manufacturing the panel on a pilot line which it said it hopes to scale up by the end of 2022. The company’s panel can be bought on its own, or as part of their custom designed east-west facing rooftop racking product.
The solar panel weighs just under 32 pounds (14.5 kg). For comparison’s sake, a Q Cell product made in Georgia weighs 43.8 pounds (19.9 kg). In the east-west configuration and including the racking hardware, the Solarge DUO will weigh 1.35 psf (6.6 kg/m2). And keep in mind that the lowest allowable collateral load often is around 3 psf.
 One point emphasized by the manufacturer is the product’s apparent strong emissions and recyclability credibility:
The product will have a CO2 footprint which is 80% lower than conventional solar panels and the panel is completely circular in design and uses no Per- and polyfluoroalkyl substances (PFAS) materials, unlike all other solar panels that use a polymeric film instead of glass.
LG Chem — part of the conglomerate that also sells the successful LG solar panel line with a manufacturing facility in Alabama — has announced that it is exploring turning the frames of solar panels from aluminum into plastics.
LG Chem said the product is as strong as aluminum, but cheaper and, of course, lightweight. Although no specific numbers were available, an LG Chem press release said its product can be manufactured with post-consumer recycled polycarbonate which will lower the emissions of the frame.

The compound, called LUPOY EU5201, is an engineering plastic composed of ASA (Acrylonitrile Styrene Acrylate) resins with polycarbonate as a base, and reinforced with glass fibers. High rooftop temperatures are well tolerated by the compound, which incorporates a flame retardant. It can maintain its shape across a range of temperatures due to its low coefficient of thermal expansion. And LG Chem claimed the new compound is highly resistant to corrosion, resistant to impacts, and extremely resistant to UV.
The company said it began selling products in the third quarter, indicating that it could already be headed toward solar panel factories for final manufacturing.
A shift to more plastics in solar panels will gain the attention of those who are considering the environmental credibility of solar power. While aluminum and glass manufacturing use an immense amount of energy, plastics are a major contributor to global trash pollution. They also are manufactured from hydrocarbons (oil).
However, the actual manufacturing of plastics from hydrocarbons — a process called cracking — doesn’t release emissions. It is the energy used to generate the heat — usually from fossil gas — that results in greenhouse gas emissions.
From this author’s experience building rooftop solar power, access to products that would lower the psf by greater than 50% of what is often our lowest allowable collateral load of 3 psf would open up a large amount of rooftop space for development.
This content is protected by copyright and may not be reused. If you want to cooperate with us and would like to reuse some of our content, please contact: editors@pv-magazine.com."
