url,tag,author,updated_date,title,contents
https://www.pv-magazine.com/2021/10/26/the-hydrogen-stream-saudi-arabia-bets-on-blue-hydrogen-denmark-wants-to-improve-green-alkaline-electrolysis/,"DISTRIBUTED STORAGE,ENERGY STORAGE,HYDROGEN,MARKETS,TECHNOLOGY AND R&D,UTILITY SCALE PV,UTILITY SCALE STORAGE,WORLD",SERGIO MATALUCCI,"OCTOBER 26, 2021","The Hydrogen Stream: Saudi Arabia bets on blue hydrogen, Denmark wants to improve green alkaline electrolysis","Saudi Arabia's energy minister, Abdulaziz bin Salman, has said most of the gas from the $110 billion (€94.7 billion) Jafurah development will be used to make blue hydrogen, as part of an attempt by the kingdom to become the biggest supplier of hydrogen in the world, according to reports by news agencies Bloomberg and Reuters. “We are the biggest adventurers, when it comes to blue hydrogen,” Bloomberg quoted Prince Abdulaziz as saying. “We’re putting our money where our mouth is … on hydrogen. We have a terrific gas base in Jafurah, we will use it to generate blue hydrogen.” According to Reuters, the country wants to export around 4 million tons of hydrogen by 2030.
Eleven companies have launched the GreenHyScale project in Denmark. The plan, which includes a 100 MW electrolysis plant, aims at accelerating pressurized alkaline electrolysis to enable the large scale production of green hydrogen. “Our focus is to create a replicable solution for stakeholders in both Denmark and the rest of Europe – replicability is key to the dissemination of green hydrogen,” said Anders Bøje Larsen, chief technology officer of Danish green industrial park GreenLab today. “That makes GreenHyScale an important project with the potential to contribute greatly to the positive development of a hydrogen infrastructure in and outside of the EU.” The partner companies also want to lower the leveled cost of hydrogen towards cost parity with fossil fuels. The project is backed by €30 million of EU funding.
Japanese automaker Toyota, Italian gas transmission system operator Snam and Portuguese bus and coach manufacturer CaetanoBus have signed a memorandum of understanding to promote hydrogen-based mobility. “With this agreement, we aim to build an alliance between operators in the energy and transport sectors to offer end users competitive sustainable hydrogen mobility solutions,” said Snam chief mobility officer Alessio Torelli. The agreement may lead to “end-to-end” hydrogen mobility projects in Italy and other European countries, including along the entire value chain. “The presence of an adequate hydrogen refueling infrastructure is a necessary condition for developing its full potential for mobility,” said Luigi Ksawery Lucà, CEO of Toyota Motor Italia.
Australian energy company Woodside Petroleum has unveiled plans to establish an export-oriented hydrogen and ammonia production facility in southern metropolitan Perth. “Local refuelling stations can be built independently of the export project timelines and could operate as early as 2023, subject to approvals and customer demand,” the company wrote yesterday. In collaboration with the government of Western Australia, the company wants to build the project on around 130 hectares of vacant industrial land, near gas, power, water and port infrastructure. “‘H2Perth' will also facilitate substantial growth of renewables in Western Australia by providing to the grid a flexible and stabilizing load that benefits uptake of intermittent renewable electricity by households and local industry,” said Woodside CEO Meg O’Neill.
South Korea-based Doosan Fuel Cell has signed a memorandum of understanding Korea Western Power and Korea Electric Power Corporation (KEPCO) in Seoul. The companies will develop a project to directly inject pure biogas – removed from unused biogas – into hydrogen fuel cells. “Doosan Fuel Cell plans to develop hydrogen fuel cell technology exclusively for pure biogas and supply main equipment, while Korea Western Power and KEPCO E&C are in charge of overall business, and design and construction of pre-treatment facilities, respectively,” the partners wrote. Doosan Fuel Cell has hydrogen fuel cell models that use energy sources such as clean and by-product hydrogen, LNG, and LPG. The agreement signed by the companies was not the only recent hydrogen development in South Korea. According to several reports, steelmaker POSCO and Korean Southern Power have also announced significant investments in hydrogen.
Aberdeen City Council has announced U.K.-based energy major BP as its preferred bidder for a commercial partnership to accelerate the city’s ambitions to become a world-class hydrogen hub. “Phase 1, which involves the delivery of a green hydrogen facility, is targeting first operations from 2024,” said a statement released by the local authority yesterday. “As a result, options could include using power drawn from a new photovoltaic solar farm, green power purchase agreements, and a private-wire grid connection to generate hydrogen for buses, heavy goods vehicles and large vans.” BP vice president Louise Kingham OBE said: “These new business opportunities are underpinned by our 50-plus years of operations in the North Sea where, based out of Aberdeen, we have built up vast skills and experience that are directly transferable to emerging energy industries.”
This content is protected by copyright and may not be reused. If you want to cooperate with us and would like to reuse some of our content, please contact: editors@pv-magazine.com."
https://www.pv-magazine.com/2021/10/26/gcl-has-no-record-of-performing-due-diligence-on-lender-which-walked-away-with-120m-of-its-stock/,"FINANCE,MARKETS & POLICY,MODULES & UPSTREAM MANUFACTURING,POLICY,CHINA,HONG KONG",MAX HALL,"OCTOBER 26, 2021",GCL has no record of performing due diligence on lender which walked away with $120m of its stock,"Chinese polysilicon manufacturer GCL-Poly has revealed the name of the general manager who signed off a controversial RMB510 million (US$79.9 million) pre-payment it made in 2019 for factory which never took shape, and also announced it has no record of performing any background checks on a finance company which last year walked away with US$120 million worth of its shares.
GCL was making the announcements as it tried to draw a line under a pair of incidents which have seen trading in its stock suspended on the Hong Kong exchange since April 1.
The company had originally opened up in May about a deal it signed in August 2018 which involved pledging 865 million shares in its GCL New Energy solar project development business as security in return for a promised US$60 million loan from Bentley Rothschild Capital 5 Ltd, of which GCL said only US$2.2 million ever arrived, in February last year.
As part of pv magazine’s UP Initiative, we have focused on raw material sourcing in the energy storage industry. Read about raw material sourcing for batteries, lithium extraction in Chile, cobalt from the Congo, and the development of raw material recycling, and contact up@pv-magazine.com to find out more.
GCL discovered in May the stock, which had been held by a third-party broker under the terms of the arrangement, had been transferred to Bentley Rothschild after the latter claimed the terms of the loan agreement had been breached. Earlier this month, GCL said a key individual associated with Bentley Rothschild had been accused of fraudulent activity by other companies which had received similar treatment.
The solar manufacturer's bid to resume trading in its stock involved appointing an independent investigation into its internal policies and Crowe (HK) Risk Advisory Ltd, the business selected by GCL to examine its practices, found the solar company could produce no evidence of having carried out any due diligence on Bentley Rothschild or the unnamed broker involved in the loss of stock which, pv magazine has previously reported, left the parent with only a 49.24% holding in its New Energy business.
The findings of the internal report, published by GCL in an update to the Hong Kong exchange yesterday, recommended any future such deals not involve any pledge of company shares and that such financing deals be approved by both the GCL-Poly board and external legal counsel.
In a series of updates yesterday – which included full-year figures for last year and an update from the first half of this year – GCL named Jiang Wenwu as the man responsible for a controversial RMB510 million pre-payment to state-owned energy construction business Sinomec Refinery & Chemical Corp as part of an engineering, procurement and construction (EPC) contract related to a planned RMB1.9 billion (US$297 million) polysilicon fab in Jiangsu Xuzhou Economic and Technological Development Zone, which is yet to begin.
Jiang was a former executive director of GCL and was general manager of the business' Jiangsu Zhongneng Polysilicon Technology Development Co Ltd subsidiary, and signed off the pre-payment despite only having authorization, under GCL internal policy, to approve up to RMB100 million (US$15.7 million) of capital spending.
The emergence of the pre-payment in relation to an EPC contract which was dissolved in April this year – with Sinomec refunding RMB495.28 million (US$77.55 million), minus its project planning expenses – prompted GCL auditor Deloitte Touche Tohmatsu to refuse to sign off the company's 2020 accounts and to walk away from the business. The lack of full-year figures, until yesterday, prompted the suspension of trading in GCL stock.
Yesterday's updates named Sinomec as lead contractor on the planned poly fab for the first time, along with sub-contractor Shanghai Chuanghong Technology Co Ltd. GCL reiterated it had decided to end the deal with the two entities to instead tender multiple EPC businesses to construct different parts of the planned 54,000-ton annual capacity poly factory, in order to protect the confidentiality of its granular silicon production technology. The manufacturer said it was still searching for replacement EPCs and would update shareholders on the contract this year.
The signing of the former EPC deal, and payment of the contentious RMB510 million, was not reported by the company as a major transaction at the time, in September 2019, as required by the Hong Kong exchange, and the investigation by Crowe Risk Advisory found Wenwu had only informed GCL chairman, Zhu Gongshan, and CEO, Zhu Zhanjun, about the contract “some time around the end of November 2019 or the beginning of December 2019.”
In a report which flagged up four internal control deficiencies of a “high-risk nature” – two associated with “procurement and construction projects and [the] handling of trade payables”; and two concerned with “funding, cash and financing management,” Crowe found GCL had permitted deals to be signed off solely on paper in cases where urgency was required. The investigator, who said yesterday the GCL board had remedied all of the 19 deficiencies it identified, recommended all such deals be required to go through the company's electronic systems in future.
This content is protected by copyright and may not be reused. If you want to cooperate with us and would like to reuse some of our content, please contact: editors@pv-magazine.com."
https://www.pv-magazine.com/2021/10/26/chinese-pv-industry-brief-government-confirms-plan-to-install-1-2-tw-of-renewables-by-2030/,"HIGHLIGHTS,MARKETS,MODULES & UPSTREAM MANUFACTURING,UTILITY SCALE PV,CHINA",VINCENT SHAW,"OCTOBER 26, 2021",Chinese PV Industry Brief: Government confirms plan to install 1.2 TW of renewables by 2030,"China's government today announced an action plan to bring carbon emissions to a peak this decade. In a notification sent to all provincial governments, the State Council confirmed figures which were initially published by the Chinese government in December. According to the document, non-fossil-fuel energy will account for 20% of consumption by the end of 2025, and a quarter of the total by 2030. Carbon dioxide emissions per unit of GDP will be cut by 65% compared to the 2005 levels, as part of the policy. In terms of renewables, the document calls for at least 1.2 TW of solar and wind generation capacity. According to National Energy Administration statistics, China currently had around 253 GW of solar at the end of 2020. The policy also calls for 120 GW of pumped hydro energy storage capacity and more than 30 GW of chemical storage and mandates solar on around half of the nation's new public-sector and industrial buildings.
Solar cell maker Aikosolar has announced two major three-year wafer purchasing agreements, with waste heat company Shuangliang and solar manufacturer Shangji. Aikosolar will buy 2.1 billion pieces from Shuangliang and 780 million pieces from Shangji, with prices set monthly, the company announced yesterday.
Solar manufacturer Zhonghuan Semiconductor posted revenue of RMB11.4 billion (US$1.78 billion) in the third quarter, for a 117.46% rise on the same period a year earlier. The net profit attributable to shareholders was RMB1.28 billion (US$200 million), for year-on-year growth of 226.3%. According to Zhonghuan's financial update, market penetration of its ‘G12', 210mm wafers rose to 20%, from only 6% at the beginning of the year. Zhonghuan said its annual wafer manufacturing capacity rose to 73.5 GW by the end of September, 59% of which is G12-compatible. The company's 50 GW G12 factory in Ningxia, which Zhonghuan has said will be the largest wafer fab in the world, is due to start commissioning in December and enter full operation by 2023.
This content is protected by copyright and may not be reused. If you want to cooperate with us and would like to reuse some of our content, please contact: editors@pv-magazine.com."
https://www.pv-magazine.com/2021/10/26/colombias-largest-pv-plant-comes-online/,"HIGHLIGHTS,MARKETS,MARKETS & POLICY,UTILITY SCALE PV,COLOMBIA",PILAR SÁNCHEZ MOLINA,"OCTOBER 26, 2021",Colombia’s largest PV plant comes online,"From pv magazine Latam
U.S.-based energy company AES, which in May changed the name of its unit in Latin America from AES Gener to AES Andes, has inaugurated and put into operation, on Friday, the San Fernando Solar Park, the largest photovoltaic project in Colombia.
AES built the plant for Colombian oil company Ecopetrol, which entered the solar energy business in August 2018.
Located in the municipality of Castilla La Nueva, in the department of Meta, the new solar complex has 61 MW of installed capacity and is the largest PV plant built in the country to date. It will supply part of the energy needed for the company's operations in the region. Ecopetrol awarded the plant construction contract to AES last year.
The park was built on 57 hectares with 114,000, 530 W monocrystalline bifacial solar panels mounted on trackers. AES said in a statement that the sun-tracking technology with bifacial panels is the first installed in the country, “which makes San Fernando Solar the most innovative solar plant in Colombia.”
As part of AES Colombia's commitment to its sustainable operation, the construction of the San Fernando Solar Park involved more than 700 people, of which 88% were local and regional employees. In addition, 38% of the park's workforce were women, which is the equivalent of more than 270 employees who were part of the different construction areas of the project.
For the CEO of AES Andes, Ricardo Falú, “this initiative is a faithful reflection of the progress of our Greentegra transformational strategy, which seeks to reduce the carbon intensity of our portfolio, make the supply of our clients more sustainable, and strengthen the investment grade of the company.”
This content is protected by copyright and may not be reused. If you want to cooperate with us and would like to reuse some of our content, please contact: editors@pv-magazine.com."
https://www.pv-magazine.com/2021/10/26/converting-coal-mines-into-gravity-based-renewable-energy-storage-facilities/,"ENERGY STORAGE,TECHNOLOGY AND R&D,UTILITY SCALE STORAGE,CZECHIA,UNITED KINGDOM",EMILIANO BELLINI,"OCTOBER 26, 2021",Converting coal mines into gravity-based renewable energy storage facilities,"Scottish start-up Gravitricity is considering the deployment of its gravity energy storage system at the decommissioned Staříč coal mine, in the Moravian Silesian region of Czechia.
The mine consists of six deep sites that could potentially host the storage solution developed by Gravitricity, which uses clean power to raise a mass in a 150-1,500m shaft and discharges the electricity thus ‘stored’ by releasing the mass to rotate an electric generator.
Specialists from the U.K. company and Diamo, which is a state-owned entity that manages decommissioned mining sites across Czechia, investigated the location features down to a depth of over 1km.
An investment decision is expected to be made early next year and more mining sites in the country may be considered for further plans, Gravitricity said in a statement. “We are ready to cooperate in [the] preparation of this project and have provided Gravitricity with all the information to allow them to make a fully qualified decision on the Staříč mine,” stated Diamo CEO Ludvík Kašpar. “We are convinced that closed mines have the potential for further use and an energy storage project could be attractive and useful for the region.”
Experts from the VSB Technical University of Ostrava were also active in the project assessment. The project is part of a plan to commence a full-scale, 4-8 MW prototype scheme in a disused mine next year.
The storage system developed by Gravitricity has so far been built as a 250 kW demonstrator project on an industrial site at Port of Leith, Scotland’s largest enclosed deepwater port. That facility was built with a 15m high lattice tower, two 25-ton weights suspended by steel cables and two grid-connected generator units. The technology is claimed to have a faster response time than lithium-ion storage technology and to be able to help stabilize electricity networks at 50Hz by responding to full power demand in less than a second.
Gravity storage has begun to raise interest in the renewable energy industry in recent years. U.S. company Energy Vault unveiled, in 2019, gravity-based storage technology relying on a crane and 35-ton concrete blocks. Austrian research organization the International Institute for Applied Systems Analysis (IIASA) recently suggested gravitational energy storage for low-energy-demand locations.
This content is protected by copyright and may not be reused. If you want to cooperate with us and would like to reuse some of our content, please contact: editors@pv-magazine.com."
https://www.pv-magazine.com/2021/10/26/nigeria-franchising-out-sections-of-power-distribution-network/,"MARKETS,MARKETS & POLICY,MINIGRID,POLICY,QUALITY,ETHIOPIA,GHANA,NAMIBIA,NIGERIA,SUB-SAHARAN AFRICA",COSMAS MWIRIGI,"OCTOBER 26, 2021",Nigeria franchising out sections of power distribution network,"Nigeria has introduced the franchising of its electricity distribution networks in a move which the authorities say will encourage the development of renewables.
Abdu Bello Mohammed, chief of staff at regulator the Nigerian Electricity Regulatory Commission, told a webinar held by German development ministry entity Green People's Energy and Brussels-based membership body the Alliance for Rural Electrification, his nation's 11 electric distribution companies are franchising portions of their network to private providers in a move which could foster mini-grid provision.
Mohammed and power sector peers from Ethiopia, Namibia and Ghana were responding to concerns voiced by German former politician Bärbel Höhn, who listed some of the obstacles to renewables roll-out she had witnessed in her unpaid role as commissioner for energy reform in Africa for development ministry the Deutsche Gesellschaft für Internationale Zusammenarbeit.
Solar PV could disrupt the fossil fuel industry and help with two of the biggest sustainability challenges of our times: biodiversity loss and food production. This year, pv magazine’s UP initiative has shone a spotlight on agrivoltaics. Read our coverage here.
Stressing the need to win hearts and minds to the clean energy cause, and referring to the successes achieved in her homeland, Alliance '90/Green Party member Höhn said subsidies for fossil fuel-fired power were a problem, with consumers in some African nations paying as little as US$0.05/kWh for conventional electricity.
Clean power developers would not be willing to invest for such low returns, said the former Bundestag MP and minister for agriculture in the German state of North Rhine-Westphalia, who added, bureaucracy and lack of support for private companies was also a hurdle to renewables in some African states. Höhn also called for high-quality equipment and comprehensive training, to sell the efficiency and job creation benefits of clean power.
Mohammed said Nigeria has mini-grid regulation in place that ensures installers of solar systems with a generation capacity of up to 100 kW need only complete a basic registration process and, for systems between 100 kW and 1 MW, a simple online permit was all that was required. The regulator representative said licences would be required only for systems bigger than 1 MW and added, Nigeria offers a feed-in tariff for solar facilities with generation capacities of up to 5 MW.
The country, said Mohammed, is aiming for 8 GW of renewables generation capacity this decade.
Bahru Oljira Debel, from the Ethiopian Energy Authority, said his nation also had mini-grid regulation in place, under an Energy Mini-grid Directive. The government of prime minister Abiy Ahmed, sworn in for a new five-year term at the start of the month, is considering further moves to foster private-sector involvement in off-grid generation and renewables plants, Debel told the webinar.
With a population density of just 2.9 people per square kilometer, according to worldatlas.com, household solar is the most effective way to provide electricity to the people of Namibia, said Pinehas Mutota, from the nation's Electricity Control Board.
Mutota said his country is making strides in renewables, with around 60 MW of generation capacity operating under a net-metering regime which has been in place since 2017, and with consumers able to shop around for their power provider.
Whilst Ghanaian electricity customers pay no more than US$0.10/kWh for consumption of up to 50 kWh per month – thanks to the kind of fossil fuel subsidies highlighted by Germany's Höhn – Wisdom Ahiataku Togobo, from state-owned hydro and solar company Bui Power Authority, pointed to the fact greenhouse gas emitters in Ghana are taxed on their CO2 output, with the money raised ring-fenced for off-grid electrification and renewables, following an amendment to the 2011 Renewable Energy Act.
This content is protected by copyright and may not be reused. If you want to cooperate with us and would like to reuse some of our content, please contact: editors@pv-magazine.com."
https://www.pv-magazine.com/2021/10/26/retractable-pv-awning-for-recreational-vehicles/,"MODULES & UPSTREAM MANUFACTURING,TECHNOLOGY AND R&D,UNITED STATES",EMILIANO BELLINI,"OCTOBER 26, 2021",Retractable PV awning for recreational vehicles,"U.S. start-up Xponent Power has launched, today, the Xpanse Solar Awning, a retractable photovoltaic awning for recreational vehicles (RVs). The manufacturer said the off-grid PV array has a power output of 1.2 kW and is able to provide power for almost all of a vehicle's onboard appliances – depending on usage patterns – while also providing external shading.
The solar power generator can be deployed automatically by pushing a button. “With the Xpanse Solar Awning, we are enabling RV owners to generate substantial power on the go so that they can go off-grid more often,” said the company's founder, Rohini Raghunathan, noting that the awning offers more space for the solar panels than the roof of vehicles.
The awning is slightly longer than 4.5m and extends to about 2.1m when fully expanded.
Xponent Power also explained that the awning is compatible with the electrical components used in conventional mobile PV installations, including charge controllers, batteries, and inverters. “The product, which can mount on either side of the vehicle, provides flexibility to RV owners who would like additional power but are not looking to replace an existing awning,” the company stated. “It can also integrate with existing rooftop installations, extending the solar power generation capabilities beyond the roof of an RV.”
The system is equipped with an, unspecified technology that makes it retract automatically in the event of adverse weather conditions. The array, however, is claimed to be intrinsically wind tolerant as it has small gaps between the solar panels that allow the wind to pass through.
The patented technology, according to the company, may enable a wide range of additional applications such as by the military, for emergency relief, and residential power. Xponent Power specified it is currently in talks with automotive and RV manufacturers to provide the system as a pre-installed option on their new vehicles.
On its website, the company also specifies that the installation of the system can be done by installers who have been thoroughly trained and vetted by Xponent Power, and that first deliveries will be made during the second half of 2022.
This content is protected by copyright and may not be reused. If you want to cooperate with us and would like to reuse some of our content, please contact: editors@pv-magazine.com."
