url,tag,author,updated_date,title,contents
https://www.pv-magazine.de/2022/03/18/multiple-steuerpersoenlichkeit/,"HIGHLIGHTS DER WOCHE,INSTALLATION,DEUTSCHLAND",THOMAS SELTMANN,18. MÄRZ 2022,Multiple Steuerpersönlichkeit,"Frage:
In einem Artikel haben Sie vom „Gewerbebetrieb Photovoltaik“ einer Steuerperson geschrieben. Was ist damit gemeint und kann ein Ehepaar mehrere Steuerpersonen haben?
Konkret hat bei uns die Ehefrau in 2016 eine 9,98 Kilowatt Photovoltaik-Anlage auf das ausschließlich von uns als Ehepaar genutzte Haus gebaut. Der Strom wird primär selbst verbraucht, der Rest eingespeist. Vom Finanzamt wurde die Umsatzsteuer erstattet, im Gegenzug werden für die Gewinne aus dem Stromverkauf Steuern abgeführt. Ab 2022 soll in die Kleinunternehmerregelung gewechselt werden, so dass keine Umsatzsteuerpflicht mehr besteht. Keiner der Ehepartner hat ein sonstiges Gewerbe.
Demnach könnte doch jeder, Ehemann und Ehefrau, einen eigenen Gewerbebetrieb Photovoltaik haben. Bei den Freibeträgen beispielsweise Arbeitnehmerfreibetrag, Vorsorgepauschale etc. bekommt auch bei zusammen veranlagten Eheleuten jeder einen eigenen Freibetrag. Kann man dieses Prinzip auch auf die Nichtbesteuerung bei der Einkommenssteuer für Photovoltaik-Anlage übertragen?
Der Ehemann würde außerdem gerne in 2022 eine weitere 10 Kilowatt-Anlage eventuell mit einem Stromspeicher, auf dem Dach des gleichen, von uns selbst genutzten Hauses bauen. Der erzeugte Strom soll ebenfalls selbst genutzt und der Überschuss eingespeist werden.
Sind das dann zwei verschiedene Anlagen mit jeweils bis zu 10 Kilowatt, die von zwei verschiedenen Personen betrieben werden und deren Einnahmen in der Steuererklärung nicht versteuert werden müssen? (gemeint ist die Vereinfachungsregel)
Antwort:
Wenn hier vom „Gewerbebetrieb Photovoltaik“ die Rede ist, geht es darum, dass der private Anlagenbetreiber einer solchen Anlage steuerlich Einkünfte aus Gewerbebetrieb erzielt, sofern er Strom gegen Vergütung ins Netz einspeist und damit zu versteuernde Gewinne erzielt.
Wer beispielsweise als Arbeitnehmer beschäftigt ist, erzielt Einkünfte aus nichtselbständiger Tätigkeit. Dazu kämen in diesem Fall noch Einkünfte aus selbständiger Tätigkeit (Strom produzieren und verkaufen) und im speziellen Fall handelt es sich hier nach dem Steuerrecht um gewerbliche Einkünfte – in Abgrenzung beispielsweise zu Einkünften als Freiberufler (Architekt, Arzt) oder Landwirt.
Wer diese Einkünfte in seiner Steuererklärung angeben muss, hängt davon ab, wer die Anlage tatsächlich betreibt. Auch Eheleute, die gemeinsam veranlagt werden, bleiben steuerrechtlich zwei verschiedene steuerpflichtige Personen. Die steuerliche Begünstigung der Zusammenveranlagung führt lediglich dazu, dass die gemeinsamen Einkünfte mit einem niedrigeren Steuersatz besteuert werden als dies bei getrennter Steuererklärung der Fall wäre, wenn beide Ehegatten unterschiedlich hoch verdienen.
Jeder Ehegatte kann also steuerlich eine eigene Photovoltaik-Anlage betreiben. Sie können sogar gemeinsam eine zusätzliche, dritte Steuerperson bilden: Die Ehegatten-GbR. Dazu erklären sie gegenüber dem Finanzamt, dass sie die Photovoltaik-Anlage gemeinsam betreiben und in allen Verträgen, Rechnungen und Belegen (Kaufvertrag, Einspeiseabrechnung usw.) müssen dann immer beide Personen namentlich genannt sein. Überhaupt ist es wichtig, dass für die steuerlichen Nachweise immer genau die Person auf diesen Unterlagen adressiert ist, die auch die Steuererklärung für die jeweilige Anlage abgeben will.
Dies kann beispielsweise sinnvoll sein, wenn ein Ehegatte bereits selbständig tätig ist, umsatzsteuerpflichtig, für die Photovoltaik-Anlage aber die Kleinunternehmerreglung gewählt werden soll und der zweite Ehegatte aus anderen Gründen nicht allein steuerlicher Betreiber werden möchte.
Im Einzelfall sollten solche Konstellationen immer mit einem Steuerberater abgeklärt werden, um zu prüfen, was die beste Lösung ist.
Die Antwort kommt von Thomas Seltmann mit fachlicher Unterstützung des Steuerberaters Markus Sprenger (Nürnberg).
Bitte beachten Sie, dass die Antworten in unserer Rubrik „Steuersprechstunde“ nur einzelne Aspekte betrachten und nicht für jeden Steuerfall zutreffend und vollständig sein müssen.
17.2.2022
Dieser Inhalt ist urheberrechtlich geschützt und darf nicht kopiert werden. Wenn Sie mit uns kooperieren und Inhalte von uns teilweise nutzen wollen, nehmen Sie bitte Kontakt auf: redaktion@pv-magazine.com."
https://www.pv-magazine.de/2022/03/18/rock-star-fraunhofer-ise-beschleunigt-druckverfahren-fuer-solarzellen/,"TECHNOLOGIE,DEUTSCHLAND",SANDRA ENKHARDT,18. MÄRZ 2022,„Rock-Star“: Fraunhofer ISE beschleunigt Druckverfahren für Solarzellen,"Das Fraunhofer-Institut für Solare Energiesysteme ISE hat mit der ASYS Automatisierungssysteme GmbH eine neue Fertigungsanlage entwickelt, die den Durchsatz beim Drucken von Solarzellen, um den Faktor 1,5 erhöht. Dafür hätten sie erstmals das Rotationssiebdruck- und das Flexodruckverfahren eingesetzt. Die Taktzeit sinke damit auf 0,6 Sekunden pro Solarzelle – deutlich schneller als die 0,9 Sekunden im bisher vorherrschenden Flachbett-Siebdruckverfahren.
„Der Druck ist damit ein Flaschenhals im Produktionsprozess von Silizium-Solarzellen, und auch im Beschichtungsprozess von Stückgut-Komponenten in vielen anderen Branchen“, erklärte Florian Clement, Leiter der Abteilung Produktionstechnologie – Strukturierung und Metallisierung am Fraunhofer ISE. Die entwickelte Demonstrator-Anlage für die Hochdurchsatz-Metallisierung könne den Prozess nun deutlich beschleunigen. Zudem sei der neue Prozess auch für den funktionalen Druck im Bereich Wasserstofftechnologie, Sensorik oder Leistungselektronik einsetzbar.
Die Anlage verfüge über ein neu entwickeltes Hochdurchsatz-Transportsystem. Dabei werden die zu beschichtenden Bauteile auf autonomen „Shuttles“ mit hoher Geschwindigkeit und Präzision durch Druckwerke der Schweizer Maschinenbaufirma Gallus Ferd. Rüesch AG, die zur Heidelberger Druckmaschinen AG gehört, transportiert und mit feinsten Strukturen passgenau beschichtet, wie die Freiburger Wissenschaftler mitteilten. Je nach Anforderung könne ein Rotationssiebdruckwerk oder ein Flexodruckwerk zugeschaltet werden, weitere Druck- und Beschichtungsverfahren wie Multi-Nozzle Dispensing und Tiefdruck seien aufgrund der modularen Bauweise ebenfalls integrierbar.
Im Zuge des Proof-of-Concept solle nun gezeigt werden, dass sich der Durchsatz des Druckprozesses um den Faktor 1,5 erhöhen lasse. Doch die Forscher hoffen noch auf mehr. „Die Anlage hat das technische Potenzial den Durchsatz im Vergleich zu Siebdruckanlagen zu verdoppeln“, ergänzte Andreas Lorenz, Projektleiter am Fraunhofer ISE. Das neue Verfahren und der Demonstrator seien im Zuge der Forschungsprojekte „Rock-Star“ und „Rock-IT“ entwickelt worden. Dies erhielten Fördermittel des Bundesforschungs- und -wirtschaftsministeriums.
Dieser Inhalt ist urheberrechtlich geschützt und darf nicht kopiert werden. Wenn Sie mit uns kooperieren und Inhalte von uns teilweise nutzen wollen, nehmen Sie bitte Kontakt auf: redaktion@pv-magazine.com."
https://www.pv-magazine.de/2022/03/18/isfh-und-uni-hannover-entwickeln-polo-ibc-solarzelle-mit-237-prozent-wirkungsgrad/,"TECHNOLOGIE,DEUTSCHLAND",EMILIANO BELLINI,18. MÄRZ 2022,"ISFH und Uni Hannover entwickeln POLO-IBC-Solarzelle mit 23,7 Prozent Wirkungsgrad","Eine Gruppe von Wissenschaftlern der Leibniz-Universität Hannover und des Instituts für Solarenergieforschung Hameln (ISFH) hat zwei verschiedene Arten von Solarzellen entwickelt, die auf n-dotierten, elektronensammelnden Poly-Si auf Oxid (POLO)-Übergängen mit einem aluminiumlegierten p+-Übergang zum Sammeln von Löchern basieren: eine rückseitig kontaktierte Zelle (POLO-BJ) und eine interdigitale rückseitig kontaktierte Zelle (POLO-IBC).
„Wir haben beide Technologien parallel entwickelt, da ihre Prozessabläufe sehr ähnlich sind und sich bei der Entwicklung viele Synergien ergeben haben“, so Robby Peibst vom ISFH, Leiter des Forschungsprojekts, auf Anfrage von pv magazine. „Eine der Hauptmotivationen für die parallele Entwicklung war sicherlich die Risikominimierung, da es anfangs nicht sicher war, dass wir die jeweiligen Herausforderungen lösen können. Für das POLO-BJ-Element stellte sich zum Beispiel die Frage, ob es wirklich möglich ist, ein Aluminium-Fingergitter so dünn zu drucken, dass es sich als Vorderseitenmetallisierung einer hocheffizienten Solarzelle eignet, was nun der Fall zu sein scheint.“
Die Wissenschaftler erklärten, dass der aluminiumlegierte p+-Übergang für die Lochsammlung der Standard bei der Herstellung von PERC-Solarzellen ist und kostengünstig während des Metallisierungsprozesses gebildet werden kann, ohne dass eine Bor-Diffusion oder Silbermetallisierung erforderlich ist. Durch simulationsbasierte Sensitivitätsanalysen zur Qualität dieser lochsammelnden Übergänge konnte die deutsche Gruppe feststellen, dass die Reduzierung der Aluminium-p+-Rekombination und des Widerstands für beide Zellstrukturen von großer Bedeutung ist.
„Eine Reduzierung des Kurzschlussstroms von Stromwerten von 600 (830) auf 400 Femtoampere pro Quadratzentimeter ist mit einem hohen Wirkungsgradpotenzial von 25,4 Prozent für POLO-IBC und 24,6 Prozent für POLO-BJ vereinbar“, heißt es weiter. „Wir schließen daraus, dass die Optimierung der Qualität des Aluminium-p+-Bereichs eine lösbare Herausforderung und kein Hindernis darstellt. Eine noch bessere Qualität des Aluminium-p+-Bereichs würde noch höhere Wirkungsgrade ermöglichen.“
Das beste von den Wissenschaftlern entwickelte POLO-IBC-Element erreichte einen Wirkungsgrad von 23,71 Prozent, eine Leerlaufspannung von 711,5 Millivolt, einen Kurzschlussstrom von 41,3 Milliampere pro Quadratzentimeter und einen Füllfaktor von 80,9 Prozent. Die POLO-BJ-Zelle mit der besten Leistung erreichte einen Wirkungsgrad von 22,9 Prozent, eine Leerlaufspannung von 714 Millivolt, einen Kurzschlussstrom von 39,6 Milliampere pro Quadratzentimeter und einen Füllfaktor von 80,9 Prozent.
„Die IBC-Zellen erforderten einen zusätzlichen Strukturierungsschritt und die Entwicklung einer ‚Nicht-Standard‘-Modulverschaltungstechnologie“, betonte Peibst. „Deshalb erschien uns POLO-BJ zunächst als die naheliegendere Alternative zu PERC“. Ihm zufolge gibt es in der Branche jedoch derzeit eine deutliche Dynamik in Richtung IBC-Zellen. „Dennoch werden beidseitig kontaktierte Zellen zumindest mittelfristig sicherlich weiterhin dominieren. Vielleicht könnte POLO-BJ das erste Upgrade einer PERC-Linie sein, und POLO-IBC eine Folgeversion“, sagte Peibst.
Ihre Forschungsergebnisse beschreiben die Forscher in dem Artikel „On the chances and challenges of combining electron-collecting nPOLO and hole-collecting Al-p+ contacts in highly efficient p-type c-Si solar cells“ beschrieben, der im Fachmagazin „Progress in Photovoltaics“ veröffentlicht ist.
„Ich persönlich halte es für eine attraktive Option, dass Teile unserer Entwicklung in die Massenproduktion einfließen können“, so Peibst weiter. „Wenn wir zum Beispiel mit POLO-BJ erfolgreich zeigen können, dass eine Vorderseitenmetallisierung mit Aluminium-Fingern möglich ist und eine stabile Modulverschaltung erlaubt, wäre dies auch eine Option, um Silber in n-type Topcon-Zellen einzusparen. Unsere Arbeit zur Aluminium-Metallisierung von Poly-Silizium ist auch für diesen Zweck relevant.“
Dieselbe Forschungsgruppe hat vor kurzem eine Reihe von numerischen Simulationen durchgeführt, um zu bewerten, wie photonische Kristalle die Effizienz von IBC-Solarzellen erhöhen können, die auf einem POLO-Übergang am Minus-Kontakt der Zelle und einem lochselektiven p+-type POLO-Übergang am Plus-Kontakt basieren. Die simulierte Zelle wurde mit einer Standard-Waferdicke von 150 Mikrometern angenommen und die Wissenschaftler fanden heraus, dass sie bei normalem Lichteinfall einen Wirkungsgrad von über 28 Prozent erreichen kann.
Dieser Inhalt ist urheberrechtlich geschützt und darf nicht kopiert werden. Wenn Sie mit uns kooperieren und Inhalte von uns teilweise nutzen wollen, nehmen Sie bitte Kontakt auf: redaktion@pv-magazine.com."
https://www.pv-magazine.de/2022/03/18/fuer-die-notwendige-beschleunigung-des-ausbaus-erneuerbarer-noch-in-diesem-sommer-braucht-es-eine-eeg-umlage-ii/,"MEINUNG,DEUTSCHLAND",,18. MÄRZ 2022,Für die notwendige Beschleunigung des Ausbaus Erneuerbarer noch in diesem Sommer braucht es eine EEG-Umlage II,"Um der spätestens seit Beginn des russischen Angriffskriegs auf die Ukraine unhaltbaren energiepolitischen Abhängigkeit von Russland noch in diesem Sommer durch eine massive Beschleunigung des Ausbaus der erneuerbaren Energien etwas entgegensetzen zu können, fehlt es derzeit noch an geeigneten gesetzlichen Rahmenbedingungen.
Was es dafür jetzt braucht, ist eine neue EEG-Umlage II !
Das Bundesministerium für Wirtschaft und Klimaschutz (BMWK) erarbeitet diesbezüglich gerade den alles entscheidenden Gesetzesentwurf. Denn: Der Entwurf des „Gesetzes zu Sofortmaßnahmen für einen beschleunigten Ausbau der erneuerbaren Energien und weiteren Maßnahmen im Stromsektor“ (EEG-Novelle) legt unter anderem fest, wie viel an Erneuerbaren noch vor dem nächsten Winter ausgebaut werden kann.
In Anbetracht der russischen Invasion in der Ukraine und der daraus resultierenden Notwendigkeit eines Importstopps russischer Energielieferungen ist die Frage nach den Möglichkeiten einer kurzfristigen  Beschleunigung des Ausbaus der erneuerbaren Energien relevanter als je zuvor. Die durch den Krieg verschärfte Energiekrise erfordert auch in diesem Sommer 2022 hohe Investitionen in alle Arten der Erneuerbaren Energien (Solar, Wind, Wasserkraft, Bioenergie, Geothermie, Meeresenergien), um einen substanziellen Beitrag zur Schaffung der Unabhängigkeit von russischen Energielieferungen und gleichzeitig zum Klimaschutz zu leisten.
Alle in diesem Sommer und Herbst 2022 gebauten neuen Anlagen helfen substanziell einer Unterversorgung von Energie in Deutschland entgegenzuwirken, die mit einer weiteren erheblichen Energiepreissteigerung einhergehen würde. Die Gefahr einer energetischen Unterversorgung Deutschlands besteht vor allem dann, wenn Russland aus kriegstaktischen Überlegungen heraus selbst die Energieversorgung nach Deutschland einstellt oder schmälert. Es müssen daher alle schnell zu schaffenden Möglichkeiten zur Erhöhung einer heimischen Energieerzeugung sowie Energieeinsparpotentiale umgesetzt werden. Neue Beiträge aus anderen fossilen und atomaren Quellen sind aus Gründen des Klimaschutzes und der atomaren Gefahren nicht akzeptabel.
Leider wird der sich im politischen Prozess befindliche Entwurf der EEG-Novelle des BMWK diesen Anforderungen nicht gerecht. In ihrer jetzigen Form wird die EEG-Novelle mit Verbesserungen für die Investor erneuerbarer Energien voraussichtlich erst Ende des Jahres 2022 greifen. Zu spät, um substanzielle Beiträge zur Linderung der Energiekrise zu bringen. Der Grund ist die Notifizierungspflicht durch die EU-Kommission. Demnach müssen die Mitgliedstaaten die Kommission über jeden Entwurf einer technischen Vorschrift vor deren Erlass unterrichten. Ab dem Datum der Notifizierung des Entwurfs besteht zunächst eine dreimonatige Stillhaltefrist – während der der notifizierende Mitgliedstaat den Gesetzesentwurf nicht annehmen kann, da die Kommission diesen zunächst prüft und darauf reagiert. Da die bestehende EEG-Umlage steuerfinanziert ist, erwächst daraus eine Beihilfeprüfung und sie fällt unter ebendiese Pflicht.
Im Rahmen der Verbändeanhörung zu diesem Referentenwurf des (BMWK) fordere ich daher die Einführung einer neuen EEG-Umlage II für die Vergütungszahlungen aller mit dem EEG 2022 neu gebauten Anlagen in allen erneuerbaren Energien Bereichen. Finanziert werden soll diese nicht aus Steuergeldern, sondern aus dem Strompreis. 
Eine solche EEG-Umlage II, finanziert aus dem Strompreis, umgeht die erwähnte EU-Notifizierungspflicht, sofern die Kriterien der EEG-Umlage von 2012 eingehalten werden, wie sie Grundlage des entsprechenden Urteils des EUGH von 2019 bildete. Wenn die EEG-Umlage II geschaffen wird, kann das EEG 2022 mit seinen substanziellen Verbesserungen bereits im Zeitraum Mai 2022 in Kraft treten. Es wird also wesentlich früher Investitionskraft entfalten, als es nach Abschluss einer Notifizierung durch die EU-Kommission möglich wäre.
Eine nennenswerte Belastung des Strompreises ist nicht zu erwarten, da heute die Investitionen selbst in versorgungssichere erneuerbare Energien plus Speicher bereits deutlich kostengünstiger sind als in konventionelle fossile und atomare Energieversorgung. Dies zeigt unter anderem die Studie der Energy Watch Group zu verlässlichen systemdienlichen EE-Investitionen.
Die Schaffung der EEG-Umlage II kann sich an den Vorschlägen der Stiftung Umweltenergierecht im Auftrag des Think-Tanks Agora Energiewende orientieren.
Wesentlich ist aber, dass die EEG-Umlage II nicht nur für Photovoltaik und Windkraft gilt, sondern für alle Arten der erneuerbaren Energien greift, damit keine Diskriminierung innerhalb der Erneuerbaren entsteht und erhebliche Ausbaupotentiale ungenutzt bleiben.
Sämtliche eingereichten Stellungnahmen werden auf der Internetseite des BMWK veröffentlicht.
— Der Autor Hans-Josef Fell saß für die Grünen von 1998 bis 2013 im Deutschen Bundestag. Der Energieexperte war im Jahr 2000 Mitautor des EEG. Nun ist er Präsident der Energy Watch Group (EWG). Mehr zu seiner Arbeit finden Sie unter www.hans-josef-fell.de. —
Die Blogbeiträge und Kommentare auf www.pv-magazine.de geben nicht zwangsläufig die Meinung und Haltung der Redaktion und der pv magazine group wieder. Unsere Webseite ist eine offene Plattform für den Austausch der Industrie und Politik. Wenn Sie auch in eigenen Beiträgen Kommentare einreichen wollen, schreiben Sie bitte an redaktion@pv-magazine.com.
Dieser Inhalt ist urheberrechtlich geschützt und darf nicht kopiert werden. Wenn Sie mit uns kooperieren und Inhalte von uns teilweise nutzen wollen, nehmen Sie bitte Kontakt auf: redaktion@pv-magazine.com."
https://www.pv-magazine.de/2022/03/18/netto-will-100-millionen-euro-in-waermepumpen-und-photovoltaik-investieren/,"MÄRKTE,DÄNEMARK,DEUTSCHLAND",SANDRA ENKHARDT,18. MÄRZ 2022,Netto will 100 Millionen Euro in Wärmepumpen und Photovoltaik investieren,"Netto Deutschland hat angekündigt, knapp 100 Millionen Euro in die Nachhaltigkeit zu investieren und sich gleichzeitig unabhängiger von russischem Gas und steigenden Energiepreisen machen zu wollen. In den nächsten drei Jahren werde die zur dänischen Salling-Group gehörende Supermarktkette in den knapp 300 Filialen in Deutschland die Gasheizungen entfernen und durch Wärmepumpen ersetzen, hieß es am Freitag. Zusätzlich sollen in den Netto-Märkten in ganz Deutschland weiterhin neue klimaneutrale Kühlregale sowie Türen für Kühl- und Gefriersysteme eingebaut werden. Daran anschließend sei geplant, die Dächer von mehr als hundert Märkten sowie Logistikzentren mit Photovoltaik-Anlagen auszustatten.
Zum Zeitplan hieß es: Alle Initiativen werden schnellstmöglich realisiert. Der Austausch der Heizungen könne voraussichtlich im Jahr 2024 abgeschlossen sein. Der Umbau aller Kühlregale und -anlagen soll bis Ende 2026 erfolgen, während die Installation von Photovoltaik-Anlagen auf bestehenden Gebäuden sukzessive bis 2028 umgesetzt werden soll. Nähere Informationen zu den geplanten Photovoltaik-Anlagen lagen zunächst nicht vor.
Die Investitionen in Nachhaltigkeit stünden im direkten Einklang mit den Klimazielen von Netto Deutschland und der dänischen Muttergesellschaft. Ziel sei es, den CO2-Fußabdruck der gesamten Gruppe zu verringern. „Um unsere Klimaziele zu erreichen, müssen wir unbedingt unseren Energieverbrauch reduzieren. Die aktuelle Energiesituation mit steigenden Preisen und hoher Abhängigkeit von Russland erhöht den Druck, in unseren Märkten auf wesentlich energieeffizientere Lösungen umzusteigen“, erklärte Ingo Panknin, CEO von Netto Deutschland und Mitglied des Executive Boards der Salling-Group. Die umfangreichen Investitionen führten dabei zu sofortigen Energieeinsparungen und sicherten langfristig die Profitabilität des Unternehmens.
Dieser Inhalt ist urheberrechtlich geschützt und darf nicht kopiert werden. Wenn Sie mit uns kooperieren und Inhalte von uns teilweise nutzen wollen, nehmen Sie bitte Kontakt auf: redaktion@pv-magazine.com."
https://www.pv-magazine.de/2022/03/18/berufungsverfahren-hanwha-q-cells-erreicht-weitergehende-unterlassungsverfuegung-gegen-longi/,"HIGHLIGHTS DER WOCHE,MÄRKTE,DEUTSCHLAND,EUROPA,NIEDERLANDE",SANDRA ENKHARDT,18. MÄRZ 2022,Berufungsverfahren: Hanwha Q-Cells erreicht weitergehende Unterlassungsverfügung gegen Longi,"Hanwha Q-Cells hat nach eigenen Angaben einen Erfolg vor dem niederländischen Berufungsgericht in Den Haag erzielt. Dieses habe die zuvor vom Bezirksgericht Rotterdam verhängte grenzüberschreitende Unterlassungsverfügung gegen Longi Netherlands Trading B.V. (NL) bestätigt und noch ausgeweitet, teilte der südkoreanische Photovoltaik-Hersteller am Freitag mit. Nach dem vorläufigen Urteil des Berufungsgerichts sei die Liste der Länder, in denen Longi die vom Patentverletzungsverfahren betroffenen Solarmodule nicht vertreiben dürfe, von neun auf elf erweitert worden. Die Entscheidung sei bereits am 1. März gefallen. Die Entscheidung des einstweiligen Verfügungsverfahren in Rotterdam stammt von 1. Oktober 2021.
Die Unterlassungsverfügung sieht vor, dass die niederländische Tochtergesellschaft von Longi Solar die Kunden nicht zur Verletzung des Patents EP `689 in Ländern anstiften dürfe, in denen die Hanwha Solutions Corporation der registrierte Eigentümer sei. Dies umfasse die Länder Belgien, Bulgarien, Deutschland, Frankreich, Ungarn, Liechtenstein, Österreich, Portugal, Spanien, das Vereinigte Königreich und die Schweiz, in denen Longi die betroffenen Solarmodule nicht zum Verkauf anbieten, verkaufen oder vertreiben dürfe. Überdies solle Longi eine Liste mit Kunden in den Ländern an Hanwha Q-Cells übermitteln.
Zudem habe das Berufungsgericht Longi NL verpflichtet, ein Rückrufschreiben an die Kunden zu senden. Diese müssten aufgefordert werden, die vom Patentstreit betroffenen Module zurückzugeben, heißt es von Hanwha Q-Cells weiter. Zudem hätten die Richter in Den Haag entschieden, dass Longi NL nicht nur bei der Anstiftung der Kunden zur Verletzung des Patents rechtswidrig handele, sondern auch direkt selbst gegen das Patent EP `689 verstoßen habe, da es seine Solarmodule in Ländern verkauft habe, in denen das Patent für gültig erklärt worden sei.
Nach Angaben von Hanwha Q-Cells soll es sich um die Longi-Solarmodultypen Hi-M03, Hi-M03m, Hi-M04, Hi-M04m, Hi-M05 und Hi-M05m handeln, die das betroffene Patent verletzen könnten und gegen sofortige Rückerstattung an Longi NL zurückgegeben werden müssen. Ausgenommen seien allerdings Solarmodule mit HIH, HIB und HIBD.
Wenn Longi den Auflagen nicht nachkomme, sei im Urteil ein tägliches Bußgeld vorgesehen, berichtet Hanwha Q-Cells. Die schriftliche Kundenliste sowie die Rückrufschreiben an die Kunden müssten zudem binnen zwei Wochen nach Zustellung des Urteils versandt werden.
Longi hat pv magazine am Montag ein Statement zur Entscheidung zugeschickt. Der chinesische Photovoltaik-Hersteller kündigt darin an, in Berufung gehen zu wollen.
Der Patentstreit zwischen Hanwha Q-Cells und Longi Solar reicht bereits bis in den März 2019 zurück. Damals hatte das koreanische Photovoltaik-Unternehmen eine Klage gegen Longi, Jinko Solar und REC wegen der Verletzung seiner Patenten bei der passivierten Solarzellentechnologie zunächst in Deutschland und den USA, kurz darauf auch in Australien eingereicht. In Deutschland entschied das Landgericht Düsseldorf in erster Instanz für Hanwha Q-Cells und stellte eine Verletzung der Patentansprüche fest. Allerdings gingen die beklagten Photovoltaik-Hersteller in Berufung und die finale Entscheidung des Oberlandesgerichts Düsseldorf steht noch aus. Auch die Entscheidung des Europäischen Patentamts über die Gültigkeit der Patente sei noch offen. In den USA entschieden die Richter im Patentverletzungsverfahren hingegen bereits zugunsten von Longi Solar und die weiteren beklagten Photovoltaik-Hersteller.
„Q-Cells begrüßt die Entscheidung des niederländischen Gerichts im Berufungsverfahren. Dies bestätigt und stärkt die Gültigkeit der laufenden rechtlichen Bemühungen zum Schutz unseres rechtmäßigen geistigen Eigentums“, erklärte CTO Daniel Jeong.
Dieser Inhalt ist urheberrechtlich geschützt und darf nicht kopiert werden. Wenn Sie mit uns kooperieren und Inhalte von uns teilweise nutzen wollen, nehmen Sie bitte Kontakt auf: redaktion@pv-magazine.com."
