url,tag,author,updated_date,title,contents
https://www.pv-magazine.de/2023/07/10/bosch-erhaelt-161-millionen-euro-foerderung-fuer-aufbau-von-brennstoffzellen-fertigung/,"MÄRKTE,POLITIK,WASSERSTOFF,DEUTSCHLAND",MARIAN WILLUHN,10. JULI 2023,Bosch erhält 161 Millionen Euro Förderung für Aufbau von Brennstoffzellen-Fertigung,"Bei Brennstoffzellen könnte es vielleicht bald mehr „made in Germany“ geben. Bosch geht mit seinen Brennstoffzell-Systemen in die Großserienfertigung in Süddeutschland. Das Projekt gilt als sogenanntes wichtiges Projekt von gemeinsamem europäischen Interesses – kurz IPCEI genannt. Für die Zusage eines Zuwendungsbescheids reiste sogar Bundeswirtschaftsminister Robert Habeck (Bündnis 90/Die Grünen) an den Standort in Renningen bei Stuttgart.
„Deutschland ist ein starker Standort mit starken Unternehmen, die bereit sind, die Transformation anzugehen und zu meistern“, sagt Habeck. „Jetzt kann eine hochinnovative Schlüsseltechnologie für den Wasserstoffhochlauf am Standort Deutschland in Serie gehen.“
Bosch wird in dem Werk seine SOFC-Systeme, also Festoxid-Brennstoffzellen, herstellen. Die Systeme sind dem Hersteller zufolge vielseitig zu Strom- und Wärmeerzeugung einsetzbar. Bereits jetzt können sie mit Biogas oder Erdgas mit Wasserstoffbeimischungen betrieben werden. Ein Betrieb mit reinem Wasserstoff ist ebenfalls möglich. Dies erlaube den Marktzugang über das bestehende Gasnetz. Der elektrische Wirkungsgrad betrage 60 Prozent. Der Gesamtwirkungsgrad 85 Prozent, teilt Bosch mit.
Die Produktion der Brennstoffzellen wird Bosch in Bamberg, Homburg und Wernau bei Esslingen vornehmen. Die Entwicklung, einen Teil der Fertigung und die Erprobung soll an mehreren Standorten im Raum Stuttgart, wie Stuttgart-Feuerbach, Renningen und Wernau stattfinden.
Insgesamt erhält Bosch 161 Millionen Euro Fördergeld für den Aufbau einer Großserienfertigung seiner Feststoffoxid-Brennstoffzellensysteme (SOFC). 70 Prozent der Förderung sollen den Angaben zufolge aus Bundesmitteln stammen. Neben dem Bund stellten auch noch die Bundesländer Bayern, Baden-Württemberg und Saarland Gelder bereit.
Bei der Übergabe des Förderbescheids am Bosch Forschungscampus in Renningen waren auch Baden-Württembergs Ministerpräsident Winfried Kretschmann und Umweltministerin Thekla Walker (beide Bündnis 90/Die Grünen) sowie die bayerische Staatsministerin Melanie Huml (CSU) anwesend.
Der Prototyp des Brennstoffzellen-Stacks wurde vergangenes Jahr im April vorgestellt. Das Gerät hatte eine Leistung von zehn Kilowatt elektrisch, wobei noch drei Kilowatt thermisch abgeleitet werden konnten. Es kann zu einer Kaskade oder einem Cluster vernetzt werden und können ein dezentrales Energieversorgungssystem bilden.
Das Unternehmen kündigte an, den Stack für höhere Leistung besonders für den Gewerbe- und Industriesektor auszulegen und bis 2024 an den Markt zu bringen. Vor einem Jahr noch teilte Senior Vice President für Festoxid-Brennstoffzellen (SOFC) bei Bosch, Marcus Spickermann, mit, dass man anstrebt, mit einem Produktionsvolumen von 200 Megawatt zu beginnen.
Dieser Inhalt ist urheberrechtlich geschützt und darf nicht kopiert werden. Wenn Sie mit uns kooperieren und Inhalte von uns teilweise nutzen wollen, nehmen Sie bitte Kontakt auf: redaktion@pv-magazine.com."
https://www.pv-magazine.de/2023/07/10/oesterreichs-erster-solarpark-mit-mehr-als-100-megawatt-im-bau/,"INSTALLATION,DEUTSCHLAND,ÖSTERREICH",SANDRA ENKHARDT,10. JULI 2023,Österreichs erster Solarpark mit mehr als 100 Megawatt im Bau,"Österreich war bislang weniger für seine Photovoltaik-Freiflächenanlagen bekannt. Doch dies könnte sich nun ändern. Aktuell befindet sich ein Photovoltaik-Kraftwerk mit knapp 120 Megawatt in der Gemeinde Nickelsdorf im Burgenland im Bau. Projektentwickler ist das österreichische Unternehmen Sonnenbau. Die Montagesysteme liefert die bayerische Schletter Gruppe, wie sie am Montag mitteilte.
Auf einer Fläche von 160 Hektar würden im Laufe des Jahres insgesamt 220.000 Solarmodule installiert. Die ersten 40 Megawatt des Photovoltaik-Kraftwerks seien bereits im Frühjahr installiert worden, die restlichen knapp 80 Megawatt sollen in den kommenden Monaten folgen. Sie würden auf dem einstützigen Schletter-System „FS UNO“ montiert. Das Sytem besteht aus wenigen Stützen und könne flexibel an Unebenheiten und verschiedene Geländeprofile angepasst werden. Noch in diesem Jahr soll das Photovoltaik-Kraftwerk ans Netz gehen. Der Solarstrom sei für die umliegenden Wohngebiete bestimmt.
„Mit etwa 300 Sonnentagen und mehr als 2.000 Sonnenstunden im Jahr ist das Burgenland prädestiniert für die Erzeugung von Solarstrom“, sagt Fabian Madl, Key Account Manager. „Mit dem Solarpark Nickelsdorf baut die Region ihre Vorreiterrolle beim Ausbau der Solarenergie weiter aus. Gleichzeitig stößt Österreich in puncto Anlagengröße in neue Dimensionen vor.“
Angesichts eines Photovoltaik-Zubaus von etwas mehr als einem Gigawatt im vergangenen Jahr sind 120 Megawatt auf jeden Fall eine Hausnummer und dürften zu einer weiteren Erhöhung der Zubauzahlen in diesem Jahr betragen. Schletter hat nach eigenen Angaben auch bereits 2020 Erfahrungen mit österreichischen Rekord-Photovoltaik-Anlagen gesammelt. Es lieferte auch die Montagegestelle für den damals größten Solarpark mit 15 Megawatt Leistung in Schönkirchen, der auf einer stellgelegten Mülldeponie entstand.
Dieser Inhalt ist urheberrechtlich geschützt und darf nicht kopiert werden. Wenn Sie mit uns kooperieren und Inhalte von uns teilweise nutzen wollen, nehmen Sie bitte Kontakt auf: redaktion@pv-magazine.com."
https://www.pv-magazine.de/2023/07/10/hopfen-und-malz-einweihung-der-ersten-hopfen-photovoltaik-anlage-in-bayern/,"HIGHLIGHTS DER WOCHE,INSTALLATION,DEUTSCHLAND",SANDRA ENKHARDT,10. JULI 2023,Hopfen und Malz…: Einweihung der ersten Hopfen-Photovoltaik-Anlage in Bayern,"Am Montag ist in Au in der Hallertau die deutschlandweit wohl erste Hopfen-Agri-Photovoltaik-Anlage eingeweiht worden. Bayerns Wirtschaftsminister Hubert Aiwanger (Freie Wähler) ließ sich den Termin nicht nehmen. Immerhin mehr als 1,5 Millionen Euro hat das Unternehmen Agri Energie in die Installation der Solarmodule über seinen Hopfenfeldern investiert. Insgesamt umfasst der Hopfenanbau eine Fläche von 1,3 Hektar, auf denen nun ah noch Solarstrom erzeugt wird. Dieser solle ausreichen, um etwa 200 Haushalte u versorgen.
Das Hopfen-Agri-Photovoltaik-Projekt wird wissenschaftlich vom Fraunhofer-Institut für Solare Energiesysteme ISE und Hochschule für angewandte Wissenschaften Weihenstephan-Triesdorf in Freising begleitet. Es handelt sich in Neuhub um eine erste Pilotanlage. Bis 2024 soll die Entwicklung abgeschlossen und solche Anlagen dann auch kommerziell verfügbar sein, wie es bei Agrar Energie heißt. Die Hopfenpflanzen würden durch die Konstruktion vor zu viel Sonne und Hagel beschützt, gleichzeitig sei die Verdunstung geringer.
Die Photovoltaik-Anlagen ist auf Stahlmasten installiert, an denen gleichzeitig ach noch Hopfenpflanzen ranken können. Die Initiative und das Engagement von Landwirt Josef Wimmer und der Agrar Energie GmbH sind großartig. Denn mit dieser Technologie bekommen wir Energiegewinnung und landwirtschaftliche Nutzung bestmöglich unter einen Hut. Wir können Photovoltaik auf Freiflächen entscheidend ausbauen, ohne dabei wertvolle Ackerflächen zu verlieren“, erklärte Aiwanger anlässlich der Einweihung. Das Potenzial vor Ort sei zudem riesig. Immerhin auf 17.200 Hektar wird demnach in der Hallertau Hopfen angebaut.
Agri-Photovoltaik ist aus Sicht von Aiwanger, für viele Landwirte eine lohnende Möglichkeit, sich ein zweites Standbein zu schaffen. „Diese erste Anlage wird uns zahlreiche wertvolle Erkenntnisse liefern, die von großer Relevanz für die Praxis – und damit für künftige Agri-Photovoltaik-Projekte – sind“, so Aiwanger weiter. „Denn viele Fragen müssen wir erst noch durch Erfahrungen beantworten: Welche Hopfensorten bringen den besten Ertrag? Welches bauliche Konzept ist ideal? In jedem Fall bin ich überzeugt, dass dieses Pionier-Projekt absoluten Modellcharakter für viele andere potenzielle Nachahmer hat.“
Dieser Inhalt ist urheberrechtlich geschützt und darf nicht kopiert werden. Wenn Sie mit uns kooperieren und Inhalte von uns teilweise nutzen wollen, nehmen Sie bitte Kontakt auf: redaktion@pv-magazine.com."
https://www.pv-magazine.de/2023/07/10/zellproduktion-in-europa-man-braucht-einen-industriestrompreis-von-vier-cent-pro-kilowattstunde-ueber-20-jahre/,"MÄRKTE,TECHNOLOGIE,CHINA,DEUTSCHLAND",MICHAEL FUHS,10. JULI 2023,Zellproduktion in Europa: „Man braucht einen Industriestrompreis von vier Cent pro Kilowattstunde über 20 Jahre“,"Wir haben in der aktuellen Ausgabe darüber berichtet, dass Sie einen Modulwirkungsgrad-Weltrekord von 23,6 Prozent erreicht haben. Inzwischen können Sie noch leistungsfähigere Module produzieren. Was ist ihr derzeitiger Rekord?
Tiger Lu, CEO: Die offizielle Effizienz, die wir publizieren können, liegt inzwischen bei 24,27 Prozent.
Die Module enthalten Zellen, die zum einen durch das n-Typ-Topcon Konzept, zum anderen durch eine Rückseitenkontakt-Technologie die hohe Effizienz erreichen. Wenn man die Beiträge auseinanderdividiert – welche Rolle spielt die Rückseitenkontakt-Technologie?
Christian Peter (Managing Director Solarlab Aiko Europe GmbH): Es ist bekannt, dass man mit Rückseitenkontakt die höchste Effizienz erreichen kann. Die aktive Zellfläche steigt um bis zu vier Prozent. Außerdem öffnet man die Vorderseite nicht, um Leiterbahnen aufzubringen. Dadurch kann man sie besser passivieren und die Verluste reduzieren. Die Kontakte auf der Rückseite sind aber auch vollkommen passiviert. Das ist im Übrigen die Bedeutung der Bezeichnung „Topcon“. Jeder denkt, dass mit „Top“ die Vorderseite gemeint ist. Es ist aber die Passivierung gemeint.
Sie nennen Ihre Technologie „ABC-Technologie“. Gibt es einen prinzipiellen Unterschied zu der bekannten IBC-Technologie für Rückkontakt-Zellen?
CP: Es ist kein grundsätzlicher Unterschied. Aber wir haben einige Probleme gelöst, die bisher verhindert haben, dass es eine Mainstream-Technologie werden konnte. Wir haben einige patentierte Technologien entwickelt, die es uns nun erlauben, eine Gigawatt Produktion aufzubauen. Das hat bisher noch gefehlt, obwohl es solche Module schon lange gibt.
Wie viel der Rekord-Effizienz-Module können Sie dieses Jahr wirklich produzieren?
CP: Wir haben letztes Jahr eine R&D-Linie in Foshan gebaut. Die hat 500 Megawatt. Jetzt bauen wir eine ganz neue Fabrik in Zhuhai. In der finalen Ausbaustufe soll sie 10-Gigawatt pro Jahr produzieren. Zunächst streben wir an, 7,5 Gigawatt zu produzieren. Derzeit laufen sechs Linien, was drei Gigawatt Jahreskapazität entspricht. Aber wir fahren sie jetzt weiter hoch.
Was ist die mittlere Effizienz der Module, die Sie dort produzieren
TL: 24 Prozent können wir anbieten. Aber die Mainstream-Effizienz ist 23,6 bis 23,8 Prozent.
Zielen Sie wie andere Hocheffizienz-Modulhersteller vor allem auf den Residential-Markt?
CP: Wir wollen nicht nur in den Residential-Markt verkaufen, sondern auch in den Utility-Markt. Wir reden momentan mit großen IPPs in Deutschland. Im Utility-Markt ist das Produkt nicht das Modul, sondern der Strom. Damit zählen die Stromgestehungskosten. Es kann Sinn machen, mehr fürs Modul zu zahlen und trotzdem billigeren Strom zu produzieren.
Ich schließe daraus, dass Sie den Preis der Module auch für das Utility-Geschäft für attraktiv halten. Wie konnten Sie die Kosten weit genug senken?
CP: Ein großer Schritt zur Kostensenkung ist, dass wir kein Silber benutzen. Die Module sind alle silberfrei. Der andere Baustein ist, dass wir den Ertrag der Produktionslinie erhöht haben, so dass es weniger Ausschuss gibt. Das ist sehr relevant, da die Bill of Materials der größte Kostenblock ist. Daher lohnt es sich, eine hohe Effizienz in der Produktion zu haben. Außerdem haben wir in einen Polysilizium- und einen Waferhersteller investiert. Wir benötigen für unsere Zellen sehr gutes Basismaterial.
Wie ist Aiko aufgestellt?
TL: Aiko wurde 2009 gegründet. In den letzten 14 Jahren waren wir vor allem mit der Entwicklung und Produktion von Zellen beschäftigt. Die Endverbraucher kennen uns meist nicht, aber unsere Zellen sind zum Beispiel in Produkten von QCells enthalten. Auch die Firmen, die ein Carbon Footprint Tracking brauchen, kaufen oft von uns. Vorletztes Jahr haben wir begonnen, ABC Zellen und n-Typ-Technologie zu entwickeln, und uns mehr um die gesamte Wertschöpfungskette zu kümmern. Module haben wir letztes Jahr eingeführt und besonders in Deutschland haben wir schon Kunden. Wir haben Teams in diversen europäischen Ländern gegründet. Ende des Jahres werden wir hier 140 Mitarbeiter haben. Wir sind auch der einzige chinesische Hersteller, der ein Labor in Europa hat, das Solarlab Aiko Europe.
Wollen Sie auch in Europa produzieren?
TL: Der Geschäftsführer des Solarlab, Christian Peter, hat die Aufgabe, einen guten Standort für eine Produktion zu finden. Dass es eine Modulproduktion geben wird, ist schon entschieden. Eine Zellproduktion diskutieren wir auch. Aber das ist ein hohes Risiko. Finanziell macht es für uns keinen Sinn. Das würde nur mit Unterstützung gehen.
Was für eine Unterstützung?
CP: Man braucht zwei Dinge. Einen Industriestrompreis von vier Cent pro Kilowattstunde über 20 Jahre garantiert. Dazu braucht man gute Angebote für Land und die Aussicht, gutes Personal zu finden. Wenn man die Produktion mit der in China vergleicht, ist dort nicht nur die Arbeit günstiger, sondern es geht auch viel schneller. In Europa kommt dazu, dass sich viele Regulierungen ständig ändern. Solche Risiken können wir nicht brauchen. Wir sind offen, überall zu investieren, aber wir brauchen Partner und eine Einladung.
Wir hören sehr unterschiedliches zu Arbeitskosten. Manche sagen, es spielt keine Rolle mehr, da sich die Unterschiede angleichen.
CP: Das hängt davon ab, wo man ist. In Shanghai sind die Lebenshaltungskosten wahrscheinlich wie in München. Es gibt andere Regionen, wo die Arbeit günstiger ist. Aber das Wichtigste ist, dass man gut planen kann und dass man das Projekt schnell entwickeln kann.
Sehen Sie noch Innovationen in Europa?
CP: Die Innovationsgeschwindigkeit in China ist groß. Wenn ein Maschinenbauer dort vielleicht 1000 Maschinen bauen kann, baut er hier vielleicht 10 oder 100. Das macht einen großen Unterschied.
Wie groß ist Ihre Forschungs- und Entwicklungsabteilung?
TL: Ungefähr 3.000 Mitarbeiter, das macht 23 bis 24 Prozent des Headcount aus.
Wem gehört Aiko?
TL: Wir sind eine Aktiengesellschaft und an der Shanghaier Börse gelistet. Der Gründer ist immer noch der größte Aktionär. Wir haben nicht so viele gelistete Unternehmen, da der Prozess sehr aufwendig ist. Aber wer gelistet ist, ist sehr transparent. Es ist alles veröffentlicht.
Werden auch andere Modulhersteller Module aus Ihren ABC-Zellen anbieten?
TL: Wir waren ein reiner Zellhersteller. Weil wir nicht wollen, dass eine Konkurrenz zwischen den Modulen von uns und denen unserer Kunden entsteht, haben wir beschlossen, die ABC-Zellen nicht an andere Modulhersteller zu liefern. Die dominante Zelltechnologie ist noch Perc. Die Module aus ABC-Zellen fertigen nur wir.
Dieser Inhalt ist urheberrechtlich geschützt und darf nicht kopiert werden. Wenn Sie mit uns kooperieren und Inhalte von uns teilweise nutzen wollen, nehmen Sie bitte Kontakt auf: redaktion@pv-magazine.com."
https://www.pv-magazine.de/2023/07/10/marktwert-solar-steigt-im-juni-leicht-auf-7124-cent-pro-kilowattstunde/,"HIGHLIGHTS DER WOCHE,MÄRKTE,DEUTSCHLAND",SANDRA ENKHARDT,10. JULI 2023,"Marktwert Solar steigt im Juni leicht auf 7,124 Cent pro Kilowattstunde","Im Juni haben die Photovoltaik-Anlagen soviel Solarstrom erzeugt wie nie zuvor in einem Monat. Gleichzeitig haben sich an der Strombörse die Marktwerte leicht erhöht. So stieg der Marktwert Solar im Gegensatz zum Mai von 5,356 auf 7,124 Cent pro Kilowattstunde. Etwas moderater fiel der Anstieg der Marktwerte für Wind an Land und auf See aus. Sie lagen mit 9,236 respektive 9,147 Cent weiter über den Marktwerten für Solarstrom, aber unter dem durchschnittlichen Spotmarktpreis, der von den Übertragungsnetzbetreibern für Juni mit 9,476 Cent pro Kilowattstunde angegeben wird. Im Mai waren es noch 8,172 Cent pro Kilowattstunde.
Im vergangenen Monat gab es ebenfalls wieder Phasen mit negativen Strompreisen. Am ersten Juni-Wochenende war dies sowohl am Samstag als auch Sonntag zwischen 12 und 16 Uhr der Fall. Auch am darauffolgenden Sonntag lag der Strompreis zwischen 11 und 17 Uhr im negativen Bereich. Außer im Februar gab es damit bislang in jedem Monat des Jahres mindestens eine Phase mit negativen Strompreisen.
Dieser Inhalt ist urheberrechtlich geschützt und darf nicht kopiert werden. Wenn Sie mit uns kooperieren und Inhalte von uns teilweise nutzen wollen, nehmen Sie bitte Kontakt auf: redaktion@pv-magazine.com."
https://www.pv-magazine.de/2023/07/10/enervis-ppa-price-tracker-fuer-photovoltaik-im-schnitt-konstante-terminmarktpreise-fuehren-zu-gleichbleibenden-10-jahres-ppa-preisen/,"MEINUNG,DEUTSCHLAND",,10. JULI 2023,Enervis PPA-Price-Tracker für Photovoltaik: Im Schnitt konstante Terminmarktpreise führen zu gleichbleibenden 10-Jahres-PPA-Preisen,"Im Juni 2023 sind die Preise für Strom im Terminmarkt im Schnitt annähernd konstant geblieben. Je nach Zeithorizont der Stromlieferung gab es hier aber Unterschiede, so sind die Preise am kurzen Ende für die Jahre 2024 und 2025 wieder angestiegen, die langfristigen Preise sind dahingehend gesunken. Diese Tendenz und das Auslaufen der Erlösabschöpfung kann auch kurzfristige PPA/Fixpreisabsicherungen mit dem Wechsel in die sonstige Direktvermarktung im Zuge des EEGs wieder attraktiv machen. Auf dieser Basis ist das gemittelte Terminpreisniveau für Strom als Benchmark für unseren PPA-Price-Tracker im Juni 2023 im Schnitt konstant geblieben und lag bei rund 102 Euro pro Megawattstunde für den 10-jährigen Betrachtungshorizont. Dies stellt den gemittelten Preisbenchmark für langfristige Power Purchase Agreements im deutschen Strommarkt dar.
Die von Enervis für den Juni 2023 berechneten generischen Preise für einen 10-jährigen Photovoltaik-PPA mit Start im Frontmonat liegen unter Berücksichtigung der üblichen Abschläge für Photovoltaik-Profilwerte, PPA-Abwicklungs- und Risikokosten sowie marktüblichen Erlösen für Herkunftsnachweise bei rund 62 bis 76 Euro pro Megawattstunde.
Quelle: Enervis
— Der Autor Thomas Rosenzopf ist Senior Consultant bei der energiewirtschaftlichen Beratung Enervis und hier für Photovoltaik-relevante Themen zuständig. Seine Expertise reicht vom systematischen Vergleich von Preisen und Verträgen von Power Purchase Agreements, Batteriespeicher und innovativen Photovoltaik Anlagendesigns bis hin zu der Einbindung und Bewertung von Strom aus Photovoltaik-Anlagen in ein industrielles Lastprofil. —
Die Blogbeiträge und Kommentare auf www.pv-magazine.de geben nicht zwangsläufig die Meinung und Haltung der Redaktion und der pv magazine group wieder. Unsere Webseite ist eine offene Plattform für den Austausch der Industrie und Politik. Wenn Sie auch in eigenen Beiträgen Kommentare einreichen wollen, schreiben Sie bitte an redaktion@pv-magazine.com.
Dieser Inhalt ist urheberrechtlich geschützt und darf nicht kopiert werden. Wenn Sie mit uns kooperieren und Inhalte von uns teilweise nutzen wollen, nehmen Sie bitte Kontakt auf: redaktion@pv-magazine.com."
