url,tag,author,updated_date,title,contents
https://www.pv-magazine.com/2023/03/07/french-module-maker-increases-capacity/,"MARKETS,MODULES & UPSTREAM MANUFACTURING,FRANCE",GWÉNAËLLE DEBOUTTE,"MARCH 7, 2023",French module maker increases capacity,"From pv magazine France
Systovi has inaugurated a new assembly line in Carquefou, near Nantes, France. It invested €1.5 million ($1.59 million) to double its production capacity from 40 MW to 80 MW.
“In addition to this increase in capacity, our objective is to produce panels with higher output,” Systovi Managing Director Paul Toulouse told pv magazine France.
The new line will make it possible to manufacture the latest Optymo series of Systovi panels, which are based on M10 cells, with outputs of up to 400 W. The new modules, which are mainly intended for the rooftop market, measure 114 mm x 176 mm and weigh 22 kg.
“Contrary to the market trend, which is moving towards thinner and thinner aluminum frames, especially for transport cost reasons, we have chosen to maintain an aluminum frame of 4 cm thickness,” said Toulouse. “This gives the panel better resistance to handling and better resistance over time.”
The company has further automated its production processes, particularly in the soldering stage. “We have also strengthened quality control because the electroluminescence inspection now takes place before lamination, which makes it possible to identify any welding inaccuracies and micro-cracks in the cells upstream,” said Toulouse.
Thanks to the continuous improvement in the sourcing of its suppliers, Systovi claims its new module has an estimated carbon footprint of approximately 23.8 CO2 eq/kWh.
“This balance sheet should drop slightly again next summer because we will be welcoming a new laminator to our site,” he added. This oven, which melts the different layers at 154 C to obtain a laminate, will have improved energy efficiency.
The company hopes, through these investments, to participate in efforts to shift the PV supply chain to France.
“However, today we are faced with multiple competition,” said Toulouse. “Chinese manufacturers are heavily subsidized and sell at low prices that are totally disconnected from their production costs. By contrast, the United States has announced significant financial support for local production with the Inflation Reduction Act (IRA). Finally, India has launched a production incentive program (PLI) to encourage the domestic manufacture of solar panels, up to 100 GW/year.”
This content is protected by copyright and may not be reused. If you want to cooperate with us and would like to reuse some of our content, please contact: editors@pv-magazine.com."
https://www.pv-magazine.com/2023/03/07/the-hydrogen-stream-japan-finances-australias-plan-to-produce-h2-from-coal/,"ENERGY STORAGE,HYDROGEN,UTILITY SCALE STORAGE,AUSTRALIA,FINLAND,JAPAN,SPAIN",SERGIO MATALUCCI,"MARCH 7, 2023",The Hydrogen Stream: Japan finances Australia’s plan to produce H2 from coal,"The Japanese government‘s Green Innovation Fund granted AUD 2.35 billion ($1.58 billion) in funding to support the commercialization of Victoria's Hydrogen Energy Supply Chain (HESC) project. Australia's most advanced clean hydrogen project has entered the commercial demonstration phase. “The funds will be delivered via Japan Suiso Energy (JSE) comprising Kawasaki Heavy Industries and Iwatani Corporation. A newly formed J-Power and Sumitomo Corporation Joint Venture (JPSC JV) will supply 30,000 tonnes of clean hydrogen gas per year to a JSE-owned and operated liquefaction and shipping facility at the industrial Port of Hastings,” said HESC. The hydrogen will be produced from Latrobe Valley coal with CO2 capture and storage facilities in the Bass Strait. JSE will liquefy the hydrogen for export to Japan, including to the port of Kobe.
Urbas and Aercom have agreed to develop green hydrogen, green ammonia, and sustainable fuels projects. The companies said they will focus on green methanol projects in Spain.
The European Commission said this week that the European Union needs to ramp up hydrogen investments in response to the US Inflation Reduction Act. European Commission President Ursula von der Leyen said that Brussels will continue negotiations with the US government on the interpretation of the legislation. 
Enersense and Q Power have agreed to deliver steel structures for reactor modules for a methanation plant. The agreement focuses on a synthetic methane production plant delivered by Q Power to P2X Solutions in Harjavalta, Finland. The plant is being built in connection with a green hydrogen production plant. “Some of the hydrogen produced sustainably in Harjavalta will be processed into synthetic methane at the methanation plant supplied by Q Power,” said Enersense. “The plant will be delivered and commissioned in 2024 at the same time as the green hydrogen production plant.”
This content is protected by copyright and may not be reused. If you want to cooperate with us and would like to reuse some of our content, please contact: editors@pv-magazine.com."
https://www.pv-magazine.com/2023/03/07/only5mins-above-and-beyond/,"HIGHLIGHTS,INSTALLATIONS,INSURANCE,MARKETS,MARKETS & POLICY,TECHNOLOGY,TECHNOLOGY AND R&D,UTILITY SCALE PV,UNITED KINGDOM",BLAKE MATICH,"MARCH 7, 2023",Only5mins! – Above and beyond,"This content is protected by copyright and may not be reused. If you want to cooperate with us and would like to reuse some of our content, please contact: editors@pv-magazine.com."
https://www.pv-magazine.com/2023/03/07/haitai-jinchen-announce-new-solar-factories-in-china/,"MARKETS,MODULES & UPSTREAM MANUFACTURING,CHINA",EMILIANO BELLINI,"MARCH 7, 2023","Haitai, Jinchen announce new solar factories in China","Haitai Solar has announced plans to invest around CNY 620 million ($91.2 million) in the construction of a new PV module factory in Qinhuangdao, Hebei province. The factory will have an annual capacity of 3 GW and will produce n-type solar products. The company aims to start construction within three months, with completion to take another nine months.
The solar panel maker says it is funding the project on its own. In August, it announced the launch of an initial public offering on the Beijing Stock Exchange. The company, which is recognized as a leading manufacturer by BloombergNEF, produces solar panels under its own brand. It also makes panels as an original equipment manufacturer for names such as JinkoSolar, JA Solar, Longi, and Trina Solar.
In a separate development, China PV production equipment manufacturer Jinchen said it is seeking to raise CNY 1 billion through a private placement of shares. It said it wants to invest CNY 410 million to expand production at its factory in Suzhou, China. The company said it will also invest CNY 310 million in the development of new production lines for heterojunction cells and modules, while setting aside an additional CNY 280 million for working capital.
Jinchen received almost 10 GW of solar module production orders from India last year. It has said that it has an additional 8 GW under discussion. The list of manufacturers placing orders includes most of the big names in the Indian industry.
This content is protected by copyright and may not be reused. If you want to cooperate with us and would like to reuse some of our content, please contact: editors@pv-magazine.com."
https://www.pv-magazine.com/2023/03/07/heat-pumps-vs-renewables-a-dilemma-for-germanys-way-out-of-gas/,"COMMERCIAL & INDUSTRIAL PV,DISTRIBUTED STORAGE,ENERGY STORAGE,HEAT PUMPS,INSTALLATIONS,MARKETS,MARKETS & POLICY,RESIDENTIAL PV,GERMANY",BEATRIZ SANTOS,"MARCH 7, 2023",Heat pumps vs. renewables – a dilemma for Germany’s way out of gas,"An international group of scientists have hypothesized that renewables-powered heat pumps could potentially be one of the fastest ways to reduce Germany’s imports of Russian gas. To test the hypothesis, they investigated whether more gas can be substituted by replacing gas boilers with renewables-powered heat pumps. They also considered the use of renewable electricity to reduce the load hours of existing gas-fired power plants.
The investigation rests on a comparison of the coefficient of performance (COP) for heat pumps with the efficiency of gas-fired power stations. The COP is defined as the amount of heat moved by the heat pump, divided by the electric power required to operate it. The scientists used the efficiency of combined cycle gas turbines (CCGT) as a reference, as they provide the bulk of gas-based electricity in Germany.
“Their average annual efficiency in 2020 is the ratio between their electricity generation, which was 95.0 TWh, and the gas consumed, which was 171.4 TWh, yielding 55%,” they said. “To account for grid losses, we lower this value to 50%.”
They assumed a COP of 2 for industrial heat pumps used in the chemical, paper, and processing industries. For residential space heating, they took the COP for a “commonly sold” air-to-water heat pump: the GMLW 14 PLUS from German heating equipment manufacturer Ochsner. Its COP varies between 3.4 and 5.3 to heat water to 35 C. To heat water to 50 C and 60 C, the COP is 3.1 and 2.8, respectively, according to the product’s datasheet. The academics assumed an average COP of 2.5 for warm water.
They modeled the German electricity system using hourly generation data of all contributing power plants, wind farms, decentralized PV, and storage capacities in 2020 – the reference year. To model near-future power generation, they included additions to PV and onshore and offshore wind, according to the plants of the German Federal Ministry of Economics and Climate Protection. They assumed that Germany would undertake sufficient grid expansion to manage these capacity additions.
The model features four scenarios: a “business-as-usual installer’s roadmap” scenario, an “accelerated” scenario, and “fast” and “very fast” scenarios. The results show that between 2022 and 2024, new solar and wind capacity mostly reduces the load hours of gas-fired power plants.
“Our hourly resolved modeling shows that this is because in these first years, there are many hours when the sun is shining and/or the wind is blowing, but not enough wind farms and PV capacities are installed to cover grid demand entirely,” said the researchers.
However, in the “fast” and “very fast” scenarios, heat pumps draw most of the newly added renewable power from 2024 to 2030. They represent the fastest way to reduce gas imports in Germany, according to the scientists.
The “very fast” scenario shows gas savings of about 30% by 2025. That is the equivalent of 290 TWh or 28 billion cubic meters, given that Germany imported 971 TWh of gas in 2020.
“Considering that in 2020, about 50% of the gas was imported from the Russian Federation, the very fast scenario can save about 60% of this gas by 2025,” they argued.
The “fast,” “accelerated,” and “installers’ roadmap” scenarios achieve total gas savings of about 22%, 18%, and 15% by 2025, respectively.
“The scenarios, developed here for Germany, must accordingly be adjusted to specifics in other countries, but offer clear, tangible, pathways to reduce the price volatility and supply risks of fossil gas,” the scientists concluded.
They shared their findings in “Replacing gas boilers with heat pumps is the fastest way to cut German gas consumption,” recently published in Nature Communications Earth & Environment.
This content is protected by copyright and may not be reused. If you want to cooperate with us and would like to reuse some of our content, please contact: editors@pv-magazine.com."
https://www.pv-magazine.com/2023/03/07/north-americas-bid-to-onshore-rare-earth-supply/,"ELECTRIC VEHICLES,GEOPOLITICS,OPINION & ANALYSIS,POLICY,CALIFORNIA,CANADA,NORTH AMERICA,UNITED STATES",,"MARCH 7, 2023",North America’s bid to onshore rare earth supply,"With the electric vehicle market expected to drive demand for 200,000 tons of rare earth elements in North America through 2030, work is being put in by industry and policy makers to restore the region's rare earth element supply chain.
Efforts are being made in Canada and the US to shift dependency away from Chinese rare earth element reserves. There are many reasons why North America is looking to onshore its processes, one of the biggest being concern around potential supply chain choke points in the event China decides to cut off rare earth element supply due to geopolitical wrangles.
Demand for the material is expected to skyrocket, with an estimated 315,000 tons of rare earth elements needed by 2030, most of them for EVs.
What is being done by North American mines to ensure they can keep up with demand without needing to rely on Chinese rare earth element supply and Far Eastern separation facilities? What type of government policy needs to be implemented to help speed the onshoring process along?
Las Vegas-based MP Materials owns the only operating rare earth mine and processing facility in the US. The Mountain Pass Mine, in California, is an open pit site that supplied 15.8% of the world’s rare earth production in 2020. In late April, MP Materials began construction at its first rare earth metal, alloy, and magnet manufacturing facility with the intention of fully restoring the US' rare earth magnetics supply chain. The plans include establishing hydrometallurgy and separation facilities, along with the manufacturing fab, at a site expected to be completed in 2025. Becoming a closed-loop operation that can convert refined materials into metals and alloys would mean the company would no longer have to export its mineral concentrate material to China for processing, thereby onshoring the process and decoupling the current supply chain.
MP Materials' substantial, $700 million investment is the first of its kind in the US and would be able to produce approximately 1,000 tons per year of neodymium-iron-boron (NdFeB) magnets, thereby supporting the production of approximately 500,000 EV motors, with room to scale. In addition to electric vehicles, NdFeB magnets are used in robots, drones, defense systems, wind turbines, and many other high-growth technologies.
Just before construction began at the mine, MP Materials was awarded $35 million by the US government's Department of Defense to refine and separate heavy rare earth elements to further support onshoring of both the mining and processing procedures. At around the same time, MP Materials and General Motors (GM) announced a definitive supply agreement for Mountain Pass to produce alloys and magnets for GM's electric vehicle programs. Under the long-term contract, MP Materials will supply US-sourced and manufactured rare earth materials, alloy, and finished magnets for the electric motors for more than a dozen GM models, with a gradual production ramp expected to begin late this year, starting with alloy supply.
This means that not only will Mountain Pass be expected to produce enough rare earth elements to fulfill the Pentagon’s Department of Defense requirements, it must also meet the alloy requirements needed to make electric motors for GM. How is this all possible without significant government support?
Although tremendous efforts have been made to begin decoupling supply chains from China, to shift processing to onshore facilities, there is still a significant gap between domestic supply and demand. One solution to this which US president Joe Biden and Canadian prime minister Justin Trudeau should consider is the creation of upstream investment incentives for suppliers of these critical minerals – particularly the metals needed for EV motors.
In late December, the Canadian government published a strategy to increase the responsibly-sourced supply of 31 critical minerals. It was backed by $3.8 billion in the 2022 budget, including $40 million to support northern regulatory processes and a 30% exploration tax credit for targeted minerals.
The issue is that these budget promises are currently no more than smoke and mirrors. Brandon Macdonald, CEO and director of Canadian miner Fireweed Metals, says he would like Ottawa to extend flow-through tax credits as there is capital scarcity during the lengthy permitting process for mining.
Flow-through shares are stock issued by mining companies at a higher price than common shares. The issuer agrees to forego, on flow-through shares, the tax deductible benefit due under Canadian law that is associated with mining exploration and development. Instead, investors buying flow-through shares can themselves claim those tax deductions, with such stock helping miners raise finance during capital-intensive exploration efforts.
Macdonald is also calling on the Canadian government to invest in infrastructure including roads, power grids, smelters, and refineries. Although Ottawa’s strategy is meant to accelerate strategic projects, build sustainable infrastructure, and make assessments more efficient, if the right companies – the ones uniquely positioned to begin fulfilling national demand within a couple of years – are not supported financially, the nation could be no closer to decoupling supply chains in 2025 than it is today.
Much work remains to be done to onshore North America's rare earth element supply chain.
If the US and Canadian governments explore different incentives for junior mining companies, the sector could see expedited infrastructure and supply chains decoupled from China becoming a reality much, much more quickly. The time to act is now, given rare earth element demand is expected to soar as North America looks to reduce its carbon footprint by rolling out EVs at mass scale.
Ultimately, the grip China has over North American supply is expected to loosen over time, particularly as new mines such as Mountain Pass come into full operation, but onshore rare earth processing could be further accelerated with the help of proper government funding and support from policy makers.
The world outside China needs more rare earth element mines and processing and separation facilities in order to reduce its dependence on the Far East for critical minerals.
About the author: Dr Luisa Moreno is president of Vancouver-based rare earth miner Defense Metals Corp. She is a physics engineer with a PhD in materials science and mechanics from Imperial College London, in the UK. She is known as a leading analyst in rare earths and has published several reports and articles for the investment community. Dr. Moreno has co-authored a book on mineral processing and project financing and authored a number of advanced industry and technical reports on several technology minerals.
The views and opinions expressed in this article are the author’s own, and do not necessarily reflect those held by pv magazine.
This content is protected by copyright and may not be reused. If you want to cooperate with us and would like to reuse some of our content, please contact: editors@pv-magazine.com."
https://www.pv-magazine.com/2023/03/07/extending-iec-61853-standard-to-bifacial-solar/,"COMMERCIAL & INDUSTRIAL PV,HIGHLIGHTS,MODULES & UPSTREAM MANUFACTURING,RESIDENTIAL PV,TECHNOLOGY AND R&D,UTILITY SCALE PV,NETHERLANDS",EMILIANO BELLINI,"MARCH 7, 2023",Dutch researchers propose modified IEC 61853 standard for bifacial solar,"Researchers from the Delft University of Technology in the Netherlands have tried to show that the IEC 61853 standard, which describes fundamental construction requirements for PV modules, could be extended to bifacial panels.
“Our work provides a comprehensive approach for calculating the energy rating of bifacial modules and shows that, in order to make it consistent with the existing standard, the Climate Specific Energy Rating (CSER) should be normalized with the front side irradiation,” researcher Malte Vogt told pv magazine.
Vogt noted that the IEC 61853 is currently applicable exclusively to monofacial panels. “Our paper is a step toward updating the standard to also cover bifacial modules, which are increasing in market share rapidly,” said Vogt.
In particular, the scientists suggest changes for the third part of the IEC 61853 standard, which combines module measurements and climate data in an energy yield and rating calculation algorithm. They also recommend changes for the fourth part, which defines the reference climates with hourly irradiation, temperature, wind speed, and angle of incidence data.
The Dutch group said the climate data from the fourth part could be expanded to take in all of the irradiance values for bifacial modules. They said that in the third part, the energy yield calculation algorithm needs to be adjusted for bifacial panel configurations.
The academics introduced a new model to calculate the rear irradiance and said its calculation should be performed exclusively by creating the bifacial module energy rating climate data and not by every user.
“It extends the climate data from IEC 61853-4 to provide additional rear irradiance components necessary for bifacial modules,” they said.
They split the rear irradiance (Gr) into beam direct, sky diffuse, and ground reflected diffuse irradiance.
“Note that we use 20-degree module tilt angle in order to enable a comparison of monofacial and bifacial module energy ratings, as the monofacial standard fixes the angle to 20 degrees for all climates irrespective of what the optimum tilt for the climate might be,” the scientists said, noting that east–west-oriented and vertical installations, as well as systems with trackers, were not considered.
The researchers said they maintained the IEC 61853 standard's four main calculation steps for monofacial panels, while correcting angular losses for the yield calculation algorithm.
“In contrast to the standard, we apply it twice once for the front and once for the rear irradiation,” they explained, noting that they implemented a correction of the ground-reflected irradiance, as well as spectral correction.
The team tested the algorithm with two different approaches under real outdoor conditions over a nine-month period. One of the two methods gives the same CSER value for a bifaciality of zero as the monofacial module. The other one always gives a lower CSER.
The scientists said that their work consists of extending the rear-side angular correction for ground-reflected irradiance and combining total and effective irradiance in the temperature and power calculation steps.
“Thus, only relatively simple calculation steps and no measurements, which are not already used for the front side, are added when extending the standard to bifacial modules,” they said. They presented their findings in “Developing an energy rating for bifacial photovoltaic modules,” which was recently published in Progress in Photovoltaics.
This content is protected by copyright and may not be reused. If you want to cooperate with us and would like to reuse some of our content, please contact: editors@pv-magazine.com."
