url,tag,author,updated_date,title,contents
https://www.pv-magazine.com/2023/03/07/new-polymer-electrolyte-for-lithium-metal-batteries/,"DISTRIBUTED STORAGE,ENERGY STORAGE,TECHNOLOGY,TECHNOLOGY AND R&D,UTILITY SCALE STORAGE,CHINA",MARIJA MAISCH,"MARCH 7, 2023",New polymer electrolyte for lithium-metal batteries,"While lithium metal batteries could offer better safety, better energy density, and lower weight than lithium-ion technology – thanks to the replacement of heavier graphite with lithium metal as anode – this battery chemistry does not work well with conventional electrolytes.
Therefore, research efforts have been directed toward solid electrolytes that can provide improved performance and are compatible with the lithium metal anode, which currently exhibits the highest theoretical specific power capacity.
Now, researchers at the University of Hong Kong (HKU) have engineered solvent-free single-ion polymer electrolytes which have delivered a significant improvement in ionic transport for lithium-metal battery applications.
Namely, in liquid electrolytes, lithium cations and counter anions move in opposite directions to conduct electricity. Normally, anions move at least four times faster than lithium cations, and thus lithium cation transfer contributes only a small fraction (20%) of the overall ionic current. Meanwhile excessive anions accumulate at the interface between electrode and electrolyte, causing internal short circuits and capacity fade of the battery.
The newly single-ion conducting polymer electrolytes designed by HKU researchers are reported to overcome these limitations and lead to at least fourfold increase in cationic transport.
The anionic network polymers consist of borate anions bridged by branched ethylene glycol linkers of differing stoichiometric ratios, in which the anions are tethered into the polymer frame, enabling a highly selective cation transport.
The researchers controlled the cation conductivity within the polymer by systematic engineering of segmental mobility. This helped them map out the comprehensive design rules for a new class of highly conductive solid electrolytes, successfully overcoming the persistent problems of current solid electrolytes, such as low cyclability and high overpotential.
“We believe the single-ion conducting polymer electrolytes would open up the possibility of new battery chemistries that will revolutionize the field of rechargeable batteries, and offer a high level of safety, high power density, and long life cycle,” said Jingyi Gao, the first author of the research paper.
According to Dr Dong-Myeong Shin of HKU, the ion-selective electrolytes can also result in fast charging due to low overpotential. “It can allow electric vehicles to be fully charged in just the time needed for drinking a cup of coffee. This remarkable advantage will unlock a new era of a clean energy world,” he adds.
Their findings were discussed in “Engineered networking in a family of solvent-free single-ion conducting borate network polymer electrolytes for Li-metal battery applications” published in Chemical Engineering Journal.
This content is protected by copyright and may not be reused. If you want to cooperate with us and would like to reuse some of our content, please contact: editors@pv-magazine.com."
https://www.pv-magazine.com/2023/03/07/raptor-maps-points-to-growing-problem-of-pv-system-underperformance/,"INSTALLATIONS,MODULES & UPSTREAM MANUFACTURING,SOILING,UTILITY SCALE PV,UTILITY SCALE STORAGE,UNITED STATES,WORLD",BEATRIZ SANTOS,"MARCH 7, 2023",Raptor Maps points to growing problem of PV system underperformance,"US-based Raptor Maps has published its latest annual report on global PV system underperformance. The solar lifecycle management software specialist performed aerial inspections across 24.5 GW of large-scale solar systems.
The inspection statistics show that solar assets are becoming more anomalous each year. Underperformance due to anomalies nearly doubled from 1.61% in 2019 to 3.13% in 2022, said the company. Power losses have increased by 94% since 2019, it added, noting that anomaly-driven power losses could grow to almost 6% by 2025 at the current rate.
Raptor Maps estimates annual losses of $82 million for the 24.5 GW of assets it inspected in 2022, at an average of an $3,350 annual loss per megawatt.
“Extrapolating across total global PV capacity (as of the end of 2021, excluding residential) translates to a $ 2.5 billion annual revenue loss for the industry,” the company said.
The report includes data on underperformance by site size and module-level anomalies for the first time. The figures show that smaller sites had the highest average power losses as a percentage of their generation capacity. However, the largest sites exhibited higher average power losses. Sites between 100 MW and 200 MW in size had average power losses of 4.04% – 29% higher than the global average.
“Sites larger than 200 MW are losing, on average, around $4,320 per MW, with some sites losing up to $12,900 per MW,” claimed Raptor Maps.
The report shows that system-level anomalies are the largest drivers of power losses, with string, inverter, and combiner anomalies affecting the most power as a percentage of total power inspected, at 1.06%, 0.70%, and 0.67%, respectively. String anomalies were reportedly responsible for 34% of lost revenue, while inverter and combiner anomalies were respectively responsible for 22% and 21%.
At the module level, Jinko Solar, First Solar, Trina Solar, Canadian Solar, and Longi were the top five manufacturers of inspected assets. Cell and diode anomalies were the most common module-level and sub-module-level anomalies among these manufacturers, according to Raptor Maps. Combined, the two categories accounted for roughly 70% of observed defects. Physical damage accounted for 18% of defects.
The next issue of pv magazine, due out on Thursday, will focus on the solar manufacturing technology enabling the new era of market expansion and high efficiency modules, including interdigitated back contact (IBC) and perovskite tandem solar cells. The magazine charts the latest technical and investment decisions in the high efficiency solar manufacturing segment and the materials and R&D underpinning them. Reports come in from France, Japan, India, Indonesia, Israel, England, the US, and China and we also examine the troubles of the solar-powered car pioneers.
Monocrystalline modules were found to be considerably less defective than polycrystalline and thin film technologies, by 65% and 41%, respectively. The inspected thin-film modules were purportedly more susceptive to physical damage such as cracking, delamination, and warping. They showed three times more physical damage than polycrystalline and 12 times more than monocrystalline. Hot spots were also found much more frequently in thin-film modules than in the other two technologies.
“The report underscores the need for asset owners and managers to monitor equipment performance over time, proactively identifying maintenance issues and warranty claim opportunities,” said Raptor Maps.
This content is protected by copyright and may not be reused. If you want to cooperate with us and would like to reuse some of our content, please contact: editors@pv-magazine.com."
https://www.pv-magazine.com/2023/03/07/sterlite-power-commissions-5-gw-green-energy-corridor-project-in-india/,"GRIDS & INTEGRATION,MARKETS,UTILITY SCALE PV,INDIA",EMILIANO BELLINI,"MARCH 7, 2023",Sterlite Power commissions 5 GW green energy corridor project in India,"From pv magazine India
Sterlite Power, a private-sector power transmission infrastructure developer, has commissioned its new green energy corridor project, Lakadia-Vadodara Transmission Project Ltd (LVTPL). The project aims to deliver more than 5 GW of power from renewable-rich regions of Bhuj and Kutch in Gujarat to the national grid – a step towards accelerating India’s transition towards a greener economy.
The inter-state transmission project is built with an investment of $244.4 million. It connects the substation at Lakadia to Vadodara via a 335 km, 7 65 kV double-circuit transmission line. 
“With 812 towers spanning seven districts in Gujarat, this power transmission corridor is also one of the largest transmission corridors built in India to date,”  said Sterlite Power.” Additionally, it forms a critical part of the world’s largest 30 GW hybrid renewable energy park coming up in Kutch.”
Sterlite Power has a portfolio of 30 projects across India and Brazil. It has a portfolio of high-performance power conductors, extra-high voltage (EHV) cables, and optical ground wires. 
This content is protected by copyright and may not be reused. If you want to cooperate with us and would like to reuse some of our content, please contact: editors@pv-magazine.com."
https://www.pv-magazine.com/2023/03/07/meyer-burger-shifting-to-100-glass-glass-bifacial-panels/,"MODULES & UPSTREAM MANUFACTURING,SWITZERLAND",JOHN FITZGERALD WEAVER,"MARCH 7, 2023",Meyer Burger shifting to 100% glass-glass bifacial panels,"From pv magazine USA
Meyer Burger has announced that in the future, it will only manufacture glass-glass bifacial solar modules. The Swiss manufacturer cites two main reasons for making the switch to glass. First, it wants to create a “unified, leaner and flexible concept for Meyer Burger’s future solar modules.” The group said that leaner production and logistics processes will lead to faster scalability of new manufacturing.
Over the short term, Meyer Burger said that the change will actually slow down manufacturing volumes in existing facilities as it transitions. The company’s Goodyear manufacturing site in the United States will be glass-glass from its start date next year.
While manufacturing speed and efficiency is of the utmost importance in the solar industry, there is another, more important reason for Meyer Burger’s decision: Glass-glass solar modules are a better technology than their plastic backsheeted siblings.
Officially, the manufacturer’s warranty suggests that their “Meyer Burger Glass” solar module will degrade at 0.2% or less per year, for 30 years. That means that a Meyer Burger glass-glass module bought today should be expected to produce at least 93.2% of its original output in the year 2053. In theory, if that degradation rate holds, a glass-glass Meyer Burger panel would still produce 89.2% of its original power rating after 50 years.
To continue reading, please visit our pv magazine USA website.
 
This content is protected by copyright and may not be reused. If you want to cooperate with us and would like to reuse some of our content, please contact: editors@pv-magazine.com."
https://www.pv-magazine.com/2023/03/07/kstar-unveils-battery-inverter-solution-for-ci-applications/,"COMMERCIAL & INDUSTRIAL PV,DISTRIBUTED STORAGE,ENERGY STORAGE,INSTALLATIONS,TECHNOLOGY,TECHNOLOGY AND R&D,CHINA,WORLD",BEATRIZ SANTOS,"MARCH 7, 2023",KStar unveils battery inverter solution for C&I applications,"KStar has launched a new all-in-one energy storage system with an inverter and battery module. It is designed for commercial and industrial (C&I) applications.
The China-based storage and inverter manufacturer said the 5.12 kWh, 512 V batteries feature lithium iron phosphate (LFP) battery cells from CATL. They include two clusters of batteries connected in parallel with 10 modules each in what KStar calls a “1+1 redundancy” design.
“If one battery cluster fails, the other 52.1 kWh battery cluster can still work normally,” KStar said in a statement. “They serve as each other's backup, 1+1 redundancy design ensures the stability of the system operation.”
The system capacity can be expanded to 1 MW/2 MWh, according to KStar. The batteries fits in an outdoor cabinet measuring 1,100 mm x 1,1000 mm x 2,380 mm and weighing 1.5 tons. It comes with IP54 protection and operates in temperatures ranging from -30 C to 50 C. The maximum operating altitude is 4,000 meters, with derating starting at 3,000 meters.
The system reportedly “enables the power generation to restore a stable power grid, optimize the power output curve, reduce solar curtailment, increase the proportion of renewable energy in total power generation, and optimize the energy structure,” the manufacturer said.
The inverter has 50 kW power output. It has three maximum power point tracking (MPPTs) with an input voltage range of 350 V to 800 V. It has an efficiency rating of 97.5% and the maximum PV input voltage is 1,000 V.
The transformerless inverter measures 650 mm x 715 mm x 325 mm and weighs 75 kg. It comes with IP65 rating and features intelligent air cooling. It operates in temperatures ranging from -25 C to 60 C.
The new solution is pre-installed in factory for easy installation on-site. It features double fire suppression design.
This content is protected by copyright and may not be reused. If you want to cooperate with us and would like to reuse some of our content, please contact: editors@pv-magazine.com."
