url,tag,author,updated_date,title,contents
https://www.pv-magazine.com/2022/12/08/paths-to-commercial-success-for-renewable-energy-tech/,"MODULES & UPSTREAM MANUFACTURING,TECHNOLOGY AND R&D,UNITED STATES",ANNE FISCHER,"DECEMBER 8, 2022",Paths to commercial success for renewable energy tech,"From pv magazine USA
Research and development is vital in the development of new technologies, yet there are many obstacles to overcome before they can move from the lab to the marketplace.
Analysts from the National Renewable Energy Laboratory (NREL), Joint Institute for Strategic Energy Analysis (JISEA), and US Department of Energy (DoE) analyzed case studies for the commercialization of four clean energy technologies. They looked at thin-film solar panels, wind turbines, dual-stage evaporators for refrigeration, and fuel cells for material handling equipment.
Findings across the case studies – published in a recent Frontiers in Energy Research article – revealed three components common to successful advancement to commercialization: (1) a good fit among public-private partnerships, R&D infrastructure, and the technology itself; (2) appropriate alignment of government regulations, R&D priorities, and market forces; and (3) the right timing between technology readiness and market opportunity.
“These findings can help inform clean energy investment decision-making, maximize benefits from R&D, and advance transition to a productive, low-emission future,” said Wyatt Merrill, DoE technology manager and co-author.
The thin-film solar case study focuses on First Solar, a US manufacturer that benefited from DoE solar research, and directly received DoE funding in research partnerships from the 1980s to 2000s. The researchers credit First Solar’s early success to the fact that the company addressed regulatory needs within the thin-film PV technology’s first major market and established a proven product at a price and time for a market that was ready for it.
A notable advance in the early stages of thin-film research demonstrated a record (at the time) of 15.8% cell using a cadmium chloride (CdCl2) heat treating process. First Solar co-developed a high-rate vapor transport deposition manufacturing technique to produce CdTe-based modules at a larger scale, which was an alternative to the slower, costlier close space sublimation manufacturing process.
With suitable device efficiency and scalable manufacturing procedures in place, the R&D focus shifted to testing and validation of product reliability. First Solar used testing standards, product quality certifications, and outdoor testing facilities funded by the DoE and led by Arizona State University and NREL to prove by 2003 that its modules were ready to enter the solar market.
First Solar entered the strong German solar market in the 2000s. But first, its modules needed to meet energy performance and regulatory requirements, which included electronic waste regulation and restrictions on the use of certain toxic substances like cadmium. A 2004 effort helped resolve concerns about emissions and recyclability of CdTe PV modules with independent, peer-reviewed studies.
Later in 2004, First Solar secured its first contract for its compound thin semiconductor modules in the German PV market, which was a commercial turning point for CdTe PV. In 2005, First Solar announced a module takeback and recycling program to respond to evolving EU policy directives, an effort that helped communicate First Solar’s responsiveness to regulatory issues, and they addressed public perception of risk sufficiently to access key markets.
While CdTe modules are less efficient than silicon-based panels, they cost less to manufacture and achieved the lowest price per watt from the mid-2000s until the mid-2010s. At the same time, demand for PV products in Europe outpaced supply, and First Solar was able to capitalize on its technology.
“The thin-film PV case study shows the importance of addressing regulatory needs within the technology’s first major market,” said Marie Mapes, DoE technology manager and co-author. “In addition, establishing a proven product at a price and time when the market was ready for it led to its early success.”
The key findings in the thin-film PV case study identified the successful use of three key commercialization strategies: development of technology with many commercially relevant inputs through public/private partnerships, alignment of set technology cost goals and product development that achieved them, and timing compatibility of technology readiness and market opportunity.
First Solar’s thin-film development benefited from government funding over decades, which enabled foundational materials research and consistent testing standards. What resulted was a prepared company with the right product at the right time. CdTe photovoltaics of proven reliability were a lower-cost replacement in a clean energy market with an open window of opportunity, allowing the early commercialization success of this solar technology.
The four case studies highlight how a good balance of technology, R&D, and public-private partnership – along with regulatory and market force alignment and the right timing – can lead to successful first commercialization of clean energy technologies.
This content is protected by copyright and may not be reused. If you want to cooperate with us and would like to reuse some of our content, please contact: editors@pv-magazine.com."
https://www.pv-magazine.com/2022/12/08/trina-solar-unveils-425-w-all-black-solar-module-with-21-3-efficiency/,"COMMERCIAL & INDUSTRIAL PV,MODULES & UPSTREAM MANUFACTURING,RESIDENTIAL PV,TECHNOLOGY AND R&D,AUSTRALIA,CHINA",DAVID CARROLL,"DECEMBER 8, 2022",Trina Solar unveils 425 W all-black solar module with 21.3% efficiency,"From pv magazine Australia
The latest version of Trina Solar’s Vertex S All-Black solar module has a power output of up to 425 W and a maximum efficiency of 21.3%.
The Chinese manufacturer said single module power for the upgraded version of the series has increased by up to 30 W. This additional power has been achieved by implementing the latest 210 mm rectangular silicon wafer technology, instead of regular square-shaped cells.
The product is backed by a 25-year product and 25-year performance warranty. End power output is guaranteed to be no less than 84.8% of the nominal output power, while degradation in the first year should not exceed 2%.
Trina Solar said the Vertex S Aesthetic module is compatible with mainstream optimizers, inverters, and mounting systems available in Australia.
The module measures 1,754 mm × 1,096 mm × 30 mm and weighs in at 21 kg, It has been designed for residential applications and commercial and industrial installations. Trina Solar Asia Pacific President Todd Li said he is confident that the installer-friendly Vertex S will secure a significant share of the Australian rooftop PV market.
“We are seeing strong interest from Australian households for this product because of its performance, in terms of higher power output and efficiency,” he said, adding part of the appeal of the Vertex S Aesthetic module is its sleek look.
The Vertex S Aesthetic module appears more matte and has minimal glass reflection thanks to a double layer of anti-reflection coating (ARC). The module also has a uniform black colour due to a dedicated cell-blackening treatment.
“More and more Australian households are installing solar on their rooftops, so we make sure we offer a wide choice of module designs to complement various styles of roofs and help aesthetically-minded homeowners,” said Li. “The black color cells with ultra-fine busbars, together with a fine layout of the black frame, back-sheet, black label and string busbars, makes Vertex S All-Black visually appealing for households.”
This content is protected by copyright and may not be reused. If you want to cooperate with us and would like to reuse some of our content, please contact: editors@pv-magazine.com."
https://www.pv-magazine.com/2022/12/08/adani-green-commissions-450-mw-hybrid-wind-solar-plant-in-india/,"MARKETS,UTILITY SCALE PV,INDIA",UMA GUPTA,"DECEMBER 8, 2022",Adani Green commissions 450 MW hybrid wind-solar plant in India,"From pv magazine India
Adani Green Energy Ltd. (AGEL), the renewables unit of the Adani Group, has become the world’s largest wind-solar hybrid power developer with the commissioning of its third wind-solar hybrid power plant in the Jaisalmer district of Rajasthan.
The developer now has a cumulative operational hybrid capacity of 1,440 MW, including its newly commissioned 450 MW power plant in Jaisalmer.
The Jaisalmer plant consists of 420 MW of solar and 105 MW of wind. It has a power purchase agreement with Solar Energy Corp. of India (SECI) at a tariff rate of INR 2.67 ($0.032)/kWh over 25 years.
AGEL’s other two operational wind-solar plants include 390 MW and 600 MW in Jaisalmer. It commissioned the plants in May and September, respectively. The company now has a total operational generation capacity of 7.17 GW.
This content is protected by copyright and may not be reused. If you want to cooperate with us and would like to reuse some of our content, please contact: editors@pv-magazine.com."
https://www.pv-magazine.com/2022/12/08/italy-expected-to-install-12-gw-of-solar-in-2023-24-period/,"COMMERCIAL & INDUSTRIAL PV,INSTALLATIONS,POLICY,RESIDENTIAL PV,UTILITY SCALE PV,ITALY",SERGIO MATALUCCI,"DECEMBER 8, 2022",Italy expected to install 12 GW of solar in 2023-24 period,"The Italia Solare industry association said it expects exponential growth of PV installations in Italy over the next two years, driven mainly by the industrial segment.
“From about 1,000 MW last year, in 2022, we should almost double to about 2 GW,” Italia Solare President Paolo Rocco Viscontini told pv magazine at the recent Italia Solare Forum in Rome. “For 2023, a doubling from this year is very likely, and for 2024 a further doubling, so we are talking about 2 GW, 4 GW, and 8 GW.”
Industrial installations are growing at the fastest pace, followed by ground-mount solar installations.
Italian consultancy Elemens said 39% more permits were allocated in the first 10 months of this year than in the same period of 2021. Authorizations for PV installations reached 3,319 MW in the January-October period.
“There does not appear to be no obvious correlation with the simplifications, any effects of which have yet to be absorbed by the market: rather, the reasons seem to depend mainly on the pressure exerted by the large number of projects filed,” Tommaso Barbetti, a partner at Elemens, said during the Italia Solare Forum.
Elemens splits the Italian solar market into three areas: Sicily, Apulia, and the rest of the country. The first two regions have high potential and demand, while the third offers good potential. Elemens said that 39% of all projects larger than 1 kW had still not started the authorization process, a full year after the first connection request.
“The issue of connections to the grid is undoubtedly an important and critical point because the demands are very high, much higher than what the country will need,” said Viscontini.
Connection requests keep the grid busy – especially the high-voltage networks. But Italia Solare's assessment of the new government is mixed. It has proceeded with changes in the ministries, as it has created the Ministry of Environment and Energy Security (MASE) to replace the Ministry of Ecological Transition.
“We certainly think the willingness of the new MASE minister, Pichetto Fratin, to dialogue is positive,” said Viscontini. “Less good was the draft of the budget law, particularly concerning the management of extra profits for power producers, which is once again wrong and confusing.”
Connections, authorizations, building rules, and finance are needed for the industry to exploit the country's full potential. In general, analysts are asking for more clarity. Italia Solare is also demanding clear rules for agrivoltaic projects, especially when it comes to defining which projects are eligible for incentives.
“We hope that agrivoltaics can be done even without incentives, but this means facilitating approvals for plants that are not financially burdensome,” said Viscontini. “We need agrivoltaic projects that are not expensive and not complicated. Certainly, systems involving plants with particularly high structures relative to the land are more expensive and therefore need incentives.”
This content is protected by copyright and may not be reused. If you want to cooperate with us and would like to reuse some of our content, please contact: editors@pv-magazine.com."
