url,tag,author,updated_date,title,contents
https://www.pv-magazine.com/2022/12/08/more-than-1-million-european-homes-powered-by-solar-batteries/,"DISTRIBUTED STORAGE,ENERGY STORAGE,MARKETS,POLICY,EUROPE",MARIJA MAISCH,"DECEMBER 8, 2022",More than 1 million European homes powered by solar batteries,"The number of residential battery energy storage systems (BESS) installed across Europe jumped from 650,000 in 2021 to more than 1 million in 2022, according to the latest figures from SolarPower Europe.
The total installed capacity of home batteries in Europe has grown from around 3 GWh in 2020 to more than 5 GWh in 2021 and beyond the 9 GWh mark this year. The top five European markets for home batteries – Germany, Italy, Austria, the United Kingdom, and Switzerland – were responsible for 88% of the installed batteries in Europe in 2021, with Germany leading the pack with a 59% share.
“In years defined by high retail electricity prices, solar and storage help to reduce electricity bills,” said Walburga Hemetsberger, CEO of SolarPower Europe. “It is no surprise that consumers are installing record numbers of battery powered homes every year.”
The solar industry trade association said the number of homes hosting solar batteries in Europe will likely triple to 3.5 million by 2026. In the best-case scenario, it could be nearly 40% more, with the right policy frameworks in place, it claimed. It is now calling on policymakers to present a comprehensive EU electricity storage strategy and a target of 200 GW by 2030.
This content is protected by copyright and may not be reused. If you want to cooperate with us and would like to reuse some of our content, please contact: editors@pv-magazine.com."
https://www.pv-magazine.com/2022/12/08/germany-slashes-vat-for-residential-pv-to-0/,"COMMERCIAL & INDUSTRIAL PV,DISTRIBUTED STORAGE,ENERGY STORAGE,MARKETS,RESIDENTIAL PV,GERMANY",PILAR SÁNCHEZ MOLINA,"DECEMBER 8, 2022",Germany slashes VAT for residential PV to 0%,"From pv magazine Germany
The German parliament debates an annual tax law at the end of every year, in order to pass new rules for the 12 months ahead. The 2022 annual tax law, which the Bundestag approved last week, includes a comprehensive change in the tax treatment of PV systems for the first time.
The new rules will resolve some key problems for small PV systems and will eliminate some bureaucratic requirements. The legislative package contains two important changes for photovoltaics. The first measure will slash the VAT to 0% for residential PV systems up to 30 kW in size. The second measure will provide tax exemptions to operators of small PV systems.
The new 0% VAT rate for PV systems has been made possible by a new regulation in the European VAT Directive, and Germany is now a pioneer in its application. Formally, it is not a VAT exemption on the sale of a PV system, but the supplier or installer bills the customer for the net price, “plus 0% VAT.”
The zero rate of VAT will be applied to the supply and installation of PV systems with the necessary accessories. It will also apply to storage systems in residential buildings, public buildings, and buildings used for public utility activities. There are no limits for the size of the storage systems.
The income tax exemption will be applied to income from the operation of PV systems up to 30 kW in size for single-family homes and other buildings. In the case of multi-family homes, the size limit will be set at 15 kW per residential and commercial unit and 100 kW per multi-family home.
This content is protected by copyright and may not be reused. If you want to cooperate with us and would like to reuse some of our content, please contact: editors@pv-magazine.com."
https://www.pv-magazine.com/2022/12/08/pv-system-fires-potentially-exacerbated-by-gap-between-solar-panels-rooftops/,"COMMERCIAL & INDUSTRIAL PV,MODULES & UPSTREAM MANUFACTURING,RESIDENTIAL PV,TECHNOLOGY AND R&D,NORWAY",EMILIANO BELLINI,"DECEMBER 8, 2022","PV system fires potentially exacerbated by gap between solar panels, rooftops","Rise Fire Research, an institute in Norway, has conducted a series of experiments indicating that the distance between solar modules and rooftop surfaces could be a crucial factor in PV system fires.
“We have not found any single ideal distance between the roof and the PV modules that can prevent fire propagation,” researcher Ragni Fjellgaard Mikalsen told pv magazine. “But we have seen that the gap distance is one of several parameters that affect the fire spread.”
The scientists said that wind speed and air gap size could affect the development of fires in the space between solar modules and the underlying roof structures. They also looked at how fires could affect PV systems on real, pitched rooftops in Norway. They performed 29 experiments at the institute's facility in Trondheim in 2021.
The research group identified a link between the size of the gap between a rooftop surface and the modules, and determined how big an initial fire would have to be for the blaze to spread and become larger. 
“These, and other experiments, point to that a larger gap distance decreases the flame propagation, but other parameters, like inclination, ignition source, combustible materials can also affect the fire dynamics in the air gap,” said Fjellgaard Mikalsen.
She claimed that there are no testing methods or standards that properly consider the interplay between PV modules and building surfaces.
“The test methods for building materials are not including the possibility to add PV modules, and the test methods for PV modules are not considering what building surface they should be installed on,” she said. “For building integrated PV modules, the modules need to comply with both the regulations for building materials and as an electrical installation.”
She said that the modules were tested against one of the four European test methods listed in CEN/TS 1187, but noted that these test methods are not particularly well-suited to test PV modules.
“The American test standard UL 1703 / UL 61730 includes some fire tests where the combination of roofing material and PV installation is handled,” she said. “These are based on the test for roofing materials UL 790 where the roof is exposed to an external flame.”
The scientists said that future standards for Norwegian PV installations should be harmonized on a European level, and preferably globally.
“Ideally, the test standards should consider the interactions between the building surface and the PV modules and test the systems at a sufficiently large scale to include the important details of the building surface, fixing system and PV modules,” Fjellgaard Mikalsen said. “To be able to document the fire performance of different combinations of roofing materials, fixing systems and PV modules, a structured classification scheme could be developed.
A similar study, published by the University of Edinburgh and the Technical University of Denmark, showed similar results. The scientists analyzed fire dynamics and flame spread on the substrate beneath panels. They concluded that the shorter the distance between the panels and rooftop, the higher the probability of larger and more destructive fires.
This content is protected by copyright and may not be reused. If you want to cooperate with us and would like to reuse some of our content, please contact: editors@pv-magazine.com."
https://www.pv-magazine.com/2022/12/08/regulator-could-prove-solars-nemesis/,"DISTRIBUTED STORAGE,OPINION & ANALYSIS,POLICY,RESIDENTIAL PV,CALIFORNIA",,"DECEMBER 8, 2022",Regulator could prove solar’s NEMesis,"On Dec. 13, 2021, CPUC issued a proposed decision (PD) on reforming the NEM 2.0 net-metering regulations instituted in 2016, by introducing NEM 3.0. The proposed decision – for consideration by the five commissioners at the regulator – came in for severe criticism from celebrities and public figures, including former governor Arnold Schwarzenegger and actor Ed Norton. Professor Severin Borenstein, at the University of California’s Energy Institute, has also considered the merits of the proposed legislation.
Three negative features stood out: a discriminatory grid-access charge of $8 per kilowatt per month, an unprecedented retroactive application of the proposed new rules to NEM 1.0 and NEM 2.0 customers, and a significant drop in the electricity export compensation rate.
Those features would have crippled the economics of rooftop solar. The payback period for solar panel systems would have doubled or tripled. Solar adoption rates would have plummeted.
The proposed decision was totally at odds with the state’s net-zero goals, which include a mandate that all new homes shall have solar panels on their roofs. The premise for instituting such drastic measures was CPUC’s desire to eliminate a cost shift that supposedly penalized the poor and benefited the rich.
The proposal, however, ignored all other cost shifts that arise in the design of electricity rates. It ignored subsidies provided by the state to low-income customers. It ignored the $1.5 billion that the state spends every year on energy efficiency programs which cause usage to go down, creating another beneficial cost shift.
Under pressure from the public, a second proposed decision, released on Nov. 10, suggests removing the grid-access charge and the retroactive provision. Removing those two elements, however, does not make the second draft worthy of admiration.
The “poor-to-rich” cost-shift narrative still permeates the entire document. The sole purpose of the latest proposed replacement for NEM 2.0 is to reduce the growth in installation of rooftop solar panels. That was also the motivation behind the first PD.
The export compensation rate, paid to solar system owners for electricity they inject into the grid, drops dramatically within a few years under the latest proposed revision. Calling the reduction a “glide path” is a misnomer. Essentially, export compensation is being pushed off a cliff.
The latest proposed decision states that its provisions will ensure a nine-year payback period for solar systems. That is doubtful since that’s the current estimate, under NEM 2.0. The payback period will be even shorter for solar systems that are paired with energy storage, according to the latest suggestion drafted by CPUC. Reaping the benefits of such an association is even more doubtful, since storage is still quite expensive.
The latest PD says that all new solar customers will be placed on a new time-of-use (TOU) “electrification” rate. Compared to other TOU rates, this will feature slightly lower energy charges but will have a fixed charge of $15 per month. The non-bypassable charges will remain in effect. Thus, the typical solar customer will be paying a fixed charge of around $25 per month.
The proposed decision is hard to follow, even for trained economists, and the math it contains is even tougher to decipher. Instead of single-mindedly focusing on reducing the cost shift, CPUC should state what the impact on carbon emissions would be in three scenarios: the status quo under NEM 2.0, the first proposed decision for NEM 3.0, and the new one.
CPUC should also explain why the societal cost test – which factors in additional costs and benefits for society at large that do not directly affect the cost of energy supply – was not used. It should also explain why resilience benefits, especially for those with storage, were not considered, even though they were brought up by several parties during the decision-making process.
The import rate has an odd, unexplained spike between 9 a.m. and noon. Export compensation gets a drastic haircut. It’s doubtful that customers would understand the proposed rules. For example, various parties have reported the average export rate is $0.08/kWh when the solar output weighted average rate is closer to $0.06/kWh.
The new proposed draft says the intent is to incentivize the installation of storage with solar. In that case, the easiest path would be to double the state’s self-generation incentive for batteries. To make these investments even more attractive, a critical peak period pricing overlay should be added to the electrification rate. If customers agree to that, they are contributing to the state’s load flexibility goals and should be offered a rebate based on the size of their system. To address the fair access issue, the rebate could be doubled for low-income customers.
About the author: Ahmad Faruqui is an energy economist who has worked on rate design issues for more than four decades, on six continents. He has also testified almost 70 times before regulatory bodies in the US and Canada and appeared internationally before governments, legislators, and regulators. He holds a doctorate from the University of California, Davis.
The views and opinions expressed in this article are the author’s own, and do not necessarily reflect those held by pv magazine.
This content is protected by copyright and may not be reused. If you want to cooperate with us and would like to reuse some of our content, please contact: editors@pv-magazine.com."
https://www.pv-magazine.com/2022/12/08/novel-sodium-sulfur-battery-for-renewables-storage/,"ENERGY STORAGE,MARKETS & POLICY,TECHNOLOGY AND R&D,UTILITY SCALE PV,UTILITY SCALE STORAGE,AUSTRALIA",EMILIANO BELLINI,"DECEMBER 8, 2022",Novel sodium-sulfur battery for renewables storage,"An international research team has fabricated a room-temperature sodium-sulfur (Na-S) battery to provide a high-performing solution for large renewable energy storage systems.
Sodium-sulfur batteries have long offered high potential for grid-scale stationary energy storage, due to their low cost and high theoretical energy density of both sodium and sulfur. However, they have also been seen as an inferior alternative and their widespread use has been limited by low energy capacity and short life cycles.
To overcome these limitations, the research team implemented a simple pyrolysis process and carbon-based electrodes to improve the reactivity of sulfur and the reversibility of reactions between sulfur and sodium.
“Our sodium battery has the potential to dramatically reduce costs while providing four times as much storage capacity,” said researcher Shenlong Zhao, in reference to the device's competitiveness with lithium-ion batteries. “Storage solutions that are manufactured using plentiful resources like sodium – which can be processed from seawater – also have the potential to guarantee greater energy security more broadly and allow more countries to join the shift toward decarbonization.”
The scientists built the battery with an integrated dual active sites cathode, which was made with sulfur-doped graphene frameworks supporting atomically dispersed molybdenum disulfide (2H-MoS2) and molybdenum (Mo1). The researchers said the battery displayed “unprecedented cyclic stability” and rate performance, with a high initial capacity and a low-capacity decay rate of 0.05% per cycle over 1,000 cycles at room temperature. It had an initial capacity of 1,017 mAh g−1 and retained a high capacity of 505 mAh g−1 after 1,000 cycles at 0.1 A g−1.
The academics said they have successfully fabricated and tested the lab-scale batteries in the University of Sydney’s chemical engineering facility. They plan to improve and commercialize the cells.
They described the new battery tech in “Atomically Dispersed Dual-Site Cathode with a Record High Sulfur Mass Loading for High-Performance Room-Temperature Sodium–Sulfur Batteries,” which was recently published in Advanced Materials. The group includes scientists from Chongqing University, the Chinese Academy of Sciences, and the University of Science and Technology in China, as well as from the University of Adelaide, the University of Wollongong, and the University of Sydney in Australia.
This content is protected by copyright and may not be reused. If you want to cooperate with us and would like to reuse some of our content, please contact: editors@pv-magazine.com."
https://www.pv-magazine.com/2022/12/08/spanish-winemaker-using-photovoltaic-wall-for-protection-energy/,"COMMERCIAL & INDUSTRIAL PV,MARKETS,MARKETS & POLICY,MODULES & UPSTREAM MANUFACTURING,TECHNOLOGY AND R&D,SPAIN",EMILIANO BELLINI,"DECEMBER 8, 2022","Spanish winemaker using photovoltaic wall for protection, energy","Spanish winemaker Vins Raïmat – a unit of Codorníu, Spain's second-largest producer of traditional sparkling wine – has installed a 30 kW photovoltaic wall at its production facility in the Catalonian town of Raïmat, Spain.
The vertical installation is part of a 300 kW PV system that the company has deployed at the site for self-consumption, with the support of Spanish installer Becquel. The project consists of a rooftop PV system with 660 solar modules and a vertical array featuring 65 panels.
“In addition to generating energy, this vertical installation reduces the energy consumption of the tubs, as it isolates them from direct contact with the sun,” a Becquel spokesperson told pv magazine. “It is a triple effect, as it achieves energy generation, insulation from the sun and reduction of energy consumption, with the electricity being required to keep cold the content of the tubs.”
Becquel used 455 W Canadian Solar panels in the facility. The project will be able to generate around 429,960 kWh per year for the winery. It is expected to cover 35% of the company's energy needs.

This content is protected by copyright and may not be reused. If you want to cooperate with us and would like to reuse some of our content, please contact: editors@pv-magazine.com."
https://www.pv-magazine.com/2022/12/08/cooling-solar-panels-with-cold-steam-from-ultrasonic-thermoelectric-generators/,"MODULES & UPSTREAM MANUFACTURING,TECHNOLOGY AND R&D,IRAN",EMILIANO BELLINI,"DECEMBER 8, 2022",Cooling solar panels with cold steam from ultrasonic thermoelectric generators,"Researchers from the Kermanshah University of Technology in Iran have investigated the possibility of reducing the operating temperature of solar panels with ultrasonic (US) thermoelectric generators (TEG).
“Although ultrasonic technology has been recognized as an effective new method for increasing the efficiency of heat transfer processes, research on the use of ultrasonic waves to increase the cooling performance of the PV systems is very rare,” researcher Amin Shahsavar told pv magazine. “However, so far no studies have been conducted on the use of cold vapor induced by high-frequency ultrasonic waves for cooling the cold side of TEGs in a PV-TEG hybrid system.”
Ultrasonic energy is generally used in other applications as a cooling method by spraying and atomizing a cold liquid to hot surfaces to reduce their temperature.
“High-frequency ultrasonic waves can produce cold steam and can atomize water droplets, which have a high specific surface area for the heat transfer process,” the scientists explained.
The proposed system can generate cold steam by ultrasonic piezoelectrics in a simple batch system. The generated cold steam is in contact with the cold side of the TEGs that are connected to the backside of a solar module.
They academics the system with a 10 W solar panel measuring 36 cm × 27 cm × 10 cm, which was provided by Taiwanese semiconductor maker ACDC Taiwan. They used a solar simulator consisting of a chamber with a wooden base and a roof, with the sidewalls being covered with aluminum foil sheets.
They also equipped the chamber with a cubic glass enclosure with a size of 35 cm × 25 cm × 10 cm and five ultrasonic piezoelectrics (PZTs). They used 12 thermoelectric generators based on bismuth telluride, each with dimensions of 40 mm × 40 mm × 4 mm and maximum voltages 4 V and and 24.4 A of current. They also used a laser thermometer to measure the module operating temperature and d a digital thermometer with two thermocouples to measure the inlet and outlet temperatures of the working fluid. 
The Iranian group applied several working fluids, including water-based nanofluid containing silicon carbide (SiC),  a mixture of ethanol and water with different volume fractions of ethanol, and a mixture of ethanol and water with SiC nanofluid.
“Comparing the effect of working fluids proved that SiC nanofluid, even at very low concentrations, due to its high conductivity, had a more significant effect than water in reducing the temperature of the photovoltaic module and increasing its electrical efficiency,” it explained.
They found that the maximum values of power yield and power conversion efficiency of the photovoltaic module were achieved with a mixture of ethanol and water with SiC nanofluid.
They introduced the cooling tech in “Improving the performance of photovoltaic modules using ultrasonic- thermoelectric generators,” which was recently published in Applied Thermal Energy.
“The results showed that for all working fluids and all arrangements of thermoelectric generators, the value of the coefficient of energy is higher than 1, which proves that the ultrasonic-thermoelectric generators/photovoltaic system is fully practical,” the scientists said. “Through an advanced understanding of the benefits of US-TEG/PV technology, this study forms the rationale for implementing ultrasonic cooling systems that lead to the design and analysis of a pilot project.”
This content is protected by copyright and may not be reused. If you want to cooperate with us and would like to reuse some of our content, please contact: editors@pv-magazine.com."
