url,tag,author,updated_date,title,contents
https://www.pv-magazine.fr/2021/08/30/laeroport-de-lome-lance-un-appel-doffre-pour-se-doter-dune-centrale-solaire-de-1-8-mwc/,"APPEL D'OFFRES,TOGO",MARIE BEYER,"AOÛT 30, 2021","L’aéroport de Lomé (Togo) lance un appel d’offre pour se doter d’une centrale solaire de 1,8 MWc","La Société aéroportuaire de Lome-Tokoin (SALT) a ouvert un appel d’offre pour le projet de centrale solaire sur le site de l’aéroport international Gnassingbé Eyadema du Togo. Dans le détail, la société requiert des projets d’installation solaire photovoltaïque au sol en autoconsommation totale avec une puissance crête minimale de 1825 kWc. Elle a précisé que ses préférences iront vers un fournisseur capable de financer et exécuter les travaux de construction de la centrale solaire à ses propres frais au cours de la période d’essai de trois mois, définie dans le Dossier de consultation des entreprises.
Le dossier d’appel d’offre (DAO) prévoit une installation PV composée de dix unités comptant chacune neuf tables de modules de 182,52 kWc soit une puissance totale de 1825 kWc. Le soumissionnaire pourra proposer une autre conception dans la limite des exigences techniques minimales. L’entrepreneur sera rémunéré sur la base des économies réalisées sur une période de 15 ans maximum.
La SALT indique dans le rapport d’étude d’impacts environnemental et social du projet que l’appel d’offre pour la centrale solaire s’inscrit dans une optique énergétique axée sur l’augmentation des sources renouvelables et que « face à la croissance de l’activité aéroportuaire ainsi qu’à l’augmentation continue des factures de consommation d’électricité, la SALT se propose un mix énergétique qui associe l’utilisation de l’énergie solaire photovoltaïque à la source d’énergie existante ».
En effet, la rénovation de l’aéroport, menée en 2016 avec une enveloppe de 150 millions de dollars (83 milliards de FCFA) a permis d’accroître sensiblement l’activité du site. Elle a notamment permis d’augmenter la capacité d’accueil de l’aéroport qui est passée de 600 000 passagers par an avant les travaux à 2 millions aujourd’hui.
Ce contenu est protégé par un copyright et vous ne pouvez pas le réutiliser sans permission. Si vous souhaitez collaborer avec nous et réutiliser notre contenu, merci de contacter notre équipe éditoriale à l’adresse suivante: editors@pv-magazine.com."
https://www.pv-magazine.fr/2021/08/30/lenergie-photovoltaique-sur-plateformes-maritimes-fait-un-pas-en-avant-au-pays-bas/,"PV FLOTTANT,PAYS-BAS",EMILIANO BELLINI,"AOÛT 30, 2021",L’énergie photovoltaïque sur plateformes maritimes fait un pas en avant au Pays-Bas,"D’après pv magazine international
La start-up néerlandaise SolarDuck a annoncé avoir obtenu une approbation de principe (AIP) de la part du Bureau Veritas pour son projet pilote flottant de 64 kWc. Celui-ci a été déployé sur les eaux fluviales du Waal (Rhin), près d’IJzendoorn, un village de la province de Gelderland. Selon son concepteur, la structure maintient les panneaux solaires à plus de trois mètres au-dessus de l’eau et est capable de résister aux conditions météorologiques des zones maritimes côtières et à des vents de la force d’un ouragan. L’installation est optimisée pour les sites offshore dans les estuaires et les ports naturels ainsi que pour les sites proches du rivage.
L’ossature de la plateforme consiste en des structures triangulaires de 16 x 16 x 16 mètres rattachées entre elles de façon modulable pour former de grandes installations. Elles ressemblent à des plateformes éoliennes flottantes offshore ou à des plateformes pétrolières de haute mer.
« L’idée est basée sur notre héritage offshore », a déclaré Koen Burgers, le PDG de SolarDuck, à pv magazine en mars. « Notre entreprise est née en « spin-off » du département de recherche du groupe Damen Shipyards qui utilise les pratiques industrielles pour concevoir des solutions capables de faire face à un environnement maritime difficile ».
Bureau Veritas, fournisseur de services d’essais, d’inspection et de certification basé aux Pays-Bas, a accordé une approbation de principe (AIP ou approval in principle) à SolarDuck pour sa solution solaire flottante offshore « King Eider ». Un AIP est un cadre utilisé par Bureau Veritas pour démontrer la faisabilité d’un projet intégrant de nouvelles technologies qui ne sont pas couvertes par les règles prescriptives de la classification traditionnelle. Il est utilisé pour démontrer la faisabilité technique aux partenaires du projet et aux organismes de réglementation.
« C’est la première fois qu’un tel agrément est accordé à une technologie solaire flottante offshore. Cela marque le début d’une nouvelle ère pour cette forme d’énergie renouvelable », a déclaré SolarDuck dans un communiqué. Dans le détail : « L’AIP couvre la méthodologie de conception de la structure de l’unité et valide les éléments qui la constitue conformément aux notes d’orientation NI631 sur le système de certification des technologies d’énergie renouvelable marine et NI572 sur la classification et la certification des éoliennes offshore flottantes ».
Ce contenu est protégé par un copyright et vous ne pouvez pas le réutiliser sans permission. Si vous souhaitez collaborer avec nous et réutiliser notre contenu, merci de contacter notre équipe éditoriale à l’adresse suivante: editors@pv-magazine.com."
https://www.pv-magazine.fr/2021/08/30/la-commission-europeenne-valide-le-guichet-ouvert-photovoltaique-jusqua-500-kwc/,"LÉGAL,MARCHÉS,PV EN TOITURE,FRANCE",GWÉNAËLLE DEBOUTTE,"AOÛT 30, 2021",La Commission européenne valide le guichet ouvert photovoltaïque jusqu’à 500 kWc,"La Commission européenne a autorisé le régime français d’aides de 5,7 milliards d’euros et qui s’étendra jusqu’en 2026, destiné à soutenir la production d’électricité renouvelable par de petites installations solaires installées en toiture, d’une puissance inférieure à 500 kWc. Ce feu vert ouvre désormais la voie à la publication prochaine du nouvel arrêté tarifaire, tant attendu par tout le secteur photovoltaïque. Dans un texte publié le 27 août, la Commission européenne indique ainsi que « cette mesure aidera la France à atteindre l’objectif qu’elle s’est fixé de produire, d’ici 2030, l’équivalent de 33 % de ses besoins en énergie à partir de sources renouvelables, et elle contribuera à atteindre l’objectif européen de neutralité climatique d’ici à 2050, sans fausser indûment la concurrence ».
Ces installations pourront bénéficier d’une aide sous la forme de tarifs de rachat (soit un prix garanti pour l’électricité produite) pendant 20 ans. Le niveau des tarifs de rachat variera en fonction de la taille de l’installation et de son modèle d’entreprise: certaines installations injectent toute leur production dans le réseau, tandis que d’autres consomment une partie de l’électricité qu’elles produisent. Grâce à cela, la France ambitionne d’augmenter la capacité d’énergie renouvelable solaire de 3 700 MW supplémentaires. « Cette mesure, destinée à soutenir la production d’énergie renouvelable à partir de petites installations solaires, complète un autre régime français d’aide à la production d’électricité à partir de sources d’énergie renouvelables, que la Commission a autorisé le mois dernier pour un montant de 30,5 milliards d’euros, a souligné Margrethe Vestager, la vice-présidente exécutive chargée de la politique de concurrence dans le même texte. La mesure renforce le soutien au développement des sources d’énergie renouvelables, tout en garantissant une égalité des conditions de concurrence sur le marché français de l’énergie ».
Le texte précise que « la Commission a apprécié le régime au regard des règles de l’UE en matière d’aides d’État, en particulier des lignes directrices de 2014 concernant les aides d’État à la protection de l’environnement et à l’énergie. La Commission a constaté que l’aide est nécessaire pour accroître encore la production d’énergie renouvelable et pour permettre à la France d’atteindre ses objectifs en matière d’environnement et d’énergies renouvelables. Le régime aura également un effet d’incitation, en permettant de réaliser des projets qui n’auraient pas pu voir le jour en l’absence d’une aide publique ».
Puisqu’elle concerne de petites installations solaires produisant moins d’1 MW, l’aide sera accordée sans procédure d’appel d’offres, conformément aux dispositions des lignes directrices de 2014 concernant les aides d’État à la protection de l’environnement et à l’énergie. La Commission a conclu qu’en tout état de cause, l’aide est proportionnée et limitée au minimum nécessaire. Enfin, la Commission a conclu que les effets positifs des mesures, en particulier sur l’environnement, l’emportent sur ses effets négatifs éventuels en termes de distorsion de la concurrence. Sur la base de ces éléments, la Commission a conclu que le régime français est conforme aux règles de l’UE en matière d’aides d’État, car il facilitera l’essor de la production d’énergies renouvelables en France et réduira les émissions de gaz à effet de serre, conformément au pacte vert pour l’Europe, sans fausser indûment la concurrence. Ce régime complète le régime général d’aide aux énergies renouvelables, approuvé par la Commission le 27 juillet 2021 (SA.50272), qui permet d’accorder une aide, via une procédure de mise en concurrence, à différentes installations de production d’énergie renouvelable, et notamment les installations solaires d’une capacité supérieure à 500 kW.
Les lignes directrices concernant les aides d’État à la protection de l’environnement et à l’énergie adoptées par la Commission en 2014 autorisent les États membres à soutenir la production d’électricité à partir de sources d’énergie renouvelables sous certaines conditions. Ces règles visent à aider les États membres à réaliser les objectifs ambitieux de l’UE en matière d’énergie et de climat au coût le plus bas possible pour les contribuables et sans fausser indûment la concurrence au sein du marché unique.
La directive sur les énergies renouvelables, de 2018, a défini un objectif contraignant à l’échelle de l’UE en matière d’énergies renouvelables de 32 % d’ici à 2030. Avec sa communication sur le pacte vert pour l’Europe, en 2019, la Commission a renforcé ses ambitions climatiques, en fixant l’objectif de parvenir à zéro émission nette de gaz à effet de serre à l’horizon 2050. La loi européenne sur le climat adoptée récemment, qui consacre l’objectif de neutralité climatique en 2050 et introduit l’objectif intermédiaire de réduire les émissions de gaz à effet de serre d’au moins 55 % d’ici 2030, a ouvert la voie aux propositions législatives « Ajustement à l’objectif 55 » qui ont été adoptées par la Commission le 14 juillet 2021. Parmi ces propositions, la Commission a présenté une modification de la directive sur les énergies renouvelables, qui relève les objectifs de production de telle sorte que la part de l’énergie produite à partir de sources renouvelables atteigne 40 % d’ici à 2030. La version non confidentielle de la décision sera publiée sous le numéro SA.61902 dans le registre des aides d’État figurant sur le site web de la Commission consacré à la concurrence dès que les éventuels problèmes de confidentialité auront été résolus. Le bulletin d’information électronique Competition Weekly e-News fournit la liste des dernières décisions relatives aux aides d’État publiées au Journal officiel et sur Internet.
Ce contenu est protégé par un copyright et vous ne pouvez pas le réutiliser sans permission. Si vous souhaitez collaborer avec nous et réutiliser notre contenu, merci de contacter notre équipe éditoriale à l’adresse suivante: editors@pv-magazine.com."
https://www.pv-magazine.fr/2021/08/30/greenyellow-securise-6-mwc-de-projets-solaires-au-cambodge/,"FOURNITURE D'ÉLECTRICITÉ,PV AU SOL,PV COMMERCIAL ET INDUSTRIEL,PV EN TOITURE,CAMBODGE",GWÉNAËLLE DEBOUTTE,"AOÛT 30, 2021",GreenYellow sécurise 6 MWc de projets solaires au Cambodge,"GreenYellow a annoncé avoir sécurisé depuis juillet 2021 plus de 6 MWc de projets solaires photovoltaïques au Cambodge, à la fois des centrales solaires en toiture pour alimenter des clients privés et des projets au sol alimentant le réseau d’électricité. Malgré un cadre réglementaire complexe, ce pays d’Asie du Sud-Est doit relever un double défi, celui d’opérer sa transition énergétique tout en faisant face à l’augmentation des besoins du pays en électricité pour accompagner son très fort développement économique, comme le note le producteur d’énergie français.
Selon GreenYellow, ces projets ont pour objectif d’aider ses clients à matérialiser leurs engagements en termes de réduction d’émission carbone mais servent aussi à sécuriser la production d’énergie pour répondre à la demande en progression. À titre d’exemple, la première phase du projet AEON MALL Sen Sok City (le plus grand centre commercial de la ville de Phnom Penh), sous forme d’Assistance à Maîtrise d’Ouvrage (AMO), a été conclue avec succès et vient de déboucher sur la signature d’un contrat clé en main (EPC) pour la mise en œuvre d’un projet de 2,1MWc en toiture. La construction du premier Contrat de Leasing Opérationnel a aussi été lancée pour une centrale solaire photovoltaïque en toiture devant alimenter l’usine de Betagro (un acteur thaï majeur de l’industrie agroalimentaire) avec une première phase de 400 kWc suivie d’une potentielle extension de 800 kWc.
Ce contenu est protégé par un copyright et vous ne pouvez pas le réutiliser sans permission. Si vous souhaitez collaborer avec nous et réutiliser notre contenu, merci de contacter notre équipe éditoriale à l’adresse suivante: editors@pv-magazine.com."
https://www.pv-magazine.fr/2021/08/30/la-puissance-du-parc-photovoltaique-francais-a-atteint-126-gw-fin-juin-2021/,"AUTOCONSOMMATION,OMBRIÈRES DE PARKING,PV À GRANDE ÉCHELLE,PV AU SOL,PV COMMERCIAL ET INDUSTRIEL,PV EN TOITURE,PV FLOTTANT,PV INTÉGRÉ AU BÂTI,PV RÉSIDENTIEL,FRANCE",GWÉNAËLLE DEBOUTTE,"AOÛT 30, 2021","La puissance du parc photovoltaïque français a atteint 12,6 GW fin juin 2021","Selon le tableau de bord de l’énergie photovoltaïque publié en août par le Ministère de la transition écologique, 1 367 MWc supplémentaires de puissance photovoltaïque ont été raccordés au cours du premier semestre 2021. Il s’agit d’une véritable accélération du rythme de raccordement : 431 MWc avaient été mis en ligne sur la même période en 2020, 430 MWc en 2019. Cette très belle progression s’explique, selon le MTE, par une hausse du nombre de raccordements mais aussi par une proportion élevée de raccordements de centrales de fortes puissances. 66 % de la nouvelle puissance raccordée correspond à des installations de plus de 250 kW, qui représentent moins de 1 % du nombre de nouveaux raccordements. Les installations de taille plus modeste, inférieure à 9 kW, représentent quant à elles près de 83 % du nombre d’unités nouvellement raccordées et environ 7 % de la nouvelle puissance. La puissance des projets en file d’attente a baissé de 1,7 % depuis le début de l’année pour s’établir à 8,8 GW, dont 2,9 GW avec une convention de raccordement signée.
Graphe : MTE
Entre janvier et juin 2021, la production d’origine solaire photovoltaïque s’est élevée à 7,6 TWh, contre 6,8 TWh à la même période en 2020, en raison d’un excédent d’ensoleillement aux mois de mars et avril. La production solaire représente 3,1 % de la consommation électrique française, en légère hausse par rapport à l’année précédente (3 %). Au niveau de l’autoconsommation, 22,4 % des installations photovoltaïques de France métropolitaine, représentant 12,8 % de la puissance installée, ont autoconsommé au moins une partie de leur production. La part de ces installations est en hausse de 1 point par rapport au trimestre précédent. Au deuxième trimestre 2021, 158 GWh d’électricité photovoltaïque ont été autoconsommés par les producteurs, soit 3,1 % de la production photovoltaïque du trimestre. Les installations en autoconsommation totale en ont produit 107 GWh, soit plus des deux tiers du total autoconsommé.
Graphe : MTE
En termes géographiques, les régions Nouvelle-Aquitaine, Occitanie, Grand-Est, Auvergne-Rhône-Alpes et Provence-Alpes-Côte d’Azur totalisent 69 % de la puissance nouvellement raccordée sur le territoire au premier semestre 2021. Il s’agit aussi des régions disposant des capacités installées les plus élevées, représentant 67 % de la puissance totale raccordée en France à la fin du premier semestre 2021.
Ce contenu est protégé par un copyright et vous ne pouvez pas le réutiliser sans permission. Si vous souhaitez collaborer avec nous et réutiliser notre contenu, merci de contacter notre équipe éditoriale à l’adresse suivante: editors@pv-magazine.com."
