url,tag,author,updated_date,title,contents
https://www.pv-magazine.com/2021/01/12/turkey-to-hold-1-gw-solar-tender-between-march-8-12/,"MARKETS,UTILITY SCALE PV,TURKEY",EMILIANO BELLINI,"JANUARY 12, 2021",Turkey to hold 1 GW solar tender between March 8-12,"Turkey's Ministry of Energy has announced the 1 GW solar tender it announced in July of last year will be held over a five-day period between March 8-12, 2021.
In a document published in the country's official journal, the Turkish government specified that it set a ceiling price of TRY0.35 ($0.047)/kWh for the procurement exercise and that winners will receive a 15-year power purchase guarantee. “Although the ceiling price was increased, the industry is worried about the value loss of the Turkish Lira and looking for a new more realistic price escalation calculation method,” the CEO of German company KRC Consulting, Hakki Karacaoglan, told pv magazine.
When the tender was announced, the Turkish government said the ceiling price would have been TRY0.3/kWh.
All projects must use locally produced modules and be located in 36 cities, and across 74 grid connection points. The following cities have been allocated projects under the tender: Adıyaman, Ağrı, Aksaray, Ankara, Antalya, Batman, Bayburt, Bilecik, Bingöl, Bitlis, Burdur, Bursa, Çankırı, Çorum, Diyarbakır, Elazığ, Erzurum, Eskişehir, Gaziantep, Hakkari, Iğdır, Kahramanmaraş, Kars, Kırşehir, Kilis, Malatya, Mardin, Mersin, Muş, Nevşehir, Osmaniye, Siirt, Şırnak, Uşak, Van and Yozgat. The selected facilities will have to range in size from 10 to 20 MW.
Karacaoglan said in July that, considering that locally-manufactured modules must be used and that they are around 30% more expensive than those produced elsewhere, project developers and participating parties will have difficulties in defining the right pricing. The auction will be in Turkish lira and, as a result, fundraising will have to be in Turkish lira. Due to the high inflation rate financing costs will be higher than if the auction was in euros or U.S. dollars.
The Yeka tender was originally postponed in January 2019 and was initially intended at selecting larger PV projects with a power range between 10 and 50 MW.
This content is protected by copyright and may not be reused. If you want to cooperate with us and would like to reuse some of our content, please contact: editors@pv-magazine.com."
https://www.pv-magazine.com/2021/01/12/system-design-key-to-enhancing-cooling-effect-of-water-in-floating-pv/,"COMMERCIAL & INDUSTRIAL PV,MODULES & UPSTREAM MANUFACTURING,TECHNOLOGY AND R&D,UTILITY SCALE PV,NETHERLANDS,SINGAPORE",EMILIANO BELLINI,"JANUARY 12, 2021",System design key to enhancing cooling effect of water in floating PV,"The cooling effect of water in floating PV systems can be increased in tropical and temperate maritime climates if a proper system design allows for more wind to flow between the modules and the water surface. This is one of the main findings of a recent research project conducted by the Netherlands Organisation for Applied Scientific Research (TNO) and the Solar Energy Research Institute of Singapore (SERIS).
Scientists from both organizations have jointly assessed the irradiance-weighted average temperatures (IWATs) of floating solar arrays in the Netherlands and Singapore and have compared the results with those of ground-mounted installations and rooftop PV systems.
The test field in the Netherlands was located on an inland lake close to the sea in the province of South-Holland. The test bed in Singapore was at a 1 MW floating solar array on the Tengeh Reservoir. In the former, two kinds of floating systems were tested: one with a small footprint on water and an open structure (NL1), and one with a large footprint on water and a closed structure (NL2). In the latter, three different systems were investigated: an array with a large footprint and closed structure (SG1), a system with a medium footprint and closed structure (SG2), and a free-standing system with an open structure (SG3).
The performance and temperature behavior of the NL1 and NL2 arrays was compared to those of two reference ground-mounted installations. The scientists called them NL 3 and NL 4. They also compared the energy yield of the three systems in Singapore with the yield from a free-standing rooftop PV system (SG4).
The measurements showed that the irradiance-weighted average temperature (IWAT) of the NL1 system in the Netherlands, which was the best performing system, was 3.2 C lower than the nearby reference system. In Singapore, the best-performing system was the SG3 array, which exhibited a 14.5 C lower IWAT than its reference system. Furthermore, the determined heat loss coefficients of the different systems have been used within PVsyst software to model the annual yield of the floating systems and the reference arrays in a typical meteorological year.
In Singapore, the best-performing system was the SG3 array, which exhibited a 14.5 C lower IWAT than its reference system.
“The determined median heat-loss coefficients of the best-performing systems NL1 and SG3 are with 57 W/m2 per kelvin and 55 W/ m2 per kelvin, respectively, almost identical,” the researchers concluded. “When the heat-loss coefficients of all systems are split into a constant value and a wind-dependent value, and using these values to model the specific yield of all systems, it can be concluded that the largest part of the cooling effect of FPV systems can be attributed to higher wind speeds above water compared to land.”
They also said that the floating systems with the open structure, which allow for wind beneath the modules, can provide a heat loss coefficient that is up to 22 W/m2 per kelvin higher compared to the reference systems.
The scientists described the floating PV systems and their performance in “The cooling effect of floating PV in two different climate zones: A comparison of field test data from the Netherlands and Singapore,” which was recently published in Solar Energy.
This content is protected by copyright and may not be reused. If you want to cooperate with us and would like to reuse some of our content, please contact: editors@pv-magazine.com."
https://www.pv-magazine.com/2021/01/12/australian-iron-ore-producer-south-korean-steelmaker-agree-to-green-hydrogen-future/,"HYDROGEN,UTILITY SCALE STORAGE,AUSTRALIA,SOUTH KOREA",BLAKE MATICH,"JANUARY 12, 2021","Australian iron ore producer, South Korean steelmaker agree to green hydrogen future","From pv magazine Australia
Fortescue Metals Group (FMG) and South Korean steelmaker Posco have agreed to a partnership that will see FMG supply Posco with iron ore and green hydrogen. 
At a meeting in Seoul on Dec. 14, Posco CEO Jeong-Woo Choi and FMG Chairman Andrew “Twiggy” Forrest discussed the potential of a cooperative green hydrogen business. FMG has already set a carbon neutrality target of 2040. But Forrest and his executives have been jet setting around the world in recent months securing deals, such as this one with Posco, in support of its ambitious plans to build one of the biggest renewable energy portfolios in the world, delivering more than 235 GW of renewable capacit. That is five times the current capacity of Australia’s National Energy Market. 
“FMG is a long-term contract supplier that has been stably supplying iron ore to Posco,” said Choi. “If competitive green hydrogen can be produced with cooperation between the two companies and is introduced to Korea, the era of green hydrogen in Korea will be accelerated.” 
Part of the deal will see FMG use Posco’s premium steel materials, PosMAC, for all the solar and wind generation behind the green hydrogen FMG produces. As it stands then, Posco will import FMG’s iron ore to make the steel. The steel will then be supplied back to FMG’s solar developments to generate green hydrogen in Western Australia. 
Posco has set itself a carbon neutrality goal of 2050, a target which the company is establishing a green hydrogen business to tackle. 
“Green hydrogen and ammonia are important factors in reducing carbon emissions as the world is in the transition to clean energy,” said Forrest. “I hope that with Posco’s participation in the first green hydrogen project conducted by FMG, both companies can grow together.” 
The partnership with Posco is one of many deals Forrest and his executives have secured in recent months. Forrest himself has been putting serious miles on the engine of the FMG private jet in a world tour to set the stage for the company’s renewable energy business, Fortescue Future Industries (FFI). 
According to the The Sydney Morning Herald, Forrest returned to Western Australia last week after “his four-month mystery world tour.” After undertaking a “formal supervised 14-day quarantine period in New South Wales” Forrest received an exemption from the Western Australian government to return to the state without an additional quarantine. 
At the FMG annual general meeting in November, it was revealed that Forrest intended to visit up to 47 countries on his search for renewable energy projects and mineral resources for FFI. 
Although much of the adventure has been kept secret, it is known that Forrest began his journey in Papua New Guinea and Indonesia, where national leaders signed non-binding agreements with FFI for multibillion dollar renewable projects. Next stop, Afghanistan, then onto Japan where Kawasaki Heavy Industries and Iwatani Corp.n signed a deal with FFI to investigate the potential for a liquid hydrogen supply-chain. Presumably, Forrest’s next stop was to meet with Choi and Posco in Seoul. 
It is also believed Forrest or his executives have been on scouting missions throughout Europe, the United States, Ecuador, Colombia, Brazil, the Congo, Kenya, and Ethiopia. 
FMG’s share price has more than doubled in the last year, making it Australia’s fourth-biggest listed company. Of course, much of this surge has to do with the rising iron ore price during the Covid-19 pandemic, but it is clear that Forrest himself is not sitting back and enjoying his mining billions. The magnate is on a mission to transform his empire into a global green force. 
This content is protected by copyright and may not be reused. If you want to cooperate with us and would like to reuse some of our content, please contact: editors@pv-magazine.com."
https://www.pv-magazine.com/2021/01/12/total-corporate-funding-into-solar-sector-rose-24-in-2020/,"FINANCE,MARKETS,UTILITY SCALE PV,WORLD",TIM SYLVIA,"JANUARY 12, 2021",Total corporate funding into solar sector rose 24% in 2020,"From pv magazine USA
Global corporate investment in the solar sector came to $14.5 billion in 2020, representing 24% growth over the $11.7 billion raised in 2019, according to a new report by Mercom Capital Group.
The growth comes in spite of an especially bad first half of the year, with the uncertainty caused by the Covid-19 pandemic leading to funding being down 25% year on year in the first half.
The rebound and recovery were driven in large part by publicly traded solar companies, with several initial public offerings and securitization deals creating what Mercom Capital Group CEO Raj Prabhu referred to as an “investment haven” in the uncertain Covid economy.
While total global solar funding rose in 2020, global venture capital and private equity funding in the sector fell to $1.2 billion in 41 deals, compared to $1.4 billion in 53 deals in 2019. Nearly all of this funding – $1.1 billion of it – went to 27 downstream companies.
Among these companies, India’s Ayana Renewable Power led the way, raising $390 million, followed by Silicon Ranch Corp., which brought in $225 million. Australia's Brighte raised $76 million, Singapore’s Sunseap Group raised $72 million, and Aurora Solar and Zero Mass Water tied for fifth, each raising $50 million.
Of the VC funding that didn’t go to downstream companies, solar service providers raised $61 million, PV companies raised $17 million, balance-of-system companies brought in $15 million, thin-film technology companies raised $15 million, and concentrated photovoltaic companies raised $5.5 million.
Alongside all of the funding, 39.5 GW of large-scale solar projects were acquired in 2020, compared to 26.1 GW in 2019. According to Mercom, those 39.5 GW represent the largest amount of projects acquired in a single year to date. The capacity came from 231 large-scale project acquisitions in 2020, compared to 192 such transactions in 2019.
There were also 62 mergers and acquisitions deals in 2020, most of which involved downstream companies. No surprise, the largest transaction in 2020 was Sunrun’s $3.2 billion, all-stock acquisition of Vivint Solar.
Debt financing came to $8.3 billion in 2020, a 6.4% increase over 2019. Eight securitization deals totaling $2.2 billion were recorded in 2020, which Mercom said represented the largest amount of securitization financing ever in a year.
Finally, public market financing saw an exponential rise, up 101%, with $5.1 billion in 2020. Array Technologies raised $1.2 billion in its initial public offering in the fourth quarter of 2020.
This content is protected by copyright and may not be reused. If you want to cooperate with us and would like to reuse some of our content, please contact: editors@pv-magazine.com."
